test/.cache/tunecache.tsv
tunecache	1.1.0	1.1.0--sm_60	cpu_arch=x86_64,gpu_arch=sm_60,cuda_version=12.4.131	# Last updated Mon May 13 19:40:25 2024

          volume	name	aux	block.x	block.y	block.z	grid.x	grid.y	grid.z	shared_bytes	aux.x	aux.y	aux.z	aux.w	time	comment
     16x16x16x32	N4quda10GaugeGaussIdLi3EL21QudaReconstructType_s12EEE	GPU-offline,vol=131072stride=69632precision=8geometry=4Nc=3,lie_group	128	1	1	512	2	1	4097	-1	-1	-1	-1	0.000584651	# 0.00 Gflop/s, 91.47 GB/s, tuning took 0.985964 seconds at Mon May 13 19:40:23 2024
     16x16x16x32	N4quda12ExtractGhostIdLi3ENS_5gauge11FloatNOrderIdLi18ELi2ELi12EL20QudaStaggeredPhase_s0ELb1EL19QudaGhostExchange_sn2147483648ELb0EEEEE	GPU-offline,vol=131072stride=69632precision=8geometry=4Nc=3,extract	32	1	1	256	1	8	2587	-1	-1	-1	-1	1.70688e-05	# 0.00 Gflop/s, 322.52 GB/s, tuning took 0.165856 seconds at Mon May 13 19:40:19 2024
     16x16x16x32	N4quda7RNGInitE	GPU-offline,vol=131072stride=69632precision=8geometry=4Nc=3	256	2	1	256	1	1	0	-1	-1	-1	-1	0.00695733	# 0.00 Gflop/s, 0.00 GB/s, tuning took 1.306898 seconds at Mon May 13 19:40:22 2024
     16x16x16x32	N4quda9CopyGaugeINS_12CopyGaugeArgIddLi18ELb0ENS_5gauge11FloatNOrderIdLi18ELi2ELi12EL20QudaStaggeredPhase_s0ELb1EL19QudaGhostExchange_sn2147483648ELb0EEENS2_8QDPOrderIdLi18EEEEEEE	GPU-offline,vol=131072stride=65536precision=8geometry=4Nc=3,vol=131072stride=69632precision=8geometry=4Nc=3	928	1	1	71	1	8	0	-1	-1	-1	-1	0.000236704	# 0.00 Gflop/s, 544.88 GB/s, tuning took 0.814923 seconds at Mon May 13 19:40:19 2024
     16x16x16x32	N4quda9CopyGaugeINS_12CopyGaugeArgIddLi18ELb0ENS_5gauge11FloatNOrderIdLi18ELi2ELi12EL20QudaStaggeredPhase_s0ELb1EL19QudaGhostExchange_sn2147483648ELb0EEES6_EEEE	GPU-offline,vol=131072stride=69632precision=8geometry=4Nc=3,vol=131072stride=69632precision=8geometry=4Nc=3,ghost	64	1	1	64	1	8	4097	-1	-1	-1	-1	1.17477e-05	# 0.00 Gflop/s, 497.89 GB/s, tuning took 0.200883 seconds at Mon May 13 19:40:19 2024
     16x16x16x32	N4quda9CopyGaugeINS_12CopyGaugeArgIddLi18ELb0ENS_5gauge8QDPOrderIdLi18EEENS2_11FloatNOrderIdLi18ELi2ELi12EL20QudaStaggeredPhase_s0ELb1EL19QudaGhostExchange_sn2147483648ELb0EEEEEEE	GPU-offline,vol=131072stride=69632precision=8geometry=4Nc=3,vol=131072stride=65536precision=8geometry=4Nc=3	128	1	1	512	1	8	3781	-1	-1	-1	-1	0.000245165	# 0.00 Gflop/s, 526.07 GB/s, tuning took 0.804424 seconds at Mon May 13 19:40:24 2024
     16x16x16x32	N4quda9CopyGaugeINS_12CopyGaugeArgIfdLi18ELb0ENS_5gauge11FloatNOrderIfLi18ELi4ELi12EL20QudaStaggeredPhase_s0ELb1EL19QudaGhostExchange_sn2147483648ELb0EEENS3_IdLi18ELi2ELi12ELS4_0ELb1ELS5_n2147483648ELb0EEEEEEE	GPU-offline,vol=131072stride=69632precision=8geometry=4Nc=3,vol=131072stride=69632precision=4geometry=4Nc=3	608	1	1	108	1	8	24577	-1	-1	-1	-1	0.000140344	# 0.00 Gflop/s, 571.57 GB/s, tuning took 0.496014 seconds at Mon May 13 19:40:21 2024
     16x16x16x32	N4quda9CopyGaugeINS_12CopyGaugeArgIfdLi18ELb0ENS_5gauge11FloatNOrderIfLi18ELi4ELi12EL20QudaStaggeredPhase_s0ELb1EL19QudaGhostExchange_sn2147483648ELb0EEENS3_IdLi18ELi2ELi12ELS4_0ELb1ELS5_n2147483648ELb0EEEEEEE	GPU-offline,vol=131072stride=69632precision=8geometry=4Nc=3,vol=131072stride=69632precision=4geometry=4Nc=3,ghost	256	1	1	16	1	8	12289	-1	-1	-1	-1	8.29819e-06	# 0.00 Gflop/s, 528.65 GB/s, tuning took 0.146348 seconds at Mon May 13 19:40:21 2024
     16x16x16x32	N4quda9CopyGaugeINS_12CopyGaugeArgIsdLi18ELb0ENS_5gauge11FloatNOrderIsLi18ELi4ELi12EL20QudaStaggeredPhase_s0ELb1EL19QudaGhostExchange_sn2147483648ELb0EEENS3_IdLi18ELi2ELi12ELS4_0ELb1ELS5_n2147483648ELb0EEEEEEE	GPU-offline,vol=131072stride=69632precision=8geometry=4Nc=3,vol=131072stride=69632precision=2geometry=4Nc=3	576	1	1	114	1	8	24577	-1	-1	-1	-1	0.000120171	# 0.00 Gflop/s, 556.26 GB/s, tuning took 0.494009 seconds at Mon May 13 19:40:20 2024
     16x16x16x32	N4quda9CopyGaugeINS_12CopyGaugeArgIsdLi18ELb0ENS_5gauge11FloatNOrderIsLi18ELi4ELi12EL20QudaStaggeredPhase_s0ELb1EL19QudaGhostExchange_sn2147483648ELb0EEENS3_IdLi18ELi2ELi12ELS4_0ELb1ELS5_n2147483648ELb0EEEEEEE	GPU-offline,vol=131072stride=69632precision=8geometry=4Nc=3,vol=131072stride=69632precision=2geometry=4Nc=3,ghost	32	1	2	128	1	4	0	-1	-1	-1	-1	7.82423e-06	# 0.00 Gflop/s, 467.23 GB/s, tuning took 0.187197 seconds at Mon May 13 19:40:20 2024
      8x16x16x32	N4quda15CopyColorSpinorILi4ELi3ENS_11colorspinor11FloatNOrderIdLi4ELi3ELi2ELb0ELb0EEENS1_21SpaceSpinorColorOrderIdLi4ELi3EEESt5tupleIJRNS_16ColorSpinorFieldERKS7_19QudaFieldLocation_sPdPKdEEEE	GPU-offline,vol=65536,parity=1,precision=8,order=9,Ns=4,Nc=3vol=65536,parity=1,precision=8,order=2,Ns=4,Nc=3,NonRelBasis	256	1	1	256	1	1	0	-1	-1	-1	-1	5.27968e-05	# 0.00 Gflop/s, 476.65 GB/s, tuning took 0.031810 seconds at Mon May 13 19:40:24 2024
      8x16x16x32	N4quda15CopyColorSpinorILi4ELi3ENS_11colorspinor21SpaceSpinorColorOrderIdLi4ELi3EEENS1_11FloatNOrderIdLi4ELi3ELi2ELb0ELb0EEESt5tupleIJRNS_16ColorSpinorFieldERKS7_19QudaFieldLocation_sPdPKdEEEE	GPU-offline,vol=65536,parity=1,precision=8,order=2,Ns=4,Nc=3vol=65536,parity=1,precision=8,order=9,Ns=4,Nc=3,RelBasis	768	1	1	86	1	1	0	-1	-1	-1	-1	5.1864e-05	# 0.00 Gflop/s, 485.23 GB/s, tuning took 0.031953 seconds at Mon May 13 19:40:25 2024
      8x16x16x32	N4quda6WilsonINS_9WilsonArgIdLi3ELi4EL21QudaReconstructType_s12EEEEE	policy,commDim=0000,parity=1,topo=1111,p2p=0,gdr=0,nvshmem=0,pol=110000111100110000	32	1	1	1	1	1	0	1	0	0	-1	0.000181221	# 477.36 Gflop/s, 833.21 GB/s, tuning took 0.032612 seconds at Mon May 13 19:40:25 2024
      8x16x16x32	N4quda6WilsonINS_9WilsonArgIdLi3ELi4EL21QudaReconstructType_s12EEEEE	policy_kernel=interior,comm=0000,commDim=0000,parity=1	48	1	1	1366	1	1	16385	-1	-1	-1	-1	0.000177323	# 487.85 Gflop/s, 851.53 GB/s, tuning took 0.610754 seconds at Mon May 13 19:40:24 2024
  bytes=18874368	cudaMemcpyDefault	copy,cuda_gauge_field.cpp,576	32	1	1	1	1	1	0	-1	-1	-1	-1	8.13194e-05	# 0.00 Gflop/s, 232.10 GB/s, tuning took 0.006169 seconds at Mon May 13 19:40:18 2024
  bytes=18874368	cudaMemcpyDefault	saveCPUField,cuda_gauge_field.cpp,658	32	1	1	1	1	1	0	-1	-1	-1	-1	0.000112647	# 0.00 Gflop/s, 167.55 GB/s, tuning took 0.003660 seconds at Mon May 13 19:40:24 2024
   bytes=2752512	cudaMemset	allocateGhostBuffer,lattice_field.cpp,288	32	1	1	1	1	1	0	-1	-1	-1	-1	1.5907e-05	# 0.00 Gflop/s, 173.04 GB/s, tuning took 0.004790 seconds at Mon May 13 19:40:19 2024
   bytes=2752512	cudaMemset	allocateGhostBuffer,lattice_field.cpp,293	32	1	1	1	1	1	0	-1	-1	-1	-1	8.38226e-06	# 0.00 Gflop/s, 328.37 GB/s, tuning took 0.002618 seconds at Mon May 13 19:40:19 2024
    bytes=393216	cudaMemcpyDeviceToDevice	exchangeGhost,cuda_gauge_field.cpp,193	32	1	1	1	1	1	0	-1	-1	-1	-1	1.06252e-05	# 0.00 Gflop/s, 74.02 GB/s, tuning took 0.002934 seconds at Mon May 13 19:40:19 2024
    bytes=786432	cudaMemcpyDeviceToDevice	exchangeGhost,cuda_gauge_field.cpp,193	32	1	1	1	1	1	0	-1	-1	-1	-1	5.42316e-06	# 0.00 Gflop/s, 290.03 GB/s, tuning took 0.001891 seconds at Mon May 13 19:40:19 2024
