test/.cache/tunecache_error.tsv
tunecache	1.1.0	1.1.0-b869d61-dirty-gfx906	cpu_arch=x86_64,gpu_arch=gfx906,hip_version=14.0.0	# Last updated Sat Oct 28 14:41:35 2023

          volume	name	aux	block.x	block.y	block.z	grid.x	grid.y	grid.z	shared_bytes	aux.x	aux.y	aux.z	aux.w	time	comment
