test/.cache/tunecache.tsv
tunecache	1.1.0	1.1.0--sm_80	cpu_arch=x86_64,gpu_arch=sm_80,cuda_version=12.3.103	# Last updated Wed Aug 14 14:52:16 2024

          volume	name	aux	block.x	block.y	block.z	grid.x	grid.y	grid.z	shared_bytes	aux.x	aux.y	aux.z	aux.w	time	comment
     12x24x24x72	N4quda6WilsonINS_9WilsonArgIdLi3ELi4EL21QudaReconstructType_s12EEEEE	policy_kernel=interior,comm=0000,commDim=0000,xpay,parity=1	64	1	1	7776	1	1	25345	-1	-1	-1	-1	0.00539477	# 126.20 Gflop/s, 212.54 GB/s, tuning took 5.275656 seconds at Wed Aug 14 09:50:45 2024
     16x16x16x16	N4quda10CopyCloverINS_6clover11FloatNOrderIfLi72ELi4ELb0ELb0ELb0EEENS2_IdLi72ELi2ELb0ELb0ELb0EEEfdEE	GPU-offline,vol=65536precision=8Nc=3	32	2	1	1024	1	1	2341	-1	-1	-1	-1	0.000232653	# 0.00 Gflop/s, 243.38 GB/s, tuning took 0.187449 seconds at Wed Aug 14 14:52:09 2024
     16x16x16x16	N4quda10CopyCloverINS_6clover11FloatNOrderIsLi72ELi8ELb0ELb0ELb0EEENS2_IdLi72ELi2ELb0ELb0ELb0EEEsdEE	GPU-offline,vol=65536precision=8Nc=3	32	2	1	1024	1	1	3781	-1	-1	-1	-1	0.000194901	# 0.00 Gflop/s, 242.10 GB/s, tuning took 0.153878 seconds at Wed Aug 14 14:52:09 2024
     16x16x16x16	N4quda10GaugeGaussIdLi3EL21QudaReconstructType_s12EEE	GPU-offline,vol=65536stride=34816precision=8geometry=4Nc=3,lie_group	32	2	1	1024	1	1	2138	-1	-1	-1	-1	0.00357001	# 0.00 Gflop/s, 7.49 GB/s, tuning took 2.315084 seconds at Wed Aug 14 14:51:35 2024
     16x16x16x16	N4quda11CopyGaugeExIddLi18ENS_5gauge11FloatNOrderIdLi18ELi2ELi18EL20QudaStaggeredPhase_s0ELb1EL19QudaGhostExchange_sn2147483648ELb0EEENS2_IdLi18ELi2ELi12ELS3_0ELb1ELS4_n2147483648ELb0EEEEE	GPU-offline,vol=65536stride=34816precision=8geometry=4Nc=3vol=65536stride=32768precision=8geometry=4Nc=3r=0000	128	2	1	256	1	1	0	-1	-1	-1	-1	0.00027008	# 0.00 Gflop/s, 238.77 GB/s, tuning took 0.233779 seconds at Wed Aug 14 14:52:09 2024
     16x16x16x16	N4quda11CopyGaugeExIddLi18ENS_5gauge11FloatNOrderIdLi18ELi2ELi18EL20QudaStaggeredPhase_s0ELb1EL19QudaGhostExchange_sn2147483648ELb0EEES5_EE	GPU-offline,vol=65536stride=34816precision=8geometry=4Nc=3vol=65536stride=32768precision=8geometry=4Nc=3r=0000	32	2	1	1024	1	1	0	-1	-1	-1	-1	0.000342272	# 0.00 Gflop/s, 227.47 GB/s, tuning took 0.292583 seconds at Wed Aug 14 14:51:36 2024
     16x16x16x16	N4quda12CloverInvertIdEE	GPU-offline,nParity=2,vol=65536precision=8Nc=3,trlog=true,twist=false	32	2	1	48	1	1	2049	-1	-1	-1	-1	0.00114676	# 0.00 Gflop/s, 65.84 GB/s, tuning took 26.770496 seconds at Wed Aug 14 14:52:08 2024
     16x16x16x16	N4quda12ExtractGhostIdLi3ENS_5gauge11FloatNOrderIdLi18ELi2ELi12EL20QudaStaggeredPhase_s0ELb1EL19QudaGhostExchange_sn2147483648ELb0EEEEE	GPU-offline,vol=65536stride=34816precision=8geometry=4Nc=3,extract	64	1	4	64	1	2	0	-1	-1	-1	-1	1.0148e-05	# 0.00 Gflop/s, 309.99 GB/s, tuning took 0.048791 seconds at Thu Aug  8 14:24:41 2024
     16x16x16x16	N4quda12ExtractGhostIdLi3ENS_5gauge11FloatNOrderIdLi18ELi2ELi18EL20QudaStaggeredPhase_s0ELb1EL19QudaGhostExchange_sn2147483648ELb0EEEEE	GPU-offline,vol=65536stride=34816precision=8geometry=4Nc=3,extract	64	1	6	64	1	2	0	-1	-1	-1	-1	7.65626e-06	# 0.00 Gflop/s, 616.30 GB/s, tuning took 0.036239 seconds at Wed Aug 14 14:51:35 2024
     16x16x16x16	N4quda13ComputeCloverIdEE	GPU-offline,vol=65536precision=8Nc=3	64	2	1	512	1	1	0	-1	-1	-1	-1	0.00040448	# 77.77 Gflop/s, 233.32 GB/s, tuning took 0.054013 seconds at Wed Aug 14 14:51:41 2024
     16x16x16x16	N4quda5FmunuIdLi3EL21QudaReconstructType_s18EEE	GPU-offline,vol=65536stride=32768precision=8geometry=4Nc=3r=0000,comm=0000	32	2	2	1024	1	3	0	-1	-1	-1	-1	0.00455201	# 213.02 Gflop/s, 211.47 GB/s, tuning took 4.850814 seconds at Wed Aug 14 14:51:41 2024
     16x16x16x16	N4quda7RNGInitE	GPU-offline,vol=65536stride=34816precision=8geometry=4Nc=3	32	2	1	1024	1	1	0	-1	-1	-1	-1	0.0245453	# 0.00 Gflop/s, 0.00 GB/s, tuning took 3.349028 seconds at Thu Aug  8 14:24:45 2024
     16x16x16x16	N4quda9CopyGaugeINS_12CopyGaugeArgIddLi18ELb0ENS_5gauge11FloatNOrderIdLi18ELi2ELi12EL20QudaStaggeredPhase_s0ELb1EL19QudaGhostExchange_sn2147483648ELb0EEENS2_8QDPOrderIdLi18EEEEEEE	GPU-offline,vol=65536stride=32768precision=8geometry=4Nc=3,vol=65536stride=34816precision=8geometry=4Nc=3	64	1	1	512	1	8	16385	-1	-1	-1	-1	0.000261632	# 0.00 Gflop/s, 246.48 GB/s, tuning took 0.369956 seconds at Thu Aug  8 14:24:41 2024
     16x16x16x16	N4quda9CopyGaugeINS_12CopyGaugeArgIddLi18ELb0ENS_5gauge11FloatNOrderIdLi18ELi2ELi12EL20QudaStaggeredPhase_s0ELb1EL19QudaGhostExchange_sn2147483648ELb0EEES6_EEEE	GPU-offline,vol=65536stride=34816precision=8geometry=4Nc=3,vol=65536stride=34816precision=8geometry=4Nc=3,ghost	96	1	1	22	1	8	3073	-1	-1	-1	-1	5.87233e-06	# 0.00 Gflop/s, 569.17 GB/s, tuning took 0.047479 seconds at Thu Aug  8 14:24:41 2024
     16x16x16x16	N4quda9CopyGaugeINS_12CopyGaugeArgIddLi18ELb0ENS_5gauge11FloatNOrderIdLi18ELi2ELi18EL20QudaStaggeredPhase_s0ELb1EL19QudaGhostExchange_sn2147483648ELb0EEENS2_8QDPOrderIdLi18EEEEEEE	GPU-offline,vol=65536stride=32768precision=8geometry=4Nc=3,vol=65536stride=34816precision=8geometry=4Nc=3	32	1	2	1024	1	4	24577	-1	-1	-1	-1	0.00033024	# 0.00 Gflop/s, 235.76 GB/s, tuning took 0.463640 seconds at Wed Aug 14 14:51:35 2024
     16x16x16x16	N4quda9CopyGaugeINS_12CopyGaugeArgIddLi18ELb0ENS_5gauge11FloatNOrderIdLi18ELi2ELi18EL20QudaStaggeredPhase_s0ELb1EL19QudaGhostExchange_sn2147483648ELb0EEES6_EEEE	GPU-offline,vol=65536stride=34816precision=8geometry=4Nc=3,vol=65536stride=34816precision=8geometry=4Nc=3,ghost	32	1	1	64	1	8	2049	-1	-1	-1	-1	7.78355e-06	# 0.00 Gflop/s, 644.12 GB/s, tuning took 0.036056 seconds at Wed Aug 14 14:51:35 2024
     16x16x16x16	N4quda9CopyGaugeINS_12CopyGaugeArgIddLi18ELb0ENS_5gauge8QDPOrderIdLi18EEENS2_11FloatNOrderIdLi18ELi2ELi12EL20QudaStaggeredPhase_s0ELb1EL19QudaGhostExchange_sn2147483648ELb0EEEEEEE	GPU-offline,vol=65536stride=34816precision=8geometry=4Nc=3,vol=65536stride=32768precision=8geometry=4Nc=3	96	1	1	342	1	8	7022	-1	-1	-1	-1	0.00026496	# 0.00 Gflop/s, 243.39 GB/s, tuning took 0.379249 seconds at Thu Aug  8 14:24:48 2024
     16x16x16x16	N4quda9CopyGaugeINS_12CopyGaugeArgIfdLi18ELb0ENS_5gauge11FloatNOrderIfLi18ELi4ELi12EL20QudaStaggeredPhase_s0ELb1EL19QudaGhostExchange_sn2147483648ELb0EEENS3_IdLi18ELi2ELi12ELS4_0ELb1ELS5_n2147483648ELb0EEEEEEE	GPU-offline,vol=65536stride=34816precision=8geometry=4Nc=3,vol=65536stride=34816precision=4geometry=4Nc=3	96	1	3	342	1	3	0	-1	-1	-1	-1	9.77189e-05	# 0.00 Gflop/s, 410.44 GB/s, tuning took 0.156370 seconds at Thu Aug  8 14:24:41 2024
     16x16x16x16	N4quda9CopyGaugeINS_12CopyGaugeArgIfdLi18ELb0ENS_5gauge11FloatNOrderIfLi18ELi4ELi12EL20QudaStaggeredPhase_s0ELb1EL19QudaGhostExchange_sn2147483648ELb0EEENS3_IdLi18ELi2ELi12ELS4_0ELb1ELS5_n2147483648ELb0EEEEEEE	GPU-offline,vol=65536stride=34816precision=8geometry=4Nc=3,vol=65536stride=34816precision=4geometry=4Nc=3,ghost	32	1	2	64	1	4	2138	-1	-1	-1	-1	1.15827e-05	# 0.00 Gflop/s, 216.42 GB/s, tuning took 0.048942 seconds at Thu Aug  8 14:24:41 2024
     16x16x16x16	N4quda9CopyGaugeINS_12CopyGaugeArgIfdLi18ELb0ENS_5gauge11FloatNOrderIfLi18ELi4ELi12EL20QudaStaggeredPhase_s0ELb1EL19QudaGhostExchange_sn2147483648ELb0EEENS3_IdLi18ELi2ELi18ELS4_0ELb1ELS5_n2147483648ELb0EEEEEEE	GPU-offline,vol=65536stride=34816precision=8geometry=4Nc=3,vol=65536stride=34816precision=4geometry=4Nc=3	160	1	1	205	1	8	0	-1	-1	-1	-1	9.85234e-05	# 0.00 Gflop/s, 542.79 GB/s, tuning took 0.166922 seconds at Wed Aug 14 14:51:36 2024
     16x16x16x16	N4quda9CopyGaugeINS_12CopyGaugeArgIfdLi18ELb0ENS_5gauge11FloatNOrderIfLi18ELi4ELi12EL20QudaStaggeredPhase_s0ELb1EL19QudaGhostExchange_sn2147483648ELb0EEENS3_IdLi18ELi2ELi18ELS4_0ELb1ELS5_n2147483648ELb0EEEEEEE	GPU-offline,vol=65536stride=34816precision=8geometry=4Nc=3,vol=65536stride=34816precision=4geometry=4Nc=3,ghost	64	1	1	32	1	8	3511	-1	-1	-1	-1	8.04959e-06	# 0.00 Gflop/s, 415.22 GB/s, tuning took 0.052246 seconds at Wed Aug 14 14:51:36 2024
     16x16x16x16	N4quda9CopyGaugeINS_12CopyGaugeArgIsdLi18ELb0ENS_5gauge11FloatNOrderIsLi18ELi4ELi12EL20QudaStaggeredPhase_s0ELb1EL19QudaGhostExchange_sn2147483648ELb0EEENS3_IdLi18ELi2ELi12ELS4_0ELb1ELS5_n2147483648ELb0EEEEEEE	GPU-offline,vol=65536stride=34816precision=8geometry=4Nc=3,vol=65536stride=34816precision=2geometry=4Nc=3	96	1	1	342	1	8	3781	-1	-1	-1	-1	5.87897e-05	# 0.00 Gflop/s, 568.52 GB/s, tuning took 0.111384 seconds at Thu Aug  8 14:24:41 2024
     16x16x16x16	N4quda9CopyGaugeINS_12CopyGaugeArgIsdLi18ELb0ENS_5gauge11FloatNOrderIsLi18ELi4ELi12EL20QudaStaggeredPhase_s0ELb1EL19QudaGhostExchange_sn2147483648ELb0EEENS3_IdLi18ELi2ELi12ELS4_0ELb1ELS5_n2147483648ELb0EEEEEEE	GPU-offline,vol=65536stride=34816precision=8geometry=4Nc=3,vol=65536stride=34816precision=2geometry=4Nc=3,ghost	64	1	1	32	1	8	2458	-1	-1	-1	-1	8.20556e-06	# 0.00 Gflop/s, 254.58 GB/s, tuning took 0.037856 seconds at Thu Aug  8 14:24:41 2024
     16x16x16x16	N4quda9CopyGaugeINS_12CopyGaugeArgIsdLi18ELb0ENS_5gauge11FloatNOrderIsLi18ELi4ELi12EL20QudaStaggeredPhase_s0ELb1EL19QudaGhostExchange_sn2147483648ELb0EEENS3_IdLi18ELi2ELi18ELS4_0ELb1ELS5_n2147483648ELb0EEEEEEE	GPU-offline,vol=65536stride=34816precision=8geometry=4Nc=3,vol=65536stride=34816precision=2geometry=4Nc=3	96	1	1	342	1	8	3781	-1	-1	-1	-1	5.72871e-05	# 0.00 Gflop/s, 816.81 GB/s, tuning took 0.113199 seconds at Wed Aug 14 14:51:36 2024
     16x16x16x16	N4quda9CopyGaugeINS_12CopyGaugeArgIsdLi18ELb0ENS_5gauge11FloatNOrderIsLi18ELi4ELi12EL20QudaStaggeredPhase_s0ELb1EL19QudaGhostExchange_sn2147483648ELb0EEENS3_IdLi18ELi2ELi18ELS4_0ELb1ELS5_n2147483648ELb0EEEEEEE	GPU-offline,vol=65536stride=34816precision=8geometry=4Nc=3,vol=65536stride=34816precision=2geometry=4Nc=3,ghost	736	1	1	3	1	8	0	-1	-1	-1	-1	7.59608e-06	# 0.00 Gflop/s, 385.01 GB/s, tuning took 0.035101 seconds at Wed Aug 14 14:51:36 2024
     16x16x16x32	N4quda10CopyCloverINS_6clover11FloatNOrderIfLi72ELi4ELb0ELb0ELb0EEENS2_IdLi72ELi2ELb0ELb0ELb0EEEfdEE	GPU-offline,vol=131072precision=8Nc=3	64	1	1	1024	2	1	2587	-1	-1	-1	-1	0.000493227	# 0.00 Gflop/s, 229.60 GB/s, tuning took 0.359248 seconds at Wed Aug 14 14:27:56 2024
     16x16x16x32	N4quda10CopyCloverINS_6clover11FloatNOrderIsLi72ELi8ELb0ELb0ELb0EEENS2_IdLi72ELi2ELb0ELb0ELb0EEEsdEE	GPU-offline,vol=131072precision=8Nc=3	64	2	1	1024	1	1	7022	-1	-1	-1	-1	0.000390827	# 0.00 Gflop/s, 241.47 GB/s, tuning took 0.328905 seconds at Wed Aug 14 14:27:56 2024
     16x16x16x32	N4quda10GaugeGaussIdLi3EL21QudaReconstructType_s12EEE	GPU-offline,vol=131072stride=69632precision=8geometry=4Nc=3,lie_group	96	1	1	683	2	1	0	-1	-1	-1	-1	0.00730624	# 0.00 Gflop/s, 7.32 GB/s, tuning took 4.599862 seconds at Tue Aug  6 22:59:50 2024
     16x16x16x32	N4quda11CopyGaugeExIddLi18ENS_5gauge11FloatNOrderIdLi18ELi2ELi18EL20QudaStaggeredPhase_s0ELb1EL19QudaGhostExchange_sn2147483648ELb0EEENS2_IdLi18ELi2ELi12ELS3_0ELb1ELS4_n2147483648ELb0EEEEE	GPU-offline,vol=131072stride=69632precision=8geometry=4Nc=3vol=131072stride=65536precision=8geometry=4Nc=3r=0000	64	1	1	1024	2	1	24577	-1	-1	-1	-1	0.000542379	# 0.00 Gflop/s, 237.79 GB/s, tuning took 0.519953 seconds at Wed Aug 14 14:27:56 2024
     16x16x16x32	N4quda11CopyGaugeExIddLi18ENS_5gauge11FloatNOrderIdLi18ELi2ELi18EL20QudaStaggeredPhase_s0ELb1EL19QudaGhostExchange_sn2147483648ELb0EEES5_EE	GPU-offline,vol=131072stride=69632precision=8geometry=4Nc=3vol=131072stride=65536precision=8geometry=4Nc=3r=0000	32	1	1	2048	2	1	12289	-1	-1	-1	-1	0.000666965	# 0.00 Gflop/s, 233.47 GB/s, tuning took 0.572862 seconds at Wed Aug 14 14:26:55 2024
     16x16x16x32	N4quda12CloverInvertIdEE	GPU-offline,nParity=2,vol=131072precision=8Nc=3,trlog=true,twist=false	64	2	1	48	1	1	8193	-1	-1	-1	-1	0.00227021	# 0.00 Gflop/s, 66.51 GB/s, tuning took 49.281966 seconds at Wed Aug 14 14:27:54 2024
     16x16x16x32	N4quda12ExtractGhostIdLi3ENS_5gauge11FloatNOrderIdLi18ELi2ELi12EL20QudaStaggeredPhase_s0ELb1EL19QudaGhostExchange_sn2147483648ELb0EEEEE	GPU-offline,vol=131072stride=69632precision=8geometry=4Nc=3,extract	448	1	1	19	1	8	0	-1	-1	-1	-1	8.04348e-06	# 0.00 Gflop/s, 684.41 GB/s, tuning took 0.038151 seconds at Tue Aug  6 22:59:38 2024
     16x16x16x32	N4quda12ExtractGhostIdLi3ENS_5gauge11FloatNOrderIdLi18ELi2ELi18EL20QudaStaggeredPhase_s0ELb1EL19QudaGhostExchange_sn2147483648ELb0EEEEE	GPU-offline,vol=131072stride=69632precision=8geometry=4Nc=3,extract	96	1	3	86	1	3	0	-1	-1	-1	-1	1.25698e-05	# 0.00 Gflop/s, 656.93 GB/s, tuning took 0.042020 seconds at Wed Aug 14 14:26:54 2024
     16x16x16x32	N4quda13ComputeCloverIdEE	GPU-offline,vol=131072precision=8Nc=3	64	1	1	1024	2	1	0	-1	-1	-1	-1	0.000801109	# 78.53 Gflop/s, 235.60 GB/s, tuning took 0.077766 seconds at Wed Aug 14 14:27:04 2024
     16x16x16x32	N4quda15CopyColorSpinorILi4ELi3ENS_11colorspinor11FloatNOrderIdLi4ELi3ELi2ELb0ELb0EEENS1_21SpaceSpinorColorOrderIdLi4ELi3EEESt5tupleIJRNS_16ColorSpinorFieldERKS7_19QudaFieldLocation_sPdPKdEEEE	GPU-offline,vol=131072,parity=2,precision=8,order=9,Ns=4,Nc=3vol=131072,parity=2,precision=8,order=2,Ns=4,Nc=3,NonRelBasis	128	2	1	512	1	1	0	-1	-1	-1	-1	0.000182857	# 0.00 Gflop/s, 275.25 GB/s, tuning took 0.058993 seconds at Sun Aug 11 15:11:20 2024
     16x16x16x32	N4quda15CopyColorSpinorILi4ELi3ENS_11colorspinor21SpaceSpinorColorOrderIdLi4ELi3EEENS1_11FloatNOrderIdLi4ELi3ELi2ELb0ELb0EEESt5tupleIJRNS_16ColorSpinorFieldERKS7_19QudaFieldLocation_sPdPKdEEEE	GPU-offline,vol=131072,parity=2,precision=8,order=2,Ns=4,Nc=3vol=131072,parity=2,precision=8,order=9,Ns=4,Nc=3,RelBasis	192	2	1	342	1	1	0	-1	-1	-1	-1	0.000202547	# 0.00 Gflop/s, 248.49 GB/s, tuning took 0.041885 seconds at Sun Aug 11 15:11:29 2024
     16x16x16x32	N4quda4blas5Norm2IddEE	GPU-offline,nParity=2,vol=131072,parity=2,precision=8,order=2,Ns=4,Nc=3	480	1	1	24	1	1	0	-1	-1	-1	-1	4.56348e-05	# 137.87 Gflop/s, 551.46 GB/s, tuning took 0.777515 seconds at Sun Aug 11 15:11:21 2024
     16x16x16x32	N4quda5FmunuIdLi3EL21QudaReconstructType_s18EEE	GPU-offline,vol=131072stride=65536precision=8geometry=4Nc=3r=0000,comm=0000	64	1	2	1024	2	3	0	-1	-1	-1	-1	0.00909346	# 213.27 Gflop/s, 211.71 GB/s, tuning took 8.975804 seconds at Wed Aug 14 14:27:04 2024
     16x16x16x32	N4quda6WilsonINS_9WilsonArgIdLi3ELi4EL21QudaReconstructType_s12EEEEE	policy,commDim=0000,xpay,parity=2,topo=1111,p2p=0,gdr=0,nvshmem=0,pol=110000111100110000	32	1	1	1	1	1	0	8	0	0	-1	0.00158276	# 113.29 Gflop/s, 190.80 GB/s, tuning took 0.114008 seconds at Sun Aug 11 15:11:32 2024
     16x16x16x32	N4quda6WilsonINS_9WilsonArgIdLi3ELi4EL21QudaReconstructType_s12EEEEE	policy_kernel=interior,comm=0000,commDim=0000,xpay,parity=2	32	1	2	2048	1	1	25345	-1	-1	-1	-1	0.00148036	# 121.12 Gflop/s, 204.00 GB/s, tuning took 2.476511 seconds at Sun Aug 11 15:11:32 2024
     16x16x16x32	N4quda7RNGInitE	GPU-offline,vol=131072stride=69632precision=8geometry=4Nc=3	32	1	1	2048	2	1	0	-1	-1	-1	-1	0.0500722	# 0.00 Gflop/s, 0.00 GB/s, tuning took 6.645787 seconds at Tue Aug  6 22:59:46 2024
     16x16x16x32	N4quda9CopyGaugeINS_12CopyGaugeArgIddLi18ELb0ENS_5gauge11FloatNOrderIdLi18ELi2ELi12EL20QudaStaggeredPhase_s0ELb1EL19QudaGhostExchange_sn2147483648ELb0EEENS2_8QDPOrderIdLi18EEEEEEE	GPU-offline,vol=131072stride=65536precision=8geometry=4Nc=3,vol=131072stride=69632precision=8geometry=4Nc=3	32	1	1	2048	1	8	2731	-1	-1	-1	-1	0.000518827	# 0.00 Gflop/s, 248.59 GB/s, tuning took 0.736767 seconds at Tue Aug  6 22:59:38 2024
     16x16x16x32	N4quda9CopyGaugeINS_12CopyGaugeArgIddLi18ELb0ENS_5gauge11FloatNOrderIdLi18ELi2ELi12EL20QudaStaggeredPhase_s0ELb1EL19QudaGhostExchange_sn2147483648ELb0EEES6_EEEE	GPU-offline,vol=131072stride=69632precision=8geometry=4Nc=3,vol=131072stride=69632precision=8geometry=4Nc=3,ghost	64	1	1	64	1	8	2458	-1	-1	-1	-1	7.83852e-06	# 0.00 Gflop/s, 746.20 GB/s, tuning took 0.031524 seconds at Tue Aug  6 22:59:38 2024
     16x16x16x32	N4quda9CopyGaugeINS_12CopyGaugeArgIddLi18ELb0ENS_5gauge11FloatNOrderIdLi18ELi2ELi18EL20QudaStaggeredPhase_s0ELb1EL19QudaGhostExchange_sn2147483648ELb0EEENS2_8QDPOrderIdLi18EEEEEEE	GPU-offline,vol=131072stride=65536precision=8geometry=4Nc=3,vol=131072stride=69632precision=8geometry=4Nc=3	32	1	2	2048	1	4	4097	-1	-1	-1	-1	0.000661461	# 0.00 Gflop/s, 235.41 GB/s, tuning took 0.864937 seconds at Wed Aug 14 14:26:54 2024
     16x16x16x32	N4quda9CopyGaugeINS_12CopyGaugeArgIddLi18ELb0ENS_5gauge11FloatNOrderIdLi18ELi2ELi18EL20QudaStaggeredPhase_s0ELb1EL19QudaGhostExchange_sn2147483648ELb0EEES6_EEEE	GPU-offline,vol=131072stride=69632precision=8geometry=4Nc=3,vol=131072stride=69632precision=8geometry=4Nc=3,ghost	64	1	1	64	1	8	2587	-1	-1	-1	-1	7.70081e-06	# 0.00 Gflop/s, 1139.31 GB/s, tuning took 0.046531 seconds at Wed Aug 14 14:26:54 2024
     16x16x16x32	N4quda9CopyGaugeINS_12CopyGaugeArgIddLi18ELb0ENS_5gauge8QDPOrderIdLi18EEENS2_11FloatNOrderIdLi18ELi2ELi12EL20QudaStaggeredPhase_s0ELb1EL19QudaGhostExchange_sn2147483648ELb0EEEEEEE	GPU-offline,vol=131072stride=69632precision=8geometry=4Nc=3,vol=131072stride=65536precision=8geometry=4Nc=3	96	1	1	683	1	8	4469	-1	-1	-1	-1	0.000528725	# 0.00 Gflop/s, 243.94 GB/s, tuning took 0.734998 seconds at Tue Aug  6 22:59:51 2024
     16x16x16x32	N4quda9CopyGaugeINS_12CopyGaugeArgIfdLi18ELb0ENS_5gauge11FloatNOrderIfLi18ELi4ELi12EL20QudaStaggeredPhase_s0ELb1EL19QudaGhostExchange_sn2147483648ELb0EEENS3_IdLi18ELi2ELi12ELS4_0ELb1ELS5_n2147483648ELb0EEEEEEE	GPU-offline,vol=131072stride=69632precision=8geometry=4Nc=3,vol=131072stride=69632precision=4geometry=4Nc=3	32	1	4	2048	1	2	12289	-1	-1	-1	-1	0.000307712	# 0.00 Gflop/s, 260.69 GB/s, tuning took 0.428068 seconds at Tue Aug  6 22:59:39 2024
     16x16x16x32	N4quda9CopyGaugeINS_12CopyGaugeArgIfdLi18ELb0ENS_5gauge11FloatNOrderIfLi18ELi4ELi12EL20QudaStaggeredPhase_s0ELb1EL19QudaGhostExchange_sn2147483648ELb0EEENS3_IdLi18ELi2ELi12ELS4_0ELb1ELS5_n2147483648ELb0EEEEEEE	GPU-offline,vol=131072stride=69632precision=8geometry=4Nc=3,vol=131072stride=69632precision=4geometry=4Nc=3,ghost	32	1	2	128	1	4	2138	-1	-1	-1	-1	9.10327e-06	# 0.00 Gflop/s, 481.89 GB/s, tuning took 0.039743 seconds at Tue Aug  6 22:59:39 2024
     16x16x16x32	N4quda9CopyGaugeINS_12CopyGaugeArgIfdLi18ELb0ENS_5gauge11FloatNOrderIfLi18ELi4ELi12EL20QudaStaggeredPhase_s0ELb1EL19QudaGhostExchange_sn2147483648ELb0EEENS3_IdLi18ELi2ELi18ELS4_0ELb1ELS5_n2147483648ELb0EEEEEEE	GPU-offline,vol=131072stride=69632precision=8geometry=4Nc=3,vol=131072stride=69632precision=4geometry=4Nc=3	32	1	4	2048	1	2	4097	-1	-1	-1	-1	0.000316672	# 0.00 Gflop/s, 337.75 GB/s, tuning took 0.445181 seconds at Wed Aug 14 14:26:55 2024
     16x16x16x32	N4quda9CopyGaugeINS_12CopyGaugeArgIfdLi18ELb0ENS_5gauge11FloatNOrderIfLi18ELi4ELi12EL20QudaStaggeredPhase_s0ELb1EL19QudaGhostExchange_sn2147483648ELb0EEENS3_IdLi18ELi2ELi18ELS4_0ELb1ELS5_n2147483648ELb0EEEEEEE	GPU-offline,vol=131072stride=69632precision=8geometry=4Nc=3,vol=131072stride=69632precision=4geometry=4Nc=3,ghost	32	1	2	128	1	4	2049	-1	-1	-1	-1	1.19592e-05	# 0.00 Gflop/s, 489.09 GB/s, tuning took 0.044179 seconds at Wed Aug 14 14:26:55 2024
     16x16x16x32	N4quda9CopyGaugeINS_12CopyGaugeArgIsdLi18ELb0ENS_5gauge11FloatNOrderIsLi18ELi4ELi12EL20QudaStaggeredPhase_s0ELb1EL19QudaGhostExchange_sn2147483648ELb0EEENS3_IdLi18ELi2ELi12ELS4_0ELb1ELS5_n2147483648ELb0EEEEEEE	GPU-offline,vol=131072stride=69632precision=8geometry=4Nc=3,vol=131072stride=69632precision=2geometry=4Nc=3	32	1	1	2048	1	8	2138	-1	-1	-1	-1	0.00025856	# 0.00 Gflop/s, 258.53 GB/s, tuning took 0.351290 seconds at Tue Aug  6 22:59:39 2024
     16x16x16x32	N4quda9CopyGaugeINS_12CopyGaugeArgIsdLi18ELb0ENS_5gauge11FloatNOrderIsLi18ELi4ELi12EL20QudaStaggeredPhase_s0ELb1EL19QudaGhostExchange_sn2147483648ELb0EEENS3_IdLi18ELi2ELi12ELS4_0ELb1ELS5_n2147483648ELb0EEEEEEE	GPU-offline,vol=131072stride=69632precision=8geometry=4Nc=3,vol=131072stride=69632precision=2geometry=4Nc=3,ghost	64	1	1	64	1	8	2049	-1	-1	-1	-1	1.27389e-05	# 0.00 Gflop/s, 286.97 GB/s, tuning took 0.043644 seconds at Tue Aug  6 22:59:39 2024
     16x16x16x32	N4quda9CopyGaugeINS_12CopyGaugeArgIsdLi18ELb0ENS_5gauge11FloatNOrderIsLi18ELi4ELi12EL20QudaStaggeredPhase_s0ELb1EL19QudaGhostExchange_sn2147483648ELb0EEENS3_IdLi18ELi2ELi18ELS4_0ELb1ELS5_n2147483648ELb0EEEEEEE	GPU-offline,vol=131072stride=69632precision=8geometry=4Nc=3,vol=131072stride=69632precision=2geometry=4Nc=3	96	1	1	683	1	8	3781	-1	-1	-1	-1	0.00026112	# 0.00 Gflop/s, 358.40 GB/s, tuning took 0.352749 seconds at Wed Aug 14 14:26:54 2024
     16x16x16x32	N4quda9CopyGaugeINS_12CopyGaugeArgIsdLi18ELb0ENS_5gauge11FloatNOrderIsLi18ELi4ELi12EL20QudaStaggeredPhase_s0ELb1EL19QudaGhostExchange_sn2147483648ELb0EEENS3_IdLi18ELi2ELi18ELS4_0ELb1ELS5_n2147483648ELb0EEEEEEE	GPU-offline,vol=131072stride=69632precision=8geometry=4Nc=3,vol=131072stride=69632precision=2geometry=4Nc=3,ghost	64	1	1	64	1	8	2341	-1	-1	-1	-1	1.13579e-05	# 0.00 Gflop/s, 450.61 GB/s, tuning took 0.042911 seconds at Wed Aug 14 14:26:54 2024
     16x32x32x64	N4quda15CopyColorSpinorILi4ELi3ENS_11colorspinor11FloatNOrderIdLi4ELi3ELi2ELb0ELb0EEENS1_21SpaceSpinorColorOrderIdLi4ELi3EEESt5tupleIJRNS_16ColorSpinorFieldERKS7_19QudaFieldLocation_sPdPKdEEEE	GPU-offline,vol=1048576,parity=1,precision=8,order=9,Ns=4,Nc=3vol=1048576,parity=1,precision=8,order=2,Ns=4,Nc=3,NonRelBasis	928	1	1	1130	1	1	0	-1	-1	-1	-1	0.00181248	# 0.00 Gflop/s, 222.16 GB/s, tuning took 0.278400 seconds at Thu Aug  8 16:28:31 2024
     16x32x32x64	N4quda15CopyColorSpinorILi4ELi3ENS_11colorspinor21SpaceSpinorColorOrderIdLi4ELi3EEENS1_11FloatNOrderIdLi4ELi3ELi2ELb0ELb0EEESt5tupleIJRNS_16ColorSpinorFieldERKS7_19QudaFieldLocation_sPdPKdEEEE	GPU-offline,vol=1048576,parity=1,precision=8,order=2,Ns=4,Nc=3vol=1048576,parity=1,precision=8,order=9,Ns=4,Nc=3,RelBasis	160	1	1	6554	1	1	0	-1	-1	-1	-1	0.00179198	# 0.00 Gflop/s, 224.70 GB/s, tuning took 0.283655 seconds at Thu Aug  8 16:28:44 2024
     16x32x32x64	N4quda6WilsonINS_9WilsonArgIdLi3ELi4EL21QudaReconstructType_s12EEEEE	policy,commDim=0000,parity=1,topo=1111,p2p=0,gdr=0,nvshmem=0,pol=110000111100110000	32	1	1	1	1	1	0	1	0	0	-1	0.0115074	# 120.28 Gflop/s, 209.95 GB/s, tuning took 0.705661 seconds at Thu Aug  8 16:28:44 2024
     16x32x32x64	N4quda6WilsonINS_9WilsonArgIdLi3ELi4EL21QudaReconstructType_s12EEEEE	policy_kernel=interior,comm=0000,commDim=0000,parity=1	32	1	1	32768	1	1	16897	-1	-1	-1	-1	0.0115081	# 120.27 Gflop/s, 209.93 GB/s, tuning took 11.625337 seconds at Thu Aug  8 16:28:43 2024
        16x8x8x4	N4quda10GaugeGaussIdLi3EL21QudaReconstructType_s12EEE	GPU-offline,vol=4096stride=2560precision=8geometry=4Nc=3,lie_group	192	1	1	11	2	1	24577	-1	-1	-1	-1	0.000258816	# 0.00 Gflop/s, 7.60 GB/s, tuning took 0.221518 seconds at Thu Aug  8 14:50:36 2024
        16x8x8x4	N4quda12ExtractGhostIdLi3ENS_5gauge11FloatNOrderIdLi18ELi2ELi12EL20QudaStaggeredPhase_s0ELb1EL19QudaGhostExchange_sn2147483648ELb0EEEEE	GPU-offline,vol=4096stride=2560precision=8geometry=4Nc=3,extract	64	1	1	16	1	8	2341	-1	-1	-1	-1	6.69153e-06	# 0.00 Gflop/s, 66.11 GB/s, tuning took 0.052269 seconds at Thu Aug  8 14:50:35 2024
        16x8x8x4	N4quda7RNGInitE	GPU-offline,vol=4096stride=2560precision=8geometry=4Nc=3	192	1	1	11	2	1	0	-1	-1	-1	-1	0.00159471	# 0.00 Gflop/s, 0.00 GB/s, tuning took 0.385256 seconds at Thu Aug  8 14:50:36 2024
        16x8x8x4	N4quda9CopyGaugeINS_12CopyGaugeArgIddLi18ELb0ENS_5gauge11FloatNOrderIdLi18ELi2ELi12EL20QudaStaggeredPhase_s0ELb1EL19QudaGhostExchange_sn2147483648ELb0EEENS2_8QDPOrderIdLi18EEEEEEE	GPU-offline,vol=4096stride=2048precision=8geometry=4Nc=3,vol=4096stride=2560precision=8geometry=4Nc=3	64	1	1	32	1	8	0	-1	-1	-1	-1	7.95063e-06	# 0.00 Gflop/s, 544.03 GB/s, tuning took 0.062561 seconds at Thu Aug  8 14:50:35 2024
        16x8x8x4	N4quda9CopyGaugeINS_12CopyGaugeArgIddLi18ELb0ENS_5gauge11FloatNOrderIdLi18ELi2ELi12EL20QudaStaggeredPhase_s0ELb1EL19QudaGhostExchange_sn2147483648ELb0EEES6_EEEE	GPU-offline,vol=4096stride=2560precision=8geometry=4Nc=3,vol=4096stride=2560precision=8geometry=4Nc=3,ghost	32	1	1	16	1	8	2458	-1	-1	-1	-1	5.92248e-06	# 0.00 Gflop/s, 93.37 GB/s, tuning took 0.051568 seconds at Thu Aug  8 14:50:36 2024
        16x8x8x4	N4quda9CopyGaugeINS_12CopyGaugeArgIddLi18ELb0ENS_5gauge8QDPOrderIdLi18EEENS2_11FloatNOrderIdLi18ELi2ELi12EL20QudaStaggeredPhase_s0ELb1EL19QudaGhostExchange_sn2147483648ELb0EEEEEEE	GPU-offline,vol=4096stride=2560precision=8geometry=4Nc=3,vol=4096stride=2048precision=8geometry=4Nc=3	32	1	3	64	1	3	3073	-1	-1	-1	-1	1.18239e-05	# 0.00 Gflop/s, 365.82 GB/s, tuning took 0.043839 seconds at Thu Aug  8 14:50:36 2024
        16x8x8x4	N4quda9CopyGaugeINS_12CopyGaugeArgIfdLi18ELb0ENS_5gauge11FloatNOrderIfLi18ELi4ELi12EL20QudaStaggeredPhase_s0ELb1EL19QudaGhostExchange_sn2147483648ELb0EEENS3_IdLi18ELi2ELi12ELS4_0ELb1ELS5_n2147483648ELb0EEEEEEE	GPU-offline,vol=4096stride=2560precision=8geometry=4Nc=3,vol=4096stride=2560precision=4geometry=4Nc=3	32	1	2	64	1	4	2138	-1	-1	-1	-1	8.67348e-06	# 0.00 Gflop/s, 340.02 GB/s, tuning took 0.043395 seconds at Thu Aug  8 14:50:36 2024
        16x8x8x4	N4quda9CopyGaugeINS_12CopyGaugeArgIfdLi18ELb0ENS_5gauge11FloatNOrderIfLi18ELi4ELi12EL20QudaStaggeredPhase_s0ELb1EL19QudaGhostExchange_sn2147483648ELb0EEENS3_IdLi18ELi2ELi12ELS4_0ELb1ELS5_n2147483648ELb0EEEEEEE	GPU-offline,vol=4096stride=2560precision=8geometry=4Nc=3,vol=4096stride=2560precision=4geometry=4Nc=3,ghost	64	1	2	8	1	4	16385	-1	-1	-1	-1	5.81486e-06	# 0.00 Gflop/s, 71.32 GB/s, tuning took 0.046184 seconds at Thu Aug  8 14:50:36 2024
        16x8x8x4	N4quda9CopyGaugeINS_12CopyGaugeArgIsdLi18ELb0ENS_5gauge11FloatNOrderIsLi18ELi4ELi12EL20QudaStaggeredPhase_s0ELb1EL19QudaGhostExchange_sn2147483648ELb0EEENS3_IdLi18ELi2ELi12ELS4_0ELb1ELS5_n2147483648ELb0EEEEEEE	GPU-offline,vol=4096stride=2560precision=8geometry=4Nc=3,vol=4096stride=2560precision=2geometry=4Nc=3	704	1	1	3	1	8	24577	-1	-1	-1	-1	8.2944e-06	# 0.00 Gflop/s, 296.30 GB/s, tuning took 0.050727 seconds at Thu Aug  8 14:50:36 2024
        16x8x8x4	N4quda9CopyGaugeINS_12CopyGaugeArgIsdLi18ELb0ENS_5gauge11FloatNOrderIsLi18ELi4ELi12EL20QudaStaggeredPhase_s0ELb1EL19QudaGhostExchange_sn2147483648ELb0EEENS3_IdLi18ELi2ELi12ELS4_0ELb1ELS5_n2147483648ELb0EEEEEEE	GPU-offline,vol=4096stride=2560precision=8geometry=4Nc=3,vol=4096stride=2560precision=2geometry=4Nc=3,ghost	32	1	1	16	1	8	2458	-1	-1	-1	-1	6.00189e-06	# 0.00 Gflop/s, 57.58 GB/s, tuning took 0.054796 seconds at Thu Aug  8 14:50:36 2024
        16x8x8x8	N4quda10GaugeGaussIdLi3EL21QudaReconstructType_s12EEE	GPU-offline,vol=8192stride=4608precision=8geometry=4Nc=3,lie_group	352	1	1	12	2	1	24577	-1	-1	-1	-1	0.000471723	# 0.00 Gflop/s, 7.50 GB/s, tuning took 0.369163 seconds at Thu Aug  8 14:21:49 2024
        16x8x8x8	N4quda12ExtractGhostIdLi3ENS_5gauge11FloatNOrderIdLi18ELi2ELi12EL20QudaStaggeredPhase_s0ELb1EL19QudaGhostExchange_sn2147483648ELb0EEEEE	GPU-offline,vol=8192stride=4608precision=8geometry=4Nc=3,extract	64	1	1	16	1	8	2049	-1	-1	-1	-1	5.58811e-06	# 0.00 Gflop/s, 123.14 GB/s, tuning took 0.036731 seconds at Thu Aug  8 14:21:48 2024
        16x8x8x8	N4quda7RNGInitE	GPU-offline,vol=8192stride=4608precision=8geometry=4Nc=3	352	1	1	12	2	1	0	-1	-1	-1	-1	0.00301773	# 0.00 Gflop/s, 0.00 GB/s, tuning took 0.503604 seconds at Thu Aug  8 14:21:48 2024
        16x8x8x8	N4quda9CopyGaugeINS_12CopyGaugeArgIddLi18ELb0ENS_5gauge11FloatNOrderIdLi18ELi2ELi12EL20QudaStaggeredPhase_s0ELb1EL19QudaGhostExchange_sn2147483648ELb0EEENS2_8QDPOrderIdLi18EEEEEEE	GPU-offline,vol=8192stride=4096precision=8geometry=4Nc=3,vol=8192stride=4608precision=8geometry=4Nc=3	32	1	2	128	1	4	2049	-1	-1	-1	-1	1.09613e-05	# 0.00 Gflop/s, 753.34 GB/s, tuning took 0.057470 seconds at Thu Aug  8 14:21:48 2024
        16x8x8x8	N4quda9CopyGaugeINS_12CopyGaugeArgIddLi18ELb0ENS_5gauge11FloatNOrderIdLi18ELi2ELi12EL20QudaStaggeredPhase_s0ELb1EL19QudaGhostExchange_sn2147483648ELb0EEES6_EEEE	GPU-offline,vol=8192stride=4608precision=8geometry=4Nc=3,vol=8192stride=4608precision=8geometry=4Nc=3,ghost	64	1	1	8	1	8	2458	-1	-1	-1	-1	5.19314e-06	# 0.00 Gflop/s, 149.07 GB/s, tuning took 0.039479 seconds at Thu Aug  8 14:21:48 2024
        16x8x8x8	N4quda9CopyGaugeINS_12CopyGaugeArgIddLi18ELb0ENS_5gauge8QDPOrderIdLi18EEENS2_11FloatNOrderIdLi18ELi2ELi12EL20QudaStaggeredPhase_s0ELb1EL19QudaGhostExchange_sn2147483648ELb0EEEEEEE	GPU-offline,vol=8192stride=4608precision=8geometry=4Nc=3,vol=8192stride=4096precision=8geometry=4Nc=3	32	1	3	128	1	3	3277	-1	-1	-1	-1	1.34242e-05	# 0.00 Gflop/s, 615.12 GB/s, tuning took 0.046205 seconds at Thu Aug  8 14:21:49 2024
        16x8x8x8	N4quda9CopyGaugeINS_12CopyGaugeArgIfdLi18ELb0ENS_5gauge11FloatNOrderIfLi18ELi4ELi12EL20QudaStaggeredPhase_s0ELb1EL19QudaGhostExchange_sn2147483648ELb0EEENS3_IdLi18ELi2ELi12ELS4_0ELb1ELS5_n2147483648ELb0EEEEEEE	GPU-offline,vol=8192stride=4608precision=8geometry=4Nc=3,vol=8192stride=4608precision=4geometry=4Nc=3	64	1	1	64	1	8	3073	-1	-1	-1	-1	9.57126e-06	# 0.00 Gflop/s, 554.62 GB/s, tuning took 0.032491 seconds at Thu Aug  8 14:21:48 2024
        16x8x8x8	N4quda9CopyGaugeINS_12CopyGaugeArgIfdLi18ELb0ENS_5gauge11FloatNOrderIfLi18ELi4ELi12EL20QudaStaggeredPhase_s0ELb1EL19QudaGhostExchange_sn2147483648ELb0EEENS3_IdLi18ELi2ELi12ELS4_0ELb1ELS5_n2147483648ELb0EEEEEEE	GPU-offline,vol=8192stride=4608precision=8geometry=4Nc=3,vol=8192stride=4608precision=4geometry=4Nc=3,ghost	96	1	1	6	1	8	0	-1	-1	-1	-1	6.21505e-06	# 0.00 Gflop/s, 93.42 GB/s, tuning took 0.035527 seconds at Thu Aug  8 14:21:48 2024
        16x8x8x8	N4quda9CopyGaugeINS_12CopyGaugeArgIsdLi18ELb0ENS_5gauge11FloatNOrderIsLi18ELi4ELi12EL20QudaStaggeredPhase_s0ELb1EL19QudaGhostExchange_sn2147483648ELb0EEENS3_IdLi18ELi2ELi12ELS4_0ELb1ELS5_n2147483648ELb0EEEEEEE	GPU-offline,vol=8192stride=4608precision=8geometry=4Nc=3,vol=8192stride=4608precision=2geometry=4Nc=3	64	1	1	64	1	8	2235	-1	-1	-1	-1	1.01964e-05	# 0.00 Gflop/s, 433.85 GB/s, tuning took 0.038922 seconds at Thu Aug  8 14:21:48 2024
        16x8x8x8	N4quda9CopyGaugeINS_12CopyGaugeArgIsdLi18ELb0ENS_5gauge11FloatNOrderIsLi18ELi4ELi12EL20QudaStaggeredPhase_s0ELb1EL19QudaGhostExchange_sn2147483648ELb0EEENS3_IdLi18ELi2ELi12ELS4_0ELb1ELS5_n2147483648ELb0EEEEEEE	GPU-offline,vol=8192stride=4608precision=8geometry=4Nc=3,vol=8192stride=4608precision=2geometry=4Nc=3,ghost	96	1	2	6	1	4	16385	-1	-1	-1	-1	6.47001e-06	# 0.00 Gflop/s, 74.78 GB/s, tuning took 0.035630 seconds at Thu Aug  8 14:21:48 2024
         2359296	N4quda15TransformReduceINS_7maximumIdEEKNS_7complexIdEEmNS_8abs_max_IddEENS_8identityEEE	GPU-offline,batch_size=1	512	1	1	47	1	1	0	-1	-1	-1	-1	0.000177664	# 0.00 Gflop/s, 212.47 GB/s, tuning took 0.809951 seconds at Wed Aug 14 14:52:09 2024
     24x24x24x72	N4quda10GaugeGaussIdLi3EL21QudaReconstructType_s12EEE	GPU-offline,vol=995328stride=518400precision=8geometry=4Nc=3,lie_group	64	1	1	7776	2	1	2235	-1	-1	-1	-1	0.0536262	# 0.00 Gflop/s, 7.42 GB/s, tuning took 34.560697 seconds at Wed Aug 14 09:50:25 2024
     24x24x24x72	N4quda12ExtractGhostIdLi3ENS_5gauge11FloatNOrderIdLi18ELi2ELi12EL20QudaStaggeredPhase_s0ELb1EL19QudaGhostExchange_sn2147483648ELb0EEEEE	GPU-offline,vol=995328stride=518400precision=8geometry=4Nc=3,extract	32	1	8	1296	1	1	16385	-1	-1	-1	-1	0.000127431	# 0.00 Gflop/s, 208.29 GB/s, tuning took 0.235320 seconds at Wed Aug 14 09:48:50 2024
     24x24x24x72	N4quda15CopyColorSpinorILi4ELi3ENS_11colorspinor11FloatNOrderIdLi4ELi3ELi2ELb0ELb0EEENS1_21SpaceSpinorColorOrderIdLi4ELi3EEESt5tupleIJRNS_16ColorSpinorFieldERKS7_19QudaFieldLocation_sPdPKdEEEE	GPU-offline,vol=995328,parity=2,precision=8,order=9,Ns=4,Nc=3vol=995328,parity=2,precision=8,order=2,Ns=4,Nc=3,NonRelBasis	480	1	1	1037	2	1	0	-1	-1	-1	-1	0.00174694	# 0.00 Gflop/s, 218.79 GB/s, tuning took 0.348235 seconds at Wed Aug 14 09:50:31 2024
     24x24x24x72	N4quda4blas5Norm2IddEE	GPU-offline,nParity=2,vol=995328,parity=2,precision=8,order=2,Ns=4,Nc=3	896	1	1	33	1	1	0	-1	-1	-1	-1	0.000902837	# 52.92 Gflop/s, 211.67 GB/s, tuning took 9.010731 seconds at Wed Aug 14 09:50:40 2024
     24x24x24x72	N4quda7RNGInitE	GPU-offline,vol=995328stride=518400precision=8geometry=4Nc=3	128	1	1	3888	2	1	0	-1	-1	-1	-1	0.402264	# 0.00 Gflop/s, 0.00 GB/s, tuning took 54.265777 seconds at Wed Aug 14 09:49:50 2024
     24x24x24x72	N4quda9CopyGaugeINS_12CopyGaugeArgIddLi18ELb0ENS_5gauge11FloatNOrderIdLi18ELi2ELi12EL20QudaStaggeredPhase_s0ELb1EL19QudaGhostExchange_sn2147483648ELb0EEENS2_8QDPOrderIdLi18EEEEEEE	GPU-offline,vol=995328stride=497664precision=8geometry=4Nc=3,vol=995328stride=518400precision=8geometry=4Nc=3	32	1	2	15552	1	4	6145	-1	-1	-1	-1	0.00413696	# 0.00 Gflop/s, 234.82 GB/s, tuning took 5.254415 seconds at Wed Aug 14 09:48:50 2024
     24x24x24x72	N4quda9CopyGaugeINS_12CopyGaugeArgIddLi18ELb0ENS_5gauge11FloatNOrderIdLi18ELi2ELi12EL20QudaStaggeredPhase_s0ELb1EL19QudaGhostExchange_sn2147483648ELb0EEES6_EEEE	GPU-offline,vol=995328stride=518400precision=8geometry=4Nc=3,vol=995328stride=518400precision=8geometry=4Nc=3,ghost	64	1	5	324	1	2	0	-1	-1	-1	-1	2.3343e-05	# 0.00 Gflop/s, 1184.42 GB/s, tuning took 0.065148 seconds at Wed Aug 14 09:48:50 2024
     24x24x24x72	N4quda9CopyGaugeINS_12CopyGaugeArgIddLi18ELb0ENS_5gauge8QDPOrderIdLi18EEENS2_11FloatNOrderIdLi18ELi2ELi12EL20QudaStaggeredPhase_s0ELb1EL19QudaGhostExchange_sn2147483648ELb0EEEEEEE	GPU-offline,vol=995328stride=518400precision=8geometry=4Nc=3,vol=995328stride=497664precision=8geometry=4Nc=3	32	1	3	15552	1	3	5462	-1	-1	-1	-1	0.00420215	# 0.00 Gflop/s, 231.18 GB/s, tuning took 5.348756 seconds at Wed Aug 14 09:50:30 2024
     24x24x24x72	N4quda9CopyGaugeINS_12CopyGaugeArgIfdLi18ELb0ENS_5gauge11FloatNOrderIfLi18ELi4ELi12EL20QudaStaggeredPhase_s0ELb1EL19QudaGhostExchange_sn2147483648ELb0EEENS3_IdLi18ELi2ELi12ELS4_0ELb1ELS5_n2147483648ELb0EEEEEEE	GPU-offline,vol=995328stride=518400precision=8geometry=4Nc=3,vol=995328stride=518400precision=4geometry=4Nc=3	96	1	1	5184	1	8	4097	-1	-1	-1	-1	0.00242995	# 0.00 Gflop/s, 245.76 GB/s, tuning took 3.100772 seconds at Wed Aug 14 09:48:56 2024
     24x24x24x72	N4quda9CopyGaugeINS_12CopyGaugeArgIfdLi18ELb0ENS_5gauge11FloatNOrderIfLi18ELi4ELi12EL20QudaStaggeredPhase_s0ELb1EL19QudaGhostExchange_sn2147483648ELb0EEENS3_IdLi18ELi2ELi12ELS4_0ELb1ELS5_n2147483648ELb0EEEEEEE	GPU-offline,vol=995328stride=518400precision=8geometry=4Nc=3,vol=995328stride=518400precision=4geometry=4Nc=3,ghost	192	1	1	108	1	8	0	-1	-1	-1	-1	3.1424e-05	# 0.00 Gflop/s, 659.88 GB/s, tuning took 0.082149 seconds at Wed Aug 14 09:48:56 2024
     24x24x24x72	N4quda9CopyGaugeINS_12CopyGaugeArgIsdLi18ELb0ENS_5gauge11FloatNOrderIsLi18ELi4ELi12EL20QudaStaggeredPhase_s0ELb1EL19QudaGhostExchange_sn2147483648ELb0EEENS3_IdLi18ELi2ELi12ELS4_0ELb1ELS5_n2147483648ELb0EEEEEEE	GPU-offline,vol=995328stride=518400precision=8geometry=4Nc=3,vol=995328stride=518400precision=2geometry=4Nc=3	32	1	4	15552	1	2	9831	-1	-1	-1	-1	0.00198963	# 0.00 Gflop/s, 250.13 GB/s, tuning took 2.528507 seconds at Wed Aug 14 09:48:52 2024
     24x24x24x72	N4quda9CopyGaugeINS_12CopyGaugeArgIsdLi18ELb0ENS_5gauge11FloatNOrderIsLi18ELi4ELi12EL20QudaStaggeredPhase_s0ELb1EL19QudaGhostExchange_sn2147483648ELb0EEENS3_IdLi18ELi2ELi12ELS4_0ELb1ELS5_n2147483648ELb0EEEEEEE	GPU-offline,vol=995328stride=518400precision=8geometry=4Nc=3,vol=995328stride=518400precision=2geometry=4Nc=3,ghost	32	1	1	648	1	8	0	-1	-1	-1	-1	3.136e-05	# 0.00 Gflop/s, 551.02 GB/s, tuning took 0.085466 seconds at Wed Aug 14 09:48:52 2024
     32x32x32x64	N4quda10GaugeGaussIdLi3EL21QudaReconstructType_s12EEE	GPU-offline,vol=2097152stride=1081344precision=8geometry=4Nc=3,lie_group	32	2	1	32768	1	1	2587	-1	-1	-1	-1	0.116362	# 0.00 Gflop/s, 7.14 GB/s, tuning took 73.301867 seconds at Thu Aug  8 16:28:20 2024
     32x32x32x64	N4quda12ExtractGhostIdLi3ENS_5gauge11FloatNOrderIdLi18ELi2ELi12EL20QudaStaggeredPhase_s0ELb1EL19QudaGhostExchange_sn2147483648ELb0EEEEE	GPU-offline,vol=2097152stride=1081344precision=8geometry=4Nc=3,extract	64	1	4	1024	1	2	8193	-1	-1	-1	-1	0.000211968	# 0.00 Gflop/s, 207.77 GB/s, tuning took 0.314873 seconds at Thu Aug  8 16:24:54 2024
     32x32x32x64	N4quda7RNGInitE	GPU-offline,vol=2097152stride=1081344precision=8geometry=4Nc=3	256	1	1	4096	2	1	0	-1	-1	-1	-1	0.907387	# 0.00 Gflop/s, 0.00 GB/s, tuning took 118.739760 seconds at Thu Aug  8 16:27:05 2024
     32x32x32x64	N4quda9CopyGaugeINS_12CopyGaugeArgIddLi18ELb0ENS_5gauge11FloatNOrderIdLi18ELi2ELi12EL20QudaStaggeredPhase_s0ELb1EL19QudaGhostExchange_sn2147483648ELb0EEENS2_8QDPOrderIdLi18EEEEEEE	GPU-offline,vol=2097152stride=1048576precision=8geometry=4Nc=3,vol=2097152stride=1081344precision=8geometry=4Nc=3	64	1	1	16384	1	8	4097	-1	-1	-1	-1	0.00864939	# 0.00 Gflop/s, 235.67 GB/s, tuning took 10.727769 seconds at Thu Aug  8 16:24:54 2024
     32x32x32x64	N4quda9CopyGaugeINS_12CopyGaugeArgIddLi18ELb0ENS_5gauge11FloatNOrderIdLi18ELi2ELi12EL20QudaStaggeredPhase_s0ELb1EL19QudaGhostExchange_sn2147483648ELb0EEES6_EEEE	GPU-offline,vol=2097152stride=1081344precision=8geometry=4Nc=3,vol=2097152stride=1081344precision=8geometry=4Nc=3,ghost	128	1	1	256	1	8	0	-1	-1	-1	-1	0.000150136	# 0.00 Gflop/s, 302.50 GB/s, tuning took 0.224812 seconds at Thu Aug  8 16:24:55 2024
     32x32x32x64	N4quda9CopyGaugeINS_12CopyGaugeArgIddLi18ELb0ENS_5gauge8QDPOrderIdLi18EEENS2_11FloatNOrderIdLi18ELi2ELi12EL20QudaStaggeredPhase_s0ELb1EL19QudaGhostExchange_sn2147483648ELb0EEEEEEE	GPU-offline,vol=2097152stride=1081344precision=8geometry=4Nc=3,vol=2097152stride=1048576precision=8geometry=4Nc=3	96	1	1	10923	1	8	24577	-1	-1	-1	-1	0.00870673	# 0.00 Gflop/s, 234.12 GB/s, tuning took 10.971348 seconds at Thu Aug  8 16:28:31 2024
     32x32x32x64	N4quda9CopyGaugeINS_12CopyGaugeArgIfdLi18ELb0ENS_5gauge11FloatNOrderIfLi18ELi4ELi12EL20QudaStaggeredPhase_s0ELb1EL19QudaGhostExchange_sn2147483648ELb0EEENS3_IdLi18ELi2ELi12ELS4_0ELb1ELS5_n2147483648ELb0EEEEEEE	GPU-offline,vol=2097152stride=1081344precision=8geometry=4Nc=3,vol=2097152stride=1081344precision=4geometry=4Nc=3	32	1	4	32768	1	2	5462	-1	-1	-1	-1	0.00518487	# 0.00 Gflop/s, 240.26 GB/s, tuning took 6.695955 seconds at Thu Aug  8 16:25:07 2024
     32x32x32x64	N4quda9CopyGaugeINS_12CopyGaugeArgIfdLi18ELb0ENS_5gauge11FloatNOrderIfLi18ELi4ELi12EL20QudaStaggeredPhase_s0ELb1EL19QudaGhostExchange_sn2147483648ELb0EEENS3_IdLi18ELi2ELi12ELS4_0ELb1ELS5_n2147483648ELb0EEEEEEE	GPU-offline,vol=2097152stride=1081344precision=8geometry=4Nc=3,vol=2097152stride=1081344precision=4geometry=4Nc=3,ghost	32	1	6	1024	1	2	0	-1	-1	-1	-1	5.20101e-05	# 0.00 Gflop/s, 654.92 GB/s, tuning took 0.137562 seconds at Thu Aug  8 16:25:07 2024
     32x32x32x64	N4quda9CopyGaugeINS_12CopyGaugeArgIsdLi18ELb0ENS_5gauge11FloatNOrderIsLi18ELi4ELi12EL20QudaStaggeredPhase_s0ELb1EL19QudaGhostExchange_sn2147483648ELb0EEENS3_IdLi18ELi2ELi12ELS4_0ELb1ELS5_n2147483648ELb0EEEEEEE	GPU-offline,vol=2097152stride=1081344precision=8geometry=4Nc=3,vol=2097152stride=1081344precision=2geometry=4Nc=3	32	1	4	32768	1	2	9831	-1	-1	-1	-1	0.004224	# 0.00 Gflop/s, 245.76 GB/s, tuning took 5.158838 seconds at Thu Aug  8 16:25:00 2024
     32x32x32x64	N4quda9CopyGaugeINS_12CopyGaugeArgIsdLi18ELb0ENS_5gauge11FloatNOrderIsLi18ELi4ELi12EL20QudaStaggeredPhase_s0ELb1EL19QudaGhostExchange_sn2147483648ELb0EEENS3_IdLi18ELi2ELi12ELS4_0ELb1ELS5_n2147483648ELb0EEEEEEE	GPU-offline,vol=2097152stride=1081344precision=8geometry=4Nc=3,vol=2097152stride=1081344precision=2geometry=4Nc=3,ghost	32	1	1	1024	1	8	0	-1	-1	-1	-1	5.18144e-05	# 0.00 Gflop/s, 547.83 GB/s, tuning took 0.155125 seconds at Thu Aug  8 16:25:00 2024
         4718592	N4quda15TransformReduceINS_7maximumIdEEKNS_7complexIdEEmNS_8abs_max_IddEENS_8identityEEE	GPU-offline,batch_size=1	512	1	1	44	1	1	0	-1	-1	-1	-1	0.000367008	# 0.00 Gflop/s, 205.71 GB/s, tuning took 1.649735 seconds at Wed Aug 14 14:27:55 2024
        4x8x8x16	N4quda15CopyColorSpinorILi4ELi3ENS_11colorspinor11FloatNOrderIdLi4ELi3ELi2ELb0ELb0EEENS1_21SpaceSpinorColorOrderIdLi4ELi3EEESt5tupleIJRNS_16ColorSpinorFieldERKS7_19QudaFieldLocation_sPdPKdEEEE	GPU-offline,vol=4096,parity=1,precision=8,order=9,Ns=4,Nc=3vol=4096,parity=1,precision=8,order=2,Ns=4,Nc=3,NonRelBasis	96	1	1	43	1	1	0	-1	-1	-1	-1	6.03649e-06	# 0.00 Gflop/s, 260.56 GB/s, tuning took 0.020219 seconds at Tue Aug 13 18:13:24 2024
        4x8x8x16	N4quda15CopyColorSpinorILi4ELi3ENS_11colorspinor11FloatNOrderIdLi4ELi3ELi2ELb0ELb0EEES3_St5tupleIJRNS_16ColorSpinorFieldERKS5_19QudaFieldLocation_sPdPKdEEEE	GPU-offline,vol=4096,parity=1,precision=8,order=2,Ns=4,Nc=3vol=4096,parity=1,precision=8,order=2,Ns=4,Nc=3,PreserveBasis	320	1	1	13	1	1	0	-1	-1	-1	-1	9.55037e-06	# 0.00 Gflop/s, 164.69 GB/s, tuning took 0.028727 seconds at Tue Aug 13 20:18:32 2024
        4x8x8x16	N4quda15CopyColorSpinorILi4ELi3ENS_11colorspinor11FloatNOrderIsLi4ELi3ELi8ELb0ELb0EEENS2_IdLi4ELi3ELi2ELb0ELb0EEESt5tupleIJRNS_16ColorSpinorFieldERKS6_19QudaFieldLocation_sPsPKdEEEE	GPU-offline,vol=4096,parity=1,precision=8,order=2,Ns=4,Nc=3vol=4096,parity=1,precision=2,order=8,Ns=4,Nc=3,PreserveBasis	64	1	1	64	1	1	0	-1	-1	-1	-1	6.09176e-06	# 0.00 Gflop/s, 164.06 GB/s, tuning took 0.019949 seconds at Tue Aug 13 20:18:32 2024
        4x8x8x16	N4quda15CopyColorSpinorILi4ELi3ENS_11colorspinor11FloatNOrderIsLi4ELi3ELi8ELb0ELb0EEES3_St5tupleIJRNS_16ColorSpinorFieldERKS5_19QudaFieldLocation_sPsPKsEEEE	GPU-offline,vol=4096,parity=1,precision=2,order=8,Ns=4,Nc=3vol=4096,parity=1,precision=2,order=8,Ns=4,Nc=3,PreserveBasis	128	1	1	32	1	1	0	-1	-1	-1	-1	5.41212e-06	# 0.00 Gflop/s, 78.71 GB/s, tuning took 0.025966 seconds at Tue Aug 13 20:18:32 2024
        4x8x8x16	N4quda15CopyColorSpinorILi4ELi3ENS_11colorspinor21SpaceSpinorColorOrderIdLi4ELi3EEENS1_11FloatNOrderIdLi4ELi3ELi2ELb0ELb0EEESt5tupleIJRNS_16ColorSpinorFieldERKS7_19QudaFieldLocation_sPdPKdEEEE	GPU-offline,vol=4096,parity=1,precision=8,order=2,Ns=4,Nc=3vol=4096,parity=1,precision=8,order=9,Ns=4,Nc=3,RelBasis	96	1	1	43	1	1	0	-1	-1	-1	-1	6.02894e-06	# 0.00 Gflop/s, 260.89 GB/s, tuning took 0.016326 seconds at Tue Aug 13 18:13:24 2024
        4x8x8x16	N4quda4blas10multiaxpy_IdEE	GPU-offline,vol=4096,parity=1,precision=2,order=8,Ns=4,Nc=3,vol=4096,parity=1,precision=8,order=2,Ns=4,Nc=3,Nxz=1,Nyw=1	160	1	1	48	1	1	0	1	0	0	0	1.07776e-05	# 18.24 Gflop/s, 165.70 GB/s, tuning took 0.024902 seconds at Tue Aug 13 20:18:33 2024
        4x8x8x16	N4quda4blas11axpbyzNorm2IddEE	GPU-offline,nParity=1,vol=4096,parity=1,precision=8,order=2,Ns=4,Nc=3	160	1	1	41	1	1	0	-1	-1	-1	-1	2.27061e-05	# 17.32 Gflop/s, 103.91 GB/s, tuning took 0.239793 seconds at Tue Aug 13 20:18:33 2024
        4x8x8x16	N4quda4blas11axpyCGNorm2IdfEE	GPU-offline,nParity=1,vol=4096,parity=1,precision=2,order=8,Ns=4,Nc=3	96	1	1	48	1	1	0	-1	-1	-1	-1	2.548e-05	# 23.15 Gflop/s, 25.08 GB/s, tuning took 0.218825 seconds at Tue Aug 13 20:18:33 2024
        4x8x8x16	N4quda4blas23HeavyQuarkResidualNorm_IddEE	GPU-offline,nParity=1,vol=4096,parity=1,precision=8,order=2,Ns=4,Nc=3	96	1	1	22	1	1	0	-1	-1	-1	-1	2.30692e-05	# 17.05 Gflop/s, 68.18 GB/s, tuning took 0.266178 seconds at Tue Aug 13 20:18:34 2024
        4x8x8x16	N4quda4blas3DotIdfEE	GPU-offline,nParity=1,vol=4096,parity=1,precision=2,order=8,Ns=4,Nc=3	224	1	1	34	1	1	0	-1	-1	-1	-1	2.31767e-05	# 8.48 Gflop/s, 18.38 GB/s, tuning took 0.265151 seconds at Tue Aug 13 20:18:33 2024
        4x8x8x16	N4quda4blas4CdotIdfEE	GPU-offline,nParity=1,vol=4096,parity=1,precision=2,order=8,Ns=4,Nc=3	32	1	1	23	1	1	0	-1	-1	-1	-1	2.5181e-05	# 15.62 Gflop/s, 16.92 GB/s, tuning took 0.282028 seconds at Tue Aug 13 20:18:34 2024
        4x8x8x16	N4quda4blas5Norm2IddEE	GPU-offline,nParity=1,vol=4096,parity=1,precision=8,order=2,Ns=4,Nc=3	256	1	1	18	1	1	0	-1	-1	-1	-1	2.19004e-05	# 8.98 Gflop/s, 35.91 GB/s, tuning took 0.251313 seconds at Tue Aug 13 20:18:32 2024
        4x8x8x16	N4quda4blas6caxpy_IfEE	GPU-offline,vol=4096,parity=1,precision=2,order=8,Ns=4,Nc=3	352	1	1	48	1	1	0	-1	-1	-1	-1	5.16795e-06	# 76.09 Gflop/s, 123.64 GB/s, tuning took 0.023841 seconds at Tue Aug 13 20:18:34 2024
        4x8x8x16	N4quda4blas7axpbyz_IdEE	GPU-offline,vol=4096,parity=1,precision=8,order=2,Ns=4,Nc=3	480	1	1	48	1	1	0	-1	-1	-1	-1	6.23325e-06	# 47.31 Gflop/s, 378.50 GB/s, tuning took 0.017992 seconds at Tue Aug 13 20:18:33 2024
        4x8x8x16	N4quda4blas7axpbyz_IfEE	GPU-offline,vol=4096,parity=1,precision=2,order=8,Ns=4,Nc=3	160	1	1	48	1	1	0	-1	-1	-1	-1	5.23703e-06	# 56.31 Gflop/s, 122.01 GB/s, tuning took 0.021284 seconds at Tue Aug 13 20:18:34 2024
        4x8x8x16	N4quda4blas9axpyZpbx_IdEE	GPU-offline,vol=4096,parity=1,precision=2,order=8,Ns=4,Nc=3,vol=4096,parity=1,precision=8,order=2,Ns=4,Nc=3	96	1	1	48	1	1	0	-1	-1	-1	-1	1.28713e-05	# 30.55 Gflop/s, 171.84 GB/s, tuning took 0.017756 seconds at Tue Aug 13 20:18:33 2024
        4x8x8x16	N4quda6WilsonINS_9WilsonArgIdLi3ELi4EL21QudaReconstructType_s12EEEEE	policy,commDim=0000,dagger,parity=1,topo=1111,p2p=0,gdr=0,nvshmem=0,pol=110000111100110000	32	1	1	1	1	1	0	1	0	0	-1	5.23857e-05	# 103.21 Gflop/s, 180.15 GB/s, tuning took 0.012540 seconds at Tue Aug 13 20:18:32 2024
        4x8x8x16	N4quda6WilsonINS_9WilsonArgIdLi3ELi4EL21QudaReconstructType_s12EEEEE	policy,commDim=0000,parity=1,topo=1111,p2p=0,gdr=0,nvshmem=0,pol=110000111100110000	32	1	1	1	1	1	0	7	0	0	-1	5.23318e-05	# 103.32 Gflop/s, 180.33 GB/s, tuning took 0.011039 seconds at Tue Aug 13 18:13:24 2024
        4x8x8x16	N4quda6WilsonINS_9WilsonArgIdLi3ELi4EL21QudaReconstructType_s12EEEEE	policy,commDim=0000,xpay,dagger,parity=1,topo=1111,p2p=0,gdr=0,nvshmem=0,pol=110000111100110000	32	1	1	1	1	1	0	1	0	0	-1	5.34686e-05	# 104.80 Gflop/s, 176.50 GB/s, tuning took 0.012891 seconds at Tue Aug 13 20:18:32 2024
        4x8x8x16	N4quda6WilsonINS_9WilsonArgIdLi3ELi4EL21QudaReconstructType_s12EEEEE	policy,commDim=0000,xpay,parity=1,topo=1111,p2p=0,gdr=0,nvshmem=0,pol=110000111100110000	32	1	1	1	1	1	0	0	0	0	-1	5.31402e-05	# 105.44 Gflop/s, 177.59 GB/s, tuning took 0.011713 seconds at Tue Aug 13 20:18:32 2024
        4x8x8x16	N4quda6WilsonINS_9WilsonArgIdLi3ELi4EL21QudaReconstructType_s12EEEEE	policy_kernel=interior,comm=0000,commDim=0000,dagger,parity=1	192	1	1	22	1	1	25345	-1	-1	-1	-1	5.24396e-05	# 103.10 Gflop/s, 179.96 GB/s, tuning took 0.078907 seconds at Tue Aug 13 20:18:32 2024
        4x8x8x16	N4quda6WilsonINS_9WilsonArgIdLi3ELi4EL21QudaReconstructType_s12EEEEE	policy_kernel=interior,comm=0000,commDim=0000,parity=1	192	1	1	22	1	1	25345	-1	-1	-1	-1	5.22779e-05	# 103.42 Gflop/s, 180.52 GB/s, tuning took 0.144619 seconds at Tue Aug 13 18:13:24 2024
        4x8x8x16	N4quda6WilsonINS_9WilsonArgIdLi3ELi4EL21QudaReconstructType_s12EEEEE	policy_kernel=interior,comm=0000,commDim=0000,xpay,dagger,parity=1	192	1	1	22	1	1	20276	-1	-1	-1	-1	5.34636e-05	# 104.81 Gflop/s, 176.52 GB/s, tuning took 0.080159 seconds at Tue Aug 13 20:18:32 2024
        4x8x8x16	N4quda6WilsonINS_9WilsonArgIdLi3ELi4EL21QudaReconstructType_s12EEEEE	policy_kernel=interior,comm=0000,commDim=0000,xpay,parity=1	192	1	1	22	1	1	0	-1	-1	-1	-1	5.31402e-05	# 105.44 Gflop/s, 177.59 GB/s, tuning took 0.132803 seconds at Tue Aug 13 20:18:32 2024
        4x8x8x16	N4quda6WilsonINS_9WilsonArgIsLi3ELi4EL21QudaReconstructType_s12EEEEE	policy,commDim=0000,dagger,parity=1,topo=1111,p2p=0,gdr=0,nvshmem=0,pol=110000111100110000	32	1	1	1	1	1	0	0	0	0	-1	8.52637e-06	# 634.12 Gflop/s, 292.08 GB/s, tuning took 0.008623 seconds at Tue Aug 13 20:18:33 2024
        4x8x8x16	N4quda6WilsonINS_9WilsonArgIsLi3ELi4EL21QudaReconstructType_s12EEEEE	policy,commDim=0000,parity=1,topo=1111,p2p=0,gdr=0,nvshmem=0,pol=110000111100110000	32	1	1	1	1	1	0	1	0	0	-1	8.4497e-06	# 639.87 Gflop/s, 294.73 GB/s, tuning took 0.018870 seconds at Tue Aug 13 20:18:32 2024
        4x8x8x16	N4quda6WilsonINS_9WilsonArgIsLi3ELi4EL21QudaReconstructType_s12EEEEE	policy,commDim=0000,xpay,dagger,parity=1,topo=1111,p2p=0,gdr=0,nvshmem=0,pol=110000111100110000	32	1	1	1	1	1	0	0	0	0	-1	8.36869e-06	# 669.56 Gflop/s, 297.59 GB/s, tuning took 0.022305 seconds at Tue Aug 13 20:18:33 2024
        4x8x8x16	N4quda6WilsonINS_9WilsonArgIsLi3ELi4EL21QudaReconstructType_s12EEEEE	policy,commDim=0000,xpay,parity=1,topo=1111,p2p=0,gdr=0,nvshmem=0,pol=110000111100110000	32	1	1	1	1	1	0	0	0	0	-1	8.23588e-06	# 680.36 Gflop/s, 302.39 GB/s, tuning took 0.017108 seconds at Tue Aug 13 20:18:33 2024
        4x8x8x16	N4quda6WilsonINS_9WilsonArgIsLi3ELi4EL21QudaReconstructType_s12EEEEE	policy_kernel=interior,comm=0000,commDim=0000,dagger,parity=1	48	1	1	86	1	1	4408	-1	-1	-1	-1	8.23269e-06	# 656.74 Gflop/s, 302.50 GB/s, tuning took 0.035210 seconds at Tue Aug 13 20:18:33 2024
        4x8x8x16	N4quda6WilsonINS_9WilsonArgIsLi3ELi4EL21QudaReconstructType_s12EEEEE	policy_kernel=interior,comm=0000,commDim=0000,parity=1	32	1	1	128	1	1	10138	-1	-1	-1	-1	8.02246e-06	# 673.95 Gflop/s, 310.42 GB/s, tuning took 0.033910 seconds at Tue Aug 13 20:18:32 2024
        4x8x8x16	N4quda6WilsonINS_9WilsonArgIsLi3ELi4EL21QudaReconstructType_s12EEEEE	policy_kernel=interior,comm=0000,commDim=0000,xpay,dagger,parity=1	32	1	1	128	1	1	4828	-1	-1	-1	-1	1.30267e-05	# 430.14 Gflop/s, 191.18 GB/s, tuning took 0.039291 seconds at Tue Aug 13 20:18:33 2024
        4x8x8x16	N4quda6WilsonINS_9WilsonArgIsLi3ELi4EL21QudaReconstructType_s12EEEEE	policy_kernel=interior,comm=0000,commDim=0000,xpay,parity=1	32	1	1	128	1	1	4828	-1	-1	-1	-1	7.91893e-06	# 707.59 Gflop/s, 314.49 GB/s, tuning took 0.033232 seconds at Tue Aug 13 20:18:33 2024
         4x8x8x8	N4quda15CopyColorSpinorILi4ELi3ENS_11colorspinor11FloatNOrderIdLi4ELi3ELi2ELb0ELb0EEENS1_21SpaceSpinorColorOrderIdLi4ELi3EEESt5tupleIJRNS_16ColorSpinorFieldERKS7_19QudaFieldLocation_sPdPKdEEEE	GPU-offline,vol=2048,parity=1,precision=8,order=9,Ns=4,Nc=3vol=2048,parity=1,precision=8,order=2,Ns=4,Nc=3,NonRelBasis	160	1	1	13	1	1	0	-1	-1	-1	-1	5.95127e-06	# 0.00 Gflop/s, 132.15 GB/s, tuning took 0.021551 seconds at Thu Aug  8 11:59:53 2024
         4x8x8x8	N4quda15CopyColorSpinorILi4ELi3ENS_11colorspinor21SpaceSpinorColorOrderIdLi4ELi3EEENS1_11FloatNOrderIdLi4ELi3ELi2ELb0ELb0EEESt5tupleIJRNS_16ColorSpinorFieldERKS7_19QudaFieldLocation_sPdPKdEEEE	GPU-offline,vol=2048,parity=1,precision=8,order=2,Ns=4,Nc=3vol=2048,parity=1,precision=8,order=9,Ns=4,Nc=3,RelBasis	96	1	1	22	1	1	0	-1	-1	-1	-1	9.46539e-06	# 0.00 Gflop/s, 83.08 GB/s, tuning took 0.026916 seconds at Thu Aug  8 11:59:54 2024
         4x8x8x8	N4quda6WilsonINS_9WilsonArgIdLi3ELi4EL21QudaReconstructType_s12EEEEE	policy,commDim=0000,parity=1,topo=1111,p2p=0,gdr=0,nvshmem=0,pol=110000111100110000	32	1	1	1	1	1	0	9	0	0	-1	2.86427e-05	# 94.38 Gflop/s, 164.74 GB/s, tuning took 0.012070 seconds at Thu Aug  8 11:59:54 2024
         4x8x8x8	N4quda6WilsonINS_9WilsonArgIdLi3ELi4EL21QudaReconstructType_s12EEEEE	policy_kernel=interior,comm=0000,commDim=0000,parity=1	32	1	1	64	1	1	6337	-1	-1	-1	-1	2.86135e-05	# 94.48 Gflop/s, 164.91 GB/s, tuning took 0.144516 seconds at Thu Aug  8 11:59:54 2024
      8x16x16x16	N4quda15CopyColorSpinorILi4ELi3ENS_11colorspinor11FloatNOrderIdLi4ELi3ELi2ELb0ELb0EEENS1_21SpaceSpinorColorOrderIdLi4ELi3EEESt5tupleIJRNS_16ColorSpinorFieldERKS7_19QudaFieldLocation_sPdPKdEEEE	GPU-offline,vol=32768,parity=1,precision=8,order=9,Ns=4,Nc=3vol=32768,parity=1,precision=8,order=2,Ns=4,Nc=3,NonRelBasis	352	1	1	94	1	1	0	-1	-1	-1	-1	2.15426e-05	# 0.00 Gflop/s, 584.09 GB/s, tuning took 0.019171 seconds at Thu Aug  8 14:24:48 2024
      8x16x16x16	N4quda15CopyColorSpinorILi4ELi3ENS_11colorspinor21SpaceSpinorColorOrderIdLi4ELi3EEENS1_11FloatNOrderIdLi4ELi3ELi2ELb0ELb0EEESt5tupleIJRNS_16ColorSpinorFieldERKS7_19QudaFieldLocation_sPdPKdEEEE	GPU-offline,vol=32768,parity=1,precision=8,order=2,Ns=4,Nc=3vol=32768,parity=1,precision=8,order=9,Ns=4,Nc=3,RelBasis	64	1	1	512	1	1	0	-1	-1	-1	-1	1.76128e-05	# 0.00 Gflop/s, 714.42 GB/s, tuning took 0.014615 seconds at Thu Aug  8 14:24:48 2024
      8x16x16x16	N4quda26WilsonCloverPreconditionedINS_15WilsonCloverArgIdLi3ELi4EL21QudaReconstructType_s12EEEEE	policy,commDim=0000,parity=1,topo=1111,p2p=0,gdr=0,nvshmem=0,pol=110000111100110000	32	1	1	1	1	1	0	6	0	0	-1	0.000453973	# 131.66 Gflop/s, 207.88 GB/s, tuning took 0.029530 seconds at Wed Aug 14 14:52:10 2024
      8x16x16x16	N4quda26WilsonCloverPreconditionedINS_15WilsonCloverArgIdLi3ELi4EL21QudaReconstructType_s12EEEEE	policy_kernel=interior,comm=0000,commDim=0000,parity=1	32	1	1	1024	1	1	12673	-1	-1	-1	-1	0.000453973	# 131.66 Gflop/s, 207.88 GB/s, tuning took 0.512635 seconds at Wed Aug 14 14:52:10 2024
      8x16x16x16	N4quda6WilsonINS_9WilsonArgIdLi3ELi4EL21QudaReconstructType_s12EEEEE	policy,commDim=0000,parity=1,topo=1111,p2p=0,gdr=0,nvshmem=0,pol=110000111100110000	32	1	1	1	1	1	0	1	0	0	-1	0.000367616	# 117.66 Gflop/s, 205.37 GB/s, tuning took 0.022638 seconds at Thu Aug  8 14:24:48 2024
      8x16x16x16	N4quda6WilsonINS_9WilsonArgIdLi3ELi4EL21QudaReconstructType_s12EEEEE	policy_kernel=interior,comm=0000,commDim=0000,parity=1	32	1	1	1024	1	1	12673	-1	-1	-1	-1	0.000367957	# 117.55 Gflop/s, 205.18 GB/s, tuning took 0.481550 seconds at Thu Aug  8 14:24:48 2024
      8x16x16x32	N4quda15CopyColorSpinorILi4ELi3ENS_11colorspinor11FloatNOrderIdLi4ELi3ELi2ELb0ELb0EEENS1_21SpaceSpinorColorOrderIdLi4ELi3EEESt5tupleIJRNS_16ColorSpinorFieldERKS7_19QudaFieldLocation_sPdPKdEEEE	GPU-offline,vol=65536,parity=1,precision=8,order=9,Ns=4,Nc=3vol=65536,parity=1,precision=8,order=2,Ns=4,Nc=3,NonRelBasis	32	1	1	2048	1	1	0	-1	-1	-1	-1	3.1711e-05	# 0.00 Gflop/s, 793.60 GB/s, tuning took 0.021113 seconds at Tue Aug  6 22:59:51 2024
      8x16x16x32	N4quda15CopyColorSpinorILi4ELi3ENS_11colorspinor11FloatNOrderIdLi4ELi3ELi2ELb0ELb0EEES3_St5tupleIJRNS_16ColorSpinorFieldERKS5_19QudaFieldLocation_sPdPKdEEEE	GPU-offline,vol=65536,parity=1,precision=8,order=2,Ns=4,Nc=3vol=65536,parity=1,precision=8,order=2,Ns=4,Nc=3,PreserveBasis	64	1	1	1024	1	1	0	-1	-1	-1	-1	1.80596e-05	# 0.00 Gflop/s, 1393.48 GB/s, tuning took 0.016065 seconds at Sun Aug 11 15:11:22 2024
      8x16x16x32	N4quda15CopyColorSpinorILi4ELi3ENS_11colorspinor11FloatNOrderIsLi4ELi3ELi8ELb0ELb0EEENS2_IdLi4ELi3ELi2ELb0ELb0EEESt5tupleIJRNS_16ColorSpinorFieldERKS6_19QudaFieldLocation_sPsPKdEEEE	GPU-offline,vol=65536,parity=1,precision=8,order=2,Ns=4,Nc=3vol=65536,parity=1,precision=2,order=8,Ns=4,Nc=3,PreserveBasis	32	1	1	2048	1	1	0	-1	-1	-1	-1	3.1104e-05	# 0.00 Gflop/s, 514.11 GB/s, tuning took 0.028352 seconds at Sun Aug 11 15:11:24 2024
      8x16x16x32	N4quda15CopyColorSpinorILi4ELi3ENS_11colorspinor11FloatNOrderIsLi4ELi3ELi8ELb0ELb0EEES3_St5tupleIJRNS_16ColorSpinorFieldERKS5_19QudaFieldLocation_sPsPKsEEEE	GPU-offline,vol=65536,parity=1,precision=2,order=8,Ns=4,Nc=3vol=65536,parity=1,precision=2,order=8,Ns=4,Nc=3,PreserveBasis	160	1	1	410	1	1	0	-1	-1	-1	-1	7.9018e-06	# 0.00 Gflop/s, 862.56 GB/s, tuning took 0.023533 seconds at Sun Aug 11 15:11:24 2024
      8x16x16x32	N4quda15CopyColorSpinorILi4ELi3ENS_11colorspinor21SpaceSpinorColorOrderIdLi4ELi3EEENS1_11FloatNOrderIdLi4ELi3ELi2ELb0ELb0EEESt5tupleIJRNS_16ColorSpinorFieldERKS7_19QudaFieldLocation_sPdPKdEEEE	GPU-offline,vol=65536,parity=1,precision=8,order=2,Ns=4,Nc=3vol=65536,parity=1,precision=8,order=9,Ns=4,Nc=3,RelBasis	32	1	1	2048	1	1	0	-1	-1	-1	-1	3.1232e-05	# 0.00 Gflop/s, 805.77 GB/s, tuning took 0.017623 seconds at Tue Aug  6 22:59:52 2024
      8x16x16x32	N4quda26WilsonCloverPreconditionedINS_15WilsonCloverArgIdLi3ELi4EL21QudaReconstructType_s12EEEEE	policy,commDim=0000,parity=1,topo=1111,p2p=0,gdr=0,nvshmem=0,pol=110000111100110000	32	1	1	1	1	1	0	0	0	0	-1	0.000897707	# 133.16 Gflop/s, 210.25 GB/s, tuning took 0.055919 seconds at Wed Aug 14 14:27:57 2024
      8x16x16x32	N4quda26WilsonCloverPreconditionedINS_15WilsonCloverArgIdLi3ELi4EL21QudaReconstructType_s12EEEEE	policy_kernel=interior,comm=0000,commDim=0000,parity=1	32	1	1	2048	1	1	16897	-1	-1	-1	-1	0.000897707	# 133.16 Gflop/s, 210.25 GB/s, tuning took 0.965420 seconds at Wed Aug 14 14:27:57 2024
      8x16x16x32	N4quda4blas10multiaxpy_IdEE	GPU-offline,vol=65536,parity=1,precision=2,order=8,Ns=4,Nc=3,vol=65536,parity=1,precision=8,order=2,Ns=4,Nc=3,Nxz=1,Nyw=1	256	1	1	48	1	1	0	1	0	0	0	3.81674e-05	# 82.42 Gflop/s, 748.64 GB/s, tuning took 0.040609 seconds at Sun Aug 11 15:11:27 2024
      8x16x16x32	N4quda4blas11axpbyzNorm2IddEE	GPU-offline,nParity=1,vol=65536,parity=1,precision=8,order=2,Ns=4,Nc=3	480	1	1	48	1	1	0	-1	-1	-1	-1	6.784e-05	# 92.74 Gflop/s, 556.44 GB/s, tuning took 0.932150 seconds at Sun Aug 11 15:11:27 2024
      8x16x16x32	N4quda4blas11axpyCGNorm2IdfEE	GPU-offline,nParity=1,vol=65536,parity=1,precision=2,order=8,Ns=4,Nc=3	192	1	1	24	1	1	0	-1	-1	-1	-1	8.36578e-05	# 112.81 Gflop/s, 122.21 GB/s, tuning took 1.006873 seconds at Sun Aug 11 15:11:26 2024
      8x16x16x32	N4quda4blas23HeavyQuarkResidualNorm_IddEE	GPU-offline,nParity=1,vol=65536,parity=1,precision=8,order=2,Ns=4,Nc=3	96	1	1	47	1	1	0	-1	-1	-1	-1	5.89608e-05	# 106.71 Gflop/s, 426.82 GB/s, tuning took 0.754359 seconds at Sun Aug 11 15:11:29 2024
      8x16x16x32	N4quda4blas3DotIdfEE	GPU-offline,nParity=1,vol=65536,parity=1,precision=2,order=8,Ns=4,Nc=3	288	1	1	46	1	1	0	-1	-1	-1	-1	6.7136e-05	# 46.86 Gflop/s, 101.52 GB/s, tuning took 0.981700 seconds at Sun Aug 11 15:11:25 2024
      8x16x16x32	N4quda4blas4CdotIdfEE	GPU-offline,nParity=1,vol=65536,parity=1,precision=2,order=8,Ns=4,Nc=3	128	1	1	24	1	1	0	-1	-1	-1	-1	8.36267e-05	# 75.23 Gflop/s, 81.50 GB/s, tuning took 0.991364 seconds at Sun Aug 11 15:11:28 2024
      8x16x16x32	N4quda4blas5Norm2IddEE	GPU-offline,nParity=1,vol=65536,parity=1,precision=8,order=2,Ns=4,Nc=3	320	1	1	48	1	1	0	-1	-1	-1	-1	3.57141e-05	# 88.08 Gflop/s, 352.32 GB/s, tuning took 0.626671 seconds at Sun Aug 11 15:11:24 2024
      8x16x16x32	N4quda4blas6caxpy_IfEE	GPU-offline,vol=65536,parity=1,precision=2,order=8,Ns=4,Nc=3	256	1	1	48	1	1	0	-1	-1	-1	-1	8.33292e-06	# 755.01 Gflop/s, 1226.90 GB/s, tuning took 0.012972 seconds at Sun Aug 11 15:11:28 2024
      8x16x16x32	N4quda4blas7axpbyz_IdEE	GPU-offline,vol=65536,parity=1,precision=8,order=2,Ns=4,Nc=3	384	1	1	48	1	1	0	-1	-1	-1	-1	3.35531e-05	# 140.63 Gflop/s, 1125.05 GB/s, tuning took 0.020918 seconds at Sun Aug 11 15:11:27 2024
      8x16x16x32	N4quda4blas7axpbyz_IfEE	GPU-offline,vol=65536,parity=1,precision=2,order=8,Ns=4,Nc=3	224	1	1	48	1	1	0	-1	-1	-1	-1	8.68174e-06	# 543.51 Gflop/s, 1177.60 GB/s, tuning took 0.019894 seconds at Sun Aug 11 15:11:29 2024
      8x16x16x32	N4quda4blas9axpyZpbx_IdEE	GPU-offline,vol=65536,parity=1,precision=2,order=8,Ns=4,Nc=3,vol=65536,parity=1,precision=8,order=2,Ns=4,Nc=3	128	1	1	48	1	1	0	-1	-1	-1	-1	0.000141952	# 44.32 Gflop/s, 249.31 GB/s, tuning took 0.029687 seconds at Sun Aug 11 15:11:26 2024
      8x16x16x32	N4quda6WilsonINS_9WilsonArgIdLi3ELi4EL21QudaReconstructType_s12EEEEE	policy,commDim=0000,dagger,parity=1,topo=1111,p2p=0,gdr=0,nvshmem=0,pol=110000111100110000	32	1	1	1	1	1	0	0	0	0	-1	0.000729088	# 118.65 Gflop/s, 207.10 GB/s, tuning took 0.042848 seconds at Sun Aug 11 15:11:22 2024
      8x16x16x32	N4quda6WilsonINS_9WilsonArgIdLi3ELi4EL21QudaReconstructType_s12EEEEE	policy,commDim=0000,parity=1,topo=1111,p2p=0,gdr=0,nvshmem=0,pol=110000111100110000	32	1	1	1	1	1	0	1	0	0	-1	0.000729088	# 118.65 Gflop/s, 207.10 GB/s, tuning took 0.049521 seconds at Tue Aug  6 22:59:52 2024
      8x16x16x32	N4quda6WilsonINS_9WilsonArgIdLi3ELi4EL21QudaReconstructType_s12EEEEE	policy,commDim=0000,xpay,dagger,parity=1,topo=1111,p2p=0,gdr=0,nvshmem=0,pol=110000111100110000	32	1	1	1	1	1	0	6	0	0	-1	0.00074752	# 119.93 Gflop/s, 201.99 GB/s, tuning took 0.057251 seconds at Sun Aug 11 15:11:23 2024
      8x16x16x32	N4quda6WilsonINS_9WilsonArgIdLi3ELi4EL21QudaReconstructType_s12EEEEE	policy,commDim=0000,xpay,parity=1,topo=1111,p2p=0,gdr=0,nvshmem=0,pol=110000111100110000	32	1	1	1	1	1	0	7	0	0	-1	0.000745131	# 120.32 Gflop/s, 202.64 GB/s, tuning took 0.045471 seconds at Sun Aug 11 15:11:22 2024
      8x16x16x32	N4quda6WilsonINS_9WilsonArgIdLi3ELi4EL21QudaReconstructType_s12EEEEE	policy_kernel=interior,comm=0000,commDim=0000,dagger,parity=1	32	1	1	2048	1	1	14483	-1	-1	-1	-1	0.000729088	# 118.65 Gflop/s, 207.10 GB/s, tuning took 0.734187 seconds at Sun Aug 11 15:11:22 2024
      8x16x16x32	N4quda6WilsonINS_9WilsonArgIdLi3ELi4EL21QudaReconstructType_s12EEEEE	policy_kernel=interior,comm=0000,commDim=0000,parity=1	32	1	1	2048	1	1	16897	-1	-1	-1	-1	0.000729088	# 118.65 Gflop/s, 207.10 GB/s, tuning took 0.844735 seconds at Tue Aug  6 22:59:52 2024
      8x16x16x32	N4quda6WilsonINS_9WilsonArgIdLi3ELi4EL21QudaReconstructType_s12EEEEE	policy_kernel=interior,comm=0000,commDim=0000,xpay,dagger,parity=1	32	1	1	2048	1	1	12673	-1	-1	-1	-1	0.00074752	# 119.93 Gflop/s, 201.99 GB/s, tuning took 0.883332 seconds at Sun Aug 11 15:11:23 2024
      8x16x16x32	N4quda6WilsonINS_9WilsonArgIdLi3ELi4EL21QudaReconstructType_s12EEEEE	policy_kernel=interior,comm=0000,commDim=0000,xpay,parity=1	32	1	1	2048	1	1	16897	-1	-1	-1	-1	0.000745813	# 120.21 Gflop/s, 202.46 GB/s, tuning took 0.884665 seconds at Sun Aug 11 15:11:21 2024
      8x16x16x32	N4quda6WilsonINS_9WilsonArgIsLi3ELi4EL21QudaReconstructType_s12EEEEE	policy,commDim=0000,dagger,parity=1,topo=1111,p2p=0,gdr=0,nvshmem=0,pol=110000111100110000	32	1	1	1	1	1	0	1	0	0	-1	3.1072e-05	# 2784.10 Gflop/s, 1282.37 GB/s, tuning took 0.016141 seconds at Sun Aug 11 15:11:24 2024
      8x16x16x32	N4quda6WilsonINS_9WilsonArgIsLi3ELi4EL21QudaReconstructType_s12EEEEE	policy,commDim=0000,parity=1,topo=1111,p2p=0,gdr=0,nvshmem=0,pol=110000111100110000	32	1	1	1	1	1	0	0	0	0	-1	3.1072e-05	# 2784.10 Gflop/s, 1282.37 GB/s, tuning took 0.017130 seconds at Sun Aug 11 15:11:24 2024
      8x16x16x32	N4quda6WilsonINS_9WilsonArgIsLi3ELi4EL21QudaReconstructType_s12EEEEE	policy,commDim=0000,xpay,dagger,parity=1,topo=1111,p2p=0,gdr=0,nvshmem=0,pol=110000111100110000	32	1	1	1	1	1	0	1	0	0	-1	3.25368e-05	# 2755.44 Gflop/s, 1224.64 GB/s, tuning took 0.014923 seconds at Sun Aug 11 15:11:24 2024
      8x16x16x32	N4quda6WilsonINS_9WilsonArgIsLi3ELi4EL21QudaReconstructType_s12EEEEE	policy,commDim=0000,xpay,parity=1,topo=1111,p2p=0,gdr=0,nvshmem=0,pol=110000111100110000	32	1	1	1	1	1	0	1	0	0	-1	3.26049e-05	# 2749.69 Gflop/s, 1222.08 GB/s, tuning took 0.016821 seconds at Sun Aug 11 15:11:24 2024
      8x16x16x32	N4quda6WilsonINS_9WilsonArgIsLi3ELi4EL21QudaReconstructType_s12EEEEE	policy_kernel=interior,comm=0000,commDim=0000,dagger,parity=1	128	1	1	512	1	1	8449	-1	-1	-1	-1	3.10303e-05	# 2787.84 Gflop/s, 1284.10 GB/s, tuning took 0.095859 seconds at Sun Aug 11 15:11:24 2024
      8x16x16x32	N4quda6WilsonINS_9WilsonArgIsLi3ELi4EL21QudaReconstructType_s12EEEEE	policy_kernel=interior,comm=0000,commDim=0000,parity=1	64	1	1	1024	1	1	6337	-1	-1	-1	-1	3.10613e-05	# 2785.05 Gflop/s, 1282.81 GB/s, tuning took 0.091999 seconds at Sun Aug 11 15:11:24 2024
      8x16x16x32	N4quda6WilsonINS_9WilsonArgIsLi3ELi4EL21QudaReconstructType_s12EEEEE	policy_kernel=interior,comm=0000,commDim=0000,xpay,dagger,parity=1	64	1	1	1024	1	1	5964	-1	-1	-1	-1	3.25037e-05	# 2758.24 Gflop/s, 1225.89 GB/s, tuning took 0.096961 seconds at Sun Aug 11 15:11:24 2024
      8x16x16x32	N4quda6WilsonINS_9WilsonArgIsLi3ELi4EL21QudaReconstructType_s12EEEEE	policy_kernel=interior,comm=0000,commDim=0000,xpay,parity=1	64	1	1	1024	1	1	6337	-1	-1	-1	-1	3.26689e-05	# 2744.30 Gflop/s, 1219.69 GB/s, tuning took 0.094117 seconds at Sun Aug 11 15:11:24 2024
        8x8x8x16	N4quda10GaugeGaussIdLi3EL21QudaReconstructType_s12EEE	GPU-offline,vol=8192stride=4608precision=8geometry=4Nc=3,lie_group	352	1	1	12	2	1	24577	-1	-1	-1	-1	0.000458411	# 0.00 Gflop/s, 7.72 GB/s, tuning took 0.347998 seconds at Tue Aug 13 18:13:24 2024
        8x8x8x16	N4quda12ExtractGhostIdLi3ENS_5gauge11FloatNOrderIdLi18ELi2ELi12EL20QudaStaggeredPhase_s0ELb1EL19QudaGhostExchange_sn2147483648ELb0EEEEE	GPU-offline,vol=8192stride=4608precision=8geometry=4Nc=3,extract	64	1	1	16	1	8	2138	-1	-1	-1	-1	6.00301e-06	# 0.00 Gflop/s, 114.63 GB/s, tuning took 0.046142 seconds at Tue Aug 13 18:13:23 2024
        8x8x8x16	N4quda15CopyColorSpinorILi4ELi3ENS_11colorspinor11FloatNOrderIdLi4ELi3ELi2ELb0ELb0EEENS1_21SpaceSpinorColorOrderIdLi4ELi3EEESt5tupleIJRNS_16ColorSpinorFieldERKS7_19QudaFieldLocation_sPdPKdEEEE	GPU-offline,vol=8192,parity=2,precision=8,order=9,Ns=4,Nc=3vol=8192,parity=2,precision=8,order=2,Ns=4,Nc=3,NonRelBasis	352	1	1	12	2	1	0	-1	-1	-1	-1	8.47383e-06	# 0.00 Gflop/s, 371.23 GB/s, tuning took 0.019735 seconds at Tue Aug 13 20:18:31 2024
        8x8x8x16	N4quda15CopyColorSpinorILi4ELi3ENS_11colorspinor21SpaceSpinorColorOrderIdLi4ELi3EEENS1_11FloatNOrderIdLi4ELi3ELi2ELb0ELb0EEESt5tupleIJRNS_16ColorSpinorFieldERKS7_19QudaFieldLocation_sPdPKdEEEE	GPU-offline,vol=8192,parity=2,precision=8,order=2,Ns=4,Nc=3vol=8192,parity=2,precision=8,order=9,Ns=4,Nc=3,RelBasis	192	1	1	22	2	1	0	-1	-1	-1	-1	8.0044e-06	# 0.00 Gflop/s, 393.00 GB/s, tuning took 0.016130 seconds at Tue Aug 13 20:18:34 2024
        8x8x8x16	N4quda4blas5Norm2IddEE	GPU-offline,nParity=2,vol=8192,parity=2,precision=8,order=2,Ns=4,Nc=3	352	1	1	46	1	1	0	-1	-1	-1	-1	2.26133e-05	# 17.39 Gflop/s, 69.55 GB/s, tuning took 0.319490 seconds at Tue Aug 13 20:18:32 2024
        8x8x8x16	N4quda6WilsonINS_9WilsonArgIdLi3ELi4EL21QudaReconstructType_s12EEEEE	policy,commDim=0000,xpay,parity=2,topo=1111,p2p=0,gdr=0,nvshmem=0,pol=110000111100110000	32	1	1	1	1	1	0	7	0	0	-1	9.56975e-05	# 117.11 Gflop/s, 197.23 GB/s, tuning took 0.013203 seconds at Tue Aug 13 20:18:34 2024
        8x8x8x16	N4quda6WilsonINS_9WilsonArgIdLi3ELi4EL21QudaReconstructType_s12EEEEE	policy_kernel=interior,comm=0000,commDim=0000,xpay,parity=2	32	1	1	128	1	2	5633	-1	-1	-1	-1	9.56975e-05	# 117.11 Gflop/s, 197.23 GB/s, tuning took 0.196376 seconds at Tue Aug 13 20:18:34 2024
        8x8x8x16	N4quda7RNGInitE	GPU-offline,vol=8192stride=4608precision=8geometry=4Nc=3	352	1	1	12	2	1	0	-1	-1	-1	-1	0.00288051	# 0.00 Gflop/s, 0.00 GB/s, tuning took 0.476494 seconds at Tue Aug 13 18:13:24 2024
        8x8x8x16	N4quda9CopyGaugeINS_12CopyGaugeArgIddLi18ELb0ENS_5gauge11FloatNOrderIdLi18ELi2ELi12EL20QudaStaggeredPhase_s0ELb1EL19QudaGhostExchange_sn2147483648ELb0EEENS2_8QDPOrderIdLi18EEEEEEE	GPU-offline,vol=8192stride=4096precision=8geometry=4Nc=3,vol=8192stride=4608precision=8geometry=4Nc=3	64	1	1	64	1	8	2138	-1	-1	-1	-1	8.35228e-06	# 0.00 Gflop/s, 988.66 GB/s, tuning took 0.062014 seconds at Tue Aug 13 18:13:23 2024
        8x8x8x16	N4quda9CopyGaugeINS_12CopyGaugeArgIddLi18ELb0ENS_5gauge11FloatNOrderIdLi18ELi2ELi12EL20QudaStaggeredPhase_s0ELb1EL19QudaGhostExchange_sn2147483648ELb0EEES6_EEEE	GPU-offline,vol=8192stride=4608precision=8geometry=4Nc=3,vol=8192stride=4608precision=8geometry=4Nc=3,ghost	32	1	1	16	1	8	2458	-1	-1	-1	-1	5.6344e-06	# 0.00 Gflop/s, 137.40 GB/s, tuning took 0.051825 seconds at Tue Aug 13 18:13:23 2024
        8x8x8x16	N4quda9CopyGaugeINS_12CopyGaugeArgIddLi18ELb0ENS_5gauge8QDPOrderIdLi18EEENS2_11FloatNOrderIdLi18ELi2ELi12EL20QudaStaggeredPhase_s0ELb1EL19QudaGhostExchange_sn2147483648ELb0EEEEEEE	GPU-offline,vol=8192stride=4608precision=8geometry=4Nc=3,vol=8192stride=4096precision=8geometry=4Nc=3	64	1	1	64	1	8	3073	-1	-1	-1	-1	1.34198e-05	# 0.00 Gflop/s, 615.33 GB/s, tuning took 0.042215 seconds at Tue Aug 13 18:13:24 2024
        8x8x8x16	N4quda9CopyGaugeINS_12CopyGaugeArgIfdLi18ELb0ENS_5gauge11FloatNOrderIfLi18ELi4ELi12EL20QudaStaggeredPhase_s0ELb1EL19QudaGhostExchange_sn2147483648ELb0EEENS3_IdLi18ELi2ELi12ELS4_0ELb1ELS5_n2147483648ELb0EEEEEEE	GPU-offline,vol=8192stride=4608precision=8geometry=4Nc=3,vol=8192stride=4608precision=4geometry=4Nc=3	32	1	3	128	1	3	3511	-1	-1	-1	-1	9.27565e-06	# 0.00 Gflop/s, 572.30 GB/s, tuning took 0.039730 seconds at Tue Aug 13 18:13:23 2024
        8x8x8x16	N4quda9CopyGaugeINS_12CopyGaugeArgIfdLi18ELb0ENS_5gauge11FloatNOrderIfLi18ELi4ELi12EL20QudaStaggeredPhase_s0ELb1EL19QudaGhostExchange_sn2147483648ELb0EEENS3_IdLi18ELi2ELi12ELS4_0ELb1ELS5_n2147483648ELb0EEEEEEE	GPU-offline,vol=8192stride=4608precision=8geometry=4Nc=3,vol=8192stride=4608precision=4geometry=4Nc=3,ghost	64	1	1	8	1	8	2049	-1	-1	-1	-1	5.61737e-06	# 0.00 Gflop/s, 103.36 GB/s, tuning took 0.034100 seconds at Tue Aug 13 18:13:23 2024
        8x8x8x16	N4quda9CopyGaugeINS_12CopyGaugeArgIsdLi18ELb0ENS_5gauge11FloatNOrderIsLi18ELi4ELi12EL20QudaStaggeredPhase_s0ELb1EL19QudaGhostExchange_sn2147483648ELb0EEENS3_IdLi18ELi2ELi12ELS4_0ELb1ELS5_n2147483648ELb0EEEEEEE	GPU-offline,vol=8192stride=4608precision=8geometry=4Nc=3,vol=8192stride=4608precision=2geometry=4Nc=3	64	1	1	64	1	8	3511	-1	-1	-1	-1	1.02073e-05	# 0.00 Gflop/s, 433.38 GB/s, tuning took 0.048700 seconds at Tue Aug 13 18:13:23 2024
        8x8x8x16	N4quda9CopyGaugeINS_12CopyGaugeArgIsdLi18ELb0ENS_5gauge11FloatNOrderIsLi18ELi4ELi12EL20QudaStaggeredPhase_s0ELb1EL19QudaGhostExchange_sn2147483648ELb0EEENS3_IdLi18ELi2ELi12ELS4_0ELb1ELS5_n2147483648ELb0EEEEEEE	GPU-offline,vol=8192stride=4608precision=8geometry=4Nc=3,vol=8192stride=4608precision=2geometry=4Nc=3,ghost	32	1	2	16	1	4	3781	-1	-1	-1	-1	6.41149e-06	# 0.00 Gflop/s, 75.46 GB/s, tuning took 0.040913 seconds at Tue Aug 13 18:13:23 2024
         8x8x8x4	N4quda15CopyColorSpinorILi4ELi3ENS_11colorspinor11FloatNOrderIdLi4ELi3ELi2ELb0ELb0EEENS1_21SpaceSpinorColorOrderIdLi4ELi3EEESt5tupleIJRNS_16ColorSpinorFieldERKS7_19QudaFieldLocation_sPdPKdEEEE	GPU-offline,vol=2048,parity=1,precision=8,order=9,Ns=4,Nc=3vol=2048,parity=1,precision=8,order=2,Ns=4,Nc=3,NonRelBasis	32	1	1	64	1	1	0	-1	-1	-1	-1	9.90563e-06	# 0.00 Gflop/s, 79.39 GB/s, tuning took 0.032619 seconds at Thu Aug  8 14:50:36 2024
         8x8x8x4	N4quda15CopyColorSpinorILi4ELi3ENS_11colorspinor21SpaceSpinorColorOrderIdLi4ELi3EEENS1_11FloatNOrderIdLi4ELi3ELi2ELb0ELb0EEESt5tupleIJRNS_16ColorSpinorFieldERKS7_19QudaFieldLocation_sPdPKdEEEE	GPU-offline,vol=2048,parity=1,precision=8,order=2,Ns=4,Nc=3vol=2048,parity=1,precision=8,order=9,Ns=4,Nc=3,RelBasis	160	1	1	13	1	1	0	-1	-1	-1	-1	5.84098e-06	# 0.00 Gflop/s, 134.64 GB/s, tuning took 0.023915 seconds at Thu Aug  8 14:50:37 2024
         8x8x8x4	N4quda6WilsonINS_9WilsonArgIdLi3ELi4EL21QudaReconstructType_s12EEEEE	policy,commDim=0000,parity=1,topo=1111,p2p=0,gdr=0,nvshmem=0,pol=110000111100110000	32	1	1	1	1	1	0	0	0	0	-1	2.8672e-05	# 94.29 Gflop/s, 164.57 GB/s, tuning took 0.013429 seconds at Thu Aug  8 14:50:37 2024
         8x8x8x4	N4quda6WilsonINS_9WilsonArgIdLi3ELi4EL21QudaReconstructType_s12EEEEE	policy_kernel=interior,comm=0000,commDim=0000,parity=1	32	1	1	64	1	1	4408	-1	-1	-1	-1	2.8672e-05	# 94.29 Gflop/s, 164.57 GB/s, tuning took 0.146606 seconds at Thu Aug  8 14:50:37 2024
         8x8x8x8	N4quda10GaugeGaussIdLi3EL21QudaReconstructType_s12EEE	GPU-offline,vol=4096stride=2304precision=8geometry=4Nc=3,lie_group	96	2	1	22	1	1	7022	-1	-1	-1	-1	0.00025856	# 0.00 Gflop/s, 6.84 GB/s, tuning took 0.222056 seconds at Thu Aug  8 11:59:53 2024
         8x8x8x8	N4quda12ExtractGhostIdLi3ENS_5gauge11FloatNOrderIdLi18ELi2ELi12EL20QudaStaggeredPhase_s0ELb1EL19QudaGhostExchange_sn2147483648ELb0EEEEE	GPU-offline,vol=4096stride=2304precision=8geometry=4Nc=3,extract	96	1	2	6	1	4	8193	-1	-1	-1	-1	5.48194e-06	# 0.00 Gflop/s, 71.73 GB/s, tuning took 0.050607 seconds at Thu Aug  8 11:59:52 2024
         8x8x8x8	N4quda15CopyColorSpinorILi4ELi3ENS_11colorspinor11FloatNOrderIdLi4ELi3ELi2ELb0ELb0EEENS1_21SpaceSpinorColorOrderIdLi4ELi3EEESt5tupleIJRNS_16ColorSpinorFieldERKS7_19QudaFieldLocation_sPdPKdEEEE	GPU-offline,vol=4096,parity=1,precision=8,order=9,Ns=4,Nc=3vol=4096,parity=1,precision=8,order=2,Ns=4,Nc=3,NonRelBasis	96	1	1	43	1	1	0	-1	-1	-1	-1	6.36872e-06	# 0.00 Gflop/s, 246.97 GB/s, tuning took 0.021795 seconds at Thu Aug  8 14:21:49 2024
         8x8x8x8	N4quda15CopyColorSpinorILi4ELi3ENS_11colorspinor21SpaceSpinorColorOrderIdLi4ELi3EEENS1_11FloatNOrderIdLi4ELi3ELi2ELb0ELb0EEESt5tupleIJRNS_16ColorSpinorFieldERKS7_19QudaFieldLocation_sPdPKdEEEE	GPU-offline,vol=4096,parity=1,precision=8,order=2,Ns=4,Nc=3vol=4096,parity=1,precision=8,order=9,Ns=4,Nc=3,RelBasis	32	1	1	128	1	1	0	-1	-1	-1	-1	6.62724e-06	# 0.00 Gflop/s, 237.33 GB/s, tuning took 0.018981 seconds at Thu Aug  8 14:21:49 2024
         8x8x8x8	N4quda6WilsonINS_9WilsonArgIdLi3ELi4EL21QudaReconstructType_s12EEEEE	policy,commDim=0000,parity=1,topo=1111,p2p=0,gdr=0,nvshmem=0,pol=110000111100110000	32	1	1	1	1	1	0	6	0	0	-1	5.38947e-05	# 100.32 Gflop/s, 175.10 GB/s, tuning took 0.012316 seconds at Thu Aug  8 14:21:49 2024
         8x8x8x8	N4quda6WilsonINS_9WilsonArgIdLi3ELi4EL21QudaReconstructType_s12EEEEE	policy_kernel=interior,comm=0000,commDim=0000,parity=1	176	1	1	24	1	1	0	-1	-1	-1	-1	5.38408e-05	# 100.42 Gflop/s, 175.28 GB/s, tuning took 0.161814 seconds at Thu Aug  8 14:21:49 2024
         8x8x8x8	N4quda7RNGInitE	GPU-offline,vol=4096stride=2304precision=8geometry=4Nc=3	32	1	1	64	2	1	0	-1	-1	-1	-1	0.00153395	# 0.00 Gflop/s, 0.00 GB/s, tuning took 0.400674 seconds at Thu Aug  8 11:59:53 2024
         8x8x8x8	N4quda9CopyGaugeINS_12CopyGaugeArgIddLi18ELb0ENS_5gauge11FloatNOrderIdLi18ELi2ELi12EL20QudaStaggeredPhase_s0ELb1EL19QudaGhostExchange_sn2147483648ELb0EEENS2_8QDPOrderIdLi18EEEEEEE	GPU-offline,vol=4096stride=2048precision=8geometry=4Nc=3,vol=4096stride=2304precision=8geometry=4Nc=3	64	1	1	32	1	8	2587	-1	-1	-1	-1	7.86649e-06	# 0.00 Gflop/s, 524.86 GB/s, tuning took 0.057477 seconds at Thu Aug  8 11:59:52 2024
         8x8x8x8	N4quda9CopyGaugeINS_12CopyGaugeArgIddLi18ELb0ENS_5gauge11FloatNOrderIdLi18ELi2ELi12EL20QudaStaggeredPhase_s0ELb1EL19QudaGhostExchange_sn2147483648ELb0EEES6_EEEE	GPU-offline,vol=4096stride=2304precision=8geometry=4Nc=3,vol=4096stride=2304precision=8geometry=4Nc=3,ghost	64	1	1	4	1	8	3511	-1	-1	-1	-1	5.71611e-06	# 0.00 Gflop/s, 77.39 GB/s, tuning took 0.042584 seconds at Thu Aug  8 11:59:52 2024
         8x8x8x8	N4quda9CopyGaugeINS_12CopyGaugeArgIddLi18ELb0ENS_5gauge8QDPOrderIdLi18EEENS2_11FloatNOrderIdLi18ELi2ELi12EL20QudaStaggeredPhase_s0ELb1EL19QudaGhostExchange_sn2147483648ELb0EEEEEEE	GPU-offline,vol=4096stride=2304precision=8geometry=4Nc=3,vol=4096stride=2048precision=8geometry=4Nc=3	64	1	1	32	1	8	3781	-1	-1	-1	-1	1.04537e-05	# 0.00 Gflop/s, 394.96 GB/s, tuning took 0.039534 seconds at Thu Aug  8 11:59:53 2024
         8x8x8x8	N4quda9CopyGaugeINS_12CopyGaugeArgIfdLi18ELb0ENS_5gauge11FloatNOrderIfLi18ELi4ELi12EL20QudaStaggeredPhase_s0ELb1EL19QudaGhostExchange_sn2147483648ELb0EEENS3_IdLi18ELi2ELi12ELS4_0ELb1ELS5_n2147483648ELb0EEEEEEE	GPU-offline,vol=4096stride=2304precision=8geometry=4Nc=3,vol=4096stride=2304precision=4geometry=4Nc=3	64	1	1	32	1	8	2138	-1	-1	-1	-1	8.6328e-06	# 0.00 Gflop/s, 307.46 GB/s, tuning took 0.047769 seconds at Thu Aug  8 11:59:53 2024
         8x8x8x8	N4quda9CopyGaugeINS_12CopyGaugeArgIfdLi18ELb0ENS_5gauge11FloatNOrderIfLi18ELi4ELi12EL20QudaStaggeredPhase_s0ELb1EL19QudaGhostExchange_sn2147483648ELb0EEENS3_IdLi18ELi2ELi12ELS4_0ELb1ELS5_n2147483648ELb0EEEEEEE	GPU-offline,vol=4096stride=2304precision=8geometry=4Nc=3,vol=4096stride=2304precision=4geometry=4Nc=3,ghost	64	1	1	4	1	8	2892	-1	-1	-1	-1	5.43817e-06	# 0.00 Gflop/s, 61.01 GB/s, tuning took 0.058216 seconds at Thu Aug  8 11:59:53 2024
         8x8x8x8	N4quda9CopyGaugeINS_12CopyGaugeArgIsdLi18ELb0ENS_5gauge11FloatNOrderIsLi18ELi4ELi12EL20QudaStaggeredPhase_s0ELb1EL19QudaGhostExchange_sn2147483648ELb0EEENS3_IdLi18ELi2ELi12ELS4_0ELb1ELS5_n2147483648ELb0EEEEEEE	GPU-offline,vol=4096stride=2304precision=8geometry=4Nc=3,vol=4096stride=2304precision=2geometry=4Nc=3	704	1	1	3	1	8	24577	-1	-1	-1	-1	8.25051e-06	# 0.00 Gflop/s, 268.09 GB/s, tuning took 0.040910 seconds at Thu Aug  8 11:59:53 2024
         8x8x8x8	N4quda9CopyGaugeINS_12CopyGaugeArgIsdLi18ELb0ENS_5gauge11FloatNOrderIsLi18ELi4ELi12EL20QudaStaggeredPhase_s0ELb1EL19QudaGhostExchange_sn2147483648ELb0EEENS3_IdLi18ELi2ELi12ELS4_0ELb1ELS5_n2147483648ELb0EEEEEEE	GPU-offline,vol=4096stride=2304precision=8geometry=4Nc=3,vol=4096stride=2304precision=2geometry=4Nc=3,ghost	128	1	1	2	1	8	4469	-1	-1	-1	-1	5.55829e-06	# 0.00 Gflop/s, 49.74 GB/s, tuning took 0.042316 seconds at Thu Aug  8 11:59:53 2024
   bytes=1179648	cudaMemcpyDefault	copy,cuda_gauge_field.cpp,576	32	1	1	1	1	1	0	-1	-1	-1	-1	1.16818e-05	# 0.00 Gflop/s, 100.98 GB/s, tuning took 0.000663 seconds at Thu Aug  8 14:21:48 2024
   bytes=1179648	cudaMemcpyDefault	saveCPUField,cuda_gauge_field.cpp,658	32	1	1	1	1	1	0	-1	-1	-1	-1	1.11391e-05	# 0.00 Gflop/s, 105.90 GB/s, tuning took 0.000676 seconds at Thu Aug  8 14:21:49 2024
   bytes=1179648	cudaMemcpyDeviceToDevice	exchangeGhost,cuda_gauge_field.cpp,193	32	1	1	1	1	1	0	-1	-1	-1	-1	1.03248e-05	# 0.00 Gflop/s, 228.51 GB/s, tuning took 0.000590 seconds at Wed Aug 14 14:26:54 2024
  bytes=12582912	cudaMemsetAsync	zero,color_spinor_field.cpp,469	32	1	1	1	1	1	0	-1	-1	-1	-1	1.752e-05	# 0.00 Gflop/s, 718.20 GB/s, tuning took 0.001291 seconds at Sun Aug 11 15:11:22 2024
   bytes=1327104	cudaMemcpyDeviceToDevice	exchangeGhost,cuda_gauge_field.cpp,193	32	1	1	1	1	1	0	-1	-1	-1	-1	9.21234e-06	# 0.00 Gflop/s, 288.11 GB/s, tuning took 0.000774 seconds at Wed Aug 14 09:48:50 2024
  bytes=13271040	cudaMemset	allocateGhostBuffer,lattice_field.cpp,288	32	1	1	1	1	1	0	-1	-1	-1	-1	1.776e-05	# 0.00 Gflop/s, 747.24 GB/s, tuning took 0.004728 seconds at Wed Aug 14 09:48:50 2024
  bytes=13271040	cudaMemset	allocateGhostBuffer,lattice_field.cpp,293	32	1	1	1	1	1	0	-1	-1	-1	-1	1.7267e-05	# 0.00 Gflop/s, 768.58 GB/s, tuning took 0.001138 seconds at Wed Aug 14 09:48:50 2024
 bytes=143327232	cudaMemcpyDefault	copy,cuda_gauge_field.cpp,576	32	1	1	1	1	1	0	-1	-1	-1	-1	0.00139028	# 0.00 Gflop/s, 103.09 GB/s, tuning took 0.030895 seconds at Wed Aug 14 09:48:44 2024
 bytes=143327232	cudaMemcpyDefault	saveCPUField,cuda_gauge_field.cpp,658	32	1	1	1	1	1	0	-1	-1	-1	-1	0.00137865	# 0.00 Gflop/s, 103.96 GB/s, tuning took 0.014546 seconds at Wed Aug 14 09:50:30 2024
   bytes=1572864	cudaMemset	allocateGhostBuffer,lattice_field.cpp,288	32	1	1	1	1	1	0	-1	-1	-1	-1	1.00096e-05	# 0.00 Gflop/s, 157.14 GB/s, tuning took 0.000841 seconds at Thu Aug  8 14:24:41 2024
   bytes=1572864	cudaMemset	allocateGhostBuffer,lattice_field.cpp,293	32	1	1	1	1	1	0	-1	-1	-1	-1	7.58314e-06	# 0.00 Gflop/s, 207.42 GB/s, tuning took 0.000528 seconds at Thu Aug  8 14:24:41 2024
   bytes=1572864	cudaMemsetAsync	zero,color_spinor_field.cpp,469	32	1	1	1	1	1	0	-1	-1	-1	-1	1.22377e-05	# 0.00 Gflop/s, 128.53 GB/s, tuning took 0.003341 seconds at Tue Aug 13 20:18:31 2024
  bytes=18874368	cudaMemcpyDefault	copy,cuda_gauge_field.cpp,576	32	1	1	1	1	1	0	-1	-1	-1	-1	0.000192853	# 0.00 Gflop/s, 97.87 GB/s, tuning took 0.003825 seconds at Tue Aug  6 22:59:37 2024
  bytes=18874368	cudaMemcpyDefault	saveCPUField,cuda_gauge_field.cpp,658	32	1	1	1	1	1	0	-1	-1	-1	-1	0.000167098	# 0.00 Gflop/s, 112.95 GB/s, tuning took 0.003539 seconds at Tue Aug  6 22:59:51 2024
 bytes=191102976	cudaMemsetAsync	zero,color_spinor_field.cpp,469	32	1	1	1	1	1	0	-1	-1	-1	-1	0.000876885	# 0.00 Gflop/s, 217.93 GB/s, tuning took 0.009011 seconds at Wed Aug 14 09:50:31 2024
    bytes=196608	cudaMemset	allocateGhostBuffer,lattice_field.cpp,288	32	1	1	1	1	1	0	-1	-1	-1	-1	6.3744e-06	# 0.00 Gflop/s, 30.84 GB/s, tuning took 0.000419 seconds at Thu Aug  8 11:59:52 2024
    bytes=196608	cudaMemset	allocateGhostBuffer,lattice_field.cpp,293	32	1	1	1	1	1	0	-1	-1	-1	-1	6.12614e-06	# 0.00 Gflop/s, 32.09 GB/s, tuning took 0.000419 seconds at Thu Aug  8 11:59:52 2024
    bytes=212992	cudaMemsetAsync	zero,color_spinor_field.cpp,469	32	1	1	1	1	1	0	-1	-1	-1	-1	6.07136e-06	# 0.00 Gflop/s, 35.08 GB/s, tuning took 0.002203 seconds at Tue Aug 13 20:18:32 2024
  bytes=22020096	cudaMemset	allocateGhostBuffer,lattice_field.cpp,288	32	1	1	1	1	1	0	-1	-1	-1	-1	3.6352e-05	# 0.00 Gflop/s, 605.75 GB/s, tuning took 0.009436 seconds at Thu Aug  8 16:24:54 2024
  bytes=22020096	cudaMemset	allocateGhostBuffer,lattice_field.cpp,293	32	1	1	1	1	1	0	-1	-1	-1	-1	2.69166e-05	# 0.00 Gflop/s, 818.09 GB/s, tuning took 0.001608 seconds at Thu Aug  8 16:24:54 2024
    bytes=221184	cudaMemset	allocateGhostBuffer,lattice_field.cpp,288	32	1	1	1	1	1	0	-1	-1	-1	-1	1.10942e-05	# 0.00 Gflop/s, 19.94 GB/s, tuning took 0.001212 seconds at Thu Aug  8 14:50:35 2024
    bytes=221184	cudaMemset	allocateGhostBuffer,lattice_field.cpp,293	32	1	1	1	1	1	0	-1	-1	-1	-1	6.1968e-06	# 0.00 Gflop/s, 35.69 GB/s, tuning took 0.000435 seconds at Thu Aug  8 14:50:35 2024
   bytes=2359296	cudaMemset	allocateGhostBuffer,lattice_field.cpp,288	32	1	1	1	1	1	0	-1	-1	-1	-1	7.2573e-06	# 0.00 Gflop/s, 325.09 GB/s, tuning took 0.000576 seconds at Wed Aug 14 14:51:35 2024
   bytes=2359296	cudaMemset	allocateGhostBuffer,lattice_field.cpp,293	32	1	1	1	1	1	0	-1	-1	-1	-1	1.20441e-05	# 0.00 Gflop/s, 195.89 GB/s, tuning took 0.000744 seconds at Wed Aug 14 14:51:35 2024
     bytes=24576	cudaMemcpyDeviceToDevice	exchangeGhost,cuda_gauge_field.cpp,193	32	1	1	1	1	1	0	-1	-1	-1	-1	5.85436e-06	# 0.00 Gflop/s, 8.40 GB/s, tuning took 0.000401 seconds at Thu Aug  8 14:50:35 2024
  bytes=25165824	cudaMemsetAsync	zero,color_spinor_field.cpp,469	32	1	1	1	1	1	0	-1	-1	-1	-1	2.82169e-05	# 0.00 Gflop/s, 891.87 GB/s, tuning took 0.001068 seconds at Sun Aug 11 15:11:20 2024
   bytes=2752512	cudaMemset	allocateGhostBuffer,lattice_field.cpp,288	32	1	1	1	1	1	0	-1	-1	-1	-1	7.19177e-06	# 0.00 Gflop/s, 382.73 GB/s, tuning took 0.001014 seconds at Tue Aug  6 22:59:38 2024
   bytes=2752512	cudaMemset	allocateGhostBuffer,lattice_field.cpp,293	32	1	1	1	1	1	0	-1	-1	-1	-1	8.16914e-06	# 0.00 Gflop/s, 336.94 GB/s, tuning took 0.000656 seconds at Tue Aug  6 22:59:38 2024
 bytes=301989888	cudaMemcpyDefault	copy,cuda_gauge_field.cpp,576	32	1	1	1	1	1	0	-1	-1	-1	-1	0.00332333	# 0.00 Gflop/s, 90.87 GB/s, tuning took 0.057597 seconds at Thu Aug  8 16:24:43 2024
 bytes=301989888	cudaMemcpyDefault	saveCPUField,cuda_gauge_field.cpp,658	32	1	1	1	1	1	0	-1	-1	-1	-1	0.00284228	# 0.00 Gflop/s, 106.25 GB/s, tuning took 0.029197 seconds at Thu Aug  8 16:28:31 2024
   bytes=3145728	cudaMemcpyDeviceToDevice	exchangeGhost,cuda_gauge_field.cpp,193	32	1	1	1	1	1	0	-1	-1	-1	-1	1.89302e-05	# 0.00 Gflop/s, 332.35 GB/s, tuning took 0.001079 seconds at Thu Aug  8 16:24:54 2024
   bytes=3407872	cudaMemsetAsync	zero,color_spinor_field.cpp,469	32	1	1	1	1	1	0	-1	-1	-1	-1	1.27288e-05	# 0.00 Gflop/s, 267.73 GB/s, tuning took 0.002942 seconds at Sun Aug 11 15:11:24 2024
    bytes=344064	cudaMemset	allocateGhostBuffer,lattice_field.cpp,288	32	1	1	1	1	1	0	-1	-1	-1	-1	1.53976e-05	# 0.00 Gflop/s, 22.35 GB/s, tuning took 0.000650 seconds at Thu Aug  8 14:21:48 2024
    bytes=344064	cudaMemset	allocateGhostBuffer,lattice_field.cpp,293	32	1	1	1	1	1	0	-1	-1	-1	-1	9.6861e-06	# 0.00 Gflop/s, 35.52 GB/s, tuning took 0.000631 seconds at Thu Aug  8 14:21:48 2024
    bytes=393216	cudaMemcpyDeviceToDevice	exchangeGhost,cuda_gauge_field.cpp,193	32	1	1	1	1	1	0	-1	-1	-1	-1	6.2441e-06	# 0.00 Gflop/s, 125.95 GB/s, tuning took 0.000404 seconds at Tue Aug  6 22:59:38 2024
   bytes=3981312	cudaMemcpyDeviceToDevice	exchangeGhost,cuda_gauge_field.cpp,193	32	1	1	1	1	1	0	-1	-1	-1	-1	1.39337e-05	# 0.00 Gflop/s, 571.46 GB/s, tuning took 0.000740 seconds at Wed Aug 14 09:48:50 2024
   bytes=4128768	cudaMemset	allocateGhostBuffer,lattice_field.cpp,288	32	1	1	1	1	1	0	-1	-1	-1	-1	1.32747e-05	# 0.00 Gflop/s, 311.03 GB/s, tuning took 0.000797 seconds at Wed Aug 14 14:26:54 2024
   bytes=4128768	cudaMemset	allocateGhostBuffer,lattice_field.cpp,293	32	1	1	1	1	1	0	-1	-1	-1	-1	9.2848e-06	# 0.00 Gflop/s, 444.68 GB/s, tuning took 0.000606 seconds at Wed Aug 14 14:26:54 2024
     bytes=49152	cudaMemcpyDeviceToDevice	exchangeGhost,cuda_gauge_field.cpp,193	32	1	1	1	1	1	0	-1	-1	-1	-1	6.59958e-06	# 0.00 Gflop/s, 14.90 GB/s, tuning took 0.000453 seconds at Thu Aug  8 11:59:52 2024
    bytes=589824	cudaMemcpyDefault	copy,cuda_gauge_field.cpp,576	32	1	1	1	1	1	0	-1	-1	-1	-1	7.66097e-06	# 0.00 Gflop/s, 76.99 GB/s, tuning took 0.000506 seconds at Thu Aug  8 11:59:52 2024
    bytes=589824	cudaMemcpyDefault	saveCPUField,cuda_gauge_field.cpp,658	32	1	1	1	1	1	0	-1	-1	-1	-1	8.21535e-06	# 0.00 Gflop/s, 71.80 GB/s, tuning took 0.000567 seconds at Thu Aug  8 11:59:53 2024
    bytes=589824	cudaMemcpyDeviceToDevice	exchangeGhost,cuda_gauge_field.cpp,193	32	1	1	1	1	1	0	-1	-1	-1	-1	1.20747e-05	# 0.00 Gflop/s, 97.70 GB/s, tuning took 0.000611 seconds at Wed Aug 14 14:26:54 2024
   bytes=6291456	cudaMemcpyDeviceToDevice	exchangeGhost,cuda_gauge_field.cpp,193	32	1	1	1	1	1	0	-1	-1	-1	-1	1.7569e-05	# 0.00 Gflop/s, 716.20 GB/s, tuning took 0.000813 seconds at Thu Aug  8 16:24:54 2024
    bytes=786432	cudaMemcpyDeviceToDevice	exchangeGhost,cuda_gauge_field.cpp,193	32	1	1	1	1	1	0	-1	-1	-1	-1	6.94568e-06	# 0.00 Gflop/s, 226.45 GB/s, tuning took 0.000436 seconds at Tue Aug  6 22:59:38 2024
    bytes=786432	cudaMemsetAsync	zero,color_spinor_field.cpp,469	32	1	1	1	1	1	0	-1	-1	-1	-1	9.32937e-06	# 0.00 Gflop/s, 84.30 GB/s, tuning took 0.002696 seconds at Tue Aug 13 20:18:32 2024
   bytes=9437184	cudaMemcpyDefault	copy,cuda_gauge_field.cpp,576	32	1	1	1	1	1	0	-1	-1	-1	-1	2.31253e-05	# 0.00 Gflop/s, 408.09 GB/s, tuning took 0.001215 seconds at Thu Aug  8 14:24:41 2024
   bytes=9437184	cudaMemcpyDefault	saveCPUField,cuda_gauge_field.cpp,658	32	1	1	1	1	1	0	-1	-1	-1	-1	1.8944e-05	# 0.00 Gflop/s, 498.16 GB/s, tuning took 0.001194 seconds at Thu Aug  8 14:24:48 2024
     bytes=98304	cudaMemcpyDeviceToDevice	exchangeGhost,cuda_gauge_field.cpp,193	32	1	1	1	1	1	0	-1	-1	-1	-1	6.55913e-06	# 0.00 Gflop/s, 29.97 GB/s, tuning took 0.000404 seconds at Thu Aug  8 14:21:48 2024
