test/.cache/tunecache.tsv
tunecache	1.1.0	1.1.0--sm_70	cpu_arch=x86_64,gpu_arch=sm_70,cuda_version=11.6.124	# Last updated Sun Sep 24 15:37:37 2023

          volume	name	aux	block.x	block.y	block.z	grid.x	grid.y	grid.z	shared_bytes	aux.x	aux.y	aux.z	aux.w	time	comment
     16x16x16x64	N4quda15CopyColorSpinorILi4ELi3ENS_11colorspinor11FloatNOrderIdLi4ELi3ELi2ELb0ELb0EEENS1_21SpaceSpinorColorOrderIdLi4ELi3EEESt5tupleIJRNS_16ColorSpinorFieldERKS7_19QudaFieldLocation_sPdPKdEEEE	GPU-offline,vol=262144,parity=1,precision=8,order=9,Ns=4,Nc=3vol=262144,parity=1,precision=8,order=2,Ns=4,Nc=3,NonRelBasis	864	1	1	304	1	1	0	-1	-1	-1	-1	0.0001387	# 0.00 Gflop/s, 725.76 GB/s, tuning took 0.025334 seconds at Sat Sep 23 20:30:54 2023
     16x16x16x64	N4quda15CopyColorSpinorILi4ELi3ENS_11colorspinor21SpaceSpinorColorOrderIdLi4ELi3EEENS1_11FloatNOrderIdLi4ELi3ELi2ELb0ELb0EEESt5tupleIJRNS_16ColorSpinorFieldERKS7_19QudaFieldLocation_sPdPKdEEEE	GPU-offline,vol=262144,parity=1,precision=8,order=2,Ns=4,Nc=3vol=262144,parity=1,precision=8,order=9,Ns=4,Nc=3,RelBasis	640	1	1	410	1	1	0	-1	-1	-1	-1	0.0001316	# 0.00 Gflop/s, 764.92 GB/s, tuning took 0.022782 seconds at Sat Sep 23 20:31:12 2023
     16x16x16x64	N4quda4PackIdLi3ELb1EEE	policy_kernel,vol=262144,parity=1,precision=8,order=2,Ns=4,Nc=3,comm=0110,topo=1221,nFace=1,device-device	224	1	1	152	1	1	0	-1	-1	-1	-1	2.81125e-05	# 27.97 Gflop/s, 671.39 GB/s, tuning took 0.640473 seconds at Sat Sep 23 20:30:54 2023
     16x16x16x64	N4quda4PackIdLi3ELb1EEE	policy_kernel,vol=262144,parity=1,precision=8,order=2,Ns=4,Nc=3,comm=0110,topo=1221,nFace=1,device-remote	128	1	1	17	1	1	0	-1	-1	-1	-1	0.000144064	# 5.46 Gflop/s, 131.01 GB/s, tuning took 2.287495 seconds at Sat Sep 23 20:31:08 2023
     16x16x16x64	N4quda4PackIdLi3ELb1EEE	policy_kernel,vol=262144,parity=1,precision=8,order=2,Ns=4,Nc=3,comm=0110,topo=1221,nFace=1,host-device	448	1	1	6	1	1	0	-1	-1	-1	-1	7.73071e-05	# 10.17 Gflop/s, 244.15 GB/s, tuning took 0.079760 seconds at Sat Sep 23 20:31:02 2023
     16x16x16x64	N4quda4PackIdLi3ELb1EEE	policy_kernel,vol=262144,parity=1,precision=8,order=2,Ns=4,Nc=3,comm=0110,topo=1221,nFace=1,host-host	128	1	1	4	1	1	0	-1	-1	-1	-1	0.000483403	# 1.63 Gflop/s, 39.04 GB/s, tuning took 0.234181 seconds at Sat Sep 23 20:30:56 2023
     16x16x16x64	N4quda4PackIdLi3ELb1EEE	policy_kernel,vol=262144,parity=1,precision=8,order=2,Ns=4,Nc=3,comm=0110,topo=1221,nFace=1,host-remote	352	1	1	4	1	1	0	-1	-1	-1	-1	0.000144571	# 5.44 Gflop/s, 130.55 GB/s, tuning took 0.094335 seconds at Sat Sep 23 20:31:08 2023
     16x16x16x64	N4quda6WilsonINS_9WilsonArgIdLi3ELi4EL21QudaReconstructType_s12EEEEE	policy,commDim=0110,parity=1,topo=1221,p2p=3,gdr=0,nvshmem=0,pol=110000111100110000	32	1	1	1	1	1	0	6	2	0	-1	0.00108713	# 318.30 Gflop/s, 555.58 GB/s, tuning took 0.273763 seconds at Sat Sep 23 20:31:12 2023
     16x16x16x64	N4quda6WilsonINS_9WilsonArgIdLi3ELi4EL21QudaReconstructType_s12EEEEE	policy_kernel=exterior_all,commDim=0110,parity=1	64	1	1	1024	1	1	19661	-1	-1	-1	-1	5.2512e-05	# 224.64 Gflop/s, 718.86 GB/s, tuning took 0.078717 seconds at Sat Sep 23 20:30:55 2023
     16x16x16x64	N4quda6WilsonINS_9WilsonArgIdLi3ELi4EL21QudaReconstructType_s12EEEEE	policy_kernel=exterior_all,commDim=0110,parity=1,zero_copy,p2p=0	224	1	1	293	1	1	32769	-1	-1	-1	-1	0.000517429	# 22.80 Gflop/s, 72.95 GB/s, tuning took 0.609930 seconds at Sat Sep 23 20:30:57 2023
     16x16x16x64	N4quda6WilsonINS_9WilsonArgIdLi3ELi4EL21QudaReconstructType_s12EEEEE	policy_kernel=exterior_all,commDim=0110,parity=1,zero_copy,p2p=1	32	1	1	2048	1	1	10923	-1	-1	-1	-1	5.23486e-05	# 225.34 Gflop/s, 721.10 GB/s, tuning took 0.078162 seconds at Sat Sep 23 20:31:02 2023
     16x16x16x64	N4quda6WilsonINS_9WilsonArgIdLi3ELi4EL21QudaReconstructType_s12EEEEE	policy_kernel=exterior_y,commDim=0110,parity=1	32	1	1	1024	1	1	7022	-1	-1	-1	-1	2.75114e-05	# 214.39 Gflop/s, 686.06 GB/s, tuning took 0.051353 seconds at Sat Sep 23 20:30:55 2023
     16x16x16x64	N4quda6WilsonINS_9WilsonArgIdLi3ELi4EL21QudaReconstructType_s12EEEEE	policy_kernel=exterior_y,commDim=0110,parity=1,zero_copy,p2p=0	16	1	1	2048	1	1	49153	-1	-1	-1	-1	0.000262712	# 22.45 Gflop/s, 71.84 GB/s, tuning took 0.316232 seconds at Sat Sep 23 20:30:56 2023
     16x16x16x64	N4quda6WilsonINS_9WilsonArgIdLi3ELi4EL21QudaReconstructType_s12EEEEE	policy_kernel=exterior_y,commDim=0110,parity=1,zero_copy,p2p=1	32	1	1	1024	1	1	7022	-1	-1	-1	-1	2.75422e-05	# 214.15 Gflop/s, 685.29 GB/s, tuning took 0.049660 seconds at Sat Sep 23 20:31:02 2023
     16x16x16x64	N4quda6WilsonINS_9WilsonArgIdLi3ELi4EL21QudaReconstructType_s12EEEEE	policy_kernel=exterior_z,commDim=0110,parity=1	16	1	1	2048	1	1	7022	-1	-1	-1	-1	2.74116e-05	# 215.17 Gflop/s, 688.56 GB/s, tuning took 0.050014 seconds at Sat Sep 23 20:30:55 2023
     16x16x16x64	N4quda6WilsonINS_9WilsonArgIdLi3ELi4EL21QudaReconstructType_s12EEEEE	policy_kernel=exterior_z,commDim=0110,parity=1,zero_copy,p2p=0	16	1	1	2048	1	1	49153	-1	-1	-1	-1	0.000262416	# 22.48 Gflop/s, 71.93 GB/s, tuning took 0.314398 seconds at Sat Sep 23 20:30:56 2023
     16x16x16x64	N4quda6WilsonINS_9WilsonArgIdLi3ELi4EL21QudaReconstructType_s12EEEEE	policy_kernel=exterior_z,commDim=0110,parity=1,zero_copy,p2p=1	32	1	1	1024	1	1	12289	-1	-1	-1	-1	2.76284e-05	# 213.48 Gflop/s, 683.15 GB/s, tuning took 0.050012 seconds at Sat Sep 23 20:31:02 2023
     16x16x16x64	N4quda6WilsonINS_9WilsonArgIdLi3ELi4EL21QudaReconstructType_s12EEEEE	policy_kernel=interior,comm=0110,commDim=0110,parity=1	128	1	1	2048	1	1	49153	-1	-1	-1	-1	0.000502923	# 667.71 Gflop/s, 1125.88 GB/s, tuning took 0.670383 seconds at Sat Sep 23 20:30:55 2023
     16x16x16x64	N4quda6WilsonINS_9WilsonArgIdLi3ELi4EL21QudaReconstructType_s12EEEEE	policy_kernel=interior,comm=0110,commDim=0110,parity=1,host-device	32	1	1	8192	1	1	16385	2	-1	-1	-1	0.000526624	# 639.15 Gflop/s, 1111.05 GB/s, tuning took 3.534745 seconds at Sat Sep 23 20:31:05 2023
     16x16x16x64	N4quda6WilsonINS_9WilsonArgIdLi3ELi4EL21QudaReconstructType_s12EEEEE	policy_kernel=interior,comm=0110,commDim=0110,parity=1,host-host	32	1	1	8192	1	1	16385	2	-1	-1	-1	0.000521515	# 645.41 Gflop/s, 1121.93 GB/s, tuning took 4.480603 seconds at Sat Sep 23 20:31:01 2023
     16x16x16x64	N4quda6WilsonINS_9WilsonArgIdLi3ELi4EL21QudaReconstructType_s12EEEEE	policy_kernel=interior,comm=0110,commDim=0110,parity=1,host-remote	32	1	1	8192	1	1	16385	2	-1	-1	-1	0.000516949	# 651.11 Gflop/s, 1131.84 GB/s, tuning took 3.473006 seconds at Sat Sep 23 20:31:11 2023
     16x16x32x64	N4quda10GaugeGaussIdLi3EL21QudaReconstructType_s12EEE	GPU-offline,vol=524288stride=278528precision=8geometry=4Nc=3,lie_group	192	2	1	1366	1	1	24577	-1	-1	-1	-1	0.00118089	# 0.00 Gflop/s, 181.14 GB/s, tuning took 1.531678 seconds at Sun Sep 24 15:14:51 2023
     16x16x32x64	N4quda12ExtractGhostIdLi3ENS_5gauge11FloatNOrderIdLi18ELi2ELi12EL20QudaStaggeredPhase_s0ELb1EL19QudaGhostExchange_sn2147483648ELb0EEEEE	GPU-offline,vol=524288stride=278528precision=8geometry=4Nc=3,extract	32	1	7	1024	1	2	0	-1	-1	-1	-1	3.81243e-05	# 0.00 Gflop/s, 453.82 GB/s, tuning took 0.087889 seconds at Sun Sep 24 15:14:47 2023
     16x16x32x64	N4quda15CopyColorSpinorILi4ELi3ENS_11colorspinor11FloatNOrderIdLi4ELi3ELi2ELb0ELb0EEENS1_21SpaceSpinorColorOrderIdLi4ELi3EEESt5tupleIJRNS_16ColorSpinorFieldERKS7_19QudaFieldLocation_sPdPKdEEEE	GPU-offline,vol=524288,parity=1,precision=8,order=9,Ns=4,Nc=3vol=524288,parity=1,precision=8,order=2,Ns=4,Nc=3,NonRelBasis	832	1	1	631	1	1	0	-1	-1	-1	-1	0.000272008	# 0.00 Gflop/s, 740.15 GB/s, tuning took 0.046730 seconds at Sat Sep 23 13:38:02 2023
     16x16x32x64	N4quda15CopyColorSpinorILi4ELi3ENS_11colorspinor21SpaceSpinorColorOrderIdLi4ELi3EEENS1_11FloatNOrderIdLi4ELi3ELi2ELb0ELb0EEESt5tupleIJRNS_16ColorSpinorFieldERKS7_19QudaFieldLocation_sPdPKdEEEE	GPU-offline,vol=524288,parity=1,precision=8,order=2,Ns=4,Nc=3vol=524288,parity=1,precision=8,order=9,Ns=4,Nc=3,RelBasis	704	1	1	745	1	1	0	-1	-1	-1	-1	0.000259072	# 0.00 Gflop/s, 777.11 GB/s, tuning took 0.034178 seconds at Sat Sep 23 13:38:53 2023
     16x16x32x64	N4quda4PackIdLi3ELb1EEE	policy_kernel,vol=524288,parity=1,precision=8,order=2,Ns=4,Nc=3,comm=0100,topo=1211,nFace=1,device-device	576	1	1	64	1	1	0	-1	-1	-1	-1	2.86546e-05	# 27.45 Gflop/s, 658.68 GB/s, tuning took 0.662883 seconds at Sat Sep 23 13:38:02 2023
     16x16x32x64	N4quda4PackIdLi3ELb1EEE	policy_kernel,vol=524288,parity=1,precision=8,order=2,Ns=4,Nc=3,comm=0100,topo=1211,nFace=1,device-remote	32	1	1	17	1	1	0	-1	-1	-1	-1	0.000281624	# 2.79 Gflop/s, 67.02 GB/s, tuning took 4.193733 seconds at Sat Sep 23 13:38:39 2023
     16x16x32x64	N4quda4PackIdLi3ELb1EEE	policy_kernel,vol=524288,parity=1,precision=8,order=2,Ns=4,Nc=3,comm=0100,topo=1211,nFace=1,host-device	512	1	1	3	1	1	0	-1	-1	-1	-1	0.0001315	# 5.98 Gflop/s, 143.53 GB/s, tuning took 0.089858 seconds at Sat Sep 23 13:38:21 2023
     16x16x32x64	N4quda4PackIdLi3ELb1EEE	policy_kernel,vol=524288,parity=1,precision=8,order=2,Ns=4,Nc=3,comm=0100,topo=1211,nFace=1,host-host	224	1	1	1	1	1	0	-1	-1	-1	-1	0.000483403	# 1.63 Gflop/s, 39.04 GB/s, tuning took 0.155412 seconds at Sat Sep 23 13:38:04 2023
     16x16x32x64	N4quda4PackIdLi3ELb1EEE	policy_kernel,vol=524288,parity=1,precision=8,order=2,Ns=4,Nc=3,comm=0100,topo=1211,nFace=1,host-remote	256	1	1	2	1	1	0	-1	-1	-1	-1	0.000282144	# 2.79 Gflop/s, 66.90 GB/s, tuning took 0.122036 seconds at Sat Sep 23 13:38:39 2023
     16x16x32x64	N4quda6WilsonINS_9WilsonArgIdLi3ELi4EL21QudaReconstructType_s12EEEEE	policy,commDim=0100,parity=1,topo=1211,p2p=3,gdr=0,nvshmem=0,pol=110000111100110000	32	1	1	1	1	1	0	13	2	0	-1	0.00111828	# 618.86 Gflop/s, 1080.19 GB/s, tuning took 0.191863 seconds at Sat Sep 23 13:38:53 2023
     16x16x32x64	N4quda6WilsonINS_9WilsonArgIdLi3ELi4EL21QudaReconstructType_s12EEEEE	policy_kernel=exterior_all,commDim=0100,parity=1	32	1	1	2048	1	1	12289	-1	-1	-1	-1	5.376e-05	# 219.43 Gflop/s, 702.17 GB/s, tuning took 0.080565 seconds at Sat Sep 23 13:38:04 2023
     16x16x32x64	N4quda6WilsonINS_9WilsonArgIdLi3ELi4EL21QudaReconstructType_s12EEEEE	policy_kernel=exterior_all,commDim=0100,parity=1,zero_copy,p2p=0	16	1	1	4096	1	1	49153	-1	-1	-1	-1	0.000518389	# 22.76 Gflop/s, 72.82 GB/s, tuning took 0.625573 seconds at Sat Sep 23 13:38:06 2023
     16x16x32x64	N4quda6WilsonINS_9WilsonArgIdLi3ELi4EL21QudaReconstructType_s12EEEEE	policy_kernel=exterior_all,commDim=0100,parity=1,zero_copy,p2p=1	32	1	1	2048	1	1	12289	-1	-1	-1	-1	5.38223e-05	# 219.17 Gflop/s, 701.36 GB/s, tuning took 0.090784 seconds at Sat Sep 23 13:38:21 2023
     16x16x32x64	N4quda6WilsonINS_9WilsonArgIdLi3ELi4EL21QudaReconstructType_s12EEEEE	policy_kernel=exterior_y,commDim=0100,parity=1	16	1	1	4096	1	1	7022	-1	-1	-1	-1	5.25996e-05	# 224.27 Gflop/s, 717.66 GB/s, tuning took 0.078930 seconds at Sat Sep 23 13:38:04 2023
     16x16x32x64	N4quda6WilsonINS_9WilsonArgIdLi3ELi4EL21QudaReconstructType_s12EEEEE	policy_kernel=exterior_y,commDim=0100,parity=1,zero_copy,p2p=0	16	1	1	4096	1	1	49153	-1	-1	-1	-1	0.000517419	# 22.80 Gflop/s, 72.96 GB/s, tuning took 0.616616 seconds at Sat Sep 23 13:38:05 2023
     16x16x32x64	N4quda6WilsonINS_9WilsonArgIdLi3ELi4EL21QudaReconstructType_s12EEEEE	policy_kernel=exterior_y,commDim=0100,parity=1,zero_copy,p2p=1	16	1	1	4096	1	1	7022	-1	-1	-1	-1	5.25625e-05	# 224.43 Gflop/s, 718.17 GB/s, tuning took 0.080242 seconds at Sat Sep 23 13:38:21 2023
     16x16x32x64	N4quda6WilsonINS_9WilsonArgIdLi3ELi4EL21QudaReconstructType_s12EEEEE	policy_kernel=interior,comm=0100,commDim=0100,parity=1	128	1	1	4096	1	1	49153	-1	-1	-1	-1	0.00101663	# 670.68 Gflop/s, 1151.07 GB/s, tuning took 1.335664 seconds at Sat Sep 23 13:38:04 2023
     16x16x32x64	N4quda6WilsonINS_9WilsonArgIdLi3ELi4EL21QudaReconstructType_s12EEEEE	policy_kernel=interior,comm=0100,commDim=0100,parity=1,host-device	32	1	1	16384	1	1	16385	2	-1	-1	-1	0.00104153	# 655.41 Gflop/s, 1141.68 GB/s, tuning took 13.688286 seconds at Sat Sep 23 13:38:35 2023
     16x16x32x64	N4quda6WilsonINS_9WilsonArgIdLi3ELi4EL21QudaReconstructType_s12EEEEE	policy_kernel=interior,comm=0100,commDim=0100,parity=1,host-host	32	1	1	16384	1	1	16385	2	-1	-1	-1	0.0010309	# 662.16 Gflop/s, 1153.44 GB/s, tuning took 15.216009 seconds at Sat Sep 23 13:38:21 2023
     16x16x32x64	N4quda6WilsonINS_9WilsonArgIdLi3ELi4EL21QudaReconstructType_s12EEEEE	policy_kernel=interior,comm=0100,commDim=0100,parity=1,host-remote	32	1	1	16384	1	1	16385	2	-1	-1	-1	0.00103126	# 661.93 Gflop/s, 1153.04 GB/s, tuning took 13.484127 seconds at Sat Sep 23 13:38:53 2023
     16x16x32x64	N4quda7RNGInitE	GPU-offline,vol=524288stride=278528precision=8geometry=4Nc=3	320	2	1	820	1	1	0	-1	-1	-1	-1	0.00748977	# 0.00 Gflop/s, 0.00 GB/s, tuning took 1.091892 seconds at Sun Sep 24 15:14:50 2023
     16x16x32x64	N4quda9CopyGaugeINS_12CopyGaugeArgIddLi18ELb0ENS_5gauge11FloatNOrderIdLi18ELi2ELi12EL20QudaStaggeredPhase_s0ELb1EL19QudaGhostExchange_sn2147483648ELb0EEENS2_8QDPOrderIdLi18EEEEEEE	GPU-offline,vol=524288stride=262144precision=8geometry=4Nc=3,vol=524288stride=278528precision=8geometry=4Nc=3	96	1	1	2731	1	8	2341	-1	-1	-1	-1	0.000616971	# 0.00 Gflop/s, 836.18 GB/s, tuning took 1.023458 seconds at Sun Sep 24 15:14:47 2023
     16x16x32x64	N4quda9CopyGaugeINS_12CopyGaugeArgIddLi18ELb0ENS_5gauge11FloatNOrderIdLi18ELi2ELi12EL20QudaStaggeredPhase_s0ELb1EL19QudaGhostExchange_sn2147483648ELb0EEES6_EEEE	GPU-offline,vol=524288stride=278528precision=8geometry=4Nc=3,vol=524288stride=278528precision=8geometry=4Nc=3,ghost	608	1	1	27	1	8	0	-1	-1	-1	-1	2.4408e-05	# 0.00 Gflop/s, 753.15 GB/s, tuning took 0.058751 seconds at Sun Sep 24 15:14:47 2023
     16x16x32x64	N4quda9CopyGaugeINS_12CopyGaugeArgIddLi18ELb0ENS_5gauge8QDPOrderIdLi18EEENS2_11FloatNOrderIdLi18ELi2ELi12EL20QudaStaggeredPhase_s0ELb1EL19QudaGhostExchange_sn2147483648ELb0EEEEEEE	GPU-offline,vol=524288stride=278528precision=8geometry=4Nc=3,vol=524288stride=262144precision=8geometry=4Nc=3	64	1	1	4096	1	8	2138	-1	-1	-1	-1	0.000648683	# 0.00 Gflop/s, 795.30 GB/s, tuning took 1.076245 seconds at Sun Sep 24 15:14:52 2023
     16x16x32x64	N4quda9CopyGaugeINS_12CopyGaugeArgIfdLi18ELb0ENS_5gauge11FloatNOrderIfLi18ELi4ELi12EL20QudaStaggeredPhase_s0ELb1EL19QudaGhostExchange_sn2147483648ELb0EEENS3_IdLi18ELi2ELi12ELS4_0ELb1ELS5_n2147483648ELb0EEEEEEE	GPU-offline,vol=524288stride=278528precision=8geometry=4Nc=3,vol=524288stride=278528precision=4geometry=4Nc=3	32	1	1	8192	1	8	0	-1	-1	-1	-1	0.000372949	# 0.00 Gflop/s, 860.34 GB/s, tuning took 0.646876 seconds at Sun Sep 24 15:14:49 2023
     16x16x32x64	N4quda9CopyGaugeINS_12CopyGaugeArgIfdLi18ELb0ENS_5gauge11FloatNOrderIfLi18ELi4ELi12EL20QudaStaggeredPhase_s0ELb1EL19QudaGhostExchange_sn2147483648ELb0EEENS3_IdLi18ELi2ELi12ELS4_0ELb1ELS5_n2147483648ELb0EEEEEEE	GPU-offline,vol=524288stride=278528precision=8geometry=4Nc=3,vol=524288stride=278528precision=4geometry=4Nc=3,ghost	128	1	3	128	1	3	9831	-1	-1	-1	-1	2.16696e-05	# 0.00 Gflop/s, 636.24 GB/s, tuning took 0.054171 seconds at Sun Sep 24 15:14:49 2023
     16x16x32x64	N4quda9CopyGaugeINS_12CopyGaugeArgIsdLi18ELb0ENS_5gauge11FloatNOrderIsLi18ELi4ELi12EL20QudaStaggeredPhase_s0ELb1EL19QudaGhostExchange_sn2147483648ELb0EEENS3_IdLi18ELi2ELi12ELS4_0ELb1ELS5_n2147483648ELb0EEEEEEE	GPU-offline,vol=524288stride=278528precision=8geometry=4Nc=3,vol=524288stride=278528precision=2geometry=4Nc=3	32	1	4	8192	1	2	0	-1	-1	-1	-1	0.000330704	# 0.00 Gflop/s, 808.54 GB/s, tuning took 0.578875 seconds at Sun Sep 24 15:14:48 2023
     16x16x32x64	N4quda9CopyGaugeINS_12CopyGaugeArgIsdLi18ELb0ENS_5gauge11FloatNOrderIsLi18ELi4ELi12EL20QudaStaggeredPhase_s0ELb1EL19QudaGhostExchange_sn2147483648ELb0EEENS3_IdLi18ELi2ELi12ELS4_0ELb1ELS5_n2147483648ELb0EEEEEEE	GPU-offline,vol=524288stride=278528precision=8geometry=4Nc=3,vol=524288stride=278528precision=2geometry=4Nc=3,ghost	32	1	5	512	1	2	0	-1	-1	-1	-1	1.79692e-05	# 0.00 Gflop/s, 639.39 GB/s, tuning took 0.049251 seconds at Sun Sep 24 15:14:48 2023
     16x32x16x64	N4quda10GaugeGaussIdLi3EL21QudaReconstructType_s12EEE	GPU-offline,vol=524288stride=278528precision=8geometry=4Nc=3,lie_group	384	1	1	683	2	1	0	-1	-1	-1	-1	0.00117873	# 0.00 Gflop/s, 181.47 GB/s, tuning took 1.533368 seconds at Sun Sep 17 02:00:13 2023
     16x32x16x64	N4quda12ExtractGhostIdLi3ENS_5gauge11FloatNOrderIdLi18ELi2ELi12EL20QudaStaggeredPhase_s0ELb1EL19QudaGhostExchange_sn2147483648ELb0EEEEE	GPU-offline,vol=524288stride=278528precision=8geometry=4Nc=3,extract	32	1	6	1024	1	2	0	-1	-1	-1	-1	3.68972e-05	# 0.00 Gflop/s, 468.91 GB/s, tuning took 0.085661 seconds at Sun Sep 17 02:00:09 2023
     16x32x16x64	N4quda15CopyColorSpinorILi4ELi3ENS_11colorspinor11FloatNOrderIdLi4ELi3ELi2ELb0ELb0EEENS1_21SpaceSpinorColorOrderIdLi4ELi3EEESt5tupleIJRNS_16ColorSpinorFieldERKS7_19QudaFieldLocation_sPdPKdEEEE	GPU-offline,vol=524288,parity=1,precision=8,order=9,Ns=4,Nc=3vol=524288,parity=1,precision=8,order=2,Ns=4,Nc=3,NonRelBasis	896	1	1	586	1	1	0	-1	-1	-1	-1	0.000273768	# 0.00 Gflop/s, 735.39 GB/s, tuning took 0.037965 seconds at Sat Sep 23 13:40:30 2023
     16x32x16x64	N4quda15CopyColorSpinorILi4ELi3ENS_11colorspinor21SpaceSpinorColorOrderIdLi4ELi3EEENS1_11FloatNOrderIdLi4ELi3ELi2ELb0ELb0EEESt5tupleIJRNS_16ColorSpinorFieldERKS7_19QudaFieldLocation_sPdPKdEEEE	GPU-offline,vol=524288,parity=1,precision=8,order=2,Ns=4,Nc=3vol=524288,parity=1,precision=8,order=9,Ns=4,Nc=3,RelBasis	704	1	1	745	1	1	0	-1	-1	-1	-1	0.00025984	# 0.00 Gflop/s, 774.81 GB/s, tuning took 0.033561 seconds at Sat Sep 23 13:41:22 2023
     16x32x16x64	N4quda4PackIdLi3ELb1EEE	policy_kernel,vol=524288,parity=1,precision=8,order=2,Ns=4,Nc=3,comm=0010,topo=1121,nFace=1,device-device	608	1	1	64	1	1	0	-1	-1	-1	-1	2.93346e-05	# 26.81 Gflop/s, 643.42 GB/s, tuning took 0.673572 seconds at Sat Sep 23 13:40:31 2023
     16x32x16x64	N4quda4PackIdLi3ELb1EEE	policy_kernel,vol=524288,parity=1,precision=8,order=2,Ns=4,Nc=3,comm=0010,topo=1121,nFace=1,device-remote	128	1	1	16	1	1	0	-1	-1	-1	-1	0.000281656	# 2.79 Gflop/s, 67.01 GB/s, tuning took 4.237421 seconds at Sat Sep 23 13:41:08 2023
     16x32x16x64	N4quda4PackIdLi3ELb1EEE	policy_kernel,vol=524288,parity=1,precision=8,order=2,Ns=4,Nc=3,comm=0010,topo=1121,nFace=1,host-device	512	1	1	3	1	1	0	-1	-1	-1	-1	0.00013194	# 5.96 Gflop/s, 143.05 GB/s, tuning took 0.104315 seconds at Sat Sep 23 13:40:50 2023
     16x32x16x64	N4quda4PackIdLi3ELb1EEE	policy_kernel,vol=524288,parity=1,precision=8,order=2,Ns=4,Nc=3,comm=0010,topo=1121,nFace=1,host-host	224	1	1	1	1	1	0	-1	-1	-1	-1	0.000483627	# 1.63 Gflop/s, 39.03 GB/s, tuning took 0.158033 seconds at Sat Sep 23 13:40:33 2023
     16x32x16x64	N4quda4PackIdLi3ELb1EEE	policy_kernel,vol=524288,parity=1,precision=8,order=2,Ns=4,Nc=3,comm=0010,topo=1121,nFace=1,host-remote	256	1	1	2	1	1	0	-1	-1	-1	-1	0.000282376	# 2.79 Gflop/s, 66.84 GB/s, tuning took 0.112540 seconds at Sat Sep 23 13:41:08 2023
     16x32x16x64	N4quda6WilsonINS_9WilsonArgIdLi3ELi4EL21QudaReconstructType_s12EEEEE	policy,commDim=0010,parity=1,topo=1121,p2p=3,gdr=0,nvshmem=0,pol=110000111100110000	32	1	1	1	1	1	0	8	2	0	-1	0.00110737	# 624.96 Gflop/s, 1090.84 GB/s, tuning took 0.188324 seconds at Sat Sep 23 13:41:22 2023
     16x32x16x64	N4quda6WilsonINS_9WilsonArgIdLi3ELi4EL21QudaReconstructType_s12EEEEE	policy_kernel=exterior_all,commDim=0010,parity=1	32	1	1	2048	1	1	8937	-1	-1	-1	-1	5.40278e-05	# 218.34 Gflop/s, 698.69 GB/s, tuning took 0.080574 seconds at Sat Sep 23 13:40:32 2023
     16x32x16x64	N4quda6WilsonINS_9WilsonArgIdLi3ELi4EL21QudaReconstructType_s12EEEEE	policy_kernel=exterior_all,commDim=0010,parity=1,zero_copy,p2p=0	16	1	1	4096	1	1	49153	-1	-1	-1	-1	0.000518411	# 22.76 Gflop/s, 72.82 GB/s, tuning took 0.616009 seconds at Sat Sep 23 13:40:34 2023
     16x32x16x64	N4quda6WilsonINS_9WilsonArgIdLi3ELi4EL21QudaReconstructType_s12EEEEE	policy_kernel=exterior_all,commDim=0010,parity=1,zero_copy,p2p=1	32	1	1	2048	1	1	8937	-1	-1	-1	-1	5.41339e-05	# 217.91 Gflop/s, 697.32 GB/s, tuning took 0.080628 seconds at Sat Sep 23 13:40:50 2023
     16x32x16x64	N4quda6WilsonINS_9WilsonArgIdLi3ELi4EL21QudaReconstructType_s12EEEEE	policy_kernel=exterior_z,commDim=0010,parity=1	16	1	1	4096	1	1	7022	-1	-1	-1	-1	5.23015e-05	# 225.55 Gflop/s, 721.75 GB/s, tuning took 0.101743 seconds at Sat Sep 23 13:40:32 2023
     16x32x16x64	N4quda6WilsonINS_9WilsonArgIdLi3ELi4EL21QudaReconstructType_s12EEEEE	policy_kernel=exterior_z,commDim=0010,parity=1,zero_copy,p2p=0	16	1	1	4096	1	1	49153	-1	-1	-1	-1	0.000517547	# 22.79 Gflop/s, 72.94 GB/s, tuning took 0.613761 seconds at Sat Sep 23 13:40:33 2023
     16x32x16x64	N4quda6WilsonINS_9WilsonArgIdLi3ELi4EL21QudaReconstructType_s12EEEEE	policy_kernel=exterior_z,commDim=0010,parity=1,zero_copy,p2p=1	16	1	1	4096	1	1	7022	-1	-1	-1	-1	5.23335e-05	# 225.41 Gflop/s, 721.31 GB/s, tuning took 0.078353 seconds at Sat Sep 23 13:40:50 2023
     16x32x16x64	N4quda6WilsonINS_9WilsonArgIdLi3ELi4EL21QudaReconstructType_s12EEEEE	policy_kernel=interior,comm=0010,commDim=0010,parity=1	128	1	1	4096	1	1	49153	-1	-1	-1	-1	0.00100901	# 675.75 Gflop/s, 1159.76 GB/s, tuning took 1.354886 seconds at Sat Sep 23 13:40:32 2023
     16x32x16x64	N4quda6WilsonINS_9WilsonArgIdLi3ELi4EL21QudaReconstructType_s12EEEEE	policy_kernel=interior,comm=0010,commDim=0010,parity=1,host-device	128	1	1	4096	1	1	49153	5	-1	-1	-1	0.00103494	# 659.57 Gflop/s, 1148.94 GB/s, tuning took 13.701968 seconds at Sat Sep 23 13:41:04 2023
     16x32x16x64	N4quda6WilsonINS_9WilsonArgIdLi3ELi4EL21QudaReconstructType_s12EEEEE	policy_kernel=interior,comm=0010,commDim=0010,parity=1,host-host	32	1	1	16384	1	1	16385	2	-1	-1	-1	0.00102965	# 662.96 Gflop/s, 1154.84 GB/s, tuning took 15.310929 seconds at Sat Sep 23 13:40:49 2023
     16x32x16x64	N4quda6WilsonINS_9WilsonArgIdLi3ELi4EL21QudaReconstructType_s12EEEEE	policy_kernel=interior,comm=0010,commDim=0010,parity=1,host-remote	128	1	1	4096	1	1	49153	2	-1	-1	-1	0.00102893	# 663.43 Gflop/s, 1155.65 GB/s, tuning took 13.559431 seconds at Sat Sep 23 13:41:21 2023
     16x32x16x64	N4quda7RNGInitE	GPU-offline,vol=524288stride=278528precision=8geometry=4Nc=3	320	2	1	820	1	1	0	-1	-1	-1	-1	0.00743513	# 0.00 Gflop/s, 0.00 GB/s, tuning took 1.093872 seconds at Sun Sep 17 02:00:11 2023
     16x32x16x64	N4quda9CopyGaugeINS_12CopyGaugeArgIddLi18ELb0ENS_5gauge11FloatNOrderIdLi18ELi2ELi12EL20QudaStaggeredPhase_s0ELb1EL19QudaGhostExchange_sn2147483648ELb0EEENS2_8QDPOrderIdLi18EEEEEEE	GPU-offline,vol=524288stride=262144precision=8geometry=4Nc=3,vol=524288stride=278528precision=8geometry=4Nc=3	128	1	1	2048	1	8	0	-1	-1	-1	-1	0.000623147	# 0.00 Gflop/s, 827.89 GB/s, tuning took 1.026735 seconds at Sun Sep 17 02:00:09 2023
     16x32x16x64	N4quda9CopyGaugeINS_12CopyGaugeArgIddLi18ELb0ENS_5gauge11FloatNOrderIdLi18ELi2ELi12EL20QudaStaggeredPhase_s0ELb1EL19QudaGhostExchange_sn2147483648ELb0EEES6_EEEE	GPU-offline,vol=524288stride=278528precision=8geometry=4Nc=3,vol=524288stride=278528precision=8geometry=4Nc=3,ghost	608	1	1	27	1	8	0	-1	-1	-1	-1	2.39867e-05	# 0.00 Gflop/s, 766.38 GB/s, tuning took 0.059131 seconds at Sun Sep 17 02:00:09 2023
     16x32x16x64	N4quda9CopyGaugeINS_12CopyGaugeArgIddLi18ELb0ENS_5gauge8QDPOrderIdLi18EEENS2_11FloatNOrderIdLi18ELi2ELi12EL20QudaStaggeredPhase_s0ELb1EL19QudaGhostExchange_sn2147483648ELb0EEEEEEE	GPU-offline,vol=524288stride=278528precision=8geometry=4Nc=3,vol=524288stride=262144precision=8geometry=4Nc=3	96	1	1	2731	1	8	2458	-1	-1	-1	-1	0.000649067	# 0.00 Gflop/s, 794.83 GB/s, tuning took 1.072970 seconds at Sun Sep 17 02:00:14 2023
     16x32x16x64	N4quda9CopyGaugeINS_12CopyGaugeArgIfdLi18ELb0ENS_5gauge11FloatNOrderIfLi18ELi4ELi12EL20QudaStaggeredPhase_s0ELb1EL19QudaGhostExchange_sn2147483648ELb0EEENS3_IdLi18ELi2ELi12ELS4_0ELb1ELS5_n2147483648ELb0EEEEEEE	GPU-offline,vol=524288stride=278528precision=8geometry=4Nc=3,vol=524288stride=278528precision=4geometry=4Nc=3	96	1	1	2731	1	8	0	-1	-1	-1	-1	0.000372107	# 0.00 Gflop/s, 862.29 GB/s, tuning took 0.634288 seconds at Sun Sep 17 02:00:10 2023
     16x32x16x64	N4quda9CopyGaugeINS_12CopyGaugeArgIfdLi18ELb0ENS_5gauge11FloatNOrderIfLi18ELi4ELi12EL20QudaStaggeredPhase_s0ELb1EL19QudaGhostExchange_sn2147483648ELb0EEENS3_IdLi18ELi2ELi12ELS4_0ELb1ELS5_n2147483648ELb0EEEEEEE	GPU-offline,vol=524288stride=278528precision=8geometry=4Nc=3,vol=524288stride=278528precision=4geometry=4Nc=3,ghost	64	1	3	256	1	3	0	-1	-1	-1	-1	1.94029e-05	# 0.00 Gflop/s, 710.57 GB/s, tuning took 0.051782 seconds at Sun Sep 17 02:00:10 2023
     16x32x16x64	N4quda9CopyGaugeINS_12CopyGaugeArgIsdLi18ELb0ENS_5gauge11FloatNOrderIsLi18ELi4ELi12EL20QudaStaggeredPhase_s0ELb1EL19QudaGhostExchange_sn2147483648ELb0EEENS3_IdLi18ELi2ELi12ELS4_0ELb1ELS5_n2147483648ELb0EEEEEEE	GPU-offline,vol=524288stride=278528precision=8geometry=4Nc=3,vol=524288stride=278528precision=2geometry=4Nc=3	96	1	4	2731	1	2	0	-1	-1	-1	-1	0.000322864	# 0.00 Gflop/s, 828.17 GB/s, tuning took 0.562417 seconds at Sun Sep 17 02:00:10 2023
     16x32x16x64	N4quda9CopyGaugeINS_12CopyGaugeArgIsdLi18ELb0ENS_5gauge11FloatNOrderIsLi18ELi4ELi12EL20QudaStaggeredPhase_s0ELb1EL19QudaGhostExchange_sn2147483648ELb0EEENS3_IdLi18ELi2ELi12ELS4_0ELb1ELS5_n2147483648ELb0EEEEEEE	GPU-offline,vol=524288stride=278528precision=8geometry=4Nc=3,vol=524288stride=278528precision=2geometry=4Nc=3,ghost	320	1	2	52	1	4	16385	-1	-1	-1	-1	1.76332e-05	# 0.00 Gflop/s, 651.57 GB/s, tuning took 0.048941 seconds at Sun Sep 17 02:00:10 2023
     16x32x32x32	N4quda10GaugeGaussIdLi3EL21QudaReconstructType_s12EEE	GPU-offline,vol=524288stride=278528precision=8geometry=4Nc=3,lie_group	384	1	1	683	2	1	12289	-1	-1	-1	-1	0.00117849	# 0.00 Gflop/s, 181.51 GB/s, tuning took 1.534216 seconds at Mon Sep 18 18:43:11 2023
     16x32x32x32	N4quda12ExtractGhostIdLi3ENS_5gauge11FloatNOrderIdLi18ELi2ELi12EL20QudaStaggeredPhase_s0ELb1EL19QudaGhostExchange_sn2147483648ELb0EEEEE	GPU-offline,vol=524288stride=278528precision=8geometry=4Nc=3,extract	64	1	3	512	1	3	0	-1	-1	-1	-1	3.63852e-05	# 0.00 Gflop/s, 432.28 GB/s, tuning took 0.084520 seconds at Mon Sep 18 18:43:06 2023
     16x32x32x32	N4quda15CopyColorSpinorILi4ELi3ENS_11colorspinor11FloatNOrderIdLi4ELi3ELi2ELb0ELb0EEENS1_21SpaceSpinorColorOrderIdLi4ELi3EEESt5tupleIJRNS_16ColorSpinorFieldERKS7_19QudaFieldLocation_sPdPKdEEEE	GPU-offline,vol=524288,parity=1,precision=8,order=9,Ns=4,Nc=3vol=524288,parity=1,precision=8,order=2,Ns=4,Nc=3,NonRelBasis	896	1	1	586	1	1	0	-1	-1	-1	-1	0.000274472	# 0.00 Gflop/s, 733.51 GB/s, tuning took 0.038035 seconds at Sun Sep  3 23:04:31 2023
     16x32x32x32	N4quda15CopyColorSpinorILi4ELi3ENS_11colorspinor21SpaceSpinorColorOrderIdLi4ELi3EEENS1_11FloatNOrderIdLi4ELi3ELi2ELb0ELb0EEESt5tupleIJRNS_16ColorSpinorFieldERKS7_19QudaFieldLocation_sPdPKdEEEE	GPU-offline,vol=524288,parity=1,precision=8,order=2,Ns=4,Nc=3vol=524288,parity=1,precision=8,order=9,Ns=4,Nc=3,RelBasis	448	1	1	1171	1	1	0	-1	-1	-1	-1	0.000259808	# 0.00 Gflop/s, 774.91 GB/s, tuning took 0.034662 seconds at Sun Sep  3 23:04:33 2023
     16x32x32x32	N4quda26WilsonCloverPreconditionedINS_15WilsonCloverArgIdLi3ELi4EL21QudaReconstructType_s12EEEEE	policy,commDim=0000,parity=1,topo=1111,p2p=0,gdr=0,nvshmem=0,pol=110000111100110000	32	1	1	1	1	1	0	7	0	0	-1	0.00156204	# 612.21 Gflop/s, 966.65 GB/s, tuning took 0.088172 seconds at Sun Sep  3 23:04:32 2023
     16x32x32x32	N4quda26WilsonCloverPreconditionedINS_15WilsonCloverArgIdLi3ELi4EL21QudaReconstructType_s12EEEEE	policy_kernel=interior,comm=0000,commDim=0000,parity=1	160	1	1	3277	1	1	49153	-1	-1	-1	-1	0.00156224	# 612.13 Gflop/s, 966.53 GB/s, tuning took 1.830577 seconds at Sun Sep  3 23:04:32 2023
     16x32x32x32	N4quda6WilsonINS_9WilsonArgIdLi3ELi4EL21QudaReconstructType_s12EEEEE	policy,commDim=0000,parity=1,topo=1111,p2p=0,gdr=0,nvshmem=0,pol=110000111100110000	32	1	1	1	1	1	0	1	0	0	-1	0.00115278	# 600.34 Gflop/s, 1047.87 GB/s, tuning took 0.065565 seconds at Sun Sep 10 15:36:50 2023
     16x32x32x32	N4quda6WilsonINS_9WilsonArgIdLi3ELi4EL21QudaReconstructType_s12EEEEE	policy_kernel=interior,comm=0000,commDim=0000,parity=1	128	1	1	4096	1	1	49153	-1	-1	-1	-1	0.00115543	# 598.96 Gflop/s, 1045.46 GB/s, tuning took 1.407409 seconds at Sun Sep 10 15:36:50 2023
     16x32x32x32	N4quda7RNGInitE	GPU-offline,vol=524288stride=278528precision=8geometry=4Nc=3	320	2	1	820	1	1	0	-1	-1	-1	-1	0.00746649	# 0.00 Gflop/s, 0.00 GB/s, tuning took 1.090606 seconds at Mon Sep 18 18:43:09 2023
     16x32x32x32	N4quda9CopyGaugeINS_12CopyGaugeArgIddLi18ELb0ENS_5gauge11FloatNOrderIdLi18ELi2ELi12EL20QudaStaggeredPhase_s0ELb1EL19QudaGhostExchange_sn2147483648ELb0EEENS2_8QDPOrderIdLi18EEEEEEE	GPU-offline,vol=524288stride=262144precision=8geometry=4Nc=3,vol=524288stride=278528precision=8geometry=4Nc=3	96	1	1	2731	1	8	2458	-1	-1	-1	-1	0.000616928	# 0.00 Gflop/s, 836.24 GB/s, tuning took 1.021697 seconds at Mon Sep 18 18:43:06 2023
     16x32x32x32	N4quda9CopyGaugeINS_12CopyGaugeArgIddLi18ELb0ENS_5gauge11FloatNOrderIdLi18ELi2ELi12EL20QudaStaggeredPhase_s0ELb1EL19QudaGhostExchange_sn2147483648ELb0EEES6_EEEE	GPU-offline,vol=524288stride=278528precision=8geometry=4Nc=3,vol=524288stride=278528precision=8geometry=4Nc=3,ghost	1024	1	1	16	1	8	24577	-1	-1	-1	-1	2.17273e-05	# 0.00 Gflop/s, 769.16 GB/s, tuning took 0.055650 seconds at Mon Sep 18 18:43:07 2023
     16x32x32x32	N4quda9CopyGaugeINS_12CopyGaugeArgIddLi18ELb0ENS_5gauge8QDPOrderIdLi18EEENS2_11FloatNOrderIdLi18ELi2ELi12EL20QudaStaggeredPhase_s0ELb1EL19QudaGhostExchange_sn2147483648ELb0EEEEEEE	GPU-offline,vol=524288stride=278528precision=8geometry=4Nc=3,vol=524288stride=262144precision=8geometry=4Nc=3	64	1	1	4096	1	8	2235	-1	-1	-1	-1	0.000648085	# 0.00 Gflop/s, 796.04 GB/s, tuning took 1.076206 seconds at Mon Sep 18 18:43:12 2023
     16x32x32x32	N4quda9CopyGaugeINS_12CopyGaugeArgIfdLi18ELb0ENS_5gauge11FloatNOrderIfLi18ELi4ELi12EL20QudaStaggeredPhase_s0ELb1EL19QudaGhostExchange_sn2147483648ELb0EEENS3_IdLi18ELi2ELi12ELS4_0ELb1ELS5_n2147483648ELb0EEEEEEE	GPU-offline,vol=524288stride=278528precision=8geometry=4Nc=3,vol=524288stride=278528precision=4geometry=4Nc=3	416	1	1	631	1	8	0	-1	-1	-1	-1	0.000372981	# 0.00 Gflop/s, 860.27 GB/s, tuning took 0.649407 seconds at Mon Sep 18 18:43:08 2023
     16x32x32x32	N4quda9CopyGaugeINS_12CopyGaugeArgIfdLi18ELb0ENS_5gauge11FloatNOrderIfLi18ELi4ELi12EL20QudaStaggeredPhase_s0ELb1EL19QudaGhostExchange_sn2147483648ELb0EEENS3_IdLi18ELi2ELi12ELS4_0ELb1ELS5_n2147483648ELb0EEEEEEE	GPU-offline,vol=524288stride=278528precision=8geometry=4Nc=3,vol=524288stride=278528precision=4geometry=4Nc=3,ghost	224	1	3	74	1	3	24577	-1	-1	-1	-1	1.8656e-05	# 0.00 Gflop/s, 671.84 GB/s, tuning took 0.050222 seconds at Mon Sep 18 18:43:08 2023
     16x32x32x32	N4quda9CopyGaugeINS_12CopyGaugeArgIsdLi18ELb0ENS_5gauge11FloatNOrderIsLi18ELi4ELi12EL20QudaStaggeredPhase_s0ELb1EL19QudaGhostExchange_sn2147483648ELb0EEENS3_IdLi18ELi2ELi12ELS4_0ELb1ELS5_n2147483648ELb0EEEEEEE	GPU-offline,vol=524288stride=278528precision=8geometry=4Nc=3,vol=524288stride=278528precision=2geometry=4Nc=3	32	1	7	8192	1	2	0	-1	-1	-1	-1	0.000330664	# 0.00 Gflop/s, 808.64 GB/s, tuning took 0.578968 seconds at Mon Sep 18 18:43:07 2023
     16x32x32x32	N4quda9CopyGaugeINS_12CopyGaugeArgIsdLi18ELb0ENS_5gauge11FloatNOrderIsLi18ELi4ELi12EL20QudaStaggeredPhase_s0ELb1EL19QudaGhostExchange_sn2147483648ELb0EEENS3_IdLi18ELi2ELi12ELS4_0ELb1ELS5_n2147483648ELb0EEEEEEE	GPU-offline,vol=524288stride=278528precision=8geometry=4Nc=3,vol=524288stride=278528precision=2geometry=4Nc=3,ghost	480	1	1	35	1	8	12289	-1	-1	-1	-1	1.64551e-05	# 0.00 Gflop/s, 634.75 GB/s, tuning took 0.047120 seconds at Mon Sep 18 18:43:07 2023
     16x32x32x64	N4quda10GaugeGaussIdLi3EL21QudaReconstructType_s12EEE	GPU-offline,vol=1048576stride=557056precision=8geometry=4Nc=3,lie_group	192	2	1	2731	1	1	0	-1	-1	-1	-1	0.0023293	# 0.00 Gflop/s, 183.67 GB/s, tuning took 3.072065 seconds at Sat Sep 23 13:35:31 2023
     16x32x32x64	N4quda12ExtractGhostIdLi3ENS_5gauge11FloatNOrderIdLi18ELi2ELi12EL20QudaStaggeredPhase_s0ELb1EL19QudaGhostExchange_sn2147483648ELb0EEEEE	GPU-offline,vol=1048576stride=557056precision=8geometry=4Nc=3,extract	32	1	3	2048	1	3	0	-1	-1	-1	-1	6.4108e-05	# 0.00 Gflop/s, 441.62 GB/s, tuning took 0.137067 seconds at Sat Sep 23 13:35:23 2023
     16x32x32x64	N4quda15CopyColorSpinorILi4ELi3ENS_11colorspinor11FloatNOrderIdLi4ELi3ELi2ELb0ELb0EEENS1_21SpaceSpinorColorOrderIdLi4ELi3EEESt5tupleIJRNS_16ColorSpinorFieldERKS7_19QudaFieldLocation_sPdPKdEEEE	GPU-offline,cmem,vol=1048576,parity=1,precision=8,order=9,Ns=4,Nc=3vol=1048576,parity=1,precision=8,order=2,Ns=4,Nc=3,NonRelBasis	832	1	1	1261	1	1	0	-1	-1	-1	-1	0.000546293	# 0.00 Gflop/s, 737.06 GB/s, tuning took 0.069415 seconds at Mon Aug 28 16:47:33 2023
     16x32x32x64	N4quda15CopyColorSpinorILi4ELi3ENS_11colorspinor11FloatNOrderIdLi4ELi3ELi2ELb0ELb0EEENS1_21SpaceSpinorColorOrderIdLi4ELi3EEESt5tupleIJRNS_16ColorSpinorFieldERKS7_19QudaFieldLocation_sPdPKdEEEE	GPU-offline,vol=1048576,parity=1,precision=8,order=9,Ns=4,Nc=3vol=1048576,parity=1,precision=8,order=2,Ns=4,Nc=3,NonRelBasis	864	1	1	1214	1	1	0	-1	-1	-1	-1	0.000543232	# 0.00 Gflop/s, 741.22 GB/s, tuning took 0.073090 seconds at Sun Sep 10 15:52:17 2023
     16x32x32x64	N4quda15CopyColorSpinorILi4ELi3ENS_11colorspinor21SpaceSpinorColorOrderIdLi4ELi3EEENS1_11FloatNOrderIdLi4ELi3ELi2ELb0ELb0EEESt5tupleIJRNS_16ColorSpinorFieldERKS7_19QudaFieldLocation_sPdPKdEEEE	GPU-offline,cmem,vol=1048576,parity=1,precision=8,order=2,Ns=4,Nc=3vol=1048576,parity=1,precision=8,order=9,Ns=4,Nc=3,RelBasis	416	1	1	2521	1	1	0	-1	-1	-1	-1	0.000521568	# 0.00 Gflop/s, 772.01 GB/s, tuning took 0.062552 seconds at Mon Aug 28 16:47:36 2023
     16x32x32x64	N4quda15CopyColorSpinorILi4ELi3ENS_11colorspinor21SpaceSpinorColorOrderIdLi4ELi3EEENS1_11FloatNOrderIdLi4ELi3ELi2ELb0ELb0EEESt5tupleIJRNS_16ColorSpinorFieldERKS7_19QudaFieldLocation_sPdPKdEEEE	GPU-offline,vol=1048576,parity=1,precision=8,order=2,Ns=4,Nc=3vol=1048576,parity=1,precision=8,order=9,Ns=4,Nc=3,RelBasis	704	1	1	1490	1	1	0	-1	-1	-1	-1	0.000526176	# 0.00 Gflop/s, 765.24 GB/s, tuning took 0.062549 seconds at Sun Sep 10 15:52:20 2023
     16x32x32x64	N4quda26WilsonCloverPreconditionedINS_15WilsonCloverArgIdLi3ELi4EL21QudaReconstructType_s12EEEEE	policy,GPU-offline,vol=1048576,parity=1,precision=8,order=2,Ns=4,Nc=3,commDim=0000,topo=1111,p2p=0,gdr=0,nvshmem=0,pol=110000111100110000	32	1	1	1	1	1	0	9	0	0	-1	0.00302427	# 632.42 Gflop/s, 998.56 GB/s, tuning took 0.170142 seconds at Tue Aug 29 01:52:25 2023
     16x32x32x64	N4quda26WilsonCloverPreconditionedINS_15WilsonCloverArgIdLi3ELi4EL21QudaReconstructType_s12EEEEE	policy_kernel=single,GPU-offline,vol=1048576,parity=1,precision=8,order=2,Ns=4,Nc=3,commDim=0000,comm=0000	128	1	1	8192	1	1	49153	-1	-1	-1	-1	0.00302183	# 632.93 Gflop/s, 999.36 GB/s, tuning took 3.620773 seconds at Tue Aug 29 01:52:24 2023
     16x32x32x64	N4quda4PackIdLi3ELb1EEE	policy_kernel,vol=1048576,parity=1,precision=8,order=2,Ns=4,Nc=3,comm=0110,topo=1221,nFace=1,device-device	512	1	1	64	1	1	0	-1	-1	-1	-1	5.20096e-05	# 30.24 Gflop/s, 725.80 GB/s, tuning took 1.169107 seconds at Sun Sep 24 15:28:37 2023
     16x32x32x64	N4quda4PackIdLi3ELb1EEE	policy_kernel,vol=1048576,parity=1,precision=8,order=2,Ns=4,Nc=3,comm=0110,topo=1221,nFace=1,device-remote	96	1	1	29	1	1	0	-1	-1	-1	-1	0.000282232	# 5.57 Gflop/s, 133.75 GB/s, tuning took 4.367179 seconds at Sun Sep 24 15:29:19 2023
     16x32x32x64	N4quda4PackIdLi3ELb1EEE	policy_kernel,vol=1048576,parity=1,precision=8,order=2,Ns=4,Nc=3,comm=0110,topo=1221,nFace=1,host-device	512	1	1	6	1	1	0	-1	-1	-1	-1	0.000151977	# 10.35 Gflop/s, 248.38 GB/s, tuning took 0.155794 seconds at Sun Sep 24 15:29:00 2023
     16x32x32x64	N4quda4PackIdLi3ELb1EEE	policy_kernel,vol=1048576,parity=1,precision=8,order=2,Ns=4,Nc=3,comm=0110,topo=1221,nFace=1,host-host	192	1	1	4	1	1	0	-1	-1	-1	-1	0.000961419	# 1.64 Gflop/s, 39.26 GB/s, tuning took 0.467117 seconds at Sun Sep 24 15:28:42 2023
     16x32x32x64	N4quda4PackIdLi3ELb1EEE	policy_kernel,vol=1048576,parity=1,precision=8,order=2,Ns=4,Nc=3,comm=0110,topo=1221,nFace=1,host-remote	256	1	1	4	1	1	0	-1	-1	-1	-1	0.000282544	# 5.57 Gflop/s, 133.60 GB/s, tuning took 0.180662 seconds at Sun Sep 24 15:29:19 2023
     16x32x32x64	N4quda6WilsonINS_9WilsonArgIdLi3ELi4EL21QudaReconstructType_s12EEEEE	policy,GPU-offline,vol=1048576,parity=1,precision=8,order=2,Ns=4,Nc=3,commDim=0000,topo=1111,p2p=0,gdr=0,nvshmem=0,pol=110000111100110000	32	1	1	1	1	1	0	1	0	0	-1	0.00222258	# 622.75 Gflop/s, 1086.99 GB/s, tuning took 0.125364 seconds at Mon Aug 28 16:47:36 2023
     16x32x32x64	N4quda6WilsonINS_9WilsonArgIdLi3ELi4EL21QudaReconstructType_s12EEEEE	policy,commDim=0000,parity=1,topo=1111,p2p=0,gdr=0,nvshmem=0,pol=110000111100110000	32	1	1	1	1	1	0	8	0	0	-1	0.00219581	# 630.35 Gflop/s, 1100.24 GB/s, tuning took 0.124165 seconds at Sun Sep 10 15:52:20 2023
     16x32x32x64	N4quda6WilsonINS_9WilsonArgIdLi3ELi4EL21QudaReconstructType_s12EEEEE	policy,commDim=0110,parity=1,topo=1221,p2p=3,gdr=0,nvshmem=0,pol=110000111100110000	32	1	1	1	1	1	0	9	2	0	-1	0.00238602	# 580.10 Gflop/s, 1012.53 GB/s, tuning took 0.622166 seconds at Sun Sep 24 15:29:33 2023
     16x32x32x64	N4quda6WilsonINS_9WilsonArgIdLi3ELi4EL21QudaReconstructType_s12EEEEE	policy_kernel=exterior_all,commDim=0110,parity=1	32	1	1	4096	1	1	10923	-1	-1	-1	-1	0.000102166	# 230.93 Gflop/s, 738.97 GB/s, tuning took 0.137393 seconds at Sun Sep 24 15:28:41 2023
     16x32x32x64	N4quda6WilsonINS_9WilsonArgIdLi3ELi4EL21QudaReconstructType_s12EEEEE	policy_kernel=exterior_all,commDim=0110,parity=1,zero_copy,p2p=0	160	1	1	820	1	1	16385	-1	-1	-1	-1	0.00102508	# 23.02 Gflop/s, 73.65 GB/s, tuning took 1.185450 seconds at Sun Sep 24 15:28:44 2023
     16x32x32x64	N4quda6WilsonINS_9WilsonArgIdLi3ELi4EL21QudaReconstructType_s12EEEEE	policy_kernel=exterior_all,commDim=0110,parity=1,zero_copy,p2p=1	64	1	1	2048	1	1	16385	-1	-1	-1	-1	0.000101808	# 231.74 Gflop/s, 741.57 GB/s, tuning took 0.136135 seconds at Sun Sep 24 15:29:01 2023
     16x32x32x64	N4quda6WilsonINS_9WilsonArgIdLi3ELi4EL21QudaReconstructType_s12EEEEE	policy_kernel=exterior_y,commDim=0110,parity=1	16	1	1	4096	1	1	5174	-1	-1	-1	-1	5.4336e-05	# 217.10 Gflop/s, 694.73 GB/s, tuning took 0.081747 seconds at Sun Sep 24 15:28:41 2023
     16x32x32x64	N4quda6WilsonINS_9WilsonArgIdLi3ELi4EL21QudaReconstructType_s12EEEEE	policy_kernel=exterior_y,commDim=0110,parity=1,zero_copy,p2p=0	16	1	1	4096	1	1	49153	-1	-1	-1	-1	0.000517184	# 22.81 Gflop/s, 72.99 GB/s, tuning took 0.606358 seconds at Sun Sep 24 15:28:43 2023
     16x32x32x64	N4quda6WilsonINS_9WilsonArgIdLi3ELi4EL21QudaReconstructType_s12EEEEE	policy_kernel=exterior_y,commDim=0110,parity=1,zero_copy,p2p=1	16	1	1	4096	1	1	4916	-1	-1	-1	-1	5.44472e-05	# 216.66 Gflop/s, 693.31 GB/s, tuning took 0.081768 seconds at Sun Sep 24 15:29:01 2023
     16x32x32x64	N4quda6WilsonINS_9WilsonArgIdLi3ELi4EL21QudaReconstructType_s12EEEEE	policy_kernel=exterior_z,commDim=0110,parity=1	48	1	1	1366	1	1	14044	-1	-1	-1	-1	5.28371e-05	# 223.26 Gflop/s, 714.44 GB/s, tuning took 0.078225 seconds at Sun Sep 24 15:28:40 2023
     16x32x32x64	N4quda6WilsonINS_9WilsonArgIdLi3ELi4EL21QudaReconstructType_s12EEEEE	policy_kernel=exterior_z,commDim=0110,parity=1,zero_copy,p2p=0	16	1	1	4096	1	1	49153	-1	-1	-1	-1	0.00051744	# 22.80 Gflop/s, 72.95 GB/s, tuning took 0.605429 seconds at Sun Sep 24 15:28:42 2023
     16x32x32x64	N4quda6WilsonINS_9WilsonArgIdLi3ELi4EL21QudaReconstructType_s12EEEEE	policy_kernel=exterior_z,commDim=0110,parity=1,zero_copy,p2p=1	16	1	1	4096	1	1	8193	-1	-1	-1	-1	5.30341e-05	# 222.43 Gflop/s, 711.78 GB/s, tuning took 0.078360 seconds at Sun Sep 24 15:29:00 2023
     16x32x32x64	N4quda6WilsonINS_9WilsonArgIdLi3ELi4EL21QudaReconstructType_s12EEEEE	policy_kernel=interior,comm=0000,commDim=0000,parity=1	128	1	1	8192	1	1	49153	-1	-1	-1	-1	0.00220095	# 628.87 Gflop/s, 1097.67 GB/s, tuning took 2.740906 seconds at Sun Sep 10 15:52:20 2023
     16x32x32x64	N4quda6WilsonINS_9WilsonArgIdLi3ELi4EL21QudaReconstructType_s12EEEEE	policy_kernel=interior,comm=0110,commDim=0110,parity=1	128	1	1	8192	1	1	49153	-1	-1	-1	-1	0.00219185	# 622.16 Gflop/s, 1067.78 GB/s, tuning took 2.704312 seconds at Sun Sep 24 15:28:40 2023
     16x32x32x64	N4quda6WilsonINS_9WilsonArgIdLi3ELi4EL21QudaReconstructType_s12EEEEE	policy_kernel=interior,comm=0110,commDim=0110,parity=1,host-device	128	1	1	8192	1	1	49153	4	-1	-1	-1	0.00224619	# 607.81 Gflop/s, 1058.76 GB/s, tuning took 13.550031 seconds at Sun Sep 24 15:29:15 2023
     16x32x32x64	N4quda6WilsonINS_9WilsonArgIdLi3ELi4EL21QudaReconstructType_s12EEEEE	policy_kernel=interior,comm=0110,commDim=0110,parity=1,host-host	32	1	1	32768	1	1	16385	1	-1	-1	-1	0.00225795	# 604.64 Gflop/s, 1053.24 GB/s, tuning took 15.320399 seconds at Sun Sep 24 15:29:00 2023
     16x32x32x64	N4quda6WilsonINS_9WilsonArgIdLi3ELi4EL21QudaReconstructType_s12EEEEE	policy_kernel=interior,comm=0110,commDim=0110,parity=1,host-remote	128	1	1	8192	1	1	49153	1	-1	-1	-1	0.00223513	# 610.81 Gflop/s, 1064.00 GB/s, tuning took 13.423418 seconds at Sun Sep 24 15:29:33 2023
     16x32x32x64	N4quda6WilsonINS_9WilsonArgIdLi3ELi4EL21QudaReconstructType_s12EEEEE	policy_kernel=single,GPU-offline,vol=1048576,parity=1,precision=8,order=2,Ns=4,Nc=3,commDim=0000,comm=0000	128	1	1	8192	1	1	49153	-1	-1	-1	-1	0.00222585	# 621.84 Gflop/s, 1085.39 GB/s, tuning took 2.754847 seconds at Mon Aug 28 16:47:35 2023
     16x32x32x64	N4quda7RNGInitE	GPU-offline,vol=1048576stride=557056precision=8geometry=4Nc=3	320	2	1	1639	1	1	0	-1	-1	-1	-1	0.0151729	# 0.00 Gflop/s, 0.00 GB/s, tuning took 2.237404 seconds at Sat Sep 23 13:35:28 2023
     16x32x32x64	N4quda9CopyGaugeINS_12CopyGaugeArgIddLi18ELb0ENS_5gauge11FloatNOrderIdLi18ELi2ELi12EL20QudaStaggeredPhase_s0ELb1EL19QudaGhostExchange_sn2147483648ELb0EEENS2_8QDPOrderIdLi18EEEEEEE	GPU-offline,vol=1048576stride=524288precision=8geometry=4Nc=3,vol=1048576stride=557056precision=8geometry=4Nc=3	96	1	1	5462	1	8	2341	-1	-1	-1	-1	0.00122535	# 0.00 Gflop/s, 842.04 GB/s, tuning took 2.053071 seconds at Sat Sep 23 13:35:23 2023
     16x32x32x64	N4quda9CopyGaugeINS_12CopyGaugeArgIddLi18ELb0ENS_5gauge11FloatNOrderIdLi18ELi2ELi12EL20QudaStaggeredPhase_s0ELb1EL19QudaGhostExchange_sn2147483648ELb0EEES6_EEEE	GPU-offline,vol=1048576stride=557056precision=8geometry=4Nc=3,vol=1048576stride=557056precision=8geometry=4Nc=3,ghost	928	1	1	36	1	8	24577	-1	-1	-1	-1	3.86892e-05	# 0.00 Gflop/s, 777.50 GB/s, tuning took 0.084808 seconds at Sat Sep 23 13:35:23 2023
     16x32x32x64	N4quda9CopyGaugeINS_12CopyGaugeArgIddLi18ELb0ENS_5gauge8QDPOrderIdLi18EEENS2_11FloatNOrderIdLi18ELi2ELi12EL20QudaStaggeredPhase_s0ELb1EL19QudaGhostExchange_sn2147483648ELb0EEEEEEE	GPU-offline,vol=1048576stride=557056precision=8geometry=4Nc=3,vol=1048576stride=524288precision=8geometry=4Nc=3	128	1	1	4096	1	8	3073	-1	-1	-1	-1	0.0012922	# 0.00 Gflop/s, 798.48 GB/s, tuning took 2.178169 seconds at Sat Sep 23 13:35:34 2023
     16x32x32x64	N4quda9CopyGaugeINS_12CopyGaugeArgIfdLi18ELb0ENS_5gauge11FloatNOrderIfLi18ELi4ELi12EL20QudaStaggeredPhase_s0ELb1EL19QudaGhostExchange_sn2147483648ELb0EEENS3_IdLi18ELi2ELi12ELS4_0ELb1ELS5_n2147483648ELb0EEEEEEE	GPU-offline,vol=1048576stride=557056precision=8geometry=4Nc=3,vol=1048576stride=557056precision=4geometry=4Nc=3	32	1	1	16384	1	8	0	-1	-1	-1	-1	0.000736341	# 0.00 Gflop/s, 871.51 GB/s, tuning took 1.290023 seconds at Sat Sep 23 13:35:26 2023
     16x32x32x64	N4quda9CopyGaugeINS_12CopyGaugeArgIfdLi18ELb0ENS_5gauge11FloatNOrderIfLi18ELi4ELi12EL20QudaStaggeredPhase_s0ELb1EL19QudaGhostExchange_sn2147483648ELb0EEENS3_IdLi18ELi2ELi12ELS4_0ELb1ELS5_n2147483648ELb0EEEEEEE	GPU-offline,vol=1048576stride=557056precision=8geometry=4Nc=3,vol=1048576stride=557056precision=4geometry=4Nc=3,ghost	64	1	1	512	1	8	1695	-1	-1	-1	-1	3.184e-05	# 0.00 Gflop/s, 708.57 GB/s, tuning took 0.074417 seconds at Sat Sep 23 13:35:26 2023
     16x32x32x64	N4quda9CopyGaugeINS_12CopyGaugeArgIsdLi18ELb0ENS_5gauge11FloatNOrderIsLi18ELi4ELi12EL20QudaStaggeredPhase_s0ELb1EL19QudaGhostExchange_sn2147483648ELb0EEENS3_IdLi18ELi2ELi12ELS4_0ELb1ELS5_n2147483648ELb0EEEEEEE	GPU-offline,vol=1048576stride=557056precision=8geometry=4Nc=3,vol=1048576stride=557056precision=2geometry=4Nc=3	32	1	8	16384	1	1	0	-1	-1	-1	-1	0.000658432	# 0.00 Gflop/s, 812.19 GB/s, tuning took 1.151158 seconds at Sat Sep 23 13:35:25 2023
     16x32x32x64	N4quda9CopyGaugeINS_12CopyGaugeArgIsdLi18ELb0ENS_5gauge11FloatNOrderIsLi18ELi4ELi12EL20QudaStaggeredPhase_s0ELb1EL19QudaGhostExchange_sn2147483648ELb0EEENS3_IdLi18ELi2ELi12ELS4_0ELb1ELS5_n2147483648ELb0EEEEEEE	GPU-offline,vol=1048576stride=557056precision=8geometry=4Nc=3,vol=1048576stride=557056precision=2geometry=4Nc=3,ghost	928	1	1	36	1	8	0	-1	-1	-1	-1	2.75031e-05	# 0.00 Gflop/s, 683.58 GB/s, tuning took 0.085690 seconds at Sat Sep 23 13:35:25 2023
      16x8x32x64	N4quda15CopyColorSpinorILi4ELi3ENS_11colorspinor11FloatNOrderIdLi4ELi3ELi2ELb0ELb0EEENS1_21SpaceSpinorColorOrderIdLi4ELi3EEESt5tupleIJRNS_16ColorSpinorFieldERKS7_19QudaFieldLocation_sPdPKdEEEE	GPU-offline,vol=262144,parity=1,precision=8,order=9,Ns=4,Nc=3vol=262144,parity=1,precision=8,order=2,Ns=4,Nc=3,NonRelBasis	320	1	1	820	1	1	0	-1	-1	-1	-1	0.000138192	# 0.00 Gflop/s, 728.43 GB/s, tuning took 0.025107 seconds at Sat Sep 23 13:44:15 2023
      16x8x32x64	N4quda15CopyColorSpinorILi4ELi3ENS_11colorspinor21SpaceSpinorColorOrderIdLi4ELi3EEENS1_11FloatNOrderIdLi4ELi3ELi2ELb0ELb0EEESt5tupleIJRNS_16ColorSpinorFieldERKS7_19QudaFieldLocation_sPdPKdEEEE	GPU-offline,vol=262144,parity=1,precision=8,order=2,Ns=4,Nc=3vol=262144,parity=1,precision=8,order=9,Ns=4,Nc=3,RelBasis	608	1	1	432	1	1	0	-1	-1	-1	-1	0.0001334	# 0.00 Gflop/s, 754.60 GB/s, tuning took 0.023351 seconds at Sat Sep 23 13:44:44 2023
      16x8x32x64	N4quda4PackIdLi3ELb1EEE	policy_kernel,vol=262144,parity=1,precision=8,order=2,Ns=4,Nc=3,comm=0100,topo=1411,nFace=1,device-device	160	1	1	144	1	1	0	-1	-1	-1	-1	2.87031e-05	# 27.40 Gflop/s, 657.57 GB/s, tuning took 0.647890 seconds at Sat Sep 23 13:44:15 2023
      16x8x32x64	N4quda4PackIdLi3ELb1EEE	policy_kernel,vol=262144,parity=1,precision=8,order=2,Ns=4,Nc=3,comm=0100,topo=1411,nFace=1,device-remote	128	1	1	17	1	1	0	-1	-1	-1	-1	0.000144439	# 5.44 Gflop/s, 130.67 GB/s, tuning took 2.282578 seconds at Sat Sep 23 13:44:37 2023
      16x8x32x64	N4quda4PackIdLi3ELb1EEE	policy_kernel,vol=262144,parity=1,precision=8,order=2,Ns=4,Nc=3,comm=0100,topo=1411,nFace=1,host-device	512	1	1	3	1	1	0	-1	-1	-1	-1	0.000132496	# 5.94 Gflop/s, 142.45 GB/s, tuning took 0.089768 seconds at Sat Sep 23 13:44:27 2023
      16x8x32x64	N4quda4PackIdLi3ELb1EEE	policy_kernel,vol=262144,parity=1,precision=8,order=2,Ns=4,Nc=3,comm=0100,topo=1411,nFace=1,host-host	192	1	1	1	1	1	0	-1	-1	-1	-1	0.000483328	# 1.63 Gflop/s, 39.05 GB/s, tuning took 0.155850 seconds at Sat Sep 23 13:44:16 2023
      16x8x32x64	N4quda4PackIdLi3ELb1EEE	policy_kernel,vol=262144,parity=1,precision=8,order=2,Ns=4,Nc=3,comm=0100,topo=1411,nFace=1,host-remote	320	1	1	3	1	1	0	-1	-1	-1	-1	0.000157193	# 5.00 Gflop/s, 120.07 GB/s, tuning took 0.090517 seconds at Sat Sep 23 13:44:37 2023
      16x8x32x64	N4quda6WilsonINS_9WilsonArgIdLi3ELi4EL21QudaReconstructType_s12EEEEE	policy,commDim=0100,parity=1,topo=1411,p2p=3,gdr=0,nvshmem=0,pol=110000111100110000	32	1	1	1	1	1	0	12	2	0	-1	0.000613643	# 563.90 Gflop/s, 984.25 GB/s, tuning took 0.364725 seconds at Sat Sep 23 13:44:44 2023
      16x8x32x64	N4quda6WilsonINS_9WilsonArgIdLi3ELi4EL21QudaReconstructType_s12EEEEE	policy_kernel=exterior_all,commDim=0100,parity=1	16	1	1	4096	1	1	3390	-1	-1	-1	-1	5.69778e-05	# 207.04 Gflop/s, 662.52 GB/s, tuning took 0.083851 seconds at Sat Sep 23 13:44:16 2023
      16x8x32x64	N4quda6WilsonINS_9WilsonArgIdLi3ELi4EL21QudaReconstructType_s12EEEEE	policy_kernel=exterior_all,commDim=0100,parity=1,zero_copy,p2p=0	16	1	1	4096	1	1	49153	-1	-1	-1	-1	0.000518603	# 22.75 Gflop/s, 72.79 GB/s, tuning took 0.605177 seconds at Sat Sep 23 13:44:18 2023
      16x8x32x64	N4quda6WilsonINS_9WilsonArgIdLi3ELi4EL21QudaReconstructType_s12EEEEE	policy_kernel=exterior_all,commDim=0100,parity=1,zero_copy,p2p=1	16	1	1	4096	1	1	6554	-1	-1	-1	-1	5.70364e-05	# 206.82 Gflop/s, 661.84 GB/s, tuning took 0.083878 seconds at Sat Sep 23 13:44:27 2023
      16x8x32x64	N4quda6WilsonINS_9WilsonArgIdLi3ELi4EL21QudaReconstructType_s12EEEEE	policy_kernel=exterior_y,commDim=0100,parity=1	64	1	1	1024	1	1	24577	-1	-1	-1	-1	5.57558e-05	# 211.57 Gflop/s, 677.04 GB/s, tuning took 0.082960 seconds at Sat Sep 23 13:44:16 2023
      16x8x32x64	N4quda6WilsonINS_9WilsonArgIdLi3ELi4EL21QudaReconstructType_s12EEEEE	policy_kernel=exterior_y,commDim=0100,parity=1,zero_copy,p2p=0	32	1	1	2048	1	1	49153	-1	-1	-1	-1	0.000517259	# 22.81 Gflop/s, 72.98 GB/s, tuning took 0.614835 seconds at Sat Sep 23 13:44:17 2023
      16x8x32x64	N4quda6WilsonINS_9WilsonArgIdLi3ELi4EL21QudaReconstructType_s12EEEEE	policy_kernel=exterior_y,commDim=0100,parity=1,zero_copy,p2p=1	32	1	1	2048	1	1	12289	-1	-1	-1	-1	5.58133e-05	# 211.36 Gflop/s, 676.34 GB/s, tuning took 0.082483 seconds at Sat Sep 23 13:44:27 2023
      16x8x32x64	N4quda6WilsonINS_9WilsonArgIdLi3ELi4EL21QudaReconstructType_s12EEEEE	policy_kernel=interior,comm=0100,commDim=0100,parity=1	128	1	1	2048	1	1	49153	-1	-1	-1	-1	0.000509003	# 659.73 Gflop/s, 1112.43 GB/s, tuning took 0.664868 seconds at Sat Sep 23 13:44:16 2023
      16x8x32x64	N4quda6WilsonINS_9WilsonArgIdLi3ELi4EL21QudaReconstructType_s12EEEEE	policy_kernel=interior,comm=0100,commDim=0100,parity=1,host-device	32	1	1	8192	1	1	19661	3	-1	-1	-1	0.000529792	# 635.33 Gflop/s, 1104.41 GB/s, tuning took 7.224607 seconds at Sat Sep 23 13:44:34 2023
      16x8x32x64	N4quda6WilsonINS_9WilsonArgIdLi3ELi4EL21QudaReconstructType_s12EEEEE	policy_kernel=interior,comm=0100,commDim=0100,parity=1,host-host	32	1	1	8192	1	1	19661	3	-1	-1	-1	0.000521408	# 645.55 Gflop/s, 1122.16 GB/s, tuning took 8.957589 seconds at Sat Sep 23 13:44:27 2023
      16x8x32x64	N4quda6WilsonINS_9WilsonArgIdLi3ELi4EL21QudaReconstructType_s12EEEEE	policy_kernel=interior,comm=0100,commDim=0100,parity=1,host-remote	32	1	1	8192	1	1	19661	3	-1	-1	-1	0.000519136	# 648.37 Gflop/s, 1127.08 GB/s, tuning took 7.078929 seconds at Sat Sep 23 13:44:44 2023
    32x16x16x512	N4quda10GaugeGaussIdLi3EL21QudaReconstructType_s12EEE	GPU-offline,vol=4194304stride=2228224precision=8geometry=4Nc=3,lie_group	384	1	1	5462	2	1	9831	-1	-1	-1	-1	0.00920123	# 0.00 Gflop/s, 185.98 GB/s, tuning took 12.238332 seconds at Sun Sep 24 15:36:15 2023
    32x16x16x512	N4quda12ExtractGhostIdLi3ENS_5gauge11FloatNOrderIdLi18ELi2ELi12EL20QudaStaggeredPhase_s0ELb1EL19QudaGhostExchange_sn2147483648ELb0EEEEE	GPU-offline,vol=4194304stride=2228224precision=8geometry=4Nc=3,extract	64	1	2	4096	1	4	0	-1	-1	-1	-1	0.000222029	# 0.00 Gflop/s, 573.81 GB/s, tuning took 0.453943 seconds at Sun Sep 24 15:35:43 2023
    32x16x16x512	N4quda7RNGInitE	GPU-offline,vol=4194304stride=2228224precision=8geometry=4Nc=3	320	2	1	6554	1	1	0	-1	-1	-1	-1	0.0623068	# 0.00 Gflop/s, 0.00 GB/s, tuning took 9.309767 seconds at Sun Sep 24 15:36:03 2023
    32x16x16x512	N4quda9CopyGaugeINS_12CopyGaugeArgIddLi18ELb0ENS_5gauge11FloatNOrderIdLi18ELi2ELi12EL20QudaStaggeredPhase_s0ELb1EL19QudaGhostExchange_sn2147483648ELb0EEENS2_8QDPOrderIdLi18EEEEEEE	GPU-offline,vol=4194304stride=2097152precision=8geometry=4Nc=3,vol=4194304stride=2228224precision=8geometry=4Nc=3	640	1	1	3277	1	8	0	-1	-1	-1	-1	0.00497908	# 0.00 Gflop/s, 828.91 GB/s, tuning took 8.769981 seconds at Sun Sep 24 15:35:42 2023
    32x16x16x512	N4quda9CopyGaugeINS_12CopyGaugeArgIddLi18ELb0ENS_5gauge11FloatNOrderIdLi18ELi2ELi12EL20QudaStaggeredPhase_s0ELb1EL19QudaGhostExchange_sn2147483648ELb0EEES6_EEEE	GPU-offline,vol=4194304stride=2228224precision=8geometry=4Nc=3,vol=4194304stride=2228224precision=8geometry=4Nc=3,ghost	832	1	1	158	1	8	24577	-1	-1	-1	-1	0.000170891	# 0.00 Gflop/s, 792.11 GB/s, tuning took 0.308539 seconds at Sun Sep 24 15:35:43 2023
    32x16x16x512	N4quda9CopyGaugeINS_12CopyGaugeArgIddLi18ELb0ENS_5gauge8QDPOrderIdLi18EEENS2_11FloatNOrderIdLi18ELi2ELi12EL20QudaStaggeredPhase_s0ELb1EL19QudaGhostExchange_sn2147483648ELb0EEEEEEE	GPU-offline,vol=4194304stride=2228224precision=8geometry=4Nc=3,vol=4194304stride=2097152precision=8geometry=4Nc=3	192	1	1	10923	1	8	5462	-1	-1	-1	-1	0.00524108	# 0.00 Gflop/s, 787.47 GB/s, tuning took 8.956239 seconds at Sun Sep 24 15:36:24 2023
    32x16x16x512	N4quda9CopyGaugeINS_12CopyGaugeArgIfdLi18ELb0ENS_5gauge11FloatNOrderIfLi18ELi4ELi12EL20QudaStaggeredPhase_s0ELb1EL19QudaGhostExchange_sn2147483648ELb0EEENS3_IdLi18ELi2ELi12ELS4_0ELb1ELS5_n2147483648ELb0EEEEEEE	GPU-offline,vol=4194304stride=2228224precision=8geometry=4Nc=3,vol=4194304stride=2228224precision=4geometry=4Nc=3	32	1	1	65536	1	8	0	-1	-1	-1	-1	0.00294001	# 0.00 Gflop/s, 873.10 GB/s, tuning took 5.301190 seconds at Sun Sep 24 15:35:53 2023
    32x16x16x512	N4quda9CopyGaugeINS_12CopyGaugeArgIfdLi18ELb0ENS_5gauge11FloatNOrderIfLi18ELi4ELi12EL20QudaStaggeredPhase_s0ELb1EL19QudaGhostExchange_sn2147483648ELb0EEENS3_IdLi18ELi2ELi12ELS4_0ELb1ELS5_n2147483648ELb0EEEEEEE	GPU-offline,vol=4194304stride=2228224precision=8geometry=4Nc=3,vol=4194304stride=2228224precision=4geometry=4Nc=3,ghost	384	1	1	342	1	8	0	-1	-1	-1	-1	0.0001254	# 0.00 Gflop/s, 809.60 GB/s, tuning took 0.251320 seconds at Sun Sep 24 15:35:53 2023
    32x16x16x512	N4quda9CopyGaugeINS_12CopyGaugeArgIsdLi18ELb0ENS_5gauge11FloatNOrderIsLi18ELi4ELi12EL20QudaStaggeredPhase_s0ELb1EL19QudaGhostExchange_sn2147483648ELb0EEENS3_IdLi18ELi2ELi12ELS4_0ELb1ELS5_n2147483648ELb0EEEEEEE	GPU-offline,vol=4194304stride=2228224precision=8geometry=4Nc=3,vol=4194304stride=2228224precision=2geometry=4Nc=3	96	1	1	21846	1	8	0	-1	-1	-1	-1	0.00261484	# 0.00 Gflop/s, 818.06 GB/s, tuning took 4.442211 seconds at Sun Sep 24 15:35:47 2023
    32x16x16x512	N4quda9CopyGaugeINS_12CopyGaugeArgIsdLi18ELb0ENS_5gauge11FloatNOrderIsLi18ELi4ELi12EL20QudaStaggeredPhase_s0ELb1EL19QudaGhostExchange_sn2147483648ELb0EEENS3_IdLi18ELi2ELi12ELS4_0ELb1ELS5_n2147483648ELb0EEEEEEE	GPU-offline,vol=4194304stride=2228224precision=8geometry=4Nc=3,vol=4194304stride=2228224precision=2geometry=4Nc=3,ghost	256	1	4	512	1	2	0	-1	-1	-1	-1	0.000108925	# 0.00 Gflop/s, 776.71 GB/s, tuning took 0.215614 seconds at Sun Sep 24 15:35:48 2023
     32x16x16x64	N4quda10GaugeGaussIdLi3EL21QudaReconstructType_s12EEE	GPU-offline,vol=524288stride=278528precision=8geometry=4Nc=3,lie_group	384	1	1	683	2	1	0	-1	-1	-1	-1	0.00117986	# 0.00 Gflop/s, 181.30 GB/s, tuning took 1.539361 seconds at Sat Sep 23 20:30:52 2023
     32x16x16x64	N4quda12ExtractGhostIdLi3ENS_5gauge11FloatNOrderIdLi18ELi2ELi12EL20QudaStaggeredPhase_s0ELb1EL19QudaGhostExchange_sn2147483648ELb0EEEEE	GPU-offline,vol=524288stride=278528precision=8geometry=4Nc=3,extract	32	1	8	1024	1	1	0	-1	-1	-1	-1	3.17037e-05	# 0.00 Gflop/s, 545.72 GB/s, tuning took 0.079706 seconds at Sat Sep 23 20:30:48 2023
     32x16x16x64	N4quda7RNGInitE	GPU-offline,vol=524288stride=278528precision=8geometry=4Nc=3	320	2	1	820	1	1	0	-1	-1	-1	-1	0.00748295	# 0.00 Gflop/s, 0.00 GB/s, tuning took 1.094973 seconds at Sat Sep 23 20:30:51 2023
     32x16x16x64	N4quda9CopyGaugeINS_12CopyGaugeArgIddLi18ELb0ENS_5gauge11FloatNOrderIdLi18ELi2ELi12EL20QudaStaggeredPhase_s0ELb1EL19QudaGhostExchange_sn2147483648ELb0EEENS2_8QDPOrderIdLi18EEEEEEE	GPU-offline,vol=524288stride=262144precision=8geometry=4Nc=3,vol=524288stride=278528precision=8geometry=4Nc=3	96	1	1	2731	1	8	2341	-1	-1	-1	-1	0.000617056	# 0.00 Gflop/s, 836.07 GB/s, tuning took 1.023129 seconds at Sat Sep 23 20:30:48 2023
     32x16x16x64	N4quda9CopyGaugeINS_12CopyGaugeArgIddLi18ELb0ENS_5gauge11FloatNOrderIdLi18ELi2ELi12EL20QudaStaggeredPhase_s0ELb1EL19QudaGhostExchange_sn2147483648ELb0EEES6_EEEE	GPU-offline,vol=524288stride=278528precision=8geometry=4Nc=3,vol=524288stride=278528precision=8geometry=4Nc=3,ghost	576	1	1	29	1	8	0	-1	-1	-1	-1	2.41358e-05	# 0.00 Gflop/s, 761.64 GB/s, tuning took 0.059475 seconds at Sat Sep 23 20:30:49 2023
     32x16x16x64	N4quda9CopyGaugeINS_12CopyGaugeArgIddLi18ELb0ENS_5gauge8QDPOrderIdLi18EEENS2_11FloatNOrderIdLi18ELi2ELi12EL20QudaStaggeredPhase_s0ELb1EL19QudaGhostExchange_sn2147483648ELb0EEEEEEE	GPU-offline,vol=524288stride=278528precision=8geometry=4Nc=3,vol=524288stride=262144precision=8geometry=4Nc=3	64	1	1	4096	1	8	1821	-1	-1	-1	-1	0.000647584	# 0.00 Gflop/s, 796.65 GB/s, tuning took 1.077001 seconds at Sat Sep 23 20:30:54 2023
     32x16x16x64	N4quda9CopyGaugeINS_12CopyGaugeArgIfdLi18ELb0ENS_5gauge11FloatNOrderIfLi18ELi4ELi12EL20QudaStaggeredPhase_s0ELb1EL19QudaGhostExchange_sn2147483648ELb0EEENS3_IdLi18ELi2ELi12ELS4_0ELb1ELS5_n2147483648ELb0EEEEEEE	GPU-offline,vol=524288stride=278528precision=8geometry=4Nc=3,vol=524288stride=278528precision=4geometry=4Nc=3	32	1	1	8192	1	8	0	-1	-1	-1	-1	0.000372843	# 0.00 Gflop/s, 860.59 GB/s, tuning took 0.648652 seconds at Sat Sep 23 20:30:50 2023
     32x16x16x64	N4quda9CopyGaugeINS_12CopyGaugeArgIfdLi18ELb0ENS_5gauge11FloatNOrderIfLi18ELi4ELi12EL20QudaStaggeredPhase_s0ELb1EL19QudaGhostExchange_sn2147483648ELb0EEENS3_IdLi18ELi2ELi12ELS4_0ELb1ELS5_n2147483648ELb0EEEEEEE	GPU-offline,vol=524288stride=278528precision=8geometry=4Nc=3,vol=524288stride=278528precision=4geometry=4Nc=3,ghost	64	1	5	256	1	2	0	-1	-1	-1	-1	1.96563e-05	# 0.00 Gflop/s, 701.41 GB/s, tuning took 0.052758 seconds at Sat Sep 23 20:30:50 2023
     32x16x16x64	N4quda9CopyGaugeINS_12CopyGaugeArgIsdLi18ELb0ENS_5gauge11FloatNOrderIsLi18ELi4ELi12EL20QudaStaggeredPhase_s0ELb1EL19QudaGhostExchange_sn2147483648ELb0EEENS3_IdLi18ELi2ELi12ELS4_0ELb1ELS5_n2147483648ELb0EEEEEEE	GPU-offline,vol=524288stride=278528precision=8geometry=4Nc=3,vol=524288stride=278528precision=2geometry=4Nc=3	256	1	4	1024	1	2	0	-1	-1	-1	-1	0.000330456	# 0.00 Gflop/s, 809.15 GB/s, tuning took 0.577814 seconds at Sat Sep 23 20:30:49 2023
     32x16x16x64	N4quda9CopyGaugeINS_12CopyGaugeArgIsdLi18ELb0ENS_5gauge11FloatNOrderIsLi18ELi4ELi12EL20QudaStaggeredPhase_s0ELb1EL19QudaGhostExchange_sn2147483648ELb0EEENS3_IdLi18ELi2ELi12ELS4_0ELb1ELS5_n2147483648ELb0EEEEEEE	GPU-offline,vol=524288stride=278528precision=8geometry=4Nc=3,vol=524288stride=278528precision=2geometry=4Nc=3,ghost	384	1	2	43	1	4	24577	-1	-1	-1	-1	1.81603e-05	# 0.00 Gflop/s, 632.66 GB/s, tuning took 0.049715 seconds at Sat Sep 23 20:30:49 2023
     32x16x32x64	N4quda10GaugeGaussIdLi3EL21QudaReconstructType_s12EEE	GPU-offline,vol=1048576stride=557056precision=8geometry=4Nc=3,lie_group	384	1	1	1366	2	1	0	-1	-1	-1	-1	0.00232789	# 0.00 Gflop/s, 183.78 GB/s, tuning took 3.083388 seconds at Sat Sep 23 13:37:59 2023
     32x16x32x64	N4quda12ExtractGhostIdLi3ENS_5gauge11FloatNOrderIdLi18ELi2ELi12EL20QudaStaggeredPhase_s0ELb1EL19QudaGhostExchange_sn2147483648ELb0EEEEE	GPU-offline,vol=1048576stride=557056precision=8geometry=4Nc=3,extract	256	1	4	256	1	2	0	-1	-1	-1	-1	5.2024e-05	# 0.00 Gflop/s, 544.20 GB/s, tuning took 0.120862 seconds at Sat Sep 23 13:37:51 2023
     32x16x32x64	N4quda7RNGInitE	GPU-offline,vol=1048576stride=557056precision=8geometry=4Nc=3	320	2	1	1639	1	1	0	-1	-1	-1	-1	0.0149794	# 0.00 Gflop/s, 0.00 GB/s, tuning took 2.237119 seconds at Sat Sep 23 13:37:56 2023
     32x16x32x64	N4quda9CopyGaugeINS_12CopyGaugeArgIddLi18ELb0ENS_5gauge11FloatNOrderIdLi18ELi2ELi12EL20QudaStaggeredPhase_s0ELb1EL19QudaGhostExchange_sn2147483648ELb0EEENS2_8QDPOrderIdLi18EEEEEEE	GPU-offline,vol=1048576stride=524288precision=8geometry=4Nc=3,vol=1048576stride=557056precision=8geometry=4Nc=3	96	1	1	5462	1	8	2341	-1	-1	-1	-1	0.00122591	# 0.00 Gflop/s, 841.66 GB/s, tuning took 2.049404 seconds at Sat Sep 23 13:37:51 2023
     32x16x32x64	N4quda9CopyGaugeINS_12CopyGaugeArgIddLi18ELb0ENS_5gauge11FloatNOrderIdLi18ELi2ELi12EL20QudaStaggeredPhase_s0ELb1EL19QudaGhostExchange_sn2147483648ELb0EEES6_EEEE	GPU-offline,vol=1048576stride=557056precision=8geometry=4Nc=3,vol=1048576stride=557056precision=8geometry=4Nc=3,ghost	928	1	1	36	1	8	24577	-1	-1	-1	-1	3.87852e-05	# 0.00 Gflop/s, 775.58 GB/s, tuning took 0.085758 seconds at Sat Sep 23 13:37:52 2023
     32x16x32x64	N4quda9CopyGaugeINS_12CopyGaugeArgIddLi18ELb0ENS_5gauge8QDPOrderIdLi18EEENS2_11FloatNOrderIdLi18ELi2ELi12EL20QudaStaggeredPhase_s0ELb1EL19QudaGhostExchange_sn2147483648ELb0EEEEEEE	GPU-offline,vol=1048576stride=557056precision=8geometry=4Nc=3,vol=1048576stride=524288precision=8geometry=4Nc=3	64	1	1	8192	1	8	1756	-1	-1	-1	-1	0.00129497	# 0.00 Gflop/s, 796.78 GB/s, tuning took 2.163482 seconds at Sat Sep 23 13:38:02 2023
     32x16x32x64	N4quda9CopyGaugeINS_12CopyGaugeArgIfdLi18ELb0ENS_5gauge11FloatNOrderIfLi18ELi4ELi12EL20QudaStaggeredPhase_s0ELb1EL19QudaGhostExchange_sn2147483648ELb0EEENS3_IdLi18ELi2ELi12ELS4_0ELb1ELS5_n2147483648ELb0EEEEEEE	GPU-offline,vol=1048576stride=557056precision=8geometry=4Nc=3,vol=1048576stride=557056precision=4geometry=4Nc=3	32	1	1	16384	1	8	0	-1	-1	-1	-1	0.000735595	# 0.00 Gflop/s, 872.39 GB/s, tuning took 1.293696 seconds at Sat Sep 23 13:37:54 2023
     32x16x32x64	N4quda9CopyGaugeINS_12CopyGaugeArgIfdLi18ELb0ENS_5gauge11FloatNOrderIfLi18ELi4ELi12EL20QudaStaggeredPhase_s0ELb1EL19QudaGhostExchange_sn2147483648ELb0EEENS3_IdLi18ELi2ELi12ELS4_0ELb1ELS5_n2147483648ELb0EEEEEEE	GPU-offline,vol=1048576stride=557056precision=8geometry=4Nc=3,vol=1048576stride=557056precision=4geometry=4Nc=3,ghost	416	1	2	79	1	4	24577	-1	-1	-1	-1	3.1618e-05	# 0.00 Gflop/s, 713.54 GB/s, tuning took 0.074364 seconds at Sat Sep 23 13:37:54 2023
     32x16x32x64	N4quda9CopyGaugeINS_12CopyGaugeArgIsdLi18ELb0ENS_5gauge11FloatNOrderIsLi18ELi4ELi12EL20QudaStaggeredPhase_s0ELb1EL19QudaGhostExchange_sn2147483648ELb0EEENS3_IdLi18ELi2ELi12ELS4_0ELb1ELS5_n2147483648ELb0EEEEEEE	GPU-offline,vol=1048576stride=557056precision=8geometry=4Nc=3,vol=1048576stride=557056precision=2geometry=4Nc=3	96	1	1	5462	1	8	0	-1	-1	-1	-1	0.000658699	# 0.00 Gflop/s, 811.86 GB/s, tuning took 1.146399 seconds at Sat Sep 23 13:37:53 2023
     32x16x32x64	N4quda9CopyGaugeINS_12CopyGaugeArgIsdLi18ELb0ENS_5gauge11FloatNOrderIsLi18ELi4ELi12EL20QudaStaggeredPhase_s0ELb1EL19QudaGhostExchange_sn2147483648ELb0EEENS3_IdLi18ELi2ELi12ELS4_0ELb1ELS5_n2147483648ELb0EEEEEEE	GPU-offline,vol=1048576stride=557056precision=8geometry=4Nc=3,vol=1048576stride=557056precision=2geometry=4Nc=3,ghost	128	1	1	256	1	8	3277	-1	-1	-1	-1	2.74071e-05	# 0.00 Gflop/s, 685.98 GB/s, tuning took 0.074323 seconds at Sat Sep 23 13:37:53 2023
     32x32x16x64	N4quda10GaugeGaussIdLi3EL21QudaReconstructType_s12EEE	GPU-offline,vol=1048576stride=557056precision=8geometry=4Nc=3,lie_group	192	2	1	2731	1	1	24577	-1	-1	-1	-1	0.00232874	# 0.00 Gflop/s, 183.71 GB/s, tuning took 3.076806 seconds at Sat Sep 23 13:40:28 2023
     32x32x16x64	N4quda12ExtractGhostIdLi3ENS_5gauge11FloatNOrderIdLi18ELi2ELi12EL20QudaStaggeredPhase_s0ELb1EL19QudaGhostExchange_sn2147483648ELb0EEEEE	GPU-offline,vol=1048576stride=557056precision=8geometry=4Nc=3,extract	128	1	3	512	1	3	0	-1	-1	-1	-1	5.22257e-05	# 0.00 Gflop/s, 542.10 GB/s, tuning took 0.122919 seconds at Sat Sep 23 13:40:20 2023
     32x32x16x64	N4quda7RNGInitE	GPU-offline,vol=1048576stride=557056precision=8geometry=4Nc=3	320	2	1	1639	1	1	0	-1	-1	-1	-1	0.014951	# 0.00 Gflop/s, 0.00 GB/s, tuning took 2.222476 seconds at Sat Sep 23 13:40:25 2023
     32x32x16x64	N4quda9CopyGaugeINS_12CopyGaugeArgIddLi18ELb0ENS_5gauge11FloatNOrderIdLi18ELi2ELi12EL20QudaStaggeredPhase_s0ELb1EL19QudaGhostExchange_sn2147483648ELb0EEENS2_8QDPOrderIdLi18EEEEEEE	GPU-offline,vol=1048576stride=524288precision=8geometry=4Nc=3,vol=1048576stride=557056precision=8geometry=4Nc=3	96	1	1	5462	1	8	2341	-1	-1	-1	-1	0.00122608	# 0.00 Gflop/s, 841.54 GB/s, tuning took 2.061214 seconds at Sat Sep 23 13:40:20 2023
     32x32x16x64	N4quda9CopyGaugeINS_12CopyGaugeArgIddLi18ELb0ENS_5gauge11FloatNOrderIdLi18ELi2ELi12EL20QudaStaggeredPhase_s0ELb1EL19QudaGhostExchange_sn2147483648ELb0EEES6_EEEE	GPU-offline,vol=1048576stride=557056precision=8geometry=4Nc=3,vol=1048576stride=557056precision=8geometry=4Nc=3,ghost	928	1	1	36	1	8	0	-1	-1	-1	-1	3.88923e-05	# 0.00 Gflop/s, 773.44 GB/s, tuning took 0.103187 seconds at Sat Sep 23 13:40:20 2023
     32x32x16x64	N4quda9CopyGaugeINS_12CopyGaugeArgIddLi18ELb0ENS_5gauge8QDPOrderIdLi18EEENS2_11FloatNOrderIdLi18ELi2ELi12EL20QudaStaggeredPhase_s0ELb1EL19QudaGhostExchange_sn2147483648ELb0EEEEEEE	GPU-offline,vol=1048576stride=557056precision=8geometry=4Nc=3,vol=1048576stride=524288precision=8geometry=4Nc=3	64	1	1	8192	1	8	1695	-1	-1	-1	-1	0.00129685	# 0.00 Gflop/s, 795.62 GB/s, tuning took 2.168040 seconds at Sat Sep 23 13:40:30 2023
     32x32x16x64	N4quda9CopyGaugeINS_12CopyGaugeArgIfdLi18ELb0ENS_5gauge11FloatNOrderIfLi18ELi4ELi12EL20QudaStaggeredPhase_s0ELb1EL19QudaGhostExchange_sn2147483648ELb0EEENS3_IdLi18ELi2ELi12ELS4_0ELb1ELS5_n2147483648ELb0EEEEEEE	GPU-offline,vol=1048576stride=557056precision=8geometry=4Nc=3,vol=1048576stride=557056precision=4geometry=4Nc=3	32	1	1	16384	1	8	0	-1	-1	-1	-1	0.000735883	# 0.00 Gflop/s, 872.05 GB/s, tuning took 1.287574 seconds at Sat Sep 23 13:40:22 2023
     32x32x16x64	N4quda9CopyGaugeINS_12CopyGaugeArgIfdLi18ELb0ENS_5gauge11FloatNOrderIfLi18ELi4ELi12EL20QudaStaggeredPhase_s0ELb1EL19QudaGhostExchange_sn2147483648ELb0EEENS3_IdLi18ELi2ELi12ELS4_0ELb1ELS5_n2147483648ELb0EEEEEEE	GPU-offline,vol=1048576stride=557056precision=8geometry=4Nc=3,vol=1048576stride=557056precision=4geometry=4Nc=3,ghost	512	1	1	64	1	8	12289	-1	-1	-1	-1	3.1514e-05	# 0.00 Gflop/s, 715.90 GB/s, tuning took 0.094552 seconds at Sat Sep 23 13:40:22 2023
     32x32x16x64	N4quda9CopyGaugeINS_12CopyGaugeArgIsdLi18ELb0ENS_5gauge11FloatNOrderIsLi18ELi4ELi12EL20QudaStaggeredPhase_s0ELb1EL19QudaGhostExchange_sn2147483648ELb0EEENS3_IdLi18ELi2ELi12ELS4_0ELb1ELS5_n2147483648ELb0EEEEEEE	GPU-offline,vol=1048576stride=557056precision=8geometry=4Nc=3,vol=1048576stride=557056precision=2geometry=4Nc=3	96	1	1	5462	1	8	0	-1	-1	-1	-1	0.000658677	# 0.00 Gflop/s, 811.89 GB/s, tuning took 1.152449 seconds at Sat Sep 23 13:40:21 2023
     32x32x16x64	N4quda9CopyGaugeINS_12CopyGaugeArgIsdLi18ELb0ENS_5gauge11FloatNOrderIsLi18ELi4ELi12EL20QudaStaggeredPhase_s0ELb1EL19QudaGhostExchange_sn2147483648ELb0EEENS3_IdLi18ELi2ELi12ELS4_0ELb1ELS5_n2147483648ELb0EEEEEEE	GPU-offline,vol=1048576stride=557056precision=8geometry=4Nc=3,vol=1048576stride=557056precision=2geometry=4Nc=3,ghost	512	1	1	64	1	8	16385	-1	-1	-1	-1	2.74764e-05	# 0.00 Gflop/s, 684.25 GB/s, tuning took 0.068220 seconds at Sat Sep 23 13:40:21 2023
    32x32x32x128	N4quda15CopyColorSpinorILi4ELi3ENS_11colorspinor11FloatNOrderIdLi4ELi3ELi2ELb0ELb0EEENS1_21SpaceSpinorColorOrderIdLi4ELi3EEESt5tupleIJRNS_16ColorSpinorFieldERKS7_19QudaFieldLocation_sPdPKdEEEE	GPU-offline,vol=4194304,parity=1,precision=8,order=9,Ns=4,Nc=3vol=4194304,parity=1,precision=8,order=2,Ns=4,Nc=3,NonRelBasis	448	1	1	9363	1	1	0	-1	-1	-1	-1	0.00214389	# 0.00 Gflop/s, 751.26 GB/s, tuning took 0.268437 seconds at Sun Sep 24 15:24:03 2023
    32x32x32x128	N4quda4PackIdLi3ELb1EEE	policy_kernel,vol=4194304,parity=1,precision=8,order=2,Ns=4,Nc=3,comm=0110,topo=1221,nFace=1,device-device	512	1	1	145	1	1	0	-1	-1	-1	-1	0.000194555	# 32.34 Gflop/s, 776.11 GB/s, tuning took 4.129379 seconds at Sun Sep 24 15:24:07 2023
    32x32x32x128	N4quda4PackIdLi3ELb1EEE	policy_kernel,vol=4194304,parity=1,precision=8,order=2,Ns=4,Nc=3,comm=0110,topo=1221,nFace=1,host-host	256	1	1	2	1	1	0	-1	-1	-1	-1	0.00382498	# 1.64 Gflop/s, 39.48 GB/s, tuning took 1.851470 seconds at Sun Sep 24 15:24:24 2023
    32x32x32x128	N4quda6WilsonINS_9WilsonArgIdLi3ELi4EL21QudaReconstructType_s12EEEEE	policy_kernel=exterior_all,commDim=0110,parity=1	64	1	1	8192	1	1	5783	-1	-1	-1	-1	0.00037504	# 251.63 Gflop/s, 805.22 GB/s, tuning took 0.453918 seconds at Sun Sep 24 15:24:22 2023
    32x32x32x128	N4quda6WilsonINS_9WilsonArgIdLi3ELi4EL21QudaReconstructType_s12EEEEE	policy_kernel=exterior_y,commDim=0110,parity=1	80	1	1	3277	1	1	19661	-1	-1	-1	-1	0.000194843	# 242.17 Gflop/s, 774.96 GB/s, tuning took 0.242454 seconds at Sun Sep 24 15:24:21 2023
    32x32x32x128	N4quda6WilsonINS_9WilsonArgIdLi3ELi4EL21QudaReconstructType_s12EEEEE	policy_kernel=exterior_z,commDim=0110,parity=1	16	1	1	16384	1	1	6145	-1	-1	-1	-1	0.000192587	# 245.01 Gflop/s, 784.04 GB/s, tuning took 0.239061 seconds at Sun Sep 24 15:24:20 2023
    32x32x32x128	N4quda6WilsonINS_9WilsonArgIdLi3ELi4EL21QudaReconstructType_s12EEEEE	policy_kernel=interior,comm=0110,commDim=0110,parity=1	128	1	1	32768	1	1	49153	-1	-1	-1	-1	0.00896287	# 608.59 Gflop/s, 1044.50 GB/s, tuning took 11.406269 seconds at Sun Sep 24 15:24:19 2023
     32x32x32x32	N4quda10CopyCloverINS_6clover11FloatNOrderIfLi72ELi4ELb0ELb0ELb0EEENS2_IdLi72ELi2ELb0ELb0ELb0EEEfdEE	GPU-offline,vol=1048576precision=8Nc=3	256	1	1	2048	2	1	0	-1	-1	-1	-1	0.00128245	# 0.00 Gflop/s, 706.43 GB/s, tuning took 1.104709 seconds at Sun Sep  3 23:04:29 2023
     32x32x32x32	N4quda10CopyCloverINS_6clover11FloatNOrderIsLi72ELi8ELb0ELb0ELb0EEENS2_IdLi72ELi2ELb0ELb0ELb0EEEsdEE	GPU-offline,vol=1048576precision=8Nc=3	64	1	1	8192	2	1	2731	-1	-1	-1	-1	0.00102714	# 0.00 Gflop/s, 735.03 GB/s, tuning took 0.904277 seconds at Sun Sep  3 23:04:28 2023
     32x32x32x32	N4quda10GaugeGaussIdLi3EL21QudaReconstructType_s12EEE	GPU-offline,vol=1048576stride=540672precision=8geometry=4Nc=3,lie_group	384	1	1	1366	2	1	24577	-1	-1	-1	-1	0.00235965	# 0.00 Gflop/s, 175.97 GB/s, tuning took 3.065818 seconds at Sun Sep  3 23:03:33 2023
     32x32x32x32	N4quda11CopyGaugeExIddLi18ENS_5gauge11FloatNOrderIdLi18ELi2ELi18EL20QudaStaggeredPhase_s0ELb1EL19QudaGhostExchange_sn2147483648ELb0EEENS2_IdLi18ELi2ELi12ELS3_0ELb1ELS4_n2147483648ELb0EEEEE	GPU-offline,vol=1048576stride=540672precision=8geometry=4Nc=3vol=1048576stride=524288precision=8geometry=4Nc=3r=0000	640	1	1	820	2	1	0	-1	-1	-1	-1	0.00140427	# 0.00 Gflop/s, 725.80 GB/s, tuning took 1.518029 seconds at Sun Sep  3 23:04:31 2023
     32x32x32x32	N4quda11CopyGaugeExIddLi18ENS_5gauge11FloatNOrderIdLi18ELi2ELi18EL20QudaStaggeredPhase_s0ELb1EL19QudaGhostExchange_sn2147483648ELb0EEES5_EE	GPU-offline,vol=1048576stride=540672precision=8geometry=4Nc=3vol=1048576stride=524288precision=8geometry=4Nc=3r=0000	608	1	1	863	2	1	0	-1	-1	-1	-1	0.00160646	# 0.00 Gflop/s, 763.69 GB/s, tuning took 1.755648 seconds at Sun Sep  3 23:03:42 2023
     32x32x32x32	N4quda12CloverInvertIdEE	GPU-offline,nParity=2,vol=1048576precision=8Nc=3,trlog=true,twist=false	160	2	1	160	1	1	9831	-1	-1	-1	-1	0.00169635	# 0.00 Gflop/s, 712.09 GB/s, tuning took 25.050255 seconds at Sun Sep  3 23:04:25 2023
     32x32x32x32	N4quda12ExtractGhostIdLi3ENS_5gauge11FloatNOrderIdLi18ELi2ELi12EL20QudaStaggeredPhase_s0ELb1EL19QudaGhostExchange_sn2147483648ELb0EEEEE	GPU-offline,vol=1048576stride=540672precision=8geometry=4Nc=3,extract	128	1	4	256	1	2	0	-1	-1	-1	-1	4.92709e-05	# 0.00 Gflop/s, 510.76 GB/s, tuning took 0.108445 seconds at Sun Sep  3 23:03:25 2023
     32x32x32x32	N4quda12ExtractGhostIdLi3ENS_5gauge11FloatNOrderIdLi18ELi2ELi18EL20QudaStaggeredPhase_s0ELb1EL19QudaGhostExchange_sn2147483648ELb0EEEEE	GPU-offline,vol=1048576stride=540672precision=8geometry=4Nc=3,extract	32	1	4	1024	1	2	3511	-1	-1	-1	-1	6.92843e-05	# 0.00 Gflop/s, 544.84 GB/s, tuning took 0.138869 seconds at Sun Sep  3 23:03:38 2023
     32x32x32x32	N4quda13ComputeCloverIdEE	GPU-offline,vol=1048576precision=8Nc=3	192	1	1	2731	2	1	0	-1	-1	-1	-1	0.00212739	# 236.59 Gflop/s, 709.77 GB/s, tuning took 0.175372 seconds at Sun Sep  3 23:04:00 2023
     32x32x32x32	N4quda5FmunuIdLi3EL21QudaReconstructType_s18EEE	GPU-offline,vol=1048576stride=524288precision=8geometry=4Nc=3r=0000,comm=0000	32	2	4	16384	1	2	0	-1	-1	-1	-1	0.0082743	# 1875.05 Gflop/s, 1861.36 GB/s, tuning took 17.176826 seconds at Sun Sep  3 23:03:59 2023
     32x32x32x32	N4quda7RNGInitE	GPU-offline,vol=1048576stride=540672precision=8geometry=4Nc=3	320	2	1	1639	1	1	0	-1	-1	-1	-1	0.0149379	# 0.00 Gflop/s, 0.00 GB/s, tuning took 2.216841 seconds at Sun Sep  3 23:03:30 2023
     32x32x32x32	N4quda9CopyGaugeINS_12CopyGaugeArgIddLi18ELb0ENS_5gauge11FloatNOrderIdLi18ELi2ELi12EL20QudaStaggeredPhase_s0ELb1EL19QudaGhostExchange_sn2147483648ELb0EEENS2_8QDPOrderIdLi18EEEEEEE	GPU-offline,vol=1048576stride=524288precision=8geometry=4Nc=3,vol=1048576stride=540672precision=8geometry=4Nc=3	96	1	1	5462	1	8	2341	-1	-1	-1	-1	0.00122573	# 0.00 Gflop/s, 831.52 GB/s, tuning took 2.026806 seconds at Sun Sep  3 23:03:25 2023
     32x32x32x32	N4quda9CopyGaugeINS_12CopyGaugeArgIddLi18ELb0ENS_5gauge11FloatNOrderIdLi18ELi2ELi12EL20QudaStaggeredPhase_s0ELb1EL19QudaGhostExchange_sn2147483648ELb0EEES6_EEEE	GPU-offline,vol=1048576stride=540672precision=8geometry=4Nc=3,vol=1048576stride=540672precision=8geometry=4Nc=3,ghost	416	1	1	40	1	8	24577	-1	-1	-1	-1	3.53794e-05	# 0.00 Gflop/s, 733.54 GB/s, tuning took 0.074652 seconds at Sun Sep  3 23:03:25 2023
     32x32x32x32	N4quda9CopyGaugeINS_12CopyGaugeArgIddLi18ELb0ENS_5gauge11FloatNOrderIdLi18ELi2ELi18EL20QudaStaggeredPhase_s0ELb1EL19QudaGhostExchange_sn2147483648ELb0EEENS2_8QDPOrderIdLi18EEEEEEE	GPU-offline,vol=1048576stride=524288precision=8geometry=4Nc=3,vol=1048576stride=540672precision=8geometry=4Nc=3	96	1	1	5462	1	8	2458	-1	-1	-1	-1	0.00149862	# 0.00 Gflop/s, 818.64 GB/s, tuning took 2.455149 seconds at Sun Sep  3 23:03:37 2023
     32x32x32x32	N4quda9CopyGaugeINS_12CopyGaugeArgIddLi18ELb0ENS_5gauge11FloatNOrderIdLi18ELi2ELi18EL20QudaStaggeredPhase_s0ELb1EL19QudaGhostExchange_sn2147483648ELb0EEES6_EEEE	GPU-offline,vol=1048576stride=540672precision=8geometry=4Nc=3,vol=1048576stride=540672precision=8geometry=4Nc=3,ghost	32	1	2	512	1	4	1891	-1	-1	-1	-1	5.16864e-05	# 0.00 Gflop/s, 753.16 GB/s, tuning took 0.100987 seconds at Sun Sep  3 23:03:38 2023
     32x32x32x32	N4quda9CopyGaugeINS_12CopyGaugeArgIddLi18ELb0ENS_5gauge8QDPOrderIdLi18EEENS2_11FloatNOrderIdLi18ELi2ELi12EL20QudaStaggeredPhase_s0ELb1EL19QudaGhostExchange_sn2147483648ELb0EEEEEEE	GPU-offline,vol=1048576stride=540672precision=8geometry=4Nc=3,vol=1048576stride=524288precision=8geometry=4Nc=3	32	1	1	16384	1	8	0	-1	-1	-1	-1	0.00129975	# 0.00 Gflop/s, 784.16 GB/s, tuning took 2.225913 seconds at Sun Sep  3 23:03:35 2023
     32x32x32x32	N4quda9CopyGaugeINS_12CopyGaugeArgIfdLi18ELb0ENS_5gauge11FloatNOrderIfLi18ELi4ELi12EL20QudaStaggeredPhase_s0ELb1EL19QudaGhostExchange_sn2147483648ELb0EEENS3_IdLi18ELi2ELi12ELS4_0ELb1ELS5_n2147483648ELb0EEEEEEE	GPU-offline,vol=1048576stride=540672precision=8geometry=4Nc=3,vol=1048576stride=540672precision=4geometry=4Nc=3	32	1	1	16384	1	8	0	-1	-1	-1	-1	0.000737184	# 0.00 Gflop/s, 844.91 GB/s, tuning took 1.338432 seconds at Sun Sep  3 23:03:27 2023
     32x32x32x32	N4quda9CopyGaugeINS_12CopyGaugeArgIfdLi18ELb0ENS_5gauge11FloatNOrderIfLi18ELi4ELi12EL20QudaStaggeredPhase_s0ELb1EL19QudaGhostExchange_sn2147483648ELb0EEENS3_IdLi18ELi2ELi12ELS4_0ELb1ELS5_n2147483648ELb0EEEEEEE	GPU-offline,vol=1048576stride=540672precision=8geometry=4Nc=3,vol=1048576stride=540672precision=4geometry=4Nc=3,ghost	32	1	1	512	1	8	0	-1	-1	-1	-1	2.69682e-05	# 0.00 Gflop/s, 721.75 GB/s, tuning took 0.067131 seconds at Sun Sep  3 23:03:27 2023
     32x32x32x32	N4quda9CopyGaugeINS_12CopyGaugeArgIfdLi18ELb0ENS_5gauge11FloatNOrderIfLi18ELi4ELi12EL20QudaStaggeredPhase_s0ELb1EL19QudaGhostExchange_sn2147483648ELb0EEENS3_IdLi18ELi2ELi18ELS4_0ELb1ELS5_n2147483648ELb0EEEEEEE	GPU-offline,vol=1048576stride=540672precision=8geometry=4Nc=3,vol=1048576stride=540672precision=4geometry=4Nc=3	32	1	1	16384	1	8	0	-1	-1	-1	-1	0.000736853	# 0.00 Gflop/s, 1127.05 GB/s, tuning took 1.354308 seconds at Sun Sep  3 23:03:40 2023
     32x32x32x32	N4quda9CopyGaugeINS_12CopyGaugeArgIfdLi18ELb0ENS_5gauge11FloatNOrderIfLi18ELi4ELi12EL20QudaStaggeredPhase_s0ELb1EL19QudaGhostExchange_sn2147483648ELb0EEENS3_IdLi18ELi2ELi18ELS4_0ELb1ELS5_n2147483648ELb0EEEEEEE	GPU-offline,vol=1048576stride=540672precision=8geometry=4Nc=3,vol=1048576stride=540672precision=4geometry=4Nc=3,ghost	32	1	1	512	1	8	0	-1	-1	-1	-1	2.70693e-05	# 0.00 Gflop/s, 958.73 GB/s, tuning took 0.066063 seconds at Sun Sep  3 23:03:40 2023
     32x32x32x32	N4quda9CopyGaugeINS_12CopyGaugeArgIsdLi18ELb0ENS_5gauge11FloatNOrderIsLi18ELi4ELi12EL20QudaStaggeredPhase_s0ELb1EL19QudaGhostExchange_sn2147483648ELb0EEENS3_IdLi18ELi2ELi12ELS4_0ELb1ELS5_n2147483648ELb0EEEEEEE	GPU-offline,vol=1048576stride=540672precision=8geometry=4Nc=3,vol=1048576stride=540672precision=2geometry=4Nc=3	32	1	4	16384	1	2	0	-1	-1	-1	-1	0.000656693	# 0.00 Gflop/s, 790.39 GB/s, tuning took 1.204072 seconds at Sun Sep  3 23:03:26 2023
     32x32x32x32	N4quda9CopyGaugeINS_12CopyGaugeArgIsdLi18ELb0ENS_5gauge11FloatNOrderIsLi18ELi4ELi12EL20QudaStaggeredPhase_s0ELb1EL19QudaGhostExchange_sn2147483648ELb0EEENS3_IdLi18ELi2ELi12ELS4_0ELb1ELS5_n2147483648ELb0EEEEEEE	GPU-offline,vol=1048576stride=540672precision=8geometry=4Nc=3,vol=1048576stride=540672precision=2geometry=4Nc=3,ghost	352	1	1	47	1	8	0	-1	-1	-1	-1	2.43288e-05	# 0.00 Gflop/s, 666.71 GB/s, tuning took 0.062099 seconds at Sun Sep  3 23:03:26 2023
     32x32x32x32	N4quda9CopyGaugeINS_12CopyGaugeArgIsdLi18ELb0ENS_5gauge11FloatNOrderIsLi18ELi4ELi12EL20QudaStaggeredPhase_s0ELb1EL19QudaGhostExchange_sn2147483648ELb0EEENS3_IdLi18ELi2ELi18ELS4_0ELb1ELS5_n2147483648ELb0EEEEEEE	GPU-offline,vol=1048576stride=540672precision=8geometry=4Nc=3,vol=1048576stride=540672precision=2geometry=4Nc=3	32	1	5	16384	1	2	0	-1	-1	-1	-1	0.000658645	# 0.00 Gflop/s, 1103.27 GB/s, tuning took 1.202544 seconds at Sun Sep  3 23:03:39 2023
     32x32x32x32	N4quda9CopyGaugeINS_12CopyGaugeArgIsdLi18ELb0ENS_5gauge11FloatNOrderIsLi18ELi4ELi12EL20QudaStaggeredPhase_s0ELb1EL19QudaGhostExchange_sn2147483648ELb0EEENS3_IdLi18ELi2ELi18ELS4_0ELb1ELS5_n2147483648ELb0EEEEEEE	GPU-offline,vol=1048576stride=540672precision=8geometry=4Nc=3,vol=1048576stride=540672precision=2geometry=4Nc=3,ghost	96	1	6	171	1	2	0	-1	-1	-1	-1	2.42152e-05	# 0.00 Gflop/s, 937.77 GB/s, tuning took 0.060548 seconds at Sun Sep  3 23:03:39 2023
     32x32x32x64	N4quda10CopyCloverINS_6clover11FloatNOrderIfLi72ELi4ELb0ELb0ELb0EEENS2_IdLi72ELi2ELb0ELb0ELb0EEEfdEE	GPU-offline,cmem,vol=2097152precision=8Nc=3	256	1	1	4096	2	1	0	-1	-1	-1	-1	0.00255236	# 0.00 Gflop/s, 709.91 GB/s, tuning took 2.193237 seconds at Tue Aug 29 01:52:18 2023
     32x32x32x64	N4quda10CopyCloverINS_6clover11FloatNOrderIsLi72ELi8ELb0ELb0ELb0EEENS2_IdLi72ELi2ELb0ELb0ELb0EEEsdEE	GPU-offline,cmem,vol=2097152precision=8Nc=3	64	2	1	16384	1	1	4097	-1	-1	-1	-1	0.00208222	# 0.00 Gflop/s, 725.16 GB/s, tuning took 1.806469 seconds at Tue Aug 29 01:52:16 2023
     32x32x32x64	N4quda10GaugeGaussIdLi3EL21QudaReconstructType_s12EEE	GPU-offline,vol=2097152stride=1081344precision=8geometry=4Nc=3,lie_group	384	1	1	2731	2	1	12289	-1	-1	-1	-1	0.00470528	# 0.00 Gflop/s, 176.50 GB/s, tuning took 6.228397 seconds at Mon Aug 28 16:47:28 2023
     32x32x32x64	N4quda11CopyGaugeExIddLi18ENS_5gauge11FloatNOrderIdLi18ELi2ELi18EL20QudaStaggeredPhase_s0ELb1EL19QudaGhostExchange_sn2147483648ELb0EEENS2_IdLi18ELi2ELi12ELS3_0ELb1ELS4_n2147483648ELb0EEEEE	GPU-offline,cmem,vol=2097152stride=1081344precision=8geometry=4Nc=3vol=2097152stride=1048576precision=8geometry=4Nc=3r=0000	640	1	1	1639	2	1	0	-1	-1	-1	-1	0.00278284	# 0.00 Gflop/s, 732.50 GB/s, tuning took 2.998690 seconds at Tue Aug 29 01:52:21 2023
     32x32x32x64	N4quda11CopyGaugeExIddLi18ENS_5gauge11FloatNOrderIdLi18ELi2ELi18EL20QudaStaggeredPhase_s0ELb1EL19QudaGhostExchange_sn2147483648ELb0EEES5_EE	GPU-offline,cmem,vol=2097152stride=1081344precision=8geometry=4Nc=3vol=2097152stride=1048576precision=8geometry=4Nc=3r=0000	1024	1	1	1024	2	1	0	-1	-1	-1	-1	0.0032048	# 0.00 Gflop/s, 765.62 GB/s, tuning took 3.465279 seconds at Tue Aug 29 01:50:46 2023
     32x32x32x64	N4quda12CloverInvertIdEE	GPU-offline,vol=2097152precision=8Nc=3,trlog=true,twist=false	192	2	1	160	1	1	0	-1	-1	-1	-1	0.00326129	# 0.00 Gflop/s, 740.79 GB/s, tuning took 48.595751 seconds at Tue Aug 29 01:52:09 2023
     32x32x32x64	N4quda12ExtractGhostIdLi3ENS_5gauge11FloatNOrderIdLi18ELi2ELi12EL20QudaStaggeredPhase_s0ELb1EL19QudaGhostExchange_sn2147483648ELb0EEEEE	GPU-offline,vol=2097152stride=1081344precision=8geometry=4Nc=3,extract	160	1	4	410	1	2	16385	-1	-1	-1	-1	8.42747e-05	# 0.00 Gflop/s, 522.58 GB/s, tuning took 0.172454 seconds at Mon Aug 28 16:47:12 2023
     32x32x32x64	N4quda12ExtractGhostIdLi3ENS_5gauge11FloatNOrderIdLi18ELi2ELi18EL20QudaStaggeredPhase_s0ELb1EL19QudaGhostExchange_sn2147483648ELb0EEEEE	GPU-offline,vol=2097152stride=1081344precision=8geometry=4Nc=3,extract	96	1	4	683	1	2	12289	-1	-1	-1	-1	0.000122503	# 0.00 Gflop/s, 539.25 GB/s, tuning took 0.234807 seconds at Tue Aug 29 01:50:37 2023
     32x32x32x64	N4quda13ComputeCloverIdEE	GPU-offline,vol=2097152precision=8Nc=3	192	1	1	5462	2	1	0	-1	-1	-1	-1	0.00421516	# 238.81 Gflop/s, 716.44 GB/s, tuning took 0.343552 seconds at Tue Aug 29 01:51:20 2023
     32x32x32x64	N4quda5FmunuIdLi3EL21QudaReconstructType_s18EEE	GPU-offline,vol=2097152stride=1048576precision=8geometry=4Nc=3r=0000,comm=0000	32	2	4	32768	1	2	0	-1	-1	-1	-1	0.0166185	# 1867.16 Gflop/s, 1853.53 GB/s, tuning took 34.270870 seconds at Tue Aug 29 01:51:20 2023
     32x32x32x64	N4quda7RNGInitE	GPU-offline,vol=2097152stride=1081344precision=8geometry=4Nc=3	320	2	1	3277	1	1	0	-1	-1	-1	-1	0.0305375	# 0.00 Gflop/s, 0.00 GB/s, tuning took 4.537740 seconds at Mon Aug 28 16:47:22 2023
     32x32x32x64	N4quda9CopyGaugeINS_12CopyGaugeArgIddLi18ELb0ENS_5gauge11FloatNOrderIdLi18ELi2ELi12EL20QudaStaggeredPhase_s0ELb1EL19QudaGhostExchange_sn2147483648ELb0EEENS2_8QDPOrderIdLi18EEEEEEE	GPU-offline,cmem,vol=2097152stride=1048576precision=8geometry=4Nc=3,vol=2097152stride=1081344precision=8geometry=4Nc=3	96	1	1	10923	1	8	2458	-1	-1	-1	-1	0.00244786	# 0.00 Gflop/s, 832.74 GB/s, tuning took 4.041601 seconds at Mon Aug 28 16:47:12 2023
     32x32x32x64	N4quda9CopyGaugeINS_12CopyGaugeArgIddLi18ELb0ENS_5gauge11FloatNOrderIdLi18ELi2ELi12EL20QudaStaggeredPhase_s0ELb1EL19QudaGhostExchange_sn2147483648ELb0EEENS2_8QDPOrderIdLi18EEEEEEE	GPU-offline,vol=2097152stride=1048576precision=8geometry=4Nc=3,vol=2097152stride=1081344precision=8geometry=4Nc=3	96	1	1	10923	1	8	2458	-1	-1	-1	-1	0.00244966	# 0.00 Gflop/s, 832.13 GB/s, tuning took 4.066300 seconds at Sun Sep 10 15:52:07 2023
     32x32x32x64	N4quda9CopyGaugeINS_12CopyGaugeArgIddLi18ELb0ENS_5gauge11FloatNOrderIdLi18ELi2ELi12EL20QudaStaggeredPhase_s0ELb1EL19QudaGhostExchange_sn2147483648ELb0EEES6_EEEE	GPU-offline,vol=2097152stride=1081344precision=8geometry=4Nc=3,vol=2097152stride=1081344precision=8geometry=4Nc=3,ghost	608	1	1	54	1	8	24577	-1	-1	-1	-1	5.86729e-05	# 0.00 Gflop/s, 774.06 GB/s, tuning took 0.120938 seconds at Sun Sep 10 15:52:07 2023
     32x32x32x64	N4quda9CopyGaugeINS_12CopyGaugeArgIddLi18ELb0ENS_5gauge11FloatNOrderIdLi18ELi2ELi18EL20QudaStaggeredPhase_s0ELb1EL19QudaGhostExchange_sn2147483648ELb0EEENS2_8QDPOrderIdLi18EEEEEEE	GPU-offline,cmem,vol=2097152stride=1048576precision=8geometry=4Nc=3,vol=2097152stride=1081344precision=8geometry=4Nc=3	64	1	1	16384	1	8	1756	-1	-1	-1	-1	0.00300738	# 0.00 Gflop/s, 815.88 GB/s, tuning took 4.912499 seconds at Tue Aug 29 01:50:37 2023
     32x32x32x64	N4quda9CopyGaugeINS_12CopyGaugeArgIddLi18ELb0ENS_5gauge8QDPOrderIdLi18EEENS2_11FloatNOrderIdLi18ELi2ELi12EL20QudaStaggeredPhase_s0ELb1EL19QudaGhostExchange_sn2147483648ELb0EEEEEEE	GPU-offline,cmem,vol=2097152stride=1081344precision=8geometry=4Nc=3,vol=2097152stride=1048576precision=8geometry=4Nc=3	128	1	1	8192	1	8	0	-1	-1	-1	-1	0.00258722	# 0.00 Gflop/s, 787.88 GB/s, tuning took 4.353178 seconds at Mon Aug 28 16:47:33 2023
     32x32x32x64	N4quda9CopyGaugeINS_12CopyGaugeArgIddLi18ELb0ENS_5gauge8QDPOrderIdLi18EEENS2_11FloatNOrderIdLi18ELi2ELi12EL20QudaStaggeredPhase_s0ELb1EL19QudaGhostExchange_sn2147483648ELb0EEEEEEE	GPU-offline,vol=2097152stride=1081344precision=8geometry=4Nc=3,vol=2097152stride=1048576precision=8geometry=4Nc=3	96	1	1	10923	1	8	0	-1	-1	-1	-1	0.00259251	# 0.00 Gflop/s, 786.28 GB/s, tuning took 4.443190 seconds at Sun Sep 10 15:52:17 2023
     32x32x32x64	N4quda9CopyGaugeINS_12CopyGaugeArgIfdLi18ELb0ENS_5gauge11FloatNOrderIfLi18ELi4ELi12EL20QudaStaggeredPhase_s0ELb1EL19QudaGhostExchange_sn2147483648ELb0EEENS3_IdLi18ELi2ELi12ELS4_0ELb1ELS5_n2147483648ELb0EEEEEEE	GPU-offline,cmem,vol=2097152stride=1081344precision=8geometry=4Nc=3,vol=2097152stride=1081344precision=4geometry=4Nc=3	32	1	1	32768	1	8	0	-1	-1	-1	-1	0.00146643	# 0.00 Gflop/s, 849.48 GB/s, tuning took 2.598917 seconds at Mon Aug 28 16:47:17 2023
     32x32x32x64	N4quda9CopyGaugeINS_12CopyGaugeArgIfdLi18ELb0ENS_5gauge11FloatNOrderIfLi18ELi4ELi12EL20QudaStaggeredPhase_s0ELb1EL19QudaGhostExchange_sn2147483648ELb0EEENS3_IdLi18ELi2ELi12ELS4_0ELb1ELS5_n2147483648ELb0EEEEEEE	GPU-offline,vol=2097152stride=1081344precision=8geometry=4Nc=3,vol=2097152stride=1081344precision=4geometry=4Nc=3	32	1	1	32768	1	8	0	-1	-1	-1	-1	0.00146701	# 0.00 Gflop/s, 849.15 GB/s, tuning took 2.610501 seconds at Sun Sep 10 15:52:12 2023
     32x32x32x64	N4quda9CopyGaugeINS_12CopyGaugeArgIfdLi18ELb0ENS_5gauge11FloatNOrderIfLi18ELi4ELi12EL20QudaStaggeredPhase_s0ELb1EL19QudaGhostExchange_sn2147483648ELb0EEENS3_IdLi18ELi2ELi12ELS4_0ELb1ELS5_n2147483648ELb0EEEEEEE	GPU-offline,vol=2097152stride=1081344precision=8geometry=4Nc=3,vol=2097152stride=1081344precision=4geometry=4Nc=3,ghost	96	1	4	342	1	2	0	-1	-1	-1	-1	4.57105e-05	# 0.00 Gflop/s, 745.17 GB/s, tuning took 0.099990 seconds at Sun Sep 10 15:52:12 2023
     32x32x32x64	N4quda9CopyGaugeINS_12CopyGaugeArgIfdLi18ELb0ENS_5gauge11FloatNOrderIfLi18ELi4ELi12EL20QudaStaggeredPhase_s0ELb1EL19QudaGhostExchange_sn2147483648ELb0EEENS3_IdLi18ELi2ELi18ELS4_0ELb1ELS5_n2147483648ELb0EEEEEEE	GPU-offline,cmem,vol=2097152stride=1081344precision=8geometry=4Nc=3,vol=2097152stride=1081344precision=4geometry=4Nc=3	32	1	1	32768	1	8	0	-1	-1	-1	-1	0.00146521	# 0.00 Gflop/s, 1133.59 GB/s, tuning took 2.601599 seconds at Tue Aug 29 01:50:42 2023
     32x32x32x64	N4quda9CopyGaugeINS_12CopyGaugeArgIsdLi18ELb0ENS_5gauge11FloatNOrderIsLi18ELi4ELi12EL20QudaStaggeredPhase_s0ELb1EL19QudaGhostExchange_sn2147483648ELb0EEENS3_IdLi18ELi2ELi12ELS4_0ELb1ELS5_n2147483648ELb0EEEEEEE	GPU-offline,cmem,vol=2097152stride=1081344precision=8geometry=4Nc=3,vol=2097152stride=1081344precision=2geometry=4Nc=3	32	1	2	32768	1	4	0	-1	-1	-1	-1	0.00130325	# 0.00 Gflop/s, 796.54 GB/s, tuning took 2.321934 seconds at Mon Aug 28 16:47:15 2023
     32x32x32x64	N4quda9CopyGaugeINS_12CopyGaugeArgIsdLi18ELb0ENS_5gauge11FloatNOrderIsLi18ELi4ELi12EL20QudaStaggeredPhase_s0ELb1EL19QudaGhostExchange_sn2147483648ELb0EEENS3_IdLi18ELi2ELi12ELS4_0ELb1ELS5_n2147483648ELb0EEEEEEE	GPU-offline,vol=2097152stride=1081344precision=8geometry=4Nc=3,vol=2097152stride=1081344precision=2geometry=4Nc=3	32	1	3	32768	1	3	0	-1	-1	-1	-1	0.00130304	# 0.00 Gflop/s, 796.67 GB/s, tuning took 2.479139 seconds at Sun Sep 10 15:52:10 2023
     32x32x32x64	N4quda9CopyGaugeINS_12CopyGaugeArgIsdLi18ELb0ENS_5gauge11FloatNOrderIsLi18ELi4ELi12EL20QudaStaggeredPhase_s0ELb1EL19QudaGhostExchange_sn2147483648ELb0EEENS3_IdLi18ELi2ELi12ELS4_0ELb1ELS5_n2147483648ELb0EEEEEEE	GPU-offline,vol=2097152stride=1081344precision=8geometry=4Nc=3,vol=2097152stride=1081344precision=2geometry=4Nc=3,ghost	64	1	5	512	1	2	0	-1	-1	-1	-1	4.00358e-05	# 0.00 Gflop/s, 709.00 GB/s, tuning took 0.092037 seconds at Sun Sep 10 15:52:10 2023
     32x32x32x64	N4quda9CopyGaugeINS_12CopyGaugeArgIsdLi18ELb0ENS_5gauge11FloatNOrderIsLi18ELi4ELi12EL20QudaStaggeredPhase_s0ELb1EL19QudaGhostExchange_sn2147483648ELb0EEENS3_IdLi18ELi2ELi18ELS4_0ELb1ELS5_n2147483648ELb0EEEEEEE	GPU-offline,cmem,vol=2097152stride=1081344precision=8geometry=4Nc=3,vol=2097152stride=1081344precision=2geometry=4Nc=3	32	1	3	32768	1	3	0	-1	-1	-1	-1	0.00130306	# 0.00 Gflop/s, 1115.32 GB/s, tuning took 2.323022 seconds at Tue Aug 29 01:50:40 2023
      32x8x32x64	N4quda10GaugeGaussIdLi3EL21QudaReconstructType_s12EEE	GPU-offline,vol=524288stride=294912precision=8geometry=4Nc=3,lie_group	384	1	1	683	2	1	16385	-1	-1	-1	-1	0.00118148	# 0.00 Gflop/s, 191.70 GB/s, tuning took 1.537485 seconds at Sat Sep 23 13:44:13 2023
      32x8x32x64	N4quda12ExtractGhostIdLi3ENS_5gauge11FloatNOrderIdLi18ELi2ELi12EL20QudaStaggeredPhase_s0ELb1EL19QudaGhostExchange_sn2147483648ELb0EEEEE	GPU-offline,vol=524288stride=294912precision=8geometry=4Nc=3,extract	32	1	6	2048	1	2	0	-1	-1	-1	-1	3.57474e-05	# 0.00 Gflop/s, 571.99 GB/s, tuning took 0.095517 seconds at Sat Sep 23 13:44:09 2023
      32x8x32x64	N4quda7RNGInitE	GPU-offline,vol=524288stride=294912precision=8geometry=4Nc=3	320	2	1	820	1	1	0	-1	-1	-1	-1	0.00748144	# 0.00 Gflop/s, 0.00 GB/s, tuning took 1.096859 seconds at Sat Sep 23 13:44:12 2023
      32x8x32x64	N4quda9CopyGaugeINS_12CopyGaugeArgIddLi18ELb0ENS_5gauge11FloatNOrderIdLi18ELi2ELi12EL20QudaStaggeredPhase_s0ELb1EL19QudaGhostExchange_sn2147483648ELb0EEENS2_8QDPOrderIdLi18EEEEEEE	GPU-offline,vol=524288stride=262144precision=8geometry=4Nc=3,vol=524288stride=294912precision=8geometry=4Nc=3	96	1	1	2731	1	8	2458	-1	-1	-1	-1	0.000614848	# 0.00 Gflop/s, 859.53 GB/s, tuning took 1.023744 seconds at Sat Sep 23 13:44:09 2023
      32x8x32x64	N4quda9CopyGaugeINS_12CopyGaugeArgIddLi18ELb0ENS_5gauge11FloatNOrderIdLi18ELi2ELi12EL20QudaStaggeredPhase_s0ELb1EL19QudaGhostExchange_sn2147483648ELb0EEES6_EEEE	GPU-offline,vol=524288stride=294912precision=8geometry=4Nc=3,vol=524288stride=294912precision=8geometry=4Nc=3,ghost	32	1	1	1024	1	8	0	-1	-1	-1	-1	2.84425e-05	# 0.00 Gflop/s, 808.76 GB/s, tuning took 0.068716 seconds at Sat Sep 23 13:44:09 2023
      32x8x32x64	N4quda9CopyGaugeINS_12CopyGaugeArgIddLi18ELb0ENS_5gauge8QDPOrderIdLi18EEENS2_11FloatNOrderIdLi18ELi2ELi12EL20QudaStaggeredPhase_s0ELb1EL19QudaGhostExchange_sn2147483648ELb0EEEEEEE	GPU-offline,vol=524288stride=294912precision=8geometry=4Nc=3,vol=524288stride=262144precision=8geometry=4Nc=3	64	1	1	4096	1	8	1891	-1	-1	-1	-1	0.000646133	# 0.00 Gflop/s, 817.92 GB/s, tuning took 1.079320 seconds at Sat Sep 23 13:44:15 2023
      32x8x32x64	N4quda9CopyGaugeINS_12CopyGaugeArgIfdLi18ELb0ENS_5gauge11FloatNOrderIfLi18ELi4ELi12EL20QudaStaggeredPhase_s0ELb1EL19QudaGhostExchange_sn2147483648ELb0EEENS3_IdLi18ELi2ELi12ELS4_0ELb1ELS5_n2147483648ELb0EEEEEEE	GPU-offline,vol=524288stride=294912precision=8geometry=4Nc=3,vol=524288stride=294912precision=4geometry=4Nc=3	32	1	1	8192	1	8	0	-1	-1	-1	-1	0.000371477	# 0.00 Gflop/s, 914.56 GB/s, tuning took 0.648439 seconds at Sat Sep 23 13:44:11 2023
      32x8x32x64	N4quda9CopyGaugeINS_12CopyGaugeArgIfdLi18ELb0ENS_5gauge11FloatNOrderIfLi18ELi4ELi12EL20QudaStaggeredPhase_s0ELb1EL19QudaGhostExchange_sn2147483648ELb0EEENS3_IdLi18ELi2ELi12ELS4_0ELb1ELS5_n2147483648ELb0EEEEEEE	GPU-offline,vol=524288stride=294912precision=8geometry=4Nc=3,vol=524288stride=294912precision=4geometry=4Nc=3,ghost	96	1	1	342	1	8	2341	-1	-1	-1	-1	2.29753e-05	# 0.00 Gflop/s, 750.91 GB/s, tuning took 0.060674 seconds at Sat Sep 23 13:44:11 2023
      32x8x32x64	N4quda9CopyGaugeINS_12CopyGaugeArgIsdLi18ELb0ENS_5gauge11FloatNOrderIsLi18ELi4ELi12EL20QudaStaggeredPhase_s0ELb1EL19QudaGhostExchange_sn2147483648ELb0EEENS3_IdLi18ELi2ELi12ELS4_0ELb1ELS5_n2147483648ELb0EEEEEEE	GPU-offline,vol=524288stride=294912precision=8geometry=4Nc=3,vol=524288stride=294912precision=2geometry=4Nc=3	96	1	3	2731	1	3	0	-1	-1	-1	-1	0.00032908	# 0.00 Gflop/s, 860.32 GB/s, tuning took 0.579240 seconds at Sat Sep 23 13:44:10 2023
      32x8x32x64	N4quda9CopyGaugeINS_12CopyGaugeArgIsdLi18ELb0ENS_5gauge11FloatNOrderIsLi18ELi4ELi12EL20QudaStaggeredPhase_s0ELb1EL19QudaGhostExchange_sn2147483648ELb0EEENS3_IdLi18ELi2ELi12ELS4_0ELb1ELS5_n2147483648ELb0EEEEEEE	GPU-offline,vol=524288stride=294912precision=8geometry=4Nc=3,vol=524288stride=294912precision=2geometry=4Nc=3,ghost	576	1	1	57	1	8	0	-1	-1	-1	-1	2.03233e-05	# 0.00 Gflop/s, 707.41 GB/s, tuning took 0.056893 seconds at Sat Sep 23 13:44:10 2023
        37748736	N4quda15TransformReduceINS_7maximumIdEEKNS_7complexIdEEmNS_8abs_max_IddEENS_8identityEEE	GPU-offline,batch_size=1	1024	1	1	155	1	1	0	-1	-1	-1	-1	0.00069744	# 0.00 Gflop/s, 866.00 GB/s, tuning took 2.365029 seconds at Sun Sep  3 23:04:27 2023
      4x32x32x64	N4quda15CopyColorSpinorILi4ELi3ENS_11colorspinor11FloatNOrderIdLi4ELi3ELi2ELb0ELb0EEENS1_21SpaceSpinorColorOrderIdLi4ELi3EEESt5tupleIJRNS_16ColorSpinorFieldERKS7_19QudaFieldLocation_sPdPKdEEEE	GPU-offline,vol=262144,parity=1,precision=8,order=9,Ns=4,Nc=3vol=262144,parity=1,precision=8,order=2,Ns=4,Nc=3,NonRelBasis	864	1	1	304	1	1	0	-1	-1	-1	-1	0.00013784	# 0.00 Gflop/s, 730.29 GB/s, tuning took 0.025175 seconds at Sat Sep 23 13:51:55 2023
      4x32x32x64	N4quda15CopyColorSpinorILi4ELi3ENS_11colorspinor21SpaceSpinorColorOrderIdLi4ELi3EEENS1_11FloatNOrderIdLi4ELi3ELi2ELb0ELb0EEESt5tupleIJRNS_16ColorSpinorFieldERKS7_19QudaFieldLocation_sPdPKdEEEE	GPU-offline,vol=262144,parity=1,precision=8,order=2,Ns=4,Nc=3vol=262144,parity=1,precision=8,order=9,Ns=4,Nc=3,RelBasis	608	1	1	432	1	1	0	-1	-1	-1	-1	0.000133924	# 0.00 Gflop/s, 751.64 GB/s, tuning took 0.023568 seconds at Sat Sep 23 13:52:30 2023
      4x32x32x64	N4quda4PackIdLi3ELb1EEE	policy_kernel,vol=262144,parity=1,precision=8,order=2,Ns=4,Nc=3,comm=1000,topo=4111,nFace=1,device-device	544	1	1	128	1	1	0	-1	-1	-1	-1	7.69674e-05	# 10.22 Gflop/s, 245.23 GB/s, tuning took 1.682027 seconds at Sat Sep 23 13:51:56 2023
      4x32x32x64	N4quda4PackIdLi3ELb1EEE	policy_kernel,vol=262144,parity=1,precision=8,order=2,Ns=4,Nc=3,comm=1000,topo=4111,nFace=1,device-remote	32	1	1	34	1	1	0	-1	-1	-1	-1	0.000145115	# 5.42 Gflop/s, 130.06 GB/s, tuning took 2.696923 seconds at Sat Sep 23 13:52:21 2023
      4x32x32x64	N4quda4PackIdLi3ELb1EEE	policy_kernel,vol=262144,parity=1,precision=8,order=2,Ns=4,Nc=3,comm=1000,topo=4111,nFace=1,host-device	128	1	1	3	1	1	0	-1	-1	-1	-1	0.000521493	# 1.51 Gflop/s, 36.19 GB/s, tuning took 0.270145 seconds at Sat Sep 23 13:52:09 2023
      4x32x32x64	N4quda4PackIdLi3ELb1EEE	policy_kernel,vol=262144,parity=1,precision=8,order=2,Ns=4,Nc=3,comm=1000,topo=4111,nFace=1,host-host	128	1	1	3	1	1	0	-1	-1	-1	-1	0.000503605	# 1.56 Gflop/s, 37.48 GB/s, tuning took 0.256408 seconds at Sat Sep 23 13:51:58 2023
      4x32x32x64	N4quda4PackIdLi3ELb1EEE	policy_kernel,vol=262144,parity=1,precision=8,order=2,Ns=4,Nc=3,comm=1000,topo=4111,nFace=1,host-remote	384	1	1	3	1	1	0	-1	-1	-1	-1	0.000480533	# 1.64 Gflop/s, 39.28 GB/s, tuning took 0.254699 seconds at Sat Sep 23 13:52:21 2023
      4x32x32x64	N4quda6WilsonINS_9WilsonArgIdLi3ELi4EL21QudaReconstructType_s12EEEEE	policy,commDim=1000,parity=1,topo=4111,p2p=3,gdr=0,nvshmem=0,pol=110000111100110000	32	1	1	1	1	1	0	12	2	0	-1	0.000746869	# 463.31 Gflop/s, 808.68 GB/s, tuning took 0.416528 seconds at Sat Sep 23 13:52:30 2023
      4x32x32x64	N4quda6WilsonINS_9WilsonArgIdLi3ELi4EL21QudaReconstructType_s12EEEEE	policy_kernel=exterior_all,commDim=1000,parity=1	80	1	1	820	1	1	4097	-1	-1	-1	-1	0.000192331	# 61.33 Gflop/s, 196.27 GB/s, tuning took 0.258334 seconds at Sat Sep 23 13:51:58 2023
      4x32x32x64	N4quda6WilsonINS_9WilsonArgIdLi3ELi4EL21QudaReconstructType_s12EEEEE	policy_kernel=exterior_all,commDim=1000,parity=1,zero_copy,p2p=0	16	1	1	4096	1	1	32769	-1	-1	-1	-1	0.000518997	# 22.73 Gflop/s, 72.73 GB/s, tuning took 0.626697 seconds at Sat Sep 23 13:51:59 2023
      4x32x32x64	N4quda6WilsonINS_9WilsonArgIdLi3ELi4EL21QudaReconstructType_s12EEEEE	policy_kernel=exterior_all,commDim=1000,parity=1,zero_copy,p2p=1	80	1	1	820	1	1	8937	-1	-1	-1	-1	0.000192448	# 61.30 Gflop/s, 196.15 GB/s, tuning took 0.257519 seconds at Sat Sep 23 13:52:10 2023
      4x32x32x64	N4quda6WilsonINS_9WilsonArgIdLi3ELi4EL21QudaReconstructType_s12EEEEE	policy_kernel=exterior_x,commDim=1000,parity=1	80	1	1	820	1	1	16385	-1	-1	-1	-1	0.000191595	# 61.57 Gflop/s, 197.02 GB/s, tuning took 0.254466 seconds at Sat Sep 23 13:51:57 2023
      4x32x32x64	N4quda6WilsonINS_9WilsonArgIdLi3ELi4EL21QudaReconstructType_s12EEEEE	policy_kernel=exterior_x,commDim=1000,parity=1,zero_copy,p2p=0	16	1	1	4096	1	1	49153	-1	-1	-1	-1	0.000517653	# 22.79 Gflop/s, 72.92 GB/s, tuning took 0.628947 seconds at Sat Sep 23 13:51:59 2023
      4x32x32x64	N4quda6WilsonINS_9WilsonArgIdLi3ELi4EL21QudaReconstructType_s12EEEEE	policy_kernel=exterior_x,commDim=1000,parity=1,zero_copy,p2p=1	80	1	1	820	1	1	9831	-1	-1	-1	-1	0.000192645	# 61.23 Gflop/s, 195.95 GB/s, tuning took 0.254417 seconds at Sat Sep 23 13:52:09 2023
      4x32x32x64	N4quda6WilsonINS_9WilsonArgIdLi3ELi4EL21QudaReconstructType_s12EEEEE	policy_kernel=interior,comm=1000,commDim=1000,parity=1	128	1	1	2048	1	1	49153	-1	-1	-1	-1	0.000512427	# 655.33 Gflop/s, 1105.00 GB/s, tuning took 0.699126 seconds at Sat Sep 23 13:51:57 2023
      4x32x32x64	N4quda6WilsonINS_9WilsonArgIdLi3ELi4EL21QudaReconstructType_s12EEEEE	policy_kernel=interior,comm=1000,commDim=1000,parity=1,host-device	128	1	1	2048	1	1	49153	2	-1	-1	-1	0.000526197	# 639.67 Gflop/s, 1111.95 GB/s, tuning took 8.703513 seconds at Sat Sep 23 13:52:18 2023
      4x32x32x64	N4quda6WilsonINS_9WilsonArgIdLi3ELi4EL21QudaReconstructType_s12EEEEE	policy_kernel=interior,comm=1000,commDim=1000,parity=1,host-host	128	1	1	2048	1	1	49153	2	-1	-1	-1	0.000517899	# 649.92 Gflop/s, 1129.77 GB/s, tuning took 9.036886 seconds at Sat Sep 23 13:52:09 2023
      4x32x32x64	N4quda6WilsonINS_9WilsonArgIdLi3ELi4EL21QudaReconstructType_s12EEEEE	policy_kernel=interior,comm=1000,commDim=1000,parity=1,host-remote	128	1	1	2048	1	1	49153	2	-1	-1	-1	0.000515285	# 653.22 Gflop/s, 1135.50 GB/s, tuning took 8.489248 seconds at Sat Sep 23 13:52:30 2023
    64x32x32x128	N4quda10GaugeGaussIdLi3EL21QudaReconstructType_s12EEE	GPU-offline,vol=8388608stride=4325376precision=8geometry=4Nc=3,lie_group	384	1	1	10923	2	1	0	-1	-1	-1	-1	0.0183437	# 0.00 Gflop/s, 181.09 GB/s, tuning took 24.501124 seconds at Sun Sep 24 15:23:44 2023
    64x32x32x128	N4quda12ExtractGhostIdLi3ENS_5gauge11FloatNOrderIdLi18ELi2ELi12EL20QudaStaggeredPhase_s0ELb1EL19QudaGhostExchange_sn2147483648ELb0EEEEE	GPU-offline,vol=8388608stride=4325376precision=8geometry=4Nc=3,extract	96	1	4	2731	1	2	16385	-1	-1	-1	-1	0.000279592	# 0.00 Gflop/s, 495.05 GB/s, tuning took 0.556432 seconds at Sun Sep 24 15:22:41 2023
    64x32x32x128	N4quda7RNGInitE	GPU-offline,vol=8388608stride=4325376precision=8geometry=4Nc=3	640	1	1	6554	2	1	0	-1	-1	-1	-1	0.124487	# 0.00 Gflop/s, 0.00 GB/s, tuning took 18.028336 seconds at Sun Sep 24 15:23:19 2023
    64x32x32x128	N4quda9CopyGaugeINS_12CopyGaugeArgIddLi18ELb0ENS_5gauge11FloatNOrderIdLi18ELi2ELi12EL20QudaStaggeredPhase_s0ELb1EL19QudaGhostExchange_sn2147483648ELb0EEENS2_8QDPOrderIdLi18EEEEEEE	GPU-offline,vol=8388608stride=4194304precision=8geometry=4Nc=3,vol=8388608stride=4325376precision=8geometry=4Nc=3	640	1	1	6554	1	8	0	-1	-1	-1	-1	0.00992668	# 0.00 Gflop/s, 821.40 GB/s, tuning took 17.319685 seconds at Sun Sep 24 15:22:40 2023
    64x32x32x128	N4quda9CopyGaugeINS_12CopyGaugeArgIddLi18ELb0ENS_5gauge11FloatNOrderIdLi18ELi2ELi12EL20QudaStaggeredPhase_s0ELb1EL19QudaGhostExchange_sn2147483648ELb0EEES6_EEEE	GPU-offline,vol=8388608stride=4325376precision=8geometry=4Nc=3,vol=8388608stride=4325376precision=8geometry=4Nc=3,ghost	320	1	1	410	1	8	8193	-1	-1	-1	-1	0.000186549	# 0.00 Gflop/s, 765.15 GB/s, tuning took 0.334901 seconds at Sun Sep 24 15:22:41 2023
    64x32x32x128	N4quda9CopyGaugeINS_12CopyGaugeArgIddLi18ELb0ENS_5gauge8QDPOrderIdLi18EEENS2_11FloatNOrderIdLi18ELi2ELi12EL20QudaStaggeredPhase_s0ELb1EL19QudaGhostExchange_sn2147483648ELb0EEEEEEE	GPU-offline,vol=8388608stride=4325376precision=8geometry=4Nc=3,vol=8388608stride=4194304precision=8geometry=4Nc=3	64	1	1	65536	1	8	2341	-1	-1	-1	-1	0.0106504	# 0.00 Gflop/s, 765.58 GB/s, tuning took 18.181478 seconds at Sun Sep 24 15:24:02 2023
    64x32x32x128	N4quda9CopyGaugeINS_12CopyGaugeArgIfdLi18ELb0ENS_5gauge11FloatNOrderIfLi18ELi4ELi12EL20QudaStaggeredPhase_s0ELb1EL19QudaGhostExchange_sn2147483648ELb0EEENS3_IdLi18ELi2ELi12ELS4_0ELb1ELS5_n2147483648ELb0EEEEEEE	GPU-offline,vol=8388608stride=4325376precision=8geometry=4Nc=3,vol=8388608stride=4325376precision=4geometry=4Nc=3	32	1	1	131072	1	8	0	-1	-1	-1	-1	0.00588079	# 0.00 Gflop/s, 847.31 GB/s, tuning took 10.678014 seconds at Sun Sep 24 15:23:01 2023
    64x32x32x128	N4quda9CopyGaugeINS_12CopyGaugeArgIfdLi18ELb0ENS_5gauge11FloatNOrderIfLi18ELi4ELi12EL20QudaStaggeredPhase_s0ELb1EL19QudaGhostExchange_sn2147483648ELb0EEENS3_IdLi18ELi2ELi12ELS4_0ELb1ELS5_n2147483648ELb0EEEEEEE	GPU-offline,vol=8388608stride=4325376precision=8geometry=4Nc=3,vol=8388608stride=4325376precision=4geometry=4Nc=3,ghost	320	1	2	410	1	4	0	-1	-1	-1	-1	0.000136764	# 0.00 Gflop/s, 782.76 GB/s, tuning took 0.277821 seconds at Sun Sep 24 15:23:01 2023
    64x32x32x128	N4quda9CopyGaugeINS_12CopyGaugeArgIsdLi18ELb0ENS_5gauge11FloatNOrderIsLi18ELi4ELi12EL20QudaStaggeredPhase_s0ELb1EL19QudaGhostExchange_sn2147483648ELb0EEENS3_IdLi18ELi2ELi12ELS4_0ELb1ELS5_n2147483648ELb0EEEEEEE	GPU-offline,vol=8388608stride=4325376precision=8geometry=4Nc=3,vol=8388608stride=4325376precision=2geometry=4Nc=3	192	1	4	21846	1	2	0	-1	-1	-1	-1	0.00518988	# 0.00 Gflop/s, 800.09 GB/s, tuning took 8.945996 seconds at Sun Sep 24 15:22:50 2023
    64x32x32x128	N4quda9CopyGaugeINS_12CopyGaugeArgIsdLi18ELb0ENS_5gauge11FloatNOrderIsLi18ELi4ELi12EL20QudaStaggeredPhase_s0ELb1EL19QudaGhostExchange_sn2147483648ELb0EEENS3_IdLi18ELi2ELi12ELS4_0ELb1ELS5_n2147483648ELb0EEEEEEE	GPU-offline,vol=8388608stride=4325376precision=8geometry=4Nc=3,vol=8388608stride=4325376precision=2geometry=4Nc=3,ghost	32	1	4	4096	1	2	0	-1	-1	-1	-1	0.00011653	# 0.00 Gflop/s, 765.56 GB/s, tuning took 0.239843 seconds at Sun Sep 24 15:22:50 2023
        75497472	N4quda15TransformReduceINS_7maximumIdEEKNS_7complexIdEEmNS_8abs_max_IddEENS_8identityEEE	,batch_size=1	1024	1	1	160	1	1	0	-1	-1	-1	-1	0.00138857	# 0.00 Gflop/s, 869.93 GB/s, tuning took 4.727140 seconds at Tue Aug 29 01:52:14 2023
      8x16x32x64	N4quda15CopyColorSpinorILi4ELi3ENS_11colorspinor11FloatNOrderIdLi4ELi3ELi2ELb0ELb0EEENS1_21SpaceSpinorColorOrderIdLi4ELi3EEESt5tupleIJRNS_16ColorSpinorFieldERKS7_19QudaFieldLocation_sPdPKdEEEE	GPU-offline,vol=262144,parity=1,precision=8,order=9,Ns=4,Nc=3vol=262144,parity=1,precision=8,order=2,Ns=4,Nc=3,NonRelBasis	896	1	1	293	1	1	0	-1	-1	-1	-1	0.00013886	# 0.00 Gflop/s, 724.93 GB/s, tuning took 0.025241 seconds at Sun Sep 24 15:14:52 2023
      8x16x32x64	N4quda15CopyColorSpinorILi4ELi3ENS_11colorspinor21SpaceSpinorColorOrderIdLi4ELi3EEENS1_11FloatNOrderIdLi4ELi3ELi2ELb0ELb0EEESt5tupleIJRNS_16ColorSpinorFieldERKS7_19QudaFieldLocation_sPdPKdEEEE	GPU-offline,vol=262144,parity=1,precision=8,order=2,Ns=4,Nc=3vol=262144,parity=1,precision=8,order=9,Ns=4,Nc=3,RelBasis	608	1	1	432	1	1	0	-1	-1	-1	-1	0.000131152	# 0.00 Gflop/s, 767.53 GB/s, tuning took 0.022876 seconds at Sun Sep 24 15:15:14 2023
      8x16x32x64	N4quda4PackIdLi3ELb1EEE	policy_kernel,vol=262144,parity=1,precision=8,order=2,Ns=4,Nc=3,comm=1100,topo=2211,nFace=1,device-device	768	1	1	160	1	1	0	-1	-1	-1	-1	5.50552e-05	# 14.28 Gflop/s, 342.83 GB/s, tuning took 1.385134 seconds at Sun Sep 24 15:14:54 2023
      8x16x32x64	N4quda4PackIdLi3ELb1EEE	policy_kernel,vol=262144,parity=1,precision=8,order=2,Ns=4,Nc=3,comm=1100,topo=2211,nFace=1,device-remote	32	1	1	149	1	1	0	-1	-1	-1	-1	0.000144777	# 5.43 Gflop/s, 130.37 GB/s, tuning took 2.714616 seconds at Sun Sep 24 15:15:09 2023
      8x16x32x64	N4quda4PackIdLi3ELb1EEE	policy_kernel,vol=262144,parity=1,precision=8,order=2,Ns=4,Nc=3,comm=1100,topo=2211,nFace=1,host-device	384	1	1	6	1	1	0	-1	-1	-1	-1	0.000294048	# 2.67 Gflop/s, 64.19 GB/s, tuning took 0.227777 seconds at Sun Sep 24 15:15:02 2023
      8x16x32x64	N4quda4PackIdLi3ELb1EEE	policy_kernel,vol=262144,parity=1,precision=8,order=2,Ns=4,Nc=3,comm=1100,topo=2211,nFace=1,host-host	480	1	1	6	1	1	0	-1	-1	-1	-1	0.000512459	# 1.53 Gflop/s, 36.83 GB/s, tuning took 0.290258 seconds at Sun Sep 24 15:14:56 2023
      8x16x32x64	N4quda4PackIdLi3ELb1EEE	policy_kernel,vol=262144,parity=1,precision=8,order=2,Ns=4,Nc=3,comm=1100,topo=2211,nFace=1,host-remote	256	1	1	6	1	1	0	-1	-1	-1	-1	0.0002576	# 3.05 Gflop/s, 73.27 GB/s, tuning took 0.207844 seconds at Sun Sep 24 15:15:10 2023
      8x16x32x64	N4quda6WilsonINS_9WilsonArgIdLi3ELi4EL21QudaReconstructType_s12EEEEE	policy,commDim=1100,parity=1,topo=2211,p2p=3,gdr=0,nvshmem=0,pol=110000111100110000	32	1	1	1	1	1	0	0	1	0	-1	0.000742795	# 465.85 Gflop/s, 813.12 GB/s, tuning took 0.225448 seconds at Sun Sep 24 15:15:14 2023
      8x16x32x64	N4quda6WilsonINS_9WilsonArgIdLi3ELi4EL21QudaReconstructType_s12EEEEE	policy_kernel=exterior_all,commDim=1100,parity=1	128	1	1	512	1	1	12289	-1	-1	-1	-1	0.000146743	# 80.39 Gflop/s, 257.24 GB/s, tuning took 0.209331 seconds at Sun Sep 24 15:14:55 2023
      8x16x32x64	N4quda6WilsonINS_9WilsonArgIdLi3ELi4EL21QudaReconstructType_s12EEEEE	policy_kernel=exterior_all,commDim=1100,parity=1,zero_copy,p2p=0	48	1	1	1366	1	1	49153	-1	-1	-1	-1	0.000638933	# 18.46 Gflop/s, 59.08 GB/s, tuning took 0.754259 seconds at Sun Sep 24 15:14:57 2023
      8x16x32x64	N4quda6WilsonINS_9WilsonArgIdLi3ELi4EL21QudaReconstructType_s12EEEEE	policy_kernel=exterior_all,commDim=1100,parity=1,zero_copy,p2p=1	128	1	1	512	1	1	8937	-1	-1	-1	-1	0.000143776	# 82.05 Gflop/s, 262.55 GB/s, tuning took 0.210456 seconds at Sun Sep 24 15:15:02 2023
      8x16x32x64	N4quda6WilsonINS_9WilsonArgIdLi3ELi4EL21QudaReconstructType_s12EEEEE	policy_kernel=exterior_x,commDim=1100,parity=1	16	1	1	2048	1	1	49153	-1	-1	-1	-1	0.000110848	# 53.21 Gflop/s, 170.27 GB/s, tuning took 0.171067 seconds at Sun Sep 24 15:14:55 2023
      8x16x32x64	N4quda6WilsonINS_9WilsonArgIdLi3ELi4EL21QudaReconstructType_s12EEEEE	policy_kernel=exterior_x,commDim=1100,parity=1,zero_copy,p2p=0	16	1	1	2048	1	1	49153	-1	-1	-1	-1	0.000264704	# 22.28 Gflop/s, 71.30 GB/s, tuning took 0.353051 seconds at Sun Sep 24 15:14:56 2023
      8x16x32x64	N4quda6WilsonINS_9WilsonArgIdLi3ELi4EL21QudaReconstructType_s12EEEEE	policy_kernel=exterior_x,commDim=1100,parity=1,zero_copy,p2p=1	16	1	1	2048	1	1	49153	-1	-1	-1	-1	0.000109485	# 53.87 Gflop/s, 172.39 GB/s, tuning took 0.170597 seconds at Sun Sep 24 15:15:02 2023
      8x16x32x64	N4quda6WilsonINS_9WilsonArgIdLi3ELi4EL21QudaReconstructType_s12EEEEE	policy_kernel=exterior_y,commDim=1100,parity=1	32	1	1	1024	1	1	4916	-1	-1	-1	-1	2.94061e-05	# 200.58 Gflop/s, 641.85 GB/s, tuning took 0.052093 seconds at Sun Sep 24 15:14:55 2023
      8x16x32x64	N4quda6WilsonINS_9WilsonArgIdLi3ELi4EL21QudaReconstructType_s12EEEEE	policy_kernel=exterior_y,commDim=1100,parity=1,zero_copy,p2p=0	16	1	1	2048	1	1	49153	-1	-1	-1	-1	0.000263128	# 22.42 Gflop/s, 71.73 GB/s, tuning took 0.316244 seconds at Sun Sep 24 15:14:56 2023
      8x16x32x64	N4quda6WilsonINS_9WilsonArgIdLi3ELi4EL21QudaReconstructType_s12EEEEE	policy_kernel=exterior_y,commDim=1100,parity=1,zero_copy,p2p=1	32	1	1	1024	1	1	4916	-1	-1	-1	-1	2.9424e-05	# 200.46 Gflop/s, 641.46 GB/s, tuning took 0.052150 seconds at Sun Sep 24 15:15:02 2023
      8x16x32x64	N4quda6WilsonINS_9WilsonArgIdLi3ELi4EL21QudaReconstructType_s12EEEEE	policy_kernel=interior,comm=1100,commDim=1100,parity=1	128	1	1	2048	1	1	49153	-1	-1	-1	-1	0.000512971	# 654.63 Gflop/s, 1103.83 GB/s, tuning took 0.691695 seconds at Sun Sep 24 15:14:55 2023
      8x16x32x64	N4quda6WilsonINS_9WilsonArgIdLi3ELi4EL21QudaReconstructType_s12EEEEE	policy_kernel=interior,comm=1100,commDim=1100,parity=1,host-device	64	1	1	4096	1	1	32769	2	-1	-1	-1	0.00055376	# 607.83 Gflop/s, 1056.60 GB/s, tuning took 4.142129 seconds at Sun Sep 24 15:15:07 2023
      8x16x32x64	N4quda6WilsonINS_9WilsonArgIdLi3ELi4EL21QudaReconstructType_s12EEEEE	policy_kernel=interior,comm=1100,commDim=1100,parity=1,host-host	32	1	1	8192	1	1	24577	2	-1	-1	-1	0.000572608	# 587.82 Gflop/s, 1021.83 GB/s, tuning took 4.455613 seconds at Sun Sep 24 15:15:02 2023
      8x16x32x64	N4quda6WilsonINS_9WilsonArgIdLi3ELi4EL21QudaReconstructType_s12EEEEE	policy_kernel=interior,comm=1100,commDim=1100,parity=1,host-remote	64	1	1	4096	1	1	32769	2	-1	-1	-1	0.000543243	# 619.60 Gflop/s, 1077.06 GB/s, tuning took 4.029213 seconds at Sun Sep 24 15:15:14 2023
      8x32x16x64	N4quda15CopyColorSpinorILi4ELi3ENS_11colorspinor11FloatNOrderIdLi4ELi3ELi2ELb0ELb0EEENS1_21SpaceSpinorColorOrderIdLi4ELi3EEESt5tupleIJRNS_16ColorSpinorFieldERKS7_19QudaFieldLocation_sPdPKdEEEE	GPU-offline,vol=262144,parity=1,precision=8,order=9,Ns=4,Nc=3vol=262144,parity=1,precision=8,order=2,Ns=4,Nc=3,NonRelBasis	864	1	1	304	1	1	0	-1	-1	-1	-1	0.000136776	# 0.00 Gflop/s, 735.97 GB/s, tuning took 0.024932 seconds at Sun Sep 17 02:00:14 2023
      8x32x16x64	N4quda15CopyColorSpinorILi4ELi3ENS_11colorspinor21SpaceSpinorColorOrderIdLi4ELi3EEENS1_11FloatNOrderIdLi4ELi3ELi2ELb0ELb0EEESt5tupleIJRNS_16ColorSpinorFieldERKS7_19QudaFieldLocation_sPdPKdEEEE	GPU-offline,vol=262144,parity=1,precision=8,order=2,Ns=4,Nc=3vol=262144,parity=1,precision=8,order=9,Ns=4,Nc=3,RelBasis	608	1	1	432	1	1	0	-1	-1	-1	-1	0.000130468	# 0.00 Gflop/s, 771.56 GB/s, tuning took 0.022689 seconds at Sun Sep 17 02:00:35 2023
      8x32x16x64	N4quda4PackIdLi3ELb1EEE	policy_kernel,vol=262144,parity=1,precision=8,order=2,Ns=4,Nc=3,comm=1010,topo=2121,nFace=1,device-device	896	1	1	160	1	1	0	-1	-1	-1	-1	5.21888e-05	# 15.07 Gflop/s, 361.66 GB/s, tuning took 1.276772 seconds at Sun Sep 17 02:00:15 2023
      8x32x16x64	N4quda4PackIdLi3ELb1EEE	policy_kernel,vol=262144,parity=1,precision=8,order=2,Ns=4,Nc=3,comm=1010,topo=2121,nFace=1,device-remote	832	1	1	160	1	1	0	-1	-1	-1	-1	5.22055e-05	# 15.06 Gflop/s, 361.54 GB/s, tuning took 1.276394 seconds at Sun Sep 17 02:00:30 2023
      8x32x16x64	N4quda4PackIdLi3ELb1EEE	policy_kernel,vol=262144,parity=1,precision=8,order=2,Ns=4,Nc=3,comm=1010,topo=2121,nFace=1,host-device	96	1	1	5	1	1	0	-1	-1	-1	-1	0.000509472	# 1.54 Gflop/s, 37.05 GB/s, tuning took 0.281846 seconds at Sun Sep 17 02:00:23 2023
      8x32x16x64	N4quda4PackIdLi3ELb1EEE	policy_kernel,vol=262144,parity=1,precision=8,order=2,Ns=4,Nc=3,comm=1010,topo=2121,nFace=1,host-host	96	1	1	5	1	1	0	-1	-1	-1	-1	0.000509003	# 1.55 Gflop/s, 37.08 GB/s, tuning took 0.290230 seconds at Sun Sep 17 02:00:17 2023
      8x32x16x64	N4quda4PackIdLi3ELb1EEE	policy_kernel,vol=262144,parity=1,precision=8,order=2,Ns=4,Nc=3,comm=1010,topo=2121,nFace=1,host-remote	96	1	1	5	1	1	0	-1	-1	-1	-1	0.000509493	# 1.54 Gflop/s, 37.05 GB/s, tuning took 0.281786 seconds at Sun Sep 17 02:00:31 2023
      8x32x16x64	N4quda6WilsonINS_9WilsonArgIdLi3ELi4EL21QudaReconstructType_s12EEEEE	policy,commDim=1010,parity=1,topo=2121,p2p=3,gdr=0,nvshmem=0,pol=110000111100110000	32	1	1	1	1	1	0	1	2	0	-1	0.00216844	# 159.58 Gflop/s, 278.53 GB/s, tuning took 0.348877 seconds at Sun Sep 17 02:00:35 2023
      8x32x16x64	N4quda6WilsonINS_9WilsonArgIdLi3ELi4EL21QudaReconstructType_s12EEEEE	policy_kernel=exterior_all,commDim=1010,parity=1	32	1	1	2048	1	1	12289	-1	-1	-1	-1	0.000127852	# 92.27 Gflop/s, 295.25 GB/s, tuning took 0.181769 seconds at Sun Sep 17 02:00:17 2023
      8x32x16x64	N4quda6WilsonINS_9WilsonArgIdLi3ELi4EL21QudaReconstructType_s12EEEEE	policy_kernel=exterior_all,commDim=1010,parity=1,zero_copy,p2p=0	64	1	1	1024	1	1	49153	-1	-1	-1	-1	0.000522517	# 22.58 Gflop/s, 72.24 GB/s, tuning took 0.627964 seconds at Sun Sep 17 02:00:19 2023
      8x32x16x64	N4quda6WilsonINS_9WilsonArgIdLi3ELi4EL21QudaReconstructType_s12EEEEE	policy_kernel=exterior_all,commDim=1010,parity=1,zero_copy,p2p=1	64	1	1	1024	1	1	49153	-1	-1	-1	-1	0.000522208	# 22.59 Gflop/s, 72.29 GB/s, tuning took 0.627953 seconds at Sun Sep 17 02:00:25 2023
      8x32x16x64	N4quda6WilsonINS_9WilsonArgIdLi3ELi4EL21QudaReconstructType_s12EEEEE	policy_kernel=exterior_x,commDim=1010,parity=1	16	1	1	2048	1	1	49153	-1	-1	-1	-1	0.000102061	# 57.79 Gflop/s, 184.93 GB/s, tuning took 0.175776 seconds at Sun Sep 17 02:00:16 2023
      8x32x16x64	N4quda6WilsonINS_9WilsonArgIdLi3ELi4EL21QudaReconstructType_s12EEEEE	policy_kernel=exterior_x,commDim=1010,parity=1,zero_copy,p2p=0	16	1	1	2048	1	1	49153	-1	-1	-1	-1	0.000264736	# 22.28 Gflop/s, 71.30 GB/s, tuning took 0.355732 seconds at Sun Sep 17 02:00:18 2023
      8x32x16x64	N4quda6WilsonINS_9WilsonArgIdLi3ELi4EL21QudaReconstructType_s12EEEEE	policy_kernel=exterior_x,commDim=1010,parity=1,zero_copy,p2p=1	16	1	1	2048	1	1	49153	-1	-1	-1	-1	0.000264688	# 22.28 Gflop/s, 71.31 GB/s, tuning took 0.356029 seconds at Sun Sep 17 02:00:24 2023
      8x32x16x64	N4quda6WilsonINS_9WilsonArgIdLi3ELi4EL21QudaReconstructType_s12EEEEE	policy_kernel=exterior_z,commDim=1010,parity=1	32	1	1	1024	1	1	3073	-1	-1	-1	-1	2.63183e-05	# 224.11 Gflop/s, 717.16 GB/s, tuning took 0.048773 seconds at Sun Sep 17 02:00:16 2023
      8x32x16x64	N4quda6WilsonINS_9WilsonArgIdLi3ELi4EL21QudaReconstructType_s12EEEEE	policy_kernel=exterior_z,commDim=1010,parity=1,zero_copy,p2p=0	16	1	1	2048	1	1	49153	-1	-1	-1	-1	0.000262576	# 22.46 Gflop/s, 71.88 GB/s, tuning took 0.314124 seconds at Sun Sep 17 02:00:17 2023
      8x32x16x64	N4quda6WilsonINS_9WilsonArgIdLi3ELi4EL21QudaReconstructType_s12EEEEE	policy_kernel=exterior_z,commDim=1010,parity=1,zero_copy,p2p=1	16	1	1	2048	1	1	49153	-1	-1	-1	-1	0.00026264	# 22.46 Gflop/s, 71.86 GB/s, tuning took 0.314712 seconds at Sun Sep 17 02:00:24 2023
      8x32x16x64	N4quda6WilsonINS_9WilsonArgIdLi3ELi4EL21QudaReconstructType_s12EEEEE	policy_kernel=interior,comm=1010,commDim=1010,parity=1	128	1	1	2048	1	1	49153	-1	-1	-1	-1	0.00049552	# 677.68 Gflop/s, 1142.70 GB/s, tuning took 0.679071 seconds at Sun Sep 17 02:00:16 2023
      8x32x16x64	N4quda6WilsonINS_9WilsonArgIdLi3ELi4EL21QudaReconstructType_s12EEEEE	policy_kernel=interior,comm=1010,commDim=1010,parity=1,host-device	16	1	1	16384	1	1	8193	5	-1	-1	-1	0.000573931	# 586.47 Gflop/s, 1019.47 GB/s, tuning took 4.369796 seconds at Sun Sep 17 02:00:29 2023
      8x32x16x64	N4quda6WilsonINS_9WilsonArgIdLi3ELi4EL21QudaReconstructType_s12EEEEE	policy_kernel=interior,comm=1010,commDim=1010,parity=1,host-host	16	1	1	16384	1	1	10923	4	-1	-1	-1	0.000573579	# 586.83 Gflop/s, 1020.10 GB/s, tuning took 4.364674 seconds at Sun Sep 17 02:00:23 2023
      8x32x16x64	N4quda6WilsonINS_9WilsonArgIdLi3ELi4EL21QudaReconstructType_s12EEEEE	policy_kernel=interior,comm=1010,commDim=1010,parity=1,host-remote	16	1	1	16384	1	1	10923	4	-1	-1	-1	0.000572405	# 588.03 Gflop/s, 1022.19 GB/s, tuning took 4.366494 seconds at Sun Sep 17 02:00:35 2023
      8x32x32x32	N4quda15CopyColorSpinorILi4ELi3ENS_11colorspinor11FloatNOrderIdLi4ELi3ELi2ELb0ELb0EEENS1_21SpaceSpinorColorOrderIdLi4ELi3EEESt5tupleIJRNS_16ColorSpinorFieldERKS7_19QudaFieldLocation_sPdPKdEEEE	GPU-offline,vol=262144,parity=1,precision=8,order=9,Ns=4,Nc=3vol=262144,parity=1,precision=8,order=2,Ns=4,Nc=3,NonRelBasis	864	1	1	304	1	1	0	-1	-1	-1	-1	0.00013854	# 0.00 Gflop/s, 726.60 GB/s, tuning took 0.025317 seconds at Mon Sep 18 18:43:12 2023
      8x32x32x32	N4quda15CopyColorSpinorILi4ELi3ENS_11colorspinor21SpaceSpinorColorOrderIdLi4ELi3EEENS1_11FloatNOrderIdLi4ELi3ELi2ELb0ELb0EEESt5tupleIJRNS_16ColorSpinorFieldERKS7_19QudaFieldLocation_sPdPKdEEEE	GPU-offline,vol=262144,parity=1,precision=8,order=2,Ns=4,Nc=3vol=262144,parity=1,precision=8,order=9,Ns=4,Nc=3,RelBasis	640	1	1	410	1	1	0	-1	-1	-1	-1	0.000131592	# 0.00 Gflop/s, 764.97 GB/s, tuning took 0.022947 seconds at Mon Sep 18 18:43:31 2023
      8x32x32x32	N4quda4PackIdLi3ELb1EEE	policy_kernel,vol=262144,parity=1,precision=8,order=2,Ns=4,Nc=3,comm=1001,topo=2112,nFace=1,device-device	640	1	1	120	1	1	0	-1	-1	-1	-1	4.56044e-05	# 12.93 Gflop/s, 310.40 GB/s, tuning took 1.119969 seconds at Mon Sep 18 18:43:13 2023
      8x32x32x32	N4quda4PackIdLi3ELb1EEE	policy_kernel,vol=262144,parity=1,precision=8,order=2,Ns=4,Nc=3,comm=1001,topo=2112,nFace=1,device-remote	96	1	1	38	1	1	0	-1	-1	-1	-1	9.17789e-05	# 6.43 Gflop/s, 154.24 GB/s, tuning took 1.865089 seconds at Mon Sep 18 18:43:26 2023
      8x32x32x32	N4quda4PackIdLi3ELb1EEE	policy_kernel,vol=262144,parity=1,precision=8,order=2,Ns=4,Nc=3,comm=1001,topo=2112,nFace=1,host-device	256	1	1	6	1	1	0	-1	-1	-1	-1	0.000212038	# 2.78 Gflop/s, 66.76 GB/s, tuning took 0.170629 seconds at Mon Sep 18 18:43:20 2023
      8x32x32x32	N4quda4PackIdLi3ELb1EEE	policy_kernel,vol=262144,parity=1,precision=8,order=2,Ns=4,Nc=3,comm=1001,topo=2112,nFace=1,host-host	128	1	1	6	1	1	0	-1	-1	-1	-1	0.000364459	# 1.62 Gflop/s, 38.84 GB/s, tuning took 0.208368 seconds at Mon Sep 18 18:43:14 2023
      8x32x32x32	N4quda4PackIdLi3ELb1EEE	policy_kernel,vol=262144,parity=1,precision=8,order=2,Ns=4,Nc=3,comm=1001,topo=2112,nFace=1,host-remote	256	1	1	6	1	1	0	-1	-1	-1	-1	0.000186624	# 3.16 Gflop/s, 75.85 GB/s, tuning took 0.160308 seconds at Mon Sep 18 18:43:27 2023
      8x32x32x32	N4quda6WilsonINS_9WilsonArgIdLi3ELi4EL21QudaReconstructType_s12EEEEE	policy,commDim=1001,parity=1,topo=2112,p2p=3,gdr=0,nvshmem=0,pol=110000111100110000	32	1	1	1	1	1	0	1	1	0	-1	0.00123121	# 281.05 Gflop/s, 490.56 GB/s, tuning took 0.235503 seconds at Mon Sep 18 18:43:31 2023
      8x32x32x32	N4quda6WilsonINS_9WilsonArgIdLi3ELi4EL21QudaReconstructType_s12EEEEE	policy_kernel=exterior_all,commDim=1001,parity=1	128	1	1	384	1	1	32769	-1	-1	-1	-1	0.000118692	# 74.54 Gflop/s, 238.53 GB/s, tuning took 0.177886 seconds at Mon Sep 18 18:43:14 2023
      8x32x32x32	N4quda6WilsonINS_9WilsonArgIdLi3ELi4EL21QudaReconstructType_s12EEEEE	policy_kernel=exterior_all,commDim=1001,parity=1,zero_copy,p2p=0	128	1	1	384	1	1	49153	-1	-1	-1	-1	0.000393888	# 22.46 Gflop/s, 71.88 GB/s, tuning took 0.474660 seconds at Mon Sep 18 18:43:15 2023
      8x32x32x32	N4quda6WilsonINS_9WilsonArgIdLi3ELi4EL21QudaReconstructType_s12EEEEE	policy_kernel=exterior_all,commDim=1001,parity=1,zero_copy,p2p=1	128	1	1	384	1	1	32769	-1	-1	-1	-1	0.000118702	# 74.53 Gflop/s, 238.51 GB/s, tuning took 0.176983 seconds at Mon Sep 18 18:43:20 2023
      8x32x32x32	N4quda6WilsonINS_9WilsonArgIdLi3ELi4EL21QudaReconstructType_s12EEEEE	policy_kernel=exterior_t,commDim=1001,parity=1	128	1	1	128	1	1	6554	-1	-1	-1	-1	8.81957e-06	# 334.38 Gflop/s, 1070.03 GB/s, tuning took 0.028888 seconds at Mon Sep 18 18:43:14 2023
      8x32x32x32	N4quda6WilsonINS_9WilsonArgIdLi3ELi4EL21QudaReconstructType_s12EEEEE	policy_kernel=exterior_t,commDim=1001,parity=1,zero_copy,p2p=0	16	1	1	1024	1	1	49153	-1	-1	-1	-1	0.000134852	# 21.87 Gflop/s, 69.98 GB/s, tuning took 0.187475 seconds at Mon Sep 18 18:43:14 2023
      8x32x32x32	N4quda6WilsonINS_9WilsonArgIdLi3ELi4EL21QudaReconstructType_s12EEEEE	policy_kernel=exterior_t,commDim=1001,parity=1,zero_copy,p2p=1	128	1	1	128	1	1	10923	-1	-1	-1	-1	8.77138e-06	# 336.22 Gflop/s, 1075.91 GB/s, tuning took 0.028910 seconds at Mon Sep 18 18:43:20 2023
      8x32x32x32	N4quda6WilsonINS_9WilsonArgIdLi3ELi4EL21QudaReconstructType_s12EEEEE	policy_kernel=exterior_x,commDim=1001,parity=1	16	1	1	2048	1	1	49153	-1	-1	-1	-1	0.000110723	# 53.27 Gflop/s, 170.46 GB/s, tuning took 0.169853 seconds at Mon Sep 18 18:43:14 2023
      8x32x32x32	N4quda6WilsonINS_9WilsonArgIdLi3ELi4EL21QudaReconstructType_s12EEEEE	policy_kernel=exterior_x,commDim=1001,parity=1,zero_copy,p2p=0	16	1	1	2048	1	1	49153	-1	-1	-1	-1	0.00026444	# 22.30 Gflop/s, 71.37 GB/s, tuning took 0.352476 seconds at Mon Sep 18 18:43:15 2023
      8x32x32x32	N4quda6WilsonINS_9WilsonArgIdLi3ELi4EL21QudaReconstructType_s12EEEEE	policy_kernel=exterior_x,commDim=1001,parity=1,zero_copy,p2p=1	16	1	1	2048	1	1	49153	-1	-1	-1	-1	0.000110166	# 53.54 Gflop/s, 171.33 GB/s, tuning took 0.171518 seconds at Mon Sep 18 18:43:20 2023
      8x32x32x32	N4quda6WilsonINS_9WilsonArgIdLi3ELi4EL21QudaReconstructType_s12EEEEE	policy_kernel=interior,comm=1001,commDim=1001,parity=1	128	1	1	2048	1	1	49153	-1	-1	-1	-1	0.000513163	# 659.37 Gflop/s, 1121.80 GB/s, tuning took 0.690882 seconds at Mon Sep 18 18:43:13 2023
      8x32x32x32	N4quda6WilsonINS_9WilsonArgIdLi3ELi4EL21QudaReconstructType_s12EEEEE	policy_kernel=interior,comm=1001,commDim=1001,parity=1,host-device	64	1	1	4096	1	1	32769	2	-1	-1	-1	0.000542507	# 624.79 Gflop/s, 1087.22 GB/s, tuning took 4.084945 seconds at Mon Sep 18 18:43:24 2023
      8x32x32x32	N4quda6WilsonINS_9WilsonArgIdLi3ELi4EL21QudaReconstructType_s12EEEEE	policy_kernel=interior,comm=1001,commDim=1001,parity=1,host-host	32	1	1	8192	1	1	19661	3	-1	-1	-1	0.000584928	# 579.48 Gflop/s, 1008.37 GB/s, tuning took 4.258988 seconds at Mon Sep 18 18:43:20 2023
      8x32x32x32	N4quda6WilsonINS_9WilsonArgIdLi3ELi4EL21QudaReconstructType_s12EEEEE	policy_kernel=interior,comm=1001,commDim=1001,parity=1,host-remote	32	1	1	8192	1	1	19661	3	-1	-1	-1	0.000534795	# 633.80 Gflop/s, 1102.90 GB/s, tuning took 4.006023 seconds at Mon Sep 18 18:43:31 2023
      8x32x32x64	N4quda10GaugeGaussIdLi3EL21QudaReconstructType_s12EEE	GPU-offline,vol=524288stride=294912precision=8geometry=4Nc=3,lie_group	384	1	1	683	2	1	0	-1	-1	-1	-1	0.00117587	# 0.00 Gflop/s, 192.62 GB/s, tuning took 1.529089 seconds at Sat Sep 23 13:51:53 2023
      8x32x32x64	N4quda12ExtractGhostIdLi3ENS_5gauge11FloatNOrderIdLi18ELi2ELi12EL20QudaStaggeredPhase_s0ELb1EL19QudaGhostExchange_sn2147483648ELb0EEEEE	GPU-offline,vol=524288stride=294912precision=8geometry=4Nc=3,extract	32	1	7	2048	1	2	0	-1	-1	-1	-1	5.58311e-05	# 0.00 Gflop/s, 366.23 GB/s, tuning took 0.119794 seconds at Sat Sep 23 13:51:49 2023
      8x32x32x64	N4quda15CopyColorSpinorILi4ELi3ENS_11colorspinor11FloatNOrderIdLi4ELi3ELi2ELb0ELb0EEENS1_21SpaceSpinorColorOrderIdLi4ELi3EEESt5tupleIJRNS_16ColorSpinorFieldERKS7_19QudaFieldLocation_sPdPKdEEEE	GPU-offline,vol=524288,parity=1,precision=8,order=9,Ns=4,Nc=3vol=524288,parity=1,precision=8,order=2,Ns=4,Nc=3,NonRelBasis	864	1	1	607	1	1	0	-1	-1	-1	-1	0.000274016	# 0.00 Gflop/s, 734.73 GB/s, tuning took 0.037991 seconds at Sat Sep 23 13:35:34 2023
      8x32x32x64	N4quda15CopyColorSpinorILi4ELi3ENS_11colorspinor21SpaceSpinorColorOrderIdLi4ELi3EEENS1_11FloatNOrderIdLi4ELi3ELi2ELb0ELb0EEESt5tupleIJRNS_16ColorSpinorFieldERKS7_19QudaFieldLocation_sPdPKdEEEE	GPU-offline,vol=524288,parity=1,precision=8,order=2,Ns=4,Nc=3vol=524288,parity=1,precision=8,order=9,Ns=4,Nc=3,RelBasis	512	1	1	1024	1	1	0	-1	-1	-1	-1	0.00026032	# 0.00 Gflop/s, 773.38 GB/s, tuning took 0.034350 seconds at Sat Sep 23 13:36:32 2023
      8x32x32x64	N4quda4PackIdLi3ELb1EEE	policy_kernel,vol=524288,parity=1,precision=8,order=2,Ns=4,Nc=3,comm=1000,topo=2111,nFace=1,device-device	704	1	1	80	1	1	0	-1	-1	-1	-1	7.66926e-05	# 10.25 Gflop/s, 246.10 GB/s, tuning took 1.765759 seconds at Sat Sep 23 13:35:35 2023
      8x32x32x64	N4quda4PackIdLi3ELb1EEE	policy_kernel,vol=524288,parity=1,precision=8,order=2,Ns=4,Nc=3,comm=1000,topo=2111,nFace=1,device-remote	32	1	1	17	1	1	0	-1	-1	-1	-1	0.000281896	# 2.79 Gflop/s, 66.96 GB/s, tuning took 4.555206 seconds at Sat Sep 23 13:36:16 2023
      8x32x32x64	N4quda4PackIdLi3ELb1EEE	policy_kernel,vol=524288,parity=1,precision=8,order=2,Ns=4,Nc=3,comm=1000,topo=2111,nFace=1,host-device	128	1	1	3	1	1	0	-1	-1	-1	-1	0.000533141	# 1.48 Gflop/s, 35.40 GB/s, tuning took 0.278295 seconds at Sat Sep 23 13:35:55 2023
      8x32x32x64	N4quda4PackIdLi3ELb1EEE	policy_kernel,vol=524288,parity=1,precision=8,order=2,Ns=4,Nc=3,comm=1000,topo=2111,nFace=1,host-host	128	1	1	3	1	1	0	-1	-1	-1	-1	0.000499424	# 1.57 Gflop/s, 37.79 GB/s, tuning took 0.269174 seconds at Sat Sep 23 13:35:38 2023
      8x32x32x64	N4quda4PackIdLi3ELb1EEE	policy_kernel,vol=524288,parity=1,precision=8,order=2,Ns=4,Nc=3,comm=1000,topo=2111,nFace=1,host-remote	256	1	1	3	1	1	0	-1	-1	-1	-1	0.000489515	# 1.61 Gflop/s, 38.56 GB/s, tuning took 0.264844 seconds at Sat Sep 23 13:36:16 2023
      8x32x32x64	N4quda6WilsonINS_9WilsonArgIdLi3ELi4EL21QudaReconstructType_s12EEEEE	policy,commDim=1000,parity=1,topo=2111,p2p=3,gdr=0,nvshmem=0,pol=110000111100110000	32	1	1	1	1	1	0	12	2	0	-1	0.00131316	# 527.02 Gflop/s, 919.89 GB/s, tuning took 0.239327 seconds at Sat Sep 23 13:36:32 2023
      8x32x32x64	N4quda6WilsonINS_9WilsonArgIdLi3ELi4EL21QudaReconstructType_s12EEEEE	policy_kernel=exterior_all,commDim=1000,parity=1	96	1	1	683	1	1	49153	-1	-1	-1	-1	0.000215597	# 54.72 Gflop/s, 175.09 GB/s, tuning took 0.303028 seconds at Sat Sep 23 13:35:38 2023
      8x32x32x64	N4quda6WilsonINS_9WilsonArgIdLi3ELi4EL21QudaReconstructType_s12EEEEE	policy_kernel=exterior_all,commDim=1000,parity=1,zero_copy,p2p=0	16	1	1	4096	1	1	32769	-1	-1	-1	-1	0.000520021	# 22.68 Gflop/s, 72.59 GB/s, tuning took 0.652233 seconds at Sat Sep 23 13:35:39 2023
      8x32x32x64	N4quda6WilsonINS_9WilsonArgIdLi3ELi4EL21QudaReconstructType_s12EEEEE	policy_kernel=exterior_all,commDim=1000,parity=1,zero_copy,p2p=1	64	1	1	1024	1	1	49153	-1	-1	-1	-1	0.000209222	# 56.38 Gflop/s, 180.42 GB/s, tuning took 0.316251 seconds at Sat Sep 23 13:35:56 2023
      8x32x32x64	N4quda6WilsonINS_9WilsonArgIdLi3ELi4EL21QudaReconstructType_s12EEEEE	policy_kernel=exterior_x,commDim=1000,parity=1	16	1	1	4096	1	1	49153	-1	-1	-1	-1	0.000205562	# 57.39 Gflop/s, 183.64 GB/s, tuning took 0.308457 seconds at Sat Sep 23 13:35:37 2023
      8x32x32x64	N4quda6WilsonINS_9WilsonArgIdLi3ELi4EL21QudaReconstructType_s12EEEEE	policy_kernel=exterior_x,commDim=1000,parity=1,zero_copy,p2p=0	16	1	1	4096	1	1	49153	-1	-1	-1	-1	0.000518304	# 22.76 Gflop/s, 72.83 GB/s, tuning took 0.649123 seconds at Sat Sep 23 13:35:39 2023
      8x32x32x64	N4quda6WilsonINS_9WilsonArgIdLi3ELi4EL21QudaReconstructType_s12EEEEE	policy_kernel=exterior_x,commDim=1000,parity=1,zero_copy,p2p=1	16	1	1	4096	1	1	49153	-1	-1	-1	-1	0.00020464	# 57.65 Gflop/s, 184.46 GB/s, tuning took 0.314996 seconds at Sat Sep 23 13:35:56 2023
      8x32x32x64	N4quda6WilsonINS_9WilsonArgIdLi3ELi4EL21QudaReconstructType_s12EEEEE	policy_kernel=interior,comm=1000,commDim=1000,parity=1	128	1	1	4096	1	1	49153	-1	-1	-1	-1	0.00103006	# 661.94 Gflop/s, 1136.06 GB/s, tuning took 1.403015 seconds at Sat Sep 23 13:35:37 2023
      8x32x32x64	N4quda6WilsonINS_9WilsonArgIdLi3ELi4EL21QudaReconstructType_s12EEEEE	policy_kernel=interior,comm=1000,commDim=1000,parity=1,host-device	64	1	1	8192	1	1	32769	2	-1	-1	-1	0.00107284	# 636.27 Gflop/s, 1108.35 GB/s, tuning took 15.473552 seconds at Sat Sep 23 13:36:11 2023
      8x32x32x64	N4quda6WilsonINS_9WilsonArgIdLi3ELi4EL21QudaReconstructType_s12EEEEE	policy_kernel=interior,comm=1000,commDim=1000,parity=1,host-host	64	1	1	8192	1	1	32769	2	-1	-1	-1	0.00106279	# 642.29 Gflop/s, 1118.83 GB/s, tuning took 15.431226 seconds at Sat Sep 23 13:35:55 2023
      8x32x32x64	N4quda6WilsonINS_9WilsonArgIdLi3ELi4EL21QudaReconstructType_s12EEEEE	policy_kernel=interior,comm=1000,commDim=1000,parity=1,host-remote	32	1	1	16384	1	1	19661	3	-1	-1	-1	0.00106477	# 641.10 Gflop/s, 1116.76 GB/s, tuning took 15.235860 seconds at Sat Sep 23 13:36:31 2023
      8x32x32x64	N4quda7RNGInitE	GPU-offline,vol=524288stride=294912precision=8geometry=4Nc=3	320	2	1	820	1	1	0	-1	-1	-1	-1	0.0075801	# 0.00 Gflop/s, 0.00 GB/s, tuning took 1.098408 seconds at Sat Sep 23 13:51:51 2023
      8x32x32x64	N4quda9CopyGaugeINS_12CopyGaugeArgIddLi18ELb0ENS_5gauge11FloatNOrderIdLi18ELi2ELi12EL20QudaStaggeredPhase_s0ELb1EL19QudaGhostExchange_sn2147483648ELb0EEENS2_8QDPOrderIdLi18EEEEEEE	GPU-offline,vol=524288stride=262144precision=8geometry=4Nc=3,vol=524288stride=294912precision=8geometry=4Nc=3	96	1	1	2731	1	8	2458	-1	-1	-1	-1	0.000615296	# 0.00 Gflop/s, 858.91 GB/s, tuning took 1.023994 seconds at Sat Sep 23 13:51:49 2023
      8x32x32x64	N4quda9CopyGaugeINS_12CopyGaugeArgIddLi18ELb0ENS_5gauge11FloatNOrderIdLi18ELi2ELi12EL20QudaStaggeredPhase_s0ELb1EL19QudaGhostExchange_sn2147483648ELb0EEES6_EEEE	GPU-offline,vol=524288stride=294912precision=8geometry=4Nc=3,vol=524288stride=294912precision=8geometry=4Nc=3,ghost	640	1	1	52	1	8	16385	-1	-1	-1	-1	2.88565e-05	# 0.00 Gflop/s, 797.16 GB/s, tuning took 0.069071 seconds at Sat Sep 23 13:51:49 2023
      8x32x32x64	N4quda9CopyGaugeINS_12CopyGaugeArgIddLi18ELb0ENS_5gauge8QDPOrderIdLi18EEENS2_11FloatNOrderIdLi18ELi2ELi12EL20QudaStaggeredPhase_s0ELb1EL19QudaGhostExchange_sn2147483648ELb0EEEEEEE	GPU-offline,vol=524288stride=294912precision=8geometry=4Nc=3,vol=524288stride=262144precision=8geometry=4Nc=3	96	1	1	2731	1	8	2458	-1	-1	-1	-1	0.000647488	# 0.00 Gflop/s, 816.20 GB/s, tuning took 1.079526 seconds at Sat Sep 23 13:51:54 2023
      8x32x32x64	N4quda9CopyGaugeINS_12CopyGaugeArgIfdLi18ELb0ENS_5gauge11FloatNOrderIfLi18ELi4ELi12EL20QudaStaggeredPhase_s0ELb1EL19QudaGhostExchange_sn2147483648ELb0EEENS3_IdLi18ELi2ELi12ELS4_0ELb1ELS5_n2147483648ELb0EEEEEEE	GPU-offline,vol=524288stride=294912precision=8geometry=4Nc=3,vol=524288stride=294912precision=4geometry=4Nc=3	32	1	1	8192	1	8	0	-1	-1	-1	-1	0.000372107	# 0.00 Gflop/s, 913.01 GB/s, tuning took 0.648322 seconds at Sat Sep 23 13:51:50 2023
      8x32x32x64	N4quda9CopyGaugeINS_12CopyGaugeArgIfdLi18ELb0ENS_5gauge11FloatNOrderIfLi18ELi4ELi12EL20QudaStaggeredPhase_s0ELb1EL19QudaGhostExchange_sn2147483648ELb0EEENS3_IdLi18ELi2ELi12ELS4_0ELb1ELS5_n2147483648ELb0EEEEEEE	GPU-offline,vol=524288stride=294912precision=8geometry=4Nc=3,vol=524288stride=294912precision=4geometry=4Nc=3,ghost	64	1	7	512	1	2	0	-1	-1	-1	-1	2.2726e-05	# 0.00 Gflop/s, 759.15 GB/s, tuning took 0.060932 seconds at Sat Sep 23 13:51:50 2023
      8x32x32x64	N4quda9CopyGaugeINS_12CopyGaugeArgIsdLi18ELb0ENS_5gauge11FloatNOrderIsLi18ELi4ELi12EL20QudaStaggeredPhase_s0ELb1EL19QudaGhostExchange_sn2147483648ELb0EEENS3_IdLi18ELi2ELi12ELS4_0ELb1ELS5_n2147483648ELb0EEEEEEE	GPU-offline,vol=524288stride=294912precision=8geometry=4Nc=3,vol=524288stride=294912precision=2geometry=4Nc=3	32	1	5	8192	1	2	0	-1	-1	-1	-1	0.000329176	# 0.00 Gflop/s, 860.07 GB/s, tuning took 0.578501 seconds at Sat Sep 23 13:51:49 2023
      8x32x32x64	N4quda9CopyGaugeINS_12CopyGaugeArgIsdLi18ELb0ENS_5gauge11FloatNOrderIsLi18ELi4ELi12EL20QudaStaggeredPhase_s0ELb1EL19QudaGhostExchange_sn2147483648ELb0EEENS3_IdLi18ELi2ELi12ELS4_0ELb1ELS5_n2147483648ELb0EEEEEEE	GPU-offline,vol=524288stride=294912precision=8geometry=4Nc=3,vol=524288stride=294912precision=2geometry=4Nc=3,ghost	416	1	1	79	1	8	0	-1	-1	-1	-1	1.9793e-05	# 0.00 Gflop/s, 726.37 GB/s, tuning took 0.056245 seconds at Sat Sep 23 13:51:49 2023
  bytes=10223616	cudaMemset	allocateGhostBuffer,lattice_field.cpp,288	32	1	1	1	1	1	0	-1	-1	-1	-1	1.49674e-05	# 0.00 Gflop/s, 683.06 GB/s, tuning took 0.001328 seconds at Sat Sep 23 13:44:09 2023
  bytes=10223616	cudaMemset	allocateGhostBuffer,lattice_field.cpp,293	32	1	1	1	1	1	0	-1	-1	-1	-1	1.49708e-05	# 0.00 Gflop/s, 682.90 GB/s, tuning took 0.001029 seconds at Sat Sep 23 13:44:09 2023
bytes=1207959552	cudaMemcpyDefault	copy,cuda_gauge_field.cpp,576	32	1	1	1	1	1	0	-1	-1	-1	-1	0.00310474	# 0.00 Gflop/s, 389.07 GB/s, tuning took 0.022089 seconds at Sun Sep 24 15:22:23 2023
bytes=1207959552	cudaMemcpyDefault	saveCPUField,cuda_gauge_field.cpp,658	32	1	1	1	1	1	0	-1	-1	-1	-1	0.00310615	# 0.00 Gflop/s, 388.89 GB/s, tuning took 0.032432 seconds at Sun Sep 24 15:24:03 2023
  bytes=12582912	cudaMemcpyDeviceToDevice	exchangeGhost,cuda_gauge_field.cpp,193	32	1	1	1	1	1	0	-1	-1	-1	-1	3.7728e-05	# 0.00 Gflop/s, 667.03 GB/s, tuning took 0.001224 seconds at Sun Sep 24 15:22:41 2023
  bytes=12582912	cudaMemset	allocateGhostBuffer,lattice_field.cpp,288	32	1	1	1	1	1	0	-1	-1	-1	-1	1.84095e-05	# 0.00 Gflop/s, 683.50 GB/s, tuning took 0.001615 seconds at Sun Sep  3 23:03:25 2023
  bytes=12582912	cudaMemset	allocateGhostBuffer,lattice_field.cpp,293	32	1	1	1	1	1	0	-1	-1	-1	-1	1.83483e-05	# 0.00 Gflop/s, 685.78 GB/s, tuning took 0.001126 seconds at Sun Sep  3 23:03:25 2023
  bytes=14155776	cudaMemset	allocateGhostBuffer,lattice_field.cpp,288	32	1	1	1	1	1	0	-1	-1	-1	-1	1.9887e-05	# 0.00 Gflop/s, 711.81 GB/s, tuning took 0.001916 seconds at Sat Sep 23 13:35:23 2023
  bytes=14155776	cudaMemset	allocateGhostBuffer,lattice_field.cpp,293	32	1	1	1	1	1	0	-1	-1	-1	-1	2.00313e-05	# 0.00 Gflop/s, 706.68 GB/s, tuning took 0.001081 seconds at Sat Sep 23 13:35:23 2023
 bytes=150994944	cudaMemcpyDefault	copy,cuda_gauge_field.cpp,576	32	1	1	1	1	1	0	-1	-1	-1	-1	0.000392704	# 0.00 Gflop/s, 384.50 GB/s, tuning took 0.003124 seconds at Sun Sep  3 23:03:23 2023
 bytes=150994944	cudaMemcpyDefault	saveCPUField,cuda_gauge_field.cpp,658	32	1	1	1	1	1	0	-1	-1	-1	-1	0.000393227	# 0.00 Gflop/s, 383.99 GB/s, tuning took 0.004108 seconds at Sun Sep  3 23:03:35 2023
   bytes=1572864	cudaMemcpyDeviceToDevice	exchangeGhost,cuda_gauge_field.cpp,193	32	1	1	1	1	1	0	-1	-1	-1	-1	3.43308e-06	# 0.00 Gflop/s, 916.30 GB/s, tuning took 0.000564 seconds at Sun Sep 17 02:00:09 2023
  bytes=18874368	cudaMemset	allocateGhostBuffer,lattice_field.cpp,288	32	1	1	1	1	1	0	-1	-1	-1	-1	2.54796e-05	# 0.00 Gflop/s, 740.76 GB/s, tuning took 0.001136 seconds at Sun Sep  3 23:03:37 2023
  bytes=18874368	cudaMemset	allocateGhostBuffer,lattice_field.cpp,293	32	1	1	1	1	1	0	-1	-1	-1	-1	2.56126e-05	# 0.00 Gflop/s, 736.92 GB/s, tuning took 0.001117 seconds at Sun Sep  3 23:03:37 2023
  bytes=22020096	cudaMemset	allocateGhostBuffer,lattice_field.cpp,288	32	1	1	1	1	1	0	-1	-1	-1	-1	2.90579e-05	# 0.00 Gflop/s, 757.80 GB/s, tuning took 0.002929 seconds at Mon Aug 28 16:47:12 2023
  bytes=22020096	cudaMemset	allocateGhostBuffer,lattice_field.cpp,293	32	1	1	1	1	1	0	-1	-1	-1	-1	2.90776e-05	# 0.00 Gflop/s, 757.29 GB/s, tuning took 0.001149 seconds at Mon Aug 28 16:47:12 2023
 bytes=301989888	cudaMemcpyDefault	copy,cuda_gauge_field.cpp,576	32	1	1	1	1	1	0	-1	-1	-1	-1	0.000779104	# 0.00 Gflop/s, 387.61 GB/s, tuning took 0.005859 seconds at Mon Aug 28 16:47:08 2023
 bytes=301989888	cudaMemcpyDefault	saveCPUField,cuda_gauge_field.cpp,658	32	1	1	1	1	1	0	-1	-1	-1	-1	0.000779616	# 0.00 Gflop/s, 387.36 GB/s, tuning took 0.008110 seconds at Mon Aug 28 16:47:33 2023
   bytes=3145728	cudaMemcpyDeviceToDevice	exchangeGhost,cuda_gauge_field.cpp,193	32	1	1	1	1	1	0	-1	-1	-1	-1	5.93945e-06	# 0.00 Gflop/s, 1059.27 GB/s, tuning took 0.000887 seconds at Mon Aug 28 16:47:12 2023
  bytes=33030144	cudaMemset	allocateGhostBuffer,lattice_field.cpp,288	32	1	1	1	1	1	0	-1	-1	-1	-1	4.22307e-05	# 0.00 Gflop/s, 782.14 GB/s, tuning took 0.001243 seconds at Tue Aug 29 01:50:37 2023
  bytes=33030144	cudaMemset	allocateGhostBuffer,lattice_field.cpp,293	32	1	1	1	1	1	0	-1	-1	-1	-1	4.2108e-05	# 0.00 Gflop/s, 784.41 GB/s, tuning took 0.001225 seconds at Tue Aug 29 01:50:37 2023
   bytes=4718592	cudaMemcpyDeviceToDevice	exchangeGhost,cuda_gauge_field.cpp,193	32	1	1	1	1	1	0	-1	-1	-1	-1	1.73257e-05	# 0.00 Gflop/s, 544.69 GB/s, tuning took 0.001157 seconds at Tue Aug 29 01:50:37 2023
 bytes=603979776	cudaMemcpyDefault	copy,cuda_gauge_field.cpp,576	32	1	1	1	1	1	0	-1	-1	-1	-1	0.0015545	# 0.00 Gflop/s, 388.54 GB/s, tuning took 0.011255 seconds at Sun Sep 24 15:35:33 2023
 bytes=603979776	cudaMemcpyDefault	saveCPUField,cuda_gauge_field.cpp,658	32	1	1	1	1	1	0	-1	-1	-1	-1	0.00155363	# 0.00 Gflop/s, 388.75 GB/s, tuning took 0.016171 seconds at Sun Sep 24 15:36:24 2023
   bytes=6291456	cudaMemcpyDeviceToDevice	exchangeGhost,cuda_gauge_field.cpp,193	32	1	1	1	1	1	0	-1	-1	-1	-1	2.12557e-05	# 0.00 Gflop/s, 591.98 GB/s, tuning took 0.001118 seconds at Mon Aug 28 16:47:12 2023
  bytes=63700992	cudaMemset	allocateGhostBuffer,lattice_field.cpp,288	32	1	1	1	1	1	0	-1	-1	-1	-1	7.65394e-05	# 0.00 Gflop/s, 832.26 GB/s, tuning took 0.005754 seconds at Sun Sep 24 15:35:42 2023
  bytes=63700992	cudaMemset	allocateGhostBuffer,lattice_field.cpp,293	32	1	1	1	1	1	0	-1	-1	-1	-1	7.63017e-05	# 0.00 Gflop/s, 834.86 GB/s, tuning took 0.001415 seconds at Sun Sep 24 15:35:42 2023
  bytes=69206016	cudaMemset	allocateGhostBuffer,lattice_field.cpp,288	32	1	1	1	1	1	0	-1	-1	-1	-1	8.3104e-05	# 0.00 Gflop/s, 832.76 GB/s, tuning took 0.010710 seconds at Sun Sep 24 15:22:40 2023
  bytes=69206016	cudaMemset	allocateGhostBuffer,lattice_field.cpp,293	32	1	1	1	1	1	0	-1	-1	-1	-1	8.31227e-05	# 0.00 Gflop/s, 832.58 GB/s, tuning took 0.001370 seconds at Sun Sep 24 15:22:40 2023
  bytes=75497472	cudaMemcpyDefault	copy,cuda_gauge_field.cpp,576	32	1	1	1	1	1	0	-1	-1	-1	-1	0.000200832	# 0.00 Gflop/s, 375.92 GB/s, tuning took 0.002171 seconds at Sun Sep 17 02:00:08 2023
  bytes=75497472	cudaMemcpyDefault	saveCPUField,cuda_gauge_field.cpp,658	32	1	1	1	1	1	0	-1	-1	-1	-1	0.000200806	# 0.00 Gflop/s, 375.97 GB/s, tuning took 0.002498 seconds at Sun Sep 17 02:00:14 2023
    bytes=786432	cudaMemcpyDeviceToDevice	exchangeGhost,cuda_gauge_field.cpp,193	32	1	1	1	1	1	0	-1	-1	-1	-1	3.42354e-06	# 0.00 Gflop/s, 459.43 GB/s, tuning took 0.000775 seconds at Sun Sep 17 02:00:09 2023
   bytes=7864320	cudaMemset	allocateGhostBuffer,lattice_field.cpp,288	32	1	1	1	1	1	0	-1	-1	-1	-1	1.2878e-05	# 0.00 Gflop/s, 610.68 GB/s, tuning took 0.001305 seconds at Mon Sep 18 18:43:06 2023
   bytes=7864320	cudaMemset	allocateGhostBuffer,lattice_field.cpp,293	32	1	1	1	1	1	0	-1	-1	-1	-1	1.29196e-05	# 0.00 Gflop/s, 608.71 GB/s, tuning took 0.001072 seconds at Mon Sep 18 18:43:06 2023
   bytes=8650752	cudaMemset	allocateGhostBuffer,lattice_field.cpp,288	32	1	1	1	1	1	0	-1	-1	-1	-1	1.35412e-05	# 0.00 Gflop/s, 638.85 GB/s, tuning took 0.001325 seconds at Sun Sep 17 02:00:09 2023
   bytes=8650752	cudaMemset	allocateGhostBuffer,lattice_field.cpp,293	32	1	1	1	1	1	0	-1	-1	-1	-1	1.34491e-05	# 0.00 Gflop/s, 643.22 GB/s, tuning took 0.000996 seconds at Sun Sep 17 02:00:09 2023
   bytes=9437184	cudaMemcpyDeviceToDevice	exchangeGhost,cuda_gauge_field.cpp,193	32	1	1	1	1	1	0	-1	-1	-1	-1	2.95884e-05	# 0.00 Gflop/s, 637.90 GB/s, tuning took 0.001156 seconds at Tue Aug 29 01:50:37 2023
