test/.cache/tunecache.tsv
tunecache	1.1.0	1.1.0--sm_60	cpu_arch=x86_64,gpu_arch=sm_60,cuda_version=12.4.131	# Last updated Wed Jul 31 01:12:07 2024

          volume	name	aux	block.x	block.y	block.z	grid.x	grid.y	grid.z	shared_bytes	aux.x	aux.y	aux.z	aux.w	time	comment
     16x32x32x64	N4quda10GaugeGaussIdLi3EL21QudaReconstructType_s12EEE	GPU-offline,vol=1048576stride=557056precision=8geometry=4Nc=3,lie_group	384	1	1	1366	2	1	16385	-1	-1	-1	-1	0.00429135	# 0.00 Gflop/s, 99.69 GB/s, tuning took 6.290176 seconds at Wed Jul 31 01:11:36 2024
     16x32x32x64	N4quda12ExtractGhostIdLi3ENS_5gauge11FloatNOrderIdLi18ELi2ELi12EL20QudaStaggeredPhase_s0ELb1EL19QudaGhostExchange_sn2147483648ELb0EEEEE	GPU-offline,vol=1048576stride=557056precision=8geometry=4Nc=3,extract	32	1	4	2048	1	2	16385	-1	-1	-1	-1	7.93748e-05	# 0.00 Gflop/s, 356.68 GB/s, tuning took 0.748196 seconds at Wed Jul 31 01:11:14 2024
     16x32x32x64	N4quda7RNGInitE	GPU-offline,vol=1048576stride=557056precision=8geometry=4Nc=3	224	2	1	2341	1	1	0	-1	-1	-1	-1	0.0349191	# 0.00 Gflop/s, 0.00 GB/s, tuning took 6.652122 seconds at Wed Jul 31 01:11:30 2024
     16x32x32x64	N4quda9CopyGaugeINS_12CopyGaugeArgIddLi18ELb0ENS_5gauge11FloatNOrderIdLi18ELi2ELi12EL20QudaStaggeredPhase_s0ELb1EL19QudaGhostExchange_sn2147483648ELb0EEENS2_8QDPOrderIdLi18EEEEEEE	GPU-offline,vol=1048576stride=524288precision=8geometry=4Nc=3,vol=1048576stride=557056precision=8geometry=4Nc=3	32	1	1	16384	1	8	4097	-1	-1	-1	-1	0.00184615	# 0.00 Gflop/s, 558.89 GB/s, tuning took 6.185480 seconds at Wed Jul 31 01:11:13 2024
     16x32x32x64	N4quda9CopyGaugeINS_12CopyGaugeArgIddLi18ELb0ENS_5gauge11FloatNOrderIdLi18ELi2ELi12EL20QudaStaggeredPhase_s0ELb1EL19QudaGhostExchange_sn2147483648ELb0EEES6_EEEE	GPU-offline,vol=1048576stride=557056precision=8geometry=4Nc=3,vol=1048576stride=557056precision=8geometry=4Nc=3,ghost	32	1	1	1024	1	8	2235	-1	-1	-1	-1	5.80373e-05	# 0.00 Gflop/s, 518.30 GB/s, tuning took 0.505942 seconds at Wed Jul 31 01:11:15 2024
     16x32x32x64	N4quda9CopyGaugeINS_12CopyGaugeArgIddLi18ELb0ENS_5gauge8QDPOrderIdLi18EEENS2_11FloatNOrderIdLi18ELi2ELi12EL20QudaStaggeredPhase_s0ELb1EL19QudaGhostExchange_sn2147483648ELb0EEEEEEE	GPU-offline,vol=1048576stride=557056precision=8geometry=4Nc=3,vol=1048576stride=524288precision=8geometry=4Nc=3	864	1	1	607	1	8	24577	-1	-1	-1	-1	0.00195299	# 0.00 Gflop/s, 528.32 GB/s, tuning took 6.361949 seconds at Wed Jul 31 01:11:43 2024
     16x32x32x64	N4quda9CopyGaugeINS_12CopyGaugeArgIfdLi18ELb0ENS_5gauge11FloatNOrderIfLi18ELi4ELi12EL20QudaStaggeredPhase_s0ELb1EL19QudaGhostExchange_sn2147483648ELb0EEENS3_IdLi18ELi2ELi12ELS4_0ELb1ELS5_n2147483648ELb0EEEEEEE	GPU-offline,vol=1048576stride=557056precision=8geometry=4Nc=3,vol=1048576stride=557056precision=4geometry=4Nc=3	96	1	1	5462	1	8	4916	-1	-1	-1	-1	0.00109462	# 0.00 Gflop/s, 586.25 GB/s, tuning took 3.970278 seconds at Wed Jul 31 01:11:23 2024
     16x32x32x64	N4quda9CopyGaugeINS_12CopyGaugeArgIfdLi18ELb0ENS_5gauge11FloatNOrderIfLi18ELi4ELi12EL20QudaStaggeredPhase_s0ELb1EL19QudaGhostExchange_sn2147483648ELb0EEENS3_IdLi18ELi2ELi12ELS4_0ELb1ELS5_n2147483648ELb0EEEEEEE	GPU-offline,vol=1048576stride=557056precision=8geometry=4Nc=3,vol=1048576stride=557056precision=4geometry=4Nc=3,ghost	32	1	1	1024	1	8	2235	-1	-1	-1	-1	4.362e-05	# 0.00 Gflop/s, 517.21 GB/s, tuning took 0.622247 seconds at Wed Jul 31 01:11:23 2024
     16x32x32x64	N4quda9CopyGaugeINS_12CopyGaugeArgIsdLi18ELb0ENS_5gauge11FloatNOrderIsLi18ELi4ELi12EL20QudaStaggeredPhase_s0ELb1EL19QudaGhostExchange_sn2147483648ELb0EEENS3_IdLi18ELi2ELi12ELS4_0ELb1ELS5_n2147483648ELb0EEEEEEE	GPU-offline,vol=1048576stride=557056precision=8geometry=4Nc=3,vol=1048576stride=557056precision=2geometry=4Nc=3	608	1	1	863	1	8	24577	-1	-1	-1	-1	0.000915563	# 0.00 Gflop/s, 584.09 GB/s, tuning took 3.681485 seconds at Wed Jul 31 01:11:18 2024
     16x32x32x64	N4quda9CopyGaugeINS_12CopyGaugeArgIsdLi18ELb0ENS_5gauge11FloatNOrderIsLi18ELi4ELi12EL20QudaStaggeredPhase_s0ELb1EL19QudaGhostExchange_sn2147483648ELb0EEENS3_IdLi18ELi2ELi12ELS4_0ELb1ELS5_n2147483648ELb0EEEEEEE	GPU-offline,vol=1048576stride=557056precision=8geometry=4Nc=3,vol=1048576stride=557056precision=2geometry=4Nc=3,ghost	64	1	1	512	1	8	4469	-1	-1	-1	-1	3.84972e-05	# 0.00 Gflop/s, 488.36 GB/s, tuning took 0.392102 seconds at Wed Jul 31 01:11:19 2024
  bytes=14155776	cudaMemset	allocateGhostBuffer,lattice_field.cpp,288	32	1	1	1	1	1	0	-1	-1	-1	-1	3.1912e-05	# 0.00 Gflop/s, 443.59 GB/s, tuning took 0.004852 seconds at Wed Jul 31 01:11:13 2024
  bytes=14155776	cudaMemset	allocateGhostBuffer,lattice_field.cpp,293	32	1	1	1	1	1	0	-1	-1	-1	-1	3.127e-05	# 0.00 Gflop/s, 452.70 GB/s, tuning took 0.002859 seconds at Wed Jul 31 01:11:13 2024
 bytes=150994944	cudaMemcpyDefault	copy,cuda_gauge_field.cpp,576	32	1	1	1	1	1	0	-1	-1	-1	-1	0.000585845	# 0.00 Gflop/s, 257.74 GB/s, tuning took 0.007621 seconds at Wed Jul 31 01:11:07 2024
 bytes=150994944	cudaMemcpyDefault	saveCPUField,cuda_gauge_field.cpp,658	32	1	1	1	1	1	0	-1	-1	-1	-1	0.000584992	# 0.00 Gflop/s, 258.11 GB/s, tuning took 0.007335 seconds at Wed Jul 31 01:11:43 2024
   bytes=1572864	cudaMemcpyDeviceToDevice	exchangeGhost,cuda_gauge_field.cpp,193	32	1	1	1	1	1	0	-1	-1	-1	-1	7.04574e-06	# 0.00 Gflop/s, 446.47 GB/s, tuning took 0.002041 seconds at Wed Jul 31 01:11:14 2024
   bytes=3145728	cudaMemcpyDeviceToDevice	exchangeGhost,cuda_gauge_field.cpp,193	32	1	1	1	1	1	0	-1	-1	-1	-1	1.78154e-05	# 0.00 Gflop/s, 353.15 GB/s, tuning took 0.165309 seconds at Wed Jul 31 01:11:14 2024
