test/.cache/tunecache.tsv
tunecache	1.1.0	1.1.0--sm_70	cpu_arch=x86_64,gpu_arch=sm_70,cuda_version=11.6.124	# Last updated Wed Mar 20 22:33:06 2024

          volume	name	aux	block.x	block.y	block.z	grid.x	grid.y	grid.z	shared_bytes	aux.x	aux.y	aux.z	aux.w	time	comment
     10x32x32x64	N4quda10GaugeGaussIdLi3EL21QudaReconstructType_s12EEE	GPU-offline,vol=655360stride=360448precision=8geometry=4Nc=3,lie_group	192	2	1	1707	1	1	0	-1	-1	-1	-1	0.00149402	# 0.00 Gflop/s, 185.29 GB/s, tuning took 1.949027 seconds at Thu Mar 14 15:52:10 2024
     10x32x32x64	N4quda12ExtractGhostIdLi3ENS_5gauge11FloatNOrderIdLi18ELi2ELi12EL20QudaStaggeredPhase_s0ELb1EL19QudaGhostExchange_sn2147483648ELb0EEEEE	GPU-offline,vol=655360stride=360448precision=8geometry=4Nc=3,extract	32	1	7	2048	1	2	0	-1	-1	-1	-1	5.9968e-05	# 0.00 Gflop/s, 373.75 GB/s, tuning took 0.128082 seconds at Thu Mar 14 15:52:05 2024
     10x32x32x64	N4quda7RNGInitE	GPU-offline,vol=655360stride=360448precision=8geometry=4Nc=3	320	2	1	1024	1	1	0	-1	-1	-1	-1	0.0104434	# 0.00 Gflop/s, 0.00 GB/s, tuning took 1.527683 seconds at Thu Mar 14 15:52:08 2024
     10x32x32x64	N4quda9CopyGaugeINS_12CopyGaugeArgIddLi18ELb0ENS_5gauge11FloatNOrderIdLi18ELi2ELi12EL20QudaStaggeredPhase_s0ELb1EL19QudaGhostExchange_sn2147483648ELb0EEENS2_8QDPOrderIdLi18EEEEEEE	GPU-offline,cmem,vol=655360stride=327680precision=8geometry=4Nc=3,vol=655360stride=360448precision=8geometry=4Nc=3	256	1	2	1280	1	4	16385	-1	-1	-1	-1	0.000764779	# 0.00 Gflop/s, 855.56 GB/s, tuning took 1.266579 seconds at Thu Mar 14 15:52:05 2024
     10x32x32x64	N4quda9CopyGaugeINS_12CopyGaugeArgIddLi18ELb0ENS_5gauge11FloatNOrderIdLi18ELi2ELi12EL20QudaStaggeredPhase_s0ELb1EL19QudaGhostExchange_sn2147483648ELb0EEES6_EEEE	GPU-offline,cmem,vol=655360stride=360448precision=8geometry=4Nc=3,vol=655360stride=360448precision=8geometry=4Nc=3,ghost	768	1	1	43	1	8	0	-1	-1	-1	-1	3.134e-05	# 0.00 Gflop/s, 786.68 GB/s, tuning took 0.073567 seconds at Thu Mar 14 15:52:05 2024
     10x32x32x64	N4quda9CopyGaugeINS_12CopyGaugeArgIddLi18ELb0ENS_5gauge8QDPOrderIdLi18EEENS2_11FloatNOrderIdLi18ELi2ELi12EL20QudaStaggeredPhase_s0ELb1EL19QudaGhostExchange_sn2147483648ELb0EEEEEEE	GPU-offline,cmem,vol=655360stride=360448precision=8geometry=4Nc=3,vol=655360stride=327680precision=8geometry=4Nc=3	96	1	1	3414	1	8	2458	-1	-1	-1	-1	0.000802379	# 0.00 Gflop/s, 815.46 GB/s, tuning took 1.336817 seconds at Thu Mar 14 15:52:11 2024
     10x32x32x64	N4quda9CopyGaugeINS_12CopyGaugeArgIfdLi18ELb0ENS_5gauge11FloatNOrderIfLi18ELi4ELi12EL20QudaStaggeredPhase_s0ELb1EL19QudaGhostExchange_sn2147483648ELb0EEENS3_IdLi18ELi2ELi12ELS4_0ELb1ELS5_n2147483648ELb0EEEEEEE	GPU-offline,cmem,vol=655360stride=360448precision=8geometry=4Nc=3,vol=655360stride=360448precision=4geometry=4Nc=3	32	1	5	10240	1	2	0	-1	-1	-1	-1	0.000462667	# 0.00 Gflop/s, 897.48 GB/s, tuning took 0.802666 seconds at Thu Mar 14 15:52:06 2024
     10x32x32x64	N4quda9CopyGaugeINS_12CopyGaugeArgIfdLi18ELb0ENS_5gauge11FloatNOrderIfLi18ELi4ELi12EL20QudaStaggeredPhase_s0ELb1EL19QudaGhostExchange_sn2147483648ELb0EEENS3_IdLi18ELi2ELi12ELS4_0ELb1ELS5_n2147483648ELb0EEEEEEE	GPU-offline,cmem,vol=655360stride=360448precision=8geometry=4Nc=3,vol=655360stride=360448precision=4geometry=4Nc=3,ghost	64	1	3	512	1	3	0	-1	-1	-1	-1	2.49328e-05	# 0.00 Gflop/s, 741.63 GB/s, tuning took 0.064566 seconds at Thu Mar 14 15:52:07 2024
     10x32x32x64	N4quda9CopyGaugeINS_12CopyGaugeArgIsdLi18ELb0ENS_5gauge11FloatNOrderIsLi18ELi4ELi12EL20QudaStaggeredPhase_s0ELb1EL19QudaGhostExchange_sn2147483648ELb0EEENS3_IdLi18ELi2ELi12ELS4_0ELb1ELS5_n2147483648ELb0EEEEEEE	GPU-offline,cmem,vol=655360stride=360448precision=8geometry=4Nc=3,vol=655360stride=360448precision=2geometry=4Nc=3	32	1	3	10240	1	3	0	-1	-1	-1	-1	0.000410133	# 0.00 Gflop/s, 843.70 GB/s, tuning took 0.716949 seconds at Thu Mar 14 15:52:06 2024
     10x32x32x64	N4quda9CopyGaugeINS_12CopyGaugeArgIsdLi18ELb0ENS_5gauge11FloatNOrderIsLi18ELi4ELi12EL20QudaStaggeredPhase_s0ELb1EL19QudaGhostExchange_sn2147483648ELb0EEENS3_IdLi18ELi2ELi12ELS4_0ELb1ELS5_n2147483648ELb0EEEEEEE	GPU-offline,cmem,vol=655360stride=360448precision=8geometry=4Nc=3,vol=655360stride=360448precision=2geometry=4Nc=3,ghost	64	1	3	512	1	3	0	-1	-1	-1	-1	2.24387e-05	# 0.00 Gflop/s, 686.72 GB/s, tuning took 0.060296 seconds at Thu Mar 14 15:52:06 2024
     16x16x16x32	N4quda10GaugeGaussIdLi3EL21QudaReconstructType_s12EEE	GPU-offline,vol=131072stride=69632precision=8geometry=4Nc=3,lie_group	64	2	1	1024	1	1	0	-1	-1	-1	-1	0.000334645	# 0.00 Gflop/s, 159.80 GB/s, tuning took 0.423313 seconds at Thu Mar 14 13:16:14 2024
     16x16x16x32	N4quda12ExtractGhostIdLi3ENS_5gauge11FloatNOrderIdLi18ELi2ELi12EL20QudaStaggeredPhase_s0ELb1EL19QudaGhostExchange_sn2147483648ELb0EEEEE	GPU-offline,vol=131072stride=69632precision=8geometry=4Nc=3,extract	32	1	4	256	1	2	0	-1	-1	-1	-1	1.2211e-05	# 0.00 Gflop/s, 450.82 GB/s, tuning took 0.040947 seconds at Thu Mar 14 13:16:13 2024
     16x16x16x32	N4quda7RNGInitE	GPU-offline,vol=131072stride=69632precision=8geometry=4Nc=3	320	2	1	205	1	1	0	-1	-1	-1	-1	0.00195585	# 0.00 Gflop/s, 0.00 GB/s, tuning took 0.272469 seconds at Thu Mar 14 13:16:14 2024
     16x16x16x32	N4quda9CopyGaugeINS_12CopyGaugeArgIddLi18ELb0ENS_5gauge11FloatNOrderIdLi18ELi2ELi12EL20QudaStaggeredPhase_s0ELb1EL19QudaGhostExchange_sn2147483648ELb0EEENS2_8QDPOrderIdLi18EEEEEEE	GPU-offline,cmem,vol=131072stride=65536precision=8geometry=4Nc=3,vol=131072stride=69632precision=8geometry=4Nc=3	96	1	1	683	1	8	2458	-1	-1	-1	-1	0.000154249	# 0.00 Gflop/s, 836.15 GB/s, tuning took 0.286582 seconds at Thu Mar 14 13:16:13 2024
     16x16x16x32	N4quda9CopyGaugeINS_12CopyGaugeArgIddLi18ELb0ENS_5gauge11FloatNOrderIdLi18ELi2ELi12EL20QudaStaggeredPhase_s0ELb1EL19QudaGhostExchange_sn2147483648ELb0EEES6_EEEE	GPU-offline,cmem,vol=131072stride=69632precision=8geometry=4Nc=3,vol=131072stride=69632precision=8geometry=4Nc=3,ghost	128	1	1	32	1	8	0	-1	-1	-1	-1	4.56717e-06	# 0.00 Gflop/s, 1280.68 GB/s, tuning took 0.026789 seconds at Thu Mar 14 13:16:13 2024
     16x16x16x32	N4quda9CopyGaugeINS_12CopyGaugeArgIddLi18ELb0ENS_5gauge8QDPOrderIdLi18EEENS2_11FloatNOrderIdLi18ELi2ELi12EL20QudaStaggeredPhase_s0ELb1EL19QudaGhostExchange_sn2147483648ELb0EEEEEEE	GPU-offline,cmem,vol=131072stride=69632precision=8geometry=4Nc=3,vol=131072stride=65536precision=8geometry=4Nc=3	96	1	1	683	1	8	2341	-1	-1	-1	-1	0.000160283	# 0.00 Gflop/s, 804.67 GB/s, tuning took 0.287121 seconds at Thu Mar 14 13:16:14 2024
     16x16x16x32	N4quda9CopyGaugeINS_12CopyGaugeArgIfdLi18ELb0ENS_5gauge11FloatNOrderIfLi18ELi4ELi12EL20QudaStaggeredPhase_s0ELb1EL19QudaGhostExchange_sn2147483648ELb0EEENS3_IdLi18ELi2ELi12ELS4_0ELb1ELS5_n2147483648ELb0EEEEEEE	GPU-offline,cmem,vol=131072stride=69632precision=8geometry=4Nc=3,vol=131072stride=69632precision=4geometry=4Nc=3	32	1	1	2048	1	8	0	-1	-1	-1	-1	9.2608e-05	# 0.00 Gflop/s, 866.19 GB/s, tuning took 0.172059 seconds at Thu Mar 14 13:16:13 2024
     16x16x16x32	N4quda9CopyGaugeINS_12CopyGaugeArgIfdLi18ELb0ENS_5gauge11FloatNOrderIfLi18ELi4ELi12EL20QudaStaggeredPhase_s0ELb1EL19QudaGhostExchange_sn2147483648ELb0EEENS3_IdLi18ELi2ELi12ELS4_0ELb1ELS5_n2147483648ELb0EEEEEEE	GPU-offline,cmem,vol=131072stride=69632precision=8geometry=4Nc=3,vol=131072stride=69632precision=4geometry=4Nc=3,ghost	128	1	1	32	1	8	0	-1	-1	-1	-1	3.99098e-06	# 0.00 Gflop/s, 1099.18 GB/s, tuning took 0.025086 seconds at Thu Mar 14 13:16:13 2024
     16x16x16x32	N4quda9CopyGaugeINS_12CopyGaugeArgIsdLi18ELb0ENS_5gauge11FloatNOrderIsLi18ELi4ELi12EL20QudaStaggeredPhase_s0ELb1EL19QudaGhostExchange_sn2147483648ELb0EEENS3_IdLi18ELi2ELi12ELS4_0ELb1ELS5_n2147483648ELb0EEEEEEE	GPU-offline,cmem,vol=131072stride=69632precision=8geometry=4Nc=3,vol=131072stride=69632precision=2geometry=4Nc=3	672	1	1	98	1	8	0	-1	-1	-1	-1	8.1312e-05	# 0.00 Gflop/s, 822.10 GB/s, tuning took 0.155936 seconds at Thu Mar 14 13:16:13 2024
     16x16x16x32	N4quda9CopyGaugeINS_12CopyGaugeArgIsdLi18ELb0ENS_5gauge11FloatNOrderIsLi18ELi4ELi12EL20QudaStaggeredPhase_s0ELb1EL19QudaGhostExchange_sn2147483648ELb0EEENS3_IdLi18ELi2ELi12ELS4_0ELb1ELS5_n2147483648ELb0EEEEEEE	GPU-offline,cmem,vol=131072stride=69632precision=8geometry=4Nc=3,vol=131072stride=69632precision=2geometry=4Nc=3,ghost	128	1	1	32	1	8	0	-1	-1	-1	-1	3.83861e-06	# 0.00 Gflop/s, 952.35 GB/s, tuning took 0.024181 seconds at Thu Mar 14 13:16:13 2024
     16x32x32x32	N4quda10GaugeGaussIdLi3EL21QudaReconstructType_s12EEE	GPU-offline,vol=524288stride=278528precision=8geometry=4Nc=3,lie_group	384	1	1	683	2	1	0	-1	-1	-1	-1	0.0011933	# 0.00 Gflop/s, 179.26 GB/s, tuning took 1.554683 seconds at Thu Mar 14 15:03:32 2024
     16x32x32x32	N4quda12ExtractGhostIdLi3ENS_5gauge11FloatNOrderIdLi18ELi2ELi12EL20QudaStaggeredPhase_s0ELb1EL19QudaGhostExchange_sn2147483648ELb0EEEEE	GPU-offline,vol=524288stride=278528precision=8geometry=4Nc=3,extract	480	1	1	69	1	8	0	-1	-1	-1	-1	3.65349e-05	# 0.00 Gflop/s, 430.51 GB/s, tuning took 0.083783 seconds at Thu Mar 14 15:03:28 2024
     16x32x32x32	N4quda15CopyColorSpinorILi4ELi3ENS_11colorspinor11FloatNOrderIdLi4ELi3ELi2ELb0ELb0EEENS1_21SpaceSpinorColorOrderIdLi4ELi3EEESt5tupleIJRNS_16ColorSpinorFieldERKS7_19QudaFieldLocation_sPdPKdEEEE	GPU-offline,cmem,vol=524288,parity=1,precision=8,order=9,Ns=4,Nc=3vol=524288,parity=1,precision=8,order=2,Ns=4,Nc=3,NonRelBasis	896	1	1	586	1	1	0	-1	-1	-1	-1	0.000274352	# 0.00 Gflop/s, 733.83 GB/s, tuning took 0.038078 seconds at Thu Mar 14 15:43:46 2024
     16x32x32x32	N4quda15CopyColorSpinorILi4ELi3ENS_11colorspinor21SpaceSpinorColorOrderIdLi4ELi3EEENS1_11FloatNOrderIdLi4ELi3ELi2ELb0ELb0EEESt5tupleIJRNS_16ColorSpinorFieldERKS7_19QudaFieldLocation_sPdPKdEEEE	GPU-offline,cmem,vol=524288,parity=1,precision=8,order=2,Ns=4,Nc=3vol=524288,parity=1,precision=8,order=9,Ns=4,Nc=3,RelBasis	640	1	1	820	1	1	0	-1	-1	-1	-1	0.00026176	# 0.00 Gflop/s, 769.13 GB/s, tuning took 0.034711 seconds at Thu Mar 14 15:43:48 2024
     16x32x32x32	N4quda26WilsonCloverPreconditionedINS_15WilsonCloverArgIdLi3ELi4EL21QudaReconstructType_s12EEEEE	policy,GPU-offline,vol=524288,parity=1,precision=8,order=2,Ns=4,Nc=3,commDim=0000,topo=1111,p2p=0,gdr=0,nvshmem=0,pol=110000111100110000	32	1	1	1	1	1	0	1	0	0	-1	0.00154449	# 619.17 Gflop/s, 977.64 GB/s, tuning took 0.087282 seconds at Thu Mar 14 15:43:48 2024
     16x32x32x32	N4quda26WilsonCloverPreconditionedINS_15WilsonCloverArgIdLi3ELi4EL21QudaReconstructType_s12EEEEE	policy_kernel=interior,GPU-offline,vol=524288,parity=1,precision=8,order=2,Ns=4,Nc=3,commDim=0000,comm=0000	160	1	1	3277	1	1	49153	-1	-1	-1	-1	0.00155004	# 616.95 Gflop/s, 974.14 GB/s, tuning took 1.823463 seconds at Thu Mar 14 15:43:48 2024
     16x32x32x32	N4quda7RNGInitE	GPU-offline,vol=524288stride=278528precision=8geometry=4Nc=3	320	2	1	820	1	1	0	-1	-1	-1	-1	0.00744107	# 0.00 Gflop/s, 0.00 GB/s, tuning took 1.092893 seconds at Thu Mar 14 15:03:30 2024
     16x32x32x32	N4quda9CopyGaugeINS_12CopyGaugeArgIddLi18ELb0ENS_5gauge11FloatNOrderIdLi18ELi2ELi12EL20QudaStaggeredPhase_s0ELb1EL19QudaGhostExchange_sn2147483648ELb0EEENS2_8QDPOrderIdLi18EEEEEEE	GPU-offline,cmem,vol=524288stride=262144precision=8geometry=4Nc=3,vol=524288stride=278528precision=8geometry=4Nc=3	64	1	1	4096	1	8	0	-1	-1	-1	-1	0.000616448	# 0.00 Gflop/s, 836.89 GB/s, tuning took 1.021614 seconds at Thu Mar 14 15:03:28 2024
     16x32x32x32	N4quda9CopyGaugeINS_12CopyGaugeArgIddLi18ELb0ENS_5gauge11FloatNOrderIdLi18ELi2ELi12EL20QudaStaggeredPhase_s0ELb1EL19QudaGhostExchange_sn2147483648ELb0EEES6_EEEE	GPU-offline,cmem,vol=524288stride=278528precision=8geometry=4Nc=3,vol=524288stride=278528precision=8geometry=4Nc=3,ghost	1024	1	1	16	1	8	24577	-1	-1	-1	-1	2.16633e-05	# 0.00 Gflop/s, 771.43 GB/s, tuning took 0.055110 seconds at Thu Mar 14 15:03:28 2024
     16x32x32x32	N4quda9CopyGaugeINS_12CopyGaugeArgIddLi18ELb0ENS_5gauge8QDPOrderIdLi18EEENS2_11FloatNOrderIdLi18ELi2ELi12EL20QudaStaggeredPhase_s0ELb1EL19QudaGhostExchange_sn2147483648ELb0EEEEEEE	GPU-offline,cmem,vol=524288stride=278528precision=8geometry=4Nc=3,vol=524288stride=262144precision=8geometry=4Nc=3	64	1	1	4096	1	8	1639	-1	-1	-1	-1	0.000647509	# 0.00 Gflop/s, 796.74 GB/s, tuning took 1.075283 seconds at Thu Mar 14 15:03:33 2024
     16x32x32x32	N4quda9CopyGaugeINS_12CopyGaugeArgIfdLi18ELb0ENS_5gauge11FloatNOrderIfLi18ELi4ELi12EL20QudaStaggeredPhase_s0ELb1EL19QudaGhostExchange_sn2147483648ELb0EEENS3_IdLi18ELi2ELi12ELS4_0ELb1ELS5_n2147483648ELb0EEEEEEE	GPU-offline,cmem,vol=524288stride=278528precision=8geometry=4Nc=3,vol=524288stride=278528precision=4geometry=4Nc=3	480	1	1	547	1	8	0	-1	-1	-1	-1	0.000372736	# 0.00 Gflop/s, 860.84 GB/s, tuning took 0.645771 seconds at Thu Mar 14 15:03:29 2024
     16x32x32x32	N4quda9CopyGaugeINS_12CopyGaugeArgIfdLi18ELb0ENS_5gauge11FloatNOrderIfLi18ELi4ELi12EL20QudaStaggeredPhase_s0ELb1EL19QudaGhostExchange_sn2147483648ELb0EEENS3_IdLi18ELi2ELi12ELS4_0ELb1ELS5_n2147483648ELb0EEEEEEE	GPU-offline,cmem,vol=524288stride=278528precision=8geometry=4Nc=3,vol=524288stride=278528precision=4geometry=4Nc=3,ghost	512	1	1	32	1	8	12289	-1	-1	-1	-1	1.8688e-05	# 0.00 Gflop/s, 670.68 GB/s, tuning took 0.049023 seconds at Thu Mar 14 15:03:29 2024
     16x32x32x32	N4quda9CopyGaugeINS_12CopyGaugeArgIsdLi18ELb0ENS_5gauge11FloatNOrderIsLi18ELi4ELi12EL20QudaStaggeredPhase_s0ELb1EL19QudaGhostExchange_sn2147483648ELb0EEENS3_IdLi18ELi2ELi12ELS4_0ELb1ELS5_n2147483648ELb0EEEEEEE	GPU-offline,cmem,vol=524288stride=278528precision=8geometry=4Nc=3,vol=524288stride=278528precision=2geometry=4Nc=3	32	1	4	8192	1	2	0	-1	-1	-1	-1	0.000330752	# 0.00 Gflop/s, 808.42 GB/s, tuning took 0.576986 seconds at Thu Mar 14 15:03:28 2024
     16x32x32x32	N4quda9CopyGaugeINS_12CopyGaugeArgIsdLi18ELb0ENS_5gauge11FloatNOrderIsLi18ELi4ELi12EL20QudaStaggeredPhase_s0ELb1EL19QudaGhostExchange_sn2147483648ELb0EEENS3_IdLi18ELi2ELi12ELS4_0ELb1ELS5_n2147483648ELb0EEEEEEE	GPU-offline,cmem,vol=524288stride=278528precision=8geometry=4Nc=3,vol=524288stride=278528precision=2geometry=4Nc=3,ghost	160	1	1	103	1	8	0	-1	-1	-1	-1	1.62781e-05	# 0.00 Gflop/s, 641.65 GB/s, tuning took 0.045460 seconds at Thu Mar 14 15:03:28 2024
     16x32x32x64	N4quda10GaugeGaussIdLi3EL21QudaReconstructType_s12EEE	GPU-offline,vol=1048576stride=557056precision=8geometry=4Nc=3,lie_group	384	1	1	1366	2	1	24577	-1	-1	-1	-1	0.00235602	# 0.00 Gflop/s, 181.59 GB/s, tuning took 3.114516 seconds at Thu Mar 14 15:46:44 2024
     16x32x32x64	N4quda12ExtractGhostIdLi3ENS_5gauge11FloatNOrderIdLi18ELi2ELi12EL20QudaStaggeredPhase_s0ELb1EL19QudaGhostExchange_sn2147483648ELb0EEEEE	GPU-offline,vol=1048576stride=557056precision=8geometry=4Nc=3,extract	64	1	3	1024	1	3	0	-1	-1	-1	-1	6.3956e-05	# 0.00 Gflop/s, 442.67 GB/s, tuning took 0.136171 seconds at Thu Mar 14 15:46:36 2024
     16x32x32x64	N4quda15CopyColorSpinorILi4ELi3ENS_11colorspinor11FloatNOrderIdLi4ELi3ELi2ELb0ELb0EEENS1_21SpaceSpinorColorOrderIdLi4ELi3EEESt5tupleIJRNS_16ColorSpinorFieldERKS7_19QudaFieldLocation_sPdPKdEEEE	GPU-offline,cmem,vol=1048576,parity=1,precision=8,order=9,Ns=4,Nc=3vol=1048576,parity=1,precision=8,order=2,Ns=4,Nc=3,NonRelBasis	832	1	1	1261	1	1	0	-1	-1	-1	-1	0.00053728	# 0.00 Gflop/s, 749.43 GB/s, tuning took 0.068211 seconds at Wed Mar 20 22:33:02 2024
     16x32x32x64	N4quda15CopyColorSpinorILi4ELi3ENS_11colorspinor21SpaceSpinorColorOrderIdLi4ELi3EEENS1_11FloatNOrderIdLi4ELi3ELi2ELb0ELb0EEESt5tupleIJRNS_16ColorSpinorFieldERKS7_19QudaFieldLocation_sPdPKdEEEE	GPU-offline,cmem,vol=1048576,parity=1,precision=8,order=2,Ns=4,Nc=3vol=1048576,parity=1,precision=8,order=9,Ns=4,Nc=3,RelBasis	416	1	1	2521	1	1	0	-1	-1	-1	-1	0.000514667	# 0.00 Gflop/s, 782.36 GB/s, tuning took 0.060770 seconds at Wed Mar 20 22:33:05 2024
     16x32x32x64	N4quda6WilsonINS_9WilsonArgIdLi3ELi4EL21QudaReconstructType_s12EEEEE	policy,GPU-offline,vol=1048576,parity=1,precision=8,order=2,Ns=4,Nc=3,commDim=0000,topo=1111,p2p=0,gdr=0,nvshmem=0,pol=110000111100110000	32	1	1	1	1	1	0	8	0	0	-1	0.00212661	# 650.86 Gflop/s, 1136.04 GB/s, tuning took 0.119831 seconds at Wed Mar 20 22:33:05 2024
     16x32x32x64	N4quda6WilsonINS_9WilsonArgIdLi3ELi4EL21QudaReconstructType_s12EEEEE	policy_kernel=interior,GPU-offline,vol=1048576,parity=1,precision=8,order=2,Ns=4,Nc=3,commDim=0000,comm=0000	128	1	1	8192	1	1	49153	-1	-1	-1	-1	0.00212909	# 650.10 Gflop/s, 1134.72 GB/s, tuning took 2.631317 seconds at Wed Mar 20 22:33:05 2024
     16x32x32x64	N4quda7RNGInitE	GPU-offline,vol=1048576stride=557056precision=8geometry=4Nc=3	320	2	1	1639	1	1	0	-1	-1	-1	-1	0.0151676	# 0.00 Gflop/s, 0.00 GB/s, tuning took 2.231231 seconds at Thu Mar 14 15:46:41 2024
     16x32x32x64	N4quda9CopyGaugeINS_12CopyGaugeArgIddLi18ELb0ENS_5gauge11FloatNOrderIdLi18ELi2ELi12EL20QudaStaggeredPhase_s0ELb1EL19QudaGhostExchange_sn2147483648ELb0EEENS2_8QDPOrderIdLi18EEEEEEE	GPU-offline,cmem,vol=1048576stride=524288precision=8geometry=4Nc=3,vol=1048576stride=557056precision=8geometry=4Nc=3	1024	1	1	512	1	8	24577	-1	-1	-1	-1	0.00122547	# 0.00 Gflop/s, 841.96 GB/s, tuning took 2.036262 seconds at Thu Mar 14 15:46:36 2024
     16x32x32x64	N4quda9CopyGaugeINS_12CopyGaugeArgIddLi18ELb0ENS_5gauge11FloatNOrderIdLi18ELi2ELi12EL20QudaStaggeredPhase_s0ELb1EL19QudaGhostExchange_sn2147483648ELb0EEES6_EEEE	GPU-offline,cmem,vol=1048576stride=557056precision=8geometry=4Nc=3,vol=1048576stride=557056precision=8geometry=4Nc=3,ghost	928	1	1	36	1	8	24577	-1	-1	-1	-1	3.90683e-05	# 0.00 Gflop/s, 769.96 GB/s, tuning took 0.085537 seconds at Thu Mar 14 15:46:36 2024
     16x32x32x64	N4quda9CopyGaugeINS_12CopyGaugeArgIddLi18ELb0ENS_5gauge8QDPOrderIdLi18EEENS2_11FloatNOrderIdLi18ELi2ELi12EL20QudaStaggeredPhase_s0ELb1EL19QudaGhostExchange_sn2147483648ELb0EEEEEEE	GPU-offline,cmem,vol=1048576stride=557056precision=8geometry=4Nc=3,vol=1048576stride=524288precision=8geometry=4Nc=3	64	1	1	8192	1	8	2458	-1	-1	-1	-1	0.0012982	# 0.00 Gflop/s, 794.79 GB/s, tuning took 2.151056 seconds at Thu Mar 14 15:46:47 2024
     16x32x32x64	N4quda9CopyGaugeINS_12CopyGaugeArgIfdLi18ELb0ENS_5gauge11FloatNOrderIfLi18ELi4ELi12EL20QudaStaggeredPhase_s0ELb1EL19QudaGhostExchange_sn2147483648ELb0EEENS3_IdLi18ELi2ELi12ELS4_0ELb1ELS5_n2147483648ELb0EEEEEEE	GPU-offline,cmem,vol=1048576stride=557056precision=8geometry=4Nc=3,vol=1048576stride=557056precision=4geometry=4Nc=3	32	1	1	16384	1	8	0	-1	-1	-1	-1	0.000736352	# 0.00 Gflop/s, 871.50 GB/s, tuning took 1.278582 seconds at Thu Mar 14 15:46:39 2024
     16x32x32x64	N4quda9CopyGaugeINS_12CopyGaugeArgIfdLi18ELb0ENS_5gauge11FloatNOrderIfLi18ELi4ELi12EL20QudaStaggeredPhase_s0ELb1EL19QudaGhostExchange_sn2147483648ELb0EEENS3_IdLi18ELi2ELi12ELS4_0ELb1ELS5_n2147483648ELb0EEEEEEE	GPU-offline,cmem,vol=1048576stride=557056precision=8geometry=4Nc=3,vol=1048576stride=557056precision=4geometry=4Nc=3,ghost	96	1	7	342	1	2	0	-1	-1	-1	-1	3.145e-05	# 0.00 Gflop/s, 717.35 GB/s, tuning took 0.074114 seconds at Thu Mar 14 15:46:39 2024
     16x32x32x64	N4quda9CopyGaugeINS_12CopyGaugeArgIsdLi18ELb0ENS_5gauge11FloatNOrderIsLi18ELi4ELi12EL20QudaStaggeredPhase_s0ELb1EL19QudaGhostExchange_sn2147483648ELb0EEENS3_IdLi18ELi2ELi12ELS4_0ELb1ELS5_n2147483648ELb0EEEEEEE	GPU-offline,cmem,vol=1048576stride=557056precision=8geometry=4Nc=3,vol=1048576stride=557056precision=2geometry=4Nc=3	32	1	5	16384	1	2	0	-1	-1	-1	-1	0.000657451	# 0.00 Gflop/s, 813.41 GB/s, tuning took 1.134016 seconds at Thu Mar 14 15:46:38 2024
     16x32x32x64	N4quda9CopyGaugeINS_12CopyGaugeArgIsdLi18ELb0ENS_5gauge11FloatNOrderIsLi18ELi4ELi12EL20QudaStaggeredPhase_s0ELb1EL19QudaGhostExchange_sn2147483648ELb0EEENS3_IdLi18ELi2ELi12ELS4_0ELb1ELS5_n2147483648ELb0EEEEEEE	GPU-offline,cmem,vol=1048576stride=557056precision=8geometry=4Nc=3,vol=1048576stride=557056precision=2geometry=4Nc=3,ghost	256	1	2	128	1	4	24577	-1	-1	-1	-1	2.76711e-05	# 0.00 Gflop/s, 679.43 GB/s, tuning took 0.067663 seconds at Thu Mar 14 15:46:38 2024
     32x32x32x32	N4quda10CopyCloverINS_6clover11FloatNOrderIfLi72ELi4ELb0ELb0ELb0EEENS2_IdLi72ELi2ELb0ELb0ELb0EEEfdEE	GPU-offline,cmem,vol=1048576precision=8Nc=3	416	1	1	1261	2	1	12289	-1	-1	-1	-1	0.00128206	# 0.00 Gflop/s, 706.65 GB/s, tuning took 1.100477 seconds at Thu Mar 14 15:43:45 2024
     32x32x32x32	N4quda10CopyCloverINS_6clover11FloatNOrderIsLi72ELi8ELb0ELb0ELb0EEENS2_IdLi72ELi2ELb0ELb0ELb0EEEsdEE	GPU-offline,cmem,vol=1048576precision=8Nc=3	64	1	1	8192	2	1	3781	-1	-1	-1	-1	0.00103698	# 0.00 Gflop/s, 728.05 GB/s, tuning took 0.906655 seconds at Thu Mar 14 15:43:44 2024
     32x32x32x32	N4quda10GaugeGaussIdLi3EL21QudaReconstructType_s12EEE	GPU-offline,vol=1048576stride=540672precision=8geometry=4Nc=3,lie_group	384	1	1	1366	2	1	12289	-1	-1	-1	-1	0.00235518	# 0.00 Gflop/s, 176.31 GB/s, tuning took 3.112638 seconds at Thu Mar 14 15:42:48 2024
     32x32x32x32	N4quda11CopyGaugeExIddLi18ENS_5gauge11FloatNOrderIdLi18ELi2ELi18EL20QudaStaggeredPhase_s0ELb1EL19QudaGhostExchange_sn2147483648ELb0EEENS2_IdLi18ELi2ELi12ELS3_0ELb1ELS4_n2147483648ELb0EEEEE	GPU-offline,cmem,vol=1048576stride=540672precision=8geometry=4Nc=3vol=1048576stride=524288precision=8geometry=4Nc=3r=0000	640	1	1	820	2	1	0	-1	-1	-1	-1	0.00139638	# 0.00 Gflop/s, 729.90 GB/s, tuning took 1.519668 seconds at Thu Mar 14 15:43:46 2024
     32x32x32x32	N4quda11CopyGaugeExIddLi18ENS_5gauge11FloatNOrderIdLi18ELi2ELi18EL20QudaStaggeredPhase_s0ELb1EL19QudaGhostExchange_sn2147483648ELb0EEES5_EE	GPU-offline,cmem,vol=1048576stride=540672precision=8geometry=4Nc=3vol=1048576stride=524288precision=8geometry=4Nc=3r=0000	640	1	1	820	2	1	0	-1	-1	-1	-1	0.00160027	# 0.00 Gflop/s, 766.64 GB/s, tuning took 1.759096 seconds at Thu Mar 14 15:42:58 2024
     32x32x32x32	N4quda12CloverInvertIdEE	GPU-offline,vol=1048576precision=8Nc=3,trlog=true,twist=false	160	2	1	160	1	1	16385	-1	-1	-1	-1	0.0016871	# 0.00 Gflop/s, 716.00 GB/s, tuning took 24.960244 seconds at Thu Mar 14 15:43:40 2024
     32x32x32x32	N4quda12ExtractGhostIdLi3ENS_5gauge11FloatNOrderIdLi18ELi2ELi12EL20QudaStaggeredPhase_s0ELb1EL19QudaGhostExchange_sn2147483648ELb0EEEEE	GPU-offline,vol=1048576stride=540672precision=8geometry=4Nc=3,extract	128	1	4	256	1	2	16385	-1	-1	-1	-1	4.83078e-05	# 0.00 Gflop/s, 520.95 GB/s, tuning took 0.105429 seconds at Thu Mar 14 15:42:40 2024
     32x32x32x32	N4quda12ExtractGhostIdLi3ENS_5gauge11FloatNOrderIdLi18ELi2ELi18EL20QudaStaggeredPhase_s0ELb1EL19QudaGhostExchange_sn2147483648ELb0EEEEE	GPU-offline,vol=1048576stride=540672precision=8geometry=4Nc=3,extract	32	1	4	1024	1	2	3511	-1	-1	-1	-1	6.89899e-05	# 0.00 Gflop/s, 547.16 GB/s, tuning took 0.138606 seconds at Thu Mar 14 15:42:53 2024
     32x32x32x32	N4quda13ComputeCloverIdEE	GPU-offline,vol=1048576precision=8Nc=3	192	1	1	2731	2	1	0	-1	-1	-1	-1	0.00212068	# 237.34 Gflop/s, 712.01 GB/s, tuning took 0.173574 seconds at Thu Mar 14 15:43:15 2024
     32x32x32x32	N4quda5FmunuIdLi3EL21QudaReconstructType_s18EEE	GPU-offline,vol=1048576stride=524288precision=8geometry=4Nc=3r=0000,comm=0000	32	2	4	16384	1	2	0	-1	-1	-1	-1	0.00843172	# 1840.04 Gflop/s, 1826.61 GB/s, tuning took 17.264695 seconds at Thu Mar 14 15:43:15 2024
     32x32x32x32	N4quda7RNGInitE	GPU-offline,vol=1048576stride=540672precision=8geometry=4Nc=3	320	2	1	1639	1	1	0	-1	-1	-1	-1	0.0149663	# 0.00 Gflop/s, 0.00 GB/s, tuning took 2.214841 seconds at Thu Mar 14 15:42:45 2024
     32x32x32x32	N4quda9CopyGaugeINS_12CopyGaugeArgIddLi18ELb0ENS_5gauge11FloatNOrderIdLi18ELi2ELi12EL20QudaStaggeredPhase_s0ELb1EL19QudaGhostExchange_sn2147483648ELb0EEENS2_8QDPOrderIdLi18EEEEEEE	GPU-offline,cmem,vol=1048576stride=524288precision=8geometry=4Nc=3,vol=1048576stride=540672precision=8geometry=4Nc=3	96	1	1	5462	1	8	2458	-1	-1	-1	-1	0.00122436	# 0.00 Gflop/s, 832.45 GB/s, tuning took 2.031747 seconds at Thu Mar 14 15:42:40 2024
     32x32x32x32	N4quda9CopyGaugeINS_12CopyGaugeArgIddLi18ELb0ENS_5gauge11FloatNOrderIdLi18ELi2ELi12EL20QudaStaggeredPhase_s0ELb1EL19QudaGhostExchange_sn2147483648ELb0EEES6_EEEE	GPU-offline,cmem,vol=1048576stride=540672precision=8geometry=4Nc=3,vol=1048576stride=540672precision=8geometry=4Nc=3,ghost	416	1	2	40	1	4	0	-1	-1	-1	-1	3.50102e-05	# 0.00 Gflop/s, 741.28 GB/s, tuning took 0.076275 seconds at Thu Mar 14 15:42:40 2024
     32x32x32x32	N4quda9CopyGaugeINS_12CopyGaugeArgIddLi18ELb0ENS_5gauge11FloatNOrderIdLi18ELi2ELi18EL20QudaStaggeredPhase_s0ELb1EL19QudaGhostExchange_sn2147483648ELb0EEENS2_8QDPOrderIdLi18EEEEEEE	GPU-offline,cmem,vol=1048576stride=524288precision=8geometry=4Nc=3,vol=1048576stride=540672precision=8geometry=4Nc=3	64	1	1	8192	1	8	1586	-1	-1	-1	-1	0.00149469	# 0.00 Gflop/s, 820.80 GB/s, tuning took 2.453183 seconds at Thu Mar 14 15:42:53 2024
     32x32x32x32	N4quda9CopyGaugeINS_12CopyGaugeArgIddLi18ELb0ENS_5gauge11FloatNOrderIdLi18ELi2ELi18EL20QudaStaggeredPhase_s0ELb1EL19QudaGhostExchange_sn2147483648ELb0EEES6_EEEE	GPU-offline,cmem,vol=1048576stride=540672precision=8geometry=4Nc=3,vol=1048576stride=540672precision=8geometry=4Nc=3,ghost	32	1	2	512	1	4	2235	-1	-1	-1	-1	5.116e-05	# 0.00 Gflop/s, 760.91 GB/s, tuning took 0.100448 seconds at Thu Mar 14 15:42:53 2024
     32x32x32x32	N4quda9CopyGaugeINS_12CopyGaugeArgIddLi18ELb0ENS_5gauge8QDPOrderIdLi18EEENS2_11FloatNOrderIdLi18ELi2ELi12EL20QudaStaggeredPhase_s0ELb1EL19QudaGhostExchange_sn2147483648ELb0EEEEEEE	GPU-offline,cmem,vol=1048576stride=540672precision=8geometry=4Nc=3,vol=1048576stride=524288precision=8geometry=4Nc=3	64	1	1	8192	1	8	0	-1	-1	-1	-1	0.00129316	# 0.00 Gflop/s, 788.16 GB/s, tuning took 2.228699 seconds at Thu Mar 14 15:42:50 2024
     32x32x32x32	N4quda9CopyGaugeINS_12CopyGaugeArgIfdLi18ELb0ENS_5gauge11FloatNOrderIfLi18ELi4ELi12EL20QudaStaggeredPhase_s0ELb1EL19QudaGhostExchange_sn2147483648ELb0EEENS3_IdLi18ELi2ELi12ELS4_0ELb1ELS5_n2147483648ELb0EEEEEEE	GPU-offline,cmem,vol=1048576stride=540672precision=8geometry=4Nc=3,vol=1048576stride=540672precision=4geometry=4Nc=3	32	1	1	16384	1	8	0	-1	-1	-1	-1	0.000735573	# 0.00 Gflop/s, 846.76 GB/s, tuning took 1.342812 seconds at Thu Mar 14 15:42:43 2024
     32x32x32x32	N4quda9CopyGaugeINS_12CopyGaugeArgIfdLi18ELb0ENS_5gauge11FloatNOrderIfLi18ELi4ELi12EL20QudaStaggeredPhase_s0ELb1EL19QudaGhostExchange_sn2147483648ELb0EEENS3_IdLi18ELi2ELi12ELS4_0ELb1ELS5_n2147483648ELb0EEEEEEE	GPU-offline,cmem,vol=1048576stride=540672precision=8geometry=4Nc=3,vol=1048576stride=540672precision=4geometry=4Nc=3,ghost	32	1	1	512	1	8	0	-1	-1	-1	-1	2.74036e-05	# 0.00 Gflop/s, 710.28 GB/s, tuning took 0.067123 seconds at Thu Mar 14 15:42:43 2024
     32x32x32x32	N4quda9CopyGaugeINS_12CopyGaugeArgIfdLi18ELb0ENS_5gauge11FloatNOrderIfLi18ELi4ELi12EL20QudaStaggeredPhase_s0ELb1EL19QudaGhostExchange_sn2147483648ELb0EEENS3_IdLi18ELi2ELi18ELS4_0ELb1ELS5_n2147483648ELb0EEEEEEE	GPU-offline,cmem,vol=1048576stride=540672precision=8geometry=4Nc=3,vol=1048576stride=540672precision=4geometry=4Nc=3	32	1	1	16384	1	8	0	-1	-1	-1	-1	0.000736021	# 0.00 Gflop/s, 1128.33 GB/s, tuning took 1.337042 seconds at Thu Mar 14 15:42:56 2024
     32x32x32x32	N4quda9CopyGaugeINS_12CopyGaugeArgIfdLi18ELb0ENS_5gauge11FloatNOrderIfLi18ELi4ELi12EL20QudaStaggeredPhase_s0ELb1EL19QudaGhostExchange_sn2147483648ELb0EEENS3_IdLi18ELi2ELi18ELS4_0ELb1ELS5_n2147483648ELb0EEEEEEE	GPU-offline,cmem,vol=1048576stride=540672precision=8geometry=4Nc=3,vol=1048576stride=540672precision=4geometry=4Nc=3,ghost	96	1	1	171	1	8	0	-1	-1	-1	-1	2.76151e-05	# 0.00 Gflop/s, 939.78 GB/s, tuning took 0.067305 seconds at Thu Mar 14 15:42:56 2024
     32x32x32x32	N4quda9CopyGaugeINS_12CopyGaugeArgIsdLi18ELb0ENS_5gauge11FloatNOrderIsLi18ELi4ELi12EL20QudaStaggeredPhase_s0ELb1EL19QudaGhostExchange_sn2147483648ELb0EEENS3_IdLi18ELi2ELi12ELS4_0ELb1ELS5_n2147483648ELb0EEEEEEE	GPU-offline,cmem,vol=1048576stride=540672precision=8geometry=4Nc=3,vol=1048576stride=540672precision=2geometry=4Nc=3	32	1	5	16384	1	2	0	-1	-1	-1	-1	0.000658176	# 0.00 Gflop/s, 788.61 GB/s, tuning took 1.211491 seconds at Thu Mar 14 15:42:41 2024
     32x32x32x32	N4quda9CopyGaugeINS_12CopyGaugeArgIsdLi18ELb0ENS_5gauge11FloatNOrderIsLi18ELi4ELi12EL20QudaStaggeredPhase_s0ELb1EL19QudaGhostExchange_sn2147483648ELb0EEENS3_IdLi18ELi2ELi12ELS4_0ELb1ELS5_n2147483648ELb0EEEEEEE	GPU-offline,cmem,vol=1048576stride=540672precision=8geometry=4Nc=3,vol=1048576stride=540672precision=2geometry=4Nc=3,ghost	64	1	5	256	1	2	0	-1	-1	-1	-1	2.37577e-05	# 0.00 Gflop/s, 682.73 GB/s, tuning took 0.060510 seconds at Thu Mar 14 15:42:41 2024
     32x32x32x32	N4quda9CopyGaugeINS_12CopyGaugeArgIsdLi18ELb0ENS_5gauge11FloatNOrderIsLi18ELi4ELi12EL20QudaStaggeredPhase_s0ELb1EL19QudaGhostExchange_sn2147483648ELb0EEENS3_IdLi18ELi2ELi18ELS4_0ELb1ELS5_n2147483648ELb0EEEEEEE	GPU-offline,cmem,vol=1048576stride=540672precision=8geometry=4Nc=3,vol=1048576stride=540672precision=2geometry=4Nc=3	32	1	4	16384	1	2	0	-1	-1	-1	-1	0.000657909	# 0.00 Gflop/s, 1104.50 GB/s, tuning took 1.202500 seconds at Thu Mar 14 15:42:55 2024
     32x32x32x32	N4quda9CopyGaugeINS_12CopyGaugeArgIsdLi18ELb0ENS_5gauge11FloatNOrderIsLi18ELi4ELi12EL20QudaStaggeredPhase_s0ELb1EL19QudaGhostExchange_sn2147483648ELb0EEENS3_IdLi18ELi2ELi18ELS4_0ELb1ELS5_n2147483648ELb0EEEEEEE	GPU-offline,cmem,vol=1048576stride=540672precision=8geometry=4Nc=3,vol=1048576stride=540672precision=2geometry=4Nc=3,ghost	224	1	4	74	1	2	0	-1	-1	-1	-1	2.57247e-05	# 0.00 Gflop/s, 882.74 GB/s, tuning took 0.062467 seconds at Thu Mar 14 15:42:55 2024
     32x32x32x64	N4quda10GaugeGaussIdLi3EL21QudaReconstructType_s12EEE	GPU-offline,vol=2097152stride=1081344precision=8geometry=4Nc=3,lie_group	384	1	1	2731	2	1	16385	-1	-1	-1	-1	0.00468807	# 0.00 Gflop/s, 177.15 GB/s, tuning took 6.202334 seconds at Wed Mar 20 22:32:58 2024
     32x32x32x64	N4quda12ExtractGhostIdLi3ENS_5gauge11FloatNOrderIdLi18ELi2ELi12EL20QudaStaggeredPhase_s0ELb1EL19QudaGhostExchange_sn2147483648ELb0EEEEE	GPU-offline,vol=2097152stride=1081344precision=8geometry=4Nc=3,extract	128	1	3	512	1	3	24577	-1	-1	-1	-1	8.28677e-05	# 0.00 Gflop/s, 531.45 GB/s, tuning took 0.165354 seconds at Wed Mar 20 22:32:42 2024
     32x32x32x64	N4quda7RNGInitE	GPU-offline,vol=2097152stride=1081344precision=8geometry=4Nc=3	320	2	1	3277	1	1	0	-1	-1	-1	-1	0.0303817	# 0.00 Gflop/s, 0.00 GB/s, tuning took 4.525785 seconds at Wed Mar 20 22:32:51 2024
     32x32x32x64	N4quda9CopyGaugeINS_12CopyGaugeArgIddLi18ELb0ENS_5gauge11FloatNOrderIdLi18ELi2ELi12EL20QudaStaggeredPhase_s0ELb1EL19QudaGhostExchange_sn2147483648ELb0EEENS2_8QDPOrderIdLi18EEEEEEE	GPU-offline,cmem,vol=2097152stride=1048576precision=8geometry=4Nc=3,vol=2097152stride=1081344precision=8geometry=4Nc=3	64	1	1	16384	1	8	1586	-1	-1	-1	-1	0.00248617	# 0.00 Gflop/s, 819.91 GB/s, tuning took 4.061677 seconds at Wed Mar 20 22:32:41 2024
     32x32x32x64	N4quda9CopyGaugeINS_12CopyGaugeArgIddLi18ELb0ENS_5gauge11FloatNOrderIdLi18ELi2ELi12EL20QudaStaggeredPhase_s0ELb1EL19QudaGhostExchange_sn2147483648ELb0EEES6_EEEE	GPU-offline,cmem,vol=2097152stride=1081344precision=8geometry=4Nc=3,vol=2097152stride=1081344precision=8geometry=4Nc=3,ghost	1024	1	1	32	1	8	24577	-1	-1	-1	-1	5.82532e-05	# 0.00 Gflop/s, 779.64 GB/s, tuning took 0.116133 seconds at Wed Mar 20 22:32:42 2024
     32x32x32x64	N4quda9CopyGaugeINS_12CopyGaugeArgIddLi18ELb0ENS_5gauge8QDPOrderIdLi18EEENS2_11FloatNOrderIdLi18ELi2ELi12EL20QudaStaggeredPhase_s0ELb1EL19QudaGhostExchange_sn2147483648ELb0EEEEEEE	GPU-offline,cmem,vol=2097152stride=1081344precision=8geometry=4Nc=3,vol=2097152stride=1048576precision=8geometry=4Nc=3	96	1	1	10923	1	8	0	-1	-1	-1	-1	0.00258565	# 0.00 Gflop/s, 788.36 GB/s, tuning took 4.332519 seconds at Wed Mar 20 22:33:02 2024
     32x32x32x64	N4quda9CopyGaugeINS_12CopyGaugeArgIfdLi18ELb0ENS_5gauge11FloatNOrderIfLi18ELi4ELi12EL20QudaStaggeredPhase_s0ELb1EL19QudaGhostExchange_sn2147483648ELb0EEENS3_IdLi18ELi2ELi12ELS4_0ELb1ELS5_n2147483648ELb0EEEEEEE	GPU-offline,cmem,vol=2097152stride=1081344precision=8geometry=4Nc=3,vol=2097152stride=1081344precision=4geometry=4Nc=3	32	1	1	32768	1	8	0	-1	-1	-1	-1	0.00146729	# 0.00 Gflop/s, 848.99 GB/s, tuning took 2.558181 seconds at Wed Mar 20 22:32:47 2024
     32x32x32x64	N4quda9CopyGaugeINS_12CopyGaugeArgIfdLi18ELb0ENS_5gauge11FloatNOrderIfLi18ELi4ELi12EL20QudaStaggeredPhase_s0ELb1EL19QudaGhostExchange_sn2147483648ELb0EEENS3_IdLi18ELi2ELi12ELS4_0ELb1ELS5_n2147483648ELb0EEEEEEE	GPU-offline,cmem,vol=2097152stride=1081344precision=8geometry=4Nc=3,vol=2097152stride=1081344precision=4geometry=4Nc=3,ghost	128	1	1	256	1	8	0	-1	-1	-1	-1	4.48403e-05	# 0.00 Gflop/s, 759.64 GB/s, tuning took 0.096430 seconds at Wed Mar 20 22:32:47 2024
     32x32x32x64	N4quda9CopyGaugeINS_12CopyGaugeArgIsdLi18ELb0ENS_5gauge11FloatNOrderIsLi18ELi4ELi12EL20QudaStaggeredPhase_s0ELb1EL19QudaGhostExchange_sn2147483648ELb0EEENS3_IdLi18ELi2ELi12ELS4_0ELb1ELS5_n2147483648ELb0EEEEEEE	GPU-offline,cmem,vol=2097152stride=1081344precision=8geometry=4Nc=3,vol=2097152stride=1081344precision=2geometry=4Nc=3	32	1	3	32768	1	3	0	-1	-1	-1	-1	0.00127152	# 0.00 Gflop/s, 816.42 GB/s, tuning took 2.234242 seconds at Wed Mar 20 22:32:44 2024
     32x32x32x64	N4quda9CopyGaugeINS_12CopyGaugeArgIsdLi18ELb0ENS_5gauge11FloatNOrderIsLi18ELi4ELi12EL20QudaStaggeredPhase_s0ELb1EL19QudaGhostExchange_sn2147483648ELb0EEENS3_IdLi18ELi2ELi12ELS4_0ELb1ELS5_n2147483648ELb0EEEEEEE	GPU-offline,cmem,vol=2097152stride=1081344precision=8geometry=4Nc=3,vol=2097152stride=1081344precision=2geometry=4Nc=3,ghost	64	1	6	512	1	2	0	-1	-1	-1	-1	3.89674e-05	# 0.00 Gflop/s, 728.44 GB/s, tuning took 0.087172 seconds at Wed Mar 20 22:32:44 2024
        37748736	N4quda15TransformReduceINS_7maximumIdEEKNS_7complexIdEEmNS_8abs_max_IddEENS_8identityEEE	,batch_size=1	1024	1	1	160	1	1	0	-1	-1	-1	-1	0.0006976	# 0.00 Gflop/s, 865.80 GB/s, tuning took 2.367295 seconds at Thu Mar 14 15:43:43 2024
      4x16x32x64	N4quda15CopyColorSpinorILi4ELi3ENS_11colorspinor11FloatNOrderIdLi4ELi3ELi2ELb0ELb0EEENS1_21SpaceSpinorColorOrderIdLi4ELi3EEESt5tupleIJRNS_16ColorSpinorFieldERKS7_19QudaFieldLocation_sPdPKdEEEE	GPU-offline,cmem,vol=131072,parity=1,precision=8,order=9,Ns=4,Nc=3vol=131072,parity=1,precision=8,order=2,Ns=4,Nc=3,NonRelBasis	832	1	1	158	1	1	0	-1	-1	-1	-1	6.4062e-05	# 0.00 Gflop/s, 785.67 GB/s, tuning took 0.024967 seconds at Thu Mar 14 14:05:37 2024
      4x16x32x64	N4quda15CopyColorSpinorILi4ELi3ENS_11colorspinor21SpaceSpinorColorOrderIdLi4ELi3EEENS1_11FloatNOrderIdLi4ELi3ELi2ELb0ELb0EEESt5tupleIJRNS_16ColorSpinorFieldERKS7_19QudaFieldLocation_sPdPKdEEEE	GPU-offline,cmem,vol=131072,parity=1,precision=8,order=2,Ns=4,Nc=3vol=131072,parity=1,precision=8,order=9,Ns=4,Nc=3,RelBasis	288	1	1	456	1	1	0	-1	-1	-1	-1	6.4996e-05	# 0.00 Gflop/s, 774.38 GB/s, tuning took 0.017201 seconds at Thu Mar 14 14:05:37 2024
      4x16x32x64	N4quda6WilsonINS_9WilsonArgIdLi3ELi4EL21QudaReconstructType_s12EEEEE	policy,GPU-offline,vol=131072,parity=1,precision=8,order=2,Ns=4,Nc=3,commDim=0000,topo=1111,p2p=0,gdr=0,nvshmem=0,pol=110000111100110000	32	1	1	1	1	1	0	9	0	0	-1	0.000227136	# 761.72 Gflop/s, 1329.56 GB/s, tuning took 0.017529 seconds at Thu Mar 14 14:05:37 2024
      4x16x32x64	N4quda6WilsonINS_9WilsonArgIdLi3ELi4EL21QudaReconstructType_s12EEEEE	policy_kernel=interior,GPU-offline,vol=131072,parity=1,precision=8,order=2,Ns=4,Nc=3,commDim=0000,comm=0000	32	1	1	4096	1	1	19661	-1	-1	-1	-1	0.000227226	# 761.42 Gflop/s, 1329.03 GB/s, tuning took 0.339012 seconds at Thu Mar 14 14:05:37 2024
      5x32x32x64	N4quda15CopyColorSpinorILi4ELi3ENS_11colorspinor11FloatNOrderIdLi4ELi3ELi2ELb0ELb0EEENS1_21SpaceSpinorColorOrderIdLi4ELi3EEESt5tupleIJRNS_16ColorSpinorFieldERKS7_19QudaFieldLocation_sPdPKdEEEE	GPU-offline,cmem,vol=327680,parity=1,precision=8,order=9,Ns=4,Nc=3vol=327680,parity=1,precision=8,order=2,Ns=4,Nc=3,NonRelBasis	544	1	1	603	1	1	0	-1	-1	-1	-1	0.000164686	# 0.00 Gflop/s, 764.06 GB/s, tuning took 0.027912 seconds at Thu Mar 14 15:52:12 2024
      5x32x32x64	N4quda15CopyColorSpinorILi4ELi3ENS_11colorspinor21SpaceSpinorColorOrderIdLi4ELi3EEENS1_11FloatNOrderIdLi4ELi3ELi2ELb0ELb0EEESt5tupleIJRNS_16ColorSpinorFieldERKS7_19QudaFieldLocation_sPdPKdEEEE	GPU-offline,cmem,vol=327680,parity=1,precision=8,order=2,Ns=4,Nc=3vol=327680,parity=1,precision=8,order=9,Ns=4,Nc=3,RelBasis	160	1	1	2048	1	1	0	-1	-1	-1	-1	0.000161673	# 0.00 Gflop/s, 778.29 GB/s, tuning took 0.025543 seconds at Thu Mar 14 15:52:52 2024
      5x32x32x64	N4quda4PackIdLi3ELb1EEE	policy_kernel,vol=327680,parity=1,precision=8,order=2,Ns=4,Nc=3,comm=1000,topo=3111,nFace=1,device-device	544	1	1	64	1	1	0	-1	-1	-1	-1	6.70315e-05	# 11.73 Gflop/s, 281.57 GB/s, tuning took 1.696566 seconds at Thu Mar 14 15:52:13 2024
      5x32x32x64	N4quda4PackIdLi3ELb1EEE	policy_kernel,vol=327680,parity=1,precision=8,order=2,Ns=4,Nc=3,comm=1000,topo=3111,nFace=1,device-remote	32	1	1	128	1	1	0	-1	-1	-1	-1	7.93502e-05	# 9.91 Gflop/s, 237.86 GB/s, tuning took 1.917782 seconds at Thu Mar 14 15:52:41 2024
      5x32x32x64	N4quda4PackIdLi3ELb1EEE	policy_kernel,vol=327680,parity=1,precision=8,order=2,Ns=4,Nc=3,comm=1000,topo=3111,nFace=1,host-device	256	1	1	3	1	1	0	-1	-1	-1	-1	0.00057328	# 1.37 Gflop/s, 32.92 GB/s, tuning took 0.286871 seconds at Thu Mar 14 15:52:28 2024
      5x32x32x64	N4quda4PackIdLi3ELb1EEE	policy_kernel,vol=327680,parity=1,precision=8,order=2,Ns=4,Nc=3,comm=1000,topo=3111,nFace=1,host-host	256	1	1	3	1	1	0	-1	-1	-1	-1	0.000550901	# 1.43 Gflop/s, 34.26 GB/s, tuning took 0.281919 seconds at Thu Mar 14 15:52:15 2024
      5x32x32x64	N4quda4PackIdLi3ELb1EEE	policy_kernel,vol=327680,parity=1,precision=8,order=2,Ns=4,Nc=3,comm=1000,topo=3111,nFace=1,host-remote	224	1	1	3	1	1	0	-1	-1	-1	-1	0.000548843	# 1.43 Gflop/s, 34.39 GB/s, tuning took 0.278692 seconds at Thu Mar 14 15:52:41 2024
      5x32x32x64	N4quda6WilsonINS_9WilsonArgIdLi3ELi4EL21QudaReconstructType_s12EEEEE	policy,GPU-offline,vol=327680,parity=1,precision=8,order=2,Ns=4,Nc=3,commDim=1000,topo=3111,p2p=3,gdr=0,nvshmem=0,pol=110000111100110000	32	1	1	1	1	1	0	0	2	0	-1	0.00224337	# 192.81 Gflop/s, 336.54 GB/s, tuning took 0.424636 seconds at Thu Mar 14 15:52:52 2024
      5x32x32x64	N4quda6WilsonINS_9WilsonArgIdLi3ELi4EL21QudaReconstructType_s12EEEEE	policy_kernel=exterior_all,GPU-offline,vol=327680,parity=1,precision=8,order=2,Ns=4,Nc=3,commDim=1000	32	1	1	2048	1	1	32769	-1	-1	-1	-1	0.000211238	# 55.84 Gflop/s, 178.70 GB/s, tuning took 0.303255 seconds at Thu Mar 14 15:52:15 2024
      5x32x32x64	N4quda6WilsonINS_9WilsonArgIdLi3ELi4EL21QudaReconstructType_s12EEEEE	policy_kernel=exterior_all,GPU-offline,vol=327680,parity=1,precision=8,order=2,Ns=4,Nc=3,commDim=1000,zero_copy,p2p=0	32	1	1	2048	1	1	49153	-1	-1	-1	-1	0.000524821	# 22.48 Gflop/s, 71.93 GB/s, tuning took 0.647008 seconds at Thu Mar 14 15:52:17 2024
      5x32x32x64	N4quda6WilsonINS_9WilsonArgIdLi3ELi4EL21QudaReconstructType_s12EEEEE	policy_kernel=exterior_all,GPU-offline,vol=327680,parity=1,precision=8,order=2,Ns=4,Nc=3,commDim=1000,zero_copy,p2p=1	224	1	1	293	1	1	49153	-1	-1	-1	-1	0.000349419	# 33.76 Gflop/s, 108.03 GB/s, tuning took 0.497191 seconds at Thu Mar 14 15:52:29 2024
      5x32x32x64	N4quda6WilsonINS_9WilsonArgIdLi3ELi4EL21QudaReconstructType_s12EEEEE	policy_kernel=exterior_x,GPU-offline,vol=327680,parity=1,precision=8,order=2,Ns=4,Nc=3,commDim=1000	16	1	1	4096	1	1	49153	-1	-1	-1	-1	0.000199205	# 59.22 Gflop/s, 189.50 GB/s, tuning took 0.301474 seconds at Thu Mar 14 15:52:15 2024
      5x32x32x64	N4quda6WilsonINS_9WilsonArgIdLi3ELi4EL21QudaReconstructType_s12EEEEE	policy_kernel=exterior_x,GPU-offline,vol=327680,parity=1,precision=8,order=2,Ns=4,Nc=3,commDim=1000,zero_copy,p2p=0	32	1	1	2048	1	1	49153	-1	-1	-1	-1	0.000523595	# 22.53 Gflop/s, 72.10 GB/s, tuning took 0.652989 seconds at Thu Mar 14 15:52:16 2024
      5x32x32x64	N4quda6WilsonINS_9WilsonArgIdLi3ELi4EL21QudaReconstructType_s12EEEEE	policy_kernel=exterior_x,GPU-offline,vol=327680,parity=1,precision=8,order=2,Ns=4,Nc=3,commDim=1000,zero_copy,p2p=1	144	1	1	456	1	1	49153	-1	-1	-1	-1	0.000356309	# 33.11 Gflop/s, 105.94 GB/s, tuning took 0.505584 seconds at Thu Mar 14 15:52:28 2024
      5x32x32x64	N4quda6WilsonINS_9WilsonArgIdLi3ELi4EL21QudaReconstructType_s12EEEEE	policy_kernel=interior,GPU-offline,vol=327680,parity=1,precision=8,order=2,Ns=4,Nc=3,commDim=1000,comm=1000	32	1	1	10240	1	1	16385	-1	-1	-1	-1	0.000628373	# 672.07 Gflop/s, 1141.40 GB/s, tuning took 0.839192 seconds at Thu Mar 14 15:52:14 2024
      5x32x32x64	N4quda6WilsonINS_9WilsonArgIdLi3ELi4EL21QudaReconstructType_s12EEEEE	policy_kernel=interior,GPU-offline,vol=327680,parity=1,precision=8,order=2,Ns=4,Nc=3,commDim=1000,comm=1000,host-device	128	1	1	2560	1	1	49153	2	-1	-1	-1	0.000649685	# 651.24 Gflop/s, 1133.01 GB/s, tuning took 10.173568 seconds at Thu Mar 14 15:52:39 2024
      5x32x32x64	N4quda6WilsonINS_9WilsonArgIdLi3ELi4EL21QudaReconstructType_s12EEEEE	policy_kernel=interior,GPU-offline,vol=327680,parity=1,precision=8,order=2,Ns=4,Nc=3,commDim=1000,comm=1000,host-host	32	1	1	10240	1	1	16385	5	-1	-1	-1	0.00064048	# 660.60 Gflop/s, 1149.29 GB/s, tuning took 10.416474 seconds at Thu Mar 14 15:52:27 2024
      5x32x32x64	N4quda6WilsonINS_9WilsonArgIdLi3ELi4EL21QudaReconstructType_s12EEEEE	policy_kernel=interior,GPU-offline,vol=327680,parity=1,precision=8,order=2,Ns=4,Nc=3,commDim=1000,comm=1000,host-remote	32	1	1	10240	1	1	16385	5	-1	-1	-1	0.000639584	# 661.52 Gflop/s, 1150.90 GB/s, tuning took 10.011280 seconds at Thu Mar 14 15:52:51 2024
      8x16x16x16	N4quda10GaugeGaussIdLi3EL21QudaReconstructType_s12EEE	GPU-offline,vol=32768stride=18432precision=8geometry=4Nc=3,lie_group	64	2	1	256	1	1	0	-1	-1	-1	-1	0.000101069	# 0.00 Gflop/s, 140.06 GB/s, tuning took 0.125674 seconds at Thu Mar 14 14:53:24 2024
      8x16x16x16	N4quda12ExtractGhostIdLi3ENS_5gauge11FloatNOrderIdLi18ELi2ELi12EL20QudaStaggeredPhase_s0ELb1EL19QudaGhostExchange_sn2147483648ELb0EEEEE	GPU-offline,vol=32768stride=18432precision=8geometry=4Nc=3,extract	128	1	1	32	1	8	3781	-1	-1	-1	-1	4.1378e-06	# 0.00 Gflop/s, 475.15 GB/s, tuning took 0.024027 seconds at Thu Mar 14 14:53:23 2024
      8x16x16x16	N4quda7RNGInitE	GPU-offline,vol=32768stride=18432precision=8geometry=4Nc=3	416	1	1	40	2	1	0	-1	-1	-1	-1	0.000557397	# 0.00 Gflop/s, 0.00 GB/s, tuning took 0.080900 seconds at Thu Mar 14 14:53:23 2024
      8x16x16x16	N4quda9CopyGaugeINS_12CopyGaugeArgIddLi18ELb0ENS_5gauge11FloatNOrderIdLi18ELi2ELi12EL20QudaStaggeredPhase_s0ELb1EL19QudaGhostExchange_sn2147483648ELb0EEENS2_8QDPOrderIdLi18EEEEEEE	GPU-offline,cmem,vol=32768stride=16384precision=8geometry=4Nc=3,vol=32768stride=18432precision=8geometry=4Nc=3	128	1	1	128	1	8	3073	-1	-1	-1	-1	4.29635e-05	# 0.00 Gflop/s, 768.80 GB/s, tuning took 0.087243 seconds at Thu Mar 14 14:53:23 2024
      8x16x16x16	N4quda9CopyGaugeINS_12CopyGaugeArgIddLi18ELb0ENS_5gauge11FloatNOrderIdLi18ELi2ELi12EL20QudaStaggeredPhase_s0ELb1EL19QudaGhostExchange_sn2147483648ELb0EEES6_EEEE	GPU-offline,cmem,vol=32768stride=18432precision=8geometry=4Nc=3,vol=32768stride=18432precision=8geometry=4Nc=3,ghost	64	1	1	32	1	8	1891	-1	-1	-1	-1	3.56521e-06	# 0.00 Gflop/s, 620.40 GB/s, tuning took 0.021878 seconds at Thu Mar 14 14:53:23 2024
      8x16x16x16	N4quda9CopyGaugeINS_12CopyGaugeArgIddLi18ELb0ENS_5gauge8QDPOrderIdLi18EEENS2_11FloatNOrderIdLi18ELi2ELi12EL20QudaStaggeredPhase_s0ELb1EL19QudaGhostExchange_sn2147483648ELb0EEEEEEE	GPU-offline,cmem,vol=32768stride=18432precision=8geometry=4Nc=3,vol=32768stride=16384precision=8geometry=4Nc=3	864	1	1	19	1	8	0	-1	-1	-1	-1	4.25387e-05	# 0.00 Gflop/s, 776.47 GB/s, tuning took 0.089386 seconds at Thu Mar 14 14:53:24 2024
      8x16x16x16	N4quda9CopyGaugeINS_12CopyGaugeArgIfdLi18ELb0ENS_5gauge11FloatNOrderIfLi18ELi4ELi12EL20QudaStaggeredPhase_s0ELb1EL19QudaGhostExchange_sn2147483648ELb0EEENS3_IdLi18ELi2ELi12ELS4_0ELb1ELS5_n2147483648ELb0EEEEEEE	GPU-offline,cmem,vol=32768stride=18432precision=8geometry=4Nc=3,vol=32768stride=18432precision=4geometry=4Nc=3	32	1	2	512	1	4	0	-1	-1	-1	-1	2.73636e-05	# 0.00 Gflop/s, 775.98 GB/s, tuning took 0.063001 seconds at Thu Mar 14 14:53:23 2024
      8x16x16x16	N4quda9CopyGaugeINS_12CopyGaugeArgIfdLi18ELb0ENS_5gauge11FloatNOrderIfLi18ELi4ELi12EL20QudaStaggeredPhase_s0ELb1EL19QudaGhostExchange_sn2147483648ELb0EEENS3_IdLi18ELi2ELi12ELS4_0ELb1ELS5_n2147483648ELb0EEEEEEE	GPU-offline,cmem,vol=32768stride=18432precision=8geometry=4Nc=3,vol=32768stride=18432precision=4geometry=4Nc=3,ghost	64	1	1	32	1	8	1537	-1	-1	-1	-1	3.235e-06	# 0.00 Gflop/s, 512.79 GB/s, tuning took 0.021489 seconds at Thu Mar 14 14:53:23 2024
      8x16x16x16	N4quda9CopyGaugeINS_12CopyGaugeArgIsdLi18ELb0ENS_5gauge11FloatNOrderIsLi18ELi4ELi12EL20QudaStaggeredPhase_s0ELb1EL19QudaGhostExchange_sn2147483648ELb0EEENS3_IdLi18ELi2ELi12ELS4_0ELb1ELS5_n2147483648ELb0EEEEEEE	GPU-offline,cmem,vol=32768stride=18432precision=8geometry=4Nc=3,vol=32768stride=18432precision=2geometry=4Nc=3	256	1	1	64	1	8	0	-1	-1	-1	-1	2.4832e-05	# 0.00 Gflop/s, 712.58 GB/s, tuning took 0.058567 seconds at Thu Mar 14 14:53:23 2024
      8x16x16x16	N4quda9CopyGaugeINS_12CopyGaugeArgIsdLi18ELb0ENS_5gauge11FloatNOrderIsLi18ELi4ELi12EL20QudaStaggeredPhase_s0ELb1EL19QudaGhostExchange_sn2147483648ELb0EEENS3_IdLi18ELi2ELi12ELS4_0ELb1ELS5_n2147483648ELb0EEEEEEE	GPU-offline,cmem,vol=32768stride=18432precision=8geometry=4Nc=3,vol=32768stride=18432precision=2geometry=4Nc=3,ghost	64	1	1	32	1	8	1586	-1	-1	-1	-1	3.50884e-06	# 0.00 Gflop/s, 393.98 GB/s, tuning took 0.021560 seconds at Thu Mar 14 14:53:23 2024
      8x16x32x64	N4quda10GaugeGaussIdLi3EL21QudaReconstructType_s12EEE	GPU-offline,vol=262144stride=147456precision=8geometry=4Nc=3,lie_group	384	1	1	342	2	1	24577	-1	-1	-1	-1	0.000616523	# 0.00 Gflop/s, 183.69 GB/s, tuning took 0.806897 seconds at Thu Mar 14 14:05:36 2024
      8x16x32x64	N4quda12ExtractGhostIdLi3ENS_5gauge11FloatNOrderIdLi18ELi2ELi12EL20QudaStaggeredPhase_s0ELb1EL19QudaGhostExchange_sn2147483648ELb0EEEEE	GPU-offline,vol=262144stride=147456precision=8geometry=4Nc=3,extract	96	1	2	342	1	4	0	-1	-1	-1	-1	2.9864e-05	# 0.00 Gflop/s, 395.01 GB/s, tuning took 0.075877 seconds at Thu Mar 14 14:05:34 2024
      8x16x32x64	N4quda7RNGInitE	GPU-offline,vol=262144stride=147456precision=8geometry=4Nc=3	640	1	1	205	2	1	0	-1	-1	-1	-1	0.00387611	# 0.00 Gflop/s, 0.00 GB/s, tuning took 0.543855 seconds at Thu Mar 14 14:05:35 2024
      8x16x32x64	N4quda9CopyGaugeINS_12CopyGaugeArgIddLi18ELb0ENS_5gauge11FloatNOrderIdLi18ELi2ELi12EL20QudaStaggeredPhase_s0ELb1EL19QudaGhostExchange_sn2147483648ELb0EEENS2_8QDPOrderIdLi18EEEEEEE	GPU-offline,cmem,vol=262144stride=131072precision=8geometry=4Nc=3,vol=262144stride=147456precision=8geometry=4Nc=3	96	1	1	1366	1	8	2458	-1	-1	-1	-1	0.000306024	# 0.00 Gflop/s, 863.47 GB/s, tuning took 0.518681 seconds at Thu Mar 14 14:05:34 2024
      8x16x32x64	N4quda9CopyGaugeINS_12CopyGaugeArgIddLi18ELb0ENS_5gauge11FloatNOrderIdLi18ELi2ELi12EL20QudaStaggeredPhase_s0ELb1EL19QudaGhostExchange_sn2147483648ELb0EEES6_EEEE	GPU-offline,cmem,vol=262144stride=147456precision=8geometry=4Nc=3,vol=262144stride=147456precision=8geometry=4Nc=3,ghost	832	1	1	20	1	8	24577	-1	-1	-1	-1	1.34553e-05	# 0.00 Gflop/s, 986.31 GB/s, tuning took 0.047898 seconds at Thu Mar 14 14:05:34 2024
      8x16x32x64	N4quda9CopyGaugeINS_12CopyGaugeArgIddLi18ELb0ENS_5gauge8QDPOrderIdLi18EEENS2_11FloatNOrderIdLi18ELi2ELi12EL20QudaStaggeredPhase_s0ELb1EL19QudaGhostExchange_sn2147483648ELb0EEEEEEE	GPU-offline,cmem,vol=262144stride=147456precision=8geometry=4Nc=3,vol=262144stride=131072precision=8geometry=4Nc=3	32	1	1	4096	1	8	0	-1	-1	-1	-1	0.000319224	# 0.00 Gflop/s, 827.76 GB/s, tuning took 0.578271 seconds at Thu Mar 14 14:05:37 2024
      8x16x32x64	N4quda9CopyGaugeINS_12CopyGaugeArgIfdLi18ELb0ENS_5gauge11FloatNOrderIfLi18ELi4ELi12EL20QudaStaggeredPhase_s0ELb1EL19QudaGhostExchange_sn2147483648ELb0EEENS3_IdLi18ELi2ELi12ELS4_0ELb1ELS5_n2147483648ELb0EEEEEEE	GPU-offline,cmem,vol=262144stride=147456precision=8geometry=4Nc=3,vol=262144stride=147456precision=4geometry=4Nc=3	96	1	1	1366	1	8	0	-1	-1	-1	-1	0.000182747	# 0.00 Gflop/s, 929.53 GB/s, tuning took 0.326086 seconds at Thu Mar 14 14:05:35 2024
      8x16x32x64	N4quda9CopyGaugeINS_12CopyGaugeArgIfdLi18ELb0ENS_5gauge11FloatNOrderIfLi18ELi4ELi12EL20QudaStaggeredPhase_s0ELb1EL19QudaGhostExchange_sn2147483648ELb0EEENS3_IdLi18ELi2ELi12ELS4_0ELb1ELS5_n2147483648ELb0EEEEEEE	GPU-offline,cmem,vol=262144stride=147456precision=8geometry=4Nc=3,vol=262144stride=147456precision=4geometry=4Nc=3,ghost	128	1	8	128	1	1	0	-1	-1	-1	-1	1.39773e-05	# 0.00 Gflop/s, 712.10 GB/s, tuning took 0.043720 seconds at Thu Mar 14 14:05:35 2024
      8x16x32x64	N4quda9CopyGaugeINS_12CopyGaugeArgIsdLi18ELb0ENS_5gauge11FloatNOrderIsLi18ELi4ELi12EL20QudaStaggeredPhase_s0ELb1EL19QudaGhostExchange_sn2147483648ELb0EEENS3_IdLi18ELi2ELi12ELS4_0ELb1ELS5_n2147483648ELb0EEEEEEE	GPU-offline,cmem,vol=262144stride=147456precision=8geometry=4Nc=3,vol=262144stride=147456precision=2geometry=4Nc=3	224	1	1	586	1	8	0	-1	-1	-1	-1	0.000157006	# 0.00 Gflop/s, 901.61 GB/s, tuning took 0.299674 seconds at Thu Mar 14 14:05:34 2024
      8x16x32x64	N4quda9CopyGaugeINS_12CopyGaugeArgIsdLi18ELb0ENS_5gauge11FloatNOrderIsLi18ELi4ELi12EL20QudaStaggeredPhase_s0ELb1EL19QudaGhostExchange_sn2147483648ELb0EEENS3_IdLi18ELi2ELi12ELS4_0ELb1ELS5_n2147483648ELb0EEEEEEE	GPU-offline,cmem,vol=262144stride=147456precision=8geometry=4Nc=3,vol=262144stride=147456precision=2geometry=4Nc=3,ghost	192	1	3	86	1	3	16385	-1	-1	-1	-1	1.07246e-05	# 0.00 Gflop/s, 773.40 GB/s, tuning took 0.048921 seconds at Thu Mar 14 14:05:34 2024
      8x32x32x32	N4quda15CopyColorSpinorILi4ELi3ENS_11colorspinor11FloatNOrderIdLi4ELi3ELi2ELb0ELb0EEENS1_21SpaceSpinorColorOrderIdLi4ELi3EEESt5tupleIJRNS_16ColorSpinorFieldERKS7_19QudaFieldLocation_sPdPKdEEEE	GPU-offline,cmem,vol=262144,parity=1,precision=8,order=9,Ns=4,Nc=3vol=262144,parity=1,precision=8,order=2,Ns=4,Nc=3,NonRelBasis	864	1	1	304	1	1	0	-1	-1	-1	-1	0.00013824	# 0.00 Gflop/s, 728.18 GB/s, tuning took 0.025252 seconds at Thu Mar 14 15:03:33 2024
      8x32x32x32	N4quda15CopyColorSpinorILi4ELi3ENS_11colorspinor21SpaceSpinorColorOrderIdLi4ELi3EEENS1_11FloatNOrderIdLi4ELi3ELi2ELb0ELb0EEESt5tupleIJRNS_16ColorSpinorFieldERKS7_19QudaFieldLocation_sPdPKdEEEE	GPU-offline,cmem,vol=262144,parity=1,precision=8,order=2,Ns=4,Nc=3vol=262144,parity=1,precision=8,order=9,Ns=4,Nc=3,RelBasis	608	1	1	432	1	1	0	-1	-1	-1	-1	0.000130688	# 0.00 Gflop/s, 770.26 GB/s, tuning took 0.023086 seconds at Thu Mar 14 15:03:54 2024
      8x32x32x32	N4quda4PackIdLi3ELb1EEE	policy_kernel,vol=262144,parity=1,precision=8,order=2,Ns=4,Nc=3,comm=1001,topo=2112,nFace=1,device-device	576	1	1	120	1	1	0	-1	-1	-1	-1	4.56611e-05	# 12.92 Gflop/s, 310.02 GB/s, tuning took 1.107798 seconds at Thu Mar 14 15:03:34 2024
      8x32x32x32	N4quda4PackIdLi3ELb1EEE	policy_kernel,vol=262144,parity=1,precision=8,order=2,Ns=4,Nc=3,comm=1001,topo=2112,nFace=1,device-remote	704	1	1	120	1	1	0	-1	-1	-1	-1	4.54749e-05	# 12.97 Gflop/s, 311.29 GB/s, tuning took 1.109067 seconds at Thu Mar 14 15:03:49 2024
      8x32x32x32	N4quda4PackIdLi3ELb1EEE	policy_kernel,vol=262144,parity=1,precision=8,order=2,Ns=4,Nc=3,comm=1001,topo=2112,nFace=1,host-device	96	1	1	6	1	1	0	-1	-1	-1	-1	0.000443392	# 1.33 Gflop/s, 31.93 GB/s, tuning took 0.247294 seconds at Thu Mar 14 15:03:42 2024
      8x32x32x32	N4quda4PackIdLi3ELb1EEE	policy_kernel,vol=262144,parity=1,precision=8,order=2,Ns=4,Nc=3,comm=1001,topo=2112,nFace=1,host-host	128	1	1	4	1	1	0	-1	-1	-1	-1	0.000445099	# 1.33 Gflop/s, 31.80 GB/s, tuning took 0.246898 seconds at Thu Mar 14 15:03:35 2024
      8x32x32x32	N4quda4PackIdLi3ELb1EEE	policy_kernel,vol=262144,parity=1,precision=8,order=2,Ns=4,Nc=3,comm=1001,topo=2112,nFace=1,host-remote	64	1	1	6	1	1	0	-1	-1	-1	-1	0.000450219	# 1.31 Gflop/s, 31.44 GB/s, tuning took 0.246408 seconds at Thu Mar 14 15:03:49 2024
      8x32x32x32	N4quda6WilsonINS_9WilsonArgIdLi3ELi4EL21QudaReconstructType_s12EEEEE	policy,GPU-offline,vol=262144,parity=1,precision=8,order=2,Ns=4,Nc=3,commDim=1001,topo=2112,p2p=3,gdr=0,nvshmem=0,pol=110000111100110000	32	1	1	1	1	1	0	8	1	0	-1	0.0023808	# 145.34 Gflop/s, 253.69 GB/s, tuning took 0.321336 seconds at Thu Mar 14 15:03:54 2024
      8x32x32x32	N4quda6WilsonINS_9WilsonArgIdLi3ELi4EL21QudaReconstructType_s12EEEEE	policy_kernel=exterior_all,GPU-offline,vol=262144,parity=1,precision=8,order=2,Ns=4,Nc=3,commDim=1001	128	1	1	384	1	1	32769	-1	-1	-1	-1	0.000117419	# 75.35 Gflop/s, 241.12 GB/s, tuning took 0.176092 seconds at Thu Mar 14 15:03:35 2024
      8x32x32x32	N4quda6WilsonINS_9WilsonArgIdLi3ELi4EL21QudaReconstructType_s12EEEEE	policy_kernel=exterior_all,GPU-offline,vol=262144,parity=1,precision=8,order=2,Ns=4,Nc=3,commDim=1001,zero_copy,p2p=0	32	1	1	1536	1	1	32769	-1	-1	-1	-1	0.000506197	# 17.48 Gflop/s, 55.93 GB/s, tuning took 0.689118 seconds at Thu Mar 14 15:03:37 2024
      8x32x32x32	N4quda6WilsonINS_9WilsonArgIdLi3ELi4EL21QudaReconstructType_s12EEEEE	policy_kernel=exterior_all,GPU-offline,vol=262144,parity=1,precision=8,order=2,Ns=4,Nc=3,commDim=1001,zero_copy,p2p=1	32	1	1	1536	1	1	32769	-1	-1	-1	-1	0.000500736	# 17.67 Gflop/s, 56.54 GB/s, tuning took 0.685275 seconds at Thu Mar 14 15:03:43 2024
      8x32x32x32	N4quda6WilsonINS_9WilsonArgIdLi3ELi4EL21QudaReconstructType_s12EEEEE	policy_kernel=exterior_t,GPU-offline,vol=262144,parity=1,precision=8,order=2,Ns=4,Nc=3,commDim=1001	208	1	1	79	1	1	14044	-1	-1	-1	-1	9.85872e-06	# 299.14 Gflop/s, 957.24 GB/s, tuning took 0.029194 seconds at Thu Mar 14 15:03:35 2024
      8x32x32x32	N4quda6WilsonINS_9WilsonArgIdLi3ELi4EL21QudaReconstructType_s12EEEEE	policy_kernel=exterior_t,GPU-offline,vol=262144,parity=1,precision=8,order=2,Ns=4,Nc=3,commDim=1001,zero_copy,p2p=0	32	1	1	512	1	1	19661	-1	-1	-1	-1	0.000153015	# 19.27 Gflop/s, 61.67 GB/s, tuning took 0.210343 seconds at Thu Mar 14 15:03:36 2024
      8x32x32x32	N4quda6WilsonINS_9WilsonArgIdLi3ELi4EL21QudaReconstructType_s12EEEEE	policy_kernel=exterior_t,GPU-offline,vol=262144,parity=1,precision=8,order=2,Ns=4,Nc=3,commDim=1001,zero_copy,p2p=1	16	1	1	1024	1	1	24577	-1	-1	-1	-1	0.00015243	# 19.35 Gflop/s, 61.91 GB/s, tuning took 0.209063 seconds at Thu Mar 14 15:03:42 2024
      8x32x32x32	N4quda6WilsonINS_9WilsonArgIdLi3ELi4EL21QudaReconstructType_s12EEEEE	policy_kernel=exterior_x,GPU-offline,vol=262144,parity=1,precision=8,order=2,Ns=4,Nc=3,commDim=1001	16	1	1	2048	1	1	49153	-1	-1	-1	-1	0.000109363	# 53.93 Gflop/s, 172.58 GB/s, tuning took 0.169306 seconds at Thu Mar 14 15:03:35 2024
      8x32x32x32	N4quda6WilsonINS_9WilsonArgIdLi3ELi4EL21QudaReconstructType_s12EEEEE	policy_kernel=exterior_x,GPU-offline,vol=262144,parity=1,precision=8,order=2,Ns=4,Nc=3,commDim=1001,zero_copy,p2p=0	16	1	1	2048	1	1	32769	-1	-1	-1	-1	0.00032128	# 18.36 Gflop/s, 58.75 GB/s, tuning took 0.515659 seconds at Thu Mar 14 15:03:36 2024
      8x32x32x32	N4quda6WilsonINS_9WilsonArgIdLi3ELi4EL21QudaReconstructType_s12EEEEE	policy_kernel=exterior_x,GPU-offline,vol=262144,parity=1,precision=8,order=2,Ns=4,Nc=3,commDim=1001,zero_copy,p2p=1	16	1	1	2048	1	1	32769	-1	-1	-1	-1	0.000319744	# 18.45 Gflop/s, 59.03 GB/s, tuning took 0.515931 seconds at Thu Mar 14 15:03:43 2024
      8x32x32x32	N4quda6WilsonINS_9WilsonArgIdLi3ELi4EL21QudaReconstructType_s12EEEEE	policy_kernel=interior,GPU-offline,vol=262144,parity=1,precision=8,order=2,Ns=4,Nc=3,commDim=1001,comm=1001	128	1	1	2048	1	1	49153	-1	-1	-1	-1	0.000516437	# 655.19 Gflop/s, 1114.69 GB/s, tuning took 0.695482 seconds at Thu Mar 14 15:03:35 2024
      8x32x32x32	N4quda6WilsonINS_9WilsonArgIdLi3ELi4EL21QudaReconstructType_s12EEEEE	policy_kernel=interior,GPU-offline,vol=262144,parity=1,precision=8,order=2,Ns=4,Nc=3,commDim=1001,comm=1001,host-device	32	1	1	8192	1	1	19661	3	-1	-1	-1	0.000659456	# 513.99 Gflop/s, 894.41 GB/s, tuning took 4.419377 seconds at Thu Mar 14 15:03:48 2024
      8x32x32x32	N4quda6WilsonINS_9WilsonArgIdLi3ELi4EL21QudaReconstructType_s12EEEEE	policy_kernel=interior,GPU-offline,vol=262144,parity=1,precision=8,order=2,Ns=4,Nc=3,commDim=1001,comm=1001,host-host	32	1	1	8192	1	1	19661	3	-1	-1	-1	0.000641707	# 528.20 Gflop/s, 919.15 GB/s, tuning took 4.423894 seconds at Thu Mar 14 15:03:41 2024
      8x32x32x32	N4quda6WilsonINS_9WilsonArgIdLi3ELi4EL21QudaReconstructType_s12EEEEE	policy_kernel=interior,GPU-offline,vol=262144,parity=1,precision=8,order=2,Ns=4,Nc=3,commDim=1001,comm=1001,host-remote	32	1	1	8192	1	1	19661	3	-1	-1	-1	0.000621568	# 545.32 Gflop/s, 948.93 GB/s, tuning took 4.421989 seconds at Thu Mar 14 15:03:54 2024
      8x32x32x64	N4quda15CopyColorSpinorILi4ELi3ENS_11colorspinor11FloatNOrderIdLi4ELi3ELi2ELb0ELb0EEENS1_21SpaceSpinorColorOrderIdLi4ELi3EEESt5tupleIJRNS_16ColorSpinorFieldERKS7_19QudaFieldLocation_sPdPKdEEEE	GPU-offline,cmem,vol=524288,parity=1,precision=8,order=9,Ns=4,Nc=3vol=524288,parity=1,precision=8,order=2,Ns=4,Nc=3,NonRelBasis	864	1	1	607	1	1	0	-1	-1	-1	-1	0.000274968	# 0.00 Gflop/s, 732.18 GB/s, tuning took 0.038380 seconds at Thu Mar 14 15:46:47 2024
      8x32x32x64	N4quda15CopyColorSpinorILi4ELi3ENS_11colorspinor21SpaceSpinorColorOrderIdLi4ELi3EEENS1_11FloatNOrderIdLi4ELi3ELi2ELb0ELb0EEESt5tupleIJRNS_16ColorSpinorFieldERKS7_19QudaFieldLocation_sPdPKdEEEE	GPU-offline,cmem,vol=524288,parity=1,precision=8,order=2,Ns=4,Nc=3vol=524288,parity=1,precision=8,order=9,Ns=4,Nc=3,RelBasis	704	1	1	745	1	1	0	-1	-1	-1	-1	0.00026308	# 0.00 Gflop/s, 765.27 GB/s, tuning took 0.034693 seconds at Thu Mar 14 15:47:43 2024
      8x32x32x64	N4quda4PackIdLi3ELb1EEE	policy_kernel,vol=524288,parity=1,precision=8,order=2,Ns=4,Nc=3,comm=1000,topo=2111,nFace=1,device-device	832	1	1	80	1	1	0	-1	-1	-1	-1	7.65612e-05	# 10.27 Gflop/s, 246.53 GB/s, tuning took 1.730862 seconds at Thu Mar 14 15:46:48 2024
      8x32x32x64	N4quda4PackIdLi3ELb1EEE	policy_kernel,vol=524288,parity=1,precision=8,order=2,Ns=4,Nc=3,comm=1000,topo=2111,nFace=1,device-remote	96	1	1	17	1	1	0	-1	-1	-1	-1	0.000145385	# 5.41 Gflop/s, 129.82 GB/s, tuning took 2.630437 seconds at Thu Mar 14 15:47:27 2024
      8x32x32x64	N4quda4PackIdLi3ELb1EEE	policy_kernel,vol=524288,parity=1,precision=8,order=2,Ns=4,Nc=3,comm=1000,topo=2111,nFace=1,host-device	128	1	1	3	1	1	0	-1	-1	-1	-1	0.000538123	# 1.46 Gflop/s, 35.07 GB/s, tuning took 0.280075 seconds at Thu Mar 14 15:47:08 2024
      8x32x32x64	N4quda4PackIdLi3ELb1EEE	policy_kernel,vol=524288,parity=1,precision=8,order=2,Ns=4,Nc=3,comm=1000,topo=2111,nFace=1,host-host	256	1	1	3	1	1	0	-1	-1	-1	-1	0.000505845	# 1.55 Gflop/s, 37.31 GB/s, tuning took 0.264769 seconds at Thu Mar 14 15:46:51 2024
      8x32x32x64	N4quda4PackIdLi3ELb1EEE	policy_kernel,vol=524288,parity=1,precision=8,order=2,Ns=4,Nc=3,comm=1000,topo=2111,nFace=1,host-remote	256	1	1	3	1	1	0	-1	-1	-1	-1	0.000493269	# 1.59 Gflop/s, 38.26 GB/s, tuning took 0.263238 seconds at Thu Mar 14 15:47:27 2024
      8x32x32x64	N4quda6WilsonINS_9WilsonArgIdLi3ELi4EL21QudaReconstructType_s12EEEEE	policy,GPU-offline,vol=524288,parity=1,precision=8,order=2,Ns=4,Nc=3,commDim=1000,topo=2111,p2p=3,gdr=0,nvshmem=0,pol=110000111100110000	32	1	1	1	1	1	0	12	2	0	-1	0.00131833	# 524.95 Gflop/s, 916.28 GB/s, tuning took 0.219533 seconds at Thu Mar 14 15:47:43 2024
      8x32x32x64	N4quda6WilsonINS_9WilsonArgIdLi3ELi4EL21QudaReconstructType_s12EEEEE	policy_kernel=exterior_all,GPU-offline,vol=524288,parity=1,precision=8,order=2,Ns=4,Nc=3,commDim=1000	96	1	1	683	1	1	49153	-1	-1	-1	-1	0.000211891	# 55.67 Gflop/s, 178.15 GB/s, tuning took 0.308457 seconds at Thu Mar 14 15:46:51 2024
      8x32x32x64	N4quda6WilsonINS_9WilsonArgIdLi3ELi4EL21QudaReconstructType_s12EEEEE	policy_kernel=exterior_all,GPU-offline,vol=524288,parity=1,precision=8,order=2,Ns=4,Nc=3,commDim=1000,zero_copy,p2p=0	16	1	1	4096	1	1	32769	-1	-1	-1	-1	0.000539477	# 21.87 Gflop/s, 69.97 GB/s, tuning took 0.689420 seconds at Thu Mar 14 15:46:52 2024
      8x32x32x64	N4quda6WilsonINS_9WilsonArgIdLi3ELi4EL21QudaReconstructType_s12EEEEE	policy_kernel=exterior_all,GPU-offline,vol=524288,parity=1,precision=8,order=2,Ns=4,Nc=3,commDim=1000,zero_copy,p2p=1	96	1	1	683	1	1	49153	-1	-1	-1	-1	0.000210426	# 56.06 Gflop/s, 179.39 GB/s, tuning took 0.309552 seconds at Thu Mar 14 15:47:09 2024
      8x32x32x64	N4quda6WilsonINS_9WilsonArgIdLi3ELi4EL21QudaReconstructType_s12EEEEE	policy_kernel=exterior_x,GPU-offline,vol=524288,parity=1,precision=8,order=2,Ns=4,Nc=3,commDim=1000	16	1	1	4096	1	1	49153	-1	-1	-1	-1	0.000210957	# 55.92 Gflop/s, 178.94 GB/s, tuning took 0.306489 seconds at Thu Mar 14 15:46:50 2024
      8x32x32x64	N4quda6WilsonINS_9WilsonArgIdLi3ELi4EL21QudaReconstructType_s12EEEEE	policy_kernel=exterior_x,GPU-offline,vol=524288,parity=1,precision=8,order=2,Ns=4,Nc=3,commDim=1000,zero_copy,p2p=0	32	1	1	2048	1	1	49153	-1	-1	-1	-1	0.00052416	# 22.51 Gflop/s, 72.02 GB/s, tuning took 0.657902 seconds at Thu Mar 14 15:46:52 2024
      8x32x32x64	N4quda6WilsonINS_9WilsonArgIdLi3ELi4EL21QudaReconstructType_s12EEEEE	policy_kernel=exterior_x,GPU-offline,vol=524288,parity=1,precision=8,order=2,Ns=4,Nc=3,commDim=1000,zero_copy,p2p=1	16	1	1	4096	1	1	49153	-1	-1	-1	-1	0.000209158	# 56.40 Gflop/s, 180.48 GB/s, tuning took 0.305505 seconds at Thu Mar 14 15:47:09 2024
      8x32x32x64	N4quda6WilsonINS_9WilsonArgIdLi3ELi4EL21QudaReconstructType_s12EEEEE	policy_kernel=interior,GPU-offline,vol=524288,parity=1,precision=8,order=2,Ns=4,Nc=3,commDim=1000,comm=1000	128	1	1	4096	1	1	49153	-1	-1	-1	-1	0.00104204	# 654.33 Gflop/s, 1123.00 GB/s, tuning took 1.392458 seconds at Thu Mar 14 15:46:50 2024
      8x32x32x64	N4quda6WilsonINS_9WilsonArgIdLi3ELi4EL21QudaReconstructType_s12EEEEE	policy_kernel=interior,GPU-offline,vol=524288,parity=1,precision=8,order=2,Ns=4,Nc=3,commDim=1000,comm=1000,host-device	64	1	1	8192	1	1	32769	2	-1	-1	-1	0.00108526	# 629.00 Gflop/s, 1095.67 GB/s, tuning took 15.502466 seconds at Thu Mar 14 15:47:25 2024
      8x32x32x64	N4quda6WilsonINS_9WilsonArgIdLi3ELi4EL21QudaReconstructType_s12EEEEE	policy_kernel=interior,GPU-offline,vol=524288,parity=1,precision=8,order=2,Ns=4,Nc=3,commDim=1000,comm=1000,host-host	64	1	1	8192	1	1	32769	2	-1	-1	-1	0.00107872	# 632.81 Gflop/s, 1102.31 GB/s, tuning took 15.469634 seconds at Thu Mar 14 15:47:08 2024
      8x32x32x64	N4quda6WilsonINS_9WilsonArgIdLi3ELi4EL21QudaReconstructType_s12EEEEE	policy_kernel=interior,GPU-offline,vol=524288,parity=1,precision=8,order=2,Ns=4,Nc=3,commDim=1000,comm=1000,host-remote	64	1	1	8192	1	1	32769	2	-1	-1	-1	0.00108057	# 631.73 Gflop/s, 1100.43 GB/s, tuning took 15.273868 seconds at Thu Mar 14 15:47:43 2024
  bytes=11206656	cudaMemset	allocateGhostBuffer,lattice_field.cpp,288	32	1	1	1	1	1	0	-1	-1	-1	-1	1.70112e-05	# 0.00 Gflop/s, 658.78 GB/s, tuning took 0.001059 seconds at Thu Mar 14 15:52:05 2024
  bytes=11206656	cudaMemset	allocateGhostBuffer,lattice_field.cpp,293	32	1	1	1	1	1	0	-1	-1	-1	-1	1.6704e-05	# 0.00 Gflop/s, 670.90 GB/s, tuning took 0.001012 seconds at Thu Mar 14 15:52:05 2024
  bytes=12582912	cudaMemset	allocateGhostBuffer,lattice_field.cpp,288	32	1	1	1	1	1	0	-1	-1	-1	-1	1.8382e-05	# 0.00 Gflop/s, 684.52 GB/s, tuning took 0.001843 seconds at Thu Mar 14 15:42:40 2024
  bytes=12582912	cudaMemset	allocateGhostBuffer,lattice_field.cpp,293	32	1	1	1	1	1	0	-1	-1	-1	-1	1.86554e-05	# 0.00 Gflop/s, 674.49 GB/s, tuning took 0.001083 seconds at Thu Mar 14 15:42:40 2024
  bytes=14155776	cudaMemset	allocateGhostBuffer,lattice_field.cpp,288	32	1	1	1	1	1	0	-1	-1	-1	-1	2.01239e-05	# 0.00 Gflop/s, 703.43 GB/s, tuning took 0.001542 seconds at Thu Mar 14 15:46:36 2024
  bytes=14155776	cudaMemset	allocateGhostBuffer,lattice_field.cpp,293	32	1	1	1	1	1	0	-1	-1	-1	-1	1.99533e-05	# 0.00 Gflop/s, 709.44 GB/s, tuning took 0.001081 seconds at Thu Mar 14 15:46:36 2024
 bytes=150994944	cudaMemcpyDefault	copy,cuda_gauge_field.cpp,576	32	1	1	1	1	1	0	-1	-1	-1	-1	0.000393237	# 0.00 Gflop/s, 383.98 GB/s, tuning took 0.003159 seconds at Thu Mar 14 15:42:38 2024
 bytes=150994944	cudaMemcpyDefault	saveCPUField,cuda_gauge_field.cpp,658	32	1	1	1	1	1	0	-1	-1	-1	-1	0.000392853	# 0.00 Gflop/s, 384.35 GB/s, tuning took 0.004070 seconds at Thu Mar 14 15:42:50 2024
   bytes=1572864	cudaMemcpyDeviceToDevice	exchangeGhost,cuda_gauge_field.cpp,193	32	1	1	1	1	1	0	-1	-1	-1	-1	4.49543e-06	# 0.00 Gflop/s, 699.76 GB/s, tuning took 0.000831 seconds at Thu Mar 14 14:05:34 2024
  bytes=18874368	cudaMemcpyDefault	copy,cuda_gauge_field.cpp,576	32	1	1	1	1	1	0	-1	-1	-1	-1	5.3915e-05	# 0.00 Gflop/s, 350.08 GB/s, tuning took 0.008190 seconds at Thu Mar 14 13:16:13 2024
  bytes=18874368	cudaMemcpyDefault	saveCPUField,cuda_gauge_field.cpp,658	32	1	1	1	1	1	0	-1	-1	-1	-1	5.38611e-05	# 0.00 Gflop/s, 350.43 GB/s, tuning took 0.001450 seconds at Thu Mar 14 13:16:14 2024
  bytes=18874368	cudaMemset	allocateGhostBuffer,lattice_field.cpp,288	32	1	1	1	1	1	0	-1	-1	-1	-1	2.58503e-05	# 0.00 Gflop/s, 730.14 GB/s, tuning took 0.001171 seconds at Thu Mar 14 15:42:53 2024
  bytes=18874368	cudaMemset	allocateGhostBuffer,lattice_field.cpp,293	32	1	1	1	1	1	0	-1	-1	-1	-1	2.58162e-05	# 0.00 Gflop/s, 731.11 GB/s, tuning took 0.001098 seconds at Thu Mar 14 15:42:53 2024
    bytes=196608	cudaMemcpyDeviceToDevice	exchangeGhost,cuda_gauge_field.cpp,193	32	1	1	1	1	1	0	-1	-1	-1	-1	3.59809e-06	# 0.00 Gflop/s, 109.28 GB/s, tuning took 0.000846 seconds at Thu Mar 14 14:53:23 2024
   bytes=1966080	cudaMemcpyDeviceToDevice	exchangeGhost,cuda_gauge_field.cpp,193	32	1	1	1	1	1	0	-1	-1	-1	-1	3.39593e-06	# 0.00 Gflop/s, 1157.90 GB/s, tuning took 0.000497 seconds at Thu Mar 14 15:52:05 2024
  bytes=22020096	cudaMemset	allocateGhostBuffer,lattice_field.cpp,288	32	1	1	1	1	1	0	-1	-1	-1	-1	2.90304e-05	# 0.00 Gflop/s, 758.52 GB/s, tuning took 0.003022 seconds at Wed Mar 20 22:32:41 2024
  bytes=22020096	cudaMemset	allocateGhostBuffer,lattice_field.cpp,293	32	1	1	1	1	1	0	-1	-1	-1	-1	2.92941e-05	# 0.00 Gflop/s, 751.69 GB/s, tuning took 0.001154 seconds at Wed Mar 20 22:32:41 2024
   bytes=2752512	cudaMemset	allocateGhostBuffer,lattice_field.cpp,288	32	1	1	1	1	1	0	-1	-1	-1	-1	4.04e-06	# 0.00 Gflop/s, 681.31 GB/s, tuning took 0.000612 seconds at Thu Mar 14 13:16:13 2024
   bytes=2752512	cudaMemset	allocateGhostBuffer,lattice_field.cpp,293	32	1	1	1	1	1	0	-1	-1	-1	-1	3.70472e-06	# 0.00 Gflop/s, 742.97 GB/s, tuning took 0.000659 seconds at Thu Mar 14 13:16:13 2024
 bytes=301989888	cudaMemcpyDefault	copy,cuda_gauge_field.cpp,576	32	1	1	1	1	1	0	-1	-1	-1	-1	0.00078544	# 0.00 Gflop/s, 384.48 GB/s, tuning took 0.005909 seconds at Wed Mar 20 22:32:37 2024
 bytes=301989888	cudaMemcpyDefault	saveCPUField,cuda_gauge_field.cpp,658	32	1	1	1	1	1	0	-1	-1	-1	-1	0.000789141	# 0.00 Gflop/s, 382.68 GB/s, tuning took 0.008152 seconds at Wed Mar 20 22:33:02 2024
   bytes=3145728	cudaMemcpyDeviceToDevice	exchangeGhost,cuda_gauge_field.cpp,193	32	1	1	1	1	1	0	-1	-1	-1	-1	5.61367e-06	# 0.00 Gflop/s, 1120.74 GB/s, tuning took 0.000685 seconds at Thu Mar 14 14:05:34 2024
  bytes=37748736	cudaMemcpyDefault	copy,cuda_gauge_field.cpp,576	32	1	1	1	1	1	0	-1	-1	-1	-1	0.000101629	# 0.00 Gflop/s, 371.44 GB/s, tuning took 0.001978 seconds at Thu Mar 14 14:05:33 2024
  bytes=37748736	cudaMemcpyDefault	saveCPUField,cuda_gauge_field.cpp,658	32	1	1	1	1	1	0	-1	-1	-1	-1	0.000101152	# 0.00 Gflop/s, 373.19 GB/s, tuning took 0.001781 seconds at Thu Mar 14 14:05:37 2024
    bytes=393216	cudaMemcpyDeviceToDevice	exchangeGhost,cuda_gauge_field.cpp,193	32	1	1	1	1	1	0	-1	-1	-1	-1	4.17576e-06	# 0.00 Gflop/s, 188.33 GB/s, tuning took 0.000906 seconds at Thu Mar 14 13:16:13 2024
   bytes=4718592	cudaMemcpyDefault	copy,cuda_gauge_field.cpp,576	32	1	1	1	1	1	0	-1	-1	-1	-1	1.73035e-05	# 0.00 Gflop/s, 272.70 GB/s, tuning took 0.001443 seconds at Thu Mar 14 14:53:23 2024
   bytes=4718592	cudaMemcpyDefault	saveCPUField,cuda_gauge_field.cpp,658	32	1	1	1	1	1	0	-1	-1	-1	-1	1.67863e-05	# 0.00 Gflop/s, 281.10 GB/s, tuning took 0.001073 seconds at Thu Mar 14 14:53:24 2024
   bytes=4718592	cudaMemcpyDeviceToDevice	exchangeGhost,cuda_gauge_field.cpp,193	32	1	1	1	1	1	0	-1	-1	-1	-1	1.69812e-05	# 0.00 Gflop/s, 555.74 GB/s, tuning took 0.001120 seconds at Thu Mar 14 15:42:53 2024
   bytes=5898240	cudaMemset	allocateGhostBuffer,lattice_field.cpp,288	32	1	1	1	1	1	0	-1	-1	-1	-1	9.8012e-06	# 0.00 Gflop/s, 601.79 GB/s, tuning took 0.000974 seconds at Thu Mar 14 14:05:34 2024
   bytes=5898240	cudaMemset	allocateGhostBuffer,lattice_field.cpp,293	32	1	1	1	1	1	0	-1	-1	-1	-1	9.21891e-06	# 0.00 Gflop/s, 639.80 GB/s, tuning took 0.000998 seconds at Thu Mar 14 14:05:34 2024
   bytes=6291456	cudaMemcpyDeviceToDevice	exchangeGhost,cuda_gauge_field.cpp,193	32	1	1	1	1	1	0	-1	-1	-1	-1	2.12014e-05	# 0.00 Gflop/s, 593.49 GB/s, tuning took 0.001111 seconds at Wed Mar 20 22:32:42 2024
  bytes=75497472	cudaMemcpyDefault	copy,cuda_gauge_field.cpp,576	32	1	1	1	1	1	0	-1	-1	-1	-1	0.000199885	# 0.00 Gflop/s, 377.70 GB/s, tuning took 0.002360 seconds at Thu Mar 14 15:03:27 2024
  bytes=75497472	cudaMemcpyDefault	saveCPUField,cuda_gauge_field.cpp,658	32	1	1	1	1	1	0	-1	-1	-1	-1	0.000199168	# 0.00 Gflop/s, 379.06 GB/s, tuning took 0.002438 seconds at Thu Mar 14 15:03:33 2024
    bytes=786432	cudaMemcpyDeviceToDevice	exchangeGhost,cuda_gauge_field.cpp,193	32	1	1	1	1	1	0	-1	-1	-1	-1	3.92242e-06	# 0.00 Gflop/s, 400.99 GB/s, tuning took 0.000629 seconds at Thu Mar 14 13:16:13 2024
   bytes=7864320	cudaMemset	allocateGhostBuffer,lattice_field.cpp,288	32	1	1	1	1	1	0	-1	-1	-1	-1	1.2793e-05	# 0.00 Gflop/s, 614.74 GB/s, tuning took 0.001054 seconds at Thu Mar 14 15:03:28 2024
   bytes=7864320	cudaMemset	allocateGhostBuffer,lattice_field.cpp,293	32	1	1	1	1	1	0	-1	-1	-1	-1	1.25861e-05	# 0.00 Gflop/s, 624.84 GB/s, tuning took 0.001091 seconds at Thu Mar 14 15:03:28 2024
  bytes=94371840	cudaMemcpyDefault	copy,cuda_gauge_field.cpp,576	32	1	1	1	1	1	0	-1	-1	-1	-1	0.000247443	# 0.00 Gflop/s, 381.39 GB/s, tuning took 0.002532 seconds at Thu Mar 14 15:52:03 2024
  bytes=94371840	cudaMemcpyDefault	saveCPUField,cuda_gauge_field.cpp,658	32	1	1	1	1	1	0	-1	-1	-1	-1	0.000247309	# 0.00 Gflop/s, 381.60 GB/s, tuning took 0.002513 seconds at Thu Mar 14 15:52:11 2024
    bytes=983040	cudaMemcpyDeviceToDevice	exchangeGhost,cuda_gauge_field.cpp,193	32	1	1	1	1	1	0	-1	-1	-1	-1	3.39604e-06	# 0.00 Gflop/s, 578.93 GB/s, tuning took 0.000675 seconds at Thu Mar 14 15:52:05 2024
    bytes=983040	cudaMemset	allocateGhostBuffer,lattice_field.cpp,288	32	1	1	1	1	1	0	-1	-1	-1	-1	2.80895e-06	# 0.00 Gflop/s, 349.97 GB/s, tuning took 0.000718 seconds at Thu Mar 14 14:53:23 2024
    bytes=983040	cudaMemset	allocateGhostBuffer,lattice_field.cpp,293	32	1	1	1	1	1	0	-1	-1	-1	-1	2.98841e-06	# 0.00 Gflop/s, 328.95 GB/s, tuning took 0.000639 seconds at Thu Mar 14 14:53:23 2024
