test/.cache/tunecache.tsv
tunecache	1.1.0	1.1.0--sm_80	cpu_arch=x86_64,gpu_arch=sm_80,cuda_version=11.4.152	# Last updated Mon Aug 19 22:05:30 2024

          volume	name	aux	block.x	block.y	block.z	grid.x	grid.y	grid.z	shared_bytes	aux.x	aux.y	aux.z	aux.w	time	comment
     16x16x16x16	N4quda10GaugeGaussIdLi3EL21QudaReconstructType_s12EEE	GPU-offline,vol=65536stride=34816precision=8geometry=4Nc=3,lie_group	32	1	1	1024	2	1	0	-1	-1	-1	-1	0.000108237	# 0.00 Gflop/s, 247.04 GB/s, tuning took 0.151038 seconds at Mon Aug 19 22:04:55 2024
     16x16x16x16	N4quda12ExtractGhostIdLi3ENS_5gauge11FloatNOrderIdLi18ELi2ELi12EL20QudaStaggeredPhase_s0ELb1EL19QudaGhostExchange_sn2147483648ELb0EEEEE	GPU-offline,vol=65536stride=34816precision=8geometry=4Nc=3,extract	32	1	2	128	1	4	1537	-1	-1	-1	-1	9.09617e-06	# 0.00 Gflop/s, 345.83 GB/s, tuning took 0.033876 seconds at Mon Aug 19 22:04:55 2024
     16x16x16x16	N4quda15CopyColorSpinorILi4ELi3ENS_11colorspinor11FloatNOrderIdLi4ELi3ELi2ELb0ELb0EEENS1_21SpaceSpinorColorOrderIdLi4ELi3EEESt5tupleIJRNS_16ColorSpinorFieldERKS7_19QudaFieldLocation_sPdPKdEEEE	GPU-offline,vol=65536,parity=2,precision=8,order=9,Ns=4,Nc=3vol=65536,parity=2,precision=8,order=2,Ns=4,Nc=3,NonRelBasis	128	1	1	256	2	1	0	-1	-1	-1	-1	1.05171e-05	# 0.00 Gflop/s, 2392.85 GB/s, tuning took 0.011990 seconds at Mon Aug 19 22:04:56 2024
     16x16x16x16	N4quda15CopyColorSpinorILi4ELi3ENS_11colorspinor21SpaceSpinorColorOrderIdLi4ELi3EEENS1_11FloatNOrderIdLi4ELi3ELi2ELb0ELb0EEESt5tupleIJRNS_16ColorSpinorFieldERKS7_19QudaFieldLocation_sPdPKdEEEE	GPU-offline,vol=65536,parity=2,precision=8,order=2,Ns=4,Nc=3vol=65536,parity=2,precision=8,order=9,Ns=4,Nc=3,RelBasis	64	2	1	512	1	1	0	-1	-1	-1	-1	1.0252e-05	# 0.00 Gflop/s, 2454.71 GB/s, tuning took 0.011364 seconds at Mon Aug 19 22:05:17 2024
     16x16x16x16	N4quda4PackIdLi3ELb1EEE	policy_kernel,vol=65536,parity=2,precision=8,order=2,Ns=4,Nc=3,comm=0001,topo=1112,order=01,nFace=1,device-device	320	1	1	24	1	2	0	-1	-1	-1	-1	5.28962e-06	# 18.58 Gflop/s, 446.02 GB/s, tuning took 0.341362 seconds at Mon Aug 19 22:05:17 2024
     16x16x16x16	N4quda4PackIdLi3ELb1EEE	policy_kernel,vol=65536,parity=2,precision=8,order=2,Ns=4,Nc=3,comm=0001,topo=1112,order=01,nFace=1,device-remote	32	1	1	1	1	2	0	-1	-1	-1	-1	0.000108851	# 0.90 Gflop/s, 21.67 GB/s, tuning took 4.182534 seconds at Mon Aug 19 22:05:25 2024
     16x16x16x16	N4quda4PackIdLi3ELb1EEE	policy_kernel,vol=65536,parity=2,precision=8,order=2,Ns=4,Nc=3,comm=0001,topo=1112,order=01,nFace=1,host-device	352	1	1	3	1	2	0	-1	-1	-1	-1	9.28914e-06	# 10.58 Gflop/s, 253.98 GB/s, tuning took 0.018694 seconds at Mon Aug 19 22:05:20 2024
     16x16x16x16	N4quda4PackIdLi3ELb1EEE	policy_kernel,vol=65536,parity=2,precision=8,order=2,Ns=4,Nc=3,comm=0001,topo=1112,order=01,nFace=1,host-host	64	1	2	1	1	1	0	-1	-1	-1	-1	6.432e-05	# 1.53 Gflop/s, 36.68 GB/s, tuning took 0.041596 seconds at Mon Aug 19 22:05:17 2024
     16x16x16x16	N4quda4PackIdLi3ELb1EEE	policy_kernel,vol=65536,parity=2,precision=8,order=2,Ns=4,Nc=3,comm=0001,topo=1112,order=01,nFace=1,host-remote	32	1	1	1	1	2	83457	-1	-1	-1	-1	0.000109363	# 0.90 Gflop/s, 21.57 GB/s, tuning took 0.066040 seconds at Mon Aug 19 22:05:25 2024
     16x16x16x16	N4quda4blas5Norm2IddEE	GPU-offline,nParity=2,vol=65536,parity=2,precision=8,order=2,Ns=4,Nc=3	640	1	1	192	1	1	0	-1	-1	-1	-1	1.20882e-05	# 260.23 Gflop/s, 1040.93 GB/s, tuning took 0.104965 seconds at Mon Aug 19 22:04:56 2024
     16x16x16x16	N4quda6WilsonINS_9WilsonArgIdLi3ELi4EL21QudaReconstructType_s12EEEEE	policy,commDim=0001,xpay,parity=2,topo=1112,order=01,p2p=3,gdr=0,nvshmem=0,pol=110000111100110000	32	1	1	1	1	1	0	0	1	0	-1	0.00013312	# 673.48 Gflop/s, 1134.28 GB/s, tuning took 0.037949 seconds at Mon Aug 19 22:05:28 2024
     16x16x16x16	N4quda6WilsonINS_9WilsonArgIdLi3ELi4EL21QudaReconstructType_s12EEEEE	policy_kernel=exterior_all,commDim=0001,xpay,parity=2	96	1	1	43	1	2	8785	-1	-1	-1	-1	8.0229e-06	# 208.30 Gflop/s, 588.14 GB/s, tuning took 0.033261 seconds at Mon Aug 19 22:05:17 2024
     16x16x16x16	N4quda6WilsonINS_9WilsonArgIdLi3ELi4EL21QudaReconstructType_s12EEEEE	policy_kernel=exterior_all,commDim=0001,xpay,parity=2,zero_copy,p2p=0	128	1	1	32	1	2	0	-1	-1	-1	-1	7.30697e-05	# 22.87 Gflop/s, 64.58 GB/s, tuning took 0.141476 seconds at Mon Aug 19 22:05:18 2024
     16x16x16x16	N4quda6WilsonINS_9WilsonArgIdLi3ELi4EL21QudaReconstructType_s12EEEEE	policy_kernel=exterior_all,commDim=0001,xpay,parity=2,zero_copy,p2p=1	112	1	1	37	1	2	11923	-1	-1	-1	-1	7.87144e-06	# 212.31 Gflop/s, 599.46 GB/s, tuning took 0.033440 seconds at Mon Aug 19 22:05:20 2024
     16x16x16x16	N4quda6WilsonINS_9WilsonArgIdLi3ELi4EL21QudaReconstructType_s12EEEEE	policy_kernel=exterior_t,commDim=0001,xpay,parity=2	32	1	1	128	1	2	5756	-1	-1	-1	-1	6.94322e-06	# 240.69 Gflop/s, 679.60 GB/s, tuning took 0.032199 seconds at Mon Aug 19 22:05:17 2024
     16x16x16x16	N4quda6WilsonINS_9WilsonArgIdLi3ELi4EL21QudaReconstructType_s12EEEEE	policy_kernel=exterior_t,commDim=0001,xpay,parity=2,zero_copy,p2p=0	32	1	1	128	1	2	23845	-1	-1	-1	-1	7.2192e-05	# 23.15 Gflop/s, 65.36 GB/s, tuning took 0.147729 seconds at Mon Aug 19 22:05:17 2024
     16x16x16x16	N4quda6WilsonINS_9WilsonArgIdLi3ELi4EL21QudaReconstructType_s12EEEEE	policy_kernel=exterior_t,commDim=0001,xpay,parity=2,zero_copy,p2p=1	32	1	1	128	1	2	5962	-1	-1	-1	-1	6.87096e-06	# 243.22 Gflop/s, 686.74 GB/s, tuning took 0.032277 seconds at Mon Aug 19 22:05:20 2024
     16x16x16x16	N4quda6WilsonINS_9WilsonArgIdLi3ELi4EL21QudaReconstructType_s12EEEEE	policy_kernel=interior,comm=0001,commDim=0001,xpay,parity=2	32	1	2	1024	1	1	0	-1	-1	-1	-1	4.98688e-05	# 1772.16 Gflop/s, 2933.23 GB/s, tuning took 0.122279 seconds at Mon Aug 19 22:05:17 2024
     16x16x16x16	N4quda6WilsonINS_9WilsonArgIdLi3ELi4EL21QudaReconstructType_s12EEEEE	policy_kernel=interior,comm=0001,commDim=0001,xpay,parity=2,host-device	64	1	2	512	1	1	0	4	-1	-1	-1	5.0176e-05	# 1763.27 Gflop/s, 2962.29 GB/s, tuning took 1.387775 seconds at Mon Aug 19 22:05:21 2024
     16x16x16x16	N4quda6WilsonINS_9WilsonArgIdLi3ELi4EL21QudaReconstructType_s12EEEEE	policy_kernel=interior,comm=0001,commDim=0001,xpay,parity=2,host-host	64	1	2	512	1	1	55638	1	-1	-1	-1	6.90859e-05	# 1280.63 Gflop/s, 2151.47 GB/s, tuning took 1.961209 seconds at Mon Aug 19 22:05:19 2024
     16x16x16x16	N4quda6WilsonINS_9WilsonArgIdLi3ELi4EL21QudaReconstructType_s12EEEEE	policy_kernel=interior,comm=0001,commDim=0001,xpay,parity=2,host-remote	32	1	1	1024	1	2	41729	1	-1	-1	-1	0.00011355	# 779.16 Gflop/s, 1308.99 GB/s, tuning took 2.588894 seconds at Mon Aug 19 22:05:28 2024
     16x16x16x16	N4quda7RNGInitE	GPU-offline,vol=65536stride=34816precision=8geometry=4Nc=3	320	2	1	103	1	1	0	-1	-1	-1	-1	0.000661163	# 0.00 Gflop/s, 0.00 GB/s, tuning took 0.108215 seconds at Mon Aug 19 22:04:55 2024
     16x16x16x16	N4quda9CopyGaugeINS_12CopyGaugeArgIddLi18ELb0ENS_5gauge11FloatNOrderIdLi18ELi2ELi12EL20QudaStaggeredPhase_s0ELb1EL19QudaGhostExchange_sn2147483648ELb0EEENS2_8QDPOrderIdLi18EEEEEEE	GPU-offline,vol=65536stride=32768precision=8geometry=4Nc=3,vol=65536stride=34816precision=8geometry=4Nc=3	64	1	7	512	1	2	0	-1	-1	-1	-1	5.47571e-05	# 0.00 Gflop/s, 1177.70 GB/s, tuning took 0.119959 seconds at Mon Aug 19 22:04:55 2024
     16x16x16x16	N4quda9CopyGaugeINS_12CopyGaugeArgIddLi18ELb0ENS_5gauge11FloatNOrderIdLi18ELi2ELi12EL20QudaStaggeredPhase_s0ELb1EL19QudaGhostExchange_sn2147483648ELb0EEES6_EEEE	GPU-offline,vol=65536stride=34816precision=8geometry=4Nc=3,vol=65536stride=34816precision=8geometry=4Nc=3,ghost	32	1	1	64	1	8	1821	-1	-1	-1	-1	8.03293e-06	# 0.00 Gflop/s, 416.08 GB/s, tuning took 0.030225 seconds at Mon Aug 19 22:04:55 2024
     16x16x16x16	N4quda9CopyGaugeINS_12CopyGaugeArgIddLi18ELb0ENS_5gauge8QDPOrderIdLi18EEENS2_11FloatNOrderIdLi18ELi2ELi12EL20QudaStaggeredPhase_s0ELb1EL19QudaGhostExchange_sn2147483648ELb0EEEEEEE	GPU-offline,vol=65536stride=34816precision=8geometry=4Nc=3,vol=65536stride=32768precision=8geometry=4Nc=3	32	1	1	1024	1	8	2138	-1	-1	-1	-1	5.21216e-05	# 0.00 Gflop/s, 1237.25 GB/s, tuning took 0.102563 seconds at Mon Aug 19 22:04:55 2024
     16x16x16x16	N4quda9CopyGaugeINS_12CopyGaugeArgIfdLi18ELb0ENS_5gauge11FloatNOrderIfLi18ELi4ELi12EL20QudaStaggeredPhase_s0ELb1EL19QudaGhostExchange_sn2147483648ELb0EEENS3_IdLi18ELi2ELi12ELS4_0ELb1ELS5_n2147483648ELb0EEEEEEE	GPU-offline,vol=65536stride=34816precision=8geometry=4Nc=3,vol=65536stride=34816precision=4geometry=4Nc=3	512	1	2	64	1	4	0	-1	-1	-1	-1	1.43174e-05	# 0.00 Gflop/s, 2801.35 GB/s, tuning took 0.058045 seconds at Mon Aug 19 22:04:55 2024
     16x16x16x16	N4quda9CopyGaugeINS_12CopyGaugeArgIfdLi18ELb0ENS_5gauge11FloatNOrderIfLi18ELi4ELi12EL20QudaStaggeredPhase_s0ELb1EL19QudaGhostExchange_sn2147483648ELb0EEENS3_IdLi18ELi2ELi12ELS4_0ELb1ELS5_n2147483648ELb0EEEEEEE	GPU-offline,vol=65536stride=34816precision=8geometry=4Nc=3,vol=65536stride=34816precision=4geometry=4Nc=3,ghost	32	1	1	64	1	8	2458	-1	-1	-1	-1	4.46993e-06	# 0.00 Gflop/s, 560.80 GB/s, tuning took 0.022019 seconds at Mon Aug 19 22:04:55 2024
     16x16x16x16	N4quda9CopyGaugeINS_12CopyGaugeArgIsdLi18ELb0ENS_5gauge11FloatNOrderIsLi18ELi4ELi12EL20QudaStaggeredPhase_s0ELb1EL19QudaGhostExchange_sn2147483648ELb0EEENS3_IdLi18ELi2ELi12ELS4_0ELb1ELS5_n2147483648ELb0EEEEEEE	GPU-offline,vol=65536stride=34816precision=8geometry=4Nc=3,vol=65536stride=34816precision=2geometry=4Nc=3	128	1	7	256	1	2	0	-1	-1	-1	-1	1.74853e-05	# 0.00 Gflop/s, 1911.51 GB/s, tuning took 0.065499 seconds at Mon Aug 19 22:04:55 2024
     16x16x16x16	N4quda9CopyGaugeINS_12CopyGaugeArgIsdLi18ELb0ENS_5gauge11FloatNOrderIsLi18ELi4ELi12EL20QudaStaggeredPhase_s0ELb1EL19QudaGhostExchange_sn2147483648ELb0EEENS3_IdLi18ELi2ELi12ELS4_0ELb1ELS5_n2147483648ELb0EEEEEEE	GPU-offline,vol=65536stride=34816precision=8geometry=4Nc=3,vol=65536stride=34816precision=2geometry=4Nc=3,ghost	64	1	1	32	1	8	2049	-1	-1	-1	-1	8.04287e-06	# 0.00 Gflop/s, 259.73 GB/s, tuning took 0.030187 seconds at Mon Aug 19 22:04:55 2024
      8x16x16x16	N4quda15CopyColorSpinorILi4ELi3ENS_11colorspinor11FloatNOrderIdLi4ELi3ELi2ELb0ELb0EEES3_St5tupleIJRNS_16ColorSpinorFieldERKS5_19QudaFieldLocation_sPdPKdEEEE	GPU-offline,vol=32768,parity=1,precision=8,order=2,Ns=4,Nc=3vol=32768,parity=1,precision=8,order=2,Ns=4,Nc=3,PreserveBasis	480	1	1	69	1	1	0	-1	-1	-1	-1	6.55047e-06	# 0.00 Gflop/s, 1920.92 GB/s, tuning took 0.010092 seconds at Mon Aug 19 22:05:00 2024
      8x16x16x16	N4quda15CopyColorSpinorILi4ELi3ENS_11colorspinor11FloatNOrderIsLi4ELi3ELi8ELb0ELb0EEENS2_IdLi4ELi3ELi2ELb0ELb0EEESt5tupleIJRNS_16ColorSpinorFieldERKS6_19QudaFieldLocation_sPsPKdEEEE	GPU-offline,vol=32768,parity=1,precision=8,order=2,Ns=4,Nc=3vol=32768,parity=1,precision=2,order=8,Ns=4,Nc=3,PreserveBasis	192	1	1	171	1	1	0	-1	-1	-1	-1	5.54723e-06	# 0.00 Gflop/s, 1441.33 GB/s, tuning took 0.009803 seconds at Mon Aug 19 22:05:07 2024
      8x16x16x16	N4quda15CopyColorSpinorILi4ELi3ENS_11colorspinor11FloatNOrderIsLi4ELi3ELi8ELb0ELb0EEES3_St5tupleIJRNS_16ColorSpinorFieldERKS5_19QudaFieldLocation_sPsPKsEEEE	GPU-offline,vol=32768,parity=1,precision=2,order=8,Ns=4,Nc=3vol=32768,parity=1,precision=2,order=8,Ns=4,Nc=3,PreserveBasis	192	1	1	171	1	1	0	-1	-1	-1	-1	4.7058e-06	# 0.00 Gflop/s, 724.19 GB/s, tuning took 0.009667 seconds at Mon Aug 19 22:05:07 2024
      8x16x16x16	N4quda4PackIdLi3ELb1EEE	policy_kernel,vol=32768,parity=1,precision=8,order=2,Ns=4,Nc=3,comm=0001,topo=1112,order=01,dagger,nFace=1,device-device	352	1	1	27	1	1	0	-1	-1	-1	-1	5.30847e-06	# 9.26 Gflop/s, 222.22 GB/s, tuning took 0.214852 seconds at Mon Aug 19 22:05:00 2024
      8x16x16x16	N4quda4PackIdLi3ELb1EEE	policy_kernel,vol=32768,parity=1,precision=8,order=2,Ns=4,Nc=3,comm=0001,topo=1112,order=01,dagger,nFace=1,device-remote	96	1	1	1	1	1	0	-1	-1	-1	-1	5.44427e-05	# 0.90 Gflop/s, 21.67 GB/s, tuning took 1.448783 seconds at Mon Aug 19 22:05:03 2024
      8x16x16x16	N4quda4PackIdLi3ELb1EEE	policy_kernel,vol=32768,parity=1,precision=8,order=2,Ns=4,Nc=3,comm=0001,topo=1112,order=01,dagger,nFace=1,host-device	352	1	1	3	1	1	0	-1	-1	-1	-1	9.11151e-06	# 5.39 Gflop/s, 129.47 GB/s, tuning took 0.014729 seconds at Mon Aug 19 22:05:01 2024
      8x16x16x16	N4quda4PackIdLi3ELb1EEE	policy_kernel,vol=32768,parity=1,precision=8,order=2,Ns=4,Nc=3,comm=0001,topo=1112,order=01,dagger,nFace=1,host-host	192	1	1	1	1	1	0	-1	-1	-1	-1	3.41804e-05	# 1.44 Gflop/s, 34.51 GB/s, tuning took 0.022031 seconds at Mon Aug 19 22:05:00 2024
      8x16x16x16	N4quda4PackIdLi3ELb1EEE	policy_kernel,vol=32768,parity=1,precision=8,order=2,Ns=4,Nc=3,comm=0001,topo=1112,order=01,dagger,nFace=1,host-remote	96	1	1	1	1	1	0	-1	-1	-1	-1	5.44996e-05	# 0.90 Gflop/s, 21.65 GB/s, tuning took 0.029270 seconds at Mon Aug 19 22:05:03 2024
      8x16x16x16	N4quda4PackIdLi3ELb1EEE	policy_kernel,vol=32768,parity=1,precision=8,order=2,Ns=4,Nc=3,comm=0001,topo=1112,order=01,nFace=1,device-device	512	1	1	23	1	1	0	-1	-1	-1	-1	5.28962e-06	# 9.29 Gflop/s, 223.01 GB/s, tuning took 0.213118 seconds at Mon Aug 19 22:04:56 2024
      8x16x16x16	N4quda4PackIdLi3ELb1EEE	policy_kernel,vol=32768,parity=1,precision=8,order=2,Ns=4,Nc=3,comm=0001,topo=1112,order=01,nFace=1,device-remote	64	1	1	1	1	1	0	-1	-1	-1	-1	5.41642e-05	# 0.91 Gflop/s, 21.78 GB/s, tuning took 1.457554 seconds at Mon Aug 19 22:04:59 2024
      8x16x16x16	N4quda4PackIdLi3ELb1EEE	policy_kernel,vol=32768,parity=1,precision=8,order=2,Ns=4,Nc=3,comm=0001,topo=1112,order=01,nFace=1,host-device	352	1	1	3	1	1	0	-1	-1	-1	-1	9.32049e-06	# 5.27 Gflop/s, 126.57 GB/s, tuning took 0.014807 seconds at Mon Aug 19 22:04:57 2024
      8x16x16x16	N4quda4PackIdLi3ELb1EEE	policy_kernel,vol=32768,parity=1,precision=8,order=2,Ns=4,Nc=3,comm=0001,topo=1112,order=01,nFace=1,host-host	160	1	1	1	1	1	0	-1	-1	-1	-1	3.43923e-05	# 1.43 Gflop/s, 34.30 GB/s, tuning took 0.022099 seconds at Mon Aug 19 22:04:56 2024
      8x16x16x16	N4quda4PackIdLi3ELb1EEE	policy_kernel,vol=32768,parity=1,precision=8,order=2,Ns=4,Nc=3,comm=0001,topo=1112,order=01,nFace=1,host-remote	64	1	1	1	1	1	0	-1	-1	-1	-1	5.38408e-05	# 0.91 Gflop/s, 21.91 GB/s, tuning took 0.030054 seconds at Mon Aug 19 22:04:59 2024
      8x16x16x16	N4quda4PackIsLi3ELb1EEE	policy_kernel,vol=32768,parity=1,precision=2,order=8,Ns=4,Nc=3,comm=0001,topo=1112,order=01,dagger,nFace=1,device-device	352	1	1	18	1	1	0	-1	-1	-1	-1	5.24564e-06	# 9.37 Gflop/s, 62.47 GB/s, tuning took 0.214220 seconds at Mon Aug 19 22:05:10 2024
      8x16x16x16	N4quda4PackIsLi3ELb1EEE	policy_kernel,vol=32768,parity=1,precision=2,order=8,Ns=4,Nc=3,comm=0001,topo=1112,order=01,dagger,nFace=1,device-remote	256	1	1	1	1	1	0	-1	-1	-1	-1	1.71287e-05	# 2.87 Gflop/s, 19.13 GB/s, tuning took 0.590839 seconds at Mon Aug 19 22:05:12 2024
      8x16x16x16	N4quda4PackIsLi3ELb1EEE	policy_kernel,vol=32768,parity=1,precision=2,order=8,Ns=4,Nc=3,comm=0001,topo=1112,order=01,dagger,nFace=1,host-device	864	1	1	3	1	1	0	-1	-1	-1	-1	7.18465e-06	# 6.84 Gflop/s, 45.61 GB/s, tuning took 0.013950 seconds at Mon Aug 19 22:05:11 2024
      8x16x16x16	N4quda4PackIsLi3ELb1EEE	policy_kernel,vol=32768,parity=1,precision=2,order=8,Ns=4,Nc=3,comm=0001,topo=1112,order=01,dagger,nFace=1,host-host	480	1	1	1	1	1	0	-1	-1	-1	-1	1.33998e-05	# 3.67 Gflop/s, 24.45 GB/s, tuning took 0.015917 seconds at Mon Aug 19 22:05:11 2024
      8x16x16x16	N4quda4PackIsLi3ELb1EEE	policy_kernel,vol=32768,parity=1,precision=2,order=8,Ns=4,Nc=3,comm=0001,topo=1112,order=01,dagger,nFace=1,host-remote	256	1	1	1	1	1	0	-1	-1	-1	-1	1.71846e-05	# 2.86 Gflop/s, 19.07 GB/s, tuning took 0.017556 seconds at Mon Aug 19 22:05:12 2024
      8x16x16x16	N4quda4PackIsLi3ELb1EEE	policy_kernel,vol=32768,parity=1,precision=2,order=8,Ns=4,Nc=3,comm=0001,topo=1112,order=01,nFace=1,device-device	256	1	1	18	1	1	0	-1	-1	-1	-1	5.23936e-06	# 9.38 Gflop/s, 62.54 GB/s, tuning took 0.213245 seconds at Mon Aug 19 22:05:07 2024
      8x16x16x16	N4quda4PackIsLi3ELb1EEE	policy_kernel,vol=32768,parity=1,precision=2,order=8,Ns=4,Nc=3,comm=0001,topo=1112,order=01,nFace=1,device-remote	256	1	1	1	1	1	0	-1	-1	-1	-1	1.7166e-05	# 2.86 Gflop/s, 19.09 GB/s, tuning took 0.590742 seconds at Mon Aug 19 22:05:09 2024
      8x16x16x16	N4quda4PackIsLi3ELb1EEE	policy_kernel,vol=32768,parity=1,precision=2,order=8,Ns=4,Nc=3,comm=0001,topo=1112,order=01,nFace=1,host-device	736	1	1	3	1	1	0	-1	-1	-1	-1	7.08475e-06	# 6.94 Gflop/s, 46.25 GB/s, tuning took 0.014053 seconds at Mon Aug 19 22:05:08 2024
      8x16x16x16	N4quda4PackIsLi3ELb1EEE	policy_kernel,vol=32768,parity=1,precision=2,order=8,Ns=4,Nc=3,comm=0001,topo=1112,order=01,nFace=1,host-host	480	1	1	1	1	1	0	-1	-1	-1	-1	1.34174e-05	# 3.66 Gflop/s, 24.42 GB/s, tuning took 0.015630 seconds at Mon Aug 19 22:05:07 2024
      8x16x16x16	N4quda4PackIsLi3ELb1EEE	policy_kernel,vol=32768,parity=1,precision=2,order=8,Ns=4,Nc=3,comm=0001,topo=1112,order=01,nFace=1,host-remote	256	1	1	1	1	1	0	-1	-1	-1	-1	1.7166e-05	# 2.86 Gflop/s, 19.09 GB/s, tuning took 0.017524 seconds at Mon Aug 19 22:05:09 2024
      8x16x16x16	N4quda4blas10multiaxpy_IdEE	GPU-offline,vol=32768,parity=1,precision=2,order=8,Ns=4,Nc=3,vol=32768,parity=1,precision=8,order=2,Ns=4,Nc=3,Nxz=1,Nyw=1	192	1	1	216	1	1	0	1	0	0	0	1.14638e-05	# 137.20 Gflop/s, 1246.26 GB/s, tuning took 0.011727 seconds at Mon Aug 19 22:05:14 2024
      8x16x16x16	N4quda4blas11axpbyzNorm2IddEE	GPU-offline,nParity=1,vol=32768,parity=1,precision=8,order=2,Ns=4,Nc=3	704	1	1	192	1	1	0	-1	-1	-1	-1	1.23269e-05	# 255.19 Gflop/s, 1531.15 GB/s, tuning took 0.095954 seconds at Mon Aug 19 22:05:16 2024
      8x16x16x16	N4quda4blas11axpyCGNorm2IdfEE	GPU-offline,nParity=1,vol=32768,parity=1,precision=2,order=8,Ns=4,Nc=3	384	1	1	192	1	1	0	-1	-1	-1	-1	1.25084e-05	# 377.24 Gflop/s, 408.67 GB/s, tuning took 0.070630 seconds at Mon Aug 19 22:05:14 2024
      8x16x16x16	N4quda4blas23HeavyQuarkResidualNorm_IddEE	GPU-offline,nParity=1,vol=32768,parity=1,precision=8,order=2,Ns=4,Nc=3	320	1	1	192	1	1	0	-1	-1	-1	-1	1.28772e-05	# 244.29 Gflop/s, 977.15 GB/s, tuning took 0.091232 seconds at Mon Aug 19 22:05:17 2024
      8x16x16x16	N4quda4blas3DotIdfEE	GPU-offline,nParity=1,vol=32768,parity=1,precision=2,order=8,Ns=4,Nc=3	320	1	1	192	1	1	0	-1	-1	-1	-1	1.11074e-05	# 141.61 Gflop/s, 306.81 GB/s, tuning took 0.077134 seconds at Mon Aug 19 22:05:14 2024
      8x16x16x16	N4quda4blas4CdotIdfEE	GPU-offline,nParity=1,vol=32768,parity=1,precision=2,order=8,Ns=4,Nc=3	192	1	1	192	1	1	0	-1	-1	-1	-1	1.19251e-05	# 263.79 Gflop/s, 285.77 GB/s, tuning took 0.083375 seconds at Mon Aug 19 22:05:16 2024
      8x16x16x16	N4quda4blas5Norm2IddEE	GPU-offline,nParity=1,vol=32768,parity=1,precision=8,order=2,Ns=4,Nc=3	544	1	1	192	1	1	0	-1	-1	-1	-1	1.06427e-05	# 147.79 Gflop/s, 591.15 GB/s, tuning took 0.080274 seconds at Mon Aug 19 22:05:07 2024
      8x16x16x16	N4quda4blas6caxpy_IfEE	GPU-offline,vol=32768,parity=1,precision=2,order=8,Ns=4,Nc=3	192	1	1	216	1	1	0	-1	-1	-1	-1	4.9064e-06	# 641.15 Gflop/s, 1041.86 GB/s, tuning took 0.009564 seconds at Mon Aug 19 22:05:16 2024
      8x16x16x16	N4quda4blas7axpbyz_IdEE	GPU-offline,vol=32768,parity=1,precision=8,order=2,Ns=4,Nc=3	608	1	1	216	1	1	0	-1	-1	-1	-1	6.2847e-06	# 375.40 Gflop/s, 3003.22 GB/s, tuning took 0.009881 seconds at Mon Aug 19 22:05:14 2024
      8x16x16x16	N4quda4blas7axpbyz_IfEE	GPU-offline,vol=32768,parity=1,precision=2,order=8,Ns=4,Nc=3	192	1	1	216	1	1	0	-1	-1	-1	-1	5.00692e-06	# 471.21 Gflop/s, 1020.95 GB/s, tuning took 0.009690 seconds at Mon Aug 19 22:05:16 2024
      8x16x16x16	N4quda4blas9axpyZpbx_IdEE	GPU-offline,vol=32768,parity=1,precision=2,order=8,Ns=4,Nc=3,vol=32768,parity=1,precision=8,order=2,Ns=4,Nc=3	192	1	1	216	1	1	0	-1	-1	-1	-1	8.87798e-06	# 354.33 Gflop/s, 1993.10 GB/s, tuning took 0.011616 seconds at Mon Aug 19 22:05:14 2024
      8x16x16x16	N4quda6WilsonINS_9WilsonArgIdLi3ELi4EL21QudaReconstructType_s12EEEEE	policy,commDim=0001,dagger,parity=1,topo=1112,order=01,p2p=3,gdr=0,nvshmem=0,pol=110000111100110000	32	1	1	1	1	1	0	0	1	0	-1	8.84053e-05	# 489.27 Gflop/s, 853.99 GB/s, tuning took 0.025984 seconds at Mon Aug 19 22:05:04 2024
      8x16x16x16	N4quda6WilsonINS_9WilsonArgIdLi3ELi4EL21QudaReconstructType_s12EEEEE	policy,commDim=0001,parity=1,topo=1112,order=01,p2p=3,gdr=0,nvshmem=0,pol=110000111100110000	32	1	1	1	1	1	0	0	1	0	-1	8.8064e-05	# 491.16 Gflop/s, 857.30 GB/s, tuning took 0.027759 seconds at Mon Aug 19 22:05:16 2024
      8x16x16x16	N4quda6WilsonINS_9WilsonArgIdLi3ELi4EL21QudaReconstructType_s12EEEEE	policy,commDim=0001,xpay,dagger,parity=1,topo=1112,order=01,p2p=3,gdr=0,nvshmem=0,pol=110000111100110000	32	1	1	1	1	1	0	0	1	0	-1	8.96e-05	# 500.30 Gflop/s, 842.61 GB/s, tuning took 0.027608 seconds at Mon Aug 19 22:05:07 2024
      8x16x16x16	N4quda6WilsonINS_9WilsonArgIdLi3ELi4EL21QudaReconstructType_s12EEEEE	policy,commDim=0001,xpay,parity=1,topo=1112,order=01,p2p=3,gdr=0,nvshmem=0,pol=110000111100110000	32	1	1	1	1	1	0	0	1	0	-1	8.84907e-05	# 506.57 Gflop/s, 853.17 GB/s, tuning took 0.028566 seconds at Mon Aug 19 22:05:00 2024
      8x16x16x16	N4quda6WilsonINS_9WilsonArgIdLi3ELi4EL21QudaReconstructType_s12EEEEE	policy_kernel=exterior_all,commDim=0001,dagger,parity=1	16	1	1	256	1	1	5217	-1	-1	-1	-1	7.39061e-06	# 99.76 Gflop/s, 319.23 GB/s, tuning took 0.023990 seconds at Mon Aug 19 22:05:00 2024
      8x16x16x16	N4quda6WilsonINS_9WilsonArgIdLi3ELi4EL21QudaReconstructType_s12EEEEE	policy_kernel=exterior_all,commDim=0001,dagger,parity=1,zero_copy,p2p=0	16	1	1	256	1	1	55638	-1	-1	-1	-1	4.096e-05	# 18.00 Gflop/s, 57.60 GB/s, tuning took 0.062422 seconds at Mon Aug 19 22:05:01 2024
      8x16x16x16	N4quda6WilsonINS_9WilsonArgIdLi3ELi4EL21QudaReconstructType_s12EEEEE	policy_kernel=exterior_all,commDim=0001,dagger,parity=1,zero_copy,p2p=1	32	1	1	128	1	1	27819	-1	-1	-1	-1	7.3678e-06	# 100.07 Gflop/s, 320.22 GB/s, tuning took 0.024581 seconds at Mon Aug 19 22:05:01 2024
      8x16x16x16	N4quda6WilsonINS_9WilsonArgIdLi3ELi4EL21QudaReconstructType_s12EEEEE	policy_kernel=exterior_all,commDim=0001,parity=1	16	1	1	256	1	1	6182	-1	-1	-1	-1	7.39278e-06	# 99.73 Gflop/s, 319.14 GB/s, tuning took 0.024601 seconds at Mon Aug 19 22:05:14 2024
      8x16x16x16	N4quda6WilsonINS_9WilsonArgIdLi3ELi4EL21QudaReconstructType_s12EEEEE	policy_kernel=exterior_all,commDim=0001,parity=1,zero_copy,p2p=0	32	1	1	128	1	1	5385	-1	-1	-1	-1	4.10453e-05	# 17.96 Gflop/s, 57.48 GB/s, tuning took 0.062446 seconds at Mon Aug 19 22:05:14 2024
      8x16x16x16	N4quda6WilsonINS_9WilsonArgIdLi3ELi4EL21QudaReconstructType_s12EEEEE	policy_kernel=exterior_all,commDim=0001,parity=1,zero_copy,p2p=1	16	1	1	256	1	1	7587	-1	-1	-1	-1	7.40842e-06	# 99.52 Gflop/s, 318.46 GB/s, tuning took 0.024036 seconds at Mon Aug 19 22:05:15 2024
      8x16x16x16	N4quda6WilsonINS_9WilsonArgIdLi3ELi4EL21QudaReconstructType_s12EEEEE	policy_kernel=exterior_all,commDim=0001,xpay,dagger,parity=1	16	1	1	256	1	1	5217	-1	-1	-1	-1	7.38446e-06	# 113.15 Gflop/s, 319.49 GB/s, tuning took 0.024615 seconds at Mon Aug 19 22:05:04 2024
      8x16x16x16	N4quda6WilsonINS_9WilsonArgIdLi3ELi4EL21QudaReconstructType_s12EEEEE	policy_kernel=exterior_all,commDim=0001,xpay,dagger,parity=1,zero_copy,p2p=0	16	1	1	256	1	1	16692	-1	-1	-1	-1	4.11307e-05	# 20.32 Gflop/s, 57.36 GB/s, tuning took 0.062414 seconds at Mon Aug 19 22:05:04 2024
      8x16x16x16	N4quda6WilsonINS_9WilsonArgIdLi3ELi4EL21QudaReconstructType_s12EEEEE	policy_kernel=exterior_all,commDim=0001,xpay,dagger,parity=1,zero_copy,p2p=1	16	1	1	256	1	1	6955	-1	-1	-1	-1	7.40842e-06	# 112.79 Gflop/s, 318.46 GB/s, tuning took 0.024295 seconds at Mon Aug 19 22:05:05 2024
      8x16x16x16	N4quda6WilsonINS_9WilsonArgIdLi3ELi4EL21QudaReconstructType_s12EEEEE	policy_kernel=exterior_all,commDim=0001,xpay,parity=1	16	1	1	256	1	1	5385	-1	-1	-1	-1	7.39951e-06	# 112.92 Gflop/s, 318.84 GB/s, tuning took 0.023993 seconds at Mon Aug 19 22:04:56 2024
      8x16x16x16	N4quda6WilsonINS_9WilsonArgIdLi3ELi4EL21QudaReconstructType_s12EEEEE	policy_kernel=exterior_all,commDim=0001,xpay,parity=1,zero_copy,p2p=0	32	1	1	128	1	1	0	-1	-1	-1	-1	4.10453e-05	# 20.36 Gflop/s, 57.48 GB/s, tuning took 0.062403 seconds at Mon Aug 19 22:04:56 2024
      8x16x16x16	N4quda6WilsonINS_9WilsonArgIdLi3ELi4EL21QudaReconstructType_s12EEEEE	policy_kernel=exterior_all,commDim=0001,xpay,parity=1,zero_copy,p2p=1	16	1	1	256	1	1	6420	-1	-1	-1	-1	7.39278e-06	# 113.03 Gflop/s, 319.14 GB/s, tuning took 0.024597 seconds at Mon Aug 19 22:04:57 2024
      8x16x16x16	N4quda6WilsonINS_9WilsonArgIdLi3ELi4EL21QudaReconstructType_s12EEEEE	policy_kernel=exterior_t,commDim=0001,dagger,parity=1	16	1	1	256	1	1	12840	-1	-1	-1	-1	6.60519e-06	# 111.62 Gflop/s, 357.19 GB/s, tuning took 0.023919 seconds at Mon Aug 19 22:05:00 2024
      8x16x16x16	N4quda6WilsonINS_9WilsonArgIdLi3ELi4EL21QudaReconstructType_s12EEEEE	policy_kernel=exterior_t,commDim=0001,dagger,parity=1,zero_copy,p2p=0	32	1	1	128	1	1	5217	-1	-1	-1	-1	4.01818e-05	# 18.35 Gflop/s, 58.72 GB/s, tuning took 0.064843 seconds at Mon Aug 19 22:05:01 2024
      8x16x16x16	N4quda6WilsonINS_9WilsonArgIdLi3ELi4EL21QudaReconstructType_s12EEEEE	policy_kernel=exterior_t,commDim=0001,dagger,parity=1,zero_copy,p2p=1	16	1	1	256	1	1	33383	-1	-1	-1	-1	6.59737e-06	# 111.75 Gflop/s, 357.61 GB/s, tuning took 0.023935 seconds at Mon Aug 19 22:05:01 2024
      8x16x16x16	N4quda6WilsonINS_9WilsonArgIdLi3ELi4EL21QudaReconstructType_s12EEEEE	policy_kernel=exterior_t,commDim=0001,parity=1	16	1	1	256	1	1	23845	-1	-1	-1	-1	6.62082e-06	# 111.36 Gflop/s, 356.34 GB/s, tuning took 0.023965 seconds at Mon Aug 19 22:05:14 2024
      8x16x16x16	N4quda6WilsonINS_9WilsonArgIdLi3ELi4EL21QudaReconstructType_s12EEEEE	policy_kernel=exterior_t,commDim=0001,parity=1,zero_copy,p2p=0	64	1	1	64	1	1	18546	-1	-1	-1	-1	4.01408e-05	# 18.37 Gflop/s, 58.78 GB/s, tuning took 0.064800 seconds at Mon Aug 19 22:05:14 2024
      8x16x16x16	N4quda6WilsonINS_9WilsonArgIdLi3ELi4EL21QudaReconstructType_s12EEEEE	policy_kernel=exterior_t,commDim=0001,parity=1,zero_copy,p2p=1	16	1	1	256	1	1	8346	-1	-1	-1	-1	6.63646e-06	# 111.10 Gflop/s, 355.51 GB/s, tuning took 0.024020 seconds at Mon Aug 19 22:05:15 2024
      8x16x16x16	N4quda6WilsonINS_9WilsonArgIdLi3ELi4EL21QudaReconstructType_s12EEEEE	policy_kernel=exterior_t,commDim=0001,xpay,dagger,parity=1	16	1	1	256	1	1	6677	-1	-1	-1	-1	6.62864e-06	# 126.06 Gflop/s, 355.92 GB/s, tuning took 0.023946 seconds at Mon Aug 19 22:05:04 2024
      8x16x16x16	N4quda6WilsonINS_9WilsonArgIdLi3ELi4EL21QudaReconstructType_s12EEEEE	policy_kernel=exterior_t,commDim=0001,xpay,dagger,parity=1,zero_copy,p2p=0	64	1	1	64	1	1	5217	-1	-1	-1	-1	4.02637e-05	# 20.75 Gflop/s, 58.60 GB/s, tuning took 0.064990 seconds at Mon Aug 19 22:05:04 2024
      8x16x16x16	N4quda6WilsonINS_9WilsonArgIdLi3ELi4EL21QudaReconstructType_s12EEEEE	policy_kernel=exterior_t,commDim=0001,xpay,dagger,parity=1,zero_copy,p2p=1	16	1	1	256	1	1	9819	-1	-1	-1	-1	6.64427e-06	# 125.76 Gflop/s, 355.09 GB/s, tuning took 0.024012 seconds at Mon Aug 19 22:05:05 2024
      8x16x16x16	N4quda6WilsonINS_9WilsonArgIdLi3ELi4EL21QudaReconstructType_s12EEEEE	policy_kernel=exterior_t,commDim=0001,xpay,parity=1	16	1	1	256	1	1	27819	-1	-1	-1	-1	6.61301e-06	# 126.35 Gflop/s, 356.77 GB/s, tuning took 0.023949 seconds at Mon Aug 19 22:04:56 2024
      8x16x16x16	N4quda6WilsonINS_9WilsonArgIdLi3ELi4EL21QudaReconstructType_s12EEEEE	policy_kernel=exterior_t,commDim=0001,xpay,parity=1,zero_copy,p2p=0	80	1	1	52	1	1	12840	-1	-1	-1	-1	4.02637e-05	# 20.75 Gflop/s, 58.60 GB/s, tuning took 0.064995 seconds at Mon Aug 19 22:04:56 2024
      8x16x16x16	N4quda6WilsonINS_9WilsonArgIdLi3ELi4EL21QudaReconstructType_s12EEEEE	policy_kernel=exterior_t,commDim=0001,xpay,parity=1,zero_copy,p2p=1	16	1	1	256	1	1	13910	-1	-1	-1	-1	6.62082e-06	# 126.21 Gflop/s, 356.34 GB/s, tuning took 0.024011 seconds at Mon Aug 19 22:04:57 2024
      8x16x16x16	N4quda6WilsonINS_9WilsonArgIdLi3ELi4EL21QudaReconstructType_s12EEEEE	policy_kernel=interior,comm=0001,commDim=0001,dagger,parity=1	320	1	1	103	1	1	27819	-1	-1	-1	-1	2.99442e-05	# 1423.14 Gflop/s, 2442.48 GB/s, tuning took 0.052975 seconds at Mon Aug 19 22:05:00 2024
      8x16x16x16	N4quda6WilsonINS_9WilsonArgIdLi3ELi4EL21QudaReconstructType_s12EEEEE	policy_kernel=interior,comm=0001,commDim=0001,dagger,parity=1,host-device	304	1	1	108	1	1	41729	3	-1	-1	-1	3.1264e-05	# 1364.63 Gflop/s, 2377.11 GB/s, tuning took 0.524358 seconds at Mon Aug 19 22:05:02 2024
      8x16x16x16	N4quda6WilsonINS_9WilsonArgIdLi3ELi4EL21QudaReconstructType_s12EEEEE	policy_kernel=interior,comm=0001,commDim=0001,dagger,parity=1,host-host	128	1	1	256	1	1	41729	1	-1	-1	-1	3.81156e-05	# 1119.33 Gflop/s, 1949.80 GB/s, tuning took 0.664761 seconds at Mon Aug 19 22:05:01 2024
      8x16x16x16	N4quda6WilsonINS_9WilsonArgIdLi3ELi4EL21QudaReconstructType_s12EEEEE	policy_kernel=interior,comm=0001,commDim=0001,dagger,parity=1,host-remote	32	1	1	1024	1	1	41729	1	-1	-1	-1	5.64907e-05	# 755.24 Gflop/s, 1315.58 GB/s, tuning took 0.837360 seconds at Mon Aug 19 22:05:04 2024
      8x16x16x16	N4quda6WilsonINS_9WilsonArgIdLi3ELi4EL21QudaReconstructType_s12EEEEE	policy_kernel=interior,comm=0001,commDim=0001,parity=1	320	1	1	103	1	1	0	-1	-1	-1	-1	3.09062e-05	# 1378.84 Gflop/s, 2366.46 GB/s, tuning took 0.053612 seconds at Mon Aug 19 22:05:14 2024
      8x16x16x16	N4quda6WilsonINS_9WilsonArgIdLi3ELi4EL21QudaReconstructType_s12EEEEE	policy_kernel=interior,comm=0001,commDim=0001,parity=1,host-device	304	1	1	108	1	1	0	3	-1	-1	-1	3.14467e-05	# 1356.71 Gflop/s, 2363.29 GB/s, tuning took 0.524410 seconds at Mon Aug 19 22:05:15 2024
      8x16x16x16	N4quda6WilsonINS_9WilsonArgIdLi3ELi4EL21QudaReconstructType_s12EEEEE	policy_kernel=interior,comm=0001,commDim=0001,parity=1,host-host	128	1	1	256	1	1	11128	1	-1	-1	-1	3.80018e-05	# 1122.68 Gflop/s, 1955.64 GB/s, tuning took 0.666132 seconds at Mon Aug 19 22:05:15 2024
      8x16x16x16	N4quda6WilsonINS_9WilsonArgIdLi3ELi4EL21QudaReconstructType_s12EEEEE	policy_kernel=interior,comm=0001,commDim=0001,parity=1,host-remote	32	1	1	1024	1	1	41729	1	-1	-1	-1	5.57511e-05	# 765.26 Gflop/s, 1333.03 GB/s, tuning took 0.840618 seconds at Mon Aug 19 22:05:16 2024
      8x16x16x16	N4quda6WilsonINS_9WilsonArgIdLi3ELi4EL21QudaReconstructType_s12EEEEE	policy_kernel=interior,comm=0001,commDim=0001,xpay,dagger,parity=1	160	1	1	205	1	1	15174	-1	-1	-1	-1	3.8381e-05	# 1151.29 Gflop/s, 1905.59 GB/s, tuning took 0.059919 seconds at Mon Aug 19 22:05:04 2024
      8x16x16x16	N4quda6WilsonINS_9WilsonArgIdLi3ELi4EL21QudaReconstructType_s12EEEEE	policy_kernel=interior,comm=0001,commDim=0001,xpay,dagger,parity=1,host-device	112	1	1	293	1	1	12840	13	-1	-1	-1	3.88361e-05	# 1139.06 Gflop/s, 1913.63 GB/s, tuning took 0.591455 seconds at Mon Aug 19 22:05:06 2024
      8x16x16x16	N4quda6WilsonINS_9WilsonArgIdLi3ELi4EL21QudaReconstructType_s12EEEEE	policy_kernel=interior,comm=0001,commDim=0001,xpay,dagger,parity=1,host-host	112	1	1	293	1	1	41729	1	-1	-1	-1	4.06323e-05	# 1088.71 Gflop/s, 1829.04 GB/s, tuning took 0.744559 seconds at Mon Aug 19 22:05:05 2024
      8x16x16x16	N4quda6WilsonINS_9WilsonArgIdLi3ELi4EL21QudaReconstructType_s12EEEEE	policy_kernel=interior,comm=0001,commDim=0001,xpay,dagger,parity=1,host-remote	32	1	1	1024	1	1	41729	1	-1	-1	-1	5.89101e-05	# 750.92 Gflop/s, 1261.55 GB/s, tuning took 0.874960 seconds at Mon Aug 19 22:05:07 2024
      8x16x16x16	N4quda6WilsonINS_9WilsonArgIdLi3ELi4EL21QudaReconstructType_s12EEEEE	policy_kernel=interior,comm=0001,commDim=0001,xpay,parity=1	80	1	1	410	1	1	7949	-1	-1	-1	-1	3.84948e-05	# 1147.89 Gflop/s, 1899.95 GB/s, tuning took 0.059761 seconds at Mon Aug 19 22:04:56 2024
      8x16x16x16	N4quda6WilsonINS_9WilsonArgIdLi3ELi4EL21QudaReconstructType_s12EEEEE	policy_kernel=interior,comm=0001,commDim=0001,xpay,parity=1,host-device	80	1	1	410	1	1	18546	6	-1	-1	-1	3.88741e-05	# 1137.95 Gflop/s, 1911.76 GB/s, tuning took 0.591230 seconds at Mon Aug 19 22:04:58 2024
      8x16x16x16	N4quda6WilsonINS_9WilsonArgIdLi3ELi4EL21QudaReconstructType_s12EEEEE	policy_kernel=interior,comm=0001,commDim=0001,xpay,parity=1,host-host	160	1	1	205	1	1	13910	1	-1	-1	-1	4.03866e-05	# 1095.33 Gflop/s, 1840.17 GB/s, tuning took 0.745594 seconds at Mon Aug 19 22:04:57 2024
      8x16x16x16	N4quda6WilsonINS_9WilsonArgIdLi3ELi4EL21QudaReconstructType_s12EEEEE	policy_kernel=interior,comm=0001,commDim=0001,xpay,parity=1,host-remote	96	1	1	342	1	1	20865	1	-1	-1	-1	6.05365e-05	# 730.75 Gflop/s, 1227.66 GB/s, tuning took 0.876617 seconds at Mon Aug 19 22:05:00 2024
      8x16x16x16	N4quda6WilsonINS_9WilsonArgIsLi3ELi4EL21QudaReconstructType_s12EEEEE	policy,commDim=0001,dagger,parity=1,topo=1112,order=01,p2p=3,gdr=0,nvshmem=0,pol=110000111100110000	32	1	1	1	1	1	0	8	2	0	-1	5.60924e-05	# 771.12 Gflop/s, 355.18 GB/s, tuning took 0.019203 seconds at Mon Aug 19 22:05:12 2024
      8x16x16x16	N4quda6WilsonINS_9WilsonArgIsLi3ELi4EL21QudaReconstructType_s12EEEEE	policy,commDim=0001,parity=1,topo=1112,order=01,p2p=3,gdr=0,nvshmem=0,pol=110000111100110000	32	1	1	1	1	1	0	12	2	0	-1	5.69826e-05	# 759.07 Gflop/s, 349.63 GB/s, tuning took 0.018514 seconds at Mon Aug 19 22:05:09 2024
      8x16x16x16	N4quda6WilsonINS_9WilsonArgIsLi3ELi4EL21QudaReconstructType_s12EEEEE	policy,commDim=0001,xpay,dagger,parity=1,topo=1112,order=01,p2p=3,gdr=0,nvshmem=0,pol=110000111100110000	32	1	1	1	1	1	0	8	2	0	-1	5.8688e-05	# 763.81 Gflop/s, 339.47 GB/s, tuning took 0.018733 seconds at Mon Aug 19 22:05:14 2024
      8x16x16x16	N4quda6WilsonINS_9WilsonArgIsLi3ELi4EL21QudaReconstructType_s12EEEEE	policy,commDim=0001,xpay,parity=1,topo=1112,order=01,p2p=3,gdr=0,nvshmem=0,pol=110000111100110000	32	1	1	1	1	1	0	12	2	0	-1	5.86089e-05	# 764.84 Gflop/s, 339.93 GB/s, tuning took 0.019383 seconds at Mon Aug 19 22:05:10 2024
      8x16x16x16	N4quda6WilsonINS_9WilsonArgIsLi3ELi4EL21QudaReconstructType_s12EEEEE	policy_kernel=exterior_all,commDim=0001,dagger,parity=1	32	1	1	128	1	1	6955	-1	-1	-1	-1	7.10972e-06	# 103.70 Gflop/s, 88.72 GB/s, tuning took 0.025143 seconds at Mon Aug 19 22:05:11 2024
      8x16x16x16	N4quda6WilsonINS_9WilsonArgIsLi3ELi4EL21QudaReconstructType_s12EEEEE	policy_kernel=exterior_all,commDim=0001,dagger,parity=1,zero_copy,p2p=0	32	1	1	128	1	1	5756	-1	-1	-1	-1	1.82942e-05	# 40.30 Gflop/s, 34.48 GB/s, tuning took 0.040010 seconds at Mon Aug 19 22:05:11 2024
      8x16x16x16	N4quda6WilsonINS_9WilsonArgIsLi3ELi4EL21QudaReconstructType_s12EEEEE	policy_kernel=exterior_all,commDim=0001,dagger,parity=1,zero_copy,p2p=1	32	1	1	128	1	1	9273	-1	-1	-1	-1	7.10972e-06	# 103.70 Gflop/s, 88.72 GB/s, tuning took 0.025053 seconds at Mon Aug 19 22:05:11 2024
      8x16x16x16	N4quda6WilsonINS_9WilsonArgIsLi3ELi4EL21QudaReconstructType_s12EEEEE	policy_kernel=exterior_all,commDim=0001,parity=1	32	1	1	128	1	1	6955	-1	-1	-1	-1	7.10972e-06	# 103.70 Gflop/s, 88.72 GB/s, tuning took 0.025161 seconds at Mon Aug 19 22:05:07 2024
      8x16x16x16	N4quda6WilsonINS_9WilsonArgIsLi3ELi4EL21QudaReconstructType_s12EEEEE	policy_kernel=exterior_all,commDim=0001,parity=1,zero_copy,p2p=0	32	1	1	128	1	1	5217	-1	-1	-1	-1	1.82942e-05	# 40.30 Gflop/s, 34.48 GB/s, tuning took 0.040000 seconds at Mon Aug 19 22:05:07 2024
      8x16x16x16	N4quda6WilsonINS_9WilsonArgIsLi3ELi4EL21QudaReconstructType_s12EEEEE	policy_kernel=exterior_all,commDim=0001,parity=1,zero_copy,p2p=1	32	1	1	128	1	1	8346	-1	-1	-1	-1	7.10972e-06	# 103.70 Gflop/s, 88.72 GB/s, tuning took 0.025051 seconds at Mon Aug 19 22:05:08 2024
      8x16x16x16	N4quda6WilsonINS_9WilsonArgIsLi3ELi4EL21QudaReconstructType_s12EEEEE	policy_kernel=exterior_all,commDim=0001,xpay,dagger,parity=1	32	1	1	128	1	1	5756	-1	-1	-1	-1	7.07642e-06	# 118.08 Gflop/s, 89.14 GB/s, tuning took 0.025116 seconds at Mon Aug 19 22:05:12 2024
      8x16x16x16	N4quda6WilsonINS_9WilsonArgIsLi3ELi4EL21QudaReconstructType_s12EEEEE	policy_kernel=exterior_all,commDim=0001,xpay,dagger,parity=1,zero_copy,p2p=0	96	1	1	43	1	1	9819	-1	-1	-1	-1	1.82195e-05	# 45.86 Gflop/s, 34.62 GB/s, tuning took 0.040154 seconds at Mon Aug 19 22:05:13 2024
      8x16x16x16	N4quda6WilsonINS_9WilsonArgIsLi3ELi4EL21QudaReconstructType_s12EEEEE	policy_kernel=exterior_all,commDim=0001,xpay,dagger,parity=1,zero_copy,p2p=1	16	1	1	256	1	1	16692	-1	-1	-1	-1	7.2679e-06	# 114.97 Gflop/s, 86.79 GB/s, tuning took 0.025228 seconds at Mon Aug 19 22:05:13 2024
      8x16x16x16	N4quda6WilsonINS_9WilsonArgIsLi3ELi4EL21QudaReconstructType_s12EEEEE	policy_kernel=exterior_all,commDim=0001,xpay,parity=1	32	1	1	128	1	1	7949	-1	-1	-1	-1	7.0681e-06	# 118.22 Gflop/s, 89.24 GB/s, tuning took 0.025166 seconds at Mon Aug 19 22:05:09 2024
      8x16x16x16	N4quda6WilsonINS_9WilsonArgIsLi3ELi4EL21QudaReconstructType_s12EEEEE	policy_kernel=exterior_all,commDim=0001,xpay,parity=1,zero_copy,p2p=0	64	1	1	64	1	1	6182	-1	-1	-1	-1	1.81229e-05	# 46.11 Gflop/s, 34.81 GB/s, tuning took 0.040133 seconds at Mon Aug 19 22:05:09 2024
      8x16x16x16	N4quda6WilsonINS_9WilsonArgIsLi3ELi4EL21QudaReconstructType_s12EEEEE	policy_kernel=exterior_all,commDim=0001,xpay,parity=1,zero_copy,p2p=1	32	1	1	128	1	1	5962	-1	-1	-1	-1	7.07642e-06	# 118.08 Gflop/s, 89.14 GB/s, tuning took 0.025097 seconds at Mon Aug 19 22:05:10 2024
      8x16x16x16	N4quda6WilsonINS_9WilsonArgIsLi3ELi4EL21QudaReconstructType_s12EEEEE	policy_kernel=exterior_t,commDim=0001,dagger,parity=1	32	1	1	128	1	1	18546	-1	-1	-1	-1	6.32686e-06	# 116.53 Gflop/s, 99.70 GB/s, tuning took 0.024830 seconds at Mon Aug 19 22:05:11 2024
      8x16x16x16	N4quda6WilsonINS_9WilsonArgIsLi3ELi4EL21QudaReconstructType_s12EEEEE	policy_kernel=exterior_t,commDim=0001,dagger,parity=1,zero_copy,p2p=0	32	1	1	128	1	1	20865	-1	-1	-1	-1	1.75011e-05	# 42.13 Gflop/s, 36.04 GB/s, tuning took 0.040046 seconds at Mon Aug 19 22:05:11 2024
      8x16x16x16	N4quda6WilsonINS_9WilsonArgIsLi3ELi4EL21QudaReconstructType_s12EEEEE	policy_kernel=exterior_t,commDim=0001,dagger,parity=1,zero_copy,p2p=1	32	1	1	128	1	1	7949	-1	-1	-1	-1	6.33417e-06	# 116.40 Gflop/s, 99.58 GB/s, tuning took 0.024668 seconds at Mon Aug 19 22:05:11 2024
      8x16x16x16	N4quda6WilsonINS_9WilsonArgIsLi3ELi4EL21QudaReconstructType_s12EEEEE	policy_kernel=exterior_t,commDim=0001,parity=1	64	1	1	64	1	1	5564	-1	-1	-1	-1	6.3488e-06	# 116.13 Gflop/s, 99.35 GB/s, tuning took 0.025325 seconds at Mon Aug 19 22:05:07 2024
      8x16x16x16	N4quda6WilsonINS_9WilsonArgIsLi3ELi4EL21QudaReconstructType_s12EEEEE	policy_kernel=exterior_t,commDim=0001,parity=1,zero_copy,p2p=0	32	1	1	128	1	1	55638	-1	-1	-1	-1	1.74825e-05	# 42.17 Gflop/s, 36.08 GB/s, tuning took 0.040023 seconds at Mon Aug 19 22:05:07 2024
      8x16x16x16	N4quda6WilsonINS_9WilsonArgIsLi3ELi4EL21QudaReconstructType_s12EEEEE	policy_kernel=exterior_t,commDim=0001,parity=1,zero_copy,p2p=1	32	1	1	128	1	1	0	-1	-1	-1	-1	6.34149e-06	# 116.26 Gflop/s, 99.47 GB/s, tuning took 0.024710 seconds at Mon Aug 19 22:05:08 2024
      8x16x16x16	N4quda6WilsonINS_9WilsonArgIsLi3ELi4EL21QudaReconstructType_s12EEEEE	policy_kernel=exterior_t,commDim=0001,xpay,dagger,parity=1	64	1	1	64	1	1	8785	-1	-1	-1	-1	6.34149e-06	# 131.76 Gflop/s, 99.47 GB/s, tuning took 0.024774 seconds at Mon Aug 19 22:05:12 2024
      8x16x16x16	N4quda6WilsonINS_9WilsonArgIsLi3ELi4EL21QudaReconstructType_s12EEEEE	policy_kernel=exterior_t,commDim=0001,xpay,dagger,parity=1,zero_copy,p2p=0	64	1	1	64	1	1	5385	-1	-1	-1	-1	1.7408e-05	# 48.00 Gflop/s, 36.24 GB/s, tuning took 0.040117 seconds at Mon Aug 19 22:05:13 2024
      8x16x16x16	N4quda6WilsonINS_9WilsonArgIsLi3ELi4EL21QudaReconstructType_s12EEEEE	policy_kernel=exterior_t,commDim=0001,xpay,dagger,parity=1,zero_copy,p2p=1	64	1	1	64	1	1	7587	-1	-1	-1	-1	6.33417e-06	# 131.92 Gflop/s, 99.58 GB/s, tuning took 0.024795 seconds at Mon Aug 19 22:05:13 2024
      8x16x16x16	N4quda6WilsonINS_9WilsonArgIsLi3ELi4EL21QudaReconstructType_s12EEEEE	policy_kernel=exterior_t,commDim=0001,xpay,parity=1	32	1	1	128	1	1	10433	-1	-1	-1	-1	6.33417e-06	# 131.92 Gflop/s, 99.58 GB/s, tuning took 0.024754 seconds at Mon Aug 19 22:05:09 2024
      8x16x16x16	N4quda6WilsonINS_9WilsonArgIsLi3ELi4EL21QudaReconstructType_s12EEEEE	policy_kernel=exterior_t,commDim=0001,xpay,parity=1,zero_copy,p2p=0	64	1	1	64	1	1	13910	-1	-1	-1	-1	1.74639e-05	# 47.85 Gflop/s, 36.12 GB/s, tuning took 0.040171 seconds at Mon Aug 19 22:05:09 2024
      8x16x16x16	N4quda6WilsonINS_9WilsonArgIsLi3ELi4EL21QudaReconstructType_s12EEEEE	policy_kernel=exterior_t,commDim=0001,xpay,parity=1,zero_copy,p2p=1	32	1	1	128	1	1	9273	-1	-1	-1	-1	6.34149e-06	# 131.76 Gflop/s, 99.47 GB/s, tuning took 0.024846 seconds at Mon Aug 19 22:05:10 2024
      8x16x16x16	N4quda6WilsonINS_9WilsonArgIsLi3ELi4EL21QudaReconstructType_s12EEEEE	policy_kernel=interior,comm=0001,commDim=0001,dagger,parity=1	64	1	1	512	1	1	0	-1	-1	-1	-1	1.51453e-05	# 2813.73 Gflop/s, 1273.81 GB/s, tuning took 0.040066 seconds at Mon Aug 19 22:05:11 2024
      8x16x16x16	N4quda6WilsonINS_9WilsonArgIsLi3ELi4EL21QudaReconstructType_s12EEEEE	policy_kernel=interior,comm=0001,commDim=0001,dagger,parity=1,host-device	64	1	1	512	1	1	5385	4	-1	-1	-1	1.5248e-05	# 2798.00 Gflop/s, 1284.57 GB/s, tuning took 0.318776 seconds at Mon Aug 19 22:05:11 2024
      8x16x16x16	N4quda6WilsonINS_9WilsonArgIsLi3ELi4EL21QudaReconstructType_s12EEEEE	policy_kernel=interior,comm=0001,commDim=0001,dagger,parity=1,host-host	128	1	1	256	1	1	0	1	-1	-1	-1	1.66841e-05	# 2557.16 Gflop/s, 1173.99 GB/s, tuning took 0.345625 seconds at Mon Aug 19 22:05:11 2024
      8x16x16x16	N4quda6WilsonINS_9WilsonArgIsLi3ELi4EL21QudaReconstructType_s12EEEEE	policy_kernel=interior,comm=0001,commDim=0001,dagger,parity=1,host-remote	96	1	1	342	1	1	7949	1	-1	-1	-1	1.87865e-05	# 2270.99 Gflop/s, 1042.62 GB/s, tuning took 0.365650 seconds at Mon Aug 19 22:05:12 2024
      8x16x16x16	N4quda6WilsonINS_9WilsonArgIsLi3ELi4EL21QudaReconstructType_s12EEEEE	policy_kernel=interior,comm=0001,commDim=0001,parity=1	32	1	1	1024	1	1	7258	-1	-1	-1	-1	1.52114e-05	# 2801.51 Gflop/s, 1268.27 GB/s, tuning took 0.040009 seconds at Mon Aug 19 22:05:07 2024
      8x16x16x16	N4quda6WilsonINS_9WilsonArgIsLi3ELi4EL21QudaReconstructType_s12EEEEE	policy_kernel=interior,comm=0001,commDim=0001,parity=1,host-device	64	1	1	512	1	1	5564	2	-1	-1	-1	1.5104e-05	# 2824.68 Gflop/s, 1296.81 GB/s, tuning took 0.319298 seconds at Mon Aug 19 22:05:08 2024
      8x16x16x16	N4quda6WilsonINS_9WilsonArgIsLi3ELi4EL21QudaReconstructType_s12EEEEE	policy_kernel=interior,comm=0001,commDim=0001,parity=1,host-host	128	1	1	256	1	1	12840	1	-1	-1	-1	1.66217e-05	# 2566.76 Gflop/s, 1178.40 GB/s, tuning took 0.344821 seconds at Mon Aug 19 22:05:08 2024
      8x16x16x16	N4quda6WilsonINS_9WilsonArgIsLi3ELi4EL21QudaReconstructType_s12EEEEE	policy_kernel=interior,comm=0001,commDim=0001,parity=1,host-remote	112	1	1	293	1	1	12840	1	-1	-1	-1	1.86683e-05	# 2285.37 Gflop/s, 1049.22 GB/s, tuning took 0.366247 seconds at Mon Aug 19 22:05:09 2024
      8x16x16x16	N4quda6WilsonINS_9WilsonArgIsLi3ELi4EL21QudaReconstructType_s12EEEEE	policy_kernel=interior,comm=0001,commDim=0001,xpay,dagger,parity=1	32	1	1	1024	1	1	0	-1	-1	-1	-1	1.6331e-05	# 2705.75 Gflop/s, 1181.32 GB/s, tuning took 0.041424 seconds at Mon Aug 19 22:05:12 2024
      8x16x16x16	N4quda6WilsonINS_9WilsonArgIsLi3ELi4EL21QudaReconstructType_s12EEEEE	policy_kernel=interior,comm=0001,commDim=0001,xpay,dagger,parity=1,host-device	32	1	1	1024	1	1	8346	9	-1	-1	-1	1.61109e-05	# 2745.76 Gflop/s, 1215.77 GB/s, tuning took 0.330191 seconds at Mon Aug 19 22:05:13 2024
      8x16x16x16	N4quda6WilsonINS_9WilsonArgIsLi3ELi4EL21QudaReconstructType_s12EEEEE	policy_kernel=interior,comm=0001,commDim=0001,xpay,dagger,parity=1,host-host	32	1	1	1024	1	1	0	11	-1	-1	-1	1.81035e-05	# 2443.54 Gflop/s, 1081.95 GB/s, tuning took 0.356396 seconds at Mon Aug 19 22:05:13 2024
      8x16x16x16	N4quda6WilsonINS_9WilsonArgIsLi3ELi4EL21QudaReconstructType_s12EEEEE	policy_kernel=interior,comm=0001,commDim=0001,xpay,dagger,parity=1,host-remote	96	1	1	342	1	1	12840	1	-1	-1	-1	1.90946e-05	# 2316.72 Gflop/s, 1025.79 GB/s, tuning took 0.371509 seconds at Mon Aug 19 22:05:14 2024
      8x16x16x16	N4quda6WilsonINS_9WilsonArgIsLi3ELi4EL21QudaReconstructType_s12EEEEE	policy_kernel=interior,comm=0001,commDim=0001,xpay,parity=1	64	1	1	512	1	1	0	-1	-1	-1	-1	1.63487e-05	# 2702.83 Gflop/s, 1180.05 GB/s, tuning took 0.041388 seconds at Mon Aug 19 22:05:09 2024
      8x16x16x16	N4quda6WilsonINS_9WilsonArgIsLi3ELi4EL21QudaReconstructType_s12EEEEE	policy_kernel=interior,comm=0001,commDim=0001,xpay,parity=1,host-device	64	1	1	512	1	1	5385	9	-1	-1	-1	1.6128e-05	# 2742.86 Gflop/s, 1214.48 GB/s, tuning took 0.331201 seconds at Mon Aug 19 22:05:10 2024
      8x16x16x16	N4quda6WilsonINS_9WilsonArgIsLi3ELi4EL21QudaReconstructType_s12EEEEE	policy_kernel=interior,comm=0001,commDim=0001,xpay,parity=1,host-host	80	1	1	410	1	1	13910	12	-1	-1	-1	1.81808e-05	# 2433.16 Gflop/s, 1077.35 GB/s, tuning took 0.356308 seconds at Mon Aug 19 22:05:09 2024
      8x16x16x16	N4quda6WilsonINS_9WilsonArgIsLi3ELi4EL21QudaReconstructType_s12EEEEE	policy_kernel=interior,comm=0001,commDim=0001,xpay,parity=1,host-remote	112	1	1	293	1	1	9819	1	-1	-1	-1	1.90344e-05	# 2324.05 Gflop/s, 1029.04 GB/s, tuning took 0.371418 seconds at Mon Aug 19 22:05:10 2024
  bytes=12582912	cudaMemsetAsync	zero,color_spinor_field.cpp,469	32	1	1	1	1	1	0	-1	-1	-1	-1	7.60015e-06	# 0.00 Gflop/s, 1655.61 GB/s, tuning took 0.000896 seconds at Mon Aug 19 22:04:56 2024
   bytes=1572864	cudaMemset	allocateGhostBuffer,lattice_field.cpp,288	32	1	1	1	1	1	0	-1	-1	-1	-1	6.91435e-06	# 0.00 Gflop/s, 227.48 GB/s, tuning took 0.000828 seconds at Mon Aug 19 22:04:55 2024
   bytes=1572864	cudaMemset	allocateGhostBuffer,lattice_field.cpp,293	32	1	1	1	1	1	0	-1	-1	-1	-1	6.97072e-06	# 0.00 Gflop/s, 225.64 GB/s, tuning took 0.000829 seconds at Mon Aug 19 22:04:55 2024
   bytes=1703936	cudaMemsetAsync	zero,color_spinor_field.cpp,469	32	1	1	1	1	1	0	-1	-1	-1	-1	3.29277e-06	# 0.00 Gflop/s, 517.48 GB/s, tuning took 0.000770 seconds at Mon Aug 19 22:05:07 2024
    bytes=393216	cudaMemcpyDeviceToDevice	exchangeGhost,cuda_gauge_field.cpp,193	32	1	1	1	1	1	0	-1	-1	-1	-1	6.58554e-06	# 0.00 Gflop/s, 119.42 GB/s, tuning took 0.000796 seconds at Mon Aug 19 22:04:55 2024
   bytes=6291456	cudaMemsetAsync	zero,color_spinor_field.cpp,469	32	1	1	1	1	1	0	-1	-1	-1	-1	5.25193e-06	# 0.00 Gflop/s, 1197.93 GB/s, tuning took 0.000909 seconds at Mon Aug 19 22:05:00 2024
   bytes=9437184	cudaMemcpyDefault	copy,cuda_gauge_field.cpp,576	32	1	1	1	1	1	0	-1	-1	-1	-1	1.792e-05	# 0.00 Gflop/s, 526.63 GB/s, tuning took 0.005478 seconds at Mon Aug 19 22:04:55 2024
   bytes=9437184	cudaMemcpyDefault	saveCPUField,cuda_gauge_field.cpp,658	32	1	1	1	1	1	0	-1	-1	-1	-1	9.99906e-06	# 0.00 Gflop/s, 943.81 GB/s, tuning took 0.000985 seconds at Mon Aug 19 22:04:55 2024
