test/.cache/tunecache.tsv
tunecache	1.1.0	1.1.0--sm_80	cpu_arch=x86_64,gpu_arch=sm_80,cuda_version=12.3.103	# Last updated Wed Aug 14 17:56:42 2024

          volume	name	aux	block.x	block.y	block.z	grid.x	grid.y	grid.z	shared_bytes	aux.x	aux.y	aux.z	aux.w	time	comment
         1179648	N4quda15TransformReduceINS_7maximumIdEEKNS_7complexIdEEmNS_8abs_max_IddEENS_8identityEEE	GPU-offline,batch_size=1	128	1	1	47	1	1	0	-1	-1	-1	-1	6.638e-05	# 0.00 Gflop/s, 284.34 GB/s, tuning took 0.336396 seconds at Wed Aug 14 16:57:59 2024
          147456	N4quda15TransformReduceINS_7maximumIdEEKNS_7complexIdEEmNS_8abs_max_IddEENS_8identityEEE	GPU-offline,batch_size=1	256	1	1	47	1	1	0	-1	-1	-1	-1	2.80976e-05	# 0.00 Gflop/s, 83.97 GB/s, tuning took 0.080120 seconds at Wed Aug 14 17:36:05 2024
     16x16x16x16	N4quda10CopyCloverINS_6clover11FloatNOrderIfLi72ELi4ELb0ELb0ELb0EEENS2_IdLi72ELi2ELb0ELb0ELb0EEEfdEE	GPU-offline,vol=65536precision=8Nc=3	128	1	1	256	2	1	12289	-1	-1	-1	-1	0.000232243	# 0.00 Gflop/s, 243.81 GB/s, tuning took 0.216895 seconds at Wed Aug 14 17:33:54 2024
     16x16x16x16	N4quda10CopyCloverINS_6clover11FloatNOrderIsLi72ELi8ELb0ELb0ELb0EEENS2_IdLi72ELi2ELb0ELb0ELb0EEEsdEE	GPU-offline,vol=65536precision=8Nc=3	320	1	1	103	2	1	24577	-1	-1	-1	-1	0.000196267	# 0.00 Gflop/s, 240.42 GB/s, tuning took 0.184357 seconds at Wed Aug 14 17:33:54 2024
     16x16x16x16	N4quda10GaugeGaussIdLi3EL21QudaReconstructType_s12EEE	GPU-offline,vol=65536stride=34816precision=8geometry=4Nc=3,lie_group	32	2	1	1024	1	1	2049	-1	-1	-1	-1	0.00357001	# 0.00 Gflop/s, 7.49 GB/s, tuning took 2.307142 seconds at Wed Aug 14 17:33:22 2024
     16x16x16x16	N4quda11CopyGaugeExIddLi18ENS_5gauge11FloatNOrderIdLi18ELi2ELi18EL20QudaStaggeredPhase_s0ELb1EL19QudaGhostExchange_sn2147483648ELb0EEENS2_IdLi18ELi2ELi12ELS3_0ELb1ELS4_n2147483648ELb0EEEEE	GPU-offline,vol=65536stride=34816precision=8geometry=4Nc=3vol=65536stride=32768precision=8geometry=4Nc=3r=0000	32	2	1	1024	1	1	9831	-1	-1	-1	-1	0.000272384	# 0.00 Gflop/s, 236.75 GB/s, tuning took 0.254893 seconds at Wed Aug 14 17:33:55 2024
     16x16x16x16	N4quda11CopyGaugeExIddLi18ENS_5gauge11FloatNOrderIdLi18ELi2ELi18EL20QudaStaggeredPhase_s0ELb1EL19QudaGhostExchange_sn2147483648ELb0EEES5_EE	GPU-offline,vol=65536stride=34816precision=8geometry=4Nc=3vol=65536stride=32768precision=8geometry=4Nc=3r=0000	32	2	1	1024	1	1	8193	-1	-1	-1	-1	0.00033308	# 0.00 Gflop/s, 233.75 GB/s, tuning took 0.285314 seconds at Wed Aug 14 17:33:23 2024
     16x16x16x16	N4quda12CloverInvertIdEE	GPU-offline,nParity=2,vol=65536precision=8Nc=3,trlog=true,twist=false	32	2	1	48	1	1	2235	-1	-1	-1	-1	0.00114181	# 0.00 Gflop/s, 66.12 GB/s, tuning took 25.185267 seconds at Wed Aug 14 17:33:53 2024
     16x16x16x16	N4quda12ExtractGhostIdLi3ENS_5gauge11FloatNOrderIdLi18ELi2ELi12EL20QudaStaggeredPhase_s0ELb1EL19QudaGhostExchange_sn2147483648ELb0EEEEE	GPU-offline,vol=65536stride=34816precision=8geometry=4Nc=3,extract	64	1	1	64	1	8	0	-1	-1	-1	-1	9.44588e-06	# 0.00 Gflop/s, 333.03 GB/s, tuning took 0.046908 seconds at Wed Aug 14 17:33:16 2024
     16x16x16x16	N4quda12ExtractGhostIdLi3ENS_5gauge11FloatNOrderIdLi18ELi2ELi18EL20QudaStaggeredPhase_s0ELb1EL19QudaGhostExchange_sn2147483648ELb0EEEEE	GPU-offline,vol=65536stride=34816precision=8geometry=4Nc=3,extract	32	1	2	128	1	4	2587	-1	-1	-1	-1	8.44228e-06	# 0.00 Gflop/s, 558.92 GB/s, tuning took 0.031935 seconds at Wed Aug 14 17:33:23 2024
     16x16x16x16	N4quda13ComputeCloverIdEE	GPU-offline,vol=65536precision=8Nc=3	32	2	1	1024	1	1	0	-1	-1	-1	-1	0.00038912	# 80.84 Gflop/s, 242.53 GB/s, tuning took 0.038523 seconds at Wed Aug 14 17:33:28 2024
     16x16x16x16	N4quda5FmunuIdLi3EL21QudaReconstructType_s18EEE	GPU-offline,vol=65536stride=32768precision=8geometry=4Nc=3r=0000,comm=0000	32	2	2	1024	1	3	0	-1	-1	-1	-1	0.00455135	# 213.05 Gflop/s, 211.50 GB/s, tuning took 4.603545 seconds at Wed Aug 14 17:33:28 2024
     16x16x16x16	N4quda7RNGInitE	GPU-offline,vol=65536stride=34816precision=8geometry=4Nc=3	64	1	1	512	2	1	0	-1	-1	-1	-1	0.0238906	# 0.00 Gflop/s, 0.00 GB/s, tuning took 3.258098 seconds at Wed Aug 14 17:33:19 2024
     16x16x16x16	N4quda9CopyGaugeINS_12CopyGaugeArgIddLi18ELb0ENS_5gauge11FloatNOrderIdLi18ELi2ELi12EL20QudaStaggeredPhase_s0ELb1EL19QudaGhostExchange_sn2147483648ELb0EEENS2_8QDPOrderIdLi18EEEEEEE	GPU-offline,vol=65536stride=32768precision=8geometry=4Nc=3,vol=65536stride=34816precision=8geometry=4Nc=3	32	1	2	1024	1	4	7022	-1	-1	-1	-1	0.00026828	# 0.00 Gflop/s, 240.37 GB/s, tuning took 0.368578 seconds at Wed Aug 14 17:33:16 2024
     16x16x16x16	N4quda9CopyGaugeINS_12CopyGaugeArgIddLi18ELb0ENS_5gauge11FloatNOrderIdLi18ELi2ELi12EL20QudaStaggeredPhase_s0ELb1EL19QudaGhostExchange_sn2147483648ELb0EEES6_EEEE	GPU-offline,vol=65536stride=34816precision=8geometry=4Nc=3,vol=65536stride=34816precision=8geometry=4Nc=3,ghost	32	1	1	64	1	8	0	-1	-1	-1	-1	9.69512e-06	# 0.00 Gflop/s, 344.74 GB/s, tuning took 0.046871 seconds at Wed Aug 14 17:33:16 2024
     16x16x16x16	N4quda9CopyGaugeINS_12CopyGaugeArgIddLi18ELb0ENS_5gauge11FloatNOrderIdLi18ELi2ELi18EL20QudaStaggeredPhase_s0ELb1EL19QudaGhostExchange_sn2147483648ELb0EEENS2_8QDPOrderIdLi18EEEEEEE	GPU-offline,vol=65536stride=32768precision=8geometry=4Nc=3,vol=65536stride=34816precision=8geometry=4Nc=3	32	1	3	1024	1	3	6145	-1	-1	-1	-1	0.000328704	# 0.00 Gflop/s, 236.86 GB/s, tuning took 0.452786 seconds at Wed Aug 14 17:33:23 2024
     16x16x16x16	N4quda9CopyGaugeINS_12CopyGaugeArgIddLi18ELb0ENS_5gauge11FloatNOrderIdLi18ELi2ELi18EL20QudaStaggeredPhase_s0ELb1EL19QudaGhostExchange_sn2147483648ELb0EEES6_EEEE	GPU-offline,vol=65536stride=34816precision=8geometry=4Nc=3,vol=65536stride=34816precision=8geometry=4Nc=3,ghost	32	1	2	64	1	4	3073	-1	-1	-1	-1	8.0827e-06	# 0.00 Gflop/s, 620.28 GB/s, tuning took 0.041162 seconds at Wed Aug 14 17:33:23 2024
     16x16x16x16	N4quda9CopyGaugeINS_12CopyGaugeArgIddLi18ELb0ENS_5gauge8QDPOrderIdLi18EEENS2_11FloatNOrderIdLi18ELi2ELi12EL20QudaStaggeredPhase_s0ELb1EL19QudaGhostExchange_sn2147483648ELb0EEEEEEE	GPU-offline,vol=65536stride=34816precision=8geometry=4Nc=3,vol=65536stride=32768precision=8geometry=4Nc=3	64	1	2	512	1	4	5462	-1	-1	-1	-1	0.0002688	# 0.00 Gflop/s, 239.91 GB/s, tuning took 0.371178 seconds at Wed Aug 14 17:33:22 2024
     16x16x16x16	N4quda9CopyGaugeINS_12CopyGaugeArgIfdLi18ELb0ENS_5gauge11FloatNOrderIfLi18ELi4ELi12EL20QudaStaggeredPhase_s0ELb1EL19QudaGhostExchange_sn2147483648ELb0EEENS3_IdLi18ELi2ELi12ELS4_0ELb1ELS5_n2147483648ELb0EEEEEEE	GPU-offline,vol=65536stride=34816precision=8geometry=4Nc=3,vol=65536stride=34816precision=4geometry=4Nc=3	64	1	3	512	1	3	0	-1	-1	-1	-1	0.000100588	# 0.00 Gflop/s, 398.73 GB/s, tuning took 0.151372 seconds at Wed Aug 14 17:33:16 2024
     16x16x16x16	N4quda9CopyGaugeINS_12CopyGaugeArgIfdLi18ELb0ENS_5gauge11FloatNOrderIfLi18ELi4ELi12EL20QudaStaggeredPhase_s0ELb1EL19QudaGhostExchange_sn2147483648ELb0EEENS3_IdLi18ELi2ELi12ELS4_0ELb1ELS5_n2147483648ELb0EEEEEEE	GPU-offline,vol=65536stride=34816precision=8geometry=4Nc=3,vol=65536stride=34816precision=4geometry=4Nc=3,ghost	64	1	3	32	1	3	0	-1	-1	-1	-1	7.87327e-06	# 0.00 Gflop/s, 318.39 GB/s, tuning took 0.038161 seconds at Wed Aug 14 17:33:16 2024
     16x16x16x16	N4quda9CopyGaugeINS_12CopyGaugeArgIfdLi18ELb0ENS_5gauge11FloatNOrderIfLi18ELi4ELi12EL20QudaStaggeredPhase_s0ELb1EL19QudaGhostExchange_sn2147483648ELb0EEENS3_IdLi18ELi2ELi18ELS4_0ELb1ELS5_n2147483648ELb0EEEEEEE	GPU-offline,vol=65536stride=34816precision=8geometry=4Nc=3,vol=65536stride=34816precision=4geometry=4Nc=3	608	1	1	54	1	8	0	-1	-1	-1	-1	9.66656e-05	# 0.00 Gflop/s, 553.22 GB/s, tuning took 0.164108 seconds at Wed Aug 14 17:33:23 2024
     16x16x16x16	N4quda9CopyGaugeINS_12CopyGaugeArgIfdLi18ELb0ENS_5gauge11FloatNOrderIfLi18ELi4ELi12EL20QudaStaggeredPhase_s0ELb1EL19QudaGhostExchange_sn2147483648ELb0EEENS3_IdLi18ELi2ELi18ELS4_0ELb1ELS5_n2147483648ELb0EEEEEEE	GPU-offline,vol=65536stride=34816precision=8geometry=4Nc=3,vol=65536stride=34816precision=4geometry=4Nc=3,ghost	64	1	1	32	1	8	2138	-1	-1	-1	-1	8.45648e-06	# 0.00 Gflop/s, 395.24 GB/s, tuning took 0.033699 seconds at Wed Aug 14 17:33:23 2024
     16x16x16x16	N4quda9CopyGaugeINS_12CopyGaugeArgIsdLi18ELb0ENS_5gauge11FloatNOrderIsLi18ELi4ELi12EL20QudaStaggeredPhase_s0ELb1EL19QudaGhostExchange_sn2147483648ELb0EEENS3_IdLi18ELi2ELi12ELS4_0ELb1ELS5_n2147483648ELb0EEEEEEE	GPU-offline,vol=65536stride=34816precision=8geometry=4Nc=3,vol=65536stride=34816precision=2geometry=4Nc=3	96	1	1	342	1	8	3511	-1	-1	-1	-1	5.69458e-05	# 0.00 Gflop/s, 586.93 GB/s, tuning took 0.108202 seconds at Wed Aug 14 17:33:16 2024
     16x16x16x16	N4quda9CopyGaugeINS_12CopyGaugeArgIsdLi18ELb0ENS_5gauge11FloatNOrderIsLi18ELi4ELi12EL20QudaStaggeredPhase_s0ELb1EL19QudaGhostExchange_sn2147483648ELb0EEENS3_IdLi18ELi2ELi12ELS4_0ELb1ELS5_n2147483648ELb0EEEEEEE	GPU-offline,vol=65536stride=34816precision=8geometry=4Nc=3,vol=65536stride=34816precision=2geometry=4Nc=3,ghost	64	1	1	32	1	8	2138	-1	-1	-1	-1	8.24625e-06	# 0.00 Gflop/s, 253.32 GB/s, tuning took 0.033793 seconds at Wed Aug 14 17:33:16 2024
     16x16x16x16	N4quda9CopyGaugeINS_12CopyGaugeArgIsdLi18ELb0ENS_5gauge11FloatNOrderIsLi18ELi4ELi12EL20QudaStaggeredPhase_s0ELb1EL19QudaGhostExchange_sn2147483648ELb0EEENS3_IdLi18ELi2ELi18ELS4_0ELb1ELS5_n2147483648ELb0EEEEEEE	GPU-offline,vol=65536stride=34816precision=8geometry=4Nc=3,vol=65536stride=34816precision=2geometry=4Nc=3	352	1	1	94	1	8	0	-1	-1	-1	-1	5.71804e-05	# 0.00 Gflop/s, 818.33 GB/s, tuning took 0.118918 seconds at Wed Aug 14 17:33:23 2024
     16x16x16x16	N4quda9CopyGaugeINS_12CopyGaugeArgIsdLi18ELb0ENS_5gauge11FloatNOrderIsLi18ELi4ELi12EL20QudaStaggeredPhase_s0ELb1EL19QudaGhostExchange_sn2147483648ELb0EEENS3_IdLi18ELi2ELi18ELS4_0ELb1ELS5_n2147483648ELb0EEEEEEE	GPU-offline,vol=65536stride=34816precision=8geometry=4Nc=3,vol=65536stride=34816precision=2geometry=4Nc=3,ghost	736	1	1	3	1	8	24577	-1	-1	-1	-1	8.52429e-06	# 0.00 Gflop/s, 343.08 GB/s, tuning took 0.038383 seconds at Wed Aug 14 17:33:23 2024
     16x32x32x64	N4quda10GaugeGaussIdLi3EL21QudaReconstructType_s12EEE	GPU-offline,vol=1048576stride=557056precision=8geometry=4Nc=3,lie_group	32	2	1	16384	1	1	2587	-1	-1	-1	-1	0.0565961	# 0.00 Gflop/s, 7.56 GB/s, tuning took 35.412488 seconds at Wed Aug 14 17:12:56 2024
     16x32x32x64	N4quda12ExtractGhostIdLi3ENS_5gauge11FloatNOrderIdLi18ELi2ELi12EL20QudaStaggeredPhase_s0ELb1EL19QudaGhostExchange_sn2147483648ELb0EEEEE	GPU-offline,vol=1048576stride=557056precision=8geometry=4Nc=3,extract	256	1	1	256	1	8	8193	-1	-1	-1	-1	0.000149211	# 0.00 Gflop/s, 189.74 GB/s, tuning took 0.235856 seconds at Wed Aug 14 17:11:18 2024
     16x32x32x64	N4quda12ExtractGhostIdLi3ENS_5gauge11FloatNOrderIdLi18ELi2ELi18EL20QudaStaggeredPhase_s0ELb1EL19QudaGhostExchange_sn2147483648ELb0EEEEE	GPU-offline,vol=1048576stride=557056precision=8geometry=4Nc=3,extract	32	1	8	2048	1	1	16385	-1	-1	-1	-1	0.000222618	# 0.00 Gflop/s, 190.76 GB/s, tuning took 0.325355 seconds at Wed Aug 14 17:13:09 2024
     16x32x32x64	N4quda7RNGInitE	GPU-offline,vol=1048576stride=557056precision=8geometry=4Nc=3	192	1	1	2731	2	1	0	-1	-1	-1	-1	0.432432	# 0.00 Gflop/s, 0.00 GB/s, tuning took 55.866702 seconds at Wed Aug 14 17:12:20 2024
     16x32x32x64	N4quda9CopyGaugeINS_12CopyGaugeArgIddLi18ELb0ENS_5gauge11FloatNOrderIdLi18ELi2ELi12EL20QudaStaggeredPhase_s0ELb1EL19QudaGhostExchange_sn2147483648ELb0EEENS2_8QDPOrderIdLi18EEEEEEE	GPU-offline,vol=1048576stride=524288precision=8geometry=4Nc=3,vol=1048576stride=557056precision=8geometry=4Nc=3	32	1	2	16384	1	4	12289	-1	-1	-1	-1	0.00434893	# 0.00 Gflop/s, 237.25 GB/s, tuning took 5.552351 seconds at Wed Aug 14 17:11:18 2024
     16x32x32x64	N4quda9CopyGaugeINS_12CopyGaugeArgIddLi18ELb0ENS_5gauge11FloatNOrderIdLi18ELi2ELi12EL20QudaStaggeredPhase_s0ELb1EL19QudaGhostExchange_sn2147483648ELb0EEES6_EEEE	GPU-offline,vol=1048576stride=557056precision=8geometry=4Nc=3,vol=1048576stride=557056precision=8geometry=4Nc=3,ghost	32	1	5	1024	1	2	0	-1	-1	-1	-1	2.37958e-05	# 0.00 Gflop/s, 1264.13 GB/s, tuning took 0.073954 seconds at Wed Aug 14 17:11:18 2024
     16x32x32x64	N4quda9CopyGaugeINS_12CopyGaugeArgIddLi18ELb0ENS_5gauge11FloatNOrderIdLi18ELi2ELi18EL20QudaStaggeredPhase_s0ELb1EL19QudaGhostExchange_sn2147483648ELb0EEENS2_8QDPOrderIdLi18EEEEEEE	GPU-offline,vol=1048576stride=524288precision=8geometry=4Nc=3,vol=1048576stride=557056precision=8geometry=4Nc=3	32	1	2	16384	1	4	4097	-1	-1	-1	-1	0.00535689	# 0.00 Gflop/s, 232.54 GB/s, tuning took 6.596662 seconds at Wed Aug 14 17:13:09 2024
     16x32x32x64	N4quda9CopyGaugeINS_12CopyGaugeArgIddLi18ELb0ENS_5gauge11FloatNOrderIdLi18ELi2ELi18EL20QudaStaggeredPhase_s0ELb1EL19QudaGhostExchange_sn2147483648ELb0EEES6_EEEE	GPU-offline,vol=1048576stride=557056precision=8geometry=4Nc=3,vol=1048576stride=557056precision=8geometry=4Nc=3,ghost	32	1	1	1024	1	8	3781	-1	-1	-1	-1	0.000123335	# 0.00 Gflop/s, 365.85 GB/s, tuning took 0.187584 seconds at Wed Aug 14 17:13:09 2024
     16x32x32x64	N4quda9CopyGaugeINS_12CopyGaugeArgIddLi18ELb0ENS_5gauge8QDPOrderIdLi18EEENS2_11FloatNOrderIdLi18ELi2ELi12EL20QudaStaggeredPhase_s0ELb1EL19QudaGhostExchange_sn2147483648ELb0EEEEEEE	GPU-offline,vol=1048576stride=557056precision=8geometry=4Nc=3,vol=1048576stride=524288precision=8geometry=4Nc=3	32	1	3	16384	1	3	6145	-1	-1	-1	-1	0.00447215	# 0.00 Gflop/s, 230.72 GB/s, tuning took 5.565940 seconds at Wed Aug 14 17:13:02 2024
     16x32x32x64	N4quda9CopyGaugeINS_12CopyGaugeArgIfdLi18ELb0ENS_5gauge11FloatNOrderIfLi18ELi4ELi12EL20QudaStaggeredPhase_s0ELb1EL19QudaGhostExchange_sn2147483648ELb0EEENS3_IdLi18ELi2ELi12ELS4_0ELb1ELS5_n2147483648ELb0EEEEEEE	GPU-offline,vol=1048576stride=557056precision=8geometry=4Nc=3,vol=1048576stride=557056precision=4geometry=4Nc=3	96	1	1	5462	1	8	8193	-1	-1	-1	-1	0.00258492	# 0.00 Gflop/s, 248.26 GB/s, tuning took 3.279685 seconds at Wed Aug 14 17:11:24 2024
     16x32x32x64	N4quda9CopyGaugeINS_12CopyGaugeArgIfdLi18ELb0ENS_5gauge11FloatNOrderIfLi18ELi4ELi12EL20QudaStaggeredPhase_s0ELb1EL19QudaGhostExchange_sn2147483648ELb0EEENS3_IdLi18ELi2ELi12ELS4_0ELb1ELS5_n2147483648ELb0EEEEEEE	GPU-offline,vol=1048576stride=557056precision=8geometry=4Nc=3,vol=1048576stride=557056precision=4geometry=4Nc=3,ghost	256	1	1	128	1	8	0	-1	-1	-1	-1	3.33141e-05	# 0.00 Gflop/s, 677.21 GB/s, tuning took 0.089301 seconds at Wed Aug 14 17:11:25 2024
     16x32x32x64	N4quda9CopyGaugeINS_12CopyGaugeArgIfdLi18ELb0ENS_5gauge11FloatNOrderIfLi18ELi4ELi12EL20QudaStaggeredPhase_s0ELb1EL19QudaGhostExchange_sn2147483648ELb0EEENS3_IdLi18ELi2ELi18ELS4_0ELb1ELS5_n2147483648ELb0EEEEEEE	GPU-offline,vol=1048576stride=557056precision=8geometry=4Nc=3,vol=1048576stride=557056precision=4geometry=4Nc=3	96	1	1	5462	1	8	7022	-1	-1	-1	-1	0.00258935	# 0.00 Gflop/s, 330.44 GB/s, tuning took 3.295331 seconds at Wed Aug 14 17:13:15 2024
     16x32x32x64	N4quda9CopyGaugeINS_12CopyGaugeArgIsdLi18ELb0ENS_5gauge11FloatNOrderIsLi18ELi4ELi12EL20QudaStaggeredPhase_s0ELb1EL19QudaGhostExchange_sn2147483648ELb0EEENS3_IdLi18ELi2ELi12ELS4_0ELb1ELS5_n2147483648ELb0EEEEEEE	GPU-offline,vol=1048576stride=557056precision=8geometry=4Nc=3,vol=1048576stride=557056precision=2geometry=4Nc=3	64	1	2	8192	1	4	4916	-1	-1	-1	-1	0.00210364	# 0.00 Gflop/s, 254.21 GB/s, tuning took 2.653731 seconds at Wed Aug 14 17:11:21 2024
     16x32x32x64	N4quda9CopyGaugeINS_12CopyGaugeArgIsdLi18ELb0ENS_5gauge11FloatNOrderIsLi18ELi4ELi12EL20QudaStaggeredPhase_s0ELb1EL19QudaGhostExchange_sn2147483648ELb0EEENS3_IdLi18ELi2ELi12ELS4_0ELb1ELS5_n2147483648ELb0EEEEEEE	GPU-offline,vol=1048576stride=557056precision=8geometry=4Nc=3,vol=1048576stride=557056precision=2geometry=4Nc=3,ghost	32	1	1	1024	1	8	0	-1	-1	-1	-1	3.33109e-05	# 0.00 Gflop/s, 564.40 GB/s, tuning took 0.090375 seconds at Wed Aug 14 17:11:21 2024
     16x32x32x64	N4quda9CopyGaugeINS_12CopyGaugeArgIsdLi18ELb0ENS_5gauge11FloatNOrderIsLi18ELi4ELi12EL20QudaStaggeredPhase_s0ELb1EL19QudaGhostExchange_sn2147483648ELb0EEENS3_IdLi18ELi2ELi18ELS4_0ELb1ELS5_n2147483648ELb0EEEEEEE	GPU-offline,vol=1048576stride=557056precision=8geometry=4Nc=3,vol=1048576stride=557056precision=2geometry=4Nc=3	32	1	4	16384	1	2	16385	-1	-1	-1	-1	0.00210261	# 0.00 Gflop/s, 356.07 GB/s, tuning took 2.699420 seconds at Wed Aug 14 17:13:12 2024
     16x32x32x64	N4quda9CopyGaugeINS_12CopyGaugeArgIsdLi18ELb0ENS_5gauge11FloatNOrderIsLi18ELi4ELi12EL20QudaStaggeredPhase_s0ELb1EL19QudaGhostExchange_sn2147483648ELb0EEENS3_IdLi18ELi2ELi18ELS4_0ELb1ELS5_n2147483648ELb0EEEEEEE	GPU-offline,vol=1048576stride=557056precision=8geometry=4Nc=3,vol=1048576stride=557056precision=2geometry=4Nc=3,ghost	128	1	1	256	1	8	0	-1	-1	-1	-1	3.33515e-05	# 0.00 Gflop/s, 789.20 GB/s, tuning took 0.089021 seconds at Wed Aug 14 17:13:12 2024
         2359296	N4quda15TransformReduceINS_7maximumIdEEKNS_7complexIdEEmNS_8abs_max_IddEENS_8identityEEE	GPU-offline,batch_size=1	512	1	1	44	1	1	0	-1	-1	-1	-1	0.000173013	# 0.00 Gflop/s, 218.18 GB/s, tuning took 0.822904 seconds at Wed Aug 14 17:33:54 2024
          294912	N4quda15TransformReduceINS_7maximumIdEEKNS_7complexIdEEmNS_8abs_max_IddEENS_8identityEEE	GPU-offline,batch_size=1	512	1	1	23	1	1	0	-1	-1	-1	-1	3.38911e-05	# 0.00 Gflop/s, 139.23 GB/s, tuning took 0.110980 seconds at Wed Aug 14 17:49:47 2024
      2x16x16x32	N4quda15CopyColorSpinorILi4ELi3ENS_11colorspinor11FloatNOrderIdLi4ELi3ELi2ELb0ELb0EEENS1_21SpaceSpinorColorOrderIdLi4ELi3EEESt5tupleIJRNS_16ColorSpinorFieldERKS7_19QudaFieldLocation_sPdPKdEEEE	GPU-offline,vol=16384,parity=1,precision=8,order=9,Ns=4,Nc=3vol=16384,parity=1,precision=8,order=2,Ns=4,Nc=3,NonRelBasis	96	1	1	171	1	1	0	-1	-1	-1	-1	1.10921e-05	# 0.00 Gflop/s, 567.20 GB/s, tuning took 0.015977 seconds at Wed Aug 14 17:38:47 2024
      2x16x16x32	N4quda15CopyColorSpinorILi4ELi3ENS_11colorspinor21SpaceSpinorColorOrderIdLi4ELi3EEENS1_11FloatNOrderIdLi4ELi3ELi2ELb0ELb0EEESt5tupleIJRNS_16ColorSpinorFieldERKS7_19QudaFieldLocation_sPdPKdEEEE	GPU-offline,vol=16384,parity=1,precision=8,order=2,Ns=4,Nc=3vol=16384,parity=1,precision=8,order=9,Ns=4,Nc=3,RelBasis	192	1	1	86	1	1	0	-1	-1	-1	-1	1.31922e-05	# 0.00 Gflop/s, 476.91 GB/s, tuning took 0.017739 seconds at Wed Aug 14 17:38:47 2024
      2x16x16x32	N4quda26WilsonCloverPreconditionedINS_15WilsonCloverArgIdLi3ELi4EL21QudaReconstructType_s12EEEEE	policy,commDim=0000,parity=1,topo=1111,p2p=0,gdr=0,nvshmem=0,pol=110000111100110000	32	1	1	1	1	1	0	7	0	0	-1	0.000232038	# 128.79 Gflop/s, 203.35 GB/s, tuning took 0.018760 seconds at Wed Aug 14 17:38:47 2024
      2x16x16x32	N4quda26WilsonCloverPreconditionedINS_15WilsonCloverArgIdLi3ELi4EL21QudaReconstructType_s12EEEEE	policy_kernel=interior,comm=0000,commDim=0000,parity=1	32	1	1	512	1	1	14483	-1	-1	-1	-1	0.000232038	# 128.79 Gflop/s, 203.35 GB/s, tuning took 0.301195 seconds at Wed Aug 14 17:38:47 2024
         2x4x4x4	N4quda15CopyColorSpinorILi4ELi3ENS_11colorspinor11FloatNOrderIdLi4ELi3ELi2ELb0ELb0EEENS1_21SpaceSpinorColorOrderIdLi4ELi3EEESt5tupleIJRNS_16ColorSpinorFieldERKS7_19QudaFieldLocation_sPdPKdEEEE	GPU-offline,vol=128,parity=1,precision=8,order=9,Ns=4,Nc=3vol=128,parity=1,precision=8,order=2,Ns=4,Nc=3,NonRelBasis	64	1	1	2	1	1	0	-1	-1	-1	-1	6.23595e-06	# 0.00 Gflop/s, 7.88 GB/s, tuning took 0.020265 seconds at Wed Aug 14 17:04:42 2024
         2x4x4x4	N4quda15CopyColorSpinorILi4ELi3ENS_11colorspinor21SpaceSpinorColorOrderIdLi4ELi3EEENS1_11FloatNOrderIdLi4ELi3ELi2ELb0ELb0EEESt5tupleIJRNS_16ColorSpinorFieldERKS7_19QudaFieldLocation_sPdPKdEEEE	GPU-offline,vol=128,parity=1,precision=8,order=2,Ns=4,Nc=3vol=128,parity=1,precision=8,order=9,Ns=4,Nc=3,RelBasis	64	1	1	2	1	1	0	-1	-1	-1	-1	5.57149e-06	# 0.00 Gflop/s, 8.82 GB/s, tuning took 0.017505 seconds at Wed Aug 14 17:04:42 2024
         2x4x4x4	N4quda26WilsonCloverPreconditionedINS_15WilsonCloverArgIdLi3ELi4EL21QudaReconstructType_s12EEEEE	policy,commDim=0000,parity=1,topo=1111,p2p=0,gdr=0,nvshmem=0,pol=110000111100110000	32	1	1	1	1	1	0	9	0	0	-1	1.59811e-05	# 14.61 Gflop/s, 23.07 GB/s, tuning took 0.012814 seconds at Wed Aug 14 17:04:42 2024
         2x4x4x4	N4quda26WilsonCloverPreconditionedINS_15WilsonCloverArgIdLi3ELi4EL21QudaReconstructType_s12EEEEE	policy_kernel=interior,comm=0000,commDim=0000,parity=1	16	1	1	8	1	1	33793	-1	-1	-1	-1	1.56688e-05	# 14.90 Gflop/s, 23.53 GB/s, tuning took 0.075009 seconds at Wed Aug 14 17:04:42 2024
      4x16x16x16	N4quda15CopyColorSpinorILi4ELi3ENS_11colorspinor11FloatNOrderIdLi4ELi3ELi2ELb0ELb0EEENS1_21SpaceSpinorColorOrderIdLi4ELi3EEESt5tupleIJRNS_16ColorSpinorFieldERKS7_19QudaFieldLocation_sPdPKdEEEE	GPU-offline,vol=16384,parity=1,precision=8,order=9,Ns=4,Nc=3vol=16384,parity=1,precision=8,order=2,Ns=4,Nc=3,NonRelBasis	64	1	1	256	1	1	0	-1	-1	-1	-1	1.13445e-05	# 0.00 Gflop/s, 554.58 GB/s, tuning took 0.020351 seconds at Wed Aug 14 16:58:00 2024
      4x16x16x16	N4quda15CopyColorSpinorILi4ELi3ENS_11colorspinor21SpaceSpinorColorOrderIdLi4ELi3EEENS1_11FloatNOrderIdLi4ELi3ELi2ELb0ELb0EEESt5tupleIJRNS_16ColorSpinorFieldERKS7_19QudaFieldLocation_sPdPKdEEEE	GPU-offline,vol=16384,parity=1,precision=8,order=2,Ns=4,Nc=3vol=16384,parity=1,precision=8,order=9,Ns=4,Nc=3,RelBasis	32	1	1	512	1	1	0	-1	-1	-1	-1	1.03054e-05	# 0.00 Gflop/s, 610.50 GB/s, tuning took 0.015922 seconds at Wed Aug 14 16:58:00 2024
      4x16x16x16	N4quda26WilsonCloverPreconditionedINS_15WilsonCloverArgIdLi3ELi4EL21QudaReconstructType_s12EEEEE	policy,commDim=0000,parity=1,topo=1111,p2p=0,gdr=0,nvshmem=0,pol=110000111100110000	32	1	1	1	1	1	0	0	0	0	-1	0.000232448	# 128.56 Gflop/s, 203.00 GB/s, tuning took 0.019195 seconds at Wed Aug 14 16:58:00 2024
      4x16x16x16	N4quda26WilsonCloverPreconditionedINS_15WilsonCloverArgIdLi3ELi4EL21QudaReconstructType_s12EEEEE	policy_kernel=interior,comm=0000,commDim=0000,parity=1	32	1	1	512	1	1	14483	-1	-1	-1	-1	0.000232429	# 128.57 Gflop/s, 203.01 GB/s, tuning took 0.358242 seconds at Wed Aug 14 16:58:00 2024
      4x16x16x16	N4quda6WilsonINS_9WilsonArgIdLi3ELi4EL21QudaReconstructType_s12EEEEE	policy,commDim=0000,parity=1,topo=1111,p2p=0,gdr=0,nvshmem=0,pol=110000111100110000	32	1	1	1	1	1	0	0	0	0	-1	0.000184832	# 117.01 Gflop/s, 204.23 GB/s, tuning took 0.016017 seconds at Wed Aug 14 17:26:46 2024
      4x16x16x16	N4quda6WilsonINS_9WilsonArgIdLi3ELi4EL21QudaReconstructType_s12EEEEE	policy_kernel=interior,comm=0000,commDim=0000,parity=1	352	1	1	47	1	1	0	-1	-1	-1	-1	0.000184832	# 117.01 Gflop/s, 204.23 GB/s, tuning took 0.334531 seconds at Wed Aug 14 17:26:46 2024
      4x16x16x32	N4quda10CopyCloverINS_6clover11FloatNOrderIfLi72ELi4ELb0ELb0ELb0EEENS2_IdLi72ELi2ELb0ELb0ELb0EEEfdEE	GPU-offline,vol=32768precision=8Nc=3	32	1	1	512	2	1	2049	-1	-1	-1	-1	4.41656e-05	# 0.00 Gflop/s, 641.03 GB/s, tuning took 0.051162 seconds at Wed Aug 14 17:38:47 2024
      4x16x16x32	N4quda10CopyCloverINS_6clover11FloatNOrderIsLi72ELi8ELb0ELb0ELb0EEENS2_IdLi72ELi2ELb0ELb0ELb0EEEsdEE	GPU-offline,vol=32768precision=8Nc=3	32	1	1	512	2	1	2049	-1	-1	-1	-1	4.39875e-05	# 0.00 Gflop/s, 536.36 GB/s, tuning took 0.053523 seconds at Wed Aug 14 17:38:47 2024
      4x16x16x32	N4quda10GaugeGaussIdLi3EL21QudaReconstructType_s12EEE	GPU-offline,vol=32768stride=20480precision=8geometry=4Nc=3,lie_group	32	1	1	512	2	1	2049	-1	-1	-1	-1	0.00179405	# 0.00 Gflop/s, 8.77 GB/s, tuning took 1.201491 seconds at Wed Aug 14 17:38:31 2024
      4x16x16x32	N4quda11CopyGaugeExIddLi18ENS_5gauge11FloatNOrderIdLi18ELi2ELi18EL20QudaStaggeredPhase_s0ELb1EL19QudaGhostExchange_sn2147483648ELb0EEENS2_IdLi18ELi2ELi12ELS3_0ELb1ELS4_n2147483648ELb0EEEEE	GPU-offline,vol=32768stride=20480precision=8geometry=4Nc=3vol=32768stride=16384precision=8geometry=4Nc=3r=0000	64	1	1	256	2	1	2458	-1	-1	-1	-1	4.28373e-05	# 0.00 Gflop/s, 807.78 GB/s, tuning took 0.057849 seconds at Wed Aug 14 17:38:47 2024
      4x16x16x32	N4quda11CopyGaugeExIddLi18ENS_5gauge11FloatNOrderIdLi18ELi2ELi18EL20QudaStaggeredPhase_s0ELb1EL19QudaGhostExchange_sn2147483648ELb0EEES5_EE	GPU-offline,vol=32768stride=20480precision=8geometry=4Nc=3vol=32768stride=16384precision=8geometry=4Nc=3r=0000	64	2	1	256	1	1	0	-1	-1	-1	-1	8.39078e-05	# 0.00 Gflop/s, 506.12 GB/s, tuning took 0.099307 seconds at Wed Aug 14 17:38:32 2024
      4x16x16x32	N4quda12CloverInvertIdEE	GPU-offline,nParity=2,vol=32768precision=8Nc=3,trlog=true,twist=false	64	2	1	24	1	1	4469	-1	-1	-1	-1	0.000616011	# 0.00 Gflop/s, 61.28 GB/s, tuning took 12.941625 seconds at Wed Aug 14 17:38:47 2024
      4x16x16x32	N4quda12ExtractGhostIdLi3ENS_5gauge11FloatNOrderIdLi18ELi2ELi12EL20QudaStaggeredPhase_s0ELb1EL19QudaGhostExchange_sn2147483648ELb0EEEEE	GPU-offline,vol=32768stride=20480precision=8geometry=4Nc=3,extract	64	1	6	128	1	2	0	-1	-1	-1	-1	5.45437e-06	# 0.00 Gflop/s, 468.60 GB/s, tuning took 0.043713 seconds at Wed Aug 14 17:38:28 2024
      4x16x16x32	N4quda12ExtractGhostIdLi3ENS_5gauge11FloatNOrderIdLi18ELi2ELi18EL20QudaStaggeredPhase_s0ELb1EL19QudaGhostExchange_sn2147483648ELb0EEEEE	GPU-offline,vol=32768stride=20480precision=8geometry=4Nc=3,extract	32	1	1	256	1	8	0	-1	-1	-1	-1	7.85904e-06	# 0.00 Gflop/s, 487.83 GB/s, tuning took 0.051596 seconds at Wed Aug 14 17:38:31 2024
      4x16x16x32	N4quda13ComputeCloverIdEE	GPU-offline,vol=32768precision=8Nc=3	64	2	1	256	1	1	0	-1	-1	-1	-1	0.000165742	# 94.90 Gflop/s, 284.70 GB/s, tuning took 0.026244 seconds at Wed Aug 14 17:38:34 2024
      4x16x16x32	N4quda15CopyColorSpinorILi4ELi3ENS_11colorspinor11FloatNOrderIdLi4ELi3ELi2ELb0ELb0EEENS1_21SpaceSpinorColorOrderIdLi4ELi3EEESt5tupleIJRNS_16ColorSpinorFieldERKS7_19QudaFieldLocation_sPdPKdEEEE	GPU-offline,vol=32768,parity=1,precision=8,order=9,Ns=4,Nc=3vol=32768,parity=1,precision=8,order=2,Ns=4,Nc=3,NonRelBasis	32	1	1	1024	1	1	0	-1	-1	-1	-1	1.73905e-05	# 0.00 Gflop/s, 723.55 GB/s, tuning took 0.021146 seconds at Wed Aug 14 17:37:50 2024
      4x16x16x32	N4quda15CopyColorSpinorILi4ELi3ENS_11colorspinor21SpaceSpinorColorOrderIdLi4ELi3EEENS1_11FloatNOrderIdLi4ELi3ELi2ELb0ELb0EEESt5tupleIJRNS_16ColorSpinorFieldERKS7_19QudaFieldLocation_sPdPKdEEEE	GPU-offline,vol=32768,parity=1,precision=8,order=2,Ns=4,Nc=3vol=32768,parity=1,precision=8,order=9,Ns=4,Nc=3,RelBasis	32	1	1	1024	1	1	0	-1	-1	-1	-1	1.69509e-05	# 0.00 Gflop/s, 742.32 GB/s, tuning took 0.014030 seconds at Wed Aug 14 17:37:50 2024
      4x16x16x32	N4quda26WilsonCloverPreconditionedINS_15WilsonCloverArgIdLi3ELi4EL21QudaReconstructType_s12EEEEE	policy,commDim=0000,parity=1,topo=1111,p2p=0,gdr=0,nvshmem=0,pol=110000111100110000	32	1	1	1	1	1	0	9	0	0	-1	0.000457728	# 130.58 Gflop/s, 206.17 GB/s, tuning took 0.028164 seconds at Wed Aug 14 17:37:50 2024
      4x16x16x32	N4quda26WilsonCloverPreconditionedINS_15WilsonCloverArgIdLi3ELi4EL21QudaReconstructType_s12EEEEE	policy_kernel=interior,comm=0000,commDim=0000,parity=1	32	1	1	1024	1	1	14483	-1	-1	-1	-1	0.000454315	# 131.56 Gflop/s, 207.72 GB/s, tuning took 0.542818 seconds at Wed Aug 14 17:37:50 2024
      4x16x16x32	N4quda5FmunuIdLi3EL21QudaReconstructType_s18EEE	GPU-offline,vol=32768stride=16384precision=8geometry=4Nc=3r=0000,comm=0000	32	2	1	512	1	6	0	-1	-1	-1	-1	0.00227601	# 213.02 Gflop/s, 211.46 GB/s, tuning took 2.268259 seconds at Wed Aug 14 17:38:34 2024
      4x16x16x32	N4quda7RNGInitE	GPU-offline,vol=32768stride=20480precision=8geometry=4Nc=3	64	1	1	256	2	1	0	-1	-1	-1	-1	0.0116582	# 0.00 Gflop/s, 0.00 GB/s, tuning took 1.644585 seconds at Wed Aug 14 17:38:30 2024
      4x16x16x32	N4quda9CopyGaugeINS_12CopyGaugeArgIddLi18ELb0ENS_5gauge11FloatNOrderIdLi18ELi2ELi12EL20QudaStaggeredPhase_s0ELb1EL19QudaGhostExchange_sn2147483648ELb0EEENS2_8QDPOrderIdLi18EEEEEEE	GPU-offline,vol=32768stride=16384precision=8geometry=4Nc=3,vol=32768stride=20480precision=8geometry=4Nc=3	32	1	2	512	1	4	2049	-1	-1	-1	-1	2.36008e-05	# 0.00 Gflop/s, 1466.18 GB/s, tuning took 0.100704 seconds at Wed Aug 14 17:38:28 2024
      4x16x16x32	N4quda9CopyGaugeINS_12CopyGaugeArgIddLi18ELb0ENS_5gauge11FloatNOrderIdLi18ELi2ELi12EL20QudaStaggeredPhase_s0ELb1EL19QudaGhostExchange_sn2147483648ELb0EEES6_EEEE	GPU-offline,vol=32768stride=20480precision=8geometry=4Nc=3,vol=32768stride=20480precision=8geometry=4Nc=3,ghost	128	1	6	32	1	2	24577	-1	-1	-1	-1	5.41593e-06	# 0.00 Gflop/s, 589.90 GB/s, tuning took 0.040137 seconds at Wed Aug 14 17:38:28 2024
      4x16x16x32	N4quda9CopyGaugeINS_12CopyGaugeArgIddLi18ELb0ENS_5gauge11FloatNOrderIdLi18ELi2ELi18EL20QudaStaggeredPhase_s0ELb1EL19QudaGhostExchange_sn2147483648ELb0EEENS2_8QDPOrderIdLi18EEEEEEE	GPU-offline,vol=32768stride=16384precision=8geometry=4Nc=3,vol=32768stride=20480precision=8geometry=4Nc=3	32	1	1	512	1	8	2049	-1	-1	-1	-1	8.56926e-05	# 0.00 Gflop/s, 495.58 GB/s, tuning took 0.132078 seconds at Wed Aug 14 17:38:31 2024
      4x16x16x32	N4quda9CopyGaugeINS_12CopyGaugeArgIddLi18ELb0ENS_5gauge11FloatNOrderIdLi18ELi2ELi18EL20QudaStaggeredPhase_s0ELb1EL19QudaGhostExchange_sn2147483648ELb0EEES6_EEEE	GPU-offline,vol=32768stride=20480precision=8geometry=4Nc=3,vol=32768stride=20480precision=8geometry=4Nc=3,ghost	32	1	3	128	1	3	0	-1	-1	-1	-1	6.25906e-06	# 0.00 Gflop/s, 765.66 GB/s, tuning took 0.030154 seconds at Wed Aug 14 17:38:31 2024
      4x16x16x32	N4quda9CopyGaugeINS_12CopyGaugeArgIddLi18ELb0ENS_5gauge8QDPOrderIdLi18EEENS2_11FloatNOrderIdLi18ELi2ELi12EL20QudaStaggeredPhase_s0ELb1EL19QudaGhostExchange_sn2147483648ELb0EEEEEEE	GPU-offline,vol=32768stride=20480precision=8geometry=4Nc=3,vol=32768stride=16384precision=8geometry=4Nc=3	64	1	2	256	1	4	0	-1	-1	-1	-1	4.34087e-05	# 0.00 Gflop/s, 797.14 GB/s, tuning took 0.106003 seconds at Wed Aug 14 17:38:31 2024
      4x16x16x32	N4quda9CopyGaugeINS_12CopyGaugeArgIfdLi18ELb0ENS_5gauge11FloatNOrderIfLi18ELi4ELi12EL20QudaStaggeredPhase_s0ELb1EL19QudaGhostExchange_sn2147483648ELb0EEENS3_IdLi18ELi2ELi12ELS4_0ELb1ELS5_n2147483648ELb0EEEEEEE	GPU-offline,vol=32768stride=20480precision=8geometry=4Nc=3,vol=32768stride=20480precision=4geometry=4Nc=3	96	1	1	171	1	8	3781	-1	-1	-1	-1	2.96358e-05	# 0.00 Gflop/s, 796.10 GB/s, tuning took 0.071534 seconds at Wed Aug 14 17:38:28 2024
      4x16x16x32	N4quda9CopyGaugeINS_12CopyGaugeArgIfdLi18ELb0ENS_5gauge11FloatNOrderIfLi18ELi4ELi12EL20QudaStaggeredPhase_s0ELb1EL19QudaGhostExchange_sn2147483648ELb0EEENS3_IdLi18ELi2ELi12ELS4_0ELb1ELS5_n2147483648ELb0EEEEEEE	GPU-offline,vol=32768stride=20480precision=8geometry=4Nc=3,vol=32768stride=20480precision=4geometry=4Nc=3,ghost	64	1	1	64	1	8	2049	-1	-1	-1	-1	7.14287e-06	# 0.00 Gflop/s, 335.46 GB/s, tuning took 0.039668 seconds at Wed Aug 14 17:38:28 2024
      4x16x16x32	N4quda9CopyGaugeINS_12CopyGaugeArgIfdLi18ELb0ENS_5gauge11FloatNOrderIfLi18ELi4ELi12EL20QudaStaggeredPhase_s0ELb1EL19QudaGhostExchange_sn2147483648ELb0EEENS3_IdLi18ELi2ELi18ELS4_0ELb1ELS5_n2147483648ELb0EEEEEEE	GPU-offline,vol=32768stride=20480precision=8geometry=4Nc=3,vol=32768stride=20480precision=4geometry=4Nc=3	96	1	1	171	1	8	3073	-1	-1	-1	-1	2.97581e-05	# 0.00 Gflop/s, 1057.10 GB/s, tuning took 0.062840 seconds at Wed Aug 14 17:38:31 2024
      4x16x16x32	N4quda9CopyGaugeINS_12CopyGaugeArgIfdLi18ELb0ENS_5gauge11FloatNOrderIfLi18ELi4ELi12EL20QudaStaggeredPhase_s0ELb1EL19QudaGhostExchange_sn2147483648ELb0EEENS3_IdLi18ELi2ELi18ELS4_0ELb1ELS5_n2147483648ELb0EEEEEEE	GPU-offline,vol=32768stride=20480precision=8geometry=4Nc=3,vol=32768stride=20480precision=4geometry=4Nc=3,ghost	32	1	2	128	1	4	0	-1	-1	-1	-1	7.95328e-06	# 0.00 Gflop/s, 401.71 GB/s, tuning took 0.035058 seconds at Wed Aug 14 17:38:32 2024
      4x16x16x32	N4quda9CopyGaugeINS_12CopyGaugeArgIsdLi18ELb0ENS_5gauge11FloatNOrderIsLi18ELi4ELi12EL20QudaStaggeredPhase_s0ELb1EL19QudaGhostExchange_sn2147483648ELb0EEENS3_IdLi18ELi2ELi12ELS4_0ELb1ELS5_n2147483648ELb0EEEEEEE	GPU-offline,vol=32768stride=20480precision=8geometry=4Nc=3,vol=32768stride=20480precision=2geometry=4Nc=3	96	1	1	171	1	8	3511	-1	-1	-1	-1	2.9696e-05	# 0.00 Gflop/s, 662.07 GB/s, tuning took 0.084194 seconds at Wed Aug 14 17:38:28 2024
      4x16x16x32	N4quda9CopyGaugeINS_12CopyGaugeArgIsdLi18ELb0ENS_5gauge11FloatNOrderIsLi18ELi4ELi12EL20QudaStaggeredPhase_s0ELb1EL19QudaGhostExchange_sn2147483648ELb0EEENS3_IdLi18ELi2ELi12ELS4_0ELb1ELS5_n2147483648ELb0EEEEEEE	GPU-offline,vol=32768stride=20480precision=8geometry=4Nc=3,vol=32768stride=20480precision=2geometry=4Nc=3,ghost	64	1	1	64	1	8	2138	-1	-1	-1	-1	7.84648e-06	# 0.00 Gflop/s, 254.48 GB/s, tuning took 0.045894 seconds at Wed Aug 14 17:38:28 2024
      4x16x16x32	N4quda9CopyGaugeINS_12CopyGaugeArgIsdLi18ELb0ENS_5gauge11FloatNOrderIsLi18ELi4ELi12EL20QudaStaggeredPhase_s0ELb1EL19QudaGhostExchange_sn2147483648ELb0EEENS3_IdLi18ELi2ELi18ELS4_0ELb1ELS5_n2147483648ELb0EEEEEEE	GPU-offline,vol=32768stride=20480precision=8geometry=4Nc=3,vol=32768stride=20480precision=2geometry=4Nc=3	608	1	1	27	1	8	0	-1	-1	-1	-1	2.98767e-05	# 0.00 Gflop/s, 921.29 GB/s, tuning took 0.063495 seconds at Wed Aug 14 17:38:31 2024
      4x16x16x32	N4quda9CopyGaugeINS_12CopyGaugeArgIsdLi18ELb0ENS_5gauge11FloatNOrderIsLi18ELi4ELi12EL20QudaStaggeredPhase_s0ELb1EL19QudaGhostExchange_sn2147483648ELb0EEENS3_IdLi18ELi2ELi18ELS4_0ELb1ELS5_n2147483648ELb0EEEEEEE	GPU-offline,vol=32768stride=20480precision=8geometry=4Nc=3,vol=32768stride=20480precision=2geometry=4Nc=3,ghost	64	1	1	64	1	8	2458	-1	-1	-1	-1	7.29364e-06	# 0.00 Gflop/s, 383.28 GB/s, tuning took 0.034788 seconds at Wed Aug 14 17:38:31 2024
       4x4x16x64	N4quda15CopyColorSpinorILi4ELi3ENS_11colorspinor11FloatNOrderIdLi4ELi3ELi2ELb0ELb0EEENS1_21SpaceSpinorColorOrderIdLi4ELi3EEESt5tupleIJRNS_16ColorSpinorFieldERKS7_19QudaFieldLocation_sPdPKdEEEE	GPU-offline,vol=16384,parity=1,precision=8,order=9,Ns=4,Nc=3vol=16384,parity=1,precision=8,order=2,Ns=4,Nc=3,NonRelBasis	96	1	1	171	1	1	0	-1	-1	-1	-1	1.10965e-05	# 0.00 Gflop/s, 566.98 GB/s, tuning took 0.028362 seconds at Wed Aug 14 17:55:45 2024
       4x4x16x64	N4quda15CopyColorSpinorILi4ELi3ENS_11colorspinor21SpaceSpinorColorOrderIdLi4ELi3EEENS1_11FloatNOrderIdLi4ELi3ELi2ELb0ELb0EEESt5tupleIJRNS_16ColorSpinorFieldERKS7_19QudaFieldLocation_sPdPKdEEEE	GPU-offline,vol=16384,parity=1,precision=8,order=2,Ns=4,Nc=3vol=16384,parity=1,precision=8,order=9,Ns=4,Nc=3,RelBasis	32	1	1	512	1	1	0	-1	-1	-1	-1	1.01257e-05	# 0.00 Gflop/s, 621.34 GB/s, tuning took 0.014794 seconds at Wed Aug 14 17:55:45 2024
       4x4x16x64	N4quda26WilsonCloverPreconditionedINS_15WilsonCloverArgIdLi3ELi4EL21QudaReconstructType_s12EEEEE	policy,commDim=0000,parity=1,topo=1111,p2p=0,gdr=0,nvshmem=0,pol=110000111100110000	32	1	1	1	1	1	0	7	0	0	-1	0.000232653	# 128.45 Gflop/s, 202.82 GB/s, tuning took 0.019003 seconds at Wed Aug 14 17:55:45 2024
       4x4x16x64	N4quda26WilsonCloverPreconditionedINS_15WilsonCloverArgIdLi3ELi4EL21QudaReconstructType_s12EEEEE	policy_kernel=interior,comm=0000,commDim=0000,parity=1	32	1	1	512	1	1	14483	-1	-1	-1	-1	0.000232858	# 128.34 Gflop/s, 202.64 GB/s, tuning took 0.302108 seconds at Wed Aug 14 17:55:45 2024
         4x4x4x4	N4quda10CopyCloverINS_6clover11FloatNOrderIfLi72ELi4ELb0ELb0ELb0EEENS2_IdLi72ELi2ELb0ELb0ELb0EEEfdEE	GPU-offline,vol=256precision=8Nc=3	32	1	1	4	2	1	5462	-1	-1	-1	-1	6.13982e-06	# 0.00 Gflop/s, 36.02 GB/s, tuning took 0.039895 seconds at Wed Aug 14 17:04:42 2024
         4x4x4x4	N4quda10CopyCloverINS_6clover11FloatNOrderIsLi72ELi8ELb0ELb0ELb0EEENS2_IdLi72ELi2ELb0ELb0ELb0EEEsdEE	GPU-offline,vol=256precision=8Nc=3	32	1	1	4	2	1	12289	-1	-1	-1	-1	6.28193e-06	# 0.00 Gflop/s, 29.34 GB/s, tuning took 0.030575 seconds at Wed Aug 14 17:04:42 2024
         4x4x4x4	N4quda10GaugeGaussIdLi3EL21QudaReconstructType_s12EEE	GPU-offline,vol=256stride=160precision=8geometry=4Nc=3,lie_group	32	1	1	4	2	1	3277	-1	-1	-1	-1	7.43863e-05	# 0.00 Gflop/s, 1.65 GB/s, tuning took 0.124668 seconds at Wed Aug 14 17:04:41 2024
         4x4x4x4	N4quda11CopyGaugeExIddLi18ENS_5gauge11FloatNOrderIdLi18ELi2ELi18EL20QudaStaggeredPhase_s0ELb1EL19QudaGhostExchange_sn2147483648ELb0EEENS2_IdLi18ELi2ELi12ELS3_0ELb1ELS4_n2147483648ELb0EEEEE	GPU-offline,vol=256stride=160precision=8geometry=4Nc=3vol=256stride=128precision=8geometry=4Nc=3r=0000	32	1	1	4	2	1	2049	-1	-1	-1	-1	6.3178e-06	# 0.00 Gflop/s, 42.79 GB/s, tuning took 0.025821 seconds at Wed Aug 14 17:04:42 2024
         4x4x4x4	N4quda11CopyGaugeExIddLi18ENS_5gauge11FloatNOrderIdLi18ELi2ELi18EL20QudaStaggeredPhase_s0ELb1EL19QudaGhostExchange_sn2147483648ELb0EEES5_EE	GPU-offline,vol=256stride=160precision=8geometry=4Nc=3vol=256stride=128precision=8geometry=4Nc=3r=0000	64	1	1	2	2	1	12289	-1	-1	-1	-1	5.4272e-06	# 0.00 Gflop/s, 61.13 GB/s, tuning took 0.042843 seconds at Wed Aug 14 17:04:42 2024
         4x4x4x4	N4quda12CloverInvertIdEE	GPU-offline,nParity=2,vol=256precision=8Nc=3,trlog=true,twist=false	32	2	1	5	1	1	4916	-1	-1	-1	-1	4.99089e-05	# 0.00 Gflop/s, 5.91 GB/s, tuning took 0.173565 seconds at Wed Aug 14 17:04:42 2024
         4x4x4x4	N4quda12ExtractGhostIdLi3ENS_5gauge11FloatNOrderIdLi18ELi2ELi12EL20QudaStaggeredPhase_s0ELb1EL19QudaGhostExchange_sn2147483648ELb0EEEEE	GPU-offline,vol=256stride=160precision=8geometry=4Nc=3,extract	96	1	1	1	1	8	4097	-1	-1	-1	-1	5.61629e-06	# 0.00 Gflop/s, 8.75 GB/s, tuning took 0.049359 seconds at Wed Aug 14 17:04:41 2024
         4x4x4x4	N4quda12ExtractGhostIdLi3ENS_5gauge11FloatNOrderIdLi18ELi2ELi18EL20QudaStaggeredPhase_s0ELb1EL19QudaGhostExchange_sn2147483648ELb0EEEEE	GPU-offline,vol=256stride=160precision=8geometry=4Nc=3,extract	32	1	1	2	1	8	9831	-1	-1	-1	-1	5.27391e-06	# 0.00 Gflop/s, 13.98 GB/s, tuning took 0.039526 seconds at Wed Aug 14 17:04:42 2024
         4x4x4x4	N4quda13ComputeCloverIdEE	GPU-offline,vol=256precision=8Nc=3	32	1	1	4	2	1	0	-1	-1	-1	-1	6.33875e-06	# 19.39 Gflop/s, 58.16 GB/s, tuning took 0.024235 seconds at Wed Aug 14 17:04:42 2024
         4x4x4x4	N4quda5FmunuIdLi3EL21QudaReconstructType_s18EEE	GPU-offline,vol=256stride=128precision=8geometry=4Nc=3r=0000,comm=0000	64	1	1	2	2	6	2138	-1	-1	-1	-1	2.36613e-05	# 160.08 Gflop/s, 158.91 GB/s, tuning took 0.062186 seconds at Wed Aug 14 17:04:42 2024
         4x4x4x4	N4quda7RNGInitE	GPU-offline,vol=256stride=160precision=8geometry=4Nc=3	64	1	1	2	2	1	0	-1	-1	-1	-1	0.000616789	# 0.00 Gflop/s, 0.00 GB/s, tuning took 0.166848 seconds at Wed Aug 14 17:04:41 2024
         4x4x4x4	N4quda9CopyGaugeINS_12CopyGaugeArgIddLi18ELb0ENS_5gauge11FloatNOrderIdLi18ELi2ELi12EL20QudaStaggeredPhase_s0ELb1EL19QudaGhostExchange_sn2147483648ELb0EEENS2_8QDPOrderIdLi18EEEEEEE	GPU-offline,vol=256stride=128precision=8geometry=4Nc=3,vol=256stride=160precision=8geometry=4Nc=3	64	1	1	2	1	8	2892	-1	-1	-1	-1	5.57714e-06	# 0.00 Gflop/s, 48.47 GB/s, tuning took 0.051875 seconds at Wed Aug 14 17:04:41 2024
         4x4x4x4	N4quda9CopyGaugeINS_12CopyGaugeArgIddLi18ELb0ENS_5gauge11FloatNOrderIdLi18ELi2ELi12EL20QudaStaggeredPhase_s0ELb1EL19QudaGhostExchange_sn2147483648ELb0EEES6_EEEE	GPU-offline,vol=256stride=160precision=8geometry=4Nc=3,vol=256stride=160precision=8geometry=4Nc=3,ghost	32	1	1	1	1	8	3277	-1	-1	-1	-1	5.57546e-06	# 0.00 Gflop/s, 11.02 GB/s, tuning took 0.042317 seconds at Wed Aug 14 17:04:41 2024
         4x4x4x4	N4quda9CopyGaugeINS_12CopyGaugeArgIddLi18ELb0ENS_5gauge11FloatNOrderIdLi18ELi2ELi18EL20QudaStaggeredPhase_s0ELb1EL19QudaGhostExchange_sn2147483648ELb0EEENS2_8QDPOrderIdLi18EEEEEEE	GPU-offline,vol=256stride=128precision=8geometry=4Nc=3,vol=256stride=160precision=8geometry=4Nc=3	32	1	1	4	1	8	2458	-1	-1	-1	-1	5.21737e-06	# 0.00 Gflop/s, 63.59 GB/s, tuning took 0.037337 seconds at Wed Aug 14 17:04:42 2024
         4x4x4x4	N4quda9CopyGaugeINS_12CopyGaugeArgIddLi18ELb0ENS_5gauge11FloatNOrderIdLi18ELi2ELi18EL20QudaStaggeredPhase_s0ELb1EL19QudaGhostExchange_sn2147483648ELb0EEES6_EEEE	GPU-offline,vol=256stride=160precision=8geometry=4Nc=3,vol=256stride=160precision=8geometry=4Nc=3,ghost	32	1	1	1	1	8	3277	-1	-1	-1	-1	8.07264e-06	# 0.00 Gflop/s, 11.42 GB/s, tuning took 0.042350 seconds at Wed Aug 14 17:04:42 2024
         4x4x4x4	N4quda9CopyGaugeINS_12CopyGaugeArgIddLi18ELb0ENS_5gauge8QDPOrderIdLi18EEENS2_11FloatNOrderIdLi18ELi2ELi12EL20QudaStaggeredPhase_s0ELb1EL19QudaGhostExchange_sn2147483648ELb0EEEEEEE	GPU-offline,vol=256stride=160precision=8geometry=4Nc=3,vol=256stride=128precision=8geometry=4Nc=3	32	1	2	4	1	4	2731	-1	-1	-1	-1	4.88594e-06	# 0.00 Gflop/s, 55.33 GB/s, tuning took 0.035991 seconds at Wed Aug 14 17:04:42 2024
         4x4x4x4	N4quda9CopyGaugeINS_12CopyGaugeArgIfdLi18ELb0ENS_5gauge11FloatNOrderIfLi18ELi4ELi12EL20QudaStaggeredPhase_s0ELb1EL19QudaGhostExchange_sn2147483648ELb0EEENS3_IdLi18ELi2ELi12ELS4_0ELb1ELS5_n2147483648ELb0EEEEEEE	GPU-offline,vol=256stride=160precision=8geometry=4Nc=3,vol=256stride=160precision=4geometry=4Nc=3	64	1	1	2	1	8	0	-1	-1	-1	-1	5.58479e-06	# 0.00 Gflop/s, 33.00 GB/s, tuning took 0.052162 seconds at Wed Aug 14 17:04:41 2024
         4x4x4x4	N4quda9CopyGaugeINS_12CopyGaugeArgIfdLi18ELb0ENS_5gauge11FloatNOrderIfLi18ELi4ELi12EL20QudaStaggeredPhase_s0ELb1EL19QudaGhostExchange_sn2147483648ELb0EEENS3_IdLi18ELi2ELi12ELS4_0ELb1ELS5_n2147483648ELb0EEEEEEE	GPU-offline,vol=256stride=160precision=8geometry=4Nc=3,vol=256stride=160precision=4geometry=4Nc=3,ghost	32	1	1	1	1	8	2235	-1	-1	-1	-1	5.47109e-06	# 0.00 Gflop/s, 8.42 GB/s, tuning took 0.032685 seconds at Wed Aug 14 17:04:41 2024
         4x4x4x4	N4quda9CopyGaugeINS_12CopyGaugeArgIfdLi18ELb0ENS_5gauge11FloatNOrderIfLi18ELi4ELi12EL20QudaStaggeredPhase_s0ELb1EL19QudaGhostExchange_sn2147483648ELb0EEENS3_IdLi18ELi2ELi18ELS4_0ELb1ELS5_n2147483648ELb0EEEEEEE	GPU-offline,vol=256stride=160precision=8geometry=4Nc=3,vol=256stride=160precision=4geometry=4Nc=3	32	1	1	4	1	8	2458	-1	-1	-1	-1	5.14827e-06	# 0.00 Gflop/s, 47.74 GB/s, tuning took 0.046637 seconds at Wed Aug 14 17:04:42 2024
         4x4x4x4	N4quda9CopyGaugeINS_12CopyGaugeArgIfdLi18ELb0ENS_5gauge11FloatNOrderIfLi18ELi4ELi12EL20QudaStaggeredPhase_s0ELb1EL19QudaGhostExchange_sn2147483648ELb0EEENS3_IdLi18ELi2ELi18ELS4_0ELb1ELS5_n2147483648ELb0EEEEEEE	GPU-offline,vol=256stride=160precision=8geometry=4Nc=3,vol=256stride=160precision=4geometry=4Nc=3,ghost	32	1	1	1	1	8	3511	-1	-1	-1	-1	5.17654e-06	# 0.00 Gflop/s, 11.87 GB/s, tuning took 0.034990 seconds at Wed Aug 14 17:04:42 2024
         4x4x4x4	N4quda9CopyGaugeINS_12CopyGaugeArgIsdLi18ELb0ENS_5gauge11FloatNOrderIsLi18ELi4ELi12EL20QudaStaggeredPhase_s0ELb1EL19QudaGhostExchange_sn2147483648ELb0EEENS3_IdLi18ELi2ELi12ELS4_0ELb1ELS5_n2147483648ELb0EEEEEEE	GPU-offline,vol=256stride=160precision=8geometry=4Nc=3,vol=256stride=160precision=2geometry=4Nc=3	32	1	2	4	1	4	12289	-1	-1	-1	-1	5.4709e-06	# 0.00 Gflop/s, 28.08 GB/s, tuning took 0.046820 seconds at Wed Aug 14 17:04:41 2024
         4x4x4x4	N4quda9CopyGaugeINS_12CopyGaugeArgIsdLi18ELb0ENS_5gauge11FloatNOrderIsLi18ELi4ELi12EL20QudaStaggeredPhase_s0ELb1EL19QudaGhostExchange_sn2147483648ELb0EEENS3_IdLi18ELi2ELi12ELS4_0ELb1ELS5_n2147483648ELb0EEEEEEE	GPU-offline,vol=256stride=160precision=8geometry=4Nc=3,vol=256stride=160precision=2geometry=4Nc=3,ghost	32	1	1	1	1	8	2458	-1	-1	-1	-1	5.71977e-06	# 0.00 Gflop/s, 6.71 GB/s, tuning took 0.044885 seconds at Wed Aug 14 17:04:41 2024
         4x4x4x4	N4quda9CopyGaugeINS_12CopyGaugeArgIsdLi18ELb0ENS_5gauge11FloatNOrderIsLi18ELi4ELi12EL20QudaStaggeredPhase_s0ELb1EL19QudaGhostExchange_sn2147483648ELb0EEENS3_IdLi18ELi2ELi18ELS4_0ELb1ELS5_n2147483648ELb0EEEEEEE	GPU-offline,vol=256stride=160precision=8geometry=4Nc=3,vol=256stride=160precision=2geometry=4Nc=3	32	1	1	4	1	8	3073	-1	-1	-1	-1	9.63602e-06	# 0.00 Gflop/s, 22.32 GB/s, tuning took 0.052570 seconds at Wed Aug 14 17:04:42 2024
         4x4x4x4	N4quda9CopyGaugeINS_12CopyGaugeArgIsdLi18ELb0ENS_5gauge11FloatNOrderIsLi18ELi4ELi12EL20QudaStaggeredPhase_s0ELb1EL19QudaGhostExchange_sn2147483648ELb0EEENS3_IdLi18ELi2ELi18ELS4_0ELb1ELS5_n2147483648ELb0EEEEEEE	GPU-offline,vol=256stride=160precision=8geometry=4Nc=3,vol=256stride=160precision=2geometry=4Nc=3,ghost	64	1	1	1	1	8	2235	-1	-1	-1	-1	1.05007e-05	# 0.00 Gflop/s, 5.12 GB/s, tuning took 0.052609 seconds at Wed Aug 14 17:04:42 2024
        4x4x8x64	N4quda15CopyColorSpinorILi4ELi3ENS_11colorspinor11FloatNOrderIdLi4ELi3ELi2ELb0ELb0EEENS1_21SpaceSpinorColorOrderIdLi4ELi3EEESt5tupleIJRNS_16ColorSpinorFieldERKS7_19QudaFieldLocation_sPdPKdEEEE	GPU-offline,vol=8192,parity=1,precision=8,order=9,Ns=4,Nc=3vol=8192,parity=1,precision=8,order=2,Ns=4,Nc=3,NonRelBasis	64	1	1	128	1	1	0	-1	-1	-1	-1	7.75426e-06	# 0.00 Gflop/s, 405.68 GB/s, tuning took 0.016473 seconds at Wed Aug 14 17:56:36 2024
        4x4x8x64	N4quda15CopyColorSpinorILi4ELi3ENS_11colorspinor21SpaceSpinorColorOrderIdLi4ELi3EEENS1_11FloatNOrderIdLi4ELi3ELi2ELb0ELb0EEESt5tupleIJRNS_16ColorSpinorFieldERKS7_19QudaFieldLocation_sPdPKdEEEE	GPU-offline,vol=8192,parity=1,precision=8,order=2,Ns=4,Nc=3vol=8192,parity=1,precision=8,order=9,Ns=4,Nc=3,RelBasis	96	1	1	86	1	1	0	-1	-1	-1	-1	8.00183e-06	# 0.00 Gflop/s, 393.13 GB/s, tuning took 0.015337 seconds at Wed Aug 14 17:56:36 2024
        4x4x8x64	N4quda26WilsonCloverPreconditionedINS_15WilsonCloverArgIdLi3ELi4EL21QudaReconstructType_s12EEEEE	policy,commDim=0000,parity=1,topo=1111,p2p=0,gdr=0,nvshmem=0,pol=110000111100110000	32	1	1	1	1	1	0	6	0	0	-1	0.000117646	# 127.01 Gflop/s, 200.54 GB/s, tuning took 0.013622 seconds at Wed Aug 14 17:56:36 2024
        4x4x8x64	N4quda26WilsonCloverPreconditionedINS_15WilsonCloverArgIdLi3ELi4EL21QudaReconstructType_s12EEEEE	policy_kernel=interior,comm=0000,commDim=0000,parity=1	32	1	1	256	1	1	12673	-1	-1	-1	-1	0.000117988	# 126.64 Gflop/s, 199.96 GB/s, tuning took 0.189537 seconds at Wed Aug 14 17:56:36 2024
       4x8x16x16	N4quda15CopyColorSpinorILi4ELi3ENS_11colorspinor11FloatNOrderIdLi4ELi3ELi2ELb0ELb0EEENS1_21SpaceSpinorColorOrderIdLi4ELi3EEESt5tupleIJRNS_16ColorSpinorFieldERKS7_19QudaFieldLocation_sPdPKdEEEE	GPU-offline,vol=8192,parity=1,precision=8,order=9,Ns=4,Nc=3vol=8192,parity=1,precision=8,order=2,Ns=4,Nc=3,NonRelBasis	384	1	1	22	1	1	0	-1	-1	-1	-1	7.86369e-06	# 0.00 Gflop/s, 400.03 GB/s, tuning took 0.015658 seconds at Wed Aug 14 17:53:43 2024
       4x8x16x16	N4quda15CopyColorSpinorILi4ELi3ENS_11colorspinor21SpaceSpinorColorOrderIdLi4ELi3EEENS1_11FloatNOrderIdLi4ELi3ELi2ELb0ELb0EEESt5tupleIJRNS_16ColorSpinorFieldERKS7_19QudaFieldLocation_sPdPKdEEEE	GPU-offline,vol=8192,parity=1,precision=8,order=2,Ns=4,Nc=3vol=8192,parity=1,precision=8,order=9,Ns=4,Nc=3,RelBasis	64	1	1	128	1	1	0	-1	-1	-1	-1	7.69484e-06	# 0.00 Gflop/s, 408.81 GB/s, tuning took 0.017225 seconds at Wed Aug 14 17:53:43 2024
       4x8x16x16	N4quda26WilsonCloverPreconditionedINS_15WilsonCloverArgIdLi3ELi4EL21QudaReconstructType_s12EEEEE	policy,commDim=0000,parity=1,topo=1111,p2p=0,gdr=0,nvshmem=0,pol=110000111100110000	32	1	1	1	1	1	0	7	0	0	-1	0.000118101	# 126.52 Gflop/s, 199.77 GB/s, tuning took 0.013679 seconds at Wed Aug 14 17:53:43 2024
       4x8x16x16	N4quda26WilsonCloverPreconditionedINS_15WilsonCloverArgIdLi3ELi4EL21QudaReconstructType_s12EEEEE	policy_kernel=interior,comm=0000,commDim=0000,parity=1	32	1	1	256	1	1	5069	-1	-1	-1	-1	0.000118101	# 126.52 Gflop/s, 199.77 GB/s, tuning took 0.187780 seconds at Wed Aug 14 17:53:43 2024
        4x8x8x16	N4quda15CopyColorSpinorILi4ELi3ENS_11colorspinor11FloatNOrderIdLi4ELi3ELi2ELb0ELb0EEENS1_21SpaceSpinorColorOrderIdLi4ELi3EEESt5tupleIJRNS_16ColorSpinorFieldERKS7_19QudaFieldLocation_sPdPKdEEEE	GPU-offline,vol=4096,parity=1,precision=8,order=9,Ns=4,Nc=3vol=4096,parity=1,precision=8,order=2,Ns=4,Nc=3,NonRelBasis	96	1	1	43	1	1	0	-1	-1	-1	-1	6.3511e-06	# 0.00 Gflop/s, 247.65 GB/s, tuning took 0.019664 seconds at Wed Aug 14 17:49:47 2024
        4x8x8x16	N4quda15CopyColorSpinorILi4ELi3ENS_11colorspinor21SpaceSpinorColorOrderIdLi4ELi3EEENS1_11FloatNOrderIdLi4ELi3ELi2ELb0ELb0EEESt5tupleIJRNS_16ColorSpinorFieldERKS7_19QudaFieldLocation_sPdPKdEEEE	GPU-offline,vol=4096,parity=1,precision=8,order=2,Ns=4,Nc=3vol=4096,parity=1,precision=8,order=9,Ns=4,Nc=3,RelBasis	96	1	1	43	1	1	0	-1	-1	-1	-1	6.32618e-06	# 0.00 Gflop/s, 248.63 GB/s, tuning took 0.020927 seconds at Wed Aug 14 17:49:47 2024
        4x8x8x16	N4quda26WilsonCloverPreconditionedINS_15WilsonCloverArgIdLi3ELi4EL21QudaReconstructType_s12EEEEE	policy,commDim=0000,parity=1,topo=1111,p2p=0,gdr=0,nvshmem=0,pol=110000111100110000	32	1	1	1	1	1	0	0	0	0	-1	6.56e-05	# 113.89 Gflop/s, 179.82 GB/s, tuning took 0.015091 seconds at Wed Aug 14 17:49:47 2024
        4x8x8x16	N4quda26WilsonCloverPreconditionedINS_15WilsonCloverArgIdLi3ELi4EL21QudaReconstructType_s12EEEEE	policy_kernel=interior,comm=0000,commDim=0000,parity=1	192	1	1	22	1	1	14483	-1	-1	-1	-1	6.5536e-05	# 114.00 Gflop/s, 180.00 GB/s, tuning took 0.120408 seconds at Wed Aug 14 17:49:47 2024
         4x8x8x8	N4quda15CopyColorSpinorILi4ELi3ENS_11colorspinor11FloatNOrderIdLi4ELi3ELi2ELb0ELb0EEENS1_21SpaceSpinorColorOrderIdLi4ELi3EEESt5tupleIJRNS_16ColorSpinorFieldERKS7_19QudaFieldLocation_sPdPKdEEEE	GPU-offline,vol=2048,parity=1,precision=8,order=9,Ns=4,Nc=3vol=2048,parity=1,precision=8,order=2,Ns=4,Nc=3,NonRelBasis	32	1	1	64	1	1	0	-1	-1	-1	-1	6.81101e-06	# 0.00 Gflop/s, 115.46 GB/s, tuning took 0.022000 seconds at Wed Aug 14 17:36:05 2024
         4x8x8x8	N4quda15CopyColorSpinorILi4ELi3ENS_11colorspinor21SpaceSpinorColorOrderIdLi4ELi3EEENS1_11FloatNOrderIdLi4ELi3ELi2ELb0ELb0EEESt5tupleIJRNS_16ColorSpinorFieldERKS7_19QudaFieldLocation_sPdPKdEEEE	GPU-offline,vol=2048,parity=1,precision=8,order=2,Ns=4,Nc=3vol=2048,parity=1,precision=8,order=9,Ns=4,Nc=3,RelBasis	128	1	1	16	1	1	0	-1	-1	-1	-1	6.1649e-06	# 0.00 Gflop/s, 127.57 GB/s, tuning took 0.018623 seconds at Wed Aug 14 17:36:05 2024
         4x8x8x8	N4quda26WilsonCloverPreconditionedINS_15WilsonCloverArgIdLi3ELi4EL21QudaReconstructType_s12EEEEE	policy,commDim=0000,parity=1,topo=1111,p2p=0,gdr=0,nvshmem=0,pol=110000111100110000	32	1	1	1	1	1	0	8	0	0	-1	3.45335e-05	# 108.17 Gflop/s, 170.80 GB/s, tuning took 0.011934 seconds at Wed Aug 14 17:36:05 2024
         4x8x8x8	N4quda26WilsonCloverPreconditionedINS_15WilsonCloverArgIdLi3ELi4EL21QudaReconstructType_s12EEEEE	policy_kernel=interior,comm=0000,commDim=0000,parity=1	32	1	1	64	1	1	4609	-1	-1	-1	-1	3.45335e-05	# 108.17 Gflop/s, 170.80 GB/s, tuning took 0.103068 seconds at Wed Aug 14 17:36:05 2024
          589824	N4quda15TransformReduceINS_7maximumIdEEKNS_7complexIdEEmNS_8abs_max_IddEENS_8identityEEE	GPU-offline,batch_size=1	256	1	1	24	1	1	0	-1	-1	-1	-1	4.48e-05	# 0.00 Gflop/s, 210.65 GB/s, tuning took 0.160907 seconds at Wed Aug 14 17:53:43 2024
      8x16x16x16	N4quda10CopyCloverINS_6clover11FloatNOrderIfLi72ELi4ELb0ELb0ELb0EEENS2_IdLi72ELi2ELb0ELb0ELb0EEEfdEE	GPU-offline,vol=32768precision=8Nc=3	32	1	1	512	2	1	2049	-1	-1	-1	-1	4.42991e-05	# 0.00 Gflop/s, 639.10 GB/s, tuning took 0.068770 seconds at Wed Aug 14 16:57:59 2024
      8x16x16x16	N4quda10CopyCloverINS_6clover11FloatNOrderIsLi72ELi8ELb0ELb0ELb0EEENS2_IdLi72ELi2ELb0ELb0ELb0EEEsdEE	GPU-offline,vol=32768precision=8Nc=3	32	1	1	512	2	1	2049	-1	-1	-1	-1	4.40765e-05	# 0.00 Gflop/s, 535.27 GB/s, tuning took 0.069025 seconds at Wed Aug 14 16:57:59 2024
      8x16x16x16	N4quda10GaugeGaussIdLi3EL21QudaReconstructType_s12EEE	GPU-offline,vol=32768stride=18432precision=8geometry=4Nc=3,lie_group	32	1	1	512	2	1	2587	-1	-1	-1	-1	0.00179951	# 0.00 Gflop/s, 7.87 GB/s, tuning took 1.203864 seconds at Wed Aug 14 16:57:43 2024
      8x16x16x16	N4quda11CopyGaugeExIddLi18ENS_5gauge11FloatNOrderIdLi18ELi2ELi18EL20QudaStaggeredPhase_s0ELb1EL19QudaGhostExchange_sn2147483648ELb0EEENS2_IdLi18ELi2ELi12ELS3_0ELb1ELS4_n2147483648ELb0EEEEE	GPU-offline,vol=32768stride=18432precision=8geometry=4Nc=3vol=32768stride=16384precision=8geometry=4Nc=3r=0000	64	1	1	256	2	1	2235	-1	-1	-1	-1	4.2919e-05	# 0.00 Gflop/s, 769.59 GB/s, tuning took 0.077701 seconds at Wed Aug 14 16:58:00 2024
      8x16x16x16	N4quda11CopyGaugeExIddLi18ENS_5gauge11FloatNOrderIdLi18ELi2ELi18EL20QudaStaggeredPhase_s0ELb1EL19QudaGhostExchange_sn2147483648ELb0EEES5_EE	GPU-offline,vol=32768stride=18432precision=8geometry=4Nc=3vol=32768stride=16384precision=8geometry=4Nc=3r=0000	64	2	1	256	1	1	0	-1	-1	-1	-1	8.7168e-05	# 0.00 Gflop/s, 460.12 GB/s, tuning took 0.104908 seconds at Wed Aug 14 16:57:44 2024
      8x16x16x16	N4quda12CloverInvertIdEE	GPU-offline,nParity=2,vol=32768precision=8Nc=3,trlog=true,twist=false	64	2	1	24	1	1	4469	-1	-1	-1	-1	0.000619285	# 0.00 Gflop/s, 60.96 GB/s, tuning took 13.114776 seconds at Wed Aug 14 16:57:59 2024
      8x16x16x16	N4quda12ExtractGhostIdLi3ENS_5gauge11FloatNOrderIdLi18ELi2ELi12EL20QudaStaggeredPhase_s0ELb1EL19QudaGhostExchange_sn2147483648ELb0EEEEE	GPU-offline,vol=32768stride=18432precision=8geometry=4Nc=3,extract	64	1	1	64	1	8	2138	-1	-1	-1	-1	6.02384e-06	# 0.00 Gflop/s, 326.38 GB/s, tuning took 0.049173 seconds at Wed Aug 14 16:57:40 2024
      8x16x16x16	N4quda12ExtractGhostIdLi3ENS_5gauge11FloatNOrderIdLi18ELi2ELi18EL20QudaStaggeredPhase_s0ELb1EL19QudaGhostExchange_sn2147483648ELb0EEEEE	GPU-offline,vol=32768stride=18432precision=8geometry=4Nc=3,extract	32	1	7	128	1	2	0	-1	-1	-1	-1	6.43739e-06	# 0.00 Gflop/s, 458.12 GB/s, tuning took 0.043928 seconds at Wed Aug 14 16:57:43 2024
      8x16x16x16	N4quda13ComputeCloverIdEE	GPU-offline,vol=32768precision=8Nc=3	96	1	1	171	2	1	0	-1	-1	-1	-1	0.000169106	# 93.01 Gflop/s, 279.03 GB/s, tuning took 0.027259 seconds at Wed Aug 14 16:57:46 2024
      8x16x16x16	N4quda15CopyColorSpinorILi4ELi3ENS_11colorspinor11FloatNOrderIdLi4ELi3ELi2ELb0ELb0EEENS1_21SpaceSpinorColorOrderIdLi4ELi3EEESt5tupleIJRNS_16ColorSpinorFieldERKS7_19QudaFieldLocation_sPdPKdEEEE	GPU-offline,vol=32768,parity=1,precision=8,order=9,Ns=4,Nc=3vol=32768,parity=1,precision=8,order=2,Ns=4,Nc=3,NonRelBasis	288	1	1	114	1	1	0	-1	-1	-1	-1	1.84506e-05	# 0.00 Gflop/s, 681.98 GB/s, tuning took 0.023227 seconds at Wed Aug 14 17:33:55 2024
      8x16x16x16	N4quda15CopyColorSpinorILi4ELi3ENS_11colorspinor21SpaceSpinorColorOrderIdLi4ELi3EEENS1_11FloatNOrderIdLi4ELi3ELi2ELb0ELb0EEESt5tupleIJRNS_16ColorSpinorFieldERKS7_19QudaFieldLocation_sPdPKdEEEE	GPU-offline,vol=32768,parity=1,precision=8,order=2,Ns=4,Nc=3vol=32768,parity=1,precision=8,order=9,Ns=4,Nc=3,RelBasis	32	1	1	1024	1	1	0	-1	-1	-1	-1	1.69143e-05	# 0.00 Gflop/s, 743.92 GB/s, tuning took 0.014318 seconds at Wed Aug 14 17:33:55 2024
      8x16x16x16	N4quda26WilsonCloverPreconditionedINS_15WilsonCloverArgIdLi3ELi4EL21QudaReconstructType_s12EEEEE	policy,commDim=0000,parity=1,topo=1111,p2p=0,gdr=0,nvshmem=0,pol=110000111100110000	32	1	1	1	1	1	0	1	0	0	-1	0.000453632	# 131.76 Gflop/s, 208.04 GB/s, tuning took 0.027811 seconds at Wed Aug 14 17:33:55 2024
      8x16x16x16	N4quda26WilsonCloverPreconditionedINS_15WilsonCloverArgIdLi3ELi4EL21QudaReconstructType_s12EEEEE	policy_kernel=interior,comm=0000,commDim=0000,parity=1	32	1	1	1024	1	1	16897	-1	-1	-1	-1	0.000454656	# 131.46 Gflop/s, 207.57 GB/s, tuning took 0.499930 seconds at Wed Aug 14 17:33:55 2024
      8x16x16x16	N4quda5FmunuIdLi3EL21QudaReconstructType_s18EEE	GPU-offline,vol=32768stride=16384precision=8geometry=4Nc=3r=0000,comm=0000	64	1	1	256	2	6	0	-1	-1	-1	-1	0.00227703	# 212.92 Gflop/s, 211.37 GB/s, tuning took 2.271232 seconds at Wed Aug 14 16:57:46 2024
      8x16x16x16	N4quda7RNGInitE	GPU-offline,vol=32768stride=18432precision=8geometry=4Nc=3	288	1	1	57	2	1	0	-1	-1	-1	-1	0.0119689	# 0.00 Gflop/s, 0.00 GB/s, tuning took 1.690463 seconds at Wed Aug 14 16:57:42 2024
      8x16x16x16	N4quda9CopyGaugeINS_12CopyGaugeArgIddLi18ELb0ENS_5gauge11FloatNOrderIdLi18ELi2ELi12EL20QudaStaggeredPhase_s0ELb1EL19QudaGhostExchange_sn2147483648ELb0EEENS2_8QDPOrderIdLi18EEEEEEE	GPU-offline,vol=32768stride=16384precision=8geometry=4Nc=3,vol=32768stride=18432precision=8geometry=4Nc=3	32	1	6	512	1	2	0	-1	-1	-1	-1	2.35032e-05	# 0.00 Gflop/s, 1405.34 GB/s, tuning took 0.103674 seconds at Wed Aug 14 16:57:40 2024
      8x16x16x16	N4quda9CopyGaugeINS_12CopyGaugeArgIddLi18ELb0ENS_5gauge11FloatNOrderIdLi18ELi2ELi12EL20QudaStaggeredPhase_s0ELb1EL19QudaGhostExchange_sn2147483648ELb0EEES6_EEEE	GPU-offline,vol=32768stride=18432precision=8geometry=4Nc=3,vol=32768stride=18432precision=8geometry=4Nc=3,ghost	64	1	1	32	1	8	0	-1	-1	-1	-1	6.61974e-06	# 0.00 Gflop/s, 334.13 GB/s, tuning took 0.036027 seconds at Wed Aug 14 16:57:40 2024
      8x16x16x16	N4quda9CopyGaugeINS_12CopyGaugeArgIddLi18ELb0ENS_5gauge11FloatNOrderIdLi18ELi2ELi18EL20QudaStaggeredPhase_s0ELb1EL19QudaGhostExchange_sn2147483648ELb0EEENS2_8QDPOrderIdLi18EEEEEEE	GPU-offline,vol=32768stride=16384precision=8geometry=4Nc=3,vol=32768stride=18432precision=8geometry=4Nc=3	32	1	3	512	1	3	3073	-1	-1	-1	-1	8.33213e-05	# 0.00 Gflop/s, 481.37 GB/s, tuning took 0.147612 seconds at Wed Aug 14 16:57:43 2024
      8x16x16x16	N4quda9CopyGaugeINS_12CopyGaugeArgIddLi18ELb0ENS_5gauge11FloatNOrderIdLi18ELi2ELi18EL20QudaStaggeredPhase_s0ELb1EL19QudaGhostExchange_sn2147483648ELb0EEES6_EEEE	GPU-offline,vol=32768stride=18432precision=8geometry=4Nc=3,vol=32768stride=18432precision=8geometry=4Nc=3,ghost	256	1	1	8	1	8	0	-1	-1	-1	-1	6.06041e-06	# 0.00 Gflop/s, 547.45 GB/s, tuning took 0.029777 seconds at Wed Aug 14 16:57:43 2024
      8x16x16x16	N4quda9CopyGaugeINS_12CopyGaugeArgIddLi18ELb0ENS_5gauge8QDPOrderIdLi18EEENS2_11FloatNOrderIdLi18ELi2ELi12EL20QudaStaggeredPhase_s0ELb1EL19QudaGhostExchange_sn2147483648ELb0EEEEEEE	GPU-offline,vol=32768stride=18432precision=8geometry=4Nc=3,vol=32768stride=16384precision=8geometry=4Nc=3	96	1	1	171	1	8	3277	-1	-1	-1	-1	4.31861e-05	# 0.00 Gflop/s, 764.83 GB/s, tuning took 0.095329 seconds at Wed Aug 14 16:57:43 2024
      8x16x16x16	N4quda9CopyGaugeINS_12CopyGaugeArgIfdLi18ELb0ENS_5gauge11FloatNOrderIfLi18ELi4ELi12EL20QudaStaggeredPhase_s0ELb1EL19QudaGhostExchange_sn2147483648ELb0EEENS3_IdLi18ELi2ELi12ELS4_0ELb1ELS5_n2147483648ELb0EEEEEEE	GPU-offline,vol=32768stride=18432precision=8geometry=4Nc=3,vol=32768stride=18432precision=4geometry=4Nc=3	32	1	3	512	1	3	3781	-1	-1	-1	-1	2.96659e-05	# 0.00 Gflop/s, 715.76 GB/s, tuning took 0.094575 seconds at Wed Aug 14 16:57:40 2024
      8x16x16x16	N4quda9CopyGaugeINS_12CopyGaugeArgIfdLi18ELb0ENS_5gauge11FloatNOrderIfLi18ELi4ELi12EL20QudaStaggeredPhase_s0ELb1EL19QudaGhostExchange_sn2147483648ELb0EEENS3_IdLi18ELi2ELi12ELS4_0ELb1ELS5_n2147483648ELb0EEEEEEE	GPU-offline,vol=32768stride=18432precision=8geometry=4Nc=3,vol=32768stride=18432precision=4geometry=4Nc=3,ghost	64	1	1	32	1	8	2138	-1	-1	-1	-1	6.33888e-06	# 0.00 Gflop/s, 261.70 GB/s, tuning took 0.038145 seconds at Wed Aug 14 16:57:40 2024
      8x16x16x16	N4quda9CopyGaugeINS_12CopyGaugeArgIfdLi18ELb0ENS_5gauge11FloatNOrderIfLi18ELi4ELi12EL20QudaStaggeredPhase_s0ELb1EL19QudaGhostExchange_sn2147483648ELb0EEENS3_IdLi18ELi2ELi18ELS4_0ELb1ELS5_n2147483648ELb0EEEEEEE	GPU-offline,vol=32768stride=18432precision=8geometry=4Nc=3,vol=32768stride=18432precision=4geometry=4Nc=3	96	1	1	171	1	8	3073	-1	-1	-1	-1	2.97261e-05	# 0.00 Gflop/s, 952.41 GB/s, tuning took 0.065540 seconds at Wed Aug 14 16:57:43 2024
      8x16x16x16	N4quda9CopyGaugeINS_12CopyGaugeArgIfdLi18ELb0ENS_5gauge11FloatNOrderIfLi18ELi4ELi12EL20QudaStaggeredPhase_s0ELb1EL19QudaGhostExchange_sn2147483648ELb0EEENS3_IdLi18ELi2ELi18ELS4_0ELb1ELS5_n2147483648ELb0EEEEEEE	GPU-offline,vol=32768stride=18432precision=8geometry=4Nc=3,vol=32768stride=18432precision=4geometry=4Nc=3,ghost	64	1	1	32	1	8	2049	-1	-1	-1	-1	6.17852e-06	# 0.00 Gflop/s, 357.99 GB/s, tuning took 0.039792 seconds at Wed Aug 14 16:57:43 2024
      8x16x16x16	N4quda9CopyGaugeINS_12CopyGaugeArgIsdLi18ELb0ENS_5gauge11FloatNOrderIsLi18ELi4ELi12EL20QudaStaggeredPhase_s0ELb1EL19QudaGhostExchange_sn2147483648ELb0EEENS3_IdLi18ELi2ELi12ELS4_0ELb1ELS5_n2147483648ELb0EEEEEEE	GPU-offline,vol=32768stride=18432precision=8geometry=4Nc=3,vol=32768stride=18432precision=2geometry=4Nc=3	96	1	1	171	1	8	3073	-1	-1	-1	-1	2.9696e-05	# 0.00 Gflop/s, 595.86 GB/s, tuning took 0.092251 seconds at Wed Aug 14 16:57:40 2024
      8x16x16x16	N4quda9CopyGaugeINS_12CopyGaugeArgIsdLi18ELb0ENS_5gauge11FloatNOrderIsLi18ELi4ELi12EL20QudaStaggeredPhase_s0ELb1EL19QudaGhostExchange_sn2147483648ELb0EEENS3_IdLi18ELi2ELi12ELS4_0ELb1ELS5_n2147483648ELb0EEEEEEE	GPU-offline,vol=32768stride=18432precision=8geometry=4Nc=3,vol=32768stride=18432precision=2geometry=4Nc=3,ghost	64	1	8	32	1	1	24577	-1	-1	-1	-1	6.56989e-06	# 0.00 Gflop/s, 210.41 GB/s, tuning took 0.042683 seconds at Wed Aug 14 16:57:40 2024
      8x16x16x16	N4quda9CopyGaugeINS_12CopyGaugeArgIsdLi18ELb0ENS_5gauge11FloatNOrderIsLi18ELi4ELi12EL20QudaStaggeredPhase_s0ELb1EL19QudaGhostExchange_sn2147483648ELb0EEENS3_IdLi18ELi2ELi18ELS4_0ELb1ELS5_n2147483648ELb0EEEEEEE	GPU-offline,vol=32768stride=18432precision=8geometry=4Nc=3,vol=32768stride=18432precision=2geometry=4Nc=3	288	1	1	57	1	8	0	-1	-1	-1	-1	2.99753e-05	# 0.00 Gflop/s, 826.43 GB/s, tuning took 0.072379 seconds at Wed Aug 14 16:57:43 2024
      8x16x16x16	N4quda9CopyGaugeINS_12CopyGaugeArgIsdLi18ELb0ENS_5gauge11FloatNOrderIsLi18ELi4ELi12EL20QudaStaggeredPhase_s0ELb1EL19QudaGhostExchange_sn2147483648ELb0EEENS3_IdLi18ELi2ELi18ELS4_0ELb1ELS5_n2147483648ELb0EEEEEEE	GPU-offline,vol=32768stride=18432precision=8geometry=4Nc=3,vol=32768stride=18432precision=2geometry=4Nc=3,ghost	64	1	1	32	1	8	2049	-1	-1	-1	-1	6.16701e-06	# 0.00 Gflop/s, 313.82 GB/s, tuning took 0.032527 seconds at Wed Aug 14 16:57:43 2024
      8x16x16x32	N4quda10CopyCloverINS_6clover11FloatNOrderIfLi72ELi4ELb0ELb0ELb0EEENS2_IdLi72ELi2ELb0ELb0ELb0EEEfdEE	GPU-offline,vol=65536precision=8Nc=3	128	1	1	256	2	1	4097	-1	-1	-1	-1	0.000228147	# 0.00 Gflop/s, 248.19 GB/s, tuning took 0.177084 seconds at Wed Aug 14 17:37:50 2024
      8x16x16x32	N4quda10CopyCloverINS_6clover11FloatNOrderIsLi72ELi8ELb0ELb0ELb0EEENS2_IdLi72ELi2ELb0ELb0ELb0EEEsdEE	GPU-offline,vol=65536precision=8Nc=3	256	1	1	128	2	1	8193	-1	-1	-1	-1	0.000196096	# 0.00 Gflop/s, 240.63 GB/s, tuning took 0.145909 seconds at Wed Aug 14 17:37:49 2024
      8x16x16x32	N4quda10GaugeGaussIdLi3EL21QudaReconstructType_s12EEE	GPU-offline,vol=65536stride=36864precision=8geometry=4Nc=3,lie_group	64	1	1	512	2	1	2138	-1	-1	-1	-1	0.00357035	# 0.00 Gflop/s, 7.93 GB/s, tuning took 2.276630 seconds at Wed Aug 14 17:37:16 2024
      8x16x16x32	N4quda11CopyGaugeExIddLi18ENS_5gauge11FloatNOrderIdLi18ELi2ELi18EL20QudaStaggeredPhase_s0ELb1EL19QudaGhostExchange_sn2147483648ELb0EEENS2_IdLi18ELi2ELi12ELS3_0ELb1ELS4_n2147483648ELb0EEEEE	GPU-offline,vol=65536stride=36864precision=8geometry=4Nc=3vol=65536stride=32768precision=8geometry=4Nc=3r=0000	32	2	1	1024	1	1	16385	-1	-1	-1	-1	0.000267264	# 0.00 Gflop/s, 247.17 GB/s, tuning took 0.286878 seconds at Wed Aug 14 17:37:50 2024
      8x16x16x32	N4quda11CopyGaugeExIddLi18ENS_5gauge11FloatNOrderIdLi18ELi2ELi18EL20QudaStaggeredPhase_s0ELb1EL19QudaGhostExchange_sn2147483648ELb0EEES5_EE	GPU-offline,vol=65536stride=36864precision=8geometry=4Nc=3vol=65536stride=32768precision=8geometry=4Nc=3r=0000	32	2	1	1024	1	1	6145	-1	-1	-1	-1	0.000336384	# 0.00 Gflop/s, 238.47 GB/s, tuning took 0.290339 seconds at Wed Aug 14 17:37:18 2024
      8x16x16x32	N4quda12CloverInvertIdEE	GPU-offline,nParity=2,vol=65536precision=8Nc=3,trlog=true,twist=false	32	2	1	48	1	1	2049	-1	-1	-1	-1	0.00111206	# 0.00 Gflop/s, 67.89 GB/s, tuning took 26.610486 seconds at Wed Aug 14 17:37:49 2024
      8x16x16x32	N4quda12ExtractGhostIdLi3ENS_5gauge11FloatNOrderIdLi18ELi2ELi12EL20QudaStaggeredPhase_s0ELb1EL19QudaGhostExchange_sn2147483648ELb0EEEEE	GPU-offline,vol=65536stride=36864precision=8geometry=4Nc=3,extract	32	1	1	256	1	8	0	-1	-1	-1	-1	7.94071e-06	# 0.00 Gflop/s, 445.67 GB/s, tuning took 0.037459 seconds at Wed Aug 14 17:37:11 2024
      8x16x16x32	N4quda12ExtractGhostIdLi3ENS_5gauge11FloatNOrderIdLi18ELi2ELi18EL20QudaStaggeredPhase_s0ELb1EL19QudaGhostExchange_sn2147483648ELb0EEEEE	GPU-offline,vol=65536stride=36864precision=8geometry=4Nc=3,extract	32	1	4	256	1	2	0	-1	-1	-1	-1	7.91841e-06	# 0.00 Gflop/s, 670.39 GB/s, tuning took 0.039793 seconds at Wed Aug 14 17:37:17 2024
      8x16x16x32	N4quda13ComputeCloverIdEE	GPU-offline,vol=65536precision=8Nc=3	128	1	1	256	2	1	0	-1	-1	-1	-1	0.000401408	# 78.37 Gflop/s, 235.10 GB/s, tuning took 0.038698 seconds at Wed Aug 14 17:37:23 2024
      8x16x16x32	N4quda5FmunuIdLi3EL21QudaReconstructType_s18EEE	GPU-offline,vol=65536stride=32768precision=8geometry=4Nc=3r=0000,comm=0000	64	1	2	512	2	3	0	-1	-1	-1	-1	0.00455135	# 213.05 Gflop/s, 211.50 GB/s, tuning took 4.477739 seconds at Wed Aug 14 17:37:23 2024
      8x16x16x32	N4quda7RNGInitE	GPU-offline,vol=65536stride=36864precision=8geometry=4Nc=3	64	2	1	512	1	1	0	-1	-1	-1	-1	0.0235851	# 0.00 Gflop/s, 0.00 GB/s, tuning took 3.201733 seconds at Wed Aug 14 17:37:14 2024
      8x16x16x32	N4quda9CopyGaugeINS_12CopyGaugeArgIddLi18ELb0ENS_5gauge11FloatNOrderIdLi18ELi2ELi12EL20QudaStaggeredPhase_s0ELb1EL19QudaGhostExchange_sn2147483648ELb0EEENS2_8QDPOrderIdLi18EEEEEEE	GPU-offline,vol=65536stride=32768precision=8geometry=4Nc=3,vol=65536stride=36864precision=8geometry=4Nc=3	64	1	1	512	1	8	4097	-1	-1	-1	-1	0.000262656	# 0.00 Gflop/s, 251.51 GB/s, tuning took 0.458798 seconds at Wed Aug 14 17:37:11 2024
      8x16x16x32	N4quda9CopyGaugeINS_12CopyGaugeArgIddLi18ELb0ENS_5gauge11FloatNOrderIdLi18ELi2ELi12EL20QudaStaggeredPhase_s0ELb1EL19QudaGhostExchange_sn2147483648ELb0EEES6_EEEE	GPU-offline,vol=65536stride=36864precision=8geometry=4Nc=3,vol=65536stride=36864precision=8geometry=4Nc=3,ghost	160	1	6	26	1	2	0	-1	-1	-1	-1	6.17012e-06	# 0.00 Gflop/s, 645.26 GB/s, tuning took 0.032216 seconds at Wed Aug 14 17:37:11 2024
      8x16x16x32	N4quda9CopyGaugeINS_12CopyGaugeArgIddLi18ELb0ENS_5gauge11FloatNOrderIdLi18ELi2ELi18EL20QudaStaggeredPhase_s0ELb1EL19QudaGhostExchange_sn2147483648ELb0EEENS2_8QDPOrderIdLi18EEEEEEE	GPU-offline,vol=65536stride=32768precision=8geometry=4Nc=3,vol=65536stride=36864precision=8geometry=4Nc=3	32	1	2	1024	1	4	4469	-1	-1	-1	-1	0.00033024	# 0.00 Gflop/s, 242.90 GB/s, tuning took 0.442071 seconds at Wed Aug 14 17:37:17 2024
      8x16x16x32	N4quda9CopyGaugeINS_12CopyGaugeArgIddLi18ELb0ENS_5gauge11FloatNOrderIdLi18ELi2ELi18EL20QudaStaggeredPhase_s0ELb1EL19QudaGhostExchange_sn2147483648ELb0EEES6_EEEE	GPU-offline,vol=65536stride=36864precision=8geometry=4Nc=3,vol=65536stride=36864precision=8geometry=4Nc=3,ghost	32	1	1	128	1	8	2049	-1	-1	-1	-1	8.06993e-06	# 0.00 Gflop/s, 740.03 GB/s, tuning took 0.040451 seconds at Wed Aug 14 17:37:17 2024
      8x16x16x32	N4quda9CopyGaugeINS_12CopyGaugeArgIddLi18ELb0ENS_5gauge8QDPOrderIdLi18EEENS2_11FloatNOrderIdLi18ELi2ELi12EL20QudaStaggeredPhase_s0ELb1EL19QudaGhostExchange_sn2147483648ELb0EEEEEEE	GPU-offline,vol=65536stride=36864precision=8geometry=4Nc=3,vol=65536stride=32768precision=8geometry=4Nc=3	32	1	4	1024	1	2	4469	-1	-1	-1	-1	0.000268288	# 0.00 Gflop/s, 246.23 GB/s, tuning took 0.361736 seconds at Wed Aug 14 17:37:17 2024
      8x16x16x32	N4quda9CopyGaugeINS_12CopyGaugeArgIfdLi18ELb0ENS_5gauge11FloatNOrderIfLi18ELi4ELi12EL20QudaStaggeredPhase_s0ELb1EL19QudaGhostExchange_sn2147483648ELb0EEENS3_IdLi18ELi2ELi12ELS4_0ELb1ELS5_n2147483648ELb0EEEEEEE	GPU-offline,vol=65536stride=36864precision=8geometry=4Nc=3,vol=65536stride=36864precision=4geometry=4Nc=3	64	1	3	512	1	3	0	-1	-1	-1	-1	9.49589e-05	# 0.00 Gflop/s, 447.22 GB/s, tuning took 0.152062 seconds at Wed Aug 14 17:37:11 2024
      8x16x16x32	N4quda9CopyGaugeINS_12CopyGaugeArgIfdLi18ELb0ENS_5gauge11FloatNOrderIfLi18ELi4ELi12EL20QudaStaggeredPhase_s0ELb1EL19QudaGhostExchange_sn2147483648ELb0EEENS3_IdLi18ELi2ELi12ELS4_0ELb1ELS5_n2147483648ELb0EEEEEEE	GPU-offline,vol=65536stride=36864precision=8geometry=4Nc=3,vol=65536stride=36864precision=4geometry=4Nc=3,ghost	64	1	1	64	1	8	2341	-1	-1	-1	-1	8.00914e-06	# 0.00 Gflop/s, 372.82 GB/s, tuning took 0.041210 seconds at Wed Aug 14 17:37:11 2024
      8x16x16x32	N4quda9CopyGaugeINS_12CopyGaugeArgIfdLi18ELb0ENS_5gauge11FloatNOrderIfLi18ELi4ELi12EL20QudaStaggeredPhase_s0ELb1EL19QudaGhostExchange_sn2147483648ELb0EEENS3_IdLi18ELi2ELi18ELS4_0ELb1ELS5_n2147483648ELb0EEEEEEE	GPU-offline,vol=65536stride=36864precision=8geometry=4Nc=3,vol=65536stride=36864precision=4geometry=4Nc=3	224	1	4	147	1	2	0	-1	-1	-1	-1	9.79383e-05	# 0.00 Gflop/s, 578.15 GB/s, tuning took 0.159108 seconds at Wed Aug 14 17:37:18 2024
      8x16x16x32	N4quda9CopyGaugeINS_12CopyGaugeArgIfdLi18ELb0ENS_5gauge11FloatNOrderIfLi18ELi4ELi12EL20QudaStaggeredPhase_s0ELb1EL19QudaGhostExchange_sn2147483648ELb0EEENS3_IdLi18ELi2ELi18ELS4_0ELb1ELS5_n2147483648ELb0EEEEEEE	GPU-offline,vol=65536stride=36864precision=8geometry=4Nc=3,vol=65536stride=36864precision=4geometry=4Nc=3,ghost	64	1	1	64	1	8	2235	-1	-1	-1	-1	7.81166e-06	# 0.00 Gflop/s, 509.66 GB/s, tuning took 0.038625 seconds at Wed Aug 14 17:37:18 2024
      8x16x16x32	N4quda9CopyGaugeINS_12CopyGaugeArgIsdLi18ELb0ENS_5gauge11FloatNOrderIsLi18ELi4ELi12EL20QudaStaggeredPhase_s0ELb1EL19QudaGhostExchange_sn2147483648ELb0EEENS3_IdLi18ELi2ELi12ELS4_0ELb1ELS5_n2147483648ELb0EEEEEEE	GPU-offline,vol=65536stride=36864precision=8geometry=4Nc=3,vol=65536stride=36864precision=2geometry=4Nc=3	64	1	1	512	1	8	2049	-1	-1	-1	-1	5.72871e-05	# 0.00 Gflop/s, 617.76 GB/s, tuning took 0.109023 seconds at Wed Aug 14 17:37:11 2024
      8x16x16x32	N4quda9CopyGaugeINS_12CopyGaugeArgIsdLi18ELb0ENS_5gauge11FloatNOrderIsLi18ELi4ELi12EL20QudaStaggeredPhase_s0ELb1EL19QudaGhostExchange_sn2147483648ELb0EEENS3_IdLi18ELi2ELi12ELS4_0ELb1ELS5_n2147483648ELb0EEEEEEE	GPU-offline,vol=65536stride=36864precision=8geometry=4Nc=3,vol=65536stride=36864precision=2geometry=4Nc=3,ghost	32	1	2	128	1	4	2049	-1	-1	-1	-1	8.00183e-06	# 0.00 Gflop/s, 310.97 GB/s, tuning took 0.040795 seconds at Wed Aug 14 17:37:11 2024
      8x16x16x32	N4quda9CopyGaugeINS_12CopyGaugeArgIsdLi18ELb0ENS_5gauge11FloatNOrderIsLi18ELi4ELi12EL20QudaStaggeredPhase_s0ELb1EL19QudaGhostExchange_sn2147483648ELb0EEENS3_IdLi18ELi2ELi18ELS4_0ELb1ELS5_n2147483648ELb0EEEEEEE	GPU-offline,vol=65536stride=36864precision=8geometry=4Nc=3,vol=65536stride=36864precision=2geometry=4Nc=3	64	1	1	512	1	8	2138	-1	-1	-1	-1	5.76284e-05	# 0.00 Gflop/s, 859.74 GB/s, tuning took 0.110456 seconds at Wed Aug 14 17:37:18 2024
      8x16x16x32	N4quda9CopyGaugeINS_12CopyGaugeArgIsdLi18ELb0ENS_5gauge11FloatNOrderIsLi18ELi4ELi12EL20QudaStaggeredPhase_s0ELb1EL19QudaGhostExchange_sn2147483648ELb0EEENS3_IdLi18ELi2ELi18ELS4_0ELb1ELS5_n2147483648ELb0EEEEEEE	GPU-offline,vol=65536stride=36864precision=8geometry=4Nc=3,vol=65536stride=36864precision=2geometry=4Nc=3,ghost	32	1	2	128	1	4	0	-1	-1	-1	-1	7.84823e-06	# 0.00 Gflop/s, 443.88 GB/s, tuning took 0.038529 seconds at Wed Aug 14 17:37:18 2024
       8x4x16x64	N4quda10CopyCloverINS_6clover11FloatNOrderIfLi72ELi4ELb0ELb0ELb0EEENS2_IdLi72ELi2ELb0ELb0ELb0EEEfdEE	GPU-offline,vol=32768precision=8Nc=3	32	1	1	512	2	1	2138	-1	-1	-1	-1	4.42101e-05	# 0.00 Gflop/s, 640.39 GB/s, tuning took 0.053008 seconds at Wed Aug 14 17:55:45 2024
       8x4x16x64	N4quda10CopyCloverINS_6clover11FloatNOrderIsLi72ELi8ELb0ELb0ELb0EEENS2_IdLi72ELi2ELb0ELb0ELb0EEEsdEE	GPU-offline,vol=32768precision=8Nc=3	32	1	1	512	2	1	2049	-1	-1	-1	-1	4.39875e-05	# 0.00 Gflop/s, 536.36 GB/s, tuning took 0.051627 seconds at Wed Aug 14 17:55:45 2024
       8x4x16x64	N4quda10GaugeGaussIdLi3EL21QudaReconstructType_s12EEE	GPU-offline,vol=32768stride=20480precision=8geometry=4Nc=3,lie_group	32	1	1	512	2	1	2587	-1	-1	-1	-1	0.00178654	# 0.00 Gflop/s, 8.80 GB/s, tuning took 1.201573 seconds at Wed Aug 14 17:55:29 2024
       8x4x16x64	N4quda11CopyGaugeExIddLi18ENS_5gauge11FloatNOrderIdLi18ELi2ELi18EL20QudaStaggeredPhase_s0ELb1EL19QudaGhostExchange_sn2147483648ELb0EEENS2_IdLi18ELi2ELi12ELS3_0ELb1ELS4_n2147483648ELb0EEEEE	GPU-offline,vol=32768stride=20480precision=8geometry=4Nc=3vol=32768stride=16384precision=8geometry=4Nc=3r=0000	32	2	1	512	1	1	2235	-1	-1	-1	-1	4.27093e-05	# 0.00 Gflop/s, 810.20 GB/s, tuning took 0.054296 seconds at Wed Aug 14 17:55:45 2024
       8x4x16x64	N4quda11CopyGaugeExIddLi18ENS_5gauge11FloatNOrderIdLi18ELi2ELi18EL20QudaStaggeredPhase_s0ELb1EL19QudaGhostExchange_sn2147483648ELb0EEES5_EE	GPU-offline,vol=32768stride=20480precision=8geometry=4Nc=3vol=32768stride=16384precision=8geometry=4Nc=3r=0000	160	2	1	103	1	1	16385	-1	-1	-1	-1	8.2944e-05	# 0.00 Gflop/s, 512.00 GB/s, tuning took 0.098065 seconds at Wed Aug 14 17:55:30 2024
       8x4x16x64	N4quda12CloverInvertIdEE	GPU-offline,nParity=2,vol=32768precision=8Nc=3,trlog=true,twist=false	64	2	1	24	1	1	8193	-1	-1	-1	-1	0.000611093	# 0.00 Gflop/s, 61.77 GB/s, tuning took 12.838270 seconds at Wed Aug 14 17:55:45 2024
       8x4x16x64	N4quda12ExtractGhostIdLi3ENS_5gauge11FloatNOrderIdLi18ELi2ELi12EL20QudaStaggeredPhase_s0ELb1EL19QudaGhostExchange_sn2147483648ELb0EEEEE	GPU-offline,vol=32768stride=20480precision=8geometry=4Nc=3,extract	256	1	1	32	1	8	0	-1	-1	-1	-1	8.32085e-06	# 0.00 Gflop/s, 342.61 GB/s, tuning took 0.057980 seconds at Wed Aug 14 17:55:26 2024
       8x4x16x64	N4quda12ExtractGhostIdLi3ENS_5gauge11FloatNOrderIdLi18ELi2ELi18EL20QudaStaggeredPhase_s0ELb1EL19QudaGhostExchange_sn2147483648ELb0EEEEE	GPU-offline,vol=32768stride=20480precision=8geometry=4Nc=3,extract	128	1	2	64	1	4	0	-1	-1	-1	-1	7.72408e-06	# 0.00 Gflop/s, 553.62 GB/s, tuning took 0.042257 seconds at Wed Aug 14 17:55:29 2024
       8x4x16x64	N4quda13ComputeCloverIdEE	GPU-offline,vol=32768precision=8Nc=3	64	2	1	256	1	1	0	-1	-1	-1	-1	0.000167218	# 94.06 Gflop/s, 282.18 GB/s, tuning took 0.026186 seconds at Wed Aug 14 17:55:32 2024
       8x4x16x64	N4quda5FmunuIdLi3EL21QudaReconstructType_s18EEE	GPU-offline,vol=32768stride=16384precision=8geometry=4Nc=3r=0000,comm=0000	32	2	1	512	1	6	0	-1	-1	-1	-1	0.00227567	# 213.05 Gflop/s, 211.50 GB/s, tuning took 2.263485 seconds at Wed Aug 14 17:55:32 2024
       8x4x16x64	N4quda7RNGInitE	GPU-offline,vol=32768stride=20480precision=8geometry=4Nc=3	64	1	1	256	2	1	0	-1	-1	-1	-1	0.0122542	# 0.00 Gflop/s, 0.00 GB/s, tuning took 1.719872 seconds at Wed Aug 14 17:55:28 2024
       8x4x16x64	N4quda9CopyGaugeINS_12CopyGaugeArgIddLi18ELb0ENS_5gauge11FloatNOrderIdLi18ELi2ELi12EL20QudaStaggeredPhase_s0ELb1EL19QudaGhostExchange_sn2147483648ELb0EEENS2_8QDPOrderIdLi18EEEEEEE	GPU-offline,vol=32768stride=16384precision=8geometry=4Nc=3,vol=32768stride=20480precision=8geometry=4Nc=3	64	1	1	256	1	8	2138	-1	-1	-1	-1	2.73436e-05	# 0.00 Gflop/s, 1265.49 GB/s, tuning took 0.118123 seconds at Wed Aug 14 17:55:26 2024
       8x4x16x64	N4quda9CopyGaugeINS_12CopyGaugeArgIddLi18ELb0ENS_5gauge11FloatNOrderIdLi18ELi2ELi12EL20QudaStaggeredPhase_s0ELb1EL19QudaGhostExchange_sn2147483648ELb0EEES6_EEEE	GPU-offline,vol=32768stride=20480precision=8geometry=4Nc=3,vol=32768stride=20480precision=8geometry=4Nc=3,ghost	96	1	1	43	1	8	3073	-1	-1	-1	-1	6.79107e-06	# 0.00 Gflop/s, 524.74 GB/s, tuning took 0.048108 seconds at Wed Aug 14 17:55:26 2024
       8x4x16x64	N4quda9CopyGaugeINS_12CopyGaugeArgIddLi18ELb0ENS_5gauge11FloatNOrderIdLi18ELi2ELi18EL20QudaStaggeredPhase_s0ELb1EL19QudaGhostExchange_sn2147483648ELb0EEENS2_8QDPOrderIdLi18EEEEEEE	GPU-offline,vol=32768stride=16384precision=8geometry=4Nc=3,vol=32768stride=20480precision=8geometry=4Nc=3	96	1	8	171	1	1	24577	-1	-1	-1	-1	8.6912e-05	# 0.00 Gflop/s, 488.62 GB/s, tuning took 0.155728 seconds at Wed Aug 14 17:55:29 2024
       8x4x16x64	N4quda9CopyGaugeINS_12CopyGaugeArgIddLi18ELb0ENS_5gauge11FloatNOrderIdLi18ELi2ELi18EL20QudaStaggeredPhase_s0ELb1EL19QudaGhostExchange_sn2147483648ELb0EEES6_EEEE	GPU-offline,vol=32768stride=20480precision=8geometry=4Nc=3,vol=32768stride=20480precision=8geometry=4Nc=3,ghost	64	1	1	64	1	8	2049	-1	-1	-1	-1	1.0775e-05	# 0.00 Gflop/s, 496.08 GB/s, tuning took 0.044952 seconds at Wed Aug 14 17:55:29 2024
       8x4x16x64	N4quda9CopyGaugeINS_12CopyGaugeArgIddLi18ELb0ENS_5gauge8QDPOrderIdLi18EEENS2_11FloatNOrderIdLi18ELi2ELi12EL20QudaStaggeredPhase_s0ELb1EL19QudaGhostExchange_sn2147483648ELb0EEEEEEE	GPU-offline,vol=32768stride=20480precision=8geometry=4Nc=3,vol=32768stride=16384precision=8geometry=4Nc=3	32	1	4	512	1	2	0	-1	-1	-1	-1	4.32751e-05	# 0.00 Gflop/s, 799.60 GB/s, tuning took 0.102473 seconds at Wed Aug 14 17:55:29 2024
       8x4x16x64	N4quda9CopyGaugeINS_12CopyGaugeArgIfdLi18ELb0ENS_5gauge11FloatNOrderIfLi18ELi4ELi12EL20QudaStaggeredPhase_s0ELb1EL19QudaGhostExchange_sn2147483648ELb0EEENS3_IdLi18ELi2ELi12ELS4_0ELb1ELS5_n2147483648ELb0EEEEEEE	GPU-offline,vol=32768stride=20480precision=8geometry=4Nc=3,vol=32768stride=20480precision=4geometry=4Nc=3	96	1	1	171	1	8	3073	-1	-1	-1	-1	2.96659e-05	# 0.00 Gflop/s, 795.29 GB/s, tuning took 0.065020 seconds at Wed Aug 14 17:55:26 2024
       8x4x16x64	N4quda9CopyGaugeINS_12CopyGaugeArgIfdLi18ELb0ENS_5gauge11FloatNOrderIfLi18ELi4ELi12EL20QudaStaggeredPhase_s0ELb1EL19QudaGhostExchange_sn2147483648ELb0EEENS3_IdLi18ELi2ELi12ELS4_0ELb1ELS5_n2147483648ELb0EEEEEEE	GPU-offline,vol=32768stride=20480precision=8geometry=4Nc=3,vol=32768stride=20480precision=4geometry=4Nc=3,ghost	32	1	2	128	1	4	0	-1	-1	-1	-1	7.26294e-06	# 0.00 Gflop/s, 367.98 GB/s, tuning took 0.034045 seconds at Wed Aug 14 17:55:26 2024
       8x4x16x64	N4quda9CopyGaugeINS_12CopyGaugeArgIfdLi18ELb0ENS_5gauge11FloatNOrderIfLi18ELi4ELi12EL20QudaStaggeredPhase_s0ELb1EL19QudaGhostExchange_sn2147483648ELb0EEENS3_IdLi18ELi2ELi18ELS4_0ELb1ELS5_n2147483648ELb0EEEEEEE	GPU-offline,vol=32768stride=20480precision=8geometry=4Nc=3,vol=32768stride=20480precision=4geometry=4Nc=3	96	1	1	171	1	8	3511	-1	-1	-1	-1	2.97261e-05	# 0.00 Gflop/s, 1058.24 GB/s, tuning took 0.068614 seconds at Wed Aug 14 17:55:29 2024
       8x4x16x64	N4quda9CopyGaugeINS_12CopyGaugeArgIfdLi18ELb0ENS_5gauge11FloatNOrderIfLi18ELi4ELi12EL20QudaStaggeredPhase_s0ELb1EL19QudaGhostExchange_sn2147483648ELb0EEENS3_IdLi18ELi2ELi18ELS4_0ELb1ELS5_n2147483648ELb0EEEEEEE	GPU-offline,vol=32768stride=20480precision=8geometry=4Nc=3,vol=32768stride=20480precision=4geometry=4Nc=3,ghost	64	1	1	64	1	8	2138	-1	-1	-1	-1	7.14087e-06	# 0.00 Gflop/s, 499.03 GB/s, tuning took 0.038043 seconds at Wed Aug 14 17:55:30 2024
       8x4x16x64	N4quda9CopyGaugeINS_12CopyGaugeArgIsdLi18ELb0ENS_5gauge11FloatNOrderIsLi18ELi4ELi12EL20QudaStaggeredPhase_s0ELb1EL19QudaGhostExchange_sn2147483648ELb0EEENS3_IdLi18ELi2ELi12ELS4_0ELb1ELS5_n2147483648ELb0EEEEEEE	GPU-offline,vol=32768stride=20480precision=8geometry=4Nc=3,vol=32768stride=20480precision=2geometry=4Nc=3	608	1	1	27	1	8	0	-1	-1	-1	-1	2.97562e-05	# 0.00 Gflop/s, 660.73 GB/s, tuning took 0.091306 seconds at Wed Aug 14 17:55:26 2024
       8x4x16x64	N4quda9CopyGaugeINS_12CopyGaugeArgIsdLi18ELb0ENS_5gauge11FloatNOrderIsLi18ELi4ELi12EL20QudaStaggeredPhase_s0ELb1EL19QudaGhostExchange_sn2147483648ELb0EEENS3_IdLi18ELi2ELi12ELS4_0ELb1ELS5_n2147483648ELb0EEEEEEE	GPU-offline,vol=32768stride=20480precision=8geometry=4Nc=3,vol=32768stride=20480precision=2geometry=4Nc=3,ghost	64	1	1	64	1	8	2458	-1	-1	-1	-1	8.36832e-06	# 0.00 Gflop/s, 266.15 GB/s, tuning took 0.039137 seconds at Wed Aug 14 17:55:26 2024
       8x4x16x64	N4quda9CopyGaugeINS_12CopyGaugeArgIsdLi18ELb0ENS_5gauge11FloatNOrderIsLi18ELi4ELi12EL20QudaStaggeredPhase_s0ELb1EL19QudaGhostExchange_sn2147483648ELb0EEENS3_IdLi18ELi2ELi18ELS4_0ELb1ELS5_n2147483648ELb0EEEEEEE	GPU-offline,vol=32768stride=20480precision=8geometry=4Nc=3,vol=32768stride=20480precision=2geometry=4Nc=3	96	1	1	171	1	8	3781	-1	-1	-1	-1	2.98165e-05	# 0.00 Gflop/s, 923.15 GB/s, tuning took 0.081692 seconds at Wed Aug 14 17:55:29 2024
       8x4x16x64	N4quda9CopyGaugeINS_12CopyGaugeArgIsdLi18ELb0ENS_5gauge11FloatNOrderIsLi18ELi4ELi12EL20QudaStaggeredPhase_s0ELb1EL19QudaGhostExchange_sn2147483648ELb0EEENS3_IdLi18ELi2ELi18ELS4_0ELb1ELS5_n2147483648ELb0EEEEEEE	GPU-offline,vol=32768stride=20480precision=8geometry=4Nc=3,vol=32768stride=20480precision=2geometry=4Nc=3,ghost	32	1	2	128	1	4	2235	-1	-1	-1	-1	7.84615e-06	# 0.00 Gflop/s, 397.40 GB/s, tuning took 0.039205 seconds at Wed Aug 14 17:55:29 2024
        8x4x8x64	N4quda10CopyCloverINS_6clover11FloatNOrderIfLi72ELi4ELb0ELb0ELb0EEENS2_IdLi72ELi2ELb0ELb0ELb0EEEfdEE	GPU-offline,vol=16384precision=8Nc=3	32	1	1	256	2	1	2049	-1	-1	-1	-1	2.38517e-05	# 0.00 Gflop/s, 593.49 GB/s, tuning took 0.035671 seconds at Wed Aug 14 17:56:36 2024
        8x4x8x64	N4quda10CopyCloverINS_6clover11FloatNOrderIsLi72ELi8ELb0ELb0ELb0EEENS2_IdLi72ELi2ELb0ELb0ELb0EEEsdEE	GPU-offline,vol=16384precision=8Nc=3	64	1	1	128	2	1	2049	-1	-1	-1	-1	2.3747e-05	# 0.00 Gflop/s, 496.76 GB/s, tuning took 0.039086 seconds at Wed Aug 14 17:56:36 2024
        8x4x8x64	N4quda10GaugeGaussIdLi3EL21QudaReconstructType_s12EEE	GPU-offline,vol=16384stride=10240precision=8geometry=4Nc=3,lie_group	352	1	1	24	2	1	24577	-1	-1	-1	-1	0.000914389	# 0.00 Gflop/s, 8.60 GB/s, tuning took 0.637180 seconds at Wed Aug 14 17:56:27 2024
        8x4x8x64	N4quda11CopyGaugeExIddLi18ENS_5gauge11FloatNOrderIdLi18ELi2ELi18EL20QudaStaggeredPhase_s0ELb1EL19QudaGhostExchange_sn2147483648ELb0EEENS2_IdLi18ELi2ELi12ELS3_0ELb1ELS4_n2147483648ELb0EEEEE	GPU-offline,vol=16384stride=10240precision=8geometry=4Nc=3vol=16384stride=8192precision=8geometry=4Nc=3r=0000	32	1	1	256	2	1	2138	-1	-1	-1	-1	2.28145e-05	# 0.00 Gflop/s, 758.36 GB/s, tuning took 0.037522 seconds at Wed Aug 14 17:56:36 2024
        8x4x8x64	N4quda11CopyGaugeExIddLi18ENS_5gauge11FloatNOrderIdLi18ELi2ELi18EL20QudaStaggeredPhase_s0ELb1EL19QudaGhostExchange_sn2147483648ELb0EEES5_EE	GPU-offline,vol=16384stride=10240precision=8geometry=4Nc=3vol=16384stride=8192precision=8geometry=4Nc=3r=0000	32	2	1	256	1	1	3277	-1	-1	-1	-1	1.37362e-05	# 0.00 Gflop/s, 1545.81 GB/s, tuning took 0.037747 seconds at Wed Aug 14 17:56:28 2024
        8x4x8x64	N4quda12CloverInvertIdEE	GPU-offline,nParity=2,vol=16384precision=8Nc=3,trlog=true,twist=false	64	2	1	45	1	1	8193	-1	-1	-1	-1	0.000321024	# 0.00 Gflop/s, 58.79 GB/s, tuning took 6.855930 seconds at Wed Aug 14 17:56:36 2024
        8x4x8x64	N4quda12ExtractGhostIdLi3ENS_5gauge11FloatNOrderIdLi18ELi2ELi12EL20QudaStaggeredPhase_s0ELb1EL19QudaGhostExchange_sn2147483648ELb0EEEEE	GPU-offline,vol=16384stride=10240precision=8geometry=4Nc=3,extract	96	1	8	43	1	1	24577	-1	-1	-1	-1	6.49404e-06	# 0.00 Gflop/s, 249.77 GB/s, tuning took 0.054475 seconds at Wed Aug 14 17:56:25 2024
        8x4x8x64	N4quda12ExtractGhostIdLi3ENS_5gauge11FloatNOrderIdLi18ELi2ELi18EL20QudaStaggeredPhase_s0ELb1EL19QudaGhostExchange_sn2147483648ELb0EEEEE	GPU-offline,vol=16384stride=10240precision=8geometry=4Nc=3,extract	160	1	6	26	1	2	0	-1	-1	-1	-1	1.07677e-05	# 0.00 Gflop/s, 225.96 GB/s, tuning took 0.046793 seconds at Wed Aug 14 17:56:27 2024
        8x4x8x64	N4quda13ComputeCloverIdEE	GPU-offline,vol=16384precision=8Nc=3	32	1	1	256	2	1	0	-1	-1	-1	-1	6.02353e-05	# 130.56 Gflop/s, 391.68 GB/s, tuning took 0.016741 seconds at Wed Aug 14 17:56:29 2024
        8x4x8x64	N4quda5FmunuIdLi3EL21QudaReconstructType_s18EEE	GPU-offline,vol=16384stride=8192precision=8geometry=4Nc=3r=0000,comm=0000	32	2	1	256	1	6	0	-1	-1	-1	-1	0.00113937	# 212.76 Gflop/s, 211.21 GB/s, tuning took 1.145914 seconds at Wed Aug 14 17:56:29 2024
        8x4x8x64	N4quda7RNGInitE	GPU-offline,vol=16384stride=10240precision=8geometry=4Nc=3	32	2	1	256	1	1	0	-1	-1	-1	-1	0.00624503	# 0.00 Gflop/s, 0.00 GB/s, tuning took 0.975161 seconds at Wed Aug 14 17:56:27 2024
        8x4x8x64	N4quda9CopyGaugeINS_12CopyGaugeArgIddLi18ELb0ENS_5gauge11FloatNOrderIdLi18ELi2ELi12EL20QudaStaggeredPhase_s0ELb1EL19QudaGhostExchange_sn2147483648ELb0EEENS2_8QDPOrderIdLi18EEEEEEE	GPU-offline,vol=16384stride=8192precision=8geometry=4Nc=3,vol=16384stride=10240precision=8geometry=4Nc=3	64	1	1	128	1	8	2138	-1	-1	-1	-1	1.40504e-05	# 0.00 Gflop/s, 1231.39 GB/s, tuning took 0.073608 seconds at Wed Aug 14 17:56:25 2024
        8x4x8x64	N4quda9CopyGaugeINS_12CopyGaugeArgIddLi18ELb0ENS_5gauge11FloatNOrderIdLi18ELi2ELi12EL20QudaStaggeredPhase_s0ELb1EL19QudaGhostExchange_sn2147483648ELb0EEES6_EEEE	GPU-offline,vol=16384stride=10240precision=8geometry=4Nc=3,vol=16384stride=10240precision=8geometry=4Nc=3,ghost	416	1	1	5	1	8	16385	-1	-1	-1	-1	6.32719e-06	# 0.00 Gflop/s, 320.45 GB/s, tuning took 0.047884 seconds at Wed Aug 14 17:56:25 2024
        8x4x8x64	N4quda9CopyGaugeINS_12CopyGaugeArgIddLi18ELb0ENS_5gauge11FloatNOrderIdLi18ELi2ELi18EL20QudaStaggeredPhase_s0ELb1EL19QudaGhostExchange_sn2147483648ELb0EEENS2_8QDPOrderIdLi18EEEEEEE	GPU-offline,vol=16384stride=8192precision=8geometry=4Nc=3,vol=16384stride=10240precision=8geometry=4Nc=3	64	1	1	128	1	8	2049	-1	-1	-1	-1	1.40499e-05	# 0.00 Gflop/s, 1511.31 GB/s, tuning took 0.046716 seconds at Wed Aug 14 17:56:27 2024
        8x4x8x64	N4quda9CopyGaugeINS_12CopyGaugeArgIddLi18ELb0ENS_5gauge11FloatNOrderIdLi18ELi2ELi18EL20QudaStaggeredPhase_s0ELb1EL19QudaGhostExchange_sn2147483648ELb0EEES6_EEEE	GPU-offline,vol=16384stride=10240precision=8geometry=4Nc=3,vol=16384stride=10240precision=8geometry=4Nc=3,ghost	64	1	1	32	1	8	2049	-1	-1	-1	-1	6.56206e-06	# 0.00 Gflop/s, 463.46 GB/s, tuning took 0.049331 seconds at Wed Aug 14 17:56:27 2024
        8x4x8x64	N4quda9CopyGaugeINS_12CopyGaugeArgIddLi18ELb0ENS_5gauge8QDPOrderIdLi18EEENS2_11FloatNOrderIdLi18ELi2ELi12EL20QudaStaggeredPhase_s0ELb1EL19QudaGhostExchange_sn2147483648ELb0EEEEEEE	GPU-offline,vol=16384stride=10240precision=8geometry=4Nc=3,vol=16384stride=8192precision=8geometry=4Nc=3	64	1	1	128	1	8	2049	-1	-1	-1	-1	2.29567e-05	# 0.00 Gflop/s, 753.66 GB/s, tuning took 0.058583 seconds at Wed Aug 14 17:56:27 2024
        8x4x8x64	N4quda9CopyGaugeINS_12CopyGaugeArgIfdLi18ELb0ENS_5gauge11FloatNOrderIfLi18ELi4ELi12EL20QudaStaggeredPhase_s0ELb1EL19QudaGhostExchange_sn2147483648ELb0EEENS3_IdLi18ELi2ELi12ELS4_0ELb1ELS5_n2147483648ELb0EEEEEEE	GPU-offline,vol=16384stride=10240precision=8geometry=4Nc=3,vol=16384stride=10240precision=4geometry=4Nc=3	64	1	1	128	1	8	3511	-1	-1	-1	-1	1.61528e-05	# 0.00 Gflop/s, 730.31 GB/s, tuning took 0.053458 seconds at Wed Aug 14 17:56:26 2024
        8x4x8x64	N4quda9CopyGaugeINS_12CopyGaugeArgIfdLi18ELb0ENS_5gauge11FloatNOrderIfLi18ELi4ELi12EL20QudaStaggeredPhase_s0ELb1EL19QudaGhostExchange_sn2147483648ELb0EEENS3_IdLi18ELi2ELi12ELS4_0ELb1ELS5_n2147483648ELb0EEEEEEE	GPU-offline,vol=16384stride=10240precision=8geometry=4Nc=3,vol=16384stride=10240precision=4geometry=4Nc=3,ghost	416	1	1	5	1	8	24577	-1	-1	-1	-1	6.02906e-06	# 0.00 Gflop/s, 252.22 GB/s, tuning took 0.028529 seconds at Wed Aug 14 17:56:26 2024
        8x4x8x64	N4quda9CopyGaugeINS_12CopyGaugeArgIfdLi18ELb0ENS_5gauge11FloatNOrderIfLi18ELi4ELi12EL20QudaStaggeredPhase_s0ELb1EL19QudaGhostExchange_sn2147483648ELb0EEENS3_IdLi18ELi2ELi18ELS4_0ELb1ELS5_n2147483648ELb0EEEEEEE	GPU-offline,vol=16384stride=10240precision=8geometry=4Nc=3,vol=16384stride=10240precision=4geometry=4Nc=3	64	1	1	128	1	8	3073	-1	-1	-1	-1	1.61858e-05	# 0.00 Gflop/s, 971.76 GB/s, tuning took 0.045229 seconds at Wed Aug 14 17:56:28 2024
        8x4x8x64	N4quda9CopyGaugeINS_12CopyGaugeArgIfdLi18ELb0ENS_5gauge11FloatNOrderIfLi18ELi4ELi12EL20QudaStaggeredPhase_s0ELb1EL19QudaGhostExchange_sn2147483648ELb0EEENS3_IdLi18ELi2ELi18ELS4_0ELb1ELS5_n2147483648ELb0EEEEEEE	GPU-offline,vol=16384stride=10240precision=8geometry=4Nc=3,vol=16384stride=10240precision=4geometry=4Nc=3,ghost	64	1	1	32	1	8	0	-1	-1	-1	-1	6.11265e-06	# 0.00 Gflop/s, 331.69 GB/s, tuning took 0.029322 seconds at Wed Aug 14 17:56:28 2024
        8x4x8x64	N4quda9CopyGaugeINS_12CopyGaugeArgIsdLi18ELb0ENS_5gauge11FloatNOrderIsLi18ELi4ELi12EL20QudaStaggeredPhase_s0ELb1EL19QudaGhostExchange_sn2147483648ELb0EEENS3_IdLi18ELi2ELi12ELS4_0ELb1ELS5_n2147483648ELb0EEEEEEE	GPU-offline,vol=16384stride=10240precision=8geometry=4Nc=3,vol=16384stride=10240precision=2geometry=4Nc=3	64	1	4	128	1	2	0	-1	-1	-1	-1	1.64693e-05	# 0.00 Gflop/s, 596.89 GB/s, tuning took 0.059985 seconds at Wed Aug 14 17:56:25 2024
        8x4x8x64	N4quda9CopyGaugeINS_12CopyGaugeArgIsdLi18ELb0ENS_5gauge11FloatNOrderIsLi18ELi4ELi12EL20QudaStaggeredPhase_s0ELb1EL19QudaGhostExchange_sn2147483648ELb0EEENS3_IdLi18ELi2ELi12ELS4_0ELb1ELS5_n2147483648ELb0EEEEEEE	GPU-offline,vol=16384stride=10240precision=8geometry=4Nc=3,vol=16384stride=10240precision=2geometry=4Nc=3,ghost	416	1	1	5	1	8	24577	-1	-1	-1	-1	6.27984e-06	# 0.00 Gflop/s, 201.79 GB/s, tuning took 0.043378 seconds at Wed Aug 14 17:56:25 2024
        8x4x8x64	N4quda9CopyGaugeINS_12CopyGaugeArgIsdLi18ELb0ENS_5gauge11FloatNOrderIsLi18ELi4ELi12EL20QudaStaggeredPhase_s0ELb1EL19QudaGhostExchange_sn2147483648ELb0EEENS3_IdLi18ELi2ELi18ELS4_0ELb1ELS5_n2147483648ELb0EEEEEEE	GPU-offline,vol=16384stride=10240precision=8geometry=4Nc=3,vol=16384stride=10240precision=2geometry=4Nc=3	32	1	3	256	1	3	3511	-1	-1	-1	-1	1.61197e-05	# 0.00 Gflop/s, 853.77 GB/s, tuning took 0.050349 seconds at Wed Aug 14 17:56:27 2024
        8x4x8x64	N4quda9CopyGaugeINS_12CopyGaugeArgIsdLi18ELb0ENS_5gauge11FloatNOrderIsLi18ELi4ELi12EL20QudaStaggeredPhase_s0ELb1EL19QudaGhostExchange_sn2147483648ELb0EEENS3_IdLi18ELi2ELi18ELS4_0ELb1ELS5_n2147483648ELb0EEEEEEE	GPU-offline,vol=16384stride=10240precision=8geometry=4Nc=3,vol=16384stride=10240precision=2geometry=4Nc=3,ghost	64	1	1	32	1	8	2587	-1	-1	-1	-1	6.70824e-06	# 0.00 Gflop/s, 264.46 GB/s, tuning took 0.032495 seconds at Wed Aug 14 17:56:28 2024
       8x8x16x16	N4quda10CopyCloverINS_6clover11FloatNOrderIfLi72ELi4ELb0ELb0ELb0EEENS2_IdLi72ELi2ELb0ELb0ELb0EEEfdEE	GPU-offline,vol=16384precision=8Nc=3	64	1	1	128	2	1	2049	-1	-1	-1	-1	2.39266e-05	# 0.00 Gflop/s, 591.63 GB/s, tuning took 0.039762 seconds at Wed Aug 14 17:53:43 2024
       8x8x16x16	N4quda10CopyCloverINS_6clover11FloatNOrderIsLi72ELi8ELb0ELb0ELb0EEENS2_IdLi72ELi2ELb0ELb0ELb0EEEsdEE	GPU-offline,vol=16384precision=8Nc=3	64	1	1	128	2	1	2138	-1	-1	-1	-1	2.36983e-05	# 0.00 Gflop/s, 497.78 GB/s, tuning took 0.039153 seconds at Wed Aug 14 17:53:43 2024
       8x8x16x16	N4quda10GaugeGaussIdLi3EL21QudaReconstructType_s12EEE	GPU-offline,vol=16384stride=9216precision=8geometry=4Nc=3,lie_group	352	1	1	24	2	1	12289	-1	-1	-1	-1	0.000914091	# 0.00 Gflop/s, 7.74 GB/s, tuning took 0.632978 seconds at Wed Aug 14 17:53:34 2024
       8x8x16x16	N4quda11CopyGaugeExIddLi18ENS_5gauge11FloatNOrderIdLi18ELi2ELi18EL20QudaStaggeredPhase_s0ELb1EL19QudaGhostExchange_sn2147483648ELb0EEENS2_IdLi18ELi2ELi12ELS3_0ELb1ELS4_n2147483648ELb0EEEEE	GPU-offline,vol=16384stride=9216precision=8geometry=4Nc=3vol=16384stride=8192precision=8geometry=4Nc=3r=0000	32	1	1	256	2	1	2138	-1	-1	-1	-1	2.28852e-05	# 0.00 Gflop/s, 721.65 GB/s, tuning took 0.041217 seconds at Wed Aug 14 17:53:43 2024
       8x8x16x16	N4quda11CopyGaugeExIddLi18ENS_5gauge11FloatNOrderIdLi18ELi2ELi18EL20QudaStaggeredPhase_s0ELb1EL19QudaGhostExchange_sn2147483648ELb0EEES5_EE	GPU-offline,vol=16384stride=9216precision=8geometry=4Nc=3vol=16384stride=8192precision=8geometry=4Nc=3r=0000	32	2	1	256	1	1	2138	-1	-1	-1	-1	1.37509e-05	# 0.00 Gflop/s, 1458.38 GB/s, tuning took 0.043628 seconds at Wed Aug 14 17:53:35 2024
       8x8x16x16	N4quda12CloverInvertIdEE	GPU-offline,nParity=2,vol=16384precision=8Nc=3,trlog=true,twist=false	32	2	1	48	1	1	3073	-1	-1	-1	-1	0.000303448	# 0.00 Gflop/s, 62.20 GB/s, tuning took 6.746631 seconds at Wed Aug 14 17:53:42 2024
       8x8x16x16	N4quda12ExtractGhostIdLi3ENS_5gauge11FloatNOrderIdLi18ELi2ELi12EL20QudaStaggeredPhase_s0ELb1EL19QudaGhostExchange_sn2147483648ELb0EEEEE	GPU-offline,vol=16384stride=9216precision=8geometry=4Nc=3,extract	480	1	1	5	1	8	24577	-1	-1	-1	-1	6.46165e-06	# 0.00 Gflop/s, 182.56 GB/s, tuning took 0.049500 seconds at Wed Aug 14 17:53:32 2024
       8x8x16x16	N4quda12ExtractGhostIdLi3ENS_5gauge11FloatNOrderIdLi18ELi2ELi18EL20QudaStaggeredPhase_s0ELb1EL19QudaGhostExchange_sn2147483648ELb0EEEEE	GPU-offline,vol=16384stride=9216precision=8geometry=4Nc=3,extract	96	1	1	22	1	8	3511	-1	-1	-1	-1	6.25204e-06	# 0.00 Gflop/s, 283.02 GB/s, tuning took 0.044342 seconds at Wed Aug 14 17:53:34 2024
       8x8x16x16	N4quda13ComputeCloverIdEE	GPU-offline,vol=16384precision=8Nc=3	32	1	1	256	2	1	0	-1	-1	-1	-1	5.96311e-05	# 131.88 Gflop/s, 395.65 GB/s, tuning took 0.016886 seconds at Wed Aug 14 17:53:36 2024
       8x8x16x16	N4quda5FmunuIdLi3EL21QudaReconstructType_s18EEE	GPU-offline,vol=16384stride=8192precision=8geometry=4Nc=3r=0000,comm=0000	32	2	1	256	1	6	0	-1	-1	-1	-1	0.00113971	# 212.70 Gflop/s, 211.15 GB/s, tuning took 1.147153 seconds at Wed Aug 14 17:53:36 2024
       8x8x16x16	N4quda7RNGInitE	GPU-offline,vol=16384stride=9216precision=8geometry=4Nc=3	32	1	1	256	2	1	0	-1	-1	-1	-1	0.00598221	# 0.00 Gflop/s, 0.00 GB/s, tuning took 0.942892 seconds at Wed Aug 14 17:53:34 2024
       8x8x16x16	N4quda9CopyGaugeINS_12CopyGaugeArgIddLi18ELb0ENS_5gauge11FloatNOrderIdLi18ELi2ELi12EL20QudaStaggeredPhase_s0ELb1EL19QudaGhostExchange_sn2147483648ELb0EEENS2_8QDPOrderIdLi18EEEEEEE	GPU-offline,vol=16384stride=8192precision=8geometry=4Nc=3,vol=16384stride=9216precision=8geometry=4Nc=3	64	1	1	128	1	8	2049	-1	-1	-1	-1	1.41677e-05	# 0.00 Gflop/s, 1165.69 GB/s, tuning took 0.080067 seconds at Wed Aug 14 17:53:32 2024
       8x8x16x16	N4quda9CopyGaugeINS_12CopyGaugeArgIddLi18ELb0ENS_5gauge11FloatNOrderIdLi18ELi2ELi12EL20QudaStaggeredPhase_s0ELb1EL19QudaGhostExchange_sn2147483648ELb0EEES6_EEEE	GPU-offline,vol=16384stride=9216precision=8geometry=4Nc=3,vol=16384stride=9216precision=8geometry=4Nc=3,ghost	64	1	1	16	1	8	2235	-1	-1	-1	-1	5.41675e-06	# 0.00 Gflop/s, 245.00 GB/s, tuning took 0.049796 seconds at Wed Aug 14 17:53:32 2024
       8x8x16x16	N4quda9CopyGaugeINS_12CopyGaugeArgIddLi18ELb0ENS_5gauge11FloatNOrderIdLi18ELi2ELi18EL20QudaStaggeredPhase_s0ELb1EL19QudaGhostExchange_sn2147483648ELb0EEENS2_8QDPOrderIdLi18EEEEEEE	GPU-offline,vol=16384stride=8192precision=8geometry=4Nc=3,vol=16384stride=9216precision=8geometry=4Nc=3	64	1	1	128	1	8	2049	-1	-1	-1	-1	1.40047e-05	# 0.00 Gflop/s, 1431.95 GB/s, tuning took 0.043833 seconds at Wed Aug 14 17:53:34 2024
       8x8x16x16	N4quda9CopyGaugeINS_12CopyGaugeArgIddLi18ELb0ENS_5gauge11FloatNOrderIdLi18ELi2ELi18EL20QudaStaggeredPhase_s0ELb1EL19QudaGhostExchange_sn2147483648ELb0EEES6_EEEE	GPU-offline,vol=16384stride=9216precision=8geometry=4Nc=3,vol=16384stride=9216precision=8geometry=4Nc=3,ghost	32	1	2	32	1	4	2049	-1	-1	-1	-1	5.70593e-06	# 0.00 Gflop/s, 348.88 GB/s, tuning took 0.033050 seconds at Wed Aug 14 17:53:34 2024
       8x8x16x16	N4quda9CopyGaugeINS_12CopyGaugeArgIddLi18ELb0ENS_5gauge8QDPOrderIdLi18EEENS2_11FloatNOrderIdLi18ELi2ELi12EL20QudaStaggeredPhase_s0ELb1EL19QudaGhostExchange_sn2147483648ELb0EEEEEEE	GPU-offline,vol=16384stride=9216precision=8geometry=4Nc=3,vol=16384stride=8192precision=8geometry=4Nc=3	32	1	2	256	1	4	2235	-1	-1	-1	-1	2.29805e-05	# 0.00 Gflop/s, 718.66 GB/s, tuning took 0.059515 seconds at Wed Aug 14 17:53:34 2024
       8x8x16x16	N4quda9CopyGaugeINS_12CopyGaugeArgIfdLi18ELb0ENS_5gauge11FloatNOrderIfLi18ELi4ELi12EL20QudaStaggeredPhase_s0ELb1EL19QudaGhostExchange_sn2147483648ELb0EEENS3_IdLi18ELi2ELi12ELS4_0ELb1ELS5_n2147483648ELb0EEEEEEE	GPU-offline,vol=16384stride=9216precision=8geometry=4Nc=3,vol=16384stride=9216precision=4geometry=4Nc=3	64	1	1	128	1	8	3073	-1	-1	-1	-1	1.61528e-05	# 0.00 Gflop/s, 657.28 GB/s, tuning took 0.058218 seconds at Wed Aug 14 17:53:33 2024
       8x8x16x16	N4quda9CopyGaugeINS_12CopyGaugeArgIfdLi18ELb0ENS_5gauge11FloatNOrderIfLi18ELi4ELi12EL20QudaStaggeredPhase_s0ELb1EL19QudaGhostExchange_sn2147483648ELb0EEENS3_IdLi18ELi2ELi12ELS4_0ELb1ELS5_n2147483648ELb0EEEEEEE	GPU-offline,vol=16384stride=9216precision=8geometry=4Nc=3,vol=16384stride=9216precision=4geometry=4Nc=3,ghost	32	1	1	32	1	8	0	-1	-1	-1	-1	6.41985e-06	# 0.00 Gflop/s, 155.04 GB/s, tuning took 0.033055 seconds at Wed Aug 14 17:53:33 2024
       8x8x16x16	N4quda9CopyGaugeINS_12CopyGaugeArgIfdLi18ELb0ENS_5gauge11FloatNOrderIfLi18ELi4ELi12EL20QudaStaggeredPhase_s0ELb1EL19QudaGhostExchange_sn2147483648ELb0EEENS3_IdLi18ELi2ELi18ELS4_0ELb1ELS5_n2147483648ELb0EEEEEEE	GPU-offline,vol=16384stride=9216precision=8geometry=4Nc=3,vol=16384stride=9216precision=4geometry=4Nc=3	32	1	3	256	1	3	3511	-1	-1	-1	-1	1.60867e-05	# 0.00 Gflop/s, 879.97 GB/s, tuning took 0.048467 seconds at Wed Aug 14 17:53:34 2024
       8x8x16x16	N4quda9CopyGaugeINS_12CopyGaugeArgIfdLi18ELb0ENS_5gauge11FloatNOrderIfLi18ELi4ELi12EL20QudaStaggeredPhase_s0ELb1EL19QudaGhostExchange_sn2147483648ELb0EEENS3_IdLi18ELi2ELi18ELS4_0ELb1ELS5_n2147483648ELb0EEEEEEE	GPU-offline,vol=16384stride=9216precision=8geometry=4Nc=3,vol=16384stride=9216precision=4geometry=4Nc=3,ghost	32	1	1	32	1	8	2587	-1	-1	-1	-1	6.32553e-06	# 0.00 Gflop/s, 209.80 GB/s, tuning took 0.033464 seconds at Wed Aug 14 17:53:35 2024
       8x8x16x16	N4quda9CopyGaugeINS_12CopyGaugeArgIsdLi18ELb0ENS_5gauge11FloatNOrderIsLi18ELi4ELi12EL20QudaStaggeredPhase_s0ELb1EL19QudaGhostExchange_sn2147483648ELb0EEENS3_IdLi18ELi2ELi12ELS4_0ELb1ELS5_n2147483648ELb0EEEEEEE	GPU-offline,vol=16384stride=9216precision=8geometry=4Nc=3,vol=16384stride=9216precision=2geometry=4Nc=3	64	1	1	128	1	8	2049	-1	-1	-1	-1	1.76274e-05	# 0.00 Gflop/s, 501.91 GB/s, tuning took 0.063144 seconds at Wed Aug 14 17:53:32 2024
       8x8x16x16	N4quda9CopyGaugeINS_12CopyGaugeArgIsdLi18ELb0ENS_5gauge11FloatNOrderIsLi18ELi4ELi12EL20QudaStaggeredPhase_s0ELb1EL19QudaGhostExchange_sn2147483648ELb0EEENS3_IdLi18ELi2ELi12ELS4_0ELb1ELS5_n2147483648ELb0EEEEEEE	GPU-offline,vol=16384stride=9216precision=8geometry=4Nc=3,vol=16384stride=9216precision=2geometry=4Nc=3,ghost	64	1	1	16	1	8	2458	-1	-1	-1	-1	6.13461e-06	# 0.00 Gflop/s, 135.21 GB/s, tuning took 0.043151 seconds at Wed Aug 14 17:53:32 2024
       8x8x16x16	N4quda9CopyGaugeINS_12CopyGaugeArgIsdLi18ELb0ENS_5gauge11FloatNOrderIsLi18ELi4ELi12EL20QudaStaggeredPhase_s0ELb1EL19QudaGhostExchange_sn2147483648ELb0EEENS3_IdLi18ELi2ELi18ELS4_0ELb1ELS5_n2147483648ELb0EEEEEEE	GPU-offline,vol=16384stride=9216precision=8geometry=4Nc=3,vol=16384stride=9216precision=2geometry=4Nc=3	64	1	1	128	1	8	2049	-1	-1	-1	-1	1.63499e-05	# 0.00 Gflop/s, 757.58 GB/s, tuning took 0.041918 seconds at Wed Aug 14 17:53:34 2024
       8x8x16x16	N4quda9CopyGaugeINS_12CopyGaugeArgIsdLi18ELb0ENS_5gauge11FloatNOrderIsLi18ELi4ELi12EL20QudaStaggeredPhase_s0ELb1EL19QudaGhostExchange_sn2147483648ELb0EEENS3_IdLi18ELi2ELi18ELS4_0ELb1ELS5_n2147483648ELb0EEEEEEE	GPU-offline,vol=16384stride=9216precision=8geometry=4Nc=3,vol=16384stride=9216precision=2geometry=4Nc=3,ghost	288	1	1	4	1	8	16385	-1	-1	-1	-1	6.0916e-06	# 0.00 Gflop/s, 190.63 GB/s, tuning took 0.039386 seconds at Wed Aug 14 17:53:34 2024
        8x8x8x16	N4quda10CopyCloverINS_6clover11FloatNOrderIfLi72ELi4ELb0ELb0ELb0EEENS2_IdLi72ELi2ELb0ELb0ELb0EEEfdEE	GPU-offline,vol=8192precision=8Nc=3	64	1	1	64	2	1	3511	-1	-1	-1	-1	1.42659e-05	# 0.00 Gflop/s, 496.14 GB/s, tuning took 0.031560 seconds at Wed Aug 14 17:49:47 2024
        8x8x8x16	N4quda10CopyCloverINS_6clover11FloatNOrderIsLi72ELi8ELb0ELb0ELb0EEENS2_IdLi72ELi2ELb0ELb0ELb0EEEsdEE	GPU-offline,vol=8192precision=8Nc=3	352	1	1	12	2	1	16385	-1	-1	-1	-1	1.37749e-05	# 0.00 Gflop/s, 428.19 GB/s, tuning took 0.029752 seconds at Wed Aug 14 17:49:47 2024
        8x8x8x16	N4quda10GaugeGaussIdLi3EL21QudaReconstructType_s12EEE	GPU-offline,vol=8192stride=4608precision=8geometry=4Nc=3,lie_group	352	1	1	12	2	1	16385	-1	-1	-1	-1	0.0004584	# 0.00 Gflop/s, 7.72 GB/s, tuning took 0.347964 seconds at Wed Aug 14 17:49:42 2024
        8x8x8x16	N4quda11CopyGaugeExIddLi18ENS_5gauge11FloatNOrderIdLi18ELi2ELi18EL20QudaStaggeredPhase_s0ELb1EL19QudaGhostExchange_sn2147483648ELb0EEENS2_IdLi18ELi2ELi12ELS3_0ELb1ELS4_n2147483648ELb0EEEEE	GPU-offline,vol=8192stride=4608precision=8geometry=4Nc=3vol=8192stride=4096precision=8geometry=4Nc=3r=0000	32	1	1	128	2	1	2341	-1	-1	-1	-1	1.35949e-05	# 0.00 Gflop/s, 607.40 GB/s, tuning took 0.029274 seconds at Wed Aug 14 17:49:47 2024
        8x8x8x16	N4quda11CopyGaugeExIddLi18ENS_5gauge11FloatNOrderIdLi18ELi2ELi18EL20QudaStaggeredPhase_s0ELb1EL19QudaGhostExchange_sn2147483648ELb0EEES5_EE	GPU-offline,vol=8192stride=4608precision=8geometry=4Nc=3vol=8192stride=4096precision=8geometry=4Nc=3r=0000	352	1	1	12	2	1	0	-1	-1	-1	-1	8.192e-06	# 0.00 Gflop/s, 1224.00 GB/s, tuning took 0.043748 seconds at Wed Aug 14 17:49:43 2024
        8x8x8x16	N4quda12CloverInvertIdEE	GPU-offline,nParity=2,vol=8192precision=8Nc=3,trlog=true,twist=false	96	2	1	45	1	1	0	-1	-1	-1	-1	0.00017408	# 0.00 Gflop/s, 54.21 GB/s, tuning took 3.631577 seconds at Wed Aug 14 17:49:47 2024
        8x8x8x16	N4quda12ExtractGhostIdLi3ENS_5gauge11FloatNOrderIdLi18ELi2ELi12EL20QudaStaggeredPhase_s0ELb1EL19QudaGhostExchange_sn2147483648ELb0EEEEE	GPU-offline,vol=8192stride=4608precision=8geometry=4Nc=3,extract	64	1	7	16	1	2	24577	-1	-1	-1	-1	6.54942e-06	# 0.00 Gflop/s, 105.07 GB/s, tuning took 0.058932 seconds at Wed Aug 14 17:49:41 2024
        8x8x8x16	N4quda12ExtractGhostIdLi3ENS_5gauge11FloatNOrderIdLi18ELi2ELi18EL20QudaStaggeredPhase_s0ELb1EL19QudaGhostExchange_sn2147483648ELb0EEEEE	GPU-offline,vol=8192stride=4608precision=8geometry=4Nc=3,extract	32	1	1	32	1	8	2049	-1	-1	-1	-1	6.6304e-06	# 0.00 Gflop/s, 155.68 GB/s, tuning took 0.043228 seconds at Wed Aug 14 17:49:42 2024
        8x8x8x16	N4quda13ComputeCloverIdEE	GPU-offline,vol=8192precision=8Nc=3	96	1	1	43	2	1	0	-1	-1	-1	-1	3.20743e-05	# 122.60 Gflop/s, 367.79 GB/s, tuning took 0.015222 seconds at Wed Aug 14 17:49:43 2024
        8x8x8x16	N4quda5FmunuIdLi3EL21QudaReconstructType_s18EEE	GPU-offline,vol=8192stride=4096precision=8geometry=4Nc=3r=0000,comm=0000	32	1	2	128	2	3	0	-1	-1	-1	-1	0.000571755	# 211.99 Gflop/s, 210.45 GB/s, tuning took 0.611445 seconds at Wed Aug 14 17:49:43 2024
        8x8x8x16	N4quda7RNGInitE	GPU-offline,vol=8192stride=4608precision=8geometry=4Nc=3	352	1	1	12	2	1	0	-1	-1	-1	-1	0.00288154	# 0.00 Gflop/s, 0.00 GB/s, tuning took 0.478585 seconds at Wed Aug 14 17:49:42 2024
        8x8x8x16	N4quda9CopyGaugeINS_12CopyGaugeArgIddLi18ELb0ENS_5gauge11FloatNOrderIdLi18ELi2ELi12EL20QudaStaggeredPhase_s0ELb1EL19QudaGhostExchange_sn2147483648ELb0EEENS2_8QDPOrderIdLi18EEEEEEE	GPU-offline,vol=8192stride=4096precision=8geometry=4Nc=3,vol=8192stride=4608precision=8geometry=4Nc=3	64	1	1	64	1	8	2587	-1	-1	-1	-1	9.39495e-06	# 0.00 Gflop/s, 878.93 GB/s, tuning took 0.063703 seconds at Wed Aug 14 17:49:41 2024
        8x8x8x16	N4quda9CopyGaugeINS_12CopyGaugeArgIddLi18ELb0ENS_5gauge11FloatNOrderIdLi18ELi2ELi12EL20QudaStaggeredPhase_s0ELb1EL19QudaGhostExchange_sn2147483648ELb0EEES6_EEEE	GPU-offline,vol=8192stride=4608precision=8geometry=4Nc=3,vol=8192stride=4608precision=8geometry=4Nc=3,ghost	32	1	1	16	1	8	2138	-1	-1	-1	-1	5.19367e-06	# 0.00 Gflop/s, 149.06 GB/s, tuning took 0.032806 seconds at Wed Aug 14 17:49:41 2024
        8x8x8x16	N4quda9CopyGaugeINS_12CopyGaugeArgIddLi18ELb0ENS_5gauge11FloatNOrderIdLi18ELi2ELi18EL20QudaStaggeredPhase_s0ELb1EL19QudaGhostExchange_sn2147483648ELb0EEENS2_8QDPOrderIdLi18EEEEEEE	GPU-offline,vol=8192stride=4096precision=8geometry=4Nc=3,vol=8192stride=4608precision=8geometry=4Nc=3	32	1	6	128	1	2	0	-1	-1	-1	-1	9.57217e-06	# 0.00 Gflop/s, 1047.52 GB/s, tuning took 0.046513 seconds at Wed Aug 14 17:49:42 2024
        8x8x8x16	N4quda9CopyGaugeINS_12CopyGaugeArgIddLi18ELb0ENS_5gauge11FloatNOrderIdLi18ELi2ELi18EL20QudaStaggeredPhase_s0ELb1EL19QudaGhostExchange_sn2147483648ELb0EEES6_EEEE	GPU-offline,vol=8192stride=4608precision=8geometry=4Nc=3,vol=8192stride=4608precision=8geometry=4Nc=3,ghost	64	1	3	8	1	3	8193	-1	-1	-1	-1	5.28731e-06	# 0.00 Gflop/s, 219.62 GB/s, tuning took 0.038451 seconds at Wed Aug 14 17:49:42 2024
        8x8x8x16	N4quda9CopyGaugeINS_12CopyGaugeArgIddLi18ELb0ENS_5gauge8QDPOrderIdLi18EEENS2_11FloatNOrderIdLi18ELi2ELi12EL20QudaStaggeredPhase_s0ELb1EL19QudaGhostExchange_sn2147483648ELb0EEEEEEE	GPU-offline,vol=8192stride=4608precision=8geometry=4Nc=3,vol=8192stride=4096precision=8geometry=4Nc=3	32	1	3	128	1	3	3511	-1	-1	-1	-1	1.30021e-05	# 0.00 Gflop/s, 635.09 GB/s, tuning took 0.044857 seconds at Wed Aug 14 17:49:42 2024
        8x8x8x16	N4quda9CopyGaugeINS_12CopyGaugeArgIfdLi18ELb0ENS_5gauge11FloatNOrderIfLi18ELi4ELi12EL20QudaStaggeredPhase_s0ELb1EL19QudaGhostExchange_sn2147483648ELb0EEENS3_IdLi18ELi2ELi12ELS4_0ELb1ELS5_n2147483648ELb0EEEEEEE	GPU-offline,vol=8192stride=4608precision=8geometry=4Nc=3,vol=8192stride=4608precision=4geometry=4Nc=3	32	1	2	128	1	4	2458	-1	-1	-1	-1	9.71755e-06	# 0.00 Gflop/s, 546.27 GB/s, tuning took 0.040223 seconds at Wed Aug 14 17:49:41 2024
        8x8x8x16	N4quda9CopyGaugeINS_12CopyGaugeArgIfdLi18ELb0ENS_5gauge11FloatNOrderIfLi18ELi4ELi12EL20QudaStaggeredPhase_s0ELb1EL19QudaGhostExchange_sn2147483648ELb0EEENS3_IdLi18ELi2ELi12ELS4_0ELb1ELS5_n2147483648ELb0EEEEEEE	GPU-offline,vol=8192stride=4608precision=8geometry=4Nc=3,vol=8192stride=4608precision=4geometry=4Nc=3,ghost	32	1	1	16	1	8	2138	-1	-1	-1	-1	5.70932e-06	# 0.00 Gflop/s, 101.69 GB/s, tuning took 0.034031 seconds at Wed Aug 14 17:49:41 2024
        8x8x8x16	N4quda9CopyGaugeINS_12CopyGaugeArgIfdLi18ELb0ENS_5gauge11FloatNOrderIfLi18ELi4ELi12EL20QudaStaggeredPhase_s0ELb1EL19QudaGhostExchange_sn2147483648ELb0EEENS3_IdLi18ELi2ELi18ELS4_0ELb1ELS5_n2147483648ELb0EEEEEEE	GPU-offline,vol=8192stride=4608precision=8geometry=4Nc=3,vol=8192stride=4608precision=4geometry=4Nc=3	32	1	3	128	1	3	3781	-1	-1	-1	-1	9.23588e-06	# 0.00 Gflop/s, 766.35 GB/s, tuning took 0.036709 seconds at Wed Aug 14 17:49:42 2024
        8x8x8x16	N4quda9CopyGaugeINS_12CopyGaugeArgIfdLi18ELb0ENS_5gauge11FloatNOrderIfLi18ELi4ELi12EL20QudaStaggeredPhase_s0ELb1EL19QudaGhostExchange_sn2147483648ELb0EEENS3_IdLi18ELi2ELi18ELS4_0ELb1ELS5_n2147483648ELb0EEEEEEE	GPU-offline,vol=8192stride=4608precision=8geometry=4Nc=3,vol=8192stride=4608precision=4geometry=4Nc=3,ghost	64	1	1	8	1	8	2587	-1	-1	-1	-1	5.85979e-06	# 0.00 Gflop/s, 132.11 GB/s, tuning took 0.042524 seconds at Wed Aug 14 17:49:43 2024
        8x8x8x16	N4quda9CopyGaugeINS_12CopyGaugeArgIsdLi18ELb0ENS_5gauge11FloatNOrderIsLi18ELi4ELi12EL20QudaStaggeredPhase_s0ELb1EL19QudaGhostExchange_sn2147483648ELb0EEENS3_IdLi18ELi2ELi12ELS4_0ELb1ELS5_n2147483648ELb0EEEEEEE	GPU-offline,vol=8192stride=4608precision=8geometry=4Nc=3,vol=8192stride=4608precision=2geometry=4Nc=3	32	1	2	128	1	4	2458	-1	-1	-1	-1	9.728e-06	# 0.00 Gflop/s, 454.74 GB/s, tuning took 0.042572 seconds at Wed Aug 14 17:49:41 2024
        8x8x8x16	N4quda9CopyGaugeINS_12CopyGaugeArgIsdLi18ELb0ENS_5gauge11FloatNOrderIsLi18ELi4ELi12EL20QudaStaggeredPhase_s0ELb1EL19QudaGhostExchange_sn2147483648ELb0EEENS3_IdLi18ELi2ELi12ELS4_0ELb1ELS5_n2147483648ELb0EEEEEEE	GPU-offline,vol=8192stride=4608precision=8geometry=4Nc=3,vol=8192stride=4608precision=2geometry=4Nc=3,ghost	32	1	1	16	1	8	0	-1	-1	-1	-1	6.02279e-06	# 0.00 Gflop/s, 80.33 GB/s, tuning took 0.043839 seconds at Wed Aug 14 17:49:41 2024
        8x8x8x16	N4quda9CopyGaugeINS_12CopyGaugeArgIsdLi18ELb0ENS_5gauge11FloatNOrderIsLi18ELi4ELi12EL20QudaStaggeredPhase_s0ELb1EL19QudaGhostExchange_sn2147483648ELb0EEENS3_IdLi18ELi2ELi18ELS4_0ELb1ELS5_n2147483648ELb0EEEEEEE	GPU-offline,vol=8192stride=4608precision=8geometry=4Nc=3,vol=8192stride=4608precision=2geometry=4Nc=3	64	1	1	64	1	8	2235	-1	-1	-1	-1	9.39495e-06	# 0.00 Gflop/s, 659.20 GB/s, tuning took 0.040400 seconds at Wed Aug 14 17:49:42 2024
        8x8x8x16	N4quda9CopyGaugeINS_12CopyGaugeArgIsdLi18ELb0ENS_5gauge11FloatNOrderIsLi18ELi4ELi12EL20QudaStaggeredPhase_s0ELb1EL19QudaGhostExchange_sn2147483648ELb0EEENS3_IdLi18ELi2ELi18ELS4_0ELb1ELS5_n2147483648ELb0EEEEEEE	GPU-offline,vol=8192stride=4608precision=8geometry=4Nc=3,vol=8192stride=4608precision=2geometry=4Nc=3,ghost	32	1	1	16	1	8	2049	-1	-1	-1	-1	5.51695e-06	# 0.00 Gflop/s, 122.78 GB/s, tuning took 0.037008 seconds at Wed Aug 14 17:49:42 2024
         8x8x8x8	N4quda10CopyCloverINS_6clover11FloatNOrderIfLi72ELi4ELb0ELb0ELb0EEENS2_IdLi72ELi2ELb0ELb0ELb0EEEfdEE	GPU-offline,vol=4096precision=8Nc=3	32	1	1	64	2	1	2049	-1	-1	-1	-1	8.47383e-06	# 0.00 Gflop/s, 417.63 GB/s, tuning took 0.025196 seconds at Wed Aug 14 17:36:05 2024
         8x8x8x8	N4quda10CopyCloverINS_6clover11FloatNOrderIsLi72ELi8ELb0ELb0ELb0EEENS2_IdLi72ELi2ELb0ELb0ELb0EEEsdEE	GPU-offline,vol=4096precision=8Nc=3	64	1	1	32	2	1	3073	-1	-1	-1	-1	8.54928e-06	# 0.00 Gflop/s, 344.96 GB/s, tuning took 0.033836 seconds at Wed Aug 14 17:36:05 2024
         8x8x8x8	N4quda10GaugeGaussIdLi3EL21QudaReconstructType_s12EEE	GPU-offline,vol=4096stride=2304precision=8geometry=4Nc=3,lie_group	192	1	1	11	2	1	6145	-1	-1	-1	-1	0.000251392	# 0.00 Gflop/s, 7.04 GB/s, tuning took 0.212748 seconds at Wed Aug 14 17:36:02 2024
         8x8x8x8	N4quda11CopyGaugeExIddLi18ENS_5gauge11FloatNOrderIdLi18ELi2ELi18EL20QudaStaggeredPhase_s0ELb1EL19QudaGhostExchange_sn2147483648ELb0EEENS2_IdLi18ELi2ELi12ELS3_0ELb1ELS4_n2147483648ELb0EEEEE	GPU-offline,vol=4096stride=2304precision=8geometry=4Nc=3vol=4096stride=2048precision=8geometry=4Nc=3r=0000	32	1	1	64	2	1	2049	-1	-1	-1	-1	8.6016e-06	# 0.00 Gflop/s, 480.00 GB/s, tuning took 0.032867 seconds at Wed Aug 14 17:36:05 2024
         8x8x8x8	N4quda11CopyGaugeExIddLi18ENS_5gauge11FloatNOrderIdLi18ELi2ELi18EL20QudaStaggeredPhase_s0ELb1EL19QudaGhostExchange_sn2147483648ELb0EEES5_EE	GPU-offline,vol=4096stride=2304precision=8geometry=4Nc=3vol=4096stride=2048precision=8geometry=4Nc=3r=0000	32	1	1	64	2	1	3073	-1	-1	-1	-1	8.0161e-06	# 0.00 Gflop/s, 625.43 GB/s, tuning took 0.037758 seconds at Wed Aug 14 17:36:02 2024
         8x8x8x8	N4quda12CloverInvertIdEE	GPU-offline,nParity=2,vol=4096precision=8Nc=3,trlog=true,twist=false	96	2	1	25	1	1	9831	-1	-1	-1	-1	9.43011e-05	# 0.00 Gflop/s, 50.04 GB/s, tuning took 2.076758 seconds at Wed Aug 14 17:36:05 2024
         8x8x8x8	N4quda12ExtractGhostIdLi3ENS_5gauge11FloatNOrderIdLi18ELi2ELi12EL20QudaStaggeredPhase_s0ELb1EL19QudaGhostExchange_sn2147483648ELb0EEEEE	GPU-offline,vol=4096stride=2304precision=8geometry=4Nc=3,extract	128	1	1	4	1	8	0	-1	-1	-1	-1	5.8974e-06	# 0.00 Gflop/s, 66.68 GB/s, tuning took 0.041642 seconds at Wed Aug 14 17:36:01 2024
         8x8x8x8	N4quda12ExtractGhostIdLi3ENS_5gauge11FloatNOrderIdLi18ELi2ELi18EL20QudaStaggeredPhase_s0ELb1EL19QudaGhostExchange_sn2147483648ELb0EEEEE	GPU-offline,vol=4096stride=2304precision=8geometry=4Nc=3,extract	192	1	1	3	1	8	16385	-1	-1	-1	-1	5.18003e-06	# 0.00 Gflop/s, 113.87 GB/s, tuning took 0.039369 seconds at Wed Aug 14 17:36:02 2024
         8x8x8x8	N4quda13ComputeCloverIdEE	GPU-offline,vol=4096precision=8Nc=3	32	1	1	64	2	1	0	-1	-1	-1	-1	1.77617e-05	# 110.69 Gflop/s, 332.08 GB/s, tuning took 0.014797 seconds at Wed Aug 14 17:36:02 2024
         8x8x8x8	N4quda5FmunuIdLi3EL21QudaReconstructType_s18EEE	GPU-offline,vol=4096stride=2048precision=8geometry=4Nc=3r=0000,comm=0000	32	1	2	64	2	3	0	-1	-1	-1	-1	0.000286976	# 211.18 Gflop/s, 209.64 GB/s, tuning took 0.317343 seconds at Wed Aug 14 17:36:02 2024
         8x8x8x8	N4quda7RNGInitE	GPU-offline,vol=4096stride=2304precision=8geometry=4Nc=3	32	1	1	64	2	1	0	-1	-1	-1	-1	0.00148992	# 0.00 Gflop/s, 0.00 GB/s, tuning took 0.342390 seconds at Wed Aug 14 17:36:02 2024
         8x8x8x8	N4quda9CopyGaugeINS_12CopyGaugeArgIddLi18ELb0ENS_5gauge11FloatNOrderIdLi18ELi2ELi12EL20QudaStaggeredPhase_s0ELb1EL19QudaGhostExchange_sn2147483648ELb0EEENS2_8QDPOrderIdLi18EEEEEEE	GPU-offline,vol=4096stride=2048precision=8geometry=4Nc=3,vol=4096stride=2304precision=8geometry=4Nc=3	64	1	1	32	1	8	0	-1	-1	-1	-1	8.87223e-06	# 0.00 Gflop/s, 465.36 GB/s, tuning took 0.062603 seconds at Wed Aug 14 17:36:01 2024
         8x8x8x8	N4quda9CopyGaugeINS_12CopyGaugeArgIddLi18ELb0ENS_5gauge11FloatNOrderIdLi18ELi2ELi12EL20QudaStaggeredPhase_s0ELb1EL19QudaGhostExchange_sn2147483648ELb0EEES6_EEEE	GPU-offline,vol=4096stride=2304precision=8geometry=4Nc=3,vol=4096stride=2304precision=8geometry=4Nc=3,ghost	32	1	1	8	1	8	3277	-1	-1	-1	-1	5.54789e-06	# 0.00 Gflop/s, 79.74 GB/s, tuning took 0.049422 seconds at Wed Aug 14 17:36:01 2024
         8x8x8x8	N4quda9CopyGaugeINS_12CopyGaugeArgIddLi18ELb0ENS_5gauge11FloatNOrderIdLi18ELi2ELi18EL20QudaStaggeredPhase_s0ELb1EL19QudaGhostExchange_sn2147483648ELb0EEENS2_8QDPOrderIdLi18EEEEEEE	GPU-offline,vol=4096stride=2048precision=8geometry=4Nc=3,vol=4096stride=2304precision=8geometry=4Nc=3	32	1	2	64	1	4	2049	-1	-1	-1	-1	1.07677e-05	# 0.00 Gflop/s, 465.61 GB/s, tuning took 0.044565 seconds at Wed Aug 14 17:36:02 2024
         8x8x8x8	N4quda9CopyGaugeINS_12CopyGaugeArgIddLi18ELb0ENS_5gauge11FloatNOrderIdLi18ELi2ELi18EL20QudaStaggeredPhase_s0ELb1EL19QudaGhostExchange_sn2147483648ELb0EEES6_EEEE	GPU-offline,vol=4096stride=2304precision=8geometry=4Nc=3,vol=4096stride=2304precision=8geometry=4Nc=3,ghost	32	1	1	8	1	8	2235	-1	-1	-1	-1	4.97865e-06	# 0.00 Gflop/s, 133.28 GB/s, tuning took 0.031089 seconds at Wed Aug 14 17:36:02 2024
         8x8x8x8	N4quda9CopyGaugeINS_12CopyGaugeArgIddLi18ELb0ENS_5gauge8QDPOrderIdLi18EEENS2_11FloatNOrderIdLi18ELi2ELi12EL20QudaStaggeredPhase_s0ELb1EL19QudaGhostExchange_sn2147483648ELb0EEEEEEE	GPU-offline,vol=4096stride=2304precision=8geometry=4Nc=3,vol=4096stride=2048precision=8geometry=4Nc=3	64	1	1	32	1	8	3073	-1	-1	-1	-1	8.05076e-06	# 0.00 Gflop/s, 512.84 GB/s, tuning took 0.039628 seconds at Wed Aug 14 17:36:02 2024
         8x8x8x8	N4quda9CopyGaugeINS_12CopyGaugeArgIfdLi18ELb0ENS_5gauge11FloatNOrderIfLi18ELi4ELi12EL20QudaStaggeredPhase_s0ELb1EL19QudaGhostExchange_sn2147483648ELb0EEENS3_IdLi18ELi2ELi12ELS4_0ELb1ELS5_n2147483648ELb0EEEEEEE	GPU-offline,vol=4096stride=2304precision=8geometry=4Nc=3,vol=4096stride=2304precision=4geometry=4Nc=3	64	1	1	32	1	8	3073	-1	-1	-1	-1	8.30925e-06	# 0.00 Gflop/s, 319.43 GB/s, tuning took 0.050667 seconds at Wed Aug 14 17:36:01 2024
         8x8x8x8	N4quda9CopyGaugeINS_12CopyGaugeArgIfdLi18ELb0ENS_5gauge11FloatNOrderIfLi18ELi4ELi12EL20QudaStaggeredPhase_s0ELb1EL19QudaGhostExchange_sn2147483648ELb0EEENS3_IdLi18ELi2ELi12ELS4_0ELb1ELS5_n2147483648ELb0EEEEEEE	GPU-offline,vol=4096stride=2304precision=8geometry=4Nc=3,vol=4096stride=2304precision=4geometry=4Nc=3,ghost	32	1	2	8	1	4	2049	-1	-1	-1	-1	5.36914e-06	# 0.00 Gflop/s, 61.79 GB/s, tuning took 0.038860 seconds at Wed Aug 14 17:36:01 2024
         8x8x8x8	N4quda9CopyGaugeINS_12CopyGaugeArgIfdLi18ELb0ENS_5gauge11FloatNOrderIfLi18ELi4ELi12EL20QudaStaggeredPhase_s0ELb1EL19QudaGhostExchange_sn2147483648ELb0EEENS3_IdLi18ELi2ELi18ELS4_0ELb1ELS5_n2147483648ELb0EEEEEEE	GPU-offline,vol=4096stride=2304precision=8geometry=4Nc=3,vol=4096stride=2304precision=4geometry=4Nc=3	64	1	1	32	1	8	2138	-1	-1	-1	-1	8.41579e-06	# 0.00 Gflop/s, 420.51 GB/s, tuning took 0.031555 seconds at Wed Aug 14 17:36:02 2024
         8x8x8x8	N4quda9CopyGaugeINS_12CopyGaugeArgIfdLi18ELb0ENS_5gauge11FloatNOrderIfLi18ELi4ELi12EL20QudaStaggeredPhase_s0ELb1EL19QudaGhostExchange_sn2147483648ELb0EEENS3_IdLi18ELi2ELi18ELS4_0ELb1ELS5_n2147483648ELb0EEEEEEE	GPU-offline,vol=4096stride=2304precision=8geometry=4Nc=3,vol=4096stride=2304precision=4geometry=4Nc=3,ghost	32	1	1	8	1	8	3511	-1	-1	-1	-1	5.25531e-06	# 0.00 Gflop/s, 84.18 GB/s, tuning took 0.040691 seconds at Wed Aug 14 17:36:02 2024
         8x8x8x8	N4quda9CopyGaugeINS_12CopyGaugeArgIsdLi18ELb0ENS_5gauge11FloatNOrderIsLi18ELi4ELi12EL20QudaStaggeredPhase_s0ELb1EL19QudaGhostExchange_sn2147483648ELb0EEENS3_IdLi18ELi2ELi12ELS4_0ELb1ELS5_n2147483648ELb0EEEEEEE	GPU-offline,vol=4096stride=2304precision=8geometry=4Nc=3,vol=4096stride=2304precision=2geometry=4Nc=3	96	1	1	22	1	8	3277	-1	-1	-1	-1	8.54376e-06	# 0.00 Gflop/s, 258.88 GB/s, tuning took 0.036628 seconds at Wed Aug 14 17:36:01 2024
         8x8x8x8	N4quda9CopyGaugeINS_12CopyGaugeArgIsdLi18ELb0ENS_5gauge11FloatNOrderIsLi18ELi4ELi12EL20QudaStaggeredPhase_s0ELb1EL19QudaGhostExchange_sn2147483648ELb0EEENS3_IdLi18ELi2ELi12ELS4_0ELb1ELS5_n2147483648ELb0EEEEEEE	GPU-offline,vol=4096stride=2304precision=8geometry=4Nc=3,vol=4096stride=2304precision=2geometry=4Nc=3,ghost	32	1	1	8	1	8	3511	-1	-1	-1	-1	5.60065e-06	# 0.00 Gflop/s, 49.37 GB/s, tuning took 0.042841 seconds at Wed Aug 14 17:36:01 2024
         8x8x8x8	N4quda9CopyGaugeINS_12CopyGaugeArgIsdLi18ELb0ENS_5gauge11FloatNOrderIsLi18ELi4ELi12EL20QudaStaggeredPhase_s0ELb1EL19QudaGhostExchange_sn2147483648ELb0EEENS3_IdLi18ELi2ELi18ELS4_0ELb1ELS5_n2147483648ELb0EEEEEEE	GPU-offline,vol=4096stride=2304precision=8geometry=4Nc=3,vol=4096stride=2304precision=2geometry=4Nc=3	64	1	1	32	1	8	3781	-1	-1	-1	-1	8.50611e-06	# 0.00 Gflop/s, 364.04 GB/s, tuning took 0.034783 seconds at Wed Aug 14 17:36:02 2024
         8x8x8x8	N4quda9CopyGaugeINS_12CopyGaugeArgIsdLi18ELb0ENS_5gauge11FloatNOrderIsLi18ELi4ELi12EL20QudaStaggeredPhase_s0ELb1EL19QudaGhostExchange_sn2147483648ELb0EEENS3_IdLi18ELi2ELi18ELS4_0ELb1ELS5_n2147483648ELb0EEEEEEE	GPU-offline,vol=4096stride=2304precision=8geometry=4Nc=3,vol=4096stride=2304precision=2geometry=4Nc=3,ghost	32	1	1	8	1	8	3277	-1	-1	-1	-1	5.14194e-06	# 0.00 Gflop/s, 75.28 GB/s, tuning took 0.029762 seconds at Wed Aug 14 17:36:02 2024
            9216	N4quda15TransformReduceINS_7maximumIdEEKNS_7complexIdEEmNS_8abs_max_IddEENS_8identityEEE	GPU-offline,batch_size=1	64	1	1	37	1	1	0	-1	-1	-1	-1	1.89719e-05	# 0.00 Gflop/s, 7.77 GB/s, tuning took 0.042089 seconds at Wed Aug 14 17:04:42 2024
   bytes=1179648	cudaMemcpyDefault	copy,cuda_gauge_field.cpp,576	32	1	1	1	1	1	0	-1	-1	-1	-1	7.18808e-06	# 0.00 Gflop/s, 164.11 GB/s, tuning took 0.001557 seconds at Wed Aug 14 17:49:41 2024
   bytes=1179648	cudaMemcpyDefault	saveCPUField,cuda_gauge_field.cpp,658	32	1	1	1	1	1	0	-1	-1	-1	-1	9.42459e-06	# 0.00 Gflop/s, 125.17 GB/s, tuning took 0.000758 seconds at Wed Aug 14 17:49:42 2024
   bytes=1179648	cudaMemcpyDeviceToDevice	exchangeGhost,cuda_gauge_field.cpp,193	32	1	1	1	1	1	0	-1	-1	-1	-1	7.287e-06	# 0.00 Gflop/s, 323.77 GB/s, tuning took 0.000533 seconds at Wed Aug 14 17:37:17 2024
   bytes=1216512	cudaMemset	allocateGhostBuffer,lattice_field.cpp,288	32	1	1	1	1	1	0	-1	-1	-1	-1	6.41903e-06	# 0.00 Gflop/s, 189.52 GB/s, tuning took 0.000622 seconds at Wed Aug 14 17:56:27 2024
   bytes=1216512	cudaMemset	allocateGhostBuffer,lattice_field.cpp,293	32	1	1	1	1	1	0	-1	-1	-1	-1	6.56178e-06	# 0.00 Gflop/s, 185.39 GB/s, tuning took 0.000457 seconds at Wed Aug 14 17:56:27 2024
   bytes=1277952	cudaMemset	allocateGhostBuffer,lattice_field.cpp,288	32	1	1	1	1	1	0	-1	-1	-1	-1	7.168e-06	# 0.00 Gflop/s, 178.29 GB/s, tuning took 0.000463 seconds at Wed Aug 14 17:38:28 2024
   bytes=1277952	cudaMemset	allocateGhostBuffer,lattice_field.cpp,293	32	1	1	1	1	1	0	-1	-1	-1	-1	1.39947e-05	# 0.00 Gflop/s, 91.32 GB/s, tuning took 0.000938 seconds at Wed Aug 14 17:38:28 2024
  bytes=14155776	cudaMemset	allocateGhostBuffer,lattice_field.cpp,288	32	1	1	1	1	1	0	-1	-1	-1	-1	1.90215e-05	# 0.00 Gflop/s, 744.20 GB/s, tuning took 0.004713 seconds at Wed Aug 14 17:11:18 2024
  bytes=14155776	cudaMemset	allocateGhostBuffer,lattice_field.cpp,293	32	1	1	1	1	1	0	-1	-1	-1	-1	1.86683e-05	# 0.00 Gflop/s, 758.28 GB/s, tuning took 0.001200 seconds at Wed Aug 14 17:11:18 2024
   bytes=1425408	cudaMemset	allocateGhostBuffer,lattice_field.cpp,288	32	1	1	1	1	1	0	-1	-1	-1	-1	8.2944e-06	# 0.00 Gflop/s, 171.85 GB/s, tuning took 0.000769 seconds at Wed Aug 14 17:55:26 2024
   bytes=1425408	cudaMemset	allocateGhostBuffer,lattice_field.cpp,293	32	1	1	1	1	1	0	-1	-1	-1	-1	8.02595e-06	# 0.00 Gflop/s, 177.60 GB/s, tuning took 0.000567 seconds at Wed Aug 14 17:55:26 2024
    bytes=147456	cudaMemcpyDeviceToDevice	exchangeGhost,cuda_gauge_field.cpp,193	32	1	1	1	1	1	0	-1	-1	-1	-1	6.2792e-06	# 0.00 Gflop/s, 46.97 GB/s, tuning took 0.000406 seconds at Wed Aug 14 17:38:31 2024
   bytes=1474560	cudaMemset	allocateGhostBuffer,lattice_field.cpp,288	32	1	1	1	1	1	0	-1	-1	-1	-1	8.76644e-06	# 0.00 Gflop/s, 168.21 GB/s, tuning took 0.000589 seconds at Wed Aug 14 16:57:43 2024
   bytes=1474560	cudaMemset	allocateGhostBuffer,lattice_field.cpp,293	32	1	1	1	1	1	0	-1	-1	-1	-1	9.91543e-06	# 0.00 Gflop/s, 148.71 GB/s, tuning took 0.000602 seconds at Wed Aug 14 16:57:43 2024
 bytes=150994944	cudaMemcpyDefault	copy,cuda_gauge_field.cpp,576	32	1	1	1	1	1	0	-1	-1	-1	-1	0.00156194	# 0.00 Gflop/s, 96.67 GB/s, tuning took 0.031641 seconds at Wed Aug 14 17:11:13 2024
 bytes=150994944	cudaMemcpyDefault	saveCPUField,cuda_gauge_field.cpp,658	32	1	1	1	1	1	0	-1	-1	-1	-1	0.0014435	# 0.00 Gflop/s, 104.60 GB/s, tuning took 0.014815 seconds at Wed Aug 14 17:13:02 2024
   bytes=1572864	cudaMemcpyDeviceToDevice	exchangeGhost,cuda_gauge_field.cpp,193	32	1	1	1	1	1	0	-1	-1	-1	-1	1.57968e-05	# 0.00 Gflop/s, 199.14 GB/s, tuning took 0.000995 seconds at Wed Aug 14 17:11:18 2024
   bytes=1572864	cudaMemset	allocateGhostBuffer,lattice_field.cpp,288	32	1	1	1	1	1	0	-1	-1	-1	-1	1.32864e-05	# 0.00 Gflop/s, 118.38 GB/s, tuning took 0.000926 seconds at Wed Aug 14 17:33:16 2024
   bytes=1572864	cudaMemset	allocateGhostBuffer,lattice_field.cpp,293	32	1	1	1	1	1	0	-1	-1	-1	-1	7.0912e-06	# 0.00 Gflop/s, 221.81 GB/s, tuning took 0.001018 seconds at Wed Aug 14 17:33:16 2024
   bytes=1769472	cudaMemset	allocateGhostBuffer,lattice_field.cpp,288	32	1	1	1	1	1	0	-1	-1	-1	-1	7.21795e-06	# 0.00 Gflop/s, 245.15 GB/s, tuning took 0.000569 seconds at Wed Aug 14 17:37:11 2024
   bytes=1769472	cudaMemset	allocateGhostBuffer,lattice_field.cpp,293	32	1	1	1	1	1	0	-1	-1	-1	-1	8.46147e-06	# 0.00 Gflop/s, 209.12 GB/s, tuning took 0.000582 seconds at Wed Aug 14 17:37:11 2024
   bytes=1916928	cudaMemset	allocateGhostBuffer,lattice_field.cpp,288	32	1	1	1	1	1	0	-1	-1	-1	-1	7.27579e-06	# 0.00 Gflop/s, 263.47 GB/s, tuning took 0.000500 seconds at Wed Aug 14 17:38:31 2024
   bytes=1916928	cudaMemset	allocateGhostBuffer,lattice_field.cpp,293	32	1	1	1	1	1	0	-1	-1	-1	-1	1.068e-05	# 0.00 Gflop/s, 179.49 GB/s, tuning took 0.000579 seconds at Wed Aug 14 17:38:31 2024
    bytes=196608	cudaMemcpyDeviceToDevice	exchangeGhost,cuda_gauge_field.cpp,193	32	1	1	1	1	1	0	-1	-1	-1	-1	6.27874e-06	# 0.00 Gflop/s, 62.63 GB/s, tuning took 0.000414 seconds at Wed Aug 14 16:57:40 2024
    bytes=196608	cudaMemset	allocateGhostBuffer,lattice_field.cpp,288	32	1	1	1	1	1	0	-1	-1	-1	-1	6.2944e-06	# 0.00 Gflop/s, 31.24 GB/s, tuning took 0.002794 seconds at Wed Aug 14 17:36:01 2024
    bytes=196608	cudaMemset	allocateGhostBuffer,lattice_field.cpp,293	32	1	1	1	1	1	0	-1	-1	-1	-1	5.82691e-06	# 0.00 Gflop/s, 33.74 GB/s, tuning took 0.000400 seconds at Wed Aug 14 17:36:01 2024
  bytes=21233664	cudaMemset	allocateGhostBuffer,lattice_field.cpp,288	32	1	1	1	1	1	0	-1	-1	-1	-1	2.50865e-05	# 0.00 Gflop/s, 846.42 GB/s, tuning took 0.001358 seconds at Wed Aug 14 17:13:09 2024
  bytes=21233664	cudaMemset	allocateGhostBuffer,lattice_field.cpp,293	32	1	1	1	1	1	0	-1	-1	-1	-1	2.57952e-05	# 0.00 Gflop/s, 823.16 GB/s, tuning took 0.002159 seconds at Wed Aug 14 17:13:09 2024
   bytes=2138112	cudaMemset	allocateGhostBuffer,lattice_field.cpp,288	32	1	1	1	1	1	0	-1	-1	-1	-1	6.18017e-06	# 0.00 Gflop/s, 345.96 GB/s, tuning took 0.003089 seconds at Wed Aug 14 17:55:29 2024
   bytes=2138112	cudaMemset	allocateGhostBuffer,lattice_field.cpp,293	32	1	1	1	1	1	0	-1	-1	-1	-1	7.97146e-06	# 0.00 Gflop/s, 268.22 GB/s, tuning took 0.000687 seconds at Wed Aug 14 17:55:29 2024
   bytes=2359296	cudaMemcpyDefault	copy,cuda_gauge_field.cpp,576	32	1	1	1	1	1	0	-1	-1	-1	-1	8.97641e-06	# 0.00 Gflop/s, 262.83 GB/s, tuning took 0.001208 seconds at Wed Aug 14 17:53:32 2024
   bytes=2359296	cudaMemcpyDefault	saveCPUField,cuda_gauge_field.cpp,658	32	1	1	1	1	1	0	-1	-1	-1	-1	8.05497e-06	# 0.00 Gflop/s, 292.90 GB/s, tuning took 0.000563 seconds at Wed Aug 14 17:53:34 2024
   bytes=2359296	cudaMemcpyDeviceToDevice	exchangeGhost,cuda_gauge_field.cpp,193	32	1	1	1	1	1	0	-1	-1	-1	-1	7.81737e-06	# 0.00 Gflop/s, 603.60 GB/s, tuning took 0.000506 seconds at Wed Aug 14 17:13:09 2024
   bytes=2359296	cudaMemset	allocateGhostBuffer,lattice_field.cpp,288	32	1	1	1	1	1	0	-1	-1	-1	-1	7.60533e-06	# 0.00 Gflop/s, 310.22 GB/s, tuning took 0.000694 seconds at Wed Aug 14 17:33:23 2024
   bytes=2359296	cudaMemset	allocateGhostBuffer,lattice_field.cpp,293	32	1	1	1	1	1	0	-1	-1	-1	-1	6.92894e-06	# 0.00 Gflop/s, 340.50 GB/s, tuning took 0.000536 seconds at Wed Aug 14 17:33:23 2024
     bytes=24576	cudaMemcpyDeviceToDevice	exchangeGhost,cuda_gauge_field.cpp,193	32	1	1	1	1	1	0	-1	-1	-1	-1	6.69751e-06	# 0.00 Gflop/s, 7.34 GB/s, tuning took 0.000476 seconds at Wed Aug 14 17:56:25 2024
     bytes=24576	cudaMemset	allocateGhostBuffer,lattice_field.cpp,288	32	1	1	1	1	1	0	-1	-1	-1	-1	6.1128e-06	# 0.00 Gflop/s, 4.02 GB/s, tuning took 0.000409 seconds at Wed Aug 14 17:04:41 2024
     bytes=24576	cudaMemset	allocateGhostBuffer,lattice_field.cpp,293	32	1	1	1	1	1	0	-1	-1	-1	-1	5.6552e-06	# 0.00 Gflop/s, 4.35 GB/s, tuning took 0.000381 seconds at Wed Aug 14 17:04:41 2024
   bytes=2654208	cudaMemset	allocateGhostBuffer,lattice_field.cpp,288	32	1	1	1	1	1	0	-1	-1	-1	-1	1.28024e-05	# 0.00 Gflop/s, 207.32 GB/s, tuning took 0.000799 seconds at Wed Aug 14 17:37:17 2024
   bytes=2654208	cudaMemset	allocateGhostBuffer,lattice_field.cpp,293	32	1	1	1	1	1	0	-1	-1	-1	-1	8.7824e-06	# 0.00 Gflop/s, 302.22 GB/s, tuning took 0.000634 seconds at Wed Aug 14 17:37:17 2024
    bytes=294912	cudaMemcpyDeviceToDevice	exchangeGhost,cuda_gauge_field.cpp,193	32	1	1	1	1	1	0	-1	-1	-1	-1	5.89662e-06	# 0.00 Gflop/s, 100.03 GB/s, tuning took 0.000424 seconds at Wed Aug 14 16:57:43 2024
    bytes=294912	cudaMemset	allocateGhostBuffer,lattice_field.cpp,288	32	1	1	1	1	1	0	-1	-1	-1	-1	8.97786e-06	# 0.00 Gflop/s, 32.85 GB/s, tuning took 0.000579 seconds at Wed Aug 14 17:36:02 2024
    bytes=294912	cudaMemset	allocateGhostBuffer,lattice_field.cpp,293	32	1	1	1	1	1	0	-1	-1	-1	-1	7.8632e-06	# 0.00 Gflop/s, 37.51 GB/s, tuning took 0.000514 seconds at Wed Aug 14 17:36:02 2024
   bytes=3145728	cudaMemcpyDeviceToDevice	exchangeGhost,cuda_gauge_field.cpp,193	32	1	1	1	1	1	0	-1	-1	-1	-1	1.00347e-05	# 0.00 Gflop/s, 626.97 GB/s, tuning took 0.000768 seconds at Wed Aug 14 17:11:18 2024
    bytes=344064	cudaMemset	allocateGhostBuffer,lattice_field.cpp,288	32	1	1	1	1	1	0	-1	-1	-1	-1	2.07014e-05	# 0.00 Gflop/s, 16.62 GB/s, tuning took 0.001065 seconds at Wed Aug 14 17:49:41 2024
    bytes=344064	cudaMemset	allocateGhostBuffer,lattice_field.cpp,293	32	1	1	1	1	1	0	-1	-1	-1	-1	2.23138e-05	# 0.00 Gflop/s, 15.42 GB/s, tuning took 0.000675 seconds at Wed Aug 14 17:49:41 2024
     bytes=36864	cudaMemcpyDefault	copy,cuda_gauge_field.cpp,576	32	1	1	1	1	1	0	-1	-1	-1	-1	1.56733e-05	# 0.00 Gflop/s, 2.35 GB/s, tuning took 0.000730 seconds at Wed Aug 14 17:04:41 2024
     bytes=36864	cudaMemcpyDefault	saveCPUField,cuda_gauge_field.cpp,658	32	1	1	1	1	1	0	-1	-1	-1	-1	8.384e-06	# 0.00 Gflop/s, 4.40 GB/s, tuning took 0.000530 seconds at Wed Aug 14 17:04:42 2024
     bytes=36864	cudaMemcpyDeviceToDevice	exchangeGhost,cuda_gauge_field.cpp,193	32	1	1	1	1	1	0	-1	-1	-1	-1	1.01344e-05	# 0.00 Gflop/s, 7.28 GB/s, tuning took 0.000540 seconds at Wed Aug 14 17:56:27 2024
     bytes=36864	cudaMemset	allocateGhostBuffer,lattice_field.cpp,288	32	1	1	1	1	1	0	-1	-1	-1	-1	8.04571e-06	# 0.00 Gflop/s, 4.58 GB/s, tuning took 0.000498 seconds at Wed Aug 14 17:04:42 2024
     bytes=36864	cudaMemset	allocateGhostBuffer,lattice_field.cpp,293	32	1	1	1	1	1	0	-1	-1	-1	-1	7.88218e-06	# 0.00 Gflop/s, 4.68 GB/s, tuning took 0.000529 seconds at Wed Aug 14 17:04:42 2024
    bytes=393216	cudaMemcpyDeviceToDevice	exchangeGhost,cuda_gauge_field.cpp,193	32	1	1	1	1	1	0	-1	-1	-1	-1	7.52778e-06	# 0.00 Gflop/s, 104.47 GB/s, tuning took 0.000509 seconds at Wed Aug 14 16:57:40 2024
   bytes=4718592	cudaMemcpyDefault	copy,cuda_gauge_field.cpp,576	32	1	1	1	1	1	0	-1	-1	-1	-1	1.04064e-05	# 0.00 Gflop/s, 453.43 GB/s, tuning took 0.000720 seconds at Wed Aug 14 16:57:40 2024
   bytes=4718592	cudaMemcpyDefault	saveCPUField,cuda_gauge_field.cpp,658	32	1	1	1	1	1	0	-1	-1	-1	-1	1.28229e-05	# 0.00 Gflop/s, 367.98 GB/s, tuning took 0.000777 seconds at Wed Aug 14 16:57:43 2024
   bytes=4718592	cudaMemcpyDeviceToDevice	exchangeGhost,cuda_gauge_field.cpp,193	32	1	1	1	1	1	0	-1	-1	-1	-1	1.196e-05	# 0.00 Gflop/s, 789.06 GB/s, tuning took 0.000712 seconds at Wed Aug 14 17:13:09 2024
     bytes=49152	cudaMemcpyDeviceToDevice	exchangeGhost,cuda_gauge_field.cpp,193	32	1	1	1	1	1	0	-1	-1	-1	-1	9.88884e-06	# 0.00 Gflop/s, 9.94 GB/s, tuning took 0.000598 seconds at Wed Aug 14 17:36:01 2024
    bytes=516096	cudaMemset	allocateGhostBuffer,lattice_field.cpp,288	32	1	1	1	1	1	0	-1	-1	-1	-1	1.18869e-05	# 0.00 Gflop/s, 43.42 GB/s, tuning took 0.000678 seconds at Wed Aug 14 17:49:42 2024
    bytes=516096	cudaMemset	allocateGhostBuffer,lattice_field.cpp,293	32	1	1	1	1	1	0	-1	-1	-1	-1	8.61842e-06	# 0.00 Gflop/s, 59.88 GB/s, tuning took 0.000538 seconds at Wed Aug 14 17:49:42 2024
    bytes=589824	cudaMemcpyDefault	copy,cuda_gauge_field.cpp,576	32	1	1	1	1	1	0	-1	-1	-1	-1	6.18757e-06	# 0.00 Gflop/s, 95.32 GB/s, tuning took 0.002112 seconds at Wed Aug 14 17:36:01 2024
    bytes=589824	cudaMemcpyDefault	saveCPUField,cuda_gauge_field.cpp,658	32	1	1	1	1	1	0	-1	-1	-1	-1	9.66227e-06	# 0.00 Gflop/s, 61.04 GB/s, tuning took 0.000536 seconds at Wed Aug 14 17:36:02 2024
    bytes=589824	cudaMemcpyDeviceToDevice	exchangeGhost,cuda_gauge_field.cpp,193	32	1	1	1	1	1	0	-1	-1	-1	-1	7.4784e-05	# 0.00 Gflop/s, 15.77 GB/s, tuning took 0.002766 seconds at Wed Aug 14 16:57:43 2024
    bytes=589824	cudaMemset	allocateGhostBuffer,lattice_field.cpp,288	32	1	1	1	1	1	0	-1	-1	-1	-1	5.91644e-06	# 0.00 Gflop/s, 99.69 GB/s, tuning took 0.000424 seconds at Wed Aug 14 17:53:32 2024
    bytes=589824	cudaMemset	allocateGhostBuffer,lattice_field.cpp,293	32	1	1	1	1	1	0	-1	-1	-1	-1	9.95556e-06	# 0.00 Gflop/s, 59.25 GB/s, tuning took 0.000739 seconds at Wed Aug 14 17:53:32 2024
      bytes=6144	cudaMemcpyDeviceToDevice	exchangeGhost,cuda_gauge_field.cpp,193	32	1	1	1	1	1	0	-1	-1	-1	-1	7.18985e-06	# 0.00 Gflop/s, 1.71 GB/s, tuning took 0.000463 seconds at Wed Aug 14 17:04:41 2024
   bytes=6291456	cudaMemcpyDeviceToDevice	exchangeGhost,cuda_gauge_field.cpp,193	32	1	1	1	1	1	0	-1	-1	-1	-1	1.37307e-05	# 0.00 Gflop/s, 916.40 GB/s, tuning took 0.000819 seconds at Wed Aug 14 17:11:18 2024
     bytes=73728	cudaMemcpyDeviceToDevice	exchangeGhost,cuda_gauge_field.cpp,193	32	1	1	1	1	1	0	-1	-1	-1	-1	9.41319e-06	# 0.00 Gflop/s, 15.66 GB/s, tuning took 0.000517 seconds at Wed Aug 14 17:36:02 2024
    bytes=786432	cudaMemcpyDeviceToDevice	exchangeGhost,cuda_gauge_field.cpp,193	32	1	1	1	1	1	0	-1	-1	-1	-1	9.27426e-06	# 0.00 Gflop/s, 169.59 GB/s, tuning took 0.000544 seconds at Wed Aug 14 17:37:11 2024
    bytes=811008	cudaMemset	allocateGhostBuffer,lattice_field.cpp,288	32	1	1	1	1	1	0	-1	-1	-1	-1	6.96727e-06	# 0.00 Gflop/s, 116.40 GB/s, tuning took 0.001397 seconds at Wed Aug 14 17:56:25 2024
    bytes=811008	cudaMemset	allocateGhostBuffer,lattice_field.cpp,293	32	1	1	1	1	1	0	-1	-1	-1	-1	6.06523e-06	# 0.00 Gflop/s, 133.71 GB/s, tuning took 0.000400 seconds at Wed Aug 14 17:56:25 2024
    bytes=884736	cudaMemset	allocateGhostBuffer,lattice_field.cpp,288	32	1	1	1	1	1	0	-1	-1	-1	-1	6.44463e-06	# 0.00 Gflop/s, 137.28 GB/s, tuning took 0.000416 seconds at Wed Aug 14 17:53:34 2024
    bytes=884736	cudaMemset	allocateGhostBuffer,lattice_field.cpp,293	32	1	1	1	1	1	0	-1	-1	-1	-1	6.1496e-06	# 0.00 Gflop/s, 143.87 GB/s, tuning took 0.000451 seconds at Wed Aug 14 17:53:34 2024
      bytes=9216	cudaMemcpyDeviceToDevice	exchangeGhost,cuda_gauge_field.cpp,193	32	1	1	1	1	1	0	-1	-1	-1	-1	4.4861e-06	# 0.00 Gflop/s, 4.11 GB/s, tuning took 0.000330 seconds at Wed Aug 14 17:04:42 2024
   bytes=9437184	cudaMemcpyDefault	copy,cuda_gauge_field.cpp,576	32	1	1	1	1	1	0	-1	-1	-1	-1	1.71046e-05	# 0.00 Gflop/s, 551.73 GB/s, tuning took 0.001326 seconds at Wed Aug 14 17:33:15 2024
   bytes=9437184	cudaMemcpyDefault	saveCPUField,cuda_gauge_field.cpp,658	32	1	1	1	1	1	0	-1	-1	-1	-1	1.49459e-05	# 0.00 Gflop/s, 631.42 GB/s, tuning took 0.001293 seconds at Wed Aug 14 17:33:22 2024
   bytes=9437184	cudaMemcpyDeviceToDevice	exchangeGhost,cuda_gauge_field.cpp,193	32	1	1	1	1	1	0	-1	-1	-1	-1	1.73248e-05	# 0.00 Gflop/s, 1089.44 GB/s, tuning took 0.000722 seconds at Wed Aug 14 17:13:09 2024
     bytes=98304	cudaMemcpyDeviceToDevice	exchangeGhost,cuda_gauge_field.cpp,193	32	1	1	1	1	1	0	-1	-1	-1	-1	5.824e-06	# 0.00 Gflop/s, 33.76 GB/s, tuning took 0.001442 seconds at Wed Aug 14 17:38:28 2024
    bytes=983040	cudaMemset	allocateGhostBuffer,lattice_field.cpp,288	32	1	1	1	1	1	0	-1	-1	-1	-1	7.16e-06	# 0.00 Gflop/s, 137.30 GB/s, tuning took 0.002709 seconds at Wed Aug 14 16:57:40 2024
    bytes=983040	cudaMemset	allocateGhostBuffer,lattice_field.cpp,293	32	1	1	1	1	1	0	-1	-1	-1	-1	1.5008e-05	# 0.00 Gflop/s, 65.50 GB/s, tuning took 0.001837 seconds at Wed Aug 14 16:57:40 2024
