test/.cache/tunecache.tsv
tunecache	1.1.0	1.1.0--sm_70	cpu_arch=x86_64,gpu_arch=sm_70,cuda_version=11.2.152	# Last updated Tue Apr  2 23:55:36 2024

          volume	name	aux	block.x	block.y	block.z	grid.x	grid.y	grid.z	shared_bytes	aux.x	aux.y	aux.z	aux.w	time	comment
     16x16x16x32	N4quda10GaugeGaussIdLi3EL21QudaReconstructType_s12EEE	GPU-offline,vol=131072stride=69632precision=8geometry=4Nc=3,lie_group	64	2	1	1024	1	1	0	-1	-1	-1	-1	0.000346901	# 0.00 Gflop/s, 154.16 GB/s, tuning took 0.984428 seconds at Tue Apr  2 23:55:30 2024
     16x16x16x32	N4quda12ExtractGhostIdLi3ENS_5gauge11FloatNOrderIdLi18ELi2ELi12EL20QudaStaggeredPhase_s0ELb1EL19QudaGhostExchange_sn2147483648ELb0EEEEE	GPU-offline,vol=131072stride=69632precision=8geometry=4Nc=3,extract	64	1	3	128	1	3	0	-1	-1	-1	-1	1.37637e-05	# 0.00 Gflop/s, 399.97 GB/s, tuning took 0.102214 seconds at Tue Apr  2 23:55:28 2024
     16x16x16x32	N4quda7RNGInitE	GPU-offline,vol=131072stride=69632precision=8geometry=4Nc=3	320	2	1	205	1	1	0	-1	-1	-1	-1	0.00195059	# 0.00 Gflop/s, 0.00 GB/s, tuning took 0.602898 seconds at Tue Apr  2 23:55:29 2024
     16x16x16x32	N4quda9CopyGaugeINS_12CopyGaugeArgIddLi18ELb0ENS_5gauge11FloatNOrderIdLi18ELi2ELi12EL20QudaStaggeredPhase_s0ELb1EL19QudaGhostExchange_sn2147483648ELb0EEENS2_8QDPOrderIdLi18EEEEEEE	GPU-offline,cmem,vol=131072stride=65536precision=8geometry=4Nc=3,vol=131072stride=69632precision=8geometry=4Nc=3	96	1	1	683	1	8	2458	-1	-1	-1	-1	0.000156507	# 0.00 Gflop/s, 824.08 GB/s, tuning took 0.781521 seconds at Tue Apr  2 23:55:28 2024
     16x16x16x32	N4quda9CopyGaugeINS_12CopyGaugeArgIddLi18ELb0ENS_5gauge8QDPOrderIdLi18EEENS2_11FloatNOrderIdLi18ELi2ELi12EL20QudaStaggeredPhase_s0ELb1EL19QudaGhostExchange_sn2147483648ELb0EEEEEEE	GPU-offline,cmem,vol=131072stride=69632precision=8geometry=4Nc=3,vol=131072stride=65536precision=8geometry=4Nc=3	96	1	1	683	1	8	2341	-1	-1	-1	-1	0.000163689	# 0.00 Gflop/s, 787.93 GB/s, tuning took 0.714644 seconds at Tue Apr  2 23:55:31 2024
     16x16x16x32	N4quda9CopyGaugeINS_12CopyGaugeArgIfdLi18ELb0ENS_5gauge11FloatNOrderIfLi18ELi4ELi12EL20QudaStaggeredPhase_s0ELb1EL19QudaGhostExchange_sn2147483648ELb0EEENS3_IdLi18ELi2ELi12ELS4_0ELb1ELS5_n2147483648ELb0EEEEEEE	GPU-offline,cmem,vol=131072stride=69632precision=8geometry=4Nc=3,vol=131072stride=69632precision=4geometry=4Nc=3	32	1	2	2048	1	4	0	-1	-1	-1	-1	9.62706e-05	# 0.00 Gflop/s, 833.24 GB/s, tuning took 0.482289 seconds at Tue Apr  2 23:55:29 2024
     16x16x16x32	N4quda9CopyGaugeINS_12CopyGaugeArgIsdLi18ELb0ENS_5gauge11FloatNOrderIsLi18ELi4ELi12EL20QudaStaggeredPhase_s0ELb1EL19QudaGhostExchange_sn2147483648ELb0EEENS3_IdLi18ELi2ELi12ELS4_0ELb1ELS5_n2147483648ELb0EEEEEEE	GPU-offline,cmem,vol=131072stride=69632precision=8geometry=4Nc=3,vol=131072stride=69632precision=2geometry=4Nc=3	192	1	5	342	1	2	0	-1	-1	-1	-1	8.58693e-05	# 0.00 Gflop/s, 778.47 GB/s, tuning took 0.325565 seconds at Tue Apr  2 23:55:28 2024
      8x16x16x32	N4quda15CopyColorSpinorILi4ELi3ENS_11colorspinor11FloatNOrderIdLi4ELi3ELi2ELb0ELb0EEENS1_21SpaceSpinorColorOrderIdLi4ELi3EEESt5tupleIJRNS_16ColorSpinorFieldERKS7_19QudaFieldLocation_sPdPKdEEEE	GPU-offline,cmem,vol=65536,parity=1,precision=8,order=9,Ns=4,Nc=3vol=65536,parity=1,precision=8,order=2,Ns=4,Nc=3,NonRelBasis	448	1	1	147	1	1	0	-1	-1	-1	-1	3.45468e-05	# 0.00 Gflop/s, 728.46 GB/s, tuning took 0.014622 seconds at Tue Apr  2 23:55:32 2024
      8x16x16x32	N4quda15CopyColorSpinorILi4ELi3ENS_11colorspinor21SpaceSpinorColorOrderIdLi4ELi3EEENS1_11FloatNOrderIdLi4ELi3ELi2ELb0ELb0EEESt5tupleIJRNS_16ColorSpinorFieldERKS7_19QudaFieldLocation_sPdPKdEEEE	GPU-offline,cmem,vol=65536,parity=1,precision=8,order=2,Ns=4,Nc=3vol=65536,parity=1,precision=8,order=9,Ns=4,Nc=3,RelBasis	32	1	1	2048	1	1	0	-1	-1	-1	-1	3.53211e-05	# 0.00 Gflop/s, 712.49 GB/s, tuning took 0.014142 seconds at Tue Apr  2 23:55:32 2024
      8x16x16x32	N4quda6WilsonINS_9WilsonArgIdLi3ELi4EL21QudaReconstructType_s12EEEEE	policy,GPU-offline,vol=65536,parity=1,precision=8,order=2,Ns=4,Nc=3,commDim=0000,topo=1111,p2p=0,gdr=0,nvshmem=0,pol=110000111100110000	32	1	1	1	1	1	0	1	0	0	-1	0.000126372	# 684.55 Gflop/s, 1194.85 GB/s, tuning took 0.072513 seconds at Tue Apr  2 23:55:32 2024
      8x16x16x32	N4quda6WilsonINS_9WilsonArgIdLi3ELi4EL21QudaReconstructType_s12EEEEE	policy_kernel=single,GPU-offline,vol=65536,parity=1,precision=8,order=2,Ns=4,Nc=3,commDim=0000,comm=0000	32	1	1	2048	1	1	16385	-1	-1	-1	-1	0.000126176	# 685.61 Gflop/s, 1196.70 GB/s, tuning took 0.402130 seconds at Tue Apr  2 23:55:32 2024
  bytes=18874368	cudaMemcpyDefault	copy,cuda_gauge_field.cpp,576	32	1	1	1	1	1	0	-1	-1	-1	-1	5.432e-05	# 0.00 Gflop/s, 347.47 GB/s, tuning took 0.002161 seconds at Tue Apr  2 23:55:27 2024
  bytes=18874368	cudaMemcpyDefault	saveCPUField,cuda_gauge_field.cpp,658	32	1	1	1	1	1	0	-1	-1	-1	-1	5.38846e-05	# 0.00 Gflop/s, 350.27 GB/s, tuning took 0.001449 seconds at Tue Apr  2 23:55:31 2024
   bytes=2752512	cudaMemset	allocateGhostBuffer,lattice_field.cpp,288	32	1	1	1	1	1	0	-1	-1	-1	-1	4.1767e-06	# 0.00 Gflop/s, 659.02 GB/s, tuning took 0.000766 seconds at Tue Apr  2 23:55:28 2024
   bytes=2752512	cudaMemset	allocateGhostBuffer,lattice_field.cpp,293	32	1	1	1	1	1	0	-1	-1	-1	-1	4.48988e-06	# 0.00 Gflop/s, 613.05 GB/s, tuning took 0.000802 seconds at Tue Apr  2 23:55:28 2024
    bytes=393216	cudaMemcpyDeviceToDevice	exchangeGhost,cuda_gauge_field.cpp,193	32	1	1	1	1	1	0	-1	-1	-1	-1	4.02533e-06	# 0.00 Gflop/s, 195.37 GB/s, tuning took 0.001094 seconds at Tue Apr  2 23:55:28 2024
    bytes=786432	cudaMemcpyDeviceToDevice	exchangeGhost,cuda_gauge_field.cpp,193	32	1	1	1	1	1	0	-1	-1	-1	-1	3.80041e-06	# 0.00 Gflop/s, 413.87 GB/s, tuning took 0.000746 seconds at Tue Apr  2 23:55:28 2024
