test/.cache/tunecache.tsv
tunecache	1.1.0	1.1.0--sm_60	cpu_arch=x86_64,gpu_arch=sm_60,cuda_version=12.4.131	# Last updated Sat Aug 31 14:29:41 2024

          volume	name	aux	block.x	block.y	block.z	grid.x	grid.y	grid.z	shared_bytes	aux.x	aux.y	aux.z	aux.w	time	comment
      4x16x16x32	N4quda15CopyColorSpinorILi4ELi3ENS_11colorspinor11FloatNOrderIdLi4ELi3ELi2ELb0ELb0EEENS1_21SpaceSpinorColorOrderIdLi4ELi3EEESt5tupleIJRNS_16ColorSpinorFieldERKS7_19QudaFieldLocation_sPdPKdEEEE	GPU-offline,vol=32768,parity=1,precision=8,order=9,Ns=4,Nc=3vol=32768,parity=1,precision=8,order=2,Ns=4,Nc=3,NonRelBasis	320	1	1	103	1	1	0	-1	-1	-1	-1	2.68244e-05	# 0.00 Gflop/s, 469.08 GB/s, tuning took 0.022756 seconds at Sat Aug 31 14:29:22 2024
      4x16x16x32	N4quda15CopyColorSpinorILi4ELi3ENS_11colorspinor21SpaceSpinorColorOrderIdLi4ELi3EEENS1_11FloatNOrderIdLi4ELi3ELi2ELb0ELb0EEESt5tupleIJRNS_16ColorSpinorFieldERKS7_19QudaFieldLocation_sPdPKdEEEE	GPU-offline,vol=32768,parity=1,precision=8,order=2,Ns=4,Nc=3vol=32768,parity=1,precision=8,order=9,Ns=4,Nc=3,RelBasis	640	1	1	52	1	1	0	-1	-1	-1	-1	2.66535e-05	# 0.00 Gflop/s, 472.09 GB/s, tuning took 0.023322 seconds at Sat Aug 31 14:29:29 2024
      4x16x16x32	N4quda4PackIdLi3ELb1EEE	policy_kernel,vol=32768,parity=1,precision=8,order=2,Ns=4,Nc=3,comm=1000,topo=2111,nFace=1,device-device	224	1	1	56	1	1	0	-1	-1	-1	-1	1.49872e-05	# 6.56 Gflop/s, 157.42 GB/s, tuning took 1.006476 seconds at Sat Aug 31 14:29:24 2024
      4x16x16x32	N4quda4PackIdLi3ELb1EEE	policy_kernel,vol=32768,parity=1,precision=8,order=2,Ns=4,Nc=3,comm=1000,topo=2111,nFace=1,host-host	32	1	1	2	1	1	0	-1	-1	-1	-1	0.000246413	# 0.40 Gflop/s, 9.57 GB/s, tuning took 0.086265 seconds at Sat Aug 31 14:29:24 2024
      4x16x16x32	N4quda6WilsonINS_9WilsonArgIdLi3ELi4EL21QudaReconstructType_s12EEEEE	policy,commDim=1000,parity=1,topo=2111,p2p=0,gdr=0,nvshmem=0,pol=110000111100110000	32	1	1	1	1	1	0	1	0	0	-1	0.000933632	# 46.33 Gflop/s, 80.86 GB/s, tuning took 0.081745 seconds at Sat Aug 31 14:29:29 2024
      4x16x16x32	N4quda6WilsonINS_9WilsonArgIdLi3ELi4EL21QudaReconstructType_s12EEEEE	policy_kernel=exterior_all,commDim=1000,parity=1	16	1	1	512	1	1	9831	-1	-1	-1	-1	3.6048e-05	# 40.91 Gflop/s, 130.90 GB/s, tuning took 0.182005 seconds at Sat Aug 31 14:29:24 2024
      4x16x16x32	N4quda6WilsonINS_9WilsonArgIdLi3ELi4EL21QudaReconstructType_s12EEEEE	policy_kernel=exterior_all,commDim=1000,parity=1,zero_copy,p2p=0	16	1	1	512	1	1	12289	-1	-1	-1	-1	0.000259688	# 5.68 Gflop/s, 18.17 GB/s, tuning took 0.486427 seconds at Sat Aug 31 14:29:25 2024
      4x16x16x32	N4quda6WilsonINS_9WilsonArgIdLi3ELi4EL21QudaReconstructType_s12EEEEE	policy_kernel=exterior_x,commDim=1000,parity=1	16	1	1	512	1	1	24577	-1	-1	-1	-1	3.4411e-05	# 42.85 Gflop/s, 137.12 GB/s, tuning took 0.137160 seconds at Sat Aug 31 14:29:24 2024
      4x16x16x32	N4quda6WilsonINS_9WilsonArgIdLi3ELi4EL21QudaReconstructType_s12EEEEE	policy_kernel=exterior_x,commDim=1000,parity=1,zero_copy,p2p=0	64	1	1	128	1	1	3073	-1	-1	-1	-1	0.000259448	# 5.68 Gflop/s, 18.19 GB/s, tuning took 0.489602 seconds at Sat Aug 31 14:29:25 2024
      4x16x16x32	N4quda6WilsonINS_9WilsonArgIdLi3ELi4EL21QudaReconstructType_s12EEEEE	policy_kernel=interior,comm=1000,commDim=1000,parity=1	32	1	1	1024	1	1	12289	-1	-1	-1	-1	9.2832e-05	# 452.17 Gflop/s, 762.44 GB/s, tuning took 0.330755 seconds at Sat Aug 31 14:29:24 2024
      4x16x16x32	N4quda6WilsonINS_9WilsonArgIdLi3ELi4EL21QudaReconstructType_s12EEEEE	policy_kernel=interior,comm=1000,commDim=1000,parity=1,host-host	16	1	1	2048	1	1	24577	1	-1	-1	-1	0.000250547	# 167.93 Gflop/s, 291.91 GB/s, tuning took 3.505433 seconds at Sat Aug 31 14:29:29 2024
      8x16x16x32	N4quda10GaugeGaussIdLi3EL21QudaReconstructType_s12EEE	GPU-offline,vol=65536stride=36864precision=8geometry=4Nc=3,lie_group	64	2	1	512	1	1	3781	-1	-1	-1	-1	0.000311832	# 0.00 Gflop/s, 90.79 GB/s, tuning took 0.369798 seconds at Sat Aug 31 14:29:22 2024
      8x16x16x32	N4quda12ExtractGhostIdLi3ENS_5gauge11FloatNOrderIdLi18ELi2ELi12EL20QudaStaggeredPhase_s0ELb1EL19QudaGhostExchange_sn2147483648ELb0EEEEE	GPU-offline,vol=65536stride=36864precision=8geometry=4Nc=3,extract	32	1	1	256	1	8	3511	-1	-1	-1	-1	1.35406e-05	# 0.00 Gflop/s, 261.36 GB/s, tuning took 0.119271 seconds at Sat Aug 31 14:29:20 2024
      8x16x16x32	N4quda7RNGInitE	GPU-offline,vol=65536stride=36864precision=8geometry=4Nc=3	160	1	1	205	2	1	0	-1	-1	-1	-1	0.00229165	# 0.00 Gflop/s, 0.00 GB/s, tuning took 0.422725 seconds at Sat Aug 31 14:29:22 2024
      8x16x16x32	N4quda9CopyGaugeINS_12CopyGaugeArgIddLi18ELb0ENS_5gauge11FloatNOrderIdLi18ELi2ELi12EL20QudaStaggeredPhase_s0ELb1EL19QudaGhostExchange_sn2147483648ELb0EEENS2_8QDPOrderIdLi18EEEEEEE	GPU-offline,vol=65536stride=32768precision=8geometry=4Nc=3,vol=65536stride=36864precision=8geometry=4Nc=3	32	1	1	1024	1	8	3511	-1	-1	-1	-1	0.000118955	# 0.00 Gflop/s, 555.34 GB/s, tuning took 0.393540 seconds at Sat Aug 31 14:29:20 2024
      8x16x16x32	N4quda9CopyGaugeINS_12CopyGaugeArgIddLi18ELb0ENS_5gauge11FloatNOrderIdLi18ELi2ELi12EL20QudaStaggeredPhase_s0ELb1EL19QudaGhostExchange_sn2147483648ELb0EEES6_EEEE	GPU-offline,vol=65536stride=36864precision=8geometry=4Nc=3,vol=65536stride=36864precision=8geometry=4Nc=3,ghost	32	1	1	128	1	8	1586	-1	-1	-1	-1	7.79829e-06	# 0.00 Gflop/s, 510.54 GB/s, tuning took 0.148759 seconds at Sat Aug 31 14:29:20 2024
      8x16x16x32	N4quda9CopyGaugeINS_12CopyGaugeArgIddLi18ELb0ENS_5gauge8QDPOrderIdLi18EEENS2_11FloatNOrderIdLi18ELi2ELi12EL20QudaStaggeredPhase_s0ELb1EL19QudaGhostExchange_sn2147483648ELb0EEEEEEE	GPU-offline,vol=65536stride=36864precision=8geometry=4Nc=3,vol=65536stride=32768precision=8geometry=4Nc=3	736	1	1	45	1	8	24577	-1	-1	-1	-1	0.000124583	# 0.00 Gflop/s, 530.25 GB/s, tuning took 0.365743 seconds at Sat Aug 31 14:29:22 2024
      8x16x16x32	N4quda9CopyGaugeINS_12CopyGaugeArgIfdLi18ELb0ENS_5gauge11FloatNOrderIfLi18ELi4ELi12EL20QudaStaggeredPhase_s0ELb1EL19QudaGhostExchange_sn2147483648ELb0EEENS3_IdLi18ELi2ELi12ELS4_0ELb1ELS5_n2147483648ELb0EEEEEEE	GPU-offline,vol=65536stride=36864precision=8geometry=4Nc=3,vol=65536stride=36864precision=4geometry=4Nc=3	32	1	1	1024	1	8	1891	-1	-1	-1	-1	7.25509e-05	# 0.00 Gflop/s, 585.35 GB/s, tuning took 0.328925 seconds at Sat Aug 31 14:29:21 2024
      8x16x16x32	N4quda9CopyGaugeINS_12CopyGaugeArgIfdLi18ELb0ENS_5gauge11FloatNOrderIfLi18ELi4ELi12EL20QudaStaggeredPhase_s0ELb1EL19QudaGhostExchange_sn2147483648ELb0EEENS3_IdLi18ELi2ELi12ELS4_0ELb1ELS5_n2147483648ELb0EEEEEEE	GPU-offline,vol=65536stride=36864precision=8geometry=4Nc=3,vol=65536stride=36864precision=4geometry=4Nc=3,ghost	32	1	3	128	1	3	2341	-1	-1	-1	-1	7.02005e-06	# 0.00 Gflop/s, 425.35 GB/s, tuning took 0.109925 seconds at Sat Aug 31 14:29:21 2024
      8x16x16x32	N4quda9CopyGaugeINS_12CopyGaugeArgIsdLi18ELb0ENS_5gauge11FloatNOrderIsLi18ELi4ELi12EL20QudaStaggeredPhase_s0ELb1EL19QudaGhostExchange_sn2147483648ELb0EEENS3_IdLi18ELi2ELi12ELS4_0ELb1ELS5_n2147483648ELb0EEEEEEE	GPU-offline,vol=65536stride=36864precision=8geometry=4Nc=3,vol=65536stride=36864precision=2geometry=4Nc=3	96	1	1	342	1	8	3781	-1	-1	-1	-1	6.20122e-05	# 0.00 Gflop/s, 570.68 GB/s, tuning took 0.243043 seconds at Sat Aug 31 14:29:21 2024
      8x16x16x32	N4quda9CopyGaugeINS_12CopyGaugeArgIsdLi18ELb0ENS_5gauge11FloatNOrderIsLi18ELi4ELi12EL20QudaStaggeredPhase_s0ELb1EL19QudaGhostExchange_sn2147483648ELb0EEENS3_IdLi18ELi2ELi12ELS4_0ELb1ELS5_n2147483648ELb0EEEEEEE	GPU-offline,vol=65536stride=36864precision=8geometry=4Nc=3,vol=65536stride=36864precision=2geometry=4Nc=3,ghost	64	1	3	64	1	3	9831	-1	-1	-1	-1	7.07259e-06	# 0.00 Gflop/s, 351.83 GB/s, tuning took 0.119295 seconds at Sat Aug 31 14:29:21 2024
   bytes=1769472	cudaMemset	allocateGhostBuffer,lattice_field.cpp,288	32	1	1	1	1	1	0	-1	-1	-1	-1	7.44725e-06	# 0.00 Gflop/s, 237.60 GB/s, tuning took 0.002430 seconds at Sat Aug 31 14:29:20 2024
   bytes=1769472	cudaMemset	allocateGhostBuffer,lattice_field.cpp,293	32	1	1	1	1	1	0	-1	-1	-1	-1	7.29684e-06	# 0.00 Gflop/s, 242.50 GB/s, tuning took 0.001985 seconds at Sat Aug 31 14:29:20 2024
    bytes=196608	cudaMemcpyDeviceToDevice	exchangeGhost,cuda_gauge_field.cpp,193	32	1	1	1	1	1	0	-1	-1	-1	-1	4.32083e-06	# 0.00 Gflop/s, 91.00 GB/s, tuning took 0.001900 seconds at Sat Aug 31 14:29:20 2024
    bytes=393216	cudaMemcpyDeviceToDevice	exchangeGhost,cuda_gauge_field.cpp,193	32	1	1	1	1	1	0	-1	-1	-1	-1	5.06634e-06	# 0.00 Gflop/s, 155.23 GB/s, tuning took 0.001702 seconds at Sat Aug 31 14:29:20 2024
   bytes=9437184	cudaMemcpyDefault	copy,cuda_gauge_field.cpp,576	32	1	1	1	1	1	0	-1	-1	-1	-1	4.21899e-05	# 0.00 Gflop/s, 223.68 GB/s, tuning took 0.003497 seconds at Sat Aug 31 14:29:20 2024
   bytes=9437184	cudaMemcpyDefault	saveCPUField,cuda_gauge_field.cpp,658	32	1	1	1	1	1	0	-1	-1	-1	-1	4.22493e-05	# 0.00 Gflop/s, 223.37 GB/s, tuning took 0.002696 seconds at Sat Aug 31 14:29:22 2024
