test/.cache/tunecache.tsv
tunecache	1.1.0	1.1.0--sm_80	cpu_arch=x86_64,gpu_arch=sm_80,cuda_version=12.3.103	# Last updated Thu Mar 21 11:23:11 2024

          volume	name	aux	block.x	block.y	block.z	grid.x	grid.y	grid.z	shared_bytes	aux.x	aux.y	aux.z	aux.w	time	comment
     16x32x32x64	N4quda15CopyColorSpinorILi4ELi3ENS_11colorspinor11FloatNOrderIdLi4ELi3ELi2ELb0ELb0EEENS1_21SpaceSpinorColorOrderIdLi4ELi3EEESt5tupleIJRNS_16ColorSpinorFieldERKS7_19QudaFieldLocation_sPdPKdEEEE	GPU-offline,vol=1048576,parity=1,precision=8,order=9,Ns=4,Nc=3vol=1048576,parity=1,precision=8,order=2,Ns=4,Nc=3,NonRelBasis	512	1	1	2048	1	1	0	-1	-1	-1	-1	0.00164618	# 0.00 Gflop/s, 244.60 GB/s, tuning took 0.235813 seconds at Thu Mar 21 11:22:40 2024
     16x32x32x64	N4quda15CopyColorSpinorILi4ELi3ENS_11colorspinor21SpaceSpinorColorOrderIdLi4ELi3EEENS1_11FloatNOrderIdLi4ELi3ELi2ELb0ELb0EEESt5tupleIJRNS_16ColorSpinorFieldERKS7_19QudaFieldLocation_sPdPKdEEEE	GPU-offline,vol=1048576,parity=1,precision=8,order=2,Ns=4,Nc=3vol=1048576,parity=1,precision=8,order=9,Ns=4,Nc=3,RelBasis	128	1	1	8192	1	1	0	-1	-1	-1	-1	0.00159851	# 0.00 Gflop/s, 251.89 GB/s, tuning took 0.219041 seconds at Thu Mar 21 11:22:51 2024
     16x32x32x64	N4quda6WilsonINS_9WilsonArgIdLi3ELi4EL21QudaReconstructType_s12EEEEE	policy,commDim=0000,parity=1,topo=1111,p2p=0,gdr=0,nvshmem=0,pol=110000111100110000	32	1	1	1	1	1	0	7	0	0	-1	0.011048	# 125.28 Gflop/s, 218.68 GB/s, tuning took 0.622982 seconds at Thu Mar 21 11:22:51 2024
     16x32x32x64	N4quda6WilsonINS_9WilsonArgIdLi3ELi4EL21QudaReconstructType_s12EEEEE	policy_kernel=interior,comm=0000,commDim=0000,parity=1	32	1	1	32768	1	1	20276	-1	-1	-1	-1	0.0110512	# 125.25 Gflop/s, 218.61 GB/s, tuning took 10.425145 seconds at Thu Mar 21 11:22:50 2024
     32x32x32x64	N4quda10GaugeGaussIdLi3EL21QudaReconstructType_s12EEE	GPU-offline,vol=2097152stride=1081344precision=8geometry=4Nc=3,lie_group	32	2	1	32768	1	1	2235	-1	-1	-1	-1	0.112381	# 0.00 Gflop/s, 7.39 GB/s, tuning took 69.432075 seconds at Thu Mar 21 11:17:05 2024
     32x32x32x64	N4quda12ExtractGhostIdLi3ENS_5gauge11FloatNOrderIdLi18ELi2ELi12EL20QudaStaggeredPhase_s0ELb1EL19QudaGhostExchange_sn2147483648ELb0EEEEE	GPU-offline,vol=2097152stride=1081344precision=8geometry=4Nc=3,extract	64	1	4	1024	1	2	16385	-1	-1	-1	-1	0.000201146	# 0.00 Gflop/s, 218.95 GB/s, tuning took 0.291732 seconds at Thu Mar 21 11:13:50 2024
     32x32x32x64	N4quda7RNGInitE	GPU-offline,vol=2097152stride=1081344precision=8geometry=4Nc=3	128	1	1	8192	2	1	0	-1	-1	-1	-1	0.871695	# 0.00 Gflop/s, 0.00 GB/s, tuning took 113.565601 seconds at Thu Mar 21 11:15:55 2024
     32x32x32x64	N4quda9CopyGaugeINS_12CopyGaugeArgIddLi18ELb0ENS_5gauge11FloatNOrderIdLi18ELi2ELi12EL20QudaStaggeredPhase_s0ELb1EL19QudaGhostExchange_sn2147483648ELb0EEENS2_8QDPOrderIdLi18EEEEEEE	GPU-offline,vol=2097152stride=1048576precision=8geometry=4Nc=3,vol=2097152stride=1081344precision=8geometry=4Nc=3	32	1	1	32768	1	8	2731	-1	-1	-1	-1	0.00777374	# 0.00 Gflop/s, 262.22 GB/s, tuning took 9.606749 seconds at Thu Mar 21 11:13:50 2024
     32x32x32x64	N4quda9CopyGaugeINS_12CopyGaugeArgIddLi18ELb0ENS_5gauge11FloatNOrderIdLi18ELi2ELi12EL20QudaStaggeredPhase_s0ELb1EL19QudaGhostExchange_sn2147483648ELb0EEES6_EEEE	GPU-offline,vol=2097152stride=1081344precision=8geometry=4Nc=3,vol=2097152stride=1081344precision=8geometry=4Nc=3,ghost	32	1	8	1024	1	1	8193	-1	-1	-1	-1	0.000143792	# 0.00 Gflop/s, 315.85 GB/s, tuning took 0.223206 seconds at Thu Mar 21 11:13:50 2024
     32x32x32x64	N4quda9CopyGaugeINS_12CopyGaugeArgIddLi18ELb0ENS_5gauge8QDPOrderIdLi18EEENS2_11FloatNOrderIdLi18ELi2ELi12EL20QudaStaggeredPhase_s0ELb1EL19QudaGhostExchange_sn2147483648ELb0EEEEEEE	GPU-offline,vol=2097152stride=1081344precision=8geometry=4Nc=3,vol=2097152stride=1048576precision=8geometry=4Nc=3	96	1	1	10923	1	8	5462	-1	-1	-1	-1	0.00793465	# 0.00 Gflop/s, 256.90 GB/s, tuning took 9.766398 seconds at Thu Mar 21 11:17:15 2024
     32x32x32x64	N4quda9CopyGaugeINS_12CopyGaugeArgIfdLi18ELb0ENS_5gauge11FloatNOrderIfLi18ELi4ELi12EL20QudaStaggeredPhase_s0ELb1EL19QudaGhostExchange_sn2147483648ELb0EEENS3_IdLi18ELi2ELi12ELS4_0ELb1ELS5_n2147483648ELb0EEEEEEE	GPU-offline,vol=2097152stride=1081344precision=8geometry=4Nc=3,vol=2097152stride=1081344precision=4geometry=4Nc=3	32	1	4	32768	1	2	7022	-1	-1	-1	-1	0.00462635	# 0.00 Gflop/s, 269.26 GB/s, tuning took 5.775211 seconds at Thu Mar 21 11:14:01 2024
     32x32x32x64	N4quda9CopyGaugeINS_12CopyGaugeArgIfdLi18ELb0ENS_5gauge11FloatNOrderIfLi18ELi4ELi12EL20QudaStaggeredPhase_s0ELb1EL19QudaGhostExchange_sn2147483648ELb0EEENS3_IdLi18ELi2ELi12ELS4_0ELb1ELS5_n2147483648ELb0EEEEEEE	GPU-offline,vol=2097152stride=1081344precision=8geometry=4Nc=3,vol=2097152stride=1081344precision=4geometry=4Nc=3,ghost	64	1	3	512	1	3	0	-1	-1	-1	-1	5.05632e-05	# 0.00 Gflop/s, 673.66 GB/s, tuning took 0.123920 seconds at Thu Mar 21 11:14:01 2024
     32x32x32x64	N4quda9CopyGaugeINS_12CopyGaugeArgIsdLi18ELb0ENS_5gauge11FloatNOrderIsLi18ELi4ELi12EL20QudaStaggeredPhase_s0ELb1EL19QudaGhostExchange_sn2147483648ELb0EEENS3_IdLi18ELi2ELi12ELS4_0ELb1ELS5_n2147483648ELb0EEEEEEE	GPU-offline,vol=2097152stride=1081344precision=8geometry=4Nc=3,vol=2097152stride=1081344precision=2geometry=4Nc=3	64	1	1	16384	1	8	3277	-1	-1	-1	-1	0.00383973	# 0.00 Gflop/s, 270.35 GB/s, tuning took 4.733451 seconds at Thu Mar 21 11:13:55 2024
     32x32x32x64	N4quda9CopyGaugeINS_12CopyGaugeArgIsdLi18ELb0ENS_5gauge11FloatNOrderIsLi18ELi4ELi12EL20QudaStaggeredPhase_s0ELb1EL19QudaGhostExchange_sn2147483648ELb0EEENS3_IdLi18ELi2ELi12ELS4_0ELb1ELS5_n2147483648ELb0EEEEEEE	GPU-offline,vol=2097152stride=1081344precision=8geometry=4Nc=3,vol=2097152stride=1081344precision=2geometry=4Nc=3,ghost	32	1	6	1024	1	2	0	-1	-1	-1	-1	5.0472e-05	# 0.00 Gflop/s, 562.40 GB/s, tuning took 0.127084 seconds at Thu Mar 21 11:13:55 2024
  bytes=22020096	cudaMemset	allocateGhostBuffer,lattice_field.cpp,288	32	1	1	1	1	1	0	-1	-1	-1	-1	2.65509e-05	# 0.00 Gflop/s, 829.36 GB/s, tuning took 0.008365 seconds at Thu Mar 21 11:13:50 2024
  bytes=22020096	cudaMemset	allocateGhostBuffer,lattice_field.cpp,293	32	1	1	1	1	1	0	-1	-1	-1	-1	2.70496e-05	# 0.00 Gflop/s, 814.06 GB/s, tuning took 0.001545 seconds at Thu Mar 21 11:13:50 2024
 bytes=301989888	cudaMemcpyDefault	copy,cuda_gauge_field.cpp,576	32	1	1	1	1	1	0	-1	-1	-1	-1	0.00256907	# 0.00 Gflop/s, 117.55 GB/s, tuning took 0.050555 seconds at Thu Mar 21 11:13:40 2024
 bytes=301989888	cudaMemcpyDefault	saveCPUField,cuda_gauge_field.cpp,658	32	1	1	1	1	1	0	-1	-1	-1	-1	0.00260197	# 0.00 Gflop/s, 116.06 GB/s, tuning took 0.026802 seconds at Thu Mar 21 11:17:15 2024
   bytes=3145728	cudaMemcpyDeviceToDevice	exchangeGhost,cuda_gauge_field.cpp,193	32	1	1	1	1	1	0	-1	-1	-1	-1	1.27552e-05	# 0.00 Gflop/s, 493.25 GB/s, tuning took 0.000812 seconds at Thu Mar 21 11:13:50 2024
   bytes=6291456	cudaMemcpyDeviceToDevice	exchangeGhost,cuda_gauge_field.cpp,193	32	1	1	1	1	1	0	-1	-1	-1	-1	1.14451e-05	# 0.00 Gflop/s, 1099.42 GB/s, tuning took 0.000628 seconds at Thu Mar 21 11:13:50 2024
