test/.cache/tunecache.tsv
tunecache	1.1.0	1.1.0-b869d61-dirty-gfx906	cpu_arch=x86_64,gpu_arch=gfx906,hip_version=14.0.0	# Last updated Wed Dec  6 21:41:14 2023

          volume	name	aux	block.x	block.y	block.z	grid.x	grid.y	grid.z	shared_bytes	aux.x	aux.y	aux.z	aux.w	time	comment
     10x32x32x64	N4quda10GaugeGaussIdLi3EL21QudaReconstructType_s12EEE	GPU-offline,vol=655360stride=360448precision=8geometry=4Nc=3,lie_group	256	1	1	1280	2	1	4001	-1	-1	-1	-1	0.00421866	# 0.00 Gflop/s, 65.62 GB/s, tuning took 4.108713 seconds at Wed Nov 29 21:05:02 2023
     10x32x32x64	N4quda12ExtractGhostIdLi3ENS_5gauge11FloatNOrderIdLi18ELi2ELi12EL20QudaStaggeredPhase_s0ELb1EL19QudaGhostExchange_sn2147483648ELb0EEEEE	GPU-offline,vol=655360stride=360448precision=8geometry=4Nc=3,extract	128	1	2	512	1	4	4572	-1	-1	-1	-1	0.000509074	# 0.00 Gflop/s, 44.03 GB/s, tuning took 1.639599 seconds at Wed Nov 29 21:04:47 2023
     10x32x32x64	N4quda7RNGInitE	GPU-offline,vol=655360stride=360448precision=8geometry=4Nc=3	256	1	1	1280	2	1	0	-1	-1	-1	-1	0.00111883	# 0.00 Gflop/s, 0.00 GB/s, tuning took 0.281040 seconds at Wed Nov 29 21:04:57 2023
     10x32x32x64	N4quda9CopyGaugeINS_12CopyGaugeArgIddLi18ELb0ENS_5gauge11FloatNOrderIdLi18ELi2ELi12EL20QudaStaggeredPhase_s0ELb1EL19QudaGhostExchange_sn2147483648ELb0EEENS2_8QDPOrderIdLi18EEEEEEE	GPU-offline,vol=655360stride=327680precision=8geometry=4Nc=3,vol=655360stride=360448precision=8geometry=4Nc=3	192	1	1	1707	1	8	2667	-1	-1	-1	-1	0.0023824	# 0.00 Gflop/s, 274.64 GB/s, tuning took 3.689100 seconds at Wed Nov 29 21:04:45 2023
     10x32x32x64	N4quda9CopyGaugeINS_12CopyGaugeArgIddLi18ELb0ENS_5gauge11FloatNOrderIdLi18ELi2ELi12EL20QudaStaggeredPhase_s0ELb1EL19QudaGhostExchange_sn2147483648ELb0EEES6_EEEE	GPU-offline,vol=655360stride=360448precision=8geometry=4Nc=3,vol=655360stride=360448precision=8geometry=4Nc=3,ghost	64	1	2	512	1	4	2286	-1	-1	-1	-1	0.000185585	# 0.00 Gflop/s, 132.85 GB/s, tuning took 1.133239 seconds at Wed Nov 29 21:04:48 2023
     10x32x32x64	N4quda9CopyGaugeINS_12CopyGaugeArgIddLi18ELb0ENS_5gauge8QDPOrderIdLi18EEENS2_11FloatNOrderIdLi18ELi2ELi12EL20QudaStaggeredPhase_s0ELb1EL19QudaGhostExchange_sn2147483648ELb0EEEEEEE	GPU-offline,vol=655360stride=360448precision=8geometry=4Nc=3,vol=655360stride=327680precision=8geometry=4Nc=3	128	1	2	2560	1	4	4572	-1	-1	-1	-1	0.00302282	# 0.00 Gflop/s, 216.46 GB/s, tuning took 4.346883 seconds at Wed Nov 29 21:05:06 2023
     10x32x32x64	N4quda9CopyGaugeINS_12CopyGaugeArgIfdLi18ELb0ENS_5gauge11FloatNOrderIfLi18ELi4ELi12EL20QudaStaggeredPhase_s0ELb1EL19QudaGhostExchange_sn2147483648ELb0EEENS3_IdLi18ELi2ELi12ELS4_0ELb1ELS5_n2147483648ELb0EEEEEEE	GPU-offline,vol=655360stride=360448precision=8geometry=4Nc=3,vol=655360stride=360448precision=4geometry=4Nc=3	256	1	1	1280	1	8	3201	-1	-1	-1	-1	0.00155013	# 0.00 Gflop/s, 267.87 GB/s, tuning took 2.927632 seconds at Wed Nov 29 21:04:56 2023
     10x32x32x64	N4quda9CopyGaugeINS_12CopyGaugeArgIfdLi18ELb0ENS_5gauge11FloatNOrderIfLi18ELi4ELi12EL20QudaStaggeredPhase_s0ELb1EL19QudaGhostExchange_sn2147483648ELb0EEENS3_IdLi18ELi2ELi12ELS4_0ELb1ELS5_n2147483648ELb0EEEEEEE	GPU-offline,vol=655360stride=360448precision=8geometry=4Nc=3,vol=655360stride=360448precision=4geometry=4Nc=3,ghost	128	1	2	256	1	4	3201	-1	-1	-1	-1	0.000261173	# 0.00 Gflop/s, 70.80 GB/s, tuning took 1.083386 seconds at Wed Nov 29 21:04:57 2023
     10x32x32x64	N4quda9CopyGaugeINS_12CopyGaugeArgIsdLi18ELb0ENS_5gauge11FloatNOrderIsLi18ELi4ELi12EL20QudaStaggeredPhase_s0ELb1EL19QudaGhostExchange_sn2147483648ELb0EEENS3_IdLi18ELi2ELi12ELS4_0ELb1ELS5_n2147483648ELb0EEEEEEE	GPU-offline,vol=655360stride=360448precision=8geometry=4Nc=3,vol=655360stride=360448precision=2geometry=4Nc=3	64	1	2	5120	1	4	2001	-1	-1	-1	-1	0.00139701	# 0.00 Gflop/s, 247.69 GB/s, tuning took 3.462527 seconds at Wed Nov 29 21:04:52 2023
     10x32x32x64	N4quda9CopyGaugeINS_12CopyGaugeArgIsdLi18ELb0ENS_5gauge11FloatNOrderIsLi18ELi4ELi12EL20QudaStaggeredPhase_s0ELb1EL19QudaGhostExchange_sn2147483648ELb0EEENS3_IdLi18ELi2ELi12ELS4_0ELb1ELS5_n2147483648ELb0EEEEEEE	GPU-offline,vol=655360stride=360448precision=8geometry=4Nc=3,vol=655360stride=360448precision=2geometry=4Nc=3,ghost	64	1	1	512	1	8	1281	-1	-1	-1	-1	0.000169863	# 0.00 Gflop/s, 90.72 GB/s, tuning took 1.302883 seconds at Wed Nov 29 21:04:53 2023
     16x32x16x32	N4quda10GaugeGaussIdLi3EL21QudaReconstructType_s12EEE	GPU-offline,vol=262144stride=139264precision=8geometry=4Nc=3,lie_group	128	2	1	1024	1	1	3201	-1	-1	-1	-1	0.00175345	# 0.00 Gflop/s, 61.00 GB/s, tuning took 3.027920 seconds at Wed Dec  6 21:39:47 2023
     16x32x16x32	N4quda12ExtractGhostIdLi3ENS_5gauge11FloatNOrderIdLi18ELi2ELi12EL20QudaStaggeredPhase_s0ELb1EL19QudaGhostExchange_sn2147483648ELb0EEEEE	GPU-offline,vol=262144stride=139264precision=8geometry=4Nc=3,extract	64	1	3	256	1	3	4001	-1	-1	-1	-1	0.000186356	# 0.00 Gflop/s, 50.64 GB/s, tuning took 1.157861 seconds at Wed Dec  6 21:39:37 2023
     16x32x16x32	N4quda7RNGInitE	GPU-offline,vol=262144stride=139264precision=8geometry=4Nc=3	256	1	1	512	2	1	0	-1	-1	-1	-1	0.000336053	# 0.00 Gflop/s, 0.00 GB/s, tuning took 0.144264 seconds at Wed Dec  6 21:39:44 2023
     16x32x16x32	N4quda9CopyGaugeINS_12CopyGaugeArgIddLi18ELb0ENS_5gauge11FloatNOrderIdLi18ELi2ELi12EL20QudaStaggeredPhase_s0ELb1EL19QudaGhostExchange_sn2147483648ELb0EEENS2_8QDPOrderIdLi18EEEEEEE	GPU-offline,vol=262144stride=131072precision=8geometry=4Nc=3,vol=262144stride=139264precision=8geometry=4Nc=3	128	1	1	1024	1	8	2134	-1	-1	-1	-1	0.00112427	# 0.00 Gflop/s, 229.44 GB/s, tuning took 2.542219 seconds at Wed Dec  6 21:39:36 2023
     16x32x16x32	N4quda9CopyGaugeINS_12CopyGaugeArgIddLi18ELb0ENS_5gauge11FloatNOrderIdLi18ELi2ELi12EL20QudaStaggeredPhase_s0ELb1EL19QudaGhostExchange_sn2147483648ELb0EEES6_EEEE	GPU-offline,vol=262144stride=139264precision=8geometry=4Nc=3,vol=262144stride=139264precision=8geometry=4Nc=3,ghost	128	1	2	64	1	4	0	-1	-1	-1	-1	0.000162088	# 0.00 Gflop/s, 61.86 GB/s, tuning took 1.073091 seconds at Wed Dec  6 21:39:39 2023
     16x32x16x32	N4quda9CopyGaugeINS_12CopyGaugeArgIddLi18ELb0ENS_5gauge8QDPOrderIdLi18EEENS2_11FloatNOrderIdLi18ELi2ELi12EL20QudaStaggeredPhase_s0ELb1EL19QudaGhostExchange_sn2147483648ELb0EEEEEEE	GPU-offline,vol=262144stride=139264precision=8geometry=4Nc=3,vol=262144stride=131072precision=8geometry=4Nc=3	256	1	1	512	1	8	0	-1	-1	-1	-1	0.00144635	# 0.00 Gflop/s, 178.35 GB/s, tuning took 2.744363 seconds at Wed Dec  6 21:39:50 2023
     16x32x16x32	N4quda9CopyGaugeINS_12CopyGaugeArgIfdLi18ELb0ENS_5gauge11FloatNOrderIfLi18ELi4ELi12EL20QudaStaggeredPhase_s0ELb1EL19QudaGhostExchange_sn2147483648ELb0EEENS3_IdLi18ELi2ELi12ELS4_0ELb1ELS5_n2147483648ELb0EEEEEEE	GPU-offline,vol=262144stride=139264precision=8geometry=4Nc=3,vol=262144stride=139264precision=4geometry=4Nc=3	192	1	1	683	1	8	4572	-1	-1	-1	-1	0.000926079	# 0.00 Gflop/s, 173.24 GB/s, tuning took 1.652783 seconds at Wed Dec  6 21:39:43 2023
     16x32x16x32	N4quda9CopyGaugeINS_12CopyGaugeArgIfdLi18ELb0ENS_5gauge11FloatNOrderIfLi18ELi4ELi12EL20QudaStaggeredPhase_s0ELb1EL19QudaGhostExchange_sn2147483648ELb0EEENS3_IdLi18ELi2ELi12ELS4_0ELb1ELS5_n2147483648ELb0EEEEEEE	GPU-offline,vol=262144stride=139264precision=8geometry=4Nc=3,vol=262144stride=139264precision=4geometry=4Nc=3,ghost	64	1	3	128	1	3	2910	-1	-1	-1	-1	0.000160866	# 0.00 Gflop/s, 46.75 GB/s, tuning took 0.908483 seconds at Wed Dec  6 21:39:44 2023
     16x32x16x32	N4quda9CopyGaugeINS_12CopyGaugeArgIsdLi18ELb0ENS_5gauge11FloatNOrderIsLi18ELi4ELi12EL20QudaStaggeredPhase_s0ELb1EL19QudaGhostExchange_sn2147483648ELb0EEENS3_IdLi18ELi2ELi12ELS4_0ELb1ELS5_n2147483648ELb0EEEEEEE	GPU-offline,vol=262144stride=139264precision=8geometry=4Nc=3,vol=262144stride=139264precision=2geometry=4Nc=3	192	1	1	683	1	8	2667	-1	-1	-1	-1	0.000990026	# 0.00 Gflop/s, 135.04 GB/s, tuning took 2.168745 seconds at Wed Dec  6 21:39:41 2023
     16x32x16x32	N4quda9CopyGaugeINS_12CopyGaugeArgIsdLi18ELb0ENS_5gauge11FloatNOrderIsLi18ELi4ELi12EL20QudaStaggeredPhase_s0ELb1EL19QudaGhostExchange_sn2147483648ELb0EEENS3_IdLi18ELi2ELi12ELS4_0ELb1ELS5_n2147483648ELb0EEEEEEE	GPU-offline,vol=262144stride=139264precision=8geometry=4Nc=3,vol=262144stride=139264precision=2geometry=4Nc=3,ghost	64	1	1	128	1	8	4001	-1	-1	-1	-1	0.000203113	# 0.00 Gflop/s, 30.85 GB/s, tuning took 0.965439 seconds at Wed Dec  6 21:39:42 2023
     16x32x32x32	N4quda10GaugeGaussIdLi3EL21QudaReconstructType_s12EEE	GPU-offline,vol=524288stride=278528precision=8geometry=4Nc=3,lie_group	128	1	1	2048	2	1	2462	-1	-1	-1	-1	0.00449973	# 0.00 Gflop/s, 47.54 GB/s, tuning took 3.681832 seconds at Thu Nov 30 01:03:15 2023
     16x32x32x32	N4quda12ExtractGhostIdLi3ENS_5gauge11FloatNOrderIdLi18ELi2ELi12EL20QudaStaggeredPhase_s0ELb1EL19QudaGhostExchange_sn2147483648ELb0EEEEE	GPU-offline,vol=524288stride=278528precision=8geometry=4Nc=3,extract	128	1	1	256	1	8	2001	-1	-1	-1	-1	0.000247405	# 0.00 Gflop/s, 63.57 GB/s, tuning took 1.281426 seconds at Thu Nov 30 01:03:02 2023
     16x32x32x32	N4quda7RNGInitE	GPU-offline,vol=524288stride=278528precision=8geometry=4Nc=3	64	1	1	4096	2	1	0	-1	-1	-1	-1	0.00102048	# 0.00 Gflop/s, 0.00 GB/s, tuning took 0.156552 seconds at Thu Nov 30 01:03:11 2023
     16x32x32x32	N4quda9CopyGaugeINS_12CopyGaugeArgIddLi18ELb0ENS_5gauge11FloatNOrderIdLi18ELi2ELi12EL20QudaStaggeredPhase_s0ELb1EL19QudaGhostExchange_sn2147483648ELb0EEENS2_8QDPOrderIdLi18EEEEEEE	GPU-offline,vol=524288stride=262144precision=8geometry=4Nc=3,vol=524288stride=278528precision=8geometry=4Nc=3	64	1	1	4096	1	8	1334	-1	-1	-1	-1	0.00168533	# 0.00 Gflop/s, 306.11 GB/s, tuning took 3.361398 seconds at Thu Nov 30 01:03:01 2023
     16x32x32x32	N4quda9CopyGaugeINS_12CopyGaugeArgIddLi18ELb0ENS_5gauge11FloatNOrderIdLi18ELi2ELi12EL20QudaStaggeredPhase_s0ELb1EL19QudaGhostExchange_sn2147483648ELb0EEES6_EEEE	GPU-offline,vol=524288stride=278528precision=8geometry=4Nc=3,vol=524288stride=278528precision=8geometry=4Nc=3,ghost	64	1	2	256	1	4	2667	-1	-1	-1	-1	0.00012992	# 0.00 Gflop/s, 128.63 GB/s, tuning took 0.996291 seconds at Thu Nov 30 01:03:03 2023
     16x32x32x32	N4quda9CopyGaugeINS_12CopyGaugeArgIddLi18ELb0ENS_5gauge8QDPOrderIdLi18EEENS2_11FloatNOrderIdLi18ELi2ELi12EL20QudaStaggeredPhase_s0ELb1EL19QudaGhostExchange_sn2147483648ELb0EEEEEEE	GPU-offline,vol=524288stride=278528precision=8geometry=4Nc=3,vol=524288stride=262144precision=8geometry=4Nc=3	128	1	1	2048	1	8	4572	-1	-1	-1	-1	0.00268976	# 0.00 Gflop/s, 191.80 GB/s, tuning took 3.933428 seconds at Thu Nov 30 01:03:19 2023
     16x32x32x32	N4quda9CopyGaugeINS_12CopyGaugeArgIfdLi18ELb0ENS_5gauge11FloatNOrderIfLi18ELi4ELi12EL20QudaStaggeredPhase_s0ELb1EL19QudaGhostExchange_sn2147483648ELb0EEENS3_IdLi18ELi2ELi12ELS4_0ELb1ELS5_n2147483648ELb0EEEEEEE	GPU-offline,vol=524288stride=278528precision=8geometry=4Nc=3,vol=524288stride=278528precision=4geometry=4Nc=3	192	1	1	1366	1	8	8001	-1	-1	-1	-1	0.00138469	# 0.00 Gflop/s, 231.72 GB/s, tuning took 2.836491 seconds at Thu Nov 30 01:03:10 2023
     16x32x32x32	N4quda9CopyGaugeINS_12CopyGaugeArgIfdLi18ELb0ENS_5gauge11FloatNOrderIfLi18ELi4ELi12EL20QudaStaggeredPhase_s0ELb1EL19QudaGhostExchange_sn2147483648ELb0EEENS3_IdLi18ELi2ELi12ELS4_0ELb1ELS5_n2147483648ELb0EEEEEEE	GPU-offline,vol=524288stride=278528precision=8geometry=4Nc=3,vol=524288stride=278528precision=4geometry=4Nc=3,ghost	64	1	1	256	1	8	1883	-1	-1	-1	-1	0.00022368	# 0.00 Gflop/s, 56.03 GB/s, tuning took 1.123348 seconds at Thu Nov 30 01:03:11 2023
     16x32x32x32	N4quda9CopyGaugeINS_12CopyGaugeArgIsdLi18ELb0ENS_5gauge11FloatNOrderIsLi18ELi4ELi12EL20QudaStaggeredPhase_s0ELb1EL19QudaGhostExchange_sn2147483648ELb0EEENS3_IdLi18ELi2ELi12ELS4_0ELb1ELS5_n2147483648ELb0EEEEEEE	GPU-offline,vol=524288stride=278528precision=8geometry=4Nc=3,vol=524288stride=278528precision=2geometry=4Nc=3	64	1	4	4096	1	2	0	-1	-1	-1	-1	0.000669226	# 0.00 Gflop/s, 399.55 GB/s, tuning took 3.130215 seconds at Thu Nov 30 01:03:06 2023
     16x32x32x32	N4quda9CopyGaugeINS_12CopyGaugeArgIsdLi18ELb0ENS_5gauge11FloatNOrderIsLi18ELi4ELi12EL20QudaStaggeredPhase_s0ELb1EL19QudaGhostExchange_sn2147483648ELb0EEENS3_IdLi18ELi2ELi12ELS4_0ELb1ELS5_n2147483648ELb0EEEEEEE	GPU-offline,vol=524288stride=278528precision=8geometry=4Nc=3,vol=524288stride=278528precision=2geometry=4Nc=3,ghost	256	1	1	64	1	8	8001	-1	-1	-1	-1	0.000265051	# 0.00 Gflop/s, 39.41 GB/s, tuning took 1.197123 seconds at Thu Nov 30 01:03:07 2023
     16x32x32x64	N4quda10GaugeGaussIdLi3EL21QudaReconstructType_s12EEE	GPU-offline,vol=1048576stride=557056precision=8geometry=4Nc=3,lie_group	128	1	1	4096	2	1	3556	-1	-1	-1	-1	0.00996772	# 0.00 Gflop/s, 42.92 GB/s, tuning took 4.939812 seconds at Wed Nov 29 20:59:17 2023
     16x32x32x64	N4quda12ExtractGhostIdLi3ENS_5gauge11FloatNOrderIdLi18ELi2ELi12EL20QudaStaggeredPhase_s0ELb1EL19QudaGhostExchange_sn2147483648ELb0EEEEE	GPU-offline,vol=1048576stride=557056precision=8geometry=4Nc=3,extract	64	1	4	1024	1	2	0	-1	-1	-1	-1	0.000659679	# 0.00 Gflop/s, 42.92 GB/s, tuning took 1.521599 seconds at Wed Nov 29 20:59:00 2023
     16x32x32x64	N4quda15CopyColorSpinorILi4ELi3ENS_11colorspinor11FloatNOrderIdLi4ELi3ELi2ELb0ELb0EEENS1_21SpaceSpinorColorOrderIdLi4ELi3EEESt5tupleIJRNS_16ColorSpinorFieldERKS7_19QudaFieldLocation_sPdPKdEEEE	GPU-offline,vol=1048576,parity=1,precision=8,order=9,Ns=4,Nc=3vol=1048576,parity=1,precision=8,order=2,Ns=4,Nc=3,NonRelBasis	64	1	1	16384	1	1	0	-1	-1	-1	-1	0.00181493	# 0.00 Gflop/s, 221.86 GB/s, tuning took 0.233813 seconds at Wed Nov 29 20:51:35 2023
     16x32x32x64	N4quda15CopyColorSpinorILi4ELi3ENS_11colorspinor21SpaceSpinorColorOrderIdLi4ELi3EEENS1_11FloatNOrderIdLi4ELi3ELi2ELb0ELb0EEESt5tupleIJRNS_16ColorSpinorFieldERKS7_19QudaFieldLocation_sPdPKdEEEE	GPU-offline,vol=1048576,parity=1,precision=8,order=2,Ns=4,Nc=3vol=1048576,parity=1,precision=8,order=9,Ns=4,Nc=3,RelBasis	64	1	1	16384	1	1	0	-1	-1	-1	-1	0.00181669	# 0.00 Gflop/s, 221.64 GB/s, tuning took 0.239925 seconds at Wed Nov 29 20:51:49 2023
     16x32x32x64	N4quda6WilsonINS_9WilsonArgIdLi3ELi4EL21QudaReconstructType_s12EEEEE	policy,GPU-offline,vol=1048576,parity=1,precision=8,order=2,Ns=4,Nc=3,commDim=0000,topo=1111,p2p=0,gdr=0,nvshmem=0,pol=110000111100110000	64	1	1	1	1	1	0	7	0	0	-1	0.00411268	# 336.55 Gflop/s, 587.43 GB/s, tuning took 0.761616 seconds at Wed Nov 29 20:51:49 2023
     16x32x32x64	N4quda6WilsonINS_9WilsonArgIdLi3ELi4EL21QudaReconstructType_s12EEEEE	policy_kernel=interior,GPU-offline,vol=1048576,parity=1,precision=8,order=2,Ns=4,Nc=3,commDim=0000,comm=0000	32	1	1	32768	1	1	8001	-1	-1	-1	-1	0.00418677	# 330.59 Gflop/s, 577.04 GB/s, tuning took 12.862474 seconds at Wed Nov 29 20:51:48 2023
     16x32x32x64	N4quda7RNGInitE	GPU-offline,vol=1048576stride=557056precision=8geometry=4Nc=3	128	1	1	4096	2	1	0	-1	-1	-1	-1	0.00197499	# 0.00 Gflop/s, 0.00 GB/s, tuning took 0.294530 seconds at Wed Nov 29 20:59:12 2023
     16x32x32x64	N4quda9CopyGaugeINS_12CopyGaugeArgIddLi18ELb0ENS_5gauge11FloatNOrderIdLi18ELi2ELi12EL20QudaStaggeredPhase_s0ELb1EL19QudaGhostExchange_sn2147483648ELb0EEENS2_8QDPOrderIdLi18EEEEEEE	GPU-offline,vol=1048576stride=524288precision=8geometry=4Nc=3,vol=1048576stride=557056precision=8geometry=4Nc=3	64	1	1	8192	1	8	1334	-1	-1	-1	-1	0.00283989	# 0.00 Gflop/s, 363.32 GB/s, tuning took 4.515704 seconds at Wed Nov 29 20:58:58 2023
     16x32x32x64	N4quda9CopyGaugeINS_12CopyGaugeArgIddLi18ELb0ENS_5gauge11FloatNOrderIdLi18ELi2ELi12EL20QudaStaggeredPhase_s0ELb1EL19QudaGhostExchange_sn2147483648ELb0EEES6_EEEE	GPU-offline,vol=1048576stride=557056precision=8geometry=4Nc=3,vol=1048576stride=557056precision=8geometry=4Nc=3,ghost	64	1	1	512	1	8	1601	-1	-1	-1	-1	0.000301847	# 0.00 Gflop/s, 99.66 GB/s, tuning took 1.261477 seconds at Wed Nov 29 20:59:01 2023
     16x32x32x64	N4quda9CopyGaugeINS_12CopyGaugeArgIddLi18ELb0ENS_5gauge8QDPOrderIdLi18EEENS2_11FloatNOrderIdLi18ELi2ELi12EL20QudaStaggeredPhase_s0ELb1EL19QudaGhostExchange_sn2147483648ELb0EEEEEEE	GPU-offline,vol=1048576stride=557056precision=8geometry=4Nc=3,vol=1048576stride=524288precision=8geometry=4Nc=3	128	1	2	4096	1	4	4572	-1	-1	-1	-1	0.00862826	# 0.00 Gflop/s, 119.58 GB/s, tuning took 4.919709 seconds at Wed Nov 29 20:59:22 2023
     16x32x32x64	N4quda9CopyGaugeINS_12CopyGaugeArgIfdLi18ELb0ENS_5gauge11FloatNOrderIfLi18ELi4ELi12EL20QudaStaggeredPhase_s0ELb1EL19QudaGhostExchange_sn2147483648ELb0EEENS3_IdLi18ELi2ELi12ELS4_0ELb1ELS5_n2147483648ELb0EEEEEEE	GPU-offline,vol=1048576stride=557056precision=8geometry=4Nc=3,vol=1048576stride=557056precision=4geometry=4Nc=3	64	1	2	8192	1	4	0	-1	-1	-1	-1	0.0017752	# 0.00 Gflop/s, 361.50 GB/s, tuning took 3.987110 seconds at Wed Nov 29 20:59:10 2023
     16x32x32x64	N4quda9CopyGaugeINS_12CopyGaugeArgIfdLi18ELb0ENS_5gauge11FloatNOrderIfLi18ELi4ELi12EL20QudaStaggeredPhase_s0ELb1EL19QudaGhostExchange_sn2147483648ELb0EEENS3_IdLi18ELi2ELi12ELS4_0ELb1ELS5_n2147483648ELb0EEEEEEE	GPU-offline,vol=1048576stride=557056precision=8geometry=4Nc=3,vol=1048576stride=557056precision=4geometry=4Nc=3,ghost	128	1	2	256	1	4	5334	-1	-1	-1	-1	0.000166416	# 0.00 Gflop/s, 135.57 GB/s, tuning took 1.256988 seconds at Wed Nov 29 20:59:11 2023
     16x32x32x64	N4quda9CopyGaugeINS_12CopyGaugeArgIsdLi18ELb0ENS_5gauge11FloatNOrderIsLi18ELi4ELi12EL20QudaStaggeredPhase_s0ELb1EL19QudaGhostExchange_sn2147483648ELb0EEENS3_IdLi18ELi2ELi12ELS4_0ELb1ELS5_n2147483648ELb0EEEEEEE	GPU-offline,vol=1048576stride=557056precision=8geometry=4Nc=3,vol=1048576stride=557056precision=2geometry=4Nc=3	64	1	2	8192	1	4	1685	-1	-1	-1	-1	0.00219668	# 0.00 Gflop/s, 243.45 GB/s, tuning took 3.850638 seconds at Wed Nov 29 20:59:05 2023
     16x32x32x64	N4quda9CopyGaugeINS_12CopyGaugeArgIsdLi18ELb0ENS_5gauge11FloatNOrderIsLi18ELi4ELi12EL20QudaStaggeredPhase_s0ELb1EL19QudaGhostExchange_sn2147483648ELb0EEENS3_IdLi18ELi2ELi12ELS4_0ELb1ELS5_n2147483648ELb0EEEEEEE	GPU-offline,vol=1048576stride=557056precision=8geometry=4Nc=3,vol=1048576stride=557056precision=2geometry=4Nc=3,ghost	64	1	1	512	1	8	1524	-1	-1	-1	-1	0.000188928	# 0.00 Gflop/s, 99.51 GB/s, tuning took 1.298801 seconds at Wed Nov 29 20:59:06 2023
     32x32x32x64	N4quda10GaugeGaussIdLi3EL21QudaReconstructType_s12EEE	GPU-offline,vol=2097152stride=1081344precision=8geometry=4Nc=3,lie_group	64	1	1	16384	2	1	1601	-1	-1	-1	-1	0.0102442	# 0.00 Gflop/s, 81.07 GB/s, tuning took 6.565479 seconds at Wed Nov 29 20:51:29 2023
     32x32x32x64	N4quda12ExtractGhostIdLi3ENS_5gauge11FloatNOrderIdLi18ELi2ELi12EL20QudaStaggeredPhase_s0ELb1EL19QudaGhostExchange_sn2147483648ELb0EEEEE	GPU-offline,vol=2097152stride=1081344precision=8geometry=4Nc=3,extract	128	1	2	512	1	4	5334	-1	-1	-1	-1	0.000581066	# 0.00 Gflop/s, 75.79 GB/s, tuning took 2.052728 seconds at Wed Nov 29 20:51:09 2023
     32x32x32x64	N4quda7RNGInitE	GPU-offline,vol=2097152stride=1081344precision=8geometry=4Nc=3	256	1	1	4096	2	1	0	-1	-1	-1	-1	0.00209792	# 0.00 Gflop/s, 0.00 GB/s, tuning took 0.402369 seconds at Wed Nov 29 20:51:23 2023
     32x32x32x64	N4quda9CopyGaugeINS_12CopyGaugeArgIddLi18ELb0ENS_5gauge11FloatNOrderIdLi18ELi2ELi12EL20QudaStaggeredPhase_s0ELb1EL19QudaGhostExchange_sn2147483648ELb0EEENS2_8QDPOrderIdLi18EEEEEEE	GPU-offline,vol=2097152stride=1048576precision=8geometry=4Nc=3,vol=2097152stride=1081344precision=8geometry=4Nc=3	192	1	1	5462	1	8	8001	-1	-1	-1	-1	0.00432336	# 0.00 Gflop/s, 471.49 GB/s, tuning took 5.137836 seconds at Wed Nov 29 20:51:07 2023
     32x32x32x64	N4quda9CopyGaugeINS_12CopyGaugeArgIddLi18ELb0ENS_5gauge11FloatNOrderIdLi18ELi2ELi12EL20QudaStaggeredPhase_s0ELb1EL19QudaGhostExchange_sn2147483648ELb0EEES6_EEEE	GPU-offline,vol=2097152stride=1081344precision=8geometry=4Nc=3,vol=2097152stride=1081344precision=8geometry=4Nc=3,ghost	256	1	1	128	1	8	3556	-1	-1	-1	-1	0.00036456	# 0.00 Gflop/s, 124.58 GB/s, tuning took 1.271398 seconds at Wed Nov 29 20:51:10 2023
     32x32x32x64	N4quda9CopyGaugeINS_12CopyGaugeArgIddLi18ELb0ENS_5gauge8QDPOrderIdLi18EEENS2_11FloatNOrderIdLi18ELi2ELi12EL20QudaStaggeredPhase_s0ELb1EL19QudaGhostExchange_sn2147483648ELb0EEEEEEE	GPU-offline,vol=2097152stride=1081344precision=8geometry=4Nc=3,vol=2097152stride=1048576precision=8geometry=4Nc=3	64	1	2	16384	1	4	6401	-1	-1	-1	-1	0.00590922	# 0.00 Gflop/s, 344.96 GB/s, tuning took 5.687118 seconds at Wed Nov 29 20:51:35 2023
     32x32x32x64	N4quda9CopyGaugeINS_12CopyGaugeArgIfdLi18ELb0ENS_5gauge11FloatNOrderIfLi18ELi4ELi12EL20QudaStaggeredPhase_s0ELb1EL19QudaGhostExchange_sn2147483648ELb0EEENS3_IdLi18ELi2ELi12ELS4_0ELb1ELS5_n2147483648ELb0EEEEEEE	GPU-offline,vol=2097152stride=1081344precision=8geometry=4Nc=3,vol=2097152stride=1081344precision=4geometry=4Nc=3	192	1	1	5462	1	8	3201	-1	-1	-1	-1	0.0033337	# 0.00 Gflop/s, 373.67 GB/s, tuning took 4.472965 seconds at Wed Nov 29 20:51:21 2023
     32x32x32x64	N4quda9CopyGaugeINS_12CopyGaugeArgIfdLi18ELb0ENS_5gauge11FloatNOrderIfLi18ELi4ELi12EL20QudaStaggeredPhase_s0ELb1EL19QudaGhostExchange_sn2147483648ELb0EEENS3_IdLi18ELi2ELi12ELS4_0ELb1ELS5_n2147483648ELb0EEEEEEE	GPU-offline,vol=2097152stride=1081344precision=8geometry=4Nc=3,vol=2097152stride=1081344precision=4geometry=4Nc=3,ghost	64	1	3	512	1	3	3556	-1	-1	-1	-1	0.000188284	# 0.00 Gflop/s, 180.91 GB/s, tuning took 1.324955 seconds at Wed Nov 29 20:51:22 2023
     32x32x32x64	N4quda9CopyGaugeINS_12CopyGaugeArgIsdLi18ELb0ENS_5gauge11FloatNOrderIsLi18ELi4ELi12EL20QudaStaggeredPhase_s0ELb1EL19QudaGhostExchange_sn2147483648ELb0EEENS3_IdLi18ELi2ELi12ELS4_0ELb1ELS5_n2147483648ELb0EEEEEEE	GPU-offline,vol=2097152stride=1081344precision=8geometry=4Nc=3,vol=2097152stride=1081344precision=2geometry=4Nc=3	64	1	1	16384	1	8	6401	-1	-1	-1	-1	0.00279816	# 0.00 Gflop/s, 370.99 GB/s, tuning took 4.349134 seconds at Wed Nov 29 20:51:15 2023
     32x32x32x64	N4quda9CopyGaugeINS_12CopyGaugeArgIsdLi18ELb0ENS_5gauge11FloatNOrderIsLi18ELi4ELi12EL20QudaStaggeredPhase_s0ELb1EL19QudaGhostExchange_sn2147483648ELb0EEENS3_IdLi18ELi2ELi12ELS4_0ELb1ELS5_n2147483648ELb0EEEEEEE	GPU-offline,vol=2097152stride=1081344precision=8geometry=4Nc=3,vol=2097152stride=1081344precision=2geometry=4Nc=3,ghost	64	1	3	512	1	3	3201	-1	-1	-1	-1	0.000532625	# 0.00 Gflop/s, 53.29 GB/s, tuning took 1.462816 seconds at Wed Nov 29 20:51:16 2023
      4x32x32x64	N4quda15CopyColorSpinorILi4ELi3ENS_11colorspinor11FloatNOrderIdLi4ELi3ELi2ELb0ELb0EEENS1_21SpaceSpinorColorOrderIdLi4ELi3EEESt5tupleIJRNS_16ColorSpinorFieldERKS7_19QudaFieldLocation_sPdPKdEEEE	GPU-offline,vol=262144,parity=1,precision=8,order=9,Ns=4,Nc=3vol=262144,parity=1,precision=8,order=2,Ns=4,Nc=3,NonRelBasis	64	1	1	4096	1	1	0	-1	-1	-1	-1	0.000328266	# 0.00 Gflop/s, 306.65 GB/s, tuning took 0.026379 seconds at Wed Nov 15 23:04:25 2023
      4x32x32x64	N4quda15CopyColorSpinorILi4ELi3ENS_11colorspinor21SpaceSpinorColorOrderIdLi4ELi3EEENS1_11FloatNOrderIdLi4ELi3ELi2ELb0ELb0EEESt5tupleIJRNS_16ColorSpinorFieldERKS7_19QudaFieldLocation_sPdPKdEEEE	GPU-offline,vol=262144,parity=1,precision=8,order=2,Ns=4,Nc=3vol=262144,parity=1,precision=8,order=9,Ns=4,Nc=3,RelBasis	192	1	1	1366	1	1	0	-1	-1	-1	-1	0.000314999	# 0.00 Gflop/s, 319.57 GB/s, tuning took 0.013373 seconds at Wed Nov 22 22:39:34 2023
      4x32x32x64	N4quda4PackIdLi3ELb1EEE	policy_kernel,vol=262144,parity=1,precision=8,order=2,Ns=4,Nc=3,comm=1000,topo=4111,nFace=1,device-device	192	1	1	103	1	1	0	-1	-1	-1	-1	0.000111984	# 7.02 Gflop/s, 168.55 GB/s, tuning took 1.541592 seconds at Wed Nov 15 23:04:27 2023
      4x32x32x64	N4quda4PackIdLi3ELb1EEE	policy_kernel,vol=262144,parity=1,precision=8,order=2,Ns=4,Nc=3,comm=1000,topo=4111,nFace=1,device-remote	192	1	1	47	1	1	0	-1	-1	-1	-1	0.00031472	# 2.50 Gflop/s, 59.97 GB/s, tuning took 0.860534 seconds at Wed Nov 22 22:39:17 2023
      4x32x32x64	N4quda4PackIdLi3ELb1EEE	policy_kernel,vol=262144,parity=1,precision=8,order=2,Ns=4,Nc=3,comm=1000,topo=4111,nFace=1,host-device	256	1	1	3	1	1	0	-1	-1	-1	-1	0.000790026	# 1.00 Gflop/s, 23.89 GB/s, tuning took 0.167269 seconds at Wed Nov 22 22:38:59 2023
      4x32x32x64	N4quda4PackIdLi3ELb1EEE	policy_kernel,vol=262144,parity=1,precision=8,order=2,Ns=4,Nc=3,comm=1000,topo=4111,nFace=1,host-host	256	1	1	3	1	1	0	-1	-1	-1	-1	0.00134299	# 0.59 Gflop/s, 14.05 GB/s, tuning took 0.196818 seconds at Wed Nov 15 23:04:42 2023
      4x32x32x64	N4quda4PackIdLi3ELb1EEE	policy_kernel,vol=262144,parity=1,precision=8,order=2,Ns=4,Nc=3,comm=1000,topo=4111,nFace=1,host-remote	256	1	1	3	1	1	0	-1	-1	-1	-1	0.000532212	# 1.48 Gflop/s, 35.46 GB/s, tuning took 0.147990 seconds at Wed Nov 22 22:39:17 2023
      4x32x32x64	N4quda6WilsonINS_9WilsonArgIdLi3ELi4EL21QudaReconstructType_s12EEEEE	policy,GPU-offline,vol=262144,parity=1,precision=8,order=2,Ns=4,Nc=3,commDim=1000,topo=4111,p2p=3,gdr=0,nvshmem=0,pol=110000111100110000	64	1	1	1	1	1	0	9	2	0	-1	0.00220149	# 157.18 Gflop/s, 274.35 GB/s, tuning took 0.673789 seconds at Wed Nov 22 22:39:34 2023
      4x32x32x64	N4quda6WilsonINS_9WilsonArgIdLi3ELi4EL21QudaReconstructType_s12EEEEE	policy_kernel=exterior_all,GPU-offline,vol=262144,parity=1,precision=8,order=2,Ns=4,Nc=3,commDim=1000	256	1	1	256	1	1	6401	-1	-1	-1	-1	0.000389039	# 30.32 Gflop/s, 97.03 GB/s, tuning took 1.019280 seconds at Wed Nov 15 23:04:41 2023
      4x32x32x64	N4quda6WilsonINS_9WilsonArgIdLi3ELi4EL21QudaReconstructType_s12EEEEE	policy_kernel=exterior_all,GPU-offline,vol=262144,parity=1,precision=8,order=2,Ns=4,Nc=3,commDim=1000,zero_copy,p2p=0	144	1	1	456	1	1	4572	-1	-1	-1	-1	0.000389866	# 30.26 Gflop/s, 96.82 GB/s, tuning took 1.109295 seconds at Wed Nov 15 23:04:44 2023
      4x32x32x64	N4quda6WilsonINS_9WilsonArgIdLi3ELi4EL21QudaReconstructType_s12EEEEE	policy_kernel=exterior_all,GPU-offline,vol=262144,parity=1,precision=8,order=2,Ns=4,Nc=3,commDim=1000,zero_copy,p2p=1	112	1	1	586	1	1	2001	-1	-1	-1	-1	0.000459359	# 25.68 Gflop/s, 82.18 GB/s, tuning took 0.589996 seconds at Wed Nov 22 22:39:01 2023
      4x32x32x64	N4quda6WilsonINS_9WilsonArgIdLi3ELi4EL21QudaReconstructType_s12EEEEE	policy_kernel=exterior_x,GPU-offline,vol=262144,parity=1,precision=8,order=2,Ns=4,Nc=3,commDim=1000	64	1	1	1024	1	1	1001	-1	-1	-1	-1	0.000709119	# 16.64 Gflop/s, 53.23 GB/s, tuning took 0.991262 seconds at Wed Nov 15 23:04:40 2023
      4x32x32x64	N4quda6WilsonINS_9WilsonArgIdLi3ELi4EL21QudaReconstructType_s12EEEEE	policy_kernel=exterior_x,GPU-offline,vol=262144,parity=1,precision=8,order=2,Ns=4,Nc=3,commDim=1000,zero_copy,p2p=0	16	1	1	4096	1	1	1186	-1	-1	-1	-1	0.0003358	# 35.13 Gflop/s, 112.41 GB/s, tuning took 1.039227 seconds at Wed Nov 15 23:04:43 2023
      4x32x32x64	N4quda6WilsonINS_9WilsonArgIdLi3ELi4EL21QudaReconstructType_s12EEEEE	policy_kernel=exterior_x,GPU-offline,vol=262144,parity=1,precision=8,order=2,Ns=4,Nc=3,commDim=1000,zero_copy,p2p=1	64	1	1	1024	1	1	1231	-1	-1	-1	-1	0.000310239	# 38.02 Gflop/s, 121.68 GB/s, tuning took 0.592176 seconds at Wed Nov 22 22:39:00 2023
      4x32x32x64	N4quda6WilsonINS_9WilsonArgIdLi3ELi4EL21QudaReconstructType_s12EEEEE	policy_kernel=interior,GPU-offline,vol=262144,parity=1,precision=8,order=2,Ns=4,Nc=3,commDim=1000,comm=1000	48	1	1	5462	1	1	2462	-1	-1	-1	-1	0.001828	# 183.70 Gflop/s, 309.75 GB/s, tuning took 11.932501 seconds at Wed Nov 15 23:04:39 2023
      4x32x32x64	N4quda6WilsonINS_9WilsonArgIdLi3ELi4EL21QudaReconstructType_s12EEEEE	policy_kernel=interior,GPU-offline,vol=262144,parity=1,precision=8,order=2,Ns=4,Nc=3,commDim=1000,comm=1000,host-device	32	1	1	8192	1	1	10667	7	-1	-1	-1	0.000941172	# 357.63 Gflop/s, 621.68 GB/s, tuning took 15.578766 seconds at Wed Nov 22 22:39:16 2023
      4x32x32x64	N4quda6WilsonINS_9WilsonArgIdLi3ELi4EL21QudaReconstructType_s12EEEEE	policy_kernel=interior,GPU-offline,vol=262144,parity=1,precision=8,order=2,Ns=4,Nc=3,commDim=1000,comm=1000,host-host	112	1	1	2341	1	1	1524	4	-1	-1	-1	0.00124464	# 270.43 Gflop/s, 470.10 GB/s, tuning took 88.337470 seconds at Wed Nov 15 23:06:13 2023
      4x32x32x64	N4quda6WilsonINS_9WilsonArgIdLi3ELi4EL21QudaReconstructType_s12EEEEE	policy_kernel=interior,GPU-offline,vol=262144,parity=1,precision=8,order=2,Ns=4,Nc=3,commDim=1000,comm=1000,host-remote	32	1	1	8192	1	1	10667	7	-1	-1	-1	0.00105349	# 319.50 Gflop/s, 555.40 GB/s, tuning took 15.627152 seconds at Wed Nov 22 22:39:33 2023
      5x32x32x64	N4quda15CopyColorSpinorILi4ELi3ENS_11colorspinor11FloatNOrderIdLi4ELi3ELi2ELb0ELb0EEENS1_21SpaceSpinorColorOrderIdLi4ELi3EEESt5tupleIJRNS_16ColorSpinorFieldERKS7_19QudaFieldLocation_sPdPKdEEEE	GPU-offline,vol=327680,parity=1,precision=8,order=9,Ns=4,Nc=3vol=327680,parity=1,precision=8,order=2,Ns=4,Nc=3,NonRelBasis	256	1	1	1280	1	1	0	-1	-1	-1	-1	0.000993386	# 0.00 Gflop/s, 126.67 GB/s, tuning took 0.105375 seconds at Wed Nov 29 21:05:06 2023
      5x32x32x64	N4quda15CopyColorSpinorILi4ELi3ENS_11colorspinor21SpaceSpinorColorOrderIdLi4ELi3EEENS1_11FloatNOrderIdLi4ELi3ELi2ELb0ELb0EEESt5tupleIJRNS_16ColorSpinorFieldERKS7_19QudaFieldLocation_sPdPKdEEEE	GPU-offline,vol=327680,parity=1,precision=8,order=2,Ns=4,Nc=3vol=327680,parity=1,precision=8,order=9,Ns=4,Nc=3,RelBasis	192	1	1	1707	1	1	0	-1	-1	-1	-1	0.000561279	# 0.00 Gflop/s, 224.18 GB/s, tuning took 0.075650 seconds at Wed Nov 29 21:19:17 2023
      5x32x32x64	N4quda4PackIdLi3ELb1EEE	policy_kernel,vol=327680,parity=1,precision=8,order=2,Ns=4,Nc=3,comm=1000,topo=3111,nFace=1,device-device	256	1	1	77	1	1	0	-1	-1	-1	-1	0.000146293	# 5.38 Gflop/s, 129.02 GB/s, tuning took 3.401101 seconds at Wed Nov 29 21:05:10 2023
      5x32x32x64	N4quda4PackIdLi3ELb1EEE	policy_kernel,vol=327680,parity=1,precision=8,order=2,Ns=4,Nc=3,comm=1000,topo=3111,nFace=1,device-remote	128	1	1	65	1	1	0	-1	-1	-1	-1	0.00032568	# 2.41 Gflop/s, 57.95 GB/s, tuning took 3.592642 seconds at Wed Nov 29 21:06:44 2023
      5x32x32x64	N4quda4PackIdLi3ELb1EEE	policy_kernel,vol=327680,parity=1,precision=8,order=2,Ns=4,Nc=3,comm=1000,topo=3111,nFace=1,host-device	256	1	1	2	1	1	0	-1	-1	-1	-1	0.000772693	# 1.02 Gflop/s, 24.43 GB/s, tuning took 0.234382 seconds at Wed Nov 29 21:06:03 2023
      5x32x32x64	N4quda4PackIdLi3ELb1EEE	policy_kernel,vol=327680,parity=1,precision=8,order=2,Ns=4,Nc=3,comm=1000,topo=3111,nFace=1,host-host	256	1	1	3	1	1	0	-1	-1	-1	-1	0.000763199	# 1.03 Gflop/s, 24.73 GB/s, tuning took 0.265611 seconds at Wed Nov 29 21:05:25 2023
      5x32x32x64	N4quda4PackIdLi3ELb1EEE	policy_kernel,vol=327680,parity=1,precision=8,order=2,Ns=4,Nc=3,comm=1000,topo=3111,nFace=1,host-remote	256	1	1	3	1	1	0	-1	-1	-1	-1	0.000510773	# 1.54 Gflop/s, 36.95 GB/s, tuning took 0.232038 seconds at Wed Nov 29 21:18:44 2023
      5x32x32x64	N4quda6WilsonINS_9WilsonArgIdLi3ELi4EL21QudaReconstructType_s12EEEEE	policy,GPU-offline,vol=327680,parity=1,precision=8,order=2,Ns=4,Nc=3,commDim=1000,topo=3111,p2p=3,gdr=0,nvshmem=0,pol=110000111100110000	64	1	1	1	1	1	0	9	1	0	-1	0.00944111	# 45.81 Gflop/s, 79.97 GB/s, tuning took 2.140742 seconds at Wed Nov 29 21:19:17 2023
      5x32x32x64	N4quda6WilsonINS_9WilsonArgIdLi3ELi4EL21QudaReconstructType_s12EEEEE	policy_kernel=exterior_all,GPU-offline,vol=327680,parity=1,precision=8,order=2,Ns=4,Nc=3,commDim=1000	64	1	1	1024	1	1	1778	-1	-1	-1	-1	0.000396586	# 29.75 Gflop/s, 95.18 GB/s, tuning took 3.373932 seconds at Wed Nov 29 21:05:24 2023
      5x32x32x64	N4quda6WilsonINS_9WilsonArgIdLi3ELi4EL21QudaReconstructType_s12EEEEE	policy_kernel=exterior_all,GPU-offline,vol=327680,parity=1,precision=8,order=2,Ns=4,Nc=3,commDim=1000,zero_copy,p2p=0	112	1	1	586	1	1	2462	-1	-1	-1	-1	0.000544053	# 21.68 Gflop/s, 69.38 GB/s, tuning took 3.646161 seconds at Wed Nov 29 21:05:32 2023
      5x32x32x64	N4quda6WilsonINS_9WilsonArgIdLi3ELi4EL21QudaReconstructType_s12EEEEE	policy_kernel=exterior_all,GPU-offline,vol=327680,parity=1,precision=8,order=2,Ns=4,Nc=3,commDim=1000,zero_copy,p2p=1	208	1	1	316	1	1	16001	-1	-1	-1	-1	0.000396213	# 29.77 Gflop/s, 95.27 GB/s, tuning took 3.292348 seconds at Wed Nov 29 21:06:09 2023
      5x32x32x64	N4quda6WilsonINS_9WilsonArgIdLi3ELi4EL21QudaReconstructType_s12EEEEE	policy_kernel=exterior_x,GPU-offline,vol=327680,parity=1,precision=8,order=2,Ns=4,Nc=3,commDim=1000	224	1	1	293	1	1	2910	-1	-1	-1	-1	0.000402453	# 29.31 Gflop/s, 93.80 GB/s, tuning took 3.146185 seconds at Wed Nov 29 21:05:21 2023
      5x32x32x64	N4quda6WilsonINS_9WilsonArgIdLi3ELi4EL21QudaReconstructType_s12EEEEE	policy_kernel=exterior_x,GPU-offline,vol=327680,parity=1,precision=8,order=2,Ns=4,Nc=3,commDim=1000,zero_copy,p2p=0	192	1	1	342	1	1	2910	-1	-1	-1	-1	0.000549013	# 21.49 Gflop/s, 68.76 GB/s, tuning took 3.336222 seconds at Wed Nov 29 21:05:28 2023
      5x32x32x64	N4quda6WilsonINS_9WilsonArgIdLi3ELi4EL21QudaReconstructType_s12EEEEE	policy_kernel=exterior_x,GPU-offline,vol=327680,parity=1,precision=8,order=2,Ns=4,Nc=3,commDim=1000,zero_copy,p2p=1	176	1	1	373	1	1	2462	-1	-1	-1	-1	0.000376853	# 31.30 Gflop/s, 100.17 GB/s, tuning took 3.338246 seconds at Wed Nov 29 21:06:06 2023
      5x32x32x64	N4quda6WilsonINS_9WilsonArgIdLi3ELi4EL21QudaReconstructType_s12EEEEE	policy_kernel=interior,GPU-offline,vol=327680,parity=1,precision=8,order=2,Ns=4,Nc=3,commDim=1000,comm=1000	256	1	1	1280	1	1	3556	-1	-1	-1	-1	0.00181322	# 232.91 Gflop/s, 395.55 GB/s, tuning took 7.924749 seconds at Wed Nov 29 21:05:18 2023
      5x32x32x64	N4quda6WilsonINS_9WilsonArgIdLi3ELi4EL21QudaReconstructType_s12EEEEE	policy_kernel=interior,GPU-offline,vol=327680,parity=1,precision=8,order=2,Ns=4,Nc=3,commDim=1000,comm=1000,host-device	64	1	1	5120	1	1	16001	4	-1	-1	-1	0.00122027	# 346.73 Gflop/s, 603.23 GB/s, tuning took 30.998172 seconds at Wed Nov 29 21:06:40 2023
      5x32x32x64	N4quda6WilsonINS_9WilsonArgIdLi3ELi4EL21QudaReconstructType_s12EEEEE	policy_kernel=interior,GPU-offline,vol=327680,parity=1,precision=8,order=2,Ns=4,Nc=3,commDim=1000,comm=1000,host-host	224	1	1	1463	1	1	2910	3	-1	-1	-1	0.00137771	# 307.11 Gflop/s, 534.29 GB/s, tuning took 30.654940 seconds at Wed Nov 29 21:06:02 2023
      5x32x32x64	N4quda6WilsonINS_9WilsonArgIdLi3ELi4EL21QudaReconstructType_s12EEEEE	policy_kernel=interior,GPU-offline,vol=327680,parity=1,precision=8,order=2,Ns=4,Nc=3,commDim=1000,comm=1000,host-remote	64	1	1	5120	1	1	16001	4	-1	-1	-1	0.00120357	# 351.54 Gflop/s, 611.60 GB/s, tuning took 30.560681 seconds at Wed Nov 29 21:19:15 2023
      8x32x16x32	N4quda15CopyColorSpinorILi4ELi3ENS_11colorspinor11FloatNOrderIdLi4ELi3ELi2ELb0ELb0EEENS1_21SpaceSpinorColorOrderIdLi4ELi3EEESt5tupleIJRNS_16ColorSpinorFieldERKS7_19QudaFieldLocation_sPdPKdEEEE	GPU-offline,vol=131072,parity=1,precision=8,order=9,Ns=4,Nc=3vol=131072,parity=1,precision=8,order=2,Ns=4,Nc=3,NonRelBasis	256	1	1	512	1	1	0	-1	-1	-1	-1	0.00021636	# 0.00 Gflop/s, 232.63 GB/s, tuning took 0.075043 seconds at Wed Dec  6 21:39:50 2023
      8x32x16x32	N4quda15CopyColorSpinorILi4ELi3ENS_11colorspinor21SpaceSpinorColorOrderIdLi4ELi3EEENS1_11FloatNOrderIdLi4ELi3ELi2ELb0ELb0EEESt5tupleIJRNS_16ColorSpinorFieldERKS7_19QudaFieldLocation_sPdPKdEEEE	GPU-offline,vol=131072,parity=1,precision=8,order=2,Ns=4,Nc=3vol=131072,parity=1,precision=8,order=9,Ns=4,Nc=3,RelBasis	192	1	1	683	1	1	0	-1	-1	-1	-1	0.0002704	# 0.00 Gflop/s, 186.14 GB/s, tuning took 0.093012 seconds at Wed Dec  6 21:41:10 2023
      8x32x16x32	N4quda4PackIdLi3ELb1EEE	policy_kernel,vol=131072,parity=1,precision=8,order=2,Ns=4,Nc=3,comm=1011,topo=2122,nFace=1,device-device	192	1	1	67	1	1	0	-1	-1	-1	-1	0.000121034	# 4.06 Gflop/s, 97.46 GB/s, tuning took 3.514624 seconds at Wed Dec  6 21:39:54 2023
      8x32x16x32	N4quda4PackIdLi3ELb1EEE	policy_kernel,vol=131072,parity=1,precision=8,order=2,Ns=4,Nc=3,comm=1011,topo=2122,nFace=1,device-remote	192	1	1	119	1	1	0	-1	-1	-1	-1	0.000261376	# 1.88 Gflop/s, 45.13 GB/s, tuning took 3.636716 seconds at Wed Dec  6 21:40:54 2023
      8x32x16x32	N4quda4PackIdLi3ELb1EEE	policy_kernel,vol=131072,parity=1,precision=8,order=2,Ns=4,Nc=3,comm=1011,topo=2122,nFace=1,host-device	128	1	1	9	1	1	0	-1	-1	-1	-1	0.000273365	# 1.80 Gflop/s, 43.15 GB/s, tuning took 0.333444 seconds at Wed Dec  6 21:40:30 2023
      8x32x16x32	N4quda4PackIdLi3ELb1EEE	policy_kernel,vol=131072,parity=1,precision=8,order=2,Ns=4,Nc=3,comm=1011,topo=2122,nFace=1,host-host	128	1	1	8	1	1	0	-1	-1	-1	-1	0.000344639	# 1.43 Gflop/s, 34.23 GB/s, tuning took 0.337825 seconds at Wed Dec  6 21:40:08 2023
      8x32x16x32	N4quda4PackIdLi3ELb1EEE	policy_kernel,vol=131072,parity=1,precision=8,order=2,Ns=4,Nc=3,comm=1011,topo=2122,nFace=1,host-remote	256	1	1	7	1	1	0	-1	-1	-1	-1	0.000301679	# 1.63 Gflop/s, 39.10 GB/s, tuning took 0.278691 seconds at Wed Dec  6 21:40:55 2023
      8x32x16x32	N4quda6WilsonINS_9WilsonArgIdLi3ELi4EL21QudaReconstructType_s12EEEEE	policy,GPU-offline,vol=131072,parity=1,precision=8,order=2,Ns=4,Nc=3,commDim=1011,topo=2122,p2p=3,gdr=0,nvshmem=0,pol=110000111100110000	64	1	1	1	1	1	0	1	1	0	-1	0.00985358	# 17.56 Gflop/s, 30.65 GB/s, tuning took 2.943823 seconds at Wed Dec  6 21:41:10 2023
      8x32x16x32	N4quda6WilsonINS_9WilsonArgIdLi3ELi4EL21QudaReconstructType_s12EEEEE	policy_kernel=exterior_all,GPU-offline,vol=131072,parity=1,precision=8,order=2,Ns=4,Nc=3,commDim=1011	176	1	1	233	1	1	8001	-1	-1	-1	-1	0.000359399	# 20.51 Gflop/s, 65.65 GB/s, tuning took 2.587220 seconds at Wed Dec  6 21:40:07 2023
      8x32x16x32	N4quda6WilsonINS_9WilsonArgIdLi3ELi4EL21QudaReconstructType_s12EEEEE	policy_kernel=exterior_all,GPU-offline,vol=131072,parity=1,precision=8,order=2,Ns=4,Nc=3,commDim=1011,zero_copy,p2p=0	192	1	1	214	1	1	0	-1	-1	-1	-1	0.000258624	# 28.51 Gflop/s, 91.23 GB/s, tuning took 2.309630 seconds at Wed Dec  6 21:40:17 2023
      8x32x16x32	N4quda6WilsonINS_9WilsonArgIdLi3ELi4EL21QudaReconstructType_s12EEEEE	policy_kernel=exterior_all,GPU-offline,vol=131072,parity=1,precision=8,order=2,Ns=4,Nc=3,commDim=1011,zero_copy,p2p=1	96	1	1	427	1	1	2134	-1	-1	-1	-1	0.000355836	# 20.72 Gflop/s, 66.30 GB/s, tuning took 2.624245 seconds at Wed Dec  6 21:40:38 2023
      8x32x16x32	N4quda6WilsonINS_9WilsonArgIdLi3ELi4EL21QudaReconstructType_s12EEEEE	policy_kernel=exterior_t,GPU-offline,vol=131072,parity=1,precision=8,order=2,Ns=4,Nc=3,commDim=1011	48	1	1	171	1	1	10667	-1	-1	-1	-1	0.000164026	# 8.99 Gflop/s, 28.77 GB/s, tuning took 1.767931 seconds at Wed Dec  6 21:40:01 2023
      8x32x16x32	N4quda6WilsonINS_9WilsonArgIdLi3ELi4EL21QudaReconstructType_s12EEEEE	policy_kernel=exterior_t,GPU-offline,vol=131072,parity=1,precision=8,order=2,Ns=4,Nc=3,commDim=1011,zero_copy,p2p=0	80	1	1	103	1	1	6401	-1	-1	-1	-1	0.0001438	# 10.25 Gflop/s, 32.81 GB/s, tuning took 2.057561 seconds at Wed Dec  6 21:40:10 2023
      8x32x16x32	N4quda6WilsonINS_9WilsonArgIdLi3ELi4EL21QudaReconstructType_s12EEEEE	policy_kernel=exterior_t,GPU-offline,vol=131072,parity=1,precision=8,order=2,Ns=4,Nc=3,commDim=1011,zero_copy,p2p=1	48	1	1	171	1	1	2134	-1	-1	-1	-1	0.000174963	# 8.43 Gflop/s, 26.97 GB/s, tuning took 1.938833 seconds at Wed Dec  6 21:40:32 2023
      8x32x16x32	N4quda6WilsonINS_9WilsonArgIdLi3ELi4EL21QudaReconstructType_s12EEEEE	policy_kernel=exterior_x,GPU-offline,vol=131072,parity=1,precision=8,order=2,Ns=4,Nc=3,commDim=1011	64	1	1	256	1	1	3201	-1	-1	-1	-1	0.000142487	# 20.70 Gflop/s, 66.23 GB/s, tuning took 2.174632 seconds at Wed Dec  6 21:40:05 2023
      8x32x16x32	N4quda6WilsonINS_9WilsonArgIdLi3ELi4EL21QudaReconstructType_s12EEEEE	policy_kernel=exterior_x,GPU-offline,vol=131072,parity=1,precision=8,order=2,Ns=4,Nc=3,commDim=1011,zero_copy,p2p=0	64	1	1	256	1	1	2286	-1	-1	-1	-1	0.00016362	# 18.02 Gflop/s, 57.68 GB/s, tuning took 2.198622 seconds at Wed Dec  6 21:40:14 2023
      8x32x16x32	N4quda6WilsonINS_9WilsonArgIdLi3ELi4EL21QudaReconstructType_s12EEEEE	policy_kernel=exterior_x,GPU-offline,vol=131072,parity=1,precision=8,order=2,Ns=4,Nc=3,commDim=1011,zero_copy,p2p=1	96	1	1	171	1	1	3201	-1	-1	-1	-1	0.000285876	# 10.32 Gflop/s, 33.01 GB/s, tuning took 1.706491 seconds at Wed Dec  6 21:40:35 2023
      8x32x16x32	N4quda6WilsonINS_9WilsonArgIdLi3ELi4EL21QudaReconstructType_s12EEEEE	policy_kernel=exterior_z,GPU-offline,vol=131072,parity=1,precision=8,order=2,Ns=4,Nc=3,commDim=1011	80	1	1	205	1	1	5334	-1	-1	-1	-1	0.000119072	# 24.77 Gflop/s, 79.26 GB/s, tuning took 2.050606 seconds at Wed Dec  6 21:40:03 2023
      8x32x16x32	N4quda6WilsonINS_9WilsonArgIdLi3ELi4EL21QudaReconstructType_s12EEEEE	policy_kernel=exterior_z,GPU-offline,vol=131072,parity=1,precision=8,order=2,Ns=4,Nc=3,commDim=1011,zero_copy,p2p=0	112	1	1	147	1	1	3201	-1	-1	-1	-1	0.000136338	# 21.63 Gflop/s, 69.22 GB/s, tuning took 2.025426 seconds at Wed Dec  6 21:40:12 2023
      8x32x16x32	N4quda6WilsonINS_9WilsonArgIdLi3ELi4EL21QudaReconstructType_s12EEEEE	policy_kernel=exterior_z,GPU-offline,vol=131072,parity=1,precision=8,order=2,Ns=4,Nc=3,commDim=1011,zero_copy,p2p=1	192	1	1	86	1	1	0	-1	-1	-1	-1	0.000230581	# 12.79 Gflop/s, 40.93 GB/s, tuning took 1.834919 seconds at Wed Dec  6 21:40:34 2023
      8x32x16x32	N4quda6WilsonINS_9WilsonArgIdLi3ELi4EL21QudaReconstructType_s12EEEEE	policy_kernel=interior,GPU-offline,vol=131072,parity=1,precision=8,order=2,Ns=4,Nc=3,commDim=1011,comm=1011	64	1	1	2048	1	1	1524	-1	-1	-1	-1	0.000546558	# 304.86 Gflop/s, 509.36 GB/s, tuning took 4.588300 seconds at Wed Dec  6 21:39:59 2023
      8x32x16x32	N4quda6WilsonINS_9WilsonArgIdLi3ELi4EL21QudaReconstructType_s12EEEEE	policy_kernel=interior,GPU-offline,vol=131072,parity=1,precision=8,order=2,Ns=4,Nc=3,commDim=1011,comm=1011,host-device	80	1	1	1639	1	1	1186	4	-1	-1	-1	0.000523466	# 319.25 Gflop/s, 554.37 GB/s, tuning took 12.382839 seconds at Wed Dec  6 21:40:50 2023
      8x32x16x32	N4quda6WilsonINS_9WilsonArgIdLi3ELi4EL21QudaReconstructType_s12EEEEE	policy_kernel=interior,GPU-offline,vol=131072,parity=1,precision=8,order=2,Ns=4,Nc=3,commDim=1011,comm=1011,host-host	112	1	1	1171	1	1	16001	4	-1	-1	-1	0.000546186	# 305.97 Gflop/s, 531.31 GB/s, tuning took 12.766730 seconds at Wed Dec  6 21:40:29 2023
      8x32x16x32	N4quda6WilsonINS_9WilsonArgIdLi3ELi4EL21QudaReconstructType_s12EEEEE	policy_kernel=interior,GPU-offline,vol=131072,parity=1,precision=8,order=2,Ns=4,Nc=3,commDim=1011,comm=1011,host-remote	80	1	1	1639	1	1	1143	4	-1	-1	-1	0.000550186	# 303.75 Gflop/s, 527.45 GB/s, tuning took 12.660312 seconds at Wed Dec  6 21:41:07 2023
      8x32x32x32	N4quda15CopyColorSpinorILi4ELi3ENS_11colorspinor11FloatNOrderIdLi4ELi3ELi2ELb0ELb0EEENS1_21SpaceSpinorColorOrderIdLi4ELi3EEESt5tupleIJRNS_16ColorSpinorFieldERKS7_19QudaFieldLocation_sPdPKdEEEE	GPU-offline,vol=262144,parity=1,precision=8,order=9,Ns=4,Nc=3vol=262144,parity=1,precision=8,order=2,Ns=4,Nc=3,NonRelBasis	256	1	1	1024	1	1	0	-1	-1	-1	-1	0.00593903	# 0.00 Gflop/s, 16.95 GB/s, tuning took 0.161192 seconds at Thu Nov 30 01:03:19 2023
      8x32x32x32	N4quda15CopyColorSpinorILi4ELi3ENS_11colorspinor21SpaceSpinorColorOrderIdLi4ELi3EEENS1_11FloatNOrderIdLi4ELi3ELi2ELb0ELb0EEESt5tupleIJRNS_16ColorSpinorFieldERKS7_19QudaFieldLocation_sPdPKdEEEE	GPU-offline,vol=262144,parity=1,precision=8,order=2,Ns=4,Nc=3vol=262144,parity=1,precision=8,order=9,Ns=4,Nc=3,RelBasis	64	1	1	4096	1	1	0	-1	-1	-1	-1	0.00037984	# 0.00 Gflop/s, 265.02 GB/s, tuning took 0.135901 seconds at Thu Nov 30 01:04:59 2023
      8x32x32x32	N4quda4PackIdLi3ELb1EEE	policy_kernel,vol=262144,parity=1,precision=8,order=2,Ns=4,Nc=3,comm=1001,topo=2112,nFace=1,device-device	128	1	1	84	1	1	0	-1	-1	-1	-1	0.000183856	# 3.21 Gflop/s, 76.99 GB/s, tuning took 3.230458 seconds at Thu Nov 30 01:03:23 2023
      8x32x32x32	N4quda4PackIdLi3ELb1EEE	policy_kernel,vol=262144,parity=1,precision=8,order=2,Ns=4,Nc=3,comm=1001,topo=2112,nFace=1,device-remote	256	1	1	79	1	1	0	-1	-1	-1	-1	0.000290048	# 2.03 Gflop/s, 48.80 GB/s, tuning took 6.188473 seconds at Thu Nov 30 01:04:40 2023
      8x32x32x32	N4quda4PackIdLi3ELb1EEE	policy_kernel,vol=262144,parity=1,precision=8,order=2,Ns=4,Nc=3,comm=1001,topo=2112,nFace=1,host-device	192	1	1	6	1	1	0	-1	-1	-1	-1	0.000390026	# 1.51 Gflop/s, 36.29 GB/s, tuning took 0.284385 seconds at Thu Nov 30 01:04:02 2023
      8x32x32x32	N4quda4PackIdLi3ELb1EEE	policy_kernel,vol=262144,parity=1,precision=8,order=2,Ns=4,Nc=3,comm=1001,topo=2112,nFace=1,host-host	192	1	1	6	1	1	0	-1	-1	-1	-1	0.00046688	# 1.26 Gflop/s, 30.32 GB/s, tuning took 0.306426 seconds at Thu Nov 30 01:03:38 2023
      8x32x32x32	N4quda4PackIdLi3ELb1EEE	policy_kernel,vol=262144,parity=1,precision=8,order=2,Ns=4,Nc=3,comm=1001,topo=2112,nFace=1,host-remote	256	1	1	4	1	1	0	-1	-1	-1	-1	0.000544586	# 1.08 Gflop/s, 25.99 GB/s, tuning took 0.365607 seconds at Thu Nov 30 01:04:41 2023
      8x32x32x32	N4quda6WilsonINS_9WilsonArgIdLi3ELi4EL21QudaReconstructType_s12EEEEE	policy,GPU-offline,vol=262144,parity=1,precision=8,order=2,Ns=4,Nc=3,commDim=1001,topo=2112,p2p=3,gdr=0,nvshmem=0,pol=110000111100110000	64	1	1	1	1	1	0	13	1	0	-1	0.0184636	# 18.74 Gflop/s, 32.71 GB/s, tuning took 2.511383 seconds at Thu Nov 30 01:04:59 2023
      8x32x32x32	N4quda6WilsonINS_9WilsonArgIdLi3ELi4EL21QudaReconstructType_s12EEEEE	policy_kernel=exterior_all,GPU-offline,vol=262144,parity=1,precision=8,order=2,Ns=4,Nc=3,commDim=1001	256	1	1	192	1	1	4572	-1	-1	-1	-1	0.0002722	# 32.50 Gflop/s, 104.01 GB/s, tuning took 2.948966 seconds at Thu Nov 30 01:03:38 2023
      8x32x32x32	N4quda6WilsonINS_9WilsonArgIdLi3ELi4EL21QudaReconstructType_s12EEEEE	policy_kernel=exterior_all,GPU-offline,vol=262144,parity=1,precision=8,order=2,Ns=4,Nc=3,commDim=1001,zero_copy,p2p=0	176	1	1	280	1	1	2667	-1	-1	-1	-1	0.00038448	# 23.01 Gflop/s, 73.64 GB/s, tuning took 3.214908 seconds at Thu Nov 30 01:03:47 2023
      8x32x32x32	N4quda6WilsonINS_9WilsonArgIdLi3ELi4EL21QudaReconstructType_s12EEEEE	policy_kernel=exterior_all,GPU-offline,vol=262144,parity=1,precision=8,order=2,Ns=4,Nc=3,commDim=1001,zero_copy,p2p=1	240	1	1	205	1	1	3201	-1	-1	-1	-1	0.000312128	# 28.35 Gflop/s, 90.71 GB/s, tuning took 2.724964 seconds at Thu Nov 30 01:04:10 2023
      8x32x32x32	N4quda6WilsonINS_9WilsonArgIdLi3ELi4EL21QudaReconstructType_s12EEEEE	policy_kernel=exterior_t,GPU-offline,vol=262144,parity=1,precision=8,order=2,Ns=4,Nc=3,commDim=1001	112	1	1	147	1	1	8001	-1	-1	-1	-1	0.000171178	# 17.23 Gflop/s, 55.13 GB/s, tuning took 2.306674 seconds at Thu Nov 30 01:03:32 2023
      8x32x32x32	N4quda6WilsonINS_9WilsonArgIdLi3ELi4EL21QudaReconstructType_s12EEEEE	policy_kernel=exterior_t,GPU-offline,vol=262144,parity=1,precision=8,order=2,Ns=4,Nc=3,commDim=1001,zero_copy,p2p=0	48	1	1	342	1	1	2910	-1	-1	-1	-1	0.000121264	# 24.32 Gflop/s, 77.82 GB/s, tuning took 1.890332 seconds at Thu Nov 30 01:03:40 2023
      8x32x32x32	N4quda6WilsonINS_9WilsonArgIdLi3ELi4EL21QudaReconstructType_s12EEEEE	policy_kernel=exterior_t,GPU-offline,vol=262144,parity=1,precision=8,order=2,Ns=4,Nc=3,commDim=1001,zero_copy,p2p=1	160	1	1	103	1	1	4001	-1	-1	-1	-1	0.000178829	# 16.49 Gflop/s, 52.77 GB/s, tuning took 2.230360 seconds at Thu Nov 30 01:04:05 2023
      8x32x32x32	N4quda6WilsonINS_9WilsonArgIdLi3ELi4EL21QudaReconstructType_s12EEEEE	policy_kernel=exterior_x,GPU-offline,vol=262144,parity=1,precision=8,order=2,Ns=4,Nc=3,commDim=1001	208	1	1	158	1	1	2910	-1	-1	-1	-1	0.000254272	# 23.20 Gflop/s, 74.23 GB/s, tuning took 2.606282 seconds at Thu Nov 30 01:03:35 2023
      8x32x32x32	N4quda6WilsonINS_9WilsonArgIdLi3ELi4EL21QudaReconstructType_s12EEEEE	policy_kernel=exterior_x,GPU-offline,vol=262144,parity=1,precision=8,order=2,Ns=4,Nc=3,commDim=1001,zero_copy,p2p=0	80	1	1	410	1	1	0	-1	-1	-1	-1	0.0003908	# 15.09 Gflop/s, 48.30 GB/s, tuning took 2.825189 seconds at Thu Nov 30 01:03:43 2023
      8x32x32x32	N4quda6WilsonINS_9WilsonArgIdLi3ELi4EL21QudaReconstructType_s12EEEEE	policy_kernel=exterior_x,GPU-offline,vol=262144,parity=1,precision=8,order=2,Ns=4,Nc=3,commDim=1001,zero_copy,p2p=1	144	1	1	228	1	1	4572	-1	-1	-1	-1	0.000272864	# 21.62 Gflop/s, 69.17 GB/s, tuning took 2.543995 seconds at Thu Nov 30 01:04:07 2023
      8x32x32x32	N4quda6WilsonINS_9WilsonArgIdLi3ELi4EL21QudaReconstructType_s12EEEEE	policy_kernel=interior,GPU-offline,vol=262144,parity=1,precision=8,order=2,Ns=4,Nc=3,commDim=1001,comm=1001	64	1	1	4096	1	1	1104	-1	-1	-1	-1	0.00110891	# 305.13 Gflop/s, 519.13 GB/s, tuning took 7.178340 seconds at Thu Nov 30 01:03:30 2023
      8x32x32x32	N4quda6WilsonINS_9WilsonArgIdLi3ELi4EL21QudaReconstructType_s12EEEEE	policy_kernel=interior,GPU-offline,vol=262144,parity=1,precision=8,order=2,Ns=4,Nc=3,commDim=1001,comm=1001,host-device	64	1	1	4096	1	1	16001	3	-1	-1	-1	0.00101205	# 334.92 Gflop/s, 582.80 GB/s, tuning took 24.044084 seconds at Thu Nov 30 01:04:34 2023
      8x32x32x32	N4quda6WilsonINS_9WilsonArgIdLi3ELi4EL21QudaReconstructType_s12EEEEE	policy_kernel=interior,GPU-offline,vol=262144,parity=1,precision=8,order=2,Ns=4,Nc=3,commDim=1001,comm=1001,host-host	48	1	1	5462	1	1	16001	3	-1	-1	-1	0.00101595	# 333.63 Gflop/s, 580.57 GB/s, tuning took 15.327778 seconds at Thu Nov 30 01:04:02 2023
      8x32x32x32	N4quda6WilsonINS_9WilsonArgIdLi3ELi4EL21QudaReconstructType_s12EEEEE	policy_kernel=interior,GPU-offline,vol=262144,parity=1,precision=8,order=2,Ns=4,Nc=3,commDim=1001,comm=1001,host-remote	112	1	1	2341	1	1	2001	4	-1	-1	-1	0.0010232	# 331.27 Gflop/s, 576.45 GB/s, tuning took 15.215680 seconds at Thu Nov 30 01:04:56 2023
      8x32x32x64	N4quda10GaugeGaussIdLi3EL21QudaReconstructType_s12EEE	GPU-offline,vol=524288stride=294912precision=8geometry=4Nc=3,lie_group	64	1	1	4096	2	1	2001	-1	-1	-1	-1	0.00745018	# 0.00 Gflop/s, 30.40 GB/s, tuning took 19.411712 seconds at Wed Nov 15 23:04:24 2023
      8x32x32x64	N4quda12ExtractGhostIdLi3ENS_5gauge11FloatNOrderIdLi18ELi2ELi12EL20QudaStaggeredPhase_s0ELb1EL19QudaGhostExchange_sn2147483648ELb0EEEEE	GPU-offline,vol=524288stride=294912precision=8geometry=4Nc=3,extract	64	1	3	1024	1	3	5334	-1	-1	-1	-1	0.00010784	# 0.00 Gflop/s, 189.61 GB/s, tuning took 0.364460 seconds at Wed Nov 15 23:04:02 2023
      8x32x32x64	N4quda15CopyColorSpinorILi4ELi3ENS_11colorspinor11FloatNOrderIdLi4ELi3ELi2ELb0ELb0EEENS1_21SpaceSpinorColorOrderIdLi4ELi3EEESt5tupleIJRNS_16ColorSpinorFieldERKS7_19QudaFieldLocation_sPdPKdEEEE	GPU-offline,vol=524288,parity=1,precision=8,order=9,Ns=4,Nc=3vol=524288,parity=1,precision=8,order=2,Ns=4,Nc=3,NonRelBasis	64	1	1	8192	1	1	0	-1	-1	-1	-1	0.000704586	# 0.00 Gflop/s, 285.74 GB/s, tuning took 0.115292 seconds at Wed Nov 29 20:59:22 2023
      8x32x32x64	N4quda15CopyColorSpinorILi4ELi3ENS_11colorspinor21SpaceSpinorColorOrderIdLi4ELi3EEENS1_11FloatNOrderIdLi4ELi3ELi2ELb0ELb0EEESt5tupleIJRNS_16ColorSpinorFieldERKS7_19QudaFieldLocation_sPdPKdEEEE	GPU-offline,vol=524288,parity=1,precision=8,order=2,Ns=4,Nc=3vol=524288,parity=1,precision=8,order=9,Ns=4,Nc=3,RelBasis	192	1	1	2731	1	1	0	-1	-1	-1	-1	0.00125061	# 0.00 Gflop/s, 160.98 GB/s, tuning took 0.082016 seconds at Wed Nov 29 21:17:35 2023
      8x32x32x64	N4quda4PackIdLi3ELb1EEE	policy_kernel,vol=524288,parity=1,precision=8,order=2,Ns=4,Nc=3,comm=1000,topo=2111,nFace=1,device-device	256	1	1	99	1	1	0	-1	-1	-1	-1	0.000203333	# 3.87 Gflop/s, 92.82 GB/s, tuning took 3.841035 seconds at Wed Nov 29 20:59:26 2023
      8x32x32x64	N4quda4PackIdLi3ELb1EEE	policy_kernel,vol=524288,parity=1,precision=8,order=2,Ns=4,Nc=3,comm=1000,topo=2111,nFace=1,device-remote	192	1	1	17	1	1	0	-1	-1	-1	-1	0.00032532	# 2.42 Gflop/s, 58.02 GB/s, tuning took 3.460451 seconds at Wed Nov 29 21:16:54 2023
      8x32x32x64	N4quda4PackIdLi3ELb1EEE	policy_kernel,vol=524288,parity=1,precision=8,order=2,Ns=4,Nc=3,comm=1000,topo=2111,nFace=1,host-device	256	1	1	3	1	1	0	-1	-1	-1	-1	0.000948426	# 0.83 Gflop/s, 19.90 GB/s, tuning took 0.238316 seconds at Wed Nov 29 21:00:30 2023
      8x32x32x64	N4quda4PackIdLi3ELb1EEE	policy_kernel,vol=524288,parity=1,precision=8,order=2,Ns=4,Nc=3,comm=1000,topo=2111,nFace=1,host-host	256	1	1	3	1	1	0	-1	-1	-1	-1	0.00107936	# 0.73 Gflop/s, 17.49 GB/s, tuning took 0.211003 seconds at Wed Nov 29 20:59:43 2023
      8x32x32x64	N4quda4PackIdLi3ELb1EEE	policy_kernel,vol=524288,parity=1,precision=8,order=2,Ns=4,Nc=3,comm=1000,topo=2111,nFace=1,host-remote	256	1	1	3	1	1	0	-1	-1	-1	-1	0.000847945	# 0.93 Gflop/s, 22.26 GB/s, tuning took 0.208881 seconds at Wed Nov 29 21:16:55 2023
      8x32x32x64	N4quda6WilsonINS_9WilsonArgIdLi3ELi4EL21QudaReconstructType_s12EEEEE	policy,GPU-offline,vol=524288,parity=1,precision=8,order=2,Ns=4,Nc=3,commDim=1000,topo=2111,p2p=3,gdr=0,nvshmem=0,pol=110000111100110000	64	1	1	1	1	1	0	8	1	0	-1	0.00361589	# 191.39 Gflop/s, 334.07 GB/s, tuning took 1.842854 seconds at Wed Nov 29 21:17:34 2023
      8x32x32x64	N4quda6WilsonINS_9WilsonArgIdLi3ELi4EL21QudaReconstructType_s12EEEEE	policy_kernel=exterior_all,GPU-offline,vol=524288,parity=1,precision=8,order=2,Ns=4,Nc=3,commDim=1000	256	1	1	256	1	1	4572	-1	-1	-1	-1	0.000499412	# 23.62 Gflop/s, 75.59 GB/s, tuning took 3.468124 seconds at Wed Nov 29 20:59:43 2023
      8x32x32x64	N4quda6WilsonINS_9WilsonArgIdLi3ELi4EL21QudaReconstructType_s12EEEEE	policy_kernel=exterior_all,GPU-offline,vol=524288,parity=1,precision=8,order=2,Ns=4,Nc=3,commDim=1000,zero_copy,p2p=0	224	1	1	293	1	1	5334	-1	-1	-1	-1	0.000651573	# 18.10 Gflop/s, 57.93 GB/s, tuning took 3.792466 seconds at Wed Nov 29 20:59:51 2023
      8x32x32x64	N4quda6WilsonINS_9WilsonArgIdLi3ELi4EL21QudaReconstructType_s12EEEEE	policy_kernel=exterior_all,GPU-offline,vol=524288,parity=1,precision=8,order=2,Ns=4,Nc=3,commDim=1000,zero_copy,p2p=1	80	1	1	820	1	1	5334	-1	-1	-1	-1	0.00052528	# 22.46 Gflop/s, 71.86 GB/s, tuning took 3.210256 seconds at Wed Nov 29 21:00:37 2023
      8x32x32x64	N4quda6WilsonINS_9WilsonArgIdLi3ELi4EL21QudaReconstructType_s12EEEEE	policy_kernel=exterior_x,GPU-offline,vol=524288,parity=1,precision=8,order=2,Ns=4,Nc=3,commDim=1000	64	1	1	1024	1	1	6401	-1	-1	-1	-1	0.000538506	# 21.91 Gflop/s, 70.10 GB/s, tuning took 3.617998 seconds at Wed Nov 29 20:59:39 2023
      8x32x32x64	N4quda6WilsonINS_9WilsonArgIdLi3ELi4EL21QudaReconstructType_s12EEEEE	policy_kernel=exterior_x,GPU-offline,vol=524288,parity=1,precision=8,order=2,Ns=4,Nc=3,commDim=1000,zero_copy,p2p=0	96	1	1	683	1	1	1334	-1	-1	-1	-1	0.00063072	# 18.70 Gflop/s, 59.85 GB/s, tuning took 3.738863 seconds at Wed Nov 29 20:59:47 2023
      8x32x32x64	N4quda6WilsonINS_9WilsonArgIdLi3ELi4EL21QudaReconstructType_s12EEEEE	policy_kernel=exterior_x,GPU-offline,vol=524288,parity=1,precision=8,order=2,Ns=4,Nc=3,commDim=1000,zero_copy,p2p=1	224	1	1	293	1	1	10667	-1	-1	-1	-1	0.000505172	# 23.35 Gflop/s, 74.72 GB/s, tuning took 3.531828 seconds at Wed Nov 29 21:00:33 2023
      8x32x32x64	N4quda6WilsonINS_9WilsonArgIdLi3ELi4EL21QudaReconstructType_s12EEEEE	policy_kernel=interior,GPU-offline,vol=524288,parity=1,precision=8,order=2,Ns=4,Nc=3,commDim=1000,comm=1000	64	1	1	8192	1	1	1883	-1	-1	-1	-1	0.00268965	# 253.50 Gflop/s, 435.08 GB/s, tuning took 9.755942 seconds at Wed Nov 29 20:59:36 2023
      8x32x32x64	N4quda6WilsonINS_9WilsonArgIdLi3ELi4EL21QudaReconstructType_s12EEEEE	policy_kernel=interior,GPU-offline,vol=524288,parity=1,precision=8,order=2,Ns=4,Nc=3,commDim=1000,comm=1000,host-device	32	1	1	16384	1	1	10667	4	-1	-1	-1	0.00185419	# 368.15 Gflop/s, 641.30 GB/s, tuning took 38.331750 seconds at Wed Nov 29 21:01:15 2023
      8x32x32x64	N4quda6WilsonINS_9WilsonArgIdLi3ELi4EL21QudaReconstructType_s12EEEEE	policy_kernel=interior,GPU-offline,vol=524288,parity=1,precision=8,order=2,Ns=4,Nc=3,commDim=1000,comm=1000,host-host	32	1	1	16384	1	1	10667	4	-1	-1	-1	0.0018433	# 370.33 Gflop/s, 645.08 GB/s, tuning took 38.489331 seconds at Wed Nov 29 21:00:29 2023
      8x32x32x64	N4quda6WilsonINS_9WilsonArgIdLi3ELi4EL21QudaReconstructType_s12EEEEE	policy_kernel=interior,GPU-offline,vol=524288,parity=1,precision=8,order=2,Ns=4,Nc=3,commDim=1000,comm=1000,host-remote	32	1	1	16384	1	1	8001	5	-1	-1	-1	0.00190704	# 357.95 Gflop/s, 623.52 GB/s, tuning took 37.700915 seconds at Wed Nov 29 21:17:32 2023
      8x32x32x64	N4quda7RNGInitE	GPU-offline,vol=524288stride=294912precision=8geometry=4Nc=3	64	1	1	4096	2	1	0	-1	-1	-1	-1	0.000521546	# 0.00 Gflop/s, 0.00 GB/s, tuning took 0.120921 seconds at Wed Nov 15 23:04:05 2023
      8x32x32x64	N4quda9CopyGaugeINS_12CopyGaugeArgIddLi18ELb0ENS_5gauge11FloatNOrderIdLi18ELi2ELi12EL20QudaStaggeredPhase_s0ELb1EL19QudaGhostExchange_sn2147483648ELb0EEENS2_8QDPOrderIdLi18EEEEEEE	GPU-offline,vol=524288stride=262144precision=8geometry=4Nc=3,vol=524288stride=294912precision=8geometry=4Nc=3	64	1	2	4096	1	4	10667	-1	-1	-1	-1	0.000768746	# 0.00 Gflop/s, 687.46 GB/s, tuning took 0.876264 seconds at Wed Nov 15 23:04:01 2023
      8x32x32x64	N4quda9CopyGaugeINS_12CopyGaugeArgIddLi18ELb0ENS_5gauge11FloatNOrderIdLi18ELi2ELi12EL20QudaStaggeredPhase_s0ELb1EL19QudaGhostExchange_sn2147483648ELb0EEES6_EEEE	GPU-offline,vol=524288stride=294912precision=8geometry=4Nc=3,vol=524288stride=294912precision=8geometry=4Nc=3,ghost	128	1	1	256	1	8	4572	-1	-1	-1	-1	0.000242713	# 0.00 Gflop/s, 94.77 GB/s, tuning took 0.539116 seconds at Wed Nov 15 23:04:03 2023
      8x32x32x64	N4quda9CopyGaugeINS_12CopyGaugeArgIddLi18ELb0ENS_5gauge8QDPOrderIdLi18EEENS2_11FloatNOrderIdLi18ELi2ELi12EL20QudaStaggeredPhase_s0ELb1EL19QudaGhostExchange_sn2147483648ELb0EEEEEEE	GPU-offline,vol=524288stride=294912precision=8geometry=4Nc=3,vol=524288stride=262144precision=8geometry=4Nc=3	64	1	1	4096	1	8	1001	-1	-1	-1	-1	0.0011	# 0.00 Gflop/s, 480.44 GB/s, tuning took 1.069765 seconds at Wed Nov 15 23:04:25 2023
      8x32x32x64	N4quda9CopyGaugeINS_12CopyGaugeArgIfdLi18ELb0ENS_5gauge11FloatNOrderIfLi18ELi4ELi12EL20QudaStaggeredPhase_s0ELb1EL19QudaGhostExchange_sn2147483648ELb0EEENS3_IdLi18ELi2ELi12ELS4_0ELb1ELS5_n2147483648ELb0EEEEEEE	GPU-offline,vol=524288stride=294912precision=8geometry=4Nc=3,vol=524288stride=294912precision=4geometry=4Nc=3	64	1	2	4096	1	4	2910	-1	-1	-1	-1	0.000427626	# 0.00 Gflop/s, 794.48 GB/s, tuning took 0.398417 seconds at Wed Nov 15 23:04:04 2023
      8x32x32x64	N4quda9CopyGaugeINS_12CopyGaugeArgIfdLi18ELb0ENS_5gauge11FloatNOrderIfLi18ELi4ELi12EL20QudaStaggeredPhase_s0ELb1EL19QudaGhostExchange_sn2147483648ELb0EEENS3_IdLi18ELi2ELi12ELS4_0ELb1ELS5_n2147483648ELb0EEEEEEE	GPU-offline,vol=524288stride=294912precision=8geometry=4Nc=3,vol=524288stride=294912precision=4geometry=4Nc=3,ghost	128	1	1	256	1	8	2910	-1	-1	-1	-1	3.42215e-05	# 0.00 Gflop/s, 504.14 GB/s, tuning took 0.365672 seconds at Wed Nov 15 23:04:04 2023
      8x32x32x64	N4quda9CopyGaugeINS_12CopyGaugeArgIsdLi18ELb0ENS_5gauge11FloatNOrderIsLi18ELi4ELi12EL20QudaStaggeredPhase_s0ELb1EL19QudaGhostExchange_sn2147483648ELb0EEENS3_IdLi18ELi2ELi12ELS4_0ELb1ELS5_n2147483648ELb0EEEEEEE	GPU-offline,vol=524288stride=294912precision=8geometry=4Nc=3,vol=524288stride=294912precision=2geometry=4Nc=3	256	1	1	1024	1	8	8001	-1	-1	-1	-1	0.000361386	# 0.00 Gflop/s, 783.42 GB/s, tuning took 0.321980 seconds at Wed Nov 15 23:04:03 2023
      8x32x32x64	N4quda9CopyGaugeINS_12CopyGaugeArgIsdLi18ELb0ENS_5gauge11FloatNOrderIsLi18ELi4ELi12EL20QudaStaggeredPhase_s0ELb1EL19QudaGhostExchange_sn2147483648ELb0EEENS3_IdLi18ELi2ELi12ELS4_0ELb1ELS5_n2147483648ELb0EEEEEEE	GPU-offline,vol=524288stride=294912precision=8geometry=4Nc=3,vol=524288stride=294912precision=2geometry=4Nc=3,ghost	128	1	1	256	1	8	0	-1	-1	-1	-1	0.000219078	# 0.00 Gflop/s, 65.62 GB/s, tuning took 0.434581 seconds at Wed Nov 15 23:04:03 2023
  bytes=10223616	hipMemset	allocateGhostBuffer,lattice_field.cpp,288	64	1	1	1	1	1	0	-1	-1	-1	-1	0.00031808	# 0.00 Gflop/s, 32.14 GB/s, tuning took 0.214230 seconds at Wed Nov 15 23:04:02 2023
  bytes=10223616	hipMemset	allocateGhostBuffer,lattice_field.cpp,293	64	1	1	1	1	1	0	-1	-1	-1	-1	0.0002956	# 0.00 Gflop/s, 34.59 GB/s, tuning took 0.002435 seconds at Wed Nov 15 23:04:02 2023
  bytes=11206656	hipMemset	allocateGhostBuffer,lattice_field.cpp,288	64	1	1	1	1	1	0	-1	-1	-1	-1	6.32582e-05	# 0.00 Gflop/s, 177.16 GB/s, tuning took 0.001240 seconds at Wed Nov 29 21:04:45 2023
  bytes=11206656	hipMemset	allocateGhostBuffer,lattice_field.cpp,293	64	1	1	1	1	1	0	-1	-1	-1	-1	6.07733e-05	# 0.00 Gflop/s, 184.40 GB/s, tuning took 0.001153 seconds at Wed Nov 29 21:04:45 2023
  bytes=14155776	hipMemset	allocateGhostBuffer,lattice_field.cpp,288	64	1	1	1	1	1	0	-1	-1	-1	-1	8.08177e-05	# 0.00 Gflop/s, 175.16 GB/s, tuning took 0.006857 seconds at Wed Nov 29 20:58:58 2023
  bytes=14155776	hipMemset	allocateGhostBuffer,lattice_field.cpp,293	64	1	1	1	1	1	0	-1	-1	-1	-1	9.4311e-05	# 0.00 Gflop/s, 150.10 GB/s, tuning took 0.006753 seconds at Wed Nov 29 20:58:58 2023
 bytes=150994944	hipMemcpyDefault	copy,cuda_gauge_field.cpp,576	64	1	1	1	1	1	0	-1	-1	-1	-1	0.000622453	# 0.00 Gflop/s, 242.58 GB/s, tuning took 0.009692 seconds at Wed Nov 29 20:58:54 2023
 bytes=150994944	hipMemcpyDefault	saveCPUField,cuda_gauge_field.cpp,658	64	1	1	1	1	1	0	-1	-1	-1	-1	0.000654133	# 0.00 Gflop/s, 230.83 GB/s, tuning took 0.022457 seconds at Wed Nov 29 20:59:22 2023
   bytes=1572864	hipMemcpyDeviceToDevice	exchangeGhost,cuda_gauge_field.cpp,193	64	1	1	1	1	1	0	-1	-1	-1	-1	0.0002084	# 0.00 Gflop/s, 15.09 GB/s, tuning took 0.001930 seconds at Wed Nov 15 23:04:02 2023
   bytes=1966080	hipMemcpyDeviceToDevice	exchangeGhost,cuda_gauge_field.cpp,193	64	1	1	1	1	1	0	-1	-1	-1	-1	5.61173e-05	# 0.00 Gflop/s, 70.07 GB/s, tuning took 0.001209 seconds at Wed Nov 29 21:04:47 2023
  bytes=22020096	hipMemset	allocateGhostBuffer,lattice_field.cpp,288	64	1	1	1	1	1	0	-1	-1	-1	-1	9.12959e-05	# 0.00 Gflop/s, 241.19 GB/s, tuning took 0.019521 seconds at Wed Nov 29 20:51:07 2023
  bytes=22020096	hipMemset	allocateGhostBuffer,lattice_field.cpp,293	64	1	1	1	1	1	0	-1	-1	-1	-1	8.79039e-05	# 0.00 Gflop/s, 250.50 GB/s, tuning took 0.001411 seconds at Wed Nov 29 20:51:07 2023
 bytes=301989888	hipMemcpyDefault	copy,cuda_gauge_field.cpp,576	64	1	1	1	1	1	0	-1	-1	-1	-1	0.00121563	# 0.00 Gflop/s, 248.42 GB/s, tuning took 0.008928 seconds at Wed Nov 29 20:51:02 2023
 bytes=301989888	hipMemcpyDefault	saveCPUField,cuda_gauge_field.cpp,658	64	1	1	1	1	1	0	-1	-1	-1	-1	0.00118309	# 0.00 Gflop/s, 255.25 GB/s, tuning took 0.017848 seconds at Wed Nov 29 20:51:35 2023
   bytes=3145728	hipMemcpyDeviceToDevice	exchangeGhost,cuda_gauge_field.cpp,193	64	1	1	1	1	1	0	-1	-1	-1	-1	5.82399e-05	# 0.00 Gflop/s, 108.03 GB/s, tuning took 0.001208 seconds at Wed Nov 29 20:51:09 2023
  bytes=37748736	hipMemcpyDefault	copy,cuda_gauge_field.cpp,576	64	1	1	1	1	1	0	-1	-1	-1	-1	0.00019536	# 0.00 Gflop/s, 193.23 GB/s, tuning took 0.002236 seconds at Wed Dec  6 21:39:34 2023
  bytes=37748736	hipMemcpyDefault	saveCPUField,cuda_gauge_field.cpp,658	64	1	1	1	1	1	0	-1	-1	-1	-1	0.0002202	# 0.00 Gflop/s, 171.43 GB/s, tuning took 0.002298 seconds at Wed Dec  6 21:39:50 2023
   bytes=4718592	hipMemset	allocateGhostBuffer,lattice_field.cpp,288	64	1	1	1	1	1	0	-1	-1	-1	-1	5.74932e-05	# 0.00 Gflop/s, 82.07 GB/s, tuning took 0.001301 seconds at Wed Dec  6 21:39:36 2023
   bytes=4718592	hipMemset	allocateGhostBuffer,lattice_field.cpp,293	64	1	1	1	1	1	0	-1	-1	-1	-1	5.75086e-05	# 0.00 Gflop/s, 82.05 GB/s, tuning took 0.000983 seconds at Wed Dec  6 21:39:36 2023
   bytes=6291456	hipMemcpyDeviceToDevice	exchangeGhost,cuda_gauge_field.cpp,193	64	1	1	1	1	1	0	-1	-1	-1	-1	6.7751e-05	# 0.00 Gflop/s, 185.72 GB/s, tuning took 0.001252 seconds at Wed Nov 29 20:51:09 2023
  bytes=75497472	hipMemcpyDefault	copy,cuda_gauge_field.cpp,576	64	1	1	1	1	1	0	-1	-1	-1	-1	0.00281664	# 0.00 Gflop/s, 26.80 GB/s, tuning took 0.022848 seconds at Wed Nov 15 23:04:00 2023
  bytes=75497472	hipMemcpyDefault	saveCPUField,cuda_gauge_field.cpp,658	64	1	1	1	1	1	0	-1	-1	-1	-1	0.000402133	# 0.00 Gflop/s, 187.74 GB/s, tuning took 0.004227 seconds at Wed Nov 15 23:04:25 2023
    bytes=786432	hipMemcpyDeviceToDevice	exchangeGhost,cuda_gauge_field.cpp,193	64	1	1	1	1	1	0	-1	-1	-1	-1	0.000154628	# 0.00 Gflop/s, 10.17 GB/s, tuning took 0.001796 seconds at Wed Nov 15 23:04:02 2023
   bytes=7864320	hipMemset	allocateGhostBuffer,lattice_field.cpp,288	64	1	1	1	1	1	0	-1	-1	-1	-1	5.69745e-05	# 0.00 Gflop/s, 138.03 GB/s, tuning took 0.001256 seconds at Thu Nov 30 01:03:01 2023
   bytes=7864320	hipMemset	allocateGhostBuffer,lattice_field.cpp,293	64	1	1	1	1	1	0	-1	-1	-1	-1	5.616e-05	# 0.00 Gflop/s, 140.03 GB/s, tuning took 0.001164 seconds at Thu Nov 30 01:03:01 2023
  bytes=94371840	hipMemcpyDefault	copy,cuda_gauge_field.cpp,576	64	1	1	1	1	1	0	-1	-1	-1	-1	0.000416266	# 0.00 Gflop/s, 226.71 GB/s, tuning took 0.003321 seconds at Wed Nov 29 21:04:42 2023
  bytes=94371840	hipMemcpyDefault	saveCPUField,cuda_gauge_field.cpp,658	64	1	1	1	1	1	0	-1	-1	-1	-1	0.000420693	# 0.00 Gflop/s, 224.32 GB/s, tuning took 0.004933 seconds at Wed Nov 29 21:05:06 2023
    bytes=983040	hipMemcpyDeviceToDevice	exchangeGhost,cuda_gauge_field.cpp,193	64	1	1	1	1	1	0	-1	-1	-1	-1	4.18667e-05	# 0.00 Gflop/s, 46.96 GB/s, tuning took 0.001086 seconds at Wed Nov 29 21:04:47 2023
