refer/qcu/test/.cache/tunecache.tsv
tunecache	1.1.0	1.1.0--sm_60	cpu_arch=x86_64,gpu_arch=sm_60,cuda_version=12.4.131	# Last updated Sun Jul 28 02:35:16 2024

          volume	name	aux	block.x	block.y	block.z	grid.x	grid.y	grid.z	shared_bytes	aux.x	aux.y	aux.z	aux.w	time	comment
     16x16x16x16	N4quda10GaugeGaussIdLi3EL21QudaReconstructType_s12EEE	GPU-offline,vol=65536stride=34816precision=8geometry=4Nc=3,lie_group	64	2	1	512	1	1	3277	-1	-1	-1	-1	0.000310248	# 0.00 Gflop/s, 86.18 GB/s, tuning took 0.472529 seconds at Sat Jul 27 16:05:03 2024
     16x16x16x16	N4quda12ExtractGhostIdLi3ENS_5gauge11FloatNOrderIdLi18ELi2ELi12EL20QudaStaggeredPhase_s0ELb1EL19QudaGhostExchange_sn2147483648ELb0EEEEE	GPU-offline,vol=65536stride=34816precision=8geometry=4Nc=3,extract	32	1	1	128	1	8	4469	-1	-1	-1	-1	1.175e-05	# 0.00 Gflop/s, 267.72 GB/s, tuning took 0.158599 seconds at Sat Jul 27 16:05:02 2024
     16x16x16x16	N4quda15CopyColorSpinorILi4ELi3ENS_11colorspinor11FloatNOrderIdLi4ELi3ELi2ELb0ELb0EEENS1_21SpaceSpinorColorOrderIdLi4ELi3EEESt5tupleIJRNS_16ColorSpinorFieldERKS7_19QudaFieldLocation_sPdPKdEEEE	GPU-offline,vol=65536,parity=2,precision=8,order=9,Ns=4,Nc=3vol=65536,parity=2,precision=8,order=2,Ns=4,Nc=3,NonRelBasis	608	1	1	54	2	1	0	-1	-1	-1	-1	5.09072e-05	# 0.00 Gflop/s, 494.35 GB/s, tuning took 0.027980 seconds at Sat Jul 27 16:05:08 2024
     16x16x16x16	N4quda15CopyColorSpinorILi4ELi3ENS_11colorspinor21SpaceSpinorColorOrderIdLi4ELi3EEENS1_11FloatNOrderIdLi4ELi3ELi2ELb0ELb0EEESt5tupleIJRNS_16ColorSpinorFieldERKS7_19QudaFieldLocation_sPdPKdEEEE	GPU-offline,vol=65536,parity=2,precision=8,order=2,Ns=4,Nc=3vol=65536,parity=2,precision=8,order=9,Ns=4,Nc=3,RelBasis	608	1	1	54	2	1	0	-1	-1	-1	-1	5.08528e-05	# 0.00 Gflop/s, 494.88 GB/s, tuning took 0.098881 seconds at Sat Jul 27 16:05:20 2024
     16x16x16x16	N4quda4PackIdLi3ELb1EEE	policy_kernel,vol=65536,parity=2,precision=8,order=2,Ns=4,Nc=3,comm=0001,topo=1112,nFace=1,device-device	128	1	2	56	1	1	0	-1	-1	-1	-1	8.73645e-06	# 11.25 Gflop/s, 270.05 GB/s, tuning took 1.507672 seconds at Sat Jul 27 16:05:09 2024
     16x16x16x16	N4quda4PackIdLi3ELb1EEE	policy_kernel,vol=65536,parity=2,precision=8,order=2,Ns=4,Nc=3,comm=0001,topo=1112,nFace=1,host-host	160	1	2	1	1	1	0	-1	-1	-1	-1	0.000243053	# 0.40 Gflop/s, 9.71 GB/s, tuning took 0.118085 seconds at Sat Jul 27 16:05:11 2024
     16x16x16x16	N4quda6WilsonINS_9WilsonArgIdLi3ELi4EL21QudaReconstructType_s12EEEEE	policy,commDim=0001,xpay,parity=2,topo=1112,p2p=0,gdr=0,nvshmem=0,pol=110000111100110000	32	1	1	1	1	1	0	8	0	0	-1	0.00082496	# 108.68 Gflop/s, 183.03 GB/s, tuning took 0.061936 seconds at Sat Jul 27 16:05:20 2024
     16x16x16x16	N4quda6WilsonINS_9WilsonArgIdLi3ELi4EL21QudaReconstructType_s12EEEEE	policy_kernel=exterior_all,commDim=0001,xpay,parity=2	32	1	2	128	1	1	2731	-1	-1	-1	-1	1.2473e-05	# 133.98 Gflop/s, 378.30 GB/s, tuning took 0.231484 seconds at Sat Jul 27 16:05:11 2024
     16x16x16x16	N4quda6WilsonINS_9WilsonArgIdLi3ELi4EL21QudaReconstructType_s12EEEEE	policy_kernel=exterior_all,commDim=0001,xpay,parity=2,zero_copy,p2p=0	16	1	2	256	1	1	2731	-1	-1	-1	-1	0.000257064	# 6.50 Gflop/s, 18.36 GB/s, tuning took 0.816873 seconds at Sat Jul 27 16:05:12 2024
     16x16x16x16	N4quda6WilsonINS_9WilsonArgIdLi3ELi4EL21QudaReconstructType_s12EEEEE	policy_kernel=exterior_t,commDim=0001,xpay,parity=2	16	1	1	256	1	2	3277	-1	-1	-1	-1	1.15748e-05	# 144.38 Gflop/s, 407.66 GB/s, tuning took 0.239787 seconds at Sat Jul 27 16:05:10 2024
     16x16x16x16	N4quda6WilsonINS_9WilsonArgIdLi3ELi4EL21QudaReconstructType_s12EEEEE	policy_kernel=exterior_t,commDim=0001,xpay,parity=2,zero_copy,p2p=0	16	1	2	256	1	1	2587	-1	-1	-1	-1	0.00025616	# 6.52 Gflop/s, 18.42 GB/s, tuning took 0.889453 seconds at Sat Jul 27 16:05:12 2024
     16x16x16x16	N4quda6WilsonINS_9WilsonArgIdLi3ELi4EL21QudaReconstructType_s12EEEEE	policy_kernel=interior,comm=0001,commDim=0001,xpay,parity=2	32	1	2	1024	1	1	24577	-1	-1	-1	-1	0.000161362	# 547.68 Gflop/s, 906.51 GB/s, tuning took 0.799424 seconds at Sat Jul 27 16:05:10 2024
     16x16x16x16	N4quda6WilsonINS_9WilsonArgIdLi3ELi4EL21QudaReconstructType_s12EEEEE	policy_kernel=interior,comm=0001,commDim=0001,xpay,parity=2,host-host	16	1	2	2048	1	1	8193	1	-1	-1	-1	0.000249722	# 354.29 Gflop/s, 595.21 GB/s, tuning took 7.554376 seconds at Sat Jul 27 16:05:20 2024
     16x16x16x16	N4quda7RNGInitE	GPU-offline,vol=65536stride=34816precision=8geometry=4Nc=3	160	2	1	205	1	1	0	-1	-1	-1	-1	0.00232833	# 0.00 Gflop/s, 0.00 GB/s, tuning took 0.492978 seconds at Sat Jul 27 16:05:02 2024
     16x16x16x16	N4quda9CopyGaugeINS_12CopyGaugeArgIddLi18ELb0ENS_5gauge11FloatNOrderIdLi18ELi2ELi12EL20QudaStaggeredPhase_s0ELb1EL19QudaGhostExchange_sn2147483648ELb0EEENS2_8QDPOrderIdLi18EEEEEEE	GPU-offline,vol=65536stride=32768precision=8geometry=4Nc=3,vol=65536stride=34816precision=8geometry=4Nc=3	32	1	1	1024	1	8	4097	-1	-1	-1	-1	0.000119004	# 0.00 Gflop/s, 541.89 GB/s, tuning took 0.470655 seconds at Sat Jul 27 16:05:02 2024
     16x16x16x16	N4quda9CopyGaugeINS_12CopyGaugeArgIddLi18ELb0ENS_5gauge11FloatNOrderIdLi18ELi2ELi12EL20QudaStaggeredPhase_s0ELb1EL19QudaGhostExchange_sn2147483648ELb0EEES6_EEEE	GPU-offline,vol=65536stride=34816precision=8geometry=4Nc=3,vol=65536stride=34816precision=8geometry=4Nc=3,ghost	32	1	3	64	1	3	2458	-1	-1	-1	-1	7.61642e-06	# 0.00 Gflop/s, 438.83 GB/s, tuning took 0.102393 seconds at Sat Jul 27 16:05:02 2024
     16x16x16x16	N4quda9CopyGaugeINS_12CopyGaugeArgIddLi18ELb0ENS_5gauge8QDPOrderIdLi18EEENS2_11FloatNOrderIdLi18ELi2ELi12EL20QudaStaggeredPhase_s0ELb1EL19QudaGhostExchange_sn2147483648ELb0EEEEEEE	GPU-offline,vol=65536stride=34816precision=8geometry=4Nc=3,vol=65536stride=32768precision=8geometry=4Nc=3	64	1	1	512	1	8	2731	-1	-1	-1	-1	0.00012438	# 0.00 Gflop/s, 518.47 GB/s, tuning took 0.470150 seconds at Sat Jul 27 16:05:03 2024
     16x16x16x32	N4quda10GaugeGaussIdLi3EL21QudaReconstructType_s12EEE	GPU-offline,vol=131072stride=69632precision=8geometry=4Nc=3,lie_group	96	2	1	683	1	1	12289	-1	-1	-1	-1	0.000583008	# 0.00 Gflop/s, 91.73 GB/s, tuning took 0.746240 seconds at Sat Jul 27 16:08:28 2024
     16x16x16x32	N4quda12ExtractGhostIdLi3ENS_5gauge11FloatNOrderIdLi18ELi2ELi12EL20QudaStaggeredPhase_s0ELb1EL19QudaGhostExchange_sn2147483648ELb0EEEEE	GPU-offline,vol=131072stride=69632precision=8geometry=4Nc=3,extract	32	1	1	256	1	8	2049	-1	-1	-1	-1	1.68866e-05	# 0.00 Gflop/s, 326.00 GB/s, tuning took 0.188183 seconds at Sat Jul 27 16:08:26 2024
     16x16x16x32	N4quda15CopyColorSpinorILi4ELi3ENS_11colorspinor11FloatNOrderIdLi4ELi3ELi2ELb0ELb0EEENS1_21SpaceSpinorColorOrderIdLi4ELi3EEESt5tupleIJRNS_16ColorSpinorFieldERKS7_19QudaFieldLocation_sPdPKdEEEE	GPU-offline,vol=131072,parity=2,precision=8,order=9,Ns=4,Nc=3vol=131072,parity=2,precision=8,order=2,Ns=4,Nc=3,NonRelBasis	768	1	1	86	2	1	0	-1	-1	-1	-1	9.73091e-05	# 0.00 Gflop/s, 517.23 GB/s, tuning took 0.110575 seconds at Sat Jul 27 16:08:30 2024
     16x16x16x32	N4quda15CopyColorSpinorILi4ELi3ENS_11colorspinor21SpaceSpinorColorOrderIdLi4ELi3EEENS1_11FloatNOrderIdLi4ELi3ELi2ELb0ELb0EEESt5tupleIJRNS_16ColorSpinorFieldERKS7_19QudaFieldLocation_sPdPKdEEEE	GPU-offline,vol=131072,parity=2,precision=8,order=2,Ns=4,Nc=3vol=131072,parity=2,precision=8,order=9,Ns=4,Nc=3,RelBasis	384	2	1	171	1	1	0	-1	-1	-1	-1	9.73266e-05	# 0.00 Gflop/s, 517.14 GB/s, tuning took 0.101945 seconds at Sat Jul 27 16:08:32 2024
     16x16x16x32	N4quda6WilsonINS_9WilsonArgIdLi3ELi4EL21QudaReconstructType_s12EEEEE	policy,commDim=0000,xpay,parity=2,topo=1111,p2p=0,gdr=0,nvshmem=0,pol=110000111100110000	32	1	1	1	1	1	0	0	0	0	-1	0.000315056	# 569.13 Gflop/s, 958.53 GB/s, tuning took 0.032318 seconds at Sat Jul 27 16:08:31 2024
     16x16x16x32	N4quda6WilsonINS_9WilsonArgIdLi3ELi4EL21QudaReconstructType_s12EEEEE	policy_kernel=interior,comm=0000,commDim=0000,xpay,parity=2	32	1	2	2048	1	1	24577	-1	-1	-1	-1	0.000315544	# 568.25 Gflop/s, 957.05 GB/s, tuning took 1.315493 seconds at Sat Jul 27 16:08:31 2024
     16x16x16x32	N4quda7RNGInitE	GPU-offline,vol=131072stride=69632precision=8geometry=4Nc=3	256	2	1	256	1	1	0	-1	-1	-1	-1	0.00447178	# 0.00 Gflop/s, 0.00 GB/s, tuning took 0.864054 seconds at Sat Jul 27 16:08:27 2024
     16x16x16x32	N4quda9CopyGaugeINS_12CopyGaugeArgIddLi18ELb0ENS_5gauge11FloatNOrderIdLi18ELi2ELi12EL20QudaStaggeredPhase_s0ELb1EL19QudaGhostExchange_sn2147483648ELb0EEENS2_8QDPOrderIdLi18EEEEEEE	GPU-offline,vol=131072stride=65536precision=8geometry=4Nc=3,vol=131072stride=69632precision=8geometry=4Nc=3	32	1	1	2048	1	8	4469	-1	-1	-1	-1	0.000233363	# 0.00 Gflop/s, 552.68 GB/s, tuning took 0.636502 seconds at Sat Jul 27 16:08:26 2024
     16x16x16x32	N4quda9CopyGaugeINS_12CopyGaugeArgIddLi18ELb0ENS_5gauge11FloatNOrderIdLi18ELi2ELi12EL20QudaStaggeredPhase_s0ELb1EL19QudaGhostExchange_sn2147483648ELb0EEES6_EEEE	GPU-offline,vol=131072stride=69632precision=8geometry=4Nc=3,vol=131072stride=69632precision=8geometry=4Nc=3,ghost	608	1	1	7	1	8	24577	-1	-1	-1	-1	1.08583e-05	# 0.00 Gflop/s, 538.68 GB/s, tuning took 0.200334 seconds at Sat Jul 27 16:08:26 2024
     16x16x16x32	N4quda9CopyGaugeINS_12CopyGaugeArgIddLi18ELb0ENS_5gauge8QDPOrderIdLi18EEENS2_11FloatNOrderIdLi18ELi2ELi12EL20QudaStaggeredPhase_s0ELb1EL19QudaGhostExchange_sn2147483648ELb0EEEEEEE	GPU-offline,vol=131072stride=69632precision=8geometry=4Nc=3,vol=131072stride=65536precision=8geometry=4Nc=3	96	1	1	683	1	8	2587	-1	-1	-1	-1	0.000243533	# 0.00 Gflop/s, 529.60 GB/s, tuning took 0.651306 seconds at Sat Jul 27 16:08:29 2024
     32x32x32x32	N4quda10GaugeGaussIdLi3EL21QudaReconstructType_s12EEE	GPU-offline,vol=1048576stride=540672precision=8geometry=4Nc=3,lie_group	384	1	1	1366	2	1	9831	-1	-1	-1	-1	0.00428255	# 0.00 Gflop/s, 96.96 GB/s, tuning took 4.293744 seconds at Sat Jul 27 16:11:38 2024
     32x32x32x32	N4quda12ExtractGhostIdLi3ENS_5gauge11FloatNOrderIdLi18ELi2ELi12EL20QudaStaggeredPhase_s0ELb1EL19QudaGhostExchange_sn2147483648ELb0EEEEE	GPU-offline,vol=1048576stride=540672precision=8geometry=4Nc=3,extract	64	1	2	512	1	4	24577	-1	-1	-1	-1	6.16339e-05	# 0.00 Gflop/s, 408.31 GB/s, tuning took 0.282994 seconds at Sat Jul 27 16:11:27 2024
     32x32x32x32	N4quda15CopyColorSpinorILi4ELi3ENS_11colorspinor11FloatNOrderIdLi4ELi3ELi2ELb0ELb0EEENS1_21SpaceSpinorColorOrderIdLi4ELi3EEESt5tupleIJRNS_16ColorSpinorFieldERKS7_19QudaFieldLocation_sPdPKdEEEE	GPU-offline,vol=1048576,parity=2,precision=8,order=9,Ns=4,Nc=3vol=1048576,parity=2,precision=8,order=2,Ns=4,Nc=3,NonRelBasis	480	1	1	1093	2	1	0	-1	-1	-1	-1	0.000751264	# 0.00 Gflop/s, 535.97 GB/s, tuning took 0.207499 seconds at Sat Jul 27 16:11:55 2024
     32x32x32x32	N4quda15CopyColorSpinorILi4ELi3ENS_11colorspinor21SpaceSpinorColorOrderIdLi4ELi3EEENS1_11FloatNOrderIdLi4ELi3ELi2ELb0ELb0EEESt5tupleIJRNS_16ColorSpinorFieldERKS7_19QudaFieldLocation_sPdPKdEEEE	GPU-offline,vol=1048576,parity=2,precision=8,order=2,Ns=4,Nc=3vol=1048576,parity=2,precision=8,order=9,Ns=4,Nc=3,RelBasis	640	1	1	820	2	1	0	-1	-1	-1	-1	0.000758144	# 0.00 Gflop/s, 531.10 GB/s, tuning took 0.209128 seconds at Sat Jul 27 16:13:30 2024
     32x32x32x32	N4quda4PackIdLi3ELb1EEE	policy_kernel,vol=1048576,parity=2,precision=8,order=2,Ns=4,Nc=3,comm=0001,topo=1112,nFace=1,device-device	544	1	1	110	1	2	0	-1	-1	-1	-1	2.93893e-05	# 26.76 Gflop/s, 642.22 GB/s, tuning took 2.050337 seconds at Sat Jul 27 16:11:57 2024
     32x32x32x32	N4quda4PackIdLi3ELb1EEE	policy_kernel,vol=1048576,parity=2,precision=8,order=2,Ns=4,Nc=3,comm=0001,topo=1112,nFace=1,host-host	256	1	1	1	1	2	0	-1	-1	-1	-1	0.00191781	# 0.41 Gflop/s, 9.84 GB/s, tuning took 0.823578 seconds at Sat Jul 27 16:12:07 2024
     32x32x32x32	N4quda6WilsonINS_9WilsonArgIdLi3ELi4EL21QudaReconstructType_s12EEEEE	policy,commDim=0001,xpay,parity=2,topo=1112,p2p=0,gdr=0,nvshmem=0,pol=110000111100110000	32	1	1	1	1	1	0	1	0	0	-1	0.00468065	# 306.46 Gflop/s, 516.15 GB/s, tuning took 0.526329 seconds at Sat Jul 27 16:13:29 2024
     32x32x32x32	N4quda6WilsonINS_9WilsonArgIdLi3ELi4EL21QudaReconstructType_s12EEEEE	policy_kernel=exterior_all,commDim=0001,xpay,parity=2	32	1	1	1024	1	2	7022	-1	-1	-1	-1	7.7488e-05	# 172.53 Gflop/s, 487.16 GB/s, tuning took 0.459715 seconds at Sat Jul 27 16:12:06 2024
     32x32x32x32	N4quda6WilsonINS_9WilsonArgIdLi3ELi4EL21QudaReconstructType_s12EEEEE	policy_kernel=exterior_all,commDim=0001,xpay,parity=2,zero_copy,p2p=0	16	1	1	2048	1	2	16385	-1	-1	-1	-1	0.00197343	# 6.77 Gflop/s, 19.13 GB/s, tuning took 4.816477 seconds at Sat Jul 27 16:12:18 2024
     32x32x32x32	N4quda6WilsonINS_9WilsonArgIdLi3ELi4EL21QudaReconstructType_s12EEEEE	policy_kernel=exterior_t,commDim=0001,xpay,parity=2	256	1	1	128	1	2	0	-1	-1	-1	-1	7.78263e-05	# 171.78 Gflop/s, 485.04 GB/s, tuning took 0.463559 seconds at Sat Jul 27 16:12:05 2024
     32x32x32x32	N4quda6WilsonINS_9WilsonArgIdLi3ELi4EL21QudaReconstructType_s12EEEEE	policy_kernel=exterior_t,commDim=0001,xpay,parity=2,zero_copy,p2p=0	16	1	1	2048	1	2	16385	-1	-1	-1	-1	0.00197277	# 6.78 Gflop/s, 19.13 GB/s, tuning took 5.006695 seconds at Sat Jul 27 16:12:12 2024
     32x32x32x32	N4quda6WilsonINS_9WilsonArgIdLi3ELi4EL21QudaReconstructType_s12EEEEE	policy_kernel=interior,comm=0001,commDim=0001,xpay,parity=2	32	1	2	16384	1	1	24577	-1	-1	-1	-1	0.00261295	# 545.07 Gflop/s, 910.15 GB/s, tuning took 8.198492 seconds at Sat Jul 27 16:12:05 2024
     32x32x32x32	N4quda6WilsonINS_9WilsonArgIdLi3ELi4EL21QudaReconstructType_s12EEEEE	policy_kernel=interior,comm=0001,commDim=0001,xpay,parity=2,host-host	16	1	1	32768	1	2	7022	2	-1	-1	-1	0.00321236	# 443.60 Gflop/s, 746.19 GB/s, tuning took 70.708948 seconds at Sat Jul 27 16:13:28 2024
     32x32x32x32	N4quda7RNGInitE	GPU-offline,vol=1048576stride=540672precision=8geometry=4Nc=3	224	2	1	2341	1	1	0	-1	-1	-1	-1	0.0350974	# 0.00 Gflop/s, 0.00 GB/s, tuning took 5.958841 seconds at Sat Jul 27 16:11:33 2024
     32x32x32x32	N4quda9CopyGaugeINS_12CopyGaugeArgIddLi18ELb0ENS_5gauge11FloatNOrderIdLi18ELi2ELi12EL20QudaStaggeredPhase_s0ELb1EL19QudaGhostExchange_sn2147483648ELb0EEENS2_8QDPOrderIdLi18EEEEEEE	GPU-offline,vol=1048576stride=524288precision=8geometry=4Nc=3,vol=1048576stride=540672precision=8geometry=4Nc=3	32	1	1	16384	1	8	3511	-1	-1	-1	-1	0.0018499	# 0.00 Gflop/s, 550.96 GB/s, tuning took 3.835328 seconds at Sat Jul 27 16:11:27 2024
     32x32x32x32	N4quda9CopyGaugeINS_12CopyGaugeArgIddLi18ELb0ENS_5gauge11FloatNOrderIdLi18ELi2ELi12EL20QudaStaggeredPhase_s0ELb1EL19QudaGhostExchange_sn2147483648ELb0EEES6_EEEE	GPU-offline,vol=1048576stride=540672precision=8geometry=4Nc=3,vol=1048576stride=540672precision=8geometry=4Nc=3,ghost	32	1	1	512	1	8	2138	-1	-1	-1	-1	5.14368e-05	# 0.00 Gflop/s, 504.55 GB/s, tuning took 0.245488 seconds at Sat Jul 27 16:11:27 2024
     32x32x32x32	N4quda9CopyGaugeINS_12CopyGaugeArgIddLi18ELb0ENS_5gauge8QDPOrderIdLi18EEENS2_11FloatNOrderIdLi18ELi2ELi12EL20QudaStaggeredPhase_s0ELb1EL19QudaGhostExchange_sn2147483648ELb0EEEEEEE	GPU-offline,vol=1048576stride=540672precision=8geometry=4Nc=3,vol=1048576stride=524288precision=8geometry=4Nc=3	32	1	3	16384	1	3	24577	-1	-1	-1	-1	0.00190879	# 0.00 Gflop/s, 533.96 GB/s, tuning took 3.966671 seconds at Sat Jul 27 16:11:42 2024
     32x32x32x32	N4quda9CopyGaugeINS_12CopyGaugeArgIfdLi18ELb0ENS_5gauge11FloatNOrderIfLi18ELi4ELi12EL20QudaStaggeredPhase_s0ELb1EL19QudaGhostExchange_sn2147483648ELb0EEENS3_IdLi18ELi2ELi12ELS4_0ELb1ELS5_n2147483648ELb0EEEEEEE	GPU-offline,vol=1048576stride=540672precision=8geometry=4Nc=3,vol=1048576stride=540672precision=4geometry=4Nc=3	32	1	8	16384	1	1	24577	-1	-1	-1	-1	0.00108983	# 0.00 Gflop/s, 571.51 GB/s, tuning took 2.569194 seconds at Sun Jul 28 02:35:15 2024
     32x32x32x32	N4quda9CopyGaugeINS_12CopyGaugeArgIfdLi18ELb0ENS_5gauge11FloatNOrderIfLi18ELi4ELi12EL20QudaStaggeredPhase_s0ELb1EL19QudaGhostExchange_sn2147483648ELb0EEENS3_IdLi18ELi2ELi12ELS4_0ELb1ELS5_n2147483648ELb0EEEEEEE	GPU-offline,vol=1048576stride=540672precision=8geometry=4Nc=3,vol=1048576stride=540672precision=4geometry=4Nc=3,ghost	32	1	1	512	1	8	1756	-1	-1	-1	-1	3.90622e-05	# 0.00 Gflop/s, 498.29 GB/s, tuning took 0.289280 seconds at Sun Jul 28 02:35:16 2024
     32x32x32x32	N4quda9CopyGaugeINS_12CopyGaugeArgIsdLi18ELb0ENS_5gauge11FloatNOrderIsLi18ELi4ELi12EL20QudaStaggeredPhase_s0ELb1EL19QudaGhostExchange_sn2147483648ELb0EEENS3_IdLi18ELi2ELi12ELS4_0ELb1ELS5_n2147483648ELb0EEEEEEE	GPU-offline,vol=1048576stride=540672precision=8geometry=4Nc=3,vol=1048576stride=540672precision=2geometry=4Nc=3	32	1	1	16384	1	8	2731	-1	-1	-1	-1	0.000915595	# 0.00 Gflop/s, 566.89 GB/s, tuning took 2.342750 seconds at Sun Jul 28 02:35:12 2024
     32x32x32x32	N4quda9CopyGaugeINS_12CopyGaugeArgIsdLi18ELb0ENS_5gauge11FloatNOrderIsLi18ELi4ELi12EL20QudaStaggeredPhase_s0ELb1EL19QudaGhostExchange_sn2147483648ELb0EEENS3_IdLi18ELi2ELi12ELS4_0ELb1ELS5_n2147483648ELb0EEEEEEE	GPU-offline,vol=1048576stride=540672precision=8geometry=4Nc=3,vol=1048576stride=540672precision=2geometry=4Nc=3,ghost	32	1	7	512	1	2	12289	-1	-1	-1	-1	3.42688e-05	# 0.00 Gflop/s, 473.32 GB/s, tuning took 0.256178 seconds at Sun Jul 28 02:35:13 2024
  bytes=12582912	cudaMemset	allocateGhostBuffer,lattice_field.cpp,288	32	1	1	1	1	1	0	-1	-1	-1	-1	2.8072e-05	# 0.00 Gflop/s, 448.24 GB/s, tuning took 0.005457 seconds at Sat Jul 27 16:11:27 2024
  bytes=12582912	cudaMemset	allocateGhostBuffer,lattice_field.cpp,293	32	1	1	1	1	1	0	-1	-1	-1	-1	2.81964e-05	# 0.00 Gflop/s, 446.26 GB/s, tuning took 0.010146 seconds at Sat Jul 27 16:11:27 2024
 bytes=150994944	cudaMemcpyDefault	copy,cuda_gauge_field.cpp,576	32	1	1	1	1	1	0	-1	-1	-1	-1	0.0005816	# 0.00 Gflop/s, 259.62 GB/s, tuning took 0.035620 seconds at Sat Jul 27 16:11:23 2024
 bytes=150994944	cudaMemcpyDefault	saveCPUField,cuda_gauge_field.cpp,658	32	1	1	1	1	1	0	-1	-1	-1	-1	0.000584523	# 0.00 Gflop/s, 258.32 GB/s, tuning took 0.007141 seconds at Sat Jul 27 16:11:42 2024
   bytes=1572864	cudaMemset	allocateGhostBuffer,lattice_field.cpp,288	32	1	1	1	1	1	0	-1	-1	-1	-1	7.25211e-06	# 0.00 Gflop/s, 216.88 GB/s, tuning took 0.002193 seconds at Sat Jul 27 16:05:02 2024
   bytes=1572864	cudaMemset	allocateGhostBuffer,lattice_field.cpp,293	32	1	1	1	1	1	0	-1	-1	-1	-1	7.3246e-06	# 0.00 Gflop/s, 214.74 GB/s, tuning took 0.001909 seconds at Sat Jul 27 16:05:02 2024
  bytes=18874368	cudaMemcpyDefault	copy,cuda_gauge_field.cpp,576	32	1	1	1	1	1	0	-1	-1	-1	-1	8.03052e-05	# 0.00 Gflop/s, 235.03 GB/s, tuning took 0.006571 seconds at Sat Jul 27 16:08:25 2024
  bytes=18874368	cudaMemcpyDefault	saveCPUField,cuda_gauge_field.cpp,658	32	1	1	1	1	1	0	-1	-1	-1	-1	7.95249e-05	# 0.00 Gflop/s, 237.34 GB/s, tuning took 0.003495 seconds at Sat Jul 27 16:08:29 2024
   bytes=2752512	cudaMemset	allocateGhostBuffer,lattice_field.cpp,288	32	1	1	1	1	1	0	-1	-1	-1	-1	8.52767e-06	# 0.00 Gflop/s, 322.77 GB/s, tuning took 0.002369 seconds at Sat Jul 27 16:08:26 2024
   bytes=2752512	cudaMemset	allocateGhostBuffer,lattice_field.cpp,293	32	1	1	1	1	1	0	-1	-1	-1	-1	8.83436e-06	# 0.00 Gflop/s, 311.57 GB/s, tuning took 0.002242 seconds at Sat Jul 27 16:08:26 2024
   bytes=3145728	cudaMemcpyDeviceToDevice	exchangeGhost,cuda_gauge_field.cpp,193	32	1	1	1	1	1	0	-1	-1	-1	-1	1.66257e-05	# 0.00 Gflop/s, 378.42 GB/s, tuning took 0.001916 seconds at Sat Jul 27 16:11:27 2024
    bytes=393216	cudaMemcpyDeviceToDevice	exchangeGhost,cuda_gauge_field.cpp,193	32	1	1	1	1	1	0	-1	-1	-1	-1	6.00849e-06	# 0.00 Gflop/s, 130.89 GB/s, tuning took 0.001653 seconds at Sat Jul 27 16:05:02 2024
    bytes=786432	cudaMemcpyDeviceToDevice	exchangeGhost,cuda_gauge_field.cpp,193	32	1	1	1	1	1	0	-1	-1	-1	-1	5.8415e-06	# 0.00 Gflop/s, 269.26 GB/s, tuning took 0.001588 seconds at Sat Jul 27 16:08:26 2024
   bytes=9437184	cudaMemcpyDefault	copy,cuda_gauge_field.cpp,576	32	1	1	1	1	1	0	-1	-1	-1	-1	4.23025e-05	# 0.00 Gflop/s, 223.09 GB/s, tuning took 0.003723 seconds at Sat Jul 27 16:05:01 2024
   bytes=9437184	cudaMemcpyDefault	saveCPUField,cuda_gauge_field.cpp,658	32	1	1	1	1	1	0	-1	-1	-1	-1	4.23193e-05	# 0.00 Gflop/s, 223.00 GB/s, tuning took 0.002254 seconds at Sat Jul 27 16:05:03 2024
